{"event": "run", "id": "E009", "path": "postflop_cuda", "hypothesis": "Dense reach-owner storage reduces postflop VRAM without changing any reach calculation", "status": "candidate", "utc": "2026-09-07T01:50:21+00:00", "commit": "4fe013617fc43a951f18977dffe4633bc59070c4", "seconds": 50.281, "diagnostic_peak_process_mb": 4150.739, "returncode": 0, "command": ["cargo", "test", "--release", "-p", "solver", "--features", "gpu", "--test", "postflop_perf", "--test", "postflop_capacity_perf", "--", "--ignored", "--nocapture", "--test-threads=1"], "env": [], "metrics": {"postflop.Ks7h2d.iso.allocated_vram_mb": 6274.678784, "postflop.Ks7h2d.iso.estimated_vram_mb": 6716.6347, "postflop.Ks7h2d.iso.init_ms": 1440.1109000000001, "postflop.Ks7h2d.iso.plan_build_ms": 99.9789, "postflop.Ks7h2d.iso.staging_memory_mb": 3415.119456, "postflop.Ks7s2d.iso.allocated_vram_mb": 5637.144576, "postflop.Ks7s2d.iso.estimated_vram_mb": 6737.546704, "postflop.Ks7s2d.iso.init_ms": 642.9473, "postflop.Ks7s2d.iso.plan_build_ms": 87.69399999999999, "postflop.Ks7s2d.iso.staging_memory_mb": 2759.814928, "postflop.Ks7s2d.full.allocated_vram_mb": 6308.233216, "postflop.Ks7s2d.full.estimated_vram_mb": 6737.546704, "postflop.Ks7s2d.full.init_ms": 657.4692, "postflop.Ks7s2d.full.plan_build_ms": 147.3625, "postflop.Ks7s2d.full.staging_memory_mb": 3426.408856, "postflop.Ks7h2d.init_ms": 1216.602, "postflop.Ks7h2d.iteration_ms": 63.968, "postflop.Ks7h2d.check_ms": 45.384, "postflop.Ks7s2d.init_ms": 764.46, "postflop.Ks7s2d.iteration_ms": 37.658, "postflop.Ks7s2d.check_ms": 34.214, "postflop.Ks7h2dQhTc.init_ms": 73.845, "postflop.Ks7h2dQhTc.iteration_ms": 0.365, "postflop.Ks7h2dQhTc.check_ms": 0.881}, "checks": [{"board": "Ks7h2d", "nodes": 1346813, "use_isomorphism": true}, {"board": "Ks7s2d", "nodes": 1346813, "use_isomorphism": true}, {"board": "Ks7s2d", "nodes": 1346813, "use_isomorphism": false}, {"postflop": "POSTFLOP board=Ks7h2d rake=0 nodes=1346813 init_ms=1216.602 iteration_ms=63.968 check_ms=45.384 exploit_chips=1.692254035"}, {"postflop": "POSTFLOP board=Ks7s2d rake=0.05 nodes=1346813 init_ms=764.460 iteration_ms=37.658 check_ms=34.214 exploit_chips=1.336350349"}, {"postflop": "POSTFLOP board=Ks7h2dQhTc rake=0.05 nodes=33 init_ms=73.845 iteration_ms=0.365 check_ms=0.881 exploit_chips=0.140634091"}], "score_patterns": ["postflop.*"]}
{"event": "run", "id": "E009R", "path": "postflop_cuda", "hypothesis": "Repeat compact postflop reaches and verify time to unchanged 0.3-percent target", "status": "candidate", "utc": "2026-09-07T01:51:51+00:00", "commit": "4fe013617fc43a951f18977dffe4633bc59070c4", "seconds": 61.187, "diagnostic_peak_process_mb": 4715.909, "returncode": 0, "command": ["cargo", "test", "--release", "-p", "solver", "--features", "gpu", "--lib", "--test", "gpu", "--test", "postflop_perf", "--", "--test-threads=1", "--nocapture", "--include-ignored"], "env": ["POSTFLOP_PERF_CONVERGENCE=1"], "metrics": {"postflop.Ks7h2d.target_seconds": 12.267, "postflop.Ks7s2d.target_seconds": 7.325, "postflop.Ks7h2dQhTc.target_seconds": 0.024}, "checks": [{"convergence": "POSTFLOP_TARGET board=Ks7h2d iteration=200 seconds=12.267 pct=0.276830440"}, {"convergence": "POSTFLOP_TARGET board=Ks7s2d iteration=200 seconds=7.325 pct=0.253765886"}, {"convergence": "POSTFLOP_TARGET board=Ks7h2dQhTc iteration=60 seconds=0.024 pct=0.269896985"}], "score_patterns": ["postflop.*"]}
{"event": "run", "id": "B008", "path": "baseline", "hypothesis": "Paired original reach-storage control after E009 to distinguish timing drift from indirection cost", "status": "baseline", "utc": "2026-09-07T01:52:59+00:00", "commit": "b6131a59d8a8561693f8545de49b45fe26723341", "seconds": 42.875, "diagnostic_peak_process_mb": 4278.514, "returncode": 0, "command": ["cargo", "test", "--release", "-p", "solver", "--features", "gpu", "--test", "postflop_perf", "--", "--ignored", "--nocapture", "--test-threads=1"], "env": [], "metrics": {"postflop.Ks7h2d.init_ms": 1029.168, "postflop.Ks7h2d.iteration_ms": 58.918, "postflop.Ks7h2d.check_ms": 41.145, "postflop.Ks7s2d.init_ms": 776.34, "postflop.Ks7s2d.iteration_ms": 34.811, "postflop.Ks7s2d.check_ms": 31.529, "postflop.Ks7h2dQhTc.init_ms": 68.551, "postflop.Ks7h2dQhTc.iteration_ms": 0.338, "postflop.Ks7h2dQhTc.check_ms": 0.594}, "checks": [{"postflop": "POSTFLOP board=Ks7h2d rake=0 nodes=1346813 init_ms=1029.168 iteration_ms=58.918 check_ms=41.145 exploit_chips=1.681661834"}, {"postflop": "POSTFLOP board=Ks7s2d rake=0.05 nodes=1346813 init_ms=776.340 iteration_ms=34.811 check_ms=31.529 exploit_chips=1.309596481"}, {"postflop": "POSTFLOP board=Ks7h2dQhTc rake=0.05 nodes=33 init_ms=68.551 iteration_ms=0.338 check_ms=0.594 exploit_chips=0.140634194"}], "score_patterns": []}
{"event": "run", "id": "E009R2", "path": "postflop_cuda", "hypothesis": "Paired warm repeat of compact reach storage after original-layout control", "status": "candidate", "utc": "2026-09-07T01:54:09+00:00", "commit": "4763e3ea36f56f1bddb30e7e02a671095542614e", "seconds": 47.172, "diagnostic_peak_process_mb": 4715.045, "returncode": 0, "command": ["cargo", "test", "--release", "-p", "solver", "--features", "gpu", "--test", "postflop_perf", "--test", "postflop_capacity_perf", "--", "--ignored", "--nocapture", "--test-threads=1"], "env": [], "metrics": {"postflop.Ks7h2d.iso.allocated_vram_mb": 6274.678784, "postflop.Ks7h2d.iso.estimated_vram_mb": 6716.6347, "postflop.Ks7h2d.iso.init_ms": 871.3498, "postflop.Ks7h2d.iso.plan_build_ms": 99.2814, "postflop.Ks7h2d.iso.staging_memory_mb": 3415.119456, "postflop.Ks7s2d.iso.allocated_vram_mb": 5637.144576, "postflop.Ks7s2d.iso.estimated_vram_mb": 6737.546704, "postflop.Ks7s2d.iso.init_ms": 623.3035, "postflop.Ks7s2d.iso.plan_build_ms": 133.5797, "postflop.Ks7s2d.iso.staging_memory_mb": 2759.814928, "postflop.Ks7s2d.full.allocated_vram_mb": 6308.233216, "postflop.Ks7s2d.full.estimated_vram_mb": 6737.546704, "postflop.Ks7s2d.full.init_ms": 592.9345000000001, "postflop.Ks7s2d.full.plan_build_ms": 93.0251, "postflop.Ks7s2d.full.staging_memory_mb": 3426.408856, "postflop.Ks7h2d.init_ms": 1103.302, "postflop.Ks7h2d.iteration_ms": 59.09, "postflop.Ks7h2d.check_ms": 40.829, "postflop.Ks7s2d.init_ms": 704.889, "postflop.Ks7s2d.iteration_ms": 34.924, "postflop.Ks7s2d.check_ms": 31.529, "postflop.Ks7h2dQhTc.init_ms": 88.041, "postflop.Ks7h2dQhTc.iteration_ms": 0.344, "postflop.Ks7h2dQhTc.check_ms": 0.77}, "checks": [{"board": "Ks7h2d", "nodes": 1346813, "use_isomorphism": true}, {"board": "Ks7s2d", "nodes": 1346813, "use_isomorphism": true}, {"board": "Ks7s2d", "nodes": 1346813, "use_isomorphism": false}, {"postflop": "POSTFLOP board=Ks7h2d rake=0 nodes=1346813 init_ms=1103.302 iteration_ms=59.090 check_ms=40.829 exploit_chips=1.676634212"}, {"postflop": "POSTFLOP board=Ks7s2d rake=0.05 nodes=1346813 init_ms=704.889 iteration_ms=34.924 check_ms=31.529 exploit_chips=1.314914786"}, {"postflop": "POSTFLOP board=Ks7h2dQhTc rake=0.05 nodes=33 init_ms=88.041 iteration_ms=0.344 check_ms=0.770 exploit_chips=0.140634150"}], "score_patterns": ["postflop.*"]}
{"event": "promote", "files": ["crates/solver/src/game.rs", "crates/solver/src/gpu/plan.rs", "crates/solver/src/gpu/mod.rs", "crates/solver/src/gpu/kernels.cu"], "commit": "4763e3ea36f56f1bddb30e7e02a671095542614e", "utc": "2026-09-07T01:54:27+00:00"}
{"event": "decision", "id": "E009", "status": "keep", "reason": "Repeated VRAM savings of 18 percent rainbow and 27 percent two-tone; paired flop iteration times and time to 0.3 percent accuracy unchanged within noise; 28 unit and 6 GPU tests pass. Tiny river checks and initialization are noisy. First timing drift retained in ledger.", "utc": "2026-09-07T01:55:13+00:00"}
{"event": "decision", "id": "E009R", "status": "keep", "reason": "Repeated VRAM savings of 18 percent rainbow and 27 percent two-tone; paired flop iteration times and time to 0.3 percent accuracy unchanged within noise; 28 unit and 6 GPU tests pass. Tiny river checks and initialization are noisy. First timing drift retained in ledger.", "utc": "2026-09-07T01:55:13+00:00"}
{"event": "decision", "id": "E009R2", "status": "keep", "reason": "Repeated VRAM savings of 18 percent rainbow and 27 percent two-tone; paired flop iteration times and time to 0.3 percent accuracy unchanged within noise; 28 unit and 6 GPU tests pass. Tiny river checks and initialization are noisy. First timing drift retained in ledger.", "utc": "2026-09-07T01:55:13+00:00"}
{"event": "run", "id": "E010", "path": "preflop_cuda", "hypothesis": "Reduce each shared reach mass once per down sweep instead of at every terminal for every opponent", "status": "candidate", "utc": "2026-09-07T01:56:01+00:00", "commit": "f3e9aba7a6556edd495538342ec0f98583223631", "seconds": 40.25, "diagnostic_peak_process_mb": 2226.282, "returncode": 0, "command": ["cargo", "test", "--release", "-p", "solver", "--features", "gpu", "--test", "preflop_perf", "--", "--ignored", "--nocapture", "--test-threads=1"], "env": [], "metrics": {"preflop.2.iteration_ms": 0.095, "preflop.2.check_ms": 0.295, "preflop.2.sync_ms": 0.039, "preflop.6.iteration_ms": 19.145, "preflop.6.check_ms": 24.308, "preflop.6.sync_ms": 25.43, "preflop.8.iteration_ms": 78.157, "preflop.8.check_ms": 93.947, "preflop.8.sync_ms": 70.391}, "checks": [{"preflop": "PERF seats=2 nodes=40 iteration_ms=0.095 check_ms=0.295 sync_ms=0.039 arena_hash=6d4781fae03e3474 gaps=[0.05088935968248226, 0.013161917444424076] evs=[-0.15795953824550446, -0.4142353804778675]"}, {"preflop": "PERF seats=6 nodes=166090 iteration_ms=19.145 check_ms=24.308 sync_ms=25.430 arena_hash=b70284af63586e3f gaps=[0.10415872559930028, 0.03471900474586882, 0.05645132130650671, 0.04355598961220011, 0.02566278444731196, 0.025583227687036025] evs=[0.08985395657613165, 0.11143259696531381, 0.13262513589238922, 0.15984876666632344, -0.3195691149045554, -0.4656351703726333]"}, {"preflop": "PERF seats=8 nodes=434350 iteration_ms=78.157 check_ms=93.947 sync_ms=70.391 arena_hash=e01dd7a18632644d gaps=[0.022654395639749164, 0.010278385995560232, 0.008437781286659882, 0.011345792287176693, 0.011192070283014638, 0.012086956929344556, 0.01380422891560007, 0.011174031925715422] evs=[0.04857087063871364, 0.05480589083850633, 0.06796224413352651, 0.07993621403632675, 0.0996648260883227, 0.13493690699672048, -0.39486055394849295, -0.5856126067014387]"}], "score_patterns": ["preflop.*"]}
{"event": "run", "id": "E010R", "path": "preflop_cuda", "hypothesis": "Repeat cached reach masses with full preflop GPU and graph-stop equivalence coverage", "status": "candidate", "utc": "2026-09-07T01:57:10+00:00", "commit": "f3e9aba7a6556edd495538342ec0f98583223631", "seconds": 42.922, "diagnostic_peak_process_mb": 2208.178, "returncode": 0, "command": ["cargo", "test", "--release", "-p", "solver", "--features", "gpu", "--lib", "--test", "preflop_gpu", "--test", "preflop_perf", "--", "--include-ignored", "--nocapture", "--test-threads=1"], "env": [], "metrics": {"preflop.2.iteration_ms": 0.096, "preflop.2.check_ms": 0.289, "preflop.2.sync_ms": 0.018, "preflop.6.iteration_ms": 19.257, "preflop.6.check_ms": 24.453, "preflop.6.sync_ms": 26.742, "preflop.8.iteration_ms": 78.01, "preflop.8.check_ms": 93.785, "preflop.8.sync_ms": 66.13}, "checks": [{"preflop": "PERF seats=2 nodes=40 iteration_ms=0.096 check_ms=0.289 sync_ms=0.018 arena_hash=6d4781fae03e3474 gaps=[0.05088935968248226, 0.013161917444424076] evs=[-0.15795953824550446, -0.4142353804778675]"}, {"preflop": "PERF seats=6 nodes=166090 iteration_ms=19.257 check_ms=24.453 sync_ms=26.742 arena_hash=b70284af63586e3f gaps=[0.10415872559930028, 0.03471900474586882, 0.05645132130650671, 0.04355598961220011, 0.02566278444731196, 0.025583227687036025] evs=[0.08985395657613165, 0.11143259696531381, 0.13262513589238922, 0.15984876666632344, -0.3195691149045554, -0.4656351703726333]"}, {"preflop": "PERF seats=8 nodes=434350 iteration_ms=78.010 check_ms=93.785 sync_ms=66.130 arena_hash=e01dd7a18632644d gaps=[0.022654395639749164, 0.010278385995560232, 0.008437781286659882, 0.011345792287176693, 0.011192070283014638, 0.012086956929344556, 0.01380422891560007, 0.011174031925715422] evs=[0.04857087063871364, 0.05480589083850633, 0.06796224413352651, 0.07993621403632675, 0.0996648260883227, 0.13493690699672048, -0.39486055394849295, -0.5856126067014387]"}], "score_patterns": ["preflop.*"]}
{"event": "decision", "id": "E010", "status": "keep", "reason": "Repeated 19.15-19.26 ms six-seat and 78.01-78.16 ms eight-seat iterations, versus 23.78 and 106.60 ms before this trial; all complete fingerprints unchanged; 28 unit and 5 preflop GPU tests pass.", "utc": "2026-09-07T01:58:15+00:00"}
{"event": "decision", "id": "E010R", "status": "keep", "reason": "Repeated 19.15-19.26 ms six-seat and 78.01-78.16 ms eight-seat iterations, versus 23.78 and 106.60 ms before this trial; all complete fingerprints unchanged; 28 unit and 5 preflop GPU tests pass.", "utc": "2026-09-07T01:58:15+00:00"}
{"event": "promote", "files": ["crates/solver/src/preflop/gpu.rs", "crates/solver/src/preflop/kernels.cu"], "commit": "f3e9aba7a6556edd495538342ec0f98583223631", "utc": "2026-09-07T01:58:22+00:00"}
{"event": "run", "id": "E011", "path": "postflop_cuda", "hypothesis": "Replace contended fold atomics with indexed card lists and CPU-order f64 sums", "status": "candidate", "utc": "2026-09-07T01:59:17+00:00", "commit": "ff045a34a8225df54a3dc3178f66c8336e195f1d", "seconds": 52.938, "diagnostic_peak_process_mb": 4185.494, "returncode": 0, "command": ["cargo", "test", "--release", "-p", "solver", "--features", "gpu", "--test", "postflop_perf", "--", "--ignored", "--nocapture", "--test-threads=1"], "env": [], "metrics": {"postflop.Ks7h2d.init_ms": 1663.934, "postflop.Ks7h2d.iteration_ms": 113.943, "postflop.Ks7h2d.check_ms": 93.23, "postflop.Ks7s2d.init_ms": 662.83, "postflop.Ks7s2d.iteration_ms": 68.083, "postflop.Ks7s2d.check_ms": 62.735, "postflop.Ks7h2dQhTc.init_ms": 72.586, "postflop.Ks7h2dQhTc.iteration_ms": 0.411, "postflop.Ks7h2dQhTc.check_ms": 0.616}, "checks": [{"postflop": "POSTFLOP board=Ks7h2d rake=0 nodes=1346813 init_ms=1663.934 iteration_ms=113.943 check_ms=93.230 exploit_chips=1.692660801"}, {"postflop": "POSTFLOP board=Ks7s2d rake=0.05 nodes=1346813 init_ms=662.830 iteration_ms=68.083 check_ms=62.735 exploit_chips=1.320537705"}, {"postflop": "POSTFLOP board=Ks7h2dQhTc rake=0.05 nodes=33 init_ms=72.586 iteration_ms=0.411 check_ms=0.616 exploit_chips=0.140634155"}], "score_patterns": ["postflop.*"]}
{"event": "decision", "id": "E011", "status": "discard", "reason": "Direct indexed global-memory fold sums are much slower: rainbow iteration 113.94 ms versus 59.09 ms; fold kernel 66.3 ms versus 6.3 ms. Next variant stages reach locally before ordered sums.", "utc": "2026-09-07T02:00:01+00:00"}
{"event": "run", "id": "E011B", "path": "postflop_cuda", "hypothesis": "Stage opponent reach in shared memory before deterministic CPU-precision fold sums", "status": "candidate", "utc": "2026-09-07T02:01:02+00:00", "commit": "fa9da02b6cbd429650975bf5ed36df1375c9a1a7", "seconds": 52.578, "diagnostic_peak_process_mb": 4085.08, "returncode": 0, "command": ["cargo", "test", "--release", "-p", "solver", "--features", "gpu", "--test", "postflop_perf", "--", "--ignored", "--nocapture", "--test-threads=1"], "env": [], "metrics": {"postflop.Ks7h2d.init_ms": 1557.562, "postflop.Ks7h2d.iteration_ms": 114.255, "postflop.Ks7h2d.check_ms": 91.642, "postflop.Ks7s2d.init_ms": 639.241, "postflop.Ks7s2d.iteration_ms": 69.008, "postflop.Ks7s2d.check_ms": 63.14, "postflop.Ks7h2dQhTc.init_ms": 77.253, "postflop.Ks7h2dQhTc.iteration_ms": 0.406, "postflop.Ks7h2dQhTc.check_ms": 0.696}, "checks": [{"postflop": "POSTFLOP board=Ks7h2d rake=0 nodes=1346813 init_ms=1557.562 iteration_ms=114.255 check_ms=91.642 exploit_chips=1.692660801"}, {"postflop": "POSTFLOP board=Ks7s2d rake=0.05 nodes=1346813 init_ms=639.241 iteration_ms=69.008 check_ms=63.140 exploit_chips=1.320537705"}, {"postflop": "POSTFLOP board=Ks7h2dQhTc rake=0.05 nodes=33 init_ms=77.253 iteration_ms=0.406 check_ms=0.696 exploit_chips=0.140634155"}], "score_patterns": ["postflop.*"]}
{"event": "decision", "id": "E011B", "status": "discard", "reason": "Shared-memory staging alone does not remove the long serial total reduction; rainbow iteration remains about 114 ms, so this variant is rejected.", "utc": "2026-09-07T02:01:38+00:00"}
{"event": "run", "id": "E011C", "path": "postflop_cuda", "hypothesis": "Parallelize fold total with a deterministic f64 reduction tree while retaining indexed card sums", "status": "candidate", "utc": "2026-09-07T02:02:31+00:00", "commit": "3f6fdb592a2fdd4834d2d4b6ac90483d1856d1a6", "seconds": 45.485, "diagnostic_peak_process_mb": 4084.679, "returncode": 0, "command": ["cargo", "test", "--release", "-p", "solver", "--features", "gpu", "--test", "postflop_perf", "--", "--ignored", "--nocapture", "--test-threads=1"], "env": [], "metrics": {"postflop.Ks7h2d.init_ms": 1526.368, "postflop.Ks7h2d.iteration_ms": 69.627, "postflop.Ks7h2d.check_ms": 47.892, "postflop.Ks7s2d.init_ms": 714.206, "postflop.Ks7s2d.iteration_ms": 41.545, "postflop.Ks7s2d.check_ms": 35.644, "postflop.Ks7h2dQhTc.init_ms": 69.742, "postflop.Ks7h2dQhTc.iteration_ms": 0.332, "postflop.Ks7h2dQhTc.check_ms": 0.689}, "checks": [{"postflop": "POSTFLOP board=Ks7h2d rake=0 nodes=1346813 init_ms=1526.368 iteration_ms=69.627 check_ms=47.892 exploit_chips=1.692664548"}, {"postflop": "POSTFLOP board=Ks7s2d rake=0.05 nodes=1346813 init_ms=714.206 iteration_ms=41.545 check_ms=35.644 exploit_chips=1.320923924"}, {"postflop": "POSTFLOP board=Ks7h2dQhTc rake=0.05 nodes=33 init_ms=69.742 iteration_ms=0.332 check_ms=0.689 exploit_chips=0.140634155"}], "score_patterns": ["postflop.*"]}
{"event": "decision", "id": "E011C", "status": "discard", "reason": "Parallel f64 reduction improves the previous candidate but remains slower than baseline: rainbow iteration 69.63 ms versus 59.09 ms. Test fixed-order f32 next, matching existing precision.", "utc": "2026-09-07T02:03:20+00:00"}
{"event": "run", "id": "E011D", "path": "postflop_cuda", "hypothesis": "Remove fold atomics with indexed fixed-order sums at the existing f32 precision", "status": "candidate", "utc": "2026-09-07T02:04:14+00:00", "commit": "e30c0f3cfe446c194dfcc1b2d8137098a62951f1", "seconds": 45.266, "diagnostic_peak_process_mb": 4638.081, "returncode": 0, "command": ["cargo", "test", "--release", "-p", "solver", "--features", "gpu", "--test", "postflop_perf", "--", "--ignored", "--nocapture", "--test-threads=1"], "env": [], "metrics": {"postflop.Ks7h2d.init_ms": 1574.626, "postflop.Ks7h2d.iteration_ms": 58.899, "postflop.Ks7h2d.check_ms": 36.224, "postflop.Ks7s2d.init_ms": 768.642, "postflop.Ks7s2d.iteration_ms": 34.254, "postflop.Ks7s2d.check_ms": 30.277, "postflop.Ks7h2dQhTc.init_ms": 80.328, "postflop.Ks7h2dQhTc.iteration_ms": 0.302, "postflop.Ks7h2dQhTc.check_ms": 0.736}, "checks": [{"postflop": "POSTFLOP board=Ks7h2d rake=0 nodes=1346813 init_ms=1574.626 iteration_ms=58.899 check_ms=36.224 exploit_chips=1.698464289"}, {"postflop": "POSTFLOP board=Ks7s2d rake=0.05 nodes=1346813 init_ms=768.642 iteration_ms=34.254 check_ms=30.277 exploit_chips=1.329163551"}, {"postflop": "POSTFLOP board=Ks7h2dQhTc rake=0.05 nodes=33 init_ms=80.328 iteration_ms=0.302 check_ms=0.736 exploit_chips=0.140634178"}], "score_patterns": ["postflop.*"]}
{"event": "run", "id": "E011DR", "path": "postflop_cuda", "hypothesis": "Verify repeatable learning and time to the same 0.3-percent exploitability with fixed-order f32 folds", "status": "candidate", "utc": "2026-09-07T02:06:29+00:00", "commit": "1ec2683d9135f38b49d3e0c120dadbb086b50230", "seconds": 74.234, "diagnostic_peak_process_mb": 4617.708, "returncode": 0, "command": ["cargo", "test", "--release", "-p", "solver", "--features", "gpu", "--lib", "--test", "gpu", "--test", "postflop_perf", "--", "--include-ignored", "--nocapture", "--test-threads=1"], "env": ["POSTFLOP_PERF_CONVERGENCE=1"], "metrics": {"postflop.Ks7h2d.target_seconds": 11.882, "postflop.Ks7s2d.target_seconds": 7.149, "postflop.Ks7h2dQhTc.target_seconds": 0.021}, "checks": [{"convergence": "POSTFLOP_TARGET board=Ks7h2d iteration=200 seconds=11.882 pct=0.275829435"}, {"convergence": "POSTFLOP_TARGET board=Ks7s2d iteration=200 seconds=7.149 pct=0.251358787"}, {"convergence": "POSTFLOP_TARGET board=Ks7h2dQhTc iteration=60 seconds=0.021 pct=0.269896845"}], "score_patterns": ["postflop.*"]}
{"event": "run", "id": "B009", "path": "baseline", "hypothesis": "Original profile raking across 512 fixed dense, sparse, zero-reach and zero-target cases", "status": "baseline", "utc": "2026-09-07T02:07:24+00:00", "commit": "4b77be8117502022b03a13ddbba41f5d795c1765", "seconds": 0.797, "diagnostic_peak_process_mb": 83.513, "returncode": 0, "command": ["python", "research/autoresearch/check_raking.py"], "env": [], "metrics": {"lifecycle.raking_ms": 5.6832}, "checks": [{"raking_hash": "aac3ae3fc5347b11", "cases": 512}], "score_patterns": []}
