{"event": "run", "id": "G003", "path": "memory_transfers", "hypothesis": "Final combined memory and evaluation checks: actual device allocation, cold and warm lifecycle, and repeated first/capture/steady evaluations.", "status": "candidate", "utc": "2026-09-07T06:41:41+00:00", "commit": "a75c327cfa20ad3338d68aa1a75398458b76ea46", "seconds": 79.016, "diagnostic_peak_process_mb": 4375.568, "returncode": 0, "command": ["cargo", "test", "--release", "-p", "solver", "--features", "gpu", "--test", "capacity_perf", "--test", "postflop_capacity_perf", "--test", "postflop_memory_perf", "--test", "postflop_full_memory_perf", "--test", "gpu_check_perf", "--", "--include-ignored", "--nocapture", "--test-threads=1"], "env": [], "metrics": {"preflop.6.allocated_vram_mb": 503.31648, "preflop.6.build_ms": 82.515, "preflop.6.cpu_arena_mb": 224.552328, "preflop.6.estimated_vram_mb": 558.527272, "preflop.6.init_ms": 151.8129, "preflop.8.allocated_vram_mb": 1308.622848, "preflop.8.build_ms": 220.894, "preflop.8.cpu_arena_mb": 587.239848, "preflop.8.estimated_vram_mb": 1357.2225680000001, "preflop.8.init_ms": 243.2158, "postflop.Ks7h2d.first_check_ms": 34.8859, "postflop.Ks7h2d.second_check_ms": 35.5047, "postflop.Ks7h2d.steady_check_ms": 34.780975, "postflop.Ks7s2d.first_check_ms": 28.037, "postflop.Ks7s2d.second_check_ms": 28.5076, "postflop.Ks7s2d.steady_check_ms": 28.0708, "postflop.Ks7h2dQhTc.first_check_ms": 0.6189, "postflop.Ks7h2dQhTc.second_check_ms": 0.6246, "postflop.Ks7h2dQhTc.steady_check_ms": 0.305775, "preflop.2.first_check_ms": 0.3327, "preflop.2.second_check_ms": 0.2743, "preflop.2.steady_check_ms": 0.11299999999999999, "preflop.6.first_check_ms": 8.960600000000001, "preflop.6.second_check_ms": 9.577300000000001, "preflop.6.steady_check_ms": 8.108525, "preflop.8.first_check_ms": 25.958, "preflop.8.second_check_ms": 26.7404, "preflop.8.steady_check_ms": 24.275925, "postflop.Ks7h2d.iso.allocated_vram_mb": 5905.580032, "postflop.Ks7h2d.iso.estimated_vram_mb": 6716.6347, "postflop.Ks7h2d.iso.init_ms": 983.6586000000001, "postflop.Ks7h2d.iso.plan_build_ms": 114.645, "postflop.Ks7h2d.iso.staging_memory_mb": 3052.063004, "postflop.Ks7s2d.iso.allocated_vram_mb": 4731.174912, "postflop.Ks7s2d.iso.estimated_vram_mb": 6737.546704, "postflop.Ks7s2d.iso.init_ms": 668.1643, "postflop.Ks7s2d.iso.plan_build_ms": 147.952, "postflop.Ks7s2d.iso.staging_memory_mb": 1862.657808, "postflop.Ks7s2d.full.allocated_vram_mb": 5939.134464, "postflop.Ks7s2d.full.estimated_vram_mb": 6737.546704, "postflop.Ks7s2d.full.init_ms": 792.9421, "postflop.Ks7s2d.full.plan_build_ms": 112.8806, "postflop.Ks7s2d.full.staging_memory_mb": 3062.214296, "postflop.memory.rainbow.cold.compressed.allocated_vram_mb": 5905.580032, "postflop.memory.rainbow.cold.compressed.host_live_mb": 2585.35424, "postflop.memory.rainbow.cold.compressed.host_private_mb": 9075.191808, "postflop.memory.rainbow.cold.compressed.init_ms": 849.6359, "postflop.memory.rainbow.cold.compressed.strategy_sync_ms": 165.93179999999998, "postflop.memory.rainbow.cold.compressed.sync_ms": 337.33459999999997, "postflop.memory.rainbow.warm.compressed.allocated_vram_mb": 5905.580032, "postflop.memory.rainbow.warm.compressed.host_live_mb": 2596.999168, "postflop.memory.rainbow.warm.compressed.host_private_mb": 9088.483328, "postflop.memory.rainbow.warm.compressed.init_ms": 812.5689, "postflop.memory.rainbow.warm.compressed.strategy_sync_ms": 167.1227, "postflop.memory.rainbow.warm.compressed.sync_ms": 338.3694, "postflop.memory.cold.f32.allocated_vram_mb": 4731.174912, "postflop.memory.cold.f32.host_live_mb": 3917.201408, "postflop.memory.cold.f32.host_private_mb": 9231.663104, "postflop.memory.cold.f32.init_ms": 764.0916, "postflop.memory.cold.f32.strategy_sync_ms": 160.8278, "postflop.memory.cold.f32.sync_ms": 315.06309999999996, "postflop.memory.warm.f32.allocated_vram_mb": 4731.174912, "postflop.memory.warm.f32.host_live_mb": 3936.37888, "postflop.memory.warm.f32.host_private_mb": 9246.818304, "postflop.memory.warm.f32.init_ms": 679.6604000000001, "postflop.memory.warm.f32.strategy_sync_ms": 157.4178, "postflop.memory.warm.f32.sync_ms": 315.5089, "postflop.memory.cold.compressed.allocated_vram_mb": 3623.878656, "postflop.memory.cold.compressed.host_live_mb": 2309.14048, "postflop.memory.cold.compressed.host_private_mb": 6511.149056, "postflop.memory.cold.compressed.init_ms": 610.103, "postflop.memory.cold.compressed.strategy_sync_ms": 125.4606, "postflop.memory.cold.compressed.sync_ms": 259.5902, "postflop.memory.warm.compressed.allocated_vram_mb": 3623.878656, "postflop.memory.warm.compressed.host_live_mb": 3770.580992, "postflop.memory.warm.compressed.host_private_mb": 8131.416064, "postflop.memory.warm.compressed.init_ms": 1099.2911000000001, "postflop.memory.warm.compressed.strategy_sync_ms": 164.6826, "postflop.memory.warm.compressed.sync_ms": 305.50939999999997}, "checks": [{"nodes": 166090, "note": "Allocated VRAM is device free-memory delta; estimate is the engine preflight formula.", "seats": 6}, {"nodes": 434350, "note": "Allocated VRAM is device free-memory delta; estimate is the engine preflight formula.", "seats": 8}, {"check_board": "Ks7h2d", "check_eval_bits": 4610328022310931180, "check_iteration": 65}, {"check_board": "Ks7s2d", "check_eval_bits": 4608664839644425536, "check_iteration": 65}, {"check_board": "Ks7h2dQhTc", "check_eval_bits": 4594234900545878240, "check_iteration": 65}, {"check_ev_bits": [13818231149285967788, 13824505857993336927], "check_gap_bits": [4587494750677495240, 4578740950612821696], "check_iteration": 65, "check_seats": 2}, {"check_ev_bits": [4591139080588829428, 4592693985497883551, 4593946344391214828, 4594927179058488125, 13822800502159894828, 13825431794291804883], "check_gap_bits": [4592169847827907240, 4585164356934551850, 4588296313823012216, 4586437900670586676, 4583054015422772960, 4583031084747833216], "check_iteration": 65, "check_seats": 6}, {"check_ev_bits": [4587160621192900714, 4588059182301650598, 4589561616460845131, 4590424431923123478, 4591846028241297974, 4594029634723087085, 13824156832147184690, 13826821985834700352], "check_gap_bits": [4582186906385158536, 4577078707904519064, 4576017671529333144, 4577694025738397696, 4577605411036232848, 4578121278065602480, 4579111217966708928, 4577595012631213824], "check_iteration": 65, "check_seats": 8}, {"board": "Ks7h2d", "nodes": 1346813, "use_isomorphism": true}, {"board": "Ks7s2d", "nodes": 1346813, "use_isomorphism": true}, {"board": "Ks7s2d", "nodes": 1346813, "use_isomorphism": false}, {"memory_checks": [{"exploit_bits": 4635293868072649448, "iteration": 5}, {"exploit_bits": 4630023946365015954, "iteration": 10}, {"exploit_bits": 4625769973037188852, "iteration": 15}], "storage": "Compressed", "warm": false}, {"memory_checks": [{"exploit_bits": 4619888790163774590, "iteration": 25}, {"exploit_bits": 4617985406012120520, "iteration": 30}, {"exploit_bits": 4616854213690844608, "iteration": 35}], "storage": "Compressed", "warm": true}, {"memory_checks": [{"exploit_bits": 4635171514568527266, "iteration": 5}, {"exploit_bits": 4628956113180057410, "iteration": 10}, {"exploit_bits": 4624490585901877567, "iteration": 15}], "storage": "F32", "warm": false}, {"memory_checks": [{"exploit_bits": 4619248813860274839, "iteration": 25}, {"exploit_bits": 4617407200860962841, "iteration": 30}, {"exploit_bits": 4616217340056387513, "iteration": 35}], "storage": "F32", "warm": true}, {"memory_checks": [{"exploit_bits": 4635171514568527266, "iteration": 5}, {"exploit_bits": 4628919606694372554, "iteration": 10}, {"exploit_bits": 4624481349270140468, "iteration": 15}], "storage": "Compressed", "warm": false}, {"memory_checks": [{"exploit_bits": 4619250289695226916, "iteration": 25}, {"exploit_bits": 4617408694201541058, "iteration": 30}, {"exploit_bits": 4616218029189393624, "iteration": 35}], "storage": "Compressed", "warm": true}], "score_patterns": []}
{"event": "run", "id": "G004", "path": "reports_profiles", "hypothesis": "Final combined server report adaptation tests and fixed 80-iteration performance workload.", "status": "candidate", "utc": "2026-09-07T06:42:54+00:00", "commit": "a75c327cfa20ad3338d68aa1a75398458b76ea46", "seconds": 48.407, "diagnostic_peak_process_mb": 4629.856, "returncode": 0, "command": ["cargo", "test", "--release", "-p", "server", "--features", "gpu", "--", "--include-ignored", "--nocapture", "--test-threads=1"], "env": [], "metrics": {"reports.adaptation_seconds": 3.63}, "checks": [{"report": "REPORT_ADAPT engine=gpu nodes=1346813 seconds=3.630 iterations=80 exploit_pct=8.768756976"}], "score_patterns": []}
{"event": "refresh_compiler_inputs", "utc": "2026-09-07T06:43:57+00:00", "files": ["crates/solver/src/gpu/kernels.cu", "crates/solver/src/gpu/mod.rs", "crates/solver/src/gpu/plan.rs", "crates/solver/src/preflop/gpu.rs", "crates/solver/src/preflop/kernels.cu"], "reason": "Content changes must invalidate Cargo even after copies preserving old mtimes"}
{"event": "run", "id": "B035", "path": "baseline", "hypothesis": "Fresh pass-start fixed-step postflop, device memory, full cold/warm transfers, and first/capture/steady checks; original source and frozen inputs.", "status": "baseline", "utc": "2026-09-07T06:46:25+00:00", "commit": "dfc1b3765810e50e0de713691e48e50bb18ea4b8", "seconds": 148.469, "diagnostic_peak_process_mb": 5353.505, "returncode": 0, "command": ["cargo", "test", "--release", "-p", "solver", "--features", "gpu", "--test", "postflop_perf", "--test", "postflop_memory_perf", "--test", "postflop_full_memory_perf", "--test", "gpu_check_perf", "--", "--include-ignored", "--nocapture", "--test-threads=1"], "env": [], "metrics": {"postflop.Ks7h2d.first_check_ms": 36.7749, "postflop.Ks7h2d.second_check_ms": 37.184799999999996, "postflop.Ks7h2d.steady_check_ms": 37.42545, "postflop.Ks7s2d.first_check_ms": 29.7091, "postflop.Ks7s2d.second_check_ms": 28.51, "postflop.Ks7s2d.steady_check_ms": 29.937325, "postflop.Ks7h2dQhTc.first_check_ms": 0.8628, "postflop.Ks7h2dQhTc.second_check_ms": 0.7505, "postflop.Ks7h2dQhTc.steady_check_ms": 0.7909250000000001, "preflop.2.first_check_ms": 0.3525, "preflop.2.second_check_ms": 0.3687, "preflop.2.steady_check_ms": 0.370525, "preflop.6.first_check_ms": 13.9405, "preflop.6.second_check_ms": 13.9294, "preflop.6.steady_check_ms": 14.62225, "preflop.8.first_check_ms": 43.8741, "preflop.8.second_check_ms": 44.1018, "preflop.8.steady_check_ms": 43.93, "postflop.memory.rainbow.cold.compressed.allocated_vram_mb": 6241.124352, "postflop.memory.rainbow.cold.compressed.host_live_mb": 5302.112256, "postflop.memory.rainbow.cold.compressed.host_private_mb": 11909.353472, "postflop.memory.rainbow.cold.compressed.init_ms": 1630.134, "postflop.memory.rainbow.cold.compressed.strategy_sync_ms": 833.943, "postflop.memory.rainbow.cold.compressed.sync_ms": 1606.9308, "postflop.memory.rainbow.warm.compressed.allocated_vram_mb": 6241.124352, "postflop.memory.rainbow.warm.compressed.host_live_mb": 5309.97248, "postflop.memory.rainbow.warm.compressed.host_private_mb": 11908.096, "postflop.memory.rainbow.warm.compressed.init_ms": 1933.6133, "postflop.memory.rainbow.warm.compressed.strategy_sync_ms": 838.366, "postflop.memory.rainbow.warm.compressed.sync_ms": 1655.8828, "postflop.memory.cold.f32.allocated_vram_mb": 4932.501504, "postflop.memory.cold.f32.host_live_mb": 3924.64384, "postflop.memory.cold.f32.host_private_mb": 9448.87808, "postflop.memory.cold.f32.init_ms": 791.1983, "postflop.memory.cold.f32.strategy_sync_ms": 172.12939999999998, "postflop.memory.cold.f32.sync_ms": 361.2863, "postflop.memory.warm.f32.allocated_vram_mb": 4932.501504, "postflop.memory.warm.f32.host_live_mb": 3934.756864, "postflop.memory.warm.f32.host_private_mb": 9447.366656, "postflop.memory.warm.f32.init_ms": 781.5497, "postflop.memory.warm.f32.strategy_sync_ms": 185.6557, "postflop.memory.warm.f32.sync_ms": 365.40250000000003, "postflop.memory.cold.compressed.allocated_vram_mb": 4932.501504, "postflop.memory.cold.compressed.host_live_mb": 5317.95968, "postflop.memory.cold.compressed.host_private_mb": 10602.053632, "postflop.memory.cold.compressed.init_ms": 1667.7062, "postflop.memory.cold.compressed.strategy_sync_ms": 556.6742, "postflop.memory.cold.compressed.sync_ms": 1124.0348, "postflop.memory.warm.compressed.allocated_vram_mb": 4932.501504, "postflop.memory.warm.compressed.host_live_mb": 5318.643712, "postflop.memory.warm.compressed.host_private_mb": 10602.053632, "postflop.memory.warm.compressed.init_ms": 1707.9687, "postflop.memory.warm.compressed.strategy_sync_ms": 757.4297, "postflop.memory.warm.compressed.sync_ms": 1531.0011000000002, "postflop.Ks7h2d.init_ms": 1266.589, "postflop.Ks7h2d.iteration_ms": 58.5, "postflop.Ks7h2d.check_ms": 36.793, "postflop.Ks7s2d.init_ms": 793.612, "postflop.Ks7s2d.iteration_ms": 34.59, "postflop.Ks7s2d.check_ms": 29.888, "postflop.Ks7h2dQhTc.init_ms": 79.516, "postflop.Ks7h2dQhTc.iteration_ms": 0.321, "postflop.Ks7h2dQhTc.check_ms": 0.6}, "checks": [{"check_board": "Ks7h2d", "check_eval_bits": 4610328022310931180, "check_iteration": 65}, {"check_board": "Ks7s2d", "check_eval_bits": 4608664839644425536, "check_iteration": 65}, {"check_board": "Ks7h2dQhTc", "check_eval_bits": 4594234900545878240, "check_iteration": 65}, {"check_ev_bits": [13818231149285967788, 13824505857993336927], "check_gap_bits": [4587494750677495240, 4578740950612821696], "check_iteration": 65, "check_seats": 2}, {"check_ev_bits": [4591139080588829428, 4592693985497883551, 4593946344391214828, 4594927179058488125, 13822800502159894828, 13825431794291804883], "check_gap_bits": [4592169847827907240, 4585164356934551850, 4588296313823012216, 4586437900670586676, 4583054015422772960, 4583031084747833216], "check_iteration": 65, "check_seats": 6}, {"check_ev_bits": [4587160621192900714, 4588059182301650598, 4589561616460845131, 4590424431923123478, 4591846028241297974, 4594029634723087085, 13824156832147184690, 13826821985834700352], "check_gap_bits": [4582186906385158536, 4577078707904519064, 4576017671529333144, 4577694025738397696, 4577605411036232848, 4578121278065602480, 4579111217966708928, 4577595012631213824], "check_iteration": 65, "check_seats": 8}, {"memory_checks": [{"exploit_bits": 4635293868072649448, "iteration": 5}, {"exploit_bits": 4630023946365015954, "iteration": 10}, {"exploit_bits": 4625769973037188852, "iteration": 15}], "storage": "Compressed", "warm": false}, {"memory_checks": [{"exploit_bits": 4619888790163774590, "iteration": 25}, {"exploit_bits": 4617985406012120520, "iteration": 30}, {"exploit_bits": 4616854213690844608, "iteration": 35}], "storage": "Compressed", "warm": true}, {"memory_checks": [{"exploit_bits": 4635171514568527266, "iteration": 5}, {"exploit_bits": 4628956113180057410, "iteration": 10}, {"exploit_bits": 4624490585901877567, "iteration": 15}], "storage": "F32", "warm": false}, {"memory_checks": [{"exploit_bits": 4619248813860274839, "iteration": 25}, {"exploit_bits": 4617407200860962841, "iteration": 30}, {"exploit_bits": 4616217340056387513, "iteration": 35}], "storage": "F32", "warm": true}, {"memory_checks": [{"exploit_bits": 4635171514568527266, "iteration": 5}, {"exploit_bits": 4628919606694372554, "iteration": 10}, {"exploit_bits": 4624481349270140468, "iteration": 15}], "storage": "Compressed", "warm": false}, {"memory_checks": [{"exploit_bits": 4619250289695226916, "iteration": 25}, {"exploit_bits": 4617408694201541058, "iteration": 30}, {"exploit_bits": 4616218029189393624, "iteration": 35}], "storage": "Compressed", "warm": true}, {"postflop": "POSTFLOP board=Ks7h2d rake=0 nodes=1346813 init_ms=1266.589 iteration_ms=58.500 check_ms=36.793 exploit_chips=1.698464289"}, {"postflop": "POSTFLOP board=Ks7s2d rake=0.05 nodes=1346813 init_ms=793.612 iteration_ms=34.590 check_ms=29.888 exploit_chips=1.329163551"}, {"postflop": "POSTFLOP board=Ks7h2dQhTc rake=0.05 nodes=33 init_ms=79.516 iteration_ms=0.321 check_ms=0.600 exploit_chips=0.140634178"}], "score_patterns": []}
{"event": "refresh_compiler_inputs", "utc": "2026-09-07T06:46:49+00:00", "files": ["crates/solver/src/gpu/kernels.cu", "crates/solver/src/gpu/mod.rs", "crates/solver/src/gpu/plan.rs", "crates/solver/src/preflop/gpu.rs", "crates/solver/src/preflop/kernels.cu"], "reason": "Content changes must invalidate Cargo even after copies preserving old mtimes"}
{"event": "decision", "id": "G001", "status": "keep", "reason": "Final combined retained implementation passes unchanged workload and all numerical reference checks; main CPU124/GPU42/server continuation suites also pass on identical source.", "utc": "2026-09-07T06:47:07+00:00"}
{"event": "decision", "id": "G002", "status": "keep", "reason": "Final combined retained implementation passes unchanged workload and all numerical reference checks; main CPU124/GPU42/server continuation suites also pass on identical source.", "utc": "2026-09-07T06:47:07+00:00"}
{"event": "decision", "id": "G003", "status": "keep", "reason": "Final combined retained implementation passes unchanged workload and all numerical reference checks; main CPU124/GPU42/server continuation suites also pass on identical source.", "utc": "2026-09-07T06:47:07+00:00"}
{"event": "decision", "id": "G004", "status": "keep", "reason": "Final combined retained implementation passes unchanged workload and all numerical reference checks; main CPU124/GPU42/server continuation suites also pass on identical source.", "utc": "2026-09-07T06:47:07+00:00"}
