{"event": "decision", "id": "E024A", "status": "discard", "reason": "Superseded by E024F: unconditional packing saves VRAM but F32 initialization/readback and host-memory regressions require adaptive policy and transfer refinements", "utc": "2026-09-07T04:42:51+00:00"}
{"event": "decision", "id": "E024B", "status": "discard", "reason": "Superseded by E024F: unconditional packing saves VRAM but F32 initialization/readback and host-memory regressions require adaptive policy and transfer refinements", "utc": "2026-09-07T04:42:51+00:00"}
{"event": "decision", "id": "E024C", "status": "discard", "reason": "Superseded by E024F: unconditional packing saves VRAM but F32 initialization/readback and host-memory regressions require adaptive policy and transfer refinements", "utc": "2026-09-07T04:42:51+00:00"}
{"event": "decision", "id": "E024D", "status": "discard", "reason": "Superseded by E024F: unconditional packing saves VRAM but F32 initialization/readback and host-memory regressions require adaptive policy and transfer refinements", "utc": "2026-09-07T04:42:51+00:00"}
{"event": "decision", "id": "E024E", "status": "discard", "reason": "Superseded by E024F: unconditional packing saves VRAM but F32 initialization/readback and host-memory regressions require adaptive policy and transfer refinements", "utc": "2026-09-07T04:42:51+00:00"}
{"event": "decision", "id": "E024F", "status": "keep", "reason": "Default compressed mode saves 1.107 GB VRAM; repeated cold/warm initialization, host-memory and download gains; direct F32 path retained when budget permits, exact compact fallback under pressure. 29 unit + 6 GPU tests and full lifecycle/resume controls pass", "utc": "2026-09-07T04:43:01+00:00"}
{"event": "promote", "files": ["crates/solver/src/gpu/arena.rs", "crates/solver/src/gpu/mod.rs", "crates/solver/src/gpu/plan.rs"], "commit": "28d36988ce85543eb60f35f4b3b7ca2e7c6ccca3", "utc": "2026-09-07T04:43:11+00:00"}
{"event": "run", "id": "B027", "path": "preflop_cuda", "hypothesis": "Fresh preflop 2/6/8-seat timing and complete-state control before terminal seat-count specialization; E024F supplies wider seat/menu/override references", "status": "baseline", "utc": "2026-09-07T04:43:26+00:00", "commit": "28d36988ce85543eb60f35f4b3b7ca2e7c6ccca3", "seconds": 13.703, "diagnostic_peak_process_mb": 2108.183, "returncode": 0, "command": ["cargo", "test", "--release", "-p", "solver", "--features", "gpu", "--test", "preflop_perf", "--test", "cuda_resources", "--", "--ignored", "--nocapture", "--test-threads=1"], "env": [], "metrics": {"preflop.2.iteration_ms": 0.087, "preflop.2.check_ms": 0.276, "preflop.2.sync_ms": 0.017, "preflop.6.iteration_ms": 18.213, "preflop.6.check_ms": 13.091, "preflop.6.sync_ms": 26.578, "preflop.8.iteration_ms": 63.517, "preflop.8.check_ms": 41.704, "preflop.8.sync_ms": 69.527}, "checks": [{"area": "postflop", "kernel": "down_action", "local_bytes_per_thread": 0, "registers": 48, "static_shared_bytes": 0}, {"area": "postflop", "kernel": "up_action", "local_bytes_per_thread": 0, "registers": 66, "static_shared_bytes": 0}, {"area": "postflop", "kernel": "up_action_eval", "local_bytes_per_thread": 0, "registers": 40, "static_shared_bytes": 0}, {"area": "postflop", "kernel": "up_show", "local_bytes_per_thread": 0, "registers": 40, "static_shared_bytes": 1040}, {"area": "postflop", "kernel": "up_fold", "local_bytes_per_thread": 0, "registers": 40, "static_shared_bytes": 1232}, {"area": "preflop", "kernel": "pf_down", "local_bytes_per_thread": 64, "registers": 40, "static_shared_bytes": 0}, {"area": "preflop", "kernel": "pf_up", "local_bytes_per_thread": 64, "registers": 40, "static_shared_bytes": 0}, {"area": "preflop", "kernel": "pf_terminal", "local_bytes_per_thread": 40, "registers": 46, "static_shared_bytes": 0}, {"area": "preflop", "kernel": "pf_reach_mass", "local_bytes_per_thread": 0, "registers": 12, "static_shared_bytes": 1024}, {"preflop": "PERF seats=2 nodes=40 iteration_ms=0.087 check_ms=0.276 sync_ms=0.017 arena_hash=6d4781fae03e3474 gaps=[0.05088935968248226, 0.013161917444424076] evs=[-0.15795953824550446, -0.4142353804778675]"}, {"preflop": "PERF seats=6 nodes=166090 iteration_ms=18.213 check_ms=13.091 sync_ms=26.578 arena_hash=b70284af63586e3f gaps=[0.10415872559930028, 0.03471900474586882, 0.05645132130650671, 0.04355598961220011, 0.02566278444731196, 0.025583227687036025] evs=[0.08985395657613165, 0.11143259696531381, 0.13262513589238922, 0.15984876666632344, -0.3195691149045554, -0.4656351703726333]"}, {"preflop": "PERF seats=8 nodes=434350 iteration_ms=63.517 check_ms=41.704 sync_ms=69.527 arena_hash=e01dd7a18632644d gaps=[0.022654395639749164, 0.010278385995560232, 0.008437781286659882, 0.011345792287176693, 0.011192070283014638, 0.012086956929344556, 0.01380422891560007, 0.011174031925715422] evs=[0.04857087063871364, 0.05480589083850633, 0.06796224413352651, 0.07993621403632675, 0.0996648260883227, 0.13493690699672048, -0.39486055394849295, -0.5856126067014387]"}], "score_patterns": []}
