{"event": "run", "id": "B034", "path": "baseline", "hypothesis": "Fresh pass-start CUDA implementation on the current machine, with unchanged frozen workloads; compare final combined gains.", "status": "baseline", "utc": "2026-09-07T06:36:58+00:00", "commit": "c14e87c3ad7f1c98cf61ca38b2971b37ecb97fef", "seconds": 114.25, "diagnostic_peak_process_mb": 8216.142, "returncode": 0, "command": ["cargo", "test", "--release", "-p", "solver", "--features", "gpu", "--test", "preflop_perf", "--test", "preflop_generic_perf", "--test", "preflop_target_perf", "--test", "capacity_perf", "--test", "postflop_perf", "--", "--include-ignored", "--nocapture", "--test-threads=1"], "env": ["POSTFLOP_PERF_CONVERGENCE=1"], "metrics": {"preflop.6.allocated_vram_mb": 671.08864, "preflop.6.build_ms": 79.7142, "preflop.6.cpu_arena_mb": 224.552328, "preflop.6.estimated_vram_mb": 706.776248, "preflop.6.init_ms": 146.5464, "preflop.8.allocated_vram_mb": 1711.276032, "preflop.8.build_ms": 206.5267, "preflop.8.cpu_arena_mb": 587.239848, "preflop.8.estimated_vram_mb": 1750.508472, "preflop.8.init_ms": 237.5974, "postflop.Ks7h2d.target_seconds": 12.067, "postflop.Ks7s2d.target_seconds": 7.219, "postflop.Ks7h2dQhTc.target_seconds": 0.022, "preflop.3.iteration_ms": 0.24, "preflop.3.check_ms": 0.612, "preflop.3.sync_ms": 0.067, "preflop.5.iteration_ms": 3.149, "preflop.5.check_ms": 2.959, "preflop.5.sync_ms": 4.621, "preflop.7.iteration_ms": 14.703, "preflop.7.check_ms": 10.424, "preflop.7.sync_ms": 16.793, "preflop.9.iteration_ms": 315.572, "preflop.9.check_ms": 197.742, "preflop.9.sync_ms": 281.192, "preflop.2.iteration_ms": 0.084, "preflop.2.check_ms": 0.322, "preflop.2.sync_ms": 0.019, "preflop.6.iteration_ms": 19.612, "preflop.6.check_ms": 13.891, "preflop.6.sync_ms": 26.613, "preflop.8.iteration_ms": 69.358, "preflop.8.check_ms": 42.0, "preflop.8.sync_ms": 66.686, "preflop.6.target_seconds": 3.5492666, "preflop.8.target_seconds": 8.925965099999999}, "checks": [{"nodes": 166090, "note": "Allocated VRAM is device free-memory delta; estimate is the engine preflight formula.", "seats": 6}, {"nodes": 434350, "note": "Allocated VRAM is device free-memory delta; estimate is the engine preflight formula.", "seats": 8}, {"convergence": "POSTFLOP_TARGET board=Ks7h2d iteration=200 seconds=12.067 pct=0.275829435"}, {"convergence": "POSTFLOP_TARGET board=Ks7s2d iteration=200 seconds=7.219 pct=0.251358787"}, {"convergence": "POSTFLOP_TARGET board=Ks7h2dQhTc iteration=60 seconds=0.022 pct=0.269896845"}, {"preflop": "PERF seats=3 nodes=430 iteration_ms=0.240 check_ms=0.612 sync_ms=0.067 arena_hash=ad8e0571988ea8d1 gaps=[0.05411917144329437, 0.020649702738510856, 0.023660626623397518] evs=[0.18057702354014996, -0.2964069280900554, -0.40403772274038074]"}, {"preflop": "PERF seats=5 nodes=25666 iteration_ms=3.149 check_ms=2.959 sync_ms=4.621 arena_hash=eacd3b740ba36a87 gaps=[0.025314965158686198, 0.024440227289712735, 0.05095333293826351, 0.02204052445371546, 0.035784321232043226] evs=[0.10492140038019776, 0.12720748057673634, 0.16157980442678233, -0.3295918169553824, -0.5837288241230508]"}, {"preflop": "PERF seats=7 nodes=101410 iteration_ms=14.703 check_ms=10.424 sync_ms=16.793 arena_hash=4d7fd195a99ae236 gaps=[0.03553805162282347, 0.007648762560631045, 0.01097738780437467, 0.014944471542742727, 0.016296028635770565, 0.012559587798595728, 0.010483293730444543] evs=[0.05280050956560466, 0.0656873532014755, 0.0779941161034474, 0.09649242795931973, 0.13524390893043642, -0.38923558977054057, -0.5455678317382016]"}, {"preflop": "PERF seats=9 nodes=1825426 iteration_ms=315.572 check_ms=197.742 sync_ms=281.192 arena_hash=c0e1bd383cfd2aff gaps=[0.02448954424457915, 0.02070868826099758, 0.012772372472253046, 0.010359589852781348, 0.017246776149790838, 0.017663266297577446, 0.02407000279366972, 0.012083211967836571, 0.01758857953274018] evs=[0.039436230451638576, 0.04524954656088196, 0.05473733184401432, 0.06773912486076317, 0.07452635556321599, 0.09305239435036294, 0.12108596285718132, -0.39379665413775883, -0.6140353649962962]"}, {"preflop": "PERF seats=2 nodes=40 iteration_ms=0.084 check_ms=0.322 sync_ms=0.019 arena_hash=6d4781fae03e3474 gaps=[0.05088935968248226, 0.013161917444424076] evs=[-0.15795953824550446, -0.4142353804778675]"}, {"preflop": "PERF seats=6 nodes=166090 iteration_ms=19.612 check_ms=13.891 sync_ms=26.613 arena_hash=b70284af63586e3f gaps=[0.10415872559930028, 0.03471900474586882, 0.05645132130650671, 0.04355598961220011, 0.02566278444731196, 0.025583227687036025] evs=[0.08985395657613165, 0.11143259696531381, 0.13262513589238922, 0.15984876666632344, -0.3195691149045554, -0.4656351703726333]"}, {"preflop": "PERF seats=8 nodes=434350 iteration_ms=69.358 check_ms=42.000 sync_ms=66.686 arena_hash=e01dd7a18632644d gaps=[0.022654395639749164, 0.010278385995560232, 0.008437781286659882, 0.011345792287176693, 0.011192070283014638, 0.012086956929344556, 0.01380422891560007, 0.011174031925715422] evs=[0.04857087063871364, 0.05480589083850633, 0.06796224413352651, 0.07993621403632675, 0.0996648260883227, 0.13493690699672048, -0.39486055394849295, -0.5856126067014387]"}, {"arena_hash": "c2dad646abce18b5", "evs": [0.08797255266730505, 0.11134619537831136, 0.14089217263325687, 0.18902651619282607, -0.30302059818816424, -0.4718418733933629], "gap_total": 0.024847662904315698, "gaps": [0.008891930020792499, 0.0028558437428595207, 0.004669706392101347, 0.003544522935725547, 0.0024462647714426633, 0.0024393950413941212], "iteration": 175, "seats": 6}, {"arena_hash": "84a3dfccf7629cc7", "evs": [0.05031450986961973, 0.06125595802790403, 0.07389315031782204, 0.08774957648238482, 0.10797622645047951, 0.14606867660221595, -0.3852499664026161, -0.5872064351282983], "gap_total": 0.020521659486179414, "gaps": [0.00410024124668109, 0.002149521831405564, 0.0020851674306289897, 0.0024997828874374906, 0.0022918593337274834, 0.0023690504386156275, 0.002572443936215363, 0.0024535923814678062], "iteration": 125, "seats": 8}], "score_patterns": []}
{"event": "refresh_compiler_inputs", "utc": "2026-09-07T06:37:20+00:00", "files": ["crates/solver/src/gpu/kernels.cu", "crates/solver/src/gpu/mod.rs", "crates/solver/src/gpu/plan.rs", "crates/solver/src/preflop/gpu.rs", "crates/solver/src/preflop/kernels.cu"], "reason": "Content changes must invalidate Cargo even after copies preserving old mtimes"}
