{"event": "run", "id": "E037DR", "path": "preflop_cuda", "hypothesis": "Repeat adaptive launch geometry with exact stopping and GPU/cache gates; collect fresh compressed lifecycle controls for the upload trial", "status": "candidate", "utc": "2026-09-07T06:22:38+00:00", "commit": "76ca9e7ded44b122049901ac81c23509037fe891", "seconds": 99.469, "diagnostic_peak_process_mb": 8230.134, "returncode": 0, "command": ["cargo", "test", "--release", "-p", "solver", "--features", "gpu", "--test", "preflop_perf", "--test", "preflop_generic_perf", "--test", "preflop_target_perf", "--test", "preflop_gpu", "--test", "preflop_budget", "--test", "postflop_memory_perf", "--test", "postflop_full_memory_perf", "--", "--include-ignored", "--nocapture", "--test-threads=1"], "env": [], "metrics": {"postflop.memory.rainbow.cold.compressed.allocated_vram_mb": 5905.580032, "postflop.memory.rainbow.cold.compressed.host_live_mb": 2585.260032, "postflop.memory.rainbow.cold.compressed.host_private_mb": 9082.830848, "postflop.memory.rainbow.cold.compressed.init_ms": 811.1334, "postflop.memory.rainbow.cold.compressed.strategy_sync_ms": 171.0208, "postflop.memory.rainbow.cold.compressed.sync_ms": 334.8445, "postflop.memory.rainbow.warm.compressed.allocated_vram_mb": 5905.580032, "postflop.memory.rainbow.warm.compressed.host_live_mb": 2597.093376, "postflop.memory.rainbow.warm.compressed.host_private_mb": 9088.954368, "postflop.memory.rainbow.warm.compressed.init_ms": 779.1766, "postflop.memory.rainbow.warm.compressed.strategy_sync_ms": 167.7842, "postflop.memory.rainbow.warm.compressed.sync_ms": 337.7634, "postflop.memory.cold.f32.allocated_vram_mb": 4731.174912, "postflop.memory.cold.f32.host_live_mb": 3917.53728, "postflop.memory.cold.f32.host_private_mb": 9230.974976, "postflop.memory.cold.f32.init_ms": 679.433, "postflop.memory.cold.f32.strategy_sync_ms": 157.2373, "postflop.memory.cold.f32.sync_ms": 311.70750000000004, "postflop.memory.warm.f32.allocated_vram_mb": 4731.174912, "postflop.memory.warm.f32.host_live_mb": 3936.321536, "postflop.memory.warm.f32.host_private_mb": 9246.261248, "postflop.memory.warm.f32.init_ms": 747.5805, "postflop.memory.warm.f32.strategy_sync_ms": 157.7772, "postflop.memory.warm.f32.sync_ms": 309.5161, "postflop.memory.cold.compressed.allocated_vram_mb": 3623.878656, "postflop.memory.cold.compressed.host_live_mb": 2300.452864, "postflop.memory.cold.compressed.host_private_mb": 6504.681472, "postflop.memory.cold.compressed.init_ms": 597.1931000000001, "postflop.memory.cold.compressed.strategy_sync_ms": 124.1716, "postflop.memory.cold.compressed.sync_ms": 254.95620000000002, "postflop.memory.warm.compressed.allocated_vram_mb": 3623.878656, "postflop.memory.warm.compressed.host_live_mb": 3769.335808, "postflop.memory.warm.compressed.host_private_mb": 8126.562304, "postflop.memory.warm.compressed.init_ms": 1005.5111999999999, "postflop.memory.warm.compressed.strategy_sync_ms": 143.0512, "postflop.memory.warm.compressed.sync_ms": 291.0126, "preflop.3.iteration_ms": 0.221, "preflop.3.check_ms": 0.503, "preflop.3.sync_ms": 0.057, "preflop.5.iteration_ms": 2.381, "preflop.5.check_ms": 2.464, "preflop.5.sync_ms": 4.035, "preflop.7.iteration_ms": 9.622, "preflop.7.check_ms": 6.261, "preflop.7.sync_ms": 15.892, "preflop.9.iteration_ms": 184.056, "preflop.9.check_ms": 112.307, "preflop.9.sync_ms": 317.055, "preflop.2.iteration_ms": 0.082, "preflop.2.check_ms": 0.268, "preflop.2.sync_ms": 0.03, "preflop.6.iteration_ms": 12.656, "preflop.6.check_ms": 9.033, "preflop.6.sync_ms": 25.226, "preflop.8.iteration_ms": 41.825, "preflop.8.check_ms": 25.355, "preflop.8.sync_ms": 69.182, "preflop.6.target_seconds": 2.2677291, "preflop.8.target_seconds": 5.336061}, "checks": [{"memory_checks": [{"exploit_bits": 4635293868072649448, "iteration": 5}, {"exploit_bits": 4630023946365015954, "iteration": 10}, {"exploit_bits": 4625769973037188852, "iteration": 15}], "storage": "Compressed", "warm": false}, {"memory_checks": [{"exploit_bits": 4619888790163774590, "iteration": 25}, {"exploit_bits": 4617985406012120520, "iteration": 30}, {"exploit_bits": 4616854213690844608, "iteration": 35}], "storage": "Compressed", "warm": true}, {"memory_checks": [{"exploit_bits": 4635171514568527266, "iteration": 5}, {"exploit_bits": 4628956113180057410, "iteration": 10}, {"exploit_bits": 4624490585901877567, "iteration": 15}], "storage": "F32", "warm": false}, {"memory_checks": [{"exploit_bits": 4619248813860274839, "iteration": 25}, {"exploit_bits": 4617407200860962841, "iteration": 30}, {"exploit_bits": 4616217340056387513, "iteration": 35}], "storage": "F32", "warm": true}, {"memory_checks": [{"exploit_bits": 4635171514568527266, "iteration": 5}, {"exploit_bits": 4628919606694372554, "iteration": 10}, {"exploit_bits": 4624481349270140468, "iteration": 15}], "storage": "Compressed", "warm": false}, {"memory_checks": [{"exploit_bits": 4619250289695226916, "iteration": 25}, {"exploit_bits": 4617408694201541058, "iteration": 30}, {"exploit_bits": 4616218029189393624, "iteration": 35}], "storage": "Compressed", "warm": true}, {"all_arena_gap_ev_bits_equal": true, "iteration": 65, "seats": 6, "tight_budget_mb": 550}, {"all_arena_gap_ev_bits_equal": true, "iteration": 65, "seats": 8, "tight_budget_mb": 1350}, {"preflop": "PERF seats=3 nodes=430 iteration_ms=0.221 check_ms=0.503 sync_ms=0.057 arena_hash=ad8e0571988ea8d1 gaps=[0.05411917144329437, 0.020649702738510856, 0.023660626623397518] evs=[0.18057702354014996, -0.2964069280900554, -0.40403772274038074]"}, {"preflop": "PERF seats=5 nodes=25666 iteration_ms=2.381 check_ms=2.464 sync_ms=4.035 arena_hash=eacd3b740ba36a87 gaps=[0.025314965158686198, 0.024440227289712735, 0.05095333293826351, 0.02204052445371546, 0.035784321232043226] evs=[0.10492140038019776, 0.12720748057673634, 0.16157980442678233, -0.3295918169553824, -0.5837288241230508]"}, {"preflop": "PERF seats=7 nodes=101410 iteration_ms=9.622 check_ms=6.261 sync_ms=15.892 arena_hash=4d7fd195a99ae236 gaps=[0.03553805162282347, 0.007648762560631045, 0.01097738780437467, 0.014944471542742727, 0.016296028635770565, 0.012559587798595728, 0.010483293730444543] evs=[0.05280050956560466, 0.0656873532014755, 0.0779941161034474, 0.09649242795931973, 0.13524390893043642, -0.38923558977054057, -0.5455678317382016]"}, {"preflop": "PERF seats=9 nodes=1825426 iteration_ms=184.056 check_ms=112.307 sync_ms=317.055 arena_hash=c0e1bd383cfd2aff gaps=[0.02448954424457915, 0.02070868826099758, 0.012772372472253046, 0.010359589852781348, 0.017246776149790838, 0.017663266297577446, 0.02407000279366972, 0.012083211967836571, 0.01758857953274018] evs=[0.039436230451638576, 0.04524954656088196, 0.05473733184401432, 0.06773912486076317, 0.07452635556321599, 0.09305239435036294, 0.12108596285718132, -0.39379665413775883, -0.6140353649962962]"}, {"preflop": "PERF seats=2 nodes=40 iteration_ms=0.082 check_ms=0.268 sync_ms=0.030 arena_hash=6d4781fae03e3474 gaps=[0.05088935968248226, 0.013161917444424076] evs=[-0.15795953824550446, -0.4142353804778675]"}, {"preflop": "PERF seats=6 nodes=166090 iteration_ms=12.656 check_ms=9.033 sync_ms=25.226 arena_hash=b70284af63586e3f gaps=[0.10415872559930028, 0.03471900474586882, 0.05645132130650671, 0.04355598961220011, 0.02566278444731196, 0.025583227687036025] evs=[0.08985395657613165, 0.11143259696531381, 0.13262513589238922, 0.15984876666632344, -0.3195691149045554, -0.4656351703726333]"}, {"preflop": "PERF seats=8 nodes=434350 iteration_ms=41.825 check_ms=25.355 sync_ms=69.182 arena_hash=e01dd7a18632644d gaps=[0.022654395639749164, 0.010278385995560232, 0.008437781286659882, 0.011345792287176693, 0.011192070283014638, 0.012086956929344556, 0.01380422891560007, 0.011174031925715422] evs=[0.04857087063871364, 0.05480589083850633, 0.06796224413352651, 0.07993621403632675, 0.0996648260883227, 0.13493690699672048, -0.39486055394849295, -0.5856126067014387]"}, {"arena_hash": "c2dad646abce18b5", "evs": [0.08797255266730505, 0.11134619537831136, 0.14089217263325687, 0.18902651619282607, -0.30302059818816424, -0.4718418733933629], "gap_total": 0.024847662904315698, "gaps": [0.008891930020792499, 0.0028558437428595207, 0.004669706392101347, 0.003544522935725547, 0.0024462647714426633, 0.0024393950413941212], "iteration": 175, "seats": 6}, {"arena_hash": "84a3dfccf7629cc7", "evs": [0.05031450986961973, 0.06125595802790403, 0.07389315031782204, 0.08774957648238482, 0.10797622645047951, 0.14606867660221595, -0.3852499664026161, -0.5872064351282983], "gap_total": 0.020521659486179414, "gaps": [0.00410024124668109, 0.002149521831405564, 0.0020851674306289897, 0.0024997828874374906, 0.0022918593337274834, 0.0023690504386156275, 0.002572443936215363, 0.0024535923814678062], "iteration": 125, "seats": 8}], "score_patterns": ["preflop.*iteration_ms", "preflop.*check_ms", "preflop.*target_seconds"]}
{"event": "decision", "id": "E037", "status": "discard", "reason": "Exact states but superseded by adaptive E037D: wide levels use 64 threads and narrow levels preserve 256; fixed 128-thread mass reduction remains unchanged.", "utc": "2026-09-07T06:27:32+00:00"}
{"event": "decision", "id": "E037B", "status": "discard", "reason": "Exact states but superseded by adaptive E037D: wide levels use 64 threads and narrow levels preserve 256; fixed 128-thread mass reduction remains unchanged.", "utc": "2026-09-07T06:27:32+00:00"}
{"event": "decision", "id": "E037C", "status": "discard", "reason": "Exact states but superseded by adaptive E037D: wide levels use 64 threads and narrow levels preserve 256; fixed 128-thread mass reduction remains unchanged.", "utc": "2026-09-07T06:27:32+00:00"}
{"event": "decision", "id": "E037D", "status": "keep", "reason": "Repeated 6/8/9-seat iteration and evaluation gains, small-tree latency preserved; all seven full fingerprints, 48 variants and fixed targets remain exact. GPU and tight-budget suites pass.", "utc": "2026-09-07T06:27:32+00:00"}
{"event": "decision", "id": "E037DR", "status": "keep", "reason": "Repeated 6/8/9-seat iteration and evaluation gains, small-tree latency preserved; all seven full fingerprints, 48 variants and fixed targets remain exact. GPU and tight-budget suites pass.", "utc": "2026-09-07T06:27:32+00:00"}
{"event": "promote", "files": ["crates/solver/src/preflop/gpu.rs", "crates/solver/src/preflop/kernels.cu"], "commit": "76ca9e7ded44b122049901ac81c23509037fe891", "utc": "2026-09-07T06:28:04+00:00"}
{"event": "refresh_compiler_inputs", "utc": "2026-09-07T06:28:05+00:00", "files": ["crates/solver/src/gpu/arena.rs"], "reason": "Content changes must invalidate Cargo even after copies preserving old mtimes"}
{"event": "source_attribution", "id": "E038", "commit": "523c8d45ddf1d444e33523484673bf815a33c243", "utc": "2026-09-07T06:28:52+00:00", "reason": "Proposal was written before compilation; the identical bytes were committed while compilation ran. Original run metadata sampled the prior HEAD. Compiler input refresh receipt and this commit identify the compiled source."}
