{"event": "run", "id": "E032R", "path": "memory_transfers", "hypothesis": "Repeat compact preflop values with fixed convergence stopping and CUDA equivalence", "status": "candidate", "utc": "2026-09-07T05:45:32+00:00", "commit": "ae8bd56fea5db6bdbca543febd0c41d15839842e", "seconds": 29.906, "diagnostic_peak_process_mb": 2126.578, "returncode": 0, "command": ["cargo", "test", "--release", "-p", "solver", "--features", "gpu", "--test", "preflop_perf", "--test", "capacity_perf", "--test", "preflop_target_perf", "--test", "preflop_gpu", "--", "--include-ignored", "--nocapture", "--test-threads=1"], "env": [], "metrics": {"preflop.6.allocated_vram_mb": 503.31648, "preflop.6.build_ms": 78.336, "preflop.6.cpu_arena_mb": 224.552328, "preflop.6.estimated_vram_mb": 558.527272, "preflop.6.init_ms": 138.59959999999998, "preflop.8.allocated_vram_mb": 1308.622848, "preflop.8.build_ms": 212.7641, "preflop.8.cpu_arena_mb": 587.239848, "preflop.8.estimated_vram_mb": 1357.2225680000001, "preflop.8.init_ms": 217.7318, "preflop.2.iteration_ms": 0.082, "preflop.2.check_ms": 0.283, "preflop.2.sync_ms": 0.018, "preflop.6.iteration_ms": 16.474, "preflop.6.check_ms": 11.629, "preflop.6.sync_ms": 29.096, "preflop.8.iteration_ms": 57.946, "preflop.8.check_ms": 39.74, "preflop.8.sync_ms": 66.138, "preflop.6.target_seconds": 2.9564696, "preflop.8.target_seconds": 7.4261381}, "checks": [{"nodes": 166090, "note": "Allocated VRAM is device free-memory delta; estimate is the engine preflight formula.", "seats": 6}, {"nodes": 434350, "note": "Allocated VRAM is device free-memory delta; estimate is the engine preflight formula.", "seats": 8}, {"preflop": "PERF seats=2 nodes=40 iteration_ms=0.082 check_ms=0.283 sync_ms=0.018 arena_hash=6d4781fae03e3474 gaps=[0.05088935968248226, 0.013161917444424076] evs=[-0.15795953824550446, -0.4142353804778675]"}, {"preflop": "PERF seats=6 nodes=166090 iteration_ms=16.474 check_ms=11.629 sync_ms=29.096 arena_hash=b70284af63586e3f gaps=[0.10415872559930028, 0.03471900474586882, 0.05645132130650671, 0.04355598961220011, 0.02566278444731196, 0.025583227687036025] evs=[0.08985395657613165, 0.11143259696531381, 0.13262513589238922, 0.15984876666632344, -0.3195691149045554, -0.4656351703726333]"}, {"preflop": "PERF seats=8 nodes=434350 iteration_ms=57.946 check_ms=39.740 sync_ms=66.138 arena_hash=e01dd7a18632644d gaps=[0.022654395639749164, 0.010278385995560232, 0.008437781286659882, 0.011345792287176693, 0.011192070283014638, 0.012086956929344556, 0.01380422891560007, 0.011174031925715422] evs=[0.04857087063871364, 0.05480589083850633, 0.06796224413352651, 0.07993621403632675, 0.0996648260883227, 0.13493690699672048, -0.39486055394849295, -0.5856126067014387]"}, {"arena_hash": "c2dad646abce18b5", "evs": [0.08797255266730505, 0.11134619537831136, 0.14089217263325687, 0.18902651619282607, -0.30302059818816424, -0.4718418733933629], "gap_total": 0.024847662904315698, "gaps": [0.008891930020792499, 0.0028558437428595207, 0.004669706392101347, 0.003544522935725547, 0.0024462647714426633, 0.0024393950413941212], "iteration": 175, "seats": 6}, {"arena_hash": "84a3dfccf7629cc7", "evs": [0.05031450986961973, 0.06125595802790403, 0.07389315031782204, 0.08774957648238482, 0.10797622645047951, 0.14606867660221595, -0.3852499664026161, -0.5872064351282983], "gap_total": 0.020521659486179414, "gaps": [0.00410024124668109, 0.002149521831405564, 0.0020851674306289897, 0.0024997828874374906, 0.0022918593337274834, 0.0023690504386156275, 0.002572443936215363, 0.0024535923814678062], "iteration": 125, "seats": 8}], "score_patterns": ["preflop.*vram_mb", "preflop.*init_ms"]}
{"event": "decision", "id": "E032", "status": "keep", "reason": "Repeated actual preflop VRAM503.316MB vs536.871MB for6 and1308.623MB vs1409.286MB for8. Exact full arenas/gaps/EVs,48variants, fixed175/125-iteration target states, tight-budget cache fallback and liveness assertions pass;29unit+5GPU tests pass. Iteration timings near control; initialization repeat138.6/217.7ms vs154.6/230.1ms.", "utc": "2026-09-07T05:48:26+00:00"}
{"event": "decision", "id": "E032R", "status": "keep", "reason": "Repeated actual preflop VRAM503.316MB vs536.871MB for6 and1308.623MB vs1409.286MB for8. Exact full arenas/gaps/EVs,48variants, fixed175/125-iteration target states, tight-budget cache fallback and liveness assertions pass;29unit+5GPU tests pass. Iteration timings near control; initialization repeat138.6/217.7ms vs154.6/230.1ms.", "utc": "2026-09-07T05:48:26+00:00"}
{"event": "promote", "files": ["crates/solver/src/preflop/gpu.rs", "crates/solver/src/preflop/kernels.cu"], "commit": "ae8bd56fea5db6bdbca543febd0c41d15839842e", "utc": "2026-09-07T05:48:43+00:00"}
{"event": "refresh_compiler_inputs", "utc": "2026-09-07T05:48:45+00:00", "files": ["crates/solver/tests/preflop_generic_perf.rs"], "reason": "Content changes must invalidate Cargo even after copies preserving old mtimes"}
{"event": "run", "id": "B033", "path": "baseline", "hypothesis": "Freeze generic3/5/7/9-seat full-state baseline and refresh postflop iteration control before narrower CUDA trials", "status": "baseline", "utc": "2026-09-07T05:49:34+00:00", "commit": "2781e2b67dae08330f267bd48663a82d4c940bfa", "seconds": 48.468, "diagnostic_peak_process_mb": 8234.344, "returncode": 0, "command": ["cargo", "test", "--release", "-p", "solver", "--features", "gpu", "--test", "preflop_generic_perf", "--test", "postflop_perf", "--", "--ignored", "--nocapture", "--test-threads=1"], "env": [], "metrics": {"postflop.Ks7h2d.init_ms": 1105.904, "postflop.Ks7h2d.iteration_ms": 51.841, "postflop.Ks7h2d.check_ms": 34.858, "postflop.Ks7s2d.init_ms": 831.082, "postflop.Ks7s2d.iteration_ms": 31.208, "postflop.Ks7s2d.check_ms": 28.182, "postflop.Ks7h2dQhTc.init_ms": 68.056, "postflop.Ks7h2dQhTc.iteration_ms": 0.284, "postflop.Ks7h2dQhTc.check_ms": 0.599, "preflop.3.iteration_ms": 0.2, "preflop.3.check_ms": 0.527, "preflop.3.sync_ms": 0.072, "preflop.5.iteration_ms": 2.733, "preflop.5.check_ms": 2.569, "preflop.5.sync_ms": 9.799, "preflop.7.iteration_ms": 13.092, "preflop.7.check_ms": 9.167, "preflop.7.sync_ms": 15.824, "preflop.9.iteration_ms": 290.68, "preflop.9.check_ms": 197.123, "preflop.9.sync_ms": 283.644}, "checks": [{"postflop": "POSTFLOP board=Ks7h2d rake=0 nodes=1346813 init_ms=1105.904 iteration_ms=51.841 check_ms=34.858 exploit_chips=1.698464289"}, {"postflop": "POSTFLOP board=Ks7s2d rake=0.05 nodes=1346813 init_ms=831.082 iteration_ms=31.208 check_ms=28.182 exploit_chips=1.329163551"}, {"postflop": "POSTFLOP board=Ks7h2dQhTc rake=0.05 nodes=33 init_ms=68.056 iteration_ms=0.284 check_ms=0.599 exploit_chips=0.140634178"}, {"preflop": "PERF seats=3 nodes=430 iteration_ms=0.200 check_ms=0.527 sync_ms=0.072 arena_hash=ad8e0571988ea8d1 gaps=[0.05411917144329437, 0.020649702738510856, 0.023660626623397518] evs=[0.18057702354014996, -0.2964069280900554, -0.40403772274038074]"}, {"preflop": "PERF seats=5 nodes=25666 iteration_ms=2.733 check_ms=2.569 sync_ms=9.799 arena_hash=eacd3b740ba36a87 gaps=[0.025314965158686198, 0.024440227289712735, 0.05095333293826351, 0.02204052445371546, 0.035784321232043226] evs=[0.10492140038019776, 0.12720748057673634, 0.16157980442678233, -0.3295918169553824, -0.5837288241230508]"}, {"preflop": "PERF seats=7 nodes=101410 iteration_ms=13.092 check_ms=9.167 sync_ms=15.824 arena_hash=4d7fd195a99ae236 gaps=[0.03553805162282347, 0.007648762560631045, 0.01097738780437467, 0.014944471542742727, 0.016296028635770565, 0.012559587798595728, 0.010483293730444543] evs=[0.05280050956560466, 0.0656873532014755, 0.0779941161034474, 0.09649242795931973, 0.13524390893043642, -0.38923558977054057, -0.5455678317382016]"}, {"preflop": "PERF seats=9 nodes=1825426 iteration_ms=290.680 check_ms=197.123 sync_ms=283.644 arena_hash=c0e1bd383cfd2aff gaps=[0.02448954424457915, 0.02070868826099758, 0.012772372472253046, 0.010359589852781348, 0.017246776149790838, 0.017663266297577446, 0.02407000279366972, 0.012083211967836571, 0.01758857953274018] evs=[0.039436230451638576, 0.04524954656088196, 0.05473733184401432, 0.06773912486076317, 0.07452635556321599, 0.09305239435036294, 0.12108596285718132, -0.39379665413775883, -0.6140353649962962]"}], "score_patterns": []}
{"event": "refresh_compiler_inputs", "utc": "2026-09-07T05:50:15+00:00", "files": ["crates/solver/src/preflop/kernels.cu"], "reason": "Content changes must invalidate Cargo even after copies preserving old mtimes"}
{"event": "run", "id": "E033", "path": "preflop_cuda", "hypothesis": "Use shared terminal masses only for generic3/5/7/9-seat kernels while preserving specialized common kernels", "status": "candidate", "utc": "2026-09-07T05:51:23+00:00", "commit": "324a69097dfce7a2a876a8f7b8fb645fd2bd128f", "seconds": 67.859, "diagnostic_peak_process_mb": 8230.679, "returncode": 0, "command": ["cargo", "test", "--release", "-p", "solver", "--features", "gpu", "--test", "preflop_generic_perf", "--test", "preflop_perf", "--test", "cuda_resources", "--", "--ignored", "--nocapture", "--test-threads=1"], "env": [], "metrics": {"preflop.3.iteration_ms": 0.23, "preflop.3.check_ms": 0.525, "preflop.3.sync_ms": 0.063, "preflop.5.iteration_ms": 2.754, "preflop.5.check_ms": 2.538, "preflop.5.sync_ms": 4.136, "preflop.7.iteration_ms": 12.328, "preflop.7.check_ms": 8.582, "preflop.7.sync_ms": 16.566, "preflop.9.iteration_ms": 251.787, "preflop.9.check_ms": 161.789, "preflop.9.sync_ms": 293.842, "preflop.2.iteration_ms": 0.081, "preflop.2.check_ms": 0.26, "preflop.2.sync_ms": 0.017, "preflop.6.iteration_ms": 16.592, "preflop.6.check_ms": 12.162, "preflop.6.sync_ms": 26.62, "preflop.8.iteration_ms": 57.988, "preflop.8.check_ms": 39.808, "preflop.8.sync_ms": 69.246}, "checks": [{"area": "postflop", "kernel": "down_action", "local_bytes_per_thread": 0, "registers": 48, "static_shared_bytes": 0}, {"area": "postflop", "kernel": "up_action", "local_bytes_per_thread": 0, "registers": 66, "static_shared_bytes": 0}, {"area": "postflop", "kernel": "up_action_eval", "local_bytes_per_thread": 0, "registers": 40, "static_shared_bytes": 0}, {"area": "postflop", "kernel": "up_show", "local_bytes_per_thread": 0, "registers": 40, "static_shared_bytes": 1040}, {"area": "postflop", "kernel": "up_fold", "local_bytes_per_thread": 0, "registers": 40, "static_shared_bytes": 1232}, {"area": "preflop", "kernel": "pf_down", "local_bytes_per_thread": 64, "registers": 40, "static_shared_bytes": 0}, {"area": "preflop", "kernel": "pf_up", "local_bytes_per_thread": 64, "registers": 40, "static_shared_bytes": 0}, {"area": "preflop", "kernel": "pf_terminal", "local_bytes_per_thread": 0, "registers": 40, "static_shared_bytes": 44}, {"area": "preflop", "kernel": "pf_reach_mass", "local_bytes_per_thread": 0, "registers": 12, "static_shared_bytes": 1024}, {"area": "preflop", "kernel": "pf_terminal_2", "local_bytes_per_thread": 0, "registers": 40, "static_shared_bytes": 0}, {"area": "preflop", "kernel": "pf_terminal_6", "local_bytes_per_thread": 0, "registers": 48, "static_shared_bytes": 0}, {"area": "preflop", "kernel": "pf_terminal_8", "local_bytes_per_thread": 0, "registers": 64, "static_shared_bytes": 0}, {"preflop": "PERF seats=3 nodes=430 iteration_ms=0.230 check_ms=0.525 sync_ms=0.063 arena_hash=ad8e0571988ea8d1 gaps=[0.05411917144329437, 0.020649702738510856, 0.023660626623397518] evs=[0.18057702354014996, -0.2964069280900554, -0.40403772274038074]"}, {"preflop": "PERF seats=5 nodes=25666 iteration_ms=2.754 check_ms=2.538 sync_ms=4.136 arena_hash=eacd3b740ba36a87 gaps=[0.025314965158686198, 0.024440227289712735, 0.05095333293826351, 0.02204052445371546, 0.035784321232043226] evs=[0.10492140038019776, 0.12720748057673634, 0.16157980442678233, -0.3295918169553824, -0.5837288241230508]"}, {"preflop": "PERF seats=7 nodes=101410 iteration_ms=12.328 check_ms=8.582 sync_ms=16.566 arena_hash=4d7fd195a99ae236 gaps=[0.03553805162282347, 0.007648762560631045, 0.01097738780437467, 0.014944471542742727, 0.016296028635770565, 0.012559587798595728, 0.010483293730444543] evs=[0.05280050956560466, 0.0656873532014755, 0.0779941161034474, 0.09649242795931973, 0.13524390893043642, -0.38923558977054057, -0.5455678317382016]"}, {"preflop": "PERF seats=9 nodes=1825426 iteration_ms=251.787 check_ms=161.789 sync_ms=293.842 arena_hash=c0e1bd383cfd2aff gaps=[0.02448954424457915, 0.02070868826099758, 0.012772372472253046, 0.010359589852781348, 0.017246776149790838, 0.017663266297577446, 0.02407000279366972, 0.012083211967836571, 0.01758857953274018] evs=[0.039436230451638576, 0.04524954656088196, 0.05473733184401432, 0.06773912486076317, 0.07452635556321599, 0.09305239435036294, 0.12108596285718132, -0.39379665413775883, -0.6140353649962962]"}, {"preflop": "PERF seats=2 nodes=40 iteration_ms=0.081 check_ms=0.260 sync_ms=0.017 arena_hash=6d4781fae03e3474 gaps=[0.05088935968248226, 0.013161917444424076] evs=[-0.15795953824550446, -0.4142353804778675]"}, {"preflop": "PERF seats=6 nodes=166090 iteration_ms=16.592 check_ms=12.162 sync_ms=26.620 arena_hash=b70284af63586e3f gaps=[0.10415872559930028, 0.03471900474586882, 0.05645132130650671, 0.04355598961220011, 0.02566278444731196, 0.025583227687036025] evs=[0.08985395657613165, 0.11143259696531381, 0.13262513589238922, 0.15984876666632344, -0.3195691149045554, -0.4656351703726333]"}, {"preflop": "PERF seats=8 nodes=434350 iteration_ms=57.988 check_ms=39.808 sync_ms=69.246 arena_hash=e01dd7a18632644d gaps=[0.022654395639749164, 0.010278385995560232, 0.008437781286659882, 0.011345792287176693, 0.011192070283014638, 0.012086956929344556, 0.01380422891560007, 0.011174031925715422] evs=[0.04857087063871364, 0.05480589083850633, 0.06796224413352651, 0.07993621403632675, 0.0996648260883227, 0.13493690699672048, -0.39486055394849295, -0.5856126067014387]"}], "score_patterns": []}
{"event": "refresh_compiler_inputs", "utc": "2026-09-07T05:52:36+00:00", "files": ["crates/solver/src/preflop/gpu.rs", "crates/solver/src/preflop/kernels.cu"], "reason": "Content changes must invalidate Cargo even after copies preserving old mtimes"}
{"event": "harness_diagnostic_extended", "utc": "2026-09-07T05:53:37.650168+00:00", "file": "crates/solver/tests/cuda_resources.rs", "old_sha256": "5c4c21d22814cc3c9e61eaf8e8b309e268cc721fb76e07064e4cd5198da7f5d7", "sha256": "73561979ee66234a55967f237838bf1d73171414cfaa0ffff6c088a7c0c07c22", "reason": "Report optional new3/4/5/7/9 terminal entry-point resources; mandatory kernels, compiler flags and timing/correctness harnesses unchanged"}
