{"event": "run", "id": "E025BR", "path": "preflop_cuda", "hypothesis": "Repeat separate terminal entry points with preflop GPU and budget tests; collect immediate postflop timing/capacity control before CFV lifetime reuse", "status": "candidate", "utc": "2026-09-07T04:53:08+00:00", "commit": "8f2a92c7b9819ccd729ae1e26060ee4169113cbf", "seconds": 47.687, "diagnostic_peak_process_mb": 4205.13, "returncode": 0, "command": ["cargo", "test", "--release", "-p", "solver", "--features", "gpu", "--test", "preflop_perf", "--test", "preflop_gpu", "--test", "preflop_budget", "--test", "postflop_perf", "--test", "postflop_capacity_perf", "--", "--include-ignored", "--nocapture", "--test-threads=1"], "env": [], "metrics": {"postflop.Ks7h2d.iso.allocated_vram_mb": 6241.124352, "postflop.Ks7h2d.iso.estimated_vram_mb": 6716.6347, "postflop.Ks7h2d.iso.init_ms": 958.9462, "postflop.Ks7h2d.iso.plan_build_ms": 101.8055, "postflop.Ks7h2d.iso.staging_memory_mb": 3380.293588, "postflop.Ks7s2d.iso.allocated_vram_mb": 4932.501504, "postflop.Ks7s2d.iso.estimated_vram_mb": 6737.546704, "postflop.Ks7s2d.iso.init_ms": 661.6857, "postflop.Ks7s2d.iso.plan_build_ms": 94.8851, "postflop.Ks7s2d.iso.staging_memory_mb": 2063.622928, "postflop.Ks7s2d.full.allocated_vram_mb": 6274.678784, "postflop.Ks7s2d.full.estimated_vram_mb": 6737.546704, "postflop.Ks7s2d.full.init_ms": 745.6814, "postflop.Ks7s2d.full.plan_build_ms": 98.5857, "postflop.Ks7s2d.full.staging_memory_mb": 3391.473816, "postflop.Ks7h2d.init_ms": 1272.236, "postflop.Ks7h2d.iteration_ms": 52.444, "postflop.Ks7h2d.check_ms": 35.472, "postflop.Ks7s2d.init_ms": 850.005, "postflop.Ks7s2d.iteration_ms": 31.759, "postflop.Ks7s2d.check_ms": 28.667, "postflop.Ks7h2dQhTc.init_ms": 64.713, "postflop.Ks7h2dQhTc.iteration_ms": 0.257, "postflop.Ks7h2dQhTc.check_ms": 0.594, "preflop.2.iteration_ms": 0.085, "preflop.2.check_ms": 0.309, "preflop.2.sync_ms": 0.023, "preflop.6.iteration_ms": 16.183, "preflop.6.check_ms": 11.999, "preflop.6.sync_ms": 24.731, "preflop.8.iteration_ms": 60.351, "preflop.8.check_ms": 38.857, "preflop.8.sync_ms": 67.14}, "checks": [{"board": "Ks7h2d", "nodes": 1346813, "use_isomorphism": true}, {"board": "Ks7s2d", "nodes": 1346813, "use_isomorphism": true}, {"board": "Ks7s2d", "nodes": 1346813, "use_isomorphism": false}, {"postflop": "POSTFLOP board=Ks7h2d rake=0 nodes=1346813 init_ms=1272.236 iteration_ms=52.444 check_ms=35.472 exploit_chips=1.698464289"}, {"postflop": "POSTFLOP board=Ks7s2d rake=0.05 nodes=1346813 init_ms=850.005 iteration_ms=31.759 check_ms=28.667 exploit_chips=1.329163551"}, {"postflop": "POSTFLOP board=Ks7h2dQhTc rake=0.05 nodes=33 init_ms=64.713 iteration_ms=0.257 check_ms=0.594 exploit_chips=0.140634178"}, {"all_arena_gap_ev_bits_equal": true, "iteration": 65, "seats": 6, "tight_budget_mb": 550}, {"all_arena_gap_ev_bits_equal": true, "iteration": 65, "seats": 8, "tight_budget_mb": 1350}, {"preflop": "PERF seats=2 nodes=40 iteration_ms=0.085 check_ms=0.309 sync_ms=0.023 arena_hash=6d4781fae03e3474 gaps=[0.05088935968248226, 0.013161917444424076] evs=[-0.15795953824550446, -0.4142353804778675]"}, {"preflop": "PERF seats=6 nodes=166090 iteration_ms=16.183 check_ms=11.999 sync_ms=24.731 arena_hash=b70284af63586e3f gaps=[0.10415872559930028, 0.03471900474586882, 0.05645132130650671, 0.04355598961220011, 0.02566278444731196, 0.025583227687036025] evs=[0.08985395657613165, 0.11143259696531381, 0.13262513589238922, 0.15984876666632344, -0.3195691149045554, -0.4656351703726333]"}, {"preflop": "PERF seats=8 nodes=434350 iteration_ms=60.351 check_ms=38.857 sync_ms=67.140 arena_hash=e01dd7a18632644d gaps=[0.022654395639749164, 0.010278385995560232, 0.008437781286659882, 0.011345792287176693, 0.011192070283014638, 0.012086956929344556, 0.01380422891560007, 0.011174031925715422] evs=[0.04857087063871364, 0.05480589083850633, 0.06796224413352651, 0.07993621403632675, 0.0996648260883227, 0.13493690699672048, -0.39486055394849295, -0.5856126067014387]"}], "score_patterns": []}
{"event": "decision", "id": "E025", "status": "discard", "reason": "Superseded by separately dispatched E025B kernels, which preserve generic table-size resource usage and further improve eight-seat timing", "utc": "2026-09-07T04:54:47+00:00"}
{"event": "decision", "id": "E025R", "status": "discard", "reason": "Superseded by separately dispatched E025B kernels, which preserve generic table-size resource usage and further improve eight-seat timing", "utc": "2026-09-07T04:54:47+00:00"}
{"event": "decision", "id": "E025B", "status": "keep", "reason": "Repeated large-game speed gains; specialized 2/6/8 terminal entries have zero local memory, generic resources unchanged; all 48 variants and full-size state fingerprints exact; preflop GPU and tight-budget tests pass", "utc": "2026-09-07T04:54:59+00:00"}
{"event": "decision", "id": "E025BR", "status": "keep", "reason": "Repeated large-game speed gains; specialized 2/6/8 terminal entries have zero local memory, generic resources unchanged; all 48 variants and full-size state fingerprints exact; preflop GPU and tight-budget tests pass", "utc": "2026-09-07T04:54:59+00:00"}
{"event": "promote", "files": ["crates/solver/src/preflop/gpu.rs", "crates/solver/src/preflop/kernels.cu"], "commit": "8f2a92c7b9819ccd729ae1e26060ee4169113cbf", "utc": "2026-09-07T04:55:11+00:00"}
