{"event": "decision", "id": "E028", "status": "keep", "reason": "Repeated6-seat iteration16.94/17.00ms vs17.59ms and8-seat58.43/57.51ms vs60.30ms; all full arena/gap/EV fingerprints and48 variants exact;29 unit and5 preflop GPU tests pass. Generic fallback retains64-byte local reservation; the gain is common-case scalarization rather than removal of every local allocation.", "utc": "2026-09-07T05:22:24+00:00"}
{"event": "decision", "id": "E028R", "status": "keep", "reason": "Repeated6-seat iteration16.94/17.00ms vs17.59ms and8-seat58.43/57.51ms vs60.30ms; all full arena/gap/EV fingerprints and48 variants exact;29 unit and5 preflop GPU tests pass. Generic fallback retains64-byte local reservation; the gain is common-case scalarization rather than removal of every local allocation.", "utc": "2026-09-07T05:22:24+00:00"}
{"event": "promote", "files": ["crates/solver/src/preflop/kernels.cu"], "commit": "a6a2e0a2afb85e5e3577a81fe8e8930543ed2229", "utc": "2026-09-07T05:22:42+00:00"}
{"event": "run", "id": "B031", "path": "baseline", "hypothesis": "Steady preflop check control including retained action specialization, before evaluation graphs", "status": "baseline", "utc": "2026-09-07T05:23:07+00:00", "commit": "a6a2e0a2afb85e5e3577a81fe8e8930543ed2229", "seconds": 23.64, "diagnostic_peak_process_mb": 1045.848, "returncode": 0, "command": ["cargo", "test", "--release", "-p", "solver", "--features", "gpu", "--test", "gpu_check_perf", "preflop_checks", "--", "--ignored", "--nocapture", "--test-threads=1"], "env": [], "metrics": {"preflop.2.first_check_ms": 0.4545, "preflop.2.second_check_ms": 0.40509999999999996, "preflop.2.steady_check_ms": 0.423575, "preflop.6.first_check_ms": 12.7186, "preflop.6.second_check_ms": 13.538400000000001, "preflop.6.steady_check_ms": 13.198649999999999, "preflop.8.first_check_ms": 38.9525, "preflop.8.second_check_ms": 38.1159, "preflop.8.steady_check_ms": 39.509725}, "checks": [{"check_ev_bits": [13818231149285967788, 13824505857993336927], "check_gap_bits": [4587494750677495240, 4578740950612821696], "check_iteration": 65, "check_seats": 2}, {"check_ev_bits": [4591139080588829428, 4592693985497883551, 4593946344391214828, 4594927179058488125, 13822800502159894828, 13825431794291804883], "check_gap_bits": [4592169847827907240, 4585164356934551850, 4588296313823012216, 4586437900670586676, 4583054015422772960, 4583031084747833216], "check_iteration": 65, "check_seats": 6}, {"check_ev_bits": [4587160621192900714, 4588059182301650598, 4589561616460845131, 4590424431923123478, 4591846028241297974, 4594029634723087085, 13824156832147184690, 13826821985834700352], "check_gap_bits": [4582186906385158536, 4577078707904519064, 4576017671529333144, 4577694025738397696, 4577605411036232848, 4578121278065602480, 4579111217966708928, 4577595012631213824], "check_iteration": 65, "check_seats": 8}], "score_patterns": []}
{"event": "refresh_compiler_inputs", "utc": "2026-09-07T05:23:44+00:00", "files": ["crates/solver/src/preflop/gpu.rs"], "reason": "Content changes must invalidate Cargo even after copies preserving old mtimes"}
