{"event": "run", "id": "E024C", "path": "memory_transfers", "hypothesis": "Restore compact action arenas with vectorizable bitwise zero-block detection; measure complete cold/warm host-memory and transfer tradeoffs against B026", "status": "candidate", "utc": "2026-09-07T04:31:01+00:00", "commit": "ffe12e97cf9554dd9f22c7e891ba74270b22b3d2", "seconds": 90.016, "diagnostic_peak_process_mb": 5764.309, "returncode": 0, "command": ["cargo", "test", "--release", "-p", "solver", "--features", "gpu", "--test", "postflop_memory_perf", "--test", "postflop_resume_state", "--", "--ignored", "--nocapture", "--test-threads=1"], "env": [], "metrics": {"postflop.memory.cold.f32.allocated_vram_mb": 3825.205248, "postflop.memory.cold.f32.host_live_mb": 4462.977024, "postflop.memory.cold.f32.host_private_mb": 8879.849472, "postflop.memory.cold.f32.init_ms": 1248.8847999999998, "postflop.memory.cold.f32.strategy_sync_ms": 219.95780000000002, "postflop.memory.cold.f32.sync_ms": 432.18580000000003, "postflop.memory.warm.f32.allocated_vram_mb": 3825.205248, "postflop.memory.warm.f32.host_live_mb": 5729.222656, "postflop.memory.warm.f32.host_private_mb": 10288.64, "postflop.memory.warm.f32.init_ms": 1613.8884, "postflop.memory.warm.f32.strategy_sync_ms": 253.7218, "postflop.memory.warm.f32.sync_ms": 489.9636, "postflop.memory.cold.compressed.allocated_vram_mb": 3825.205248, "postflop.memory.cold.compressed.host_live_mb": 2754.715648, "postflop.memory.cold.compressed.host_private_mb": 7163.133952, "postflop.memory.cold.compressed.init_ms": 903.4918, "postflop.memory.cold.compressed.strategy_sync_ms": 449.0752, "postflop.memory.cold.compressed.sync_ms": 899.7561, "postflop.memory.warm.compressed.allocated_vram_mb": 3825.205248, "postflop.memory.warm.compressed.host_live_mb": 4155.482112, "postflop.memory.warm.compressed.host_private_mb": 8510.6688, "postflop.memory.warm.compressed.init_ms": 1337.3429999999998, "postflop.memory.warm.compressed.strategy_sync_ms": 665.8615, "postflop.memory.warm.compressed.sync_ms": 1352.1607}, "checks": [{"memory_checks": [{"exploit_bits": 4635171514568527266, "iteration": 5}, {"exploit_bits": 4628956113180057410, "iteration": 10}, {"exploit_bits": 4624490585901877567, "iteration": 15}], "storage": "F32", "warm": false}, {"memory_checks": [{"exploit_bits": 4619248813860274839, "iteration": 25}, {"exploit_bits": 4617407200860962841, "iteration": 30}, {"exploit_bits": 4616217340056387513, "iteration": 35}], "storage": "F32", "warm": true}, {"memory_checks": [{"exploit_bits": 4635171514568527266, "iteration": 5}, {"exploit_bits": 4628919606694372554, "iteration": 10}, {"exploit_bits": 4624481349270140468, "iteration": 15}], "storage": "Compressed", "warm": false}, {"memory_checks": [{"exploit_bits": 4619250289695226916, "iteration": 25}, {"exploit_bits": 4617408694201541058, "iteration": 30}, {"exploit_bits": 4616218029189393624, "iteration": 35}], "storage": "Compressed", "warm": true}, {"board": "KsQs2d", "exploit_bits": 4602578713680545664, "inactive": 1421, "iso": false, "queries": ["e2c492c87cf6e4be", "f8f2089e2e434f23"], "resume_states": [{"iteration": 0, "raw_hash": "6efe33310c55f1a5", "save_hash": "6a075d97c7c6db7d", "stage": "initial"}, {"iteration": 7, "raw_hash": "48660e632ad5b879", "save_hash": "0cad57bbdb96d314", "stage": "first_sync"}, {"iteration": 7, "raw_hash": "48660e632ad5b879", "save_hash": "0cad57bbdb96d314", "stage": "materialized"}, {"iteration": 7, "raw_hash": "48660e632ad5b879", "save_hash": "0cad57bbdb96d314", "stage": "strategy_resync"}, {"iteration": 7, "raw_hash": "48660e632ad5b879", "save_hash": "0cad57bbdb96d314", "stage": "full_resync"}, {"iteration": 16, "raw_hash": "4af1446f1da731d4", "save_hash": "f49ee8e1043ada28", "stage": "locked_sync"}, {"iteration": 21, "raw_hash": "44a3c523163fe3dd", "save_hash": "ed5bbdcbc4ea1e77", "stage": "resumed"}], "resumed_exploit_bits": 4599028146264155440, "storage": "F32", "warm": false}, {"board": "KsQs2d", "exploit_bits": 4599332415581787700, "inactive": 1421, "iso": false, "queries": ["11e25aea6c80dcbd", "c4cc76aafe4a8729"], "resume_states": [{"iteration": 4, "raw_hash": "9ee052d258356aaa", "save_hash": "d1c47c4996956c82", "stage": "initial"}, {"iteration": 11, "raw_hash": "b7e1741412e607b7", "save_hash": "334acc8fa7b11d9b", "stage": "first_sync"}, {"iteration": 11, "raw_hash": "b7e1741412e607b7", "save_hash": "334acc8fa7b11d9b", "stage": "materialized"}, {"iteration": 11, "raw_hash": "b7e1741412e607b7", "save_hash": "334acc8fa7b11d9b", "stage": "strategy_resync"}, {"iteration": 11, "raw_hash": "b7e1741412e607b7", "save_hash": "334acc8fa7b11d9b", "stage": "full_resync"}, {"iteration": 20, "raw_hash": "ae2d52b96cc8effa", "save_hash": "a9ada8b1b42fb75a", "stage": "locked_sync"}, {"iteration": 25, "raw_hash": "90336a88c26f3a01", "save_hash": "0c13e01724fbecaa", "stage": "resumed"}], "resumed_exploit_bits": 4596408297456974656, "storage": "F32", "warm": true}, {"board": "KsQs2d", "exploit_bits": 4602587915789417860, "inactive": 28331, "iso": true, "queries": ["1409097d1e006bbf", "545f76eb89bd277c"], "resume_states": [{"iteration": 0, "raw_hash": "a35d4b23e4e67da5", "save_hash": "ed177c389687447d", "stage": "initial"}, {"iteration": 7, "raw_hash": "51c9980460428ee6", "save_hash": "21d622302bba980f", "stage": "first_sync"}, {"iteration": 7, "raw_hash": "4669959a131153b3", "save_hash": "01e3df03e2f7b052", "stage": "materialized"}, {"iteration": 7, "raw_hash": "0581d09dbd38e210", "save_hash": "44976d3782490831", "stage": "strategy_resync"}, {"iteration": 7, "raw_hash": "51c9980460428ee6", "save_hash": "21d622302bba980f", "stage": "full_resync"}, {"iteration": 16, "raw_hash": "63567463789d999e", "save_hash": "09faa84d107d5dc4", "stage": "locked_sync"}, {"iteration": 21, "raw_hash": "4ddc8c2d9ffb194c", "save_hash": "a9fb3e03bbdfcf20", "stage": "resumed"}], "resumed_exploit_bits": 4599029879454001440, "storage": "F32", "warm": false}, {"board": "KsQs2d", "exploit_bits": 4599385826049268552, "inactive": 28331, "iso": true, "queries": ["01bd2f5d8365263f", "2d419480c54838a7"], "resume_states": [{"iteration": 4, "raw_hash": "9ee052d258356aaa", "save_hash": "d1c47c4996956c82", "stage": "initial"}, {"iteration": 11, "raw_hash": "78fdb1fff07eae56", "save_hash": "884e678fb2d9ef72", "stage": "first_sync"}, {"iteration": 11, "raw_hash": "16ba5bef99aa75cd", "save_hash": "2244f4b62540d555", "stage": "materialized"}, {"iteration": 11, "raw_hash": "d698cd79726c2e38", "save_hash": "722833541a695f70", "stage": "strategy_resync"}, {"iteration": 11, "raw_hash": "78fdb1fff07eae56", "save_hash": "884e678fb2d9ef72", "stage": "full_resync"}, {"iteration": 20, "raw_hash": "9d1f4ecc8bdaa2e4", "save_hash": "477b20cd0b34e90b", "stage": "locked_sync"}, {"iteration": 25, "raw_hash": "5712eb06a899e447", "save_hash": "c02051e5a0073d05", "stage": "resumed"}], "resumed_exploit_bits": 4596475378414907108, "storage": "F32", "warm": true}, {"board": "KsQs2d", "exploit_bits": 4602579154013779002, "inactive": 1421, "iso": false, "queries": ["d17f0834eb2e81d4", "03faa827ff2fdb7d"], "resume_states": [{"iteration": 0, "raw_hash": "fcad077cf7d2dde5", "save_hash": "3e1697b3c7ce477d", "stage": "initial"}, {"iteration": 7, "raw_hash": "e25b4b9cf3826400", "save_hash": "e1a67592e0a8ab71", "stage": "first_sync"}, {"iteration": 7, "raw_hash": "e25b4b9cf3826400", "save_hash": "e1a67592e0a8ab71", "stage": "materialized"}, {"iteration": 7, "raw_hash": "e25b4b9cf3826400", "save_hash": "e1a67592e0a8ab71", "stage": "strategy_resync"}, {"iteration": 7, "raw_hash": "e25b4b9cf3826400", "save_hash": "e1a67592e0a8ab71", "stage": "full_resync"}, {"iteration": 16, "raw_hash": "d2ce843f596cfdbe", "save_hash": "6b22f606eeffb249", "stage": "locked_sync"}, {"iteration": 21, "raw_hash": "1500af0975bcd083", "save_hash": "6d9d58fa1fa2cb5c", "stage": "resumed"}], "resumed_exploit_bits": 4599027087966486304, "storage": "Compressed", "warm": false}, {"board": "KsQs2d", "exploit_bits": 4599389224566682102, "inactive": 1421, "iso": false, "queries": ["93430df5071b4389", "0e13065304e61e27"], "resume_states": [{"iteration": 4, "raw_hash": "91333e7e3524d601", "save_hash": "a3d4302dbe04bce2", "stage": "initial"}, {"iteration": 11, "raw_hash": "56a1dd2ad2e719ed", "save_hash": "1154f1894b6d8887", "stage": "first_sync"}, {"iteration": 11, "raw_hash": "56a1dd2ad2e719ed", "save_hash": "1154f1894b6d8887", "stage": "materialized"}, {"iteration": 11, "raw_hash": "56a1dd2ad2e719ed", "save_hash": "1154f1894b6d8887", "stage": "strategy_resync"}, {"iteration": 11, "raw_hash": "56a1dd2ad2e719ed", "save_hash": "1154f1894b6d8887", "stage": "full_resync"}, {"iteration": 20, "raw_hash": "42c9df1515cbd777", "save_hash": "129eac2ca2931680", "stage": "locked_sync"}, {"iteration": 25, "raw_hash": "b0267981dd6a131e", "save_hash": "aabeeb67bf029fb2", "stage": "resumed"}], "resumed_exploit_bits": 4596450857652247244, "storage": "Compressed", "warm": true}, {"board": "KsQs2d", "exploit_bits": 4602587911898015366, "inactive": 28331, "iso": true, "queries": ["f79152071c7ca9ea", "e370f15c3d98e2d6"], "resume_states": [{"iteration": 0, "raw_hash": "fcad077cf7d2dde5", "save_hash": "3e1697b3c7ce477d", "stage": "initial"}, {"iteration": 7, "raw_hash": "9ec7e4f00bb9770b", "save_hash": "3f7c03894afd13ec", "stage": "first_sync"}, {"iteration": 7, "raw_hash": "0b7f7d46823ab408", "save_hash": "5682308c2a3f638e", "stage": "materialized"}, {"iteration": 7, "raw_hash": "8054c275c542593c", "save_hash": "d41ecc7643faf1e4", "stage": "strategy_resync"}, {"iteration": 7, "raw_hash": "9ec7e4f00bb9770b", "save_hash": "3f7c03894afd13ec", "stage": "full_resync"}, {"iteration": 16, "raw_hash": "10d79a3701a97adb", "save_hash": "c4884f24205d712b", "stage": "locked_sync"}, {"iteration": 21, "raw_hash": "0491ff2e49a7d96d", "save_hash": "5a0bc7ebce515364", "stage": "resumed"}], "resumed_exploit_bits": 4599028044336379776, "storage": "Compressed", "warm": false}, {"board": "KsQs2d", "exploit_bits": 4599327386543095910, "inactive": 28331, "iso": true, "queries": ["1aa8706d72bc7e42", "9b6f9fdb16d579f4"], "resume_states": [{"iteration": 4, "raw_hash": "91333e7e3524d601", "save_hash": "a3d4302dbe04bce2", "stage": "initial"}, {"iteration": 11, "raw_hash": "69446a2f27ef2ca8", "save_hash": "2cdc5c02057a6e49", "stage": "first_sync"}, {"iteration": 11, "raw_hash": "deef52b36293d720", "save_hash": "94652fb67a1b53ae", "stage": "materialized"}, {"iteration": 11, "raw_hash": "e49482b897b878de", "save_hash": "7e27024ea493da0b", "stage": "strategy_resync"}, {"iteration": 11, "raw_hash": "69446a2f27ef2ca8", "save_hash": "2cdc5c02057a6e49", "stage": "full_resync"}, {"iteration": 20, "raw_hash": "2c77b0579713148c", "save_hash": "0e4c7ea2f16e958c", "stage": "locked_sync"}, {"iteration": 25, "raw_hash": "a6d057434936e258", "save_hash": "5f5a1718e9e95665", "stage": "resumed"}], "resumed_exploit_bits": 4596461339885700988, "storage": "Compressed", "warm": true}, {"board": "KsQs2dJd", "exploit_bits": 4593492244551533040, "inactive": 0, "iso": false, "queries": ["bcc3ea1b1db11956", "fe959fc894b96bf5"], "resume_states": [{"iteration": 0, "raw_hash": "3b418c5d262f0425", "save_hash": "f2a87b9043356263", "stage": "initial"}, {"iteration": 7, "raw_hash": "57d14afcdfc69503", "save_hash": "8a4e696c929f26d0", "stage": "first_sync"}, {"iteration": 7, "raw_hash": "57d14afcdfc69503", "save_hash": "8a4e696c929f26d0", "stage": "materialized"}, {"iteration": 7, "raw_hash": "57d14afcdfc69503", "save_hash": "8a4e696c929f26d0", "stage": "strategy_resync"}, {"iteration": 7, "raw_hash": "57d14afcdfc69503", "save_hash": "8a4e696c929f26d0", "stage": "full_resync"}, {"iteration": 16, "raw_hash": "bdc5323e2ca4239f", "save_hash": "d1a1d8133afb4cae", "stage": "locked_sync"}, {"iteration": 21, "raw_hash": "49d30427d3f47b78", "save_hash": "d28aa1da24c4563f", "stage": "resumed"}], "resumed_exploit_bits": 4591609752914400816, "storage": "F32", "warm": false}, {"board": "KsQs2dJd", "exploit_bits": 4590986155395317520, "inactive": 0, "iso": false, "queries": ["0be619db35cb9c88", "534952df123a2be5"], "resume_states": [{"iteration": 4, "raw_hash": "3f4ef7e0b5ec8a7f", "save_hash": "41be08502bd010e9", "stage": "initial"}, {"iteration": 11, "raw_hash": "444db559076f6311", "save_hash": "460c1fa9e858caa3", "stage": "first_sync"}, {"iteration": 11, "raw_hash": "444db559076f6311", "save_hash": "460c1fa9e858caa3", "stage": "materialized"}, {"iteration": 11, "raw_hash": "444db559076f6311", "save_hash": "460c1fa9e858caa3", "stage": "strategy_resync"}, {"iteration": 11, "raw_hash": "444db559076f6311", "save_hash": "460c1fa9e858caa3", "stage": "full_resync"}, {"iteration": 20, "raw_hash": "bb9dfc0577d0a07b", "save_hash": "9d0f1545a802642f", "stage": "locked_sync"}, {"iteration": 25, "raw_hash": "595a618710730c5c", "save_hash": "adb01e5ad7dfbc39", "stage": "resumed"}], "resumed_exploit_bits": 4588498413657077568, "storage": "F32", "warm": true}, {"board": "KsQs2dJd", "exploit_bits": 4593492233496039344, "inactive": 143, "iso": true, "queries": ["60d3fb51a06bbfe4", "b2a4ac9204a12b33"], "resume_states": [{"iteration": 0, "raw_hash": "72feef5d6ce18425", "save_hash": "3880cc2e74974b63", "stage": "initial"}, {"iteration": 7, "raw_hash": "c906d028d0faedff", "save_hash": "bf8dc4771bd0db60", "stage": "first_sync"}, {"iteration": 7, "raw_hash": "53485ed98975d374", "save_hash": "50f12a193bea99a7", "stage": "materialized"}, {"iteration": 7, "raw_hash": "4f875f4df4e47480", "save_hash": "b01d2da08f9c2873", "stage": "strategy_resync"}, {"iteration": 7, "raw_hash": "c906d028d0faedff", "save_hash": "bf8dc4771bd0db60", "stage": "full_resync"}, {"iteration": 16, "raw_hash": "40efd4506f7f51a6", "save_hash": "f90cca928973cbda", "stage": "locked_sync"}, {"iteration": 21, "raw_hash": "879a9dc7c48f3e53", "save_hash": "a52b4ff311d86509", "stage": "resumed"}], "resumed_exploit_bits": 4591609747553279968, "storage": "F32", "warm": false}, {"board": "KsQs2dJd", "exploit_bits": 4590986159761108784, "inactive": 143, "iso": true, "queries": ["e38df16b8f265de6", "a92bc718e97d3ba1"], "resume_states": [{"iteration": 4, "raw_hash": "3f4ef7e0b5ec8a7f", "save_hash": "41be08502bd010e9", "stage": "initial"}, {"iteration": 11, "raw_hash": "aec46fe5c1c16589", "save_hash": "296b4009ac43bc9b", "stage": "first_sync"}, {"iteration": 11, "raw_hash": "6d3c14cc47893c62", "save_hash": "5231a7d6d9e39758", "stage": "materialized"}, {"iteration": 11, "raw_hash": "9855d73d796d10b2", "save_hash": "ccba5e2a9fa09bbc", "stage": "strategy_resync"}, {"iteration": 11, "raw_hash": "aec46fe5c1c16589", "save_hash": "296b4009ac43bc9b", "stage": "full_resync"}, {"iteration": 20, "raw_hash": "d492cc5c4652daa1", "save_hash": "44ddb51e96134046", "stage": "locked_sync"}, {"iteration": 25, "raw_hash": "8f2808888b479085", "save_hash": "5306e548327c2255", "stage": "resumed"}], "resumed_exploit_bits": 4588498429120730400, "storage": "F32", "warm": true}, {"board": "KsQs2dJd", "exploit_bits": 4593492238403760368, "inactive": 0, "iso": false, "queries": ["0cd252590a9a37aa", "faecdad76212acdb"], "resume_states": [{"iteration": 0, "raw_hash": "97e039b245303ee5", "save_hash": "f2a87b9043356263", "stage": "initial"}, {"iteration": 7, "raw_hash": "973504273a198267", "save_hash": "ff4dac964152d398", "stage": "first_sync"}, {"iteration": 7, "raw_hash": "973504273a198267", "save_hash": "ff4dac964152d398", "stage": "materialized"}, {"iteration": 7, "raw_hash": "973504273a198267", "save_hash": "ff4dac964152d398", "stage": "strategy_resync"}, {"iteration": 7, "raw_hash": "973504273a198267", "save_hash": "ff4dac964152d398", "stage": "full_resync"}, {"iteration": 16, "raw_hash": "89efa049a0e34bea", "save_hash": "22454accb0bc8860", "stage": "locked_sync"}, {"iteration": 21, "raw_hash": "cacb24b87e68f724", "save_hash": "3776f79766e08b81", "stage": "resumed"}], "resumed_exploit_bits": 4591609527632236640, "storage": "Compressed", "warm": false}, {"board": "KsQs2dJd", "exploit_bits": 4590984449755165376, "inactive": 0, "iso": false, "queries": ["147f8c9488b28c24", "1a5930f9bacb59d4"], "resume_states": [{"iteration": 4, "raw_hash": "a92f40021629abcd", "save_hash": "66bf2aa5c76fbd64", "stage": "initial"}, {"iteration": 11, "raw_hash": "6a6d53ff51916ca8", "save_hash": "3b157891fd45a30d", "stage": "first_sync"}, {"iteration": 11, "raw_hash": "6a6d53ff51916ca8", "save_hash": "3b157891fd45a30d", "stage": "materialized"}, {"iteration": 11, "raw_hash": "6a6d53ff51916ca8", "save_hash": "3b157891fd45a30d", "stage": "strategy_resync"}, {"iteration": 11, "raw_hash": "6a6d53ff51916ca8", "save_hash": "3b157891fd45a30d", "stage": "full_resync"}, {"iteration": 20, "raw_hash": "418219a239f405de", "save_hash": "7d5bded75cdda31b", "stage": "locked_sync"}, {"iteration": 25, "raw_hash": "89d74319503bea6e", "save_hash": "fe70acf639c094e6", "stage": "resumed"}], "resumed_exploit_bits": 4588496636820507168, "storage": "Compressed", "warm": true}, {"board": "KsQs2dJd", "exploit_bits": 4593492236549690256, "inactive": 143, "iso": true, "queries": ["4e365f6f7fd4bdbb", "faecdad76212acdb"], "resume_states": [{"iteration": 0, "raw_hash": "97e039b245303ee5", "save_hash": "f2a87b9043356263", "stage": "initial"}, {"iteration": 7, "raw_hash": "27360131f26c3267", "save_hash": "429fe5ee3234555f", "stage": "first_sync"}, {"iteration": 7, "raw_hash": "a2388db5f52ca89d", "save_hash": "08303f696219804e", "stage": "materialized"}, {"iteration": 7, "raw_hash": "cba0664fb381faa4", "save_hash": "e410feb429d914a5", "stage": "strategy_resync"}, {"iteration": 7, "raw_hash": "27360131f26c3267", "save_hash": "429fe5ee3234555f", "stage": "full_resync"}, {"iteration": 16, "raw_hash": "587e44993f75a3d6", "save_hash": "67826c92a89626c4", "stage": "locked_sync"}, {"iteration": 21, "raw_hash": "5674f609be8065d5", "save_hash": "733f2924d483e9b9", "stage": "resumed"}], "resumed_exploit_bits": 4591609471434689008, "storage": "Compressed", "warm": false}, {"board": "KsQs2dJd", "exploit_bits": 4590984433867833488, "inactive": 143, "iso": true, "queries": ["147f8c9488b28c24", "1a5930f9bacb59d4"], "resume_states": [{"iteration": 4, "raw_hash": "a92f40021629abcd", "save_hash": "66bf2aa5c76fbd64", "stage": "initial"}, {"iteration": 11, "raw_hash": "2cbc7eefffc0e858", "save_hash": "d5d623284f27d9dc", "stage": "first_sync"}, {"iteration": 11, "raw_hash": "f8c0805d7c8f179d", "save_hash": "9f0c5c7b6e62acca", "stage": "materialized"}, {"iteration": 11, "raw_hash": "cb23b1995f492414", "save_hash": "f60054fb7eb57f40", "stage": "strategy_resync"}, {"iteration": 11, "raw_hash": "2cbc7eefffc0e858", "save_hash": "d5d623284f27d9dc", "stage": "full_resync"}, {"iteration": 20, "raw_hash": "16b99d557322da33", "save_hash": "f9c2968f43314e15", "stage": "locked_sync"}, {"iteration": 25, "raw_hash": "4210ee1d40d2cc27", "save_hash": "c8af4ba60984cde1", "stage": "resumed"}], "resumed_exploit_bits": 4588496515980919360, "storage": "Compressed", "warm": true}], "score_patterns": ["postflop.memory.*"]}
