{"event": "run", "id": "B001", "path": "baseline", "hypothesis": "Frozen CUDA preflop baseline, current validated implementation", "status": "baseline", "utc": "2026-09-07T00:49:11+00:00", "commit": "bc192bfa0a9b1bd025003fdee3d70ab0d5f8f326", "seconds": 15.516, "diagnostic_peak_process_mb": 1610.273, "returncode": 0, "command": ["cargo", "test", "--release", "-p", "solver", "--features", "gpu", "--test", "preflop_perf", "--", "--ignored", "--nocapture", "--test-threads=1"], "env": [], "metrics": {"preflop.2.iteration_ms": 0.22, "preflop.2.check_ms": 0.281, "preflop.2.sync_ms": 0.027, "preflop.6.iteration_ms": 33.508, "preflop.6.check_ms": 34.513, "preflop.6.sync_ms": 59.988, "preflop.8.iteration_ms": 152.884, "preflop.8.check_ms": 141.242, "preflop.8.sync_ms": 150.459}, "checks": [{"preflop": "PERF seats=2 nodes=40 iteration_ms=0.220 check_ms=0.281 sync_ms=0.027 arena_hash=6d4781fae03e3474 gaps=[0.05088935968248226, 0.013161917444424076] evs=[-0.15795953824550446, -0.4142353804778675]"}, {"preflop": "PERF seats=6 nodes=166090 iteration_ms=33.508 check_ms=34.513 sync_ms=59.988 arena_hash=b70284af63586e3f gaps=[0.10415872559930028, 0.03471900474586882, 0.05645132130650671, 0.04355598961220011, 0.02566278444731196, 0.025583227687036025] evs=[0.08985395657613165, 0.11143259696531381, 0.13262513589238922, 0.15984876666632344, -0.3195691149045554, -0.4656351703726333]"}, {"preflop": "PERF seats=8 nodes=434350 iteration_ms=152.884 check_ms=141.242 sync_ms=150.459 arena_hash=e01dd7a18632644d gaps=[0.022654395639749164, 0.010278385995560232, 0.008437781286659882, 0.011345792287176693, 0.011192070283014638, 0.012086956929344556, 0.01380422891560007, 0.011174031925715422] evs=[0.04857087063871364, 0.05480589083850633, 0.06796224413352651, 0.07993621403632675, 0.0996648260883227, 0.13493690699672048, -0.39486055394849295, -0.5856126067014387]"}]}
{"event": "run", "id": "B002", "path": "baseline", "hypothesis": "Frozen CUDA postflop baseline, wide rainbow and two-tone flops plus river", "status": "baseline", "utc": "2026-09-07T00:49:37+00:00", "commit": "bc192bfa0a9b1bd025003fdee3d70ab0d5f8f326", "seconds": 10.625, "diagnostic_peak_process_mb": 4283.736, "returncode": 0, "command": ["cargo", "test", "--release", "-p", "solver", "--features", "gpu", "--test", "postflop_perf", "--", "--ignored", "--nocapture", "--test-threads=1"], "env": [], "metrics": {"postflop.Ks7h2d.init_ms": 1264.559, "postflop.Ks7h2d.iteration_ms": 59.488, "postflop.Ks7h2d.check_ms": 41.296, "postflop.Ks7s2d.init_ms": 674.325, "postflop.Ks7s2d.iteration_ms": 35.163, "postflop.Ks7s2d.check_ms": 31.888, "postflop.Ks7h2dQhTc.init_ms": 67.607, "postflop.Ks7h2dQhTc.iteration_ms": 0.34, "postflop.Ks7h2dQhTc.check_ms": 0.635}, "checks": [{"postflop": "POSTFLOP board=Ks7h2d rake=0 nodes=1346813 init_ms=1264.559 iteration_ms=59.488 check_ms=41.296 exploit_chips=1.719406689"}, {"postflop": "POSTFLOP board=Ks7s2d rake=0.05 nodes=1346813 init_ms=674.325 iteration_ms=35.163 check_ms=31.888 exploit_chips=1.324327512"}, {"postflop": "POSTFLOP board=Ks7h2dQhTc rake=0.05 nodes=33 init_ms=67.607 iteration_ms=0.340 check_ms=0.635 exploit_chips=0.140634364"}]}
{"event": "run", "id": "B003", "path": "baseline", "hypothesis": "Frozen CPU traversal, reports, profiles, build and save-load baseline", "status": "baseline", "utc": "2026-09-07T00:50:12+00:00", "commit": "bc192bfa0a9b1bd025003fdee3d70ab0d5f8f326", "seconds": 13.937, "diagnostic_peak_process_mb": 802.062, "returncode": 0, "command": ["cargo", "test", "--release", "-p", "solver", "--features", "gpu", "--test", "research_perf", "--", "--ignored", "--nocapture", "--test-threads=1"], "env": [], "metrics": {}, "checks": []}
{"event": "run", "id": "B003", "path": "baseline", "hypothesis": "Frozen CPU traversal, reports, profiles, build and save-load baseline", "status": "baseline", "utc": "2026-09-07T00:50:12+00:00", "commit": "bc192bfa0a9b1bd025003fdee3d70ab0d5f8f326", "seconds": 13.937, "diagnostic_peak_process_mb": 802.062, "returncode": 0, "command": ["cargo", "test", "--release", "-p", "solver", "--features", "gpu", "--test", "research_perf", "--", "--ignored", "--nocapture", "--test-threads=1"], "env": [], "metrics": {"cpu.preflop.arena_mb": 224.552328, "cpu.preflop.check_ms": 1439.9938, "cpu.preflop.iteration_ms": 204.80818, "cpu.postflop.arena_mb": 104.204192, "cpu.postflop.iteration_ms": 34.42082, "lifecycle.build_ms": 9.987400000000001, "lifecycle.compressed_load_ms": 87.3054, "lifecycle.load_ms": 78.935, "lifecycle.profile_ms": 678.3966, "lifecycle.report_lines_ms": 212.4025, "lifecycle.save_mb": 104.204944, "lifecycle.save_ms": 213.86260000000001}, "checks": [{"arena_hash": "3f021c64d7c7a141", "evs": [0.11723085944569259, 0.11294138971777481, 0.06514406696957305, 0.07628515082630205, -0.39683870489050355, -0.46397515173140375], "gaps": [0.941004372452971, 0.10522786080636143, 0.20258109159216667, 0.2029610176426232, 0.15556088815149854, 0.11106866681620509], "iteration": 18, "nodes": 166090}, {"exploitability": 0.36963080697589445, "iteration": 18, "nodes": 208516, "profile_hash": "b0d3ea8a1b19e943", "report_hash": "a757b21c1a6973a3", "save_hash": "b92fb5d3a217da94"}], "parser_correction": "Recognize Rust test-name prefix before METRIC_JSON; original measurement retained."}
{"event": "run", "id": "E001", "path": "preflop_cuda", "hypothesis": "Capture each alternating seat sweep into a CUDA graph to remove repeated launch overhead", "status": "candidate", "utc": "2026-09-07T00:51:33+00:00", "commit": "151e1bd7c761cca2cae7ba70e00de4c5826f8294", "seconds": 50.14, "diagnostic_peak_process_mb": 1614.295, "returncode": 0, "command": ["cargo", "test", "--release", "-p", "solver", "--features", "gpu", "--test", "preflop_perf", "--", "--ignored", "--nocapture", "--test-threads=1"], "env": [], "metrics": {"preflop.2.iteration_ms": 0.094, "preflop.2.check_ms": 0.277, "preflop.2.sync_ms": 0.027, "preflop.6.iteration_ms": 33.016, "preflop.6.check_ms": 35.446, "preflop.6.sync_ms": 64.298, "preflop.8.iteration_ms": 152.021, "preflop.8.check_ms": 142.945, "preflop.8.sync_ms": 160.593}, "checks": [{"preflop": "PERF seats=2 nodes=40 iteration_ms=0.094 check_ms=0.277 sync_ms=0.027 arena_hash=6d4781fae03e3474 gaps=[0.05088935968248226, 0.013161917444424076] evs=[-0.15795953824550446, -0.4142353804778675]"}, {"preflop": "PERF seats=6 nodes=166090 iteration_ms=33.016 check_ms=35.446 sync_ms=64.298 arena_hash=b70284af63586e3f gaps=[0.10415872559930028, 0.03471900474586882, 0.05645132130650671, 0.04355598961220011, 0.02566278444731196, 0.025583227687036025] evs=[0.08985395657613165, 0.11143259696531381, 0.13262513589238922, 0.15984876666632344, -0.3195691149045554, -0.4656351703726333]"}, {"preflop": "PERF seats=8 nodes=434350 iteration_ms=152.021 check_ms=142.945 sync_ms=160.593 arena_hash=e01dd7a18632644d gaps=[0.022654395639749164, 0.010278385995560232, 0.008437781286659882, 0.011345792287176693, 0.011192070283014638, 0.012086956929344556, 0.01380422891560007, 0.011174031925715422] evs=[0.04857087063871364, 0.05480589083850633, 0.06796224413352651, 0.07993621403632675, 0.0996648260883227, 0.13493690699672048, -0.39486055394849295, -0.5856126067014387]"}]}
{"event": "run", "id": "E001R", "path": "preflop_cuda", "hypothesis": "Repeat CUDA graph timings and verify identical preflop state fingerprints", "status": "candidate", "utc": "2026-09-07T00:52:24+00:00", "commit": "151e1bd7c761cca2cae7ba70e00de4c5826f8294", "seconds": 15.218, "diagnostic_peak_process_mb": 1603.129, "returncode": 0, "command": ["cargo", "test", "--release", "-p", "solver", "--features", "gpu", "--test", "preflop_perf", "--", "--ignored", "--nocapture", "--test-threads=1"], "env": [], "metrics": {"preflop.2.iteration_ms": 0.1, "preflop.2.check_ms": 0.354, "preflop.2.sync_ms": 0.035, "preflop.6.iteration_ms": 32.829, "preflop.6.check_ms": 33.934, "preflop.6.sync_ms": 56.734, "preflop.8.iteration_ms": 151.094, "preflop.8.check_ms": 140.573, "preflop.8.sync_ms": 156.832}, "checks": [{"preflop": "PERF seats=2 nodes=40 iteration_ms=0.100 check_ms=0.354 sync_ms=0.035 arena_hash=6d4781fae03e3474 gaps=[0.05088935968248226, 0.013161917444424076] evs=[-0.15795953824550446, -0.4142353804778675]"}, {"preflop": "PERF seats=6 nodes=166090 iteration_ms=32.829 check_ms=33.934 sync_ms=56.734 arena_hash=b70284af63586e3f gaps=[0.10415872559930028, 0.03471900474586882, 0.05645132130650671, 0.04355598961220011, 0.02566278444731196, 0.025583227687036025] evs=[0.08985395657613165, 0.11143259696531381, 0.13262513589238922, 0.15984876666632344, -0.3195691149045554, -0.4656351703726333]"}, {"preflop": "PERF seats=8 nodes=434350 iteration_ms=151.094 check_ms=140.573 sync_ms=156.832 arena_hash=e01dd7a18632644d gaps=[0.022654395639749164, 0.010278385995560232, 0.008437781286659882, 0.011345792287176693, 0.011192070283014638, 0.012086956929344556, 0.01380422891560007, 0.011174031925715422] evs=[0.04857087063871364, 0.05480589083850633, 0.06796224413352651, 0.07993621403632675, 0.0996648260883227, 0.13493690699672048, -0.39486055394849295, -0.5856126067014387]"}]}
{"event": "decision", "id": "E001", "status": "keep", "reason": "HU iterations 55-57% faster across two runs; six/eight-seat gains small. All three arenas/gaps/EVs bit-identical. Five GPU equivalence and two private eager/cache/stop tests pass.", "utc": "2026-09-07T00:55:08+00:00"}
{"event": "decision", "id": "E001R", "status": "keep", "reason": "Confirms launch-bound HU gain and exact deterministic state; large-tree variation is within timing noise.", "utc": "2026-09-07T00:55:11+00:00"}
{"event": "promote", "files": ["crates/solver/src/preflop/gpu.rs"], "commit": "10bf6193588f7e83e93a0edea11e90c08c774cd6", "utc": "2026-09-07T00:55:15+00:00"}
{"event": "run", "id": "E002", "path": "cpu_solving", "hypothesis": "Reuse thread-local preflop traversal scratch and fill average strategies directly into it", "status": "candidate", "utc": "2026-09-07T00:56:31+00:00", "commit": "c55a2cd7aeeae96e565476abb8e337210f9a1ab2", "seconds": 40.969, "diagnostic_peak_process_mb": 775.029, "returncode": 0, "command": ["cargo", "test", "--release", "-p", "solver", "--features", "gpu", "--test", "research_perf", "cpu_preflop", "--", "--ignored", "--nocapture", "--test-threads=1"], "env": [], "metrics": {"cpu.preflop.arena_mb": 224.552328, "cpu.preflop.check_ms": 1473.7062999999998, "cpu.preflop.iteration_ms": 200.46096000000003}, "checks": [{"arena_hash": "3f021c64d7c7a141", "evs": [0.11723085944569259, 0.11294138971777481, 0.06514406696957305, 0.07628515082630205, -0.39683870489050355, -0.46397515173140375], "gaps": [0.941004372452971, 0.10522786080636143, 0.20258109159216667, 0.2029610176426232, 0.15556088815149854, 0.11106866681620509], "iteration": 18, "nodes": 166090}]}
{"event": "run", "id": "E002R", "path": "cpu_solving", "hypothesis": "Repeat scratch-pool trial; initial iteration improvement is marginal and checks may regress", "status": "candidate", "utc": "2026-09-07T00:57:55+00:00", "commit": "60f39955b0615d1111c0421651bb3675f58c5de7", "seconds": 40.172, "diagnostic_peak_process_mb": 661.209, "returncode": 0, "command": ["cargo", "test", "--release", "-p", "solver", "--features", "gpu", "--test", "research_perf", "cpu_preflop", "--", "--ignored", "--nocapture", "--test-threads=1"], "env": [], "metrics": {"cpu.preflop.arena_mb": 224.552328, "cpu.preflop.check_ms": 1488.7741999999998, "cpu.preflop.iteration_ms": 203.17534}, "checks": [{"arena_hash": "3f021c64d7c7a141", "evs": [0.11723085944569259, 0.11294138971777481, 0.06514406696957305, 0.07628515082630205, -0.39683870489050355, -0.46397515173140375], "gaps": [0.941004372452971, 0.10522786080636143, 0.20258109159216667, 0.2029610176426232, 0.15556088815149854, 0.11106866681620509], "iteration": 18, "nodes": 166090}]}
{"event": "decision", "id": "E002", "status": "discard", "reason": "Exact state retained, but iteration gain fell to 0.8% on repeat and checkpoint time regressed 2-3%. Added pooling complexity is not justified.", "utc": "2026-09-07T00:58:42+00:00"}
{"event": "decision", "id": "E002R", "status": "discard", "reason": "Repeat does not establish a useful speed gain; restore pre-experiment CPU implementation.", "utc": "2026-09-07T00:58:45+00:00"}
{"event": "run", "id": "E003", "path": "memory_transfers", "hypothesis": "Reuse a pinned two-arena snapshot buffer for faster GPU downloads without partial CPU publication", "status": "candidate", "utc": "2026-09-07T00:59:34+00:00", "commit": "6d64a9b664a14be1b4473ee59fc19da83ad79b91", "seconds": 44.328, "diagnostic_peak_process_mb": 2192.986, "returncode": 0, "command": ["cargo", "test", "--release", "-p", "solver", "--features", "gpu", "--test", "preflop_perf", "--", "--ignored", "--nocapture", "--test-threads=1"], "env": [], "metrics": {"preflop.2.iteration_ms": 0.094, "preflop.2.check_ms": 0.296, "preflop.2.sync_ms": 0.016, "preflop.6.iteration_ms": 32.722, "preflop.6.check_ms": 34.4, "preflop.6.sync_ms": 26.615, "preflop.8.iteration_ms": 151.989, "preflop.8.check_ms": 142.487, "preflop.8.sync_ms": 67.567}, "checks": [{"preflop": "PERF seats=2 nodes=40 iteration_ms=0.094 check_ms=0.296 sync_ms=0.016 arena_hash=6d4781fae03e3474 gaps=[0.05088935968248226, 0.013161917444424076] evs=[-0.15795953824550446, -0.4142353804778675]"}, {"preflop": "PERF seats=6 nodes=166090 iteration_ms=32.722 check_ms=34.400 sync_ms=26.615 arena_hash=b70284af63586e3f gaps=[0.10415872559930028, 0.03471900474586882, 0.05645132130650671, 0.04355598961220011, 0.02566278444731196, 0.025583227687036025] evs=[0.08985395657613165, 0.11143259696531381, 0.13262513589238922, 0.15984876666632344, -0.3195691149045554, -0.4656351703726333]"}, {"preflop": "PERF seats=8 nodes=434350 iteration_ms=151.989 check_ms=142.487 sync_ms=67.567 arena_hash=e01dd7a18632644d gaps=[0.022654395639749164, 0.010278385995560232, 0.008437781286659882, 0.011345792287176693, 0.011192070283014638, 0.012086956929344556, 0.01380422891560007, 0.011174031925715422] evs=[0.04857087063871364, 0.05480589083850633, 0.06796224413352651, 0.07993621403632675, 0.0996648260883227, 0.13493690699672048, -0.39486055394849295, -0.5856126067014387]"}]}
{"event": "run", "id": "E003R", "path": "memory_transfers", "hypothesis": "Confirm pinned snapshot gain after adding pageable fallback; all CUDA suites passed", "status": "candidate", "utc": "2026-09-07T01:01:55+00:00", "commit": "b8c25400452d9971e959bfe8d66c5e2d3c6c93c9", "seconds": 19.593, "diagnostic_peak_process_mb": 2193.514, "returncode": 0, "command": ["cargo", "test", "--release", "-p", "solver", "--features", "gpu", "--test", "preflop_perf", "--", "--ignored", "--nocapture", "--test-threads=1"], "env": [], "metrics": {"preflop.2.iteration_ms": 0.101, "preflop.2.check_ms": 0.29, "preflop.2.sync_ms": 0.022, "preflop.6.iteration_ms": 32.744, "preflop.6.check_ms": 34.215, "preflop.6.sync_ms": 30.926, "preflop.8.iteration_ms": 153.638, "preflop.8.check_ms": 140.187, "preflop.8.sync_ms": 67.568}, "checks": [{"preflop": "PERF seats=2 nodes=40 iteration_ms=0.101 check_ms=0.290 sync_ms=0.022 arena_hash=6d4781fae03e3474 gaps=[0.05088935968248226, 0.013161917444424076] evs=[-0.15795953824550446, -0.4142353804778675]"}, {"preflop": "PERF seats=6 nodes=166090 iteration_ms=32.744 check_ms=34.215 sync_ms=30.926 arena_hash=b70284af63586e3f gaps=[0.10415872559930028, 0.03471900474586882, 0.05645132130650671, 0.04355598961220011, 0.02566278444731196, 0.025583227687036025] evs=[0.08985395657613165, 0.11143259696531381, 0.13262513589238922, 0.15984876666632344, -0.3195691149045554, -0.4656351703726333]"}, {"preflop": "PERF seats=8 nodes=434350 iteration_ms=153.638 check_ms=140.187 sync_ms=67.568 arena_hash=e01dd7a18632644d gaps=[0.022654395639749164, 0.010278385995560232, 0.008437781286659882, 0.011345792287176693, 0.011192070283014638, 0.012086956929344556, 0.01380422891560007, 0.011174031925715422] evs=[0.04857087063871364, 0.05480589083850633, 0.06796224413352651, 0.07993621403632675, 0.0996648260883227, 0.13493690699672048, -0.39486055394849295, -0.5856126067014387]"}]}
{"event": "decision", "id": "E003", "status": "keep", "reason": "GPU snapshots are 48-56% faster across repeats; exact arenas/gaps/EVs, 26 unit and 11 GPU equivalence tests pass. Tradeoff: a retained pinned buffer equal to the CPU arenas during the GPU engine lifetime; pageable fallback preserved.", "utc": "2026-09-07T01:03:16+00:00"}
{"event": "decision", "id": "E003R", "status": "keep", "reason": "Confirms eight-seat sync at 67.568 ms vs 150.459 ms baseline, and six-seat 30.926 ms vs 59.988 ms. Numerical fingerprints identical.", "utc": "2026-09-07T01:03:19+00:00"}
{"event": "promote", "files": ["crates/solver/src/preflop/gpu.rs", "crates/solver/src/gpu/mod.rs"], "commit": "b8c25400452d9971e959bfe8d66c5e2d3c6c93c9", "utc": "2026-09-07T01:03:23+00:00"}
{"event": "run", "id": "E004", "path": "postflop_cuda", "hypothesis": "A 256-thread postflop block may reduce per-thread hand work and improve occupancy", "status": "candidate", "utc": "2026-09-07T01:04:07+00:00", "commit": "d211e665c0baba6a58e8c42920f0b93a89becb84", "seconds": 42.813, "diagnostic_peak_process_mb": 4278.284, "returncode": 0, "command": ["cargo", "test", "--release", "-p", "solver", "--features", "gpu", "--test", "postflop_perf", "--", "--ignored", "--nocapture", "--test-threads=1"], "env": [], "metrics": {"postflop.Ks7h2d.init_ms": 1014.986, "postflop.Ks7h2d.iteration_ms": 71.482, "postflop.Ks7h2d.check_ms": 58.757, "postflop.Ks7s2d.init_ms": 714.543, "postflop.Ks7s2d.iteration_ms": 42.733, "postflop.Ks7s2d.check_ms": 43.15, "postflop.Ks7h2dQhTc.init_ms": 70.966, "postflop.Ks7h2dQhTc.iteration_ms": 0.305, "postflop.Ks7h2dQhTc.check_ms": 0.721}, "checks": [{"postflop": "POSTFLOP board=Ks7h2d rake=0 nodes=1346813 init_ms=1014.986 iteration_ms=71.482 check_ms=58.757 exploit_chips=1.671981700"}, {"postflop": "POSTFLOP board=Ks7s2d rake=0.05 nodes=1346813 init_ms=714.543 iteration_ms=42.733 check_ms=43.150 exploit_chips=1.323560664"}, {"postflop": "POSTFLOP board=Ks7h2dQhTc rake=0.05 nodes=33 init_ms=70.966 iteration_ms=0.305 check_ms=0.721 exploit_chips=0.140635386"}]}
{"event": "decision", "id": "E004", "status": "discard", "reason": "256-thread blocks slow rainbow flop iterations 20% and two-tone 22%, with worse checkpoints. No need to retain or broaden this regression.", "utc": "2026-09-07T01:05:58+00:00"}
{"event": "run", "id": "E004B", "path": "postflop_cuda", "hypothesis": "64-thread blocks may reduce serial prefix overhead and block resource pressure", "status": "candidate", "utc": "2026-09-07T01:06:45+00:00", "commit": "1086dd8b8675cc53f01819224f9e970a09e9e1bf", "seconds": 42.015, "diagnostic_peak_process_mb": 4273.254, "returncode": 0, "command": ["cargo", "test", "--release", "-p", "solver", "--features", "gpu", "--test", "postflop_perf", "--", "--ignored", "--nocapture", "--test-threads=1"], "env": [], "metrics": {"postflop.Ks7h2d.init_ms": 1033.552, "postflop.Ks7h2d.iteration_ms": 61.09, "postflop.Ks7h2d.check_ms": 40.219, "postflop.Ks7s2d.init_ms": 691.739, "postflop.Ks7s2d.iteration_ms": 35.868, "postflop.Ks7s2d.check_ms": 33.972, "postflop.Ks7h2dQhTc.init_ms": 69.603, "postflop.Ks7h2dQhTc.iteration_ms": 0.472, "postflop.Ks7h2dQhTc.check_ms": 0.863}, "checks": [{"postflop": "POSTFLOP board=Ks7h2d rake=0 nodes=1346813 init_ms=1033.552 iteration_ms=61.090 check_ms=40.219 exploit_chips=1.724920333"}, {"postflop": "POSTFLOP board=Ks7s2d rake=0.05 nodes=1346813 init_ms=691.739 iteration_ms=35.868 check_ms=33.972 exploit_chips=1.317907206"}, {"postflop": "POSTFLOP board=Ks7h2dQhTc rake=0.05 nodes=33 init_ms=69.603 iteration_ms=0.472 check_ms=0.863 exploit_chips=0.140634901"}]}
{"event": "decision", "id": "E004B", "status": "discard", "reason": "64-thread blocks provide no repeatable flop iteration benefit and materially slow the river workload. Restore 128 threads; pursue data movement instead.", "utc": "2026-09-07T01:07:44+00:00"}
{"event": "run", "id": "B004", "path": "baseline", "hypothesis": "Measure current preflop GPU capacity and initialization before compact reach storage", "status": "baseline", "utc": "2026-09-07T01:08:20+00:00", "commit": "c6efc14a78eef81be3975a880cc2bc4daaa29087", "seconds": 32.282, "diagnostic_peak_process_mb": 2031.215, "returncode": 0, "command": ["cargo", "test", "--release", "-p", "solver", "--features", "gpu", "--test", "capacity_perf", "--", "--ignored", "--nocapture", "--test-threads=1"], "env": [], "metrics": {"preflop.6.allocated_vram_mb": 1140.850688, "preflop.6.build_ms": 77.0805, "preflop.6.cpu_arena_mb": 224.552328, "preflop.6.estimated_vram_mb": 1201.382292, "preflop.6.init_ms": 184.7098, "preflop.8.allocated_vram_mb": 3590.324224, "preflop.8.build_ms": 241.9299, "preflop.8.cpu_arena_mb": 587.239848, "preflop.8.estimated_vram_mb": 3632.617572, "preflop.8.init_ms": 325.3486}, "checks": [{"nodes": 166090, "note": "Allocated VRAM is device free-memory delta; estimate is the engine preflight formula.", "seats": 6}, {"nodes": 434350, "note": "Allocated VRAM is device free-memory delta; estimate is the engine preflight formula.", "seats": 8}]}
