{"event": "run", "id": "E011DR2", "path": "postflop_cuda", "hypothesis": "Warm fixed-iteration repeat of deterministic fold sums after all accuracy and reproducibility checks passed", "status": "candidate", "utc": "2026-09-07T02:07:54+00:00", "commit": "4b77be8117502022b03a13ddbba41f5d795c1765", "seconds": 10.016, "diagnostic_peak_process_mb": 4617.499, "returncode": 0, "command": ["cargo", "test", "--release", "-p", "solver", "--features", "gpu", "--test", "postflop_perf", "--", "--ignored", "--nocapture", "--test-threads=1"], "env": [], "metrics": {"postflop.Ks7h2d.init_ms": 1042.241, "postflop.Ks7h2d.iteration_ms": 56.643, "postflop.Ks7h2d.check_ms": 35.059, "postflop.Ks7s2d.init_ms": 858.983, "postflop.Ks7s2d.iteration_ms": 33.599, "postflop.Ks7s2d.check_ms": 28.463, "postflop.Ks7h2dQhTc.init_ms": 73.606, "postflop.Ks7h2dQhTc.iteration_ms": 0.313, "postflop.Ks7h2dQhTc.check_ms": 0.662}, "checks": [{"postflop": "POSTFLOP board=Ks7h2d rake=0 nodes=1346813 init_ms=1042.241 iteration_ms=56.643 check_ms=35.059 exploit_chips=1.698464289"}, {"postflop": "POSTFLOP board=Ks7s2d rake=0.05 nodes=1346813 init_ms=858.983 iteration_ms=33.599 check_ms=28.463 exploit_chips=1.329163551"}, {"postflop": "POSTFLOP board=Ks7h2dQhTc rake=0.05 nodes=33 init_ms=73.606 iteration_ms=0.313 check_ms=0.662 exploit_chips=0.140634178"}], "score_patterns": ["postflop.*"]}
{"event": "decision", "id": "E011D", "status": "keep", "reason": "Warm repeat: rainbow 56.64 ms, two-tone 33.60 ms; checks 35.06/28.46 ms versus 40.83/31.53. Same 0.3-percent target at 200 iterations, slightly faster; 28 unit and 6 GPU tests pass. Learning/evaluation now bit-repeatable. Original f32 precision retained; higher-precision variants rejected for cost.", "utc": "2026-09-07T02:08:56+00:00"}
{"event": "decision", "id": "E011DR", "status": "keep", "reason": "Warm repeat: rainbow 56.64 ms, two-tone 33.60 ms; checks 35.06/28.46 ms versus 40.83/31.53. Same 0.3-percent target at 200 iterations, slightly faster; 28 unit and 6 GPU tests pass. Learning/evaluation now bit-repeatable. Original f32 precision retained; higher-precision variants rejected for cost.", "utc": "2026-09-07T02:08:56+00:00"}
{"event": "decision", "id": "E011DR2", "status": "keep", "reason": "Warm repeat: rainbow 56.64 ms, two-tone 33.60 ms; checks 35.06/28.46 ms versus 40.83/31.53. Same 0.3-percent target at 200 iterations, slightly faster; 28 unit and 6 GPU tests pass. Learning/evaluation now bit-repeatable. Original f32 precision retained; higher-precision variants rejected for cost.", "utc": "2026-09-07T02:08:56+00:00"}
{"event": "promote", "files": ["crates/solver/src/gpu/mod.rs", "crates/solver/src/gpu/kernels.cu"], "commit": "4b77be8117502022b03a13ddbba41f5d795c1765", "utc": "2026-09-07T02:09:03+00:00"}
{"event": "run", "id": "E012", "path": "reports_profiles", "hypothesis": "Specialize two-, three- and four-action raking without changing any arithmetic order", "status": "candidate", "utc": "2026-09-07T02:09:06+00:00", "commit": "2e4ae15ce344b3c8e359cb9aa2d8868072149216", "seconds": 1.047, "diagnostic_peak_process_mb": 95.568, "returncode": 0, "command": ["python", "research/autoresearch/check_raking.py"], "env": [], "metrics": {"lifecycle.raking_ms": 4.629099999999999}, "checks": [{"raking_hash": "aac3ae3fc5347b11", "cases": 512}], "score_patterns": ["lifecycle.raking_ms"]}
{"event": "run", "id": "E012R", "path": "reports_profiles", "hypothesis": "Measure specialized raking in full profile generation and verify report/profile/state fingerprints", "status": "candidate", "utc": "2026-09-07T02:10:13+00:00", "commit": "2e4ae15ce344b3c8e359cb9aa2d8868072149216", "seconds": 37.938, "diagnostic_peak_process_mb": 789.873, "returncode": 0, "command": ["cargo", "test", "--release", "-p", "solver", "--lib", "--test", "report_lines", "--test", "research_perf", "--", "--include-ignored", "--nocapture", "--test-threads=1"], "env": [], "metrics": {"cpu.preflop.arena_mb": 224.552328, "cpu.preflop.check_ms": 339.3351, "cpu.preflop.iteration_ms": 78.79948, "cpu.postflop.arena_mb": 104.204192, "cpu.postflop.iteration_ms": 33.886919999999996, "lifecycle.build_ms": 7.7875000000000005, "lifecycle.compressed_load_ms": 103.52749999999999, "lifecycle.load_ms": 48.7379, "lifecycle.profile_ms": 592.6199, "lifecycle.report_lines_ms": 88.95870000000001, "lifecycle.save_mb": 104.204944, "lifecycle.save_ms": 221.0937}, "checks": [{"arena_hash": "3f021c64d7c7a141", "evs": [0.11723085944569259, 0.11294138971777481, 0.06514406696957305, 0.07628515082630205, -0.39683870489050355, -0.46397515173140375], "gaps": [0.941004372452971, 0.10522786080636143, 0.20258109159216667, 0.2029610176426232, 0.15556088815149854, 0.11106866681620509], "iteration": 18, "nodes": 166090}, {"exploitability": 0.36963080697589445, "iteration": 18, "nodes": 208516, "profile_hash": "b0d3ea8a1b19e943", "report_hash": "a757b21c1a6973a3", "save_hash": "b92fb5d3a217da94"}], "score_patterns": ["lifecycle.profile_ms"]}
{"event": "run", "id": "E012R2", "path": "reports_profiles", "hypothesis": "Repeat full profile specialization workload with immutable profile and solver fingerprints", "status": "candidate", "utc": "2026-09-07T02:11:21+00:00", "commit": "2e4ae15ce344b3c8e359cb9aa2d8868072149216", "seconds": 4.485, "diagnostic_peak_process_mb": 456.155, "returncode": 0, "command": ["cargo", "test", "--release", "-p", "solver", "--test", "research_perf", "--", "lifecycle", "--ignored", "--nocapture", "--test-threads=1"], "env": [], "metrics": {"cpu.postflop.arena_mb": 104.204192, "cpu.postflop.iteration_ms": 29.792800000000003, "lifecycle.build_ms": 10.1053, "lifecycle.compressed_load_ms": 93.786, "lifecycle.load_ms": 42.166799999999995, "lifecycle.profile_ms": 579.7951999999999, "lifecycle.report_lines_ms": 70.8613, "lifecycle.save_mb": 104.204944, "lifecycle.save_ms": 221.23160000000001}, "checks": [{"exploitability": 0.36963080697589445, "iteration": 18, "nodes": 208516, "profile_hash": "b0d3ea8a1b19e943", "report_hash": "a757b21c1a6973a3", "save_hash": "b92fb5d3a217da94"}], "score_patterns": ["lifecycle.profile_ms"]}
{"event": "decision", "id": "E012", "status": "keep", "reason": "512 varied raking cases retain exact hash aac3ae3fc5347b11; full profile generation repeats at 592.62/579.80 ms versus 648-681 ms controls. Profile/report/save hashes unchanged; unit and report tests pass.", "utc": "2026-09-07T02:12:45+00:00"}
{"event": "decision", "id": "E012R", "status": "keep", "reason": "512 varied raking cases retain exact hash aac3ae3fc5347b11; full profile generation repeats at 592.62/579.80 ms versus 648-681 ms controls. Profile/report/save hashes unchanged; unit and report tests pass.", "utc": "2026-09-07T02:12:45+00:00"}
{"event": "decision", "id": "E012R2", "status": "keep", "reason": "512 varied raking cases retain exact hash aac3ae3fc5347b11; full profile generation repeats at 592.62/579.80 ms versus 648-681 ms controls. Profile/report/save hashes unchanged; unit and report tests pass.", "utc": "2026-09-07T02:12:45+00:00"}
{"event": "promote", "files": ["crates/solver/src/query.rs"], "commit": "2e4ae15ce344b3c8e359cb9aa2d8868072149216", "utc": "2026-09-07T02:12:52+00:00"}
{"event": "run", "id": "B010", "path": "baseline", "hypothesis": "Complete saved-state and exploitability-bit controls across flop, turn, river, isomorphism, rake and locks", "status": "crash", "utc": "2026-09-07T02:14:13+00:00", "commit": "84b380de002c4442bc338fba1882fdccdfe09f99", "seconds": 33.985, "diagnostic_peak_process_mb": 413.557, "returncode": 101, "command": ["cargo", "test", "--release", "-p", "solver", "--features", "gpu", "--test", "postflop_state_perf", "--", "--ignored", "--nocapture", "--test-threads=1"], "env": [], "metrics": {}, "checks": [], "score_patterns": []}
{"event": "harness_api_fix", "utc": "2026-09-07T02:14:48.020594+00:00", "path": "crates/solver/tests/postflop_state_perf.rs", "old_sha": "7ead5bf55d85b05903b0911c22d39d9db8001421dbd30dbcff770ec8c96f92a0", "new_sha": "7d6f51618d0fe5b0fa431351c31cc0775f4a3bd7e816a2e93ecda9bbafa49d47", "reason": "New state harness failed to compile before any measurements; adapt PathBuf to existing save(&str) API, with fixtures unchanged."}
{"event": "run", "id": "B010R", "path": "baseline", "hypothesis": "Complete postflop state controls after fixing new harness save-path API usage", "status": "baseline", "utc": "2026-09-07T02:15:04+00:00", "commit": "65b8c2c184366fe03ec8c2809198d3829ef5b8b0", "seconds": 14.734, "diagnostic_peak_process_mb": 388.071, "returncode": 0, "command": ["cargo", "test", "--release", "-p", "solver", "--features", "gpu", "--test", "postflop_state_perf", "--", "--ignored", "--nocapture", "--test-threads=1"], "env": [], "metrics": {}, "checks": [{"board": "KsQs2d", "iso": false, "rake": 0.0, "states": [{"exploit_bits": 4587303795425830328, "hash": "ced25cd534160a7a", "locked": false}, {"exploit_bits": 4581640868563274656, "hash": "8729320849b9d33c", "locked": true}]}, {"board": "KsQs2d", "iso": false, "rake": 0.05, "states": [{"exploit_bits": 4587469623950769688, "hash": "dce9b2717e0df16e", "locked": false}, {"exploit_bits": 4581722223845122880, "hash": "99111fb9c8ec709b", "locked": true}]}, {"board": "KsQs2d", "iso": true, "rake": 0.0, "states": [{"exploit_bits": 4587284094896033288, "hash": "f28b67b0f43f8498", "locked": false}, {"exploit_bits": 4581629036489079792, "hash": "52fbd9a266ab35c1", "locked": true}]}, {"board": "KsQs2d", "iso": true, "rake": 0.05, "states": [{"exploit_bits": 4587467559043767640, "hash": "7abb90d6fa5ac2fc", "locked": false}, {"exploit_bits": 4581695983154347840, "hash": "b529102cce25dc39", "locked": true}]}, {"board": "Qs7h2dKh", "iso": false, "rake": 0.0, "states": [{"exploit_bits": 4582461738720506392, "hash": "816eeeb55df5fe5c", "locked": false}, {"exploit_bits": 4576041536399700112, "hash": "202311fe47670cc0", "locked": true}]}, {"board": "Qs7h2dKh", "iso": false, "rake": 0.05, "states": [{"exploit_bits": 4583407264393491801, "hash": "ed2549bfcfbc34f1", "locked": false}, {"exploit_bits": 4576219535588436580, "hash": "8217b6d74d4da526", "locked": true}]}, {"board": "Qs7h2dKh", "iso": true, "rake": 0.0, "states": [{"exploit_bits": 4582461738720506392, "hash": "816eeeb55df5fe5c", "locked": false}, {"exploit_bits": 4576041536399700112, "hash": "202311fe47670cc0", "locked": true}]}, {"board": "Qs7h2dKh", "iso": true, "rake": 0.05, "states": [{"exploit_bits": 4583407264393491801, "hash": "ed2549bfcfbc34f1", "locked": false}, {"exploit_bits": 4576219535588436580, "hash": "8217b6d74d4da526", "locked": true}]}, {"board": "AsKsQsJsTs", "iso": false, "rake": 0.0, "states": [{"exploit_bits": 4554443791804951647, "hash": "7f53c8ac5434860d", "locked": false}, {"exploit_bits": 4545576682231338880, "hash": "409995a6b2afc105", "locked": true}]}, {"board": "AsKsQsJsTs", "iso": false, "rake": 0.05, "states": [{"exploit_bits": 4566905886187841344, "hash": "af8ff4550d82f9ef", "locked": false}, {"exploit_bits": 4558330255933400576, "hash": "db670420a8559b3f", "locked": true}]}, {"board": "AsKsQsJsTs", "iso": true, "rake": 0.0, "states": [{"exploit_bits": 4554443791804951647, "hash": "7f53c8ac5434860d", "locked": false}, {"exploit_bits": 4545576682231338880, "hash": "409995a6b2afc105", "locked": true}]}, {"board": "AsKsQsJsTs", "iso": true, "rake": 0.05, "states": [{"exploit_bits": 4566905886187841344, "hash": "af8ff4550d82f9ef", "locked": false}, {"exploit_bits": 4558330255933400576, "hash": "db670420a8559b3f", "locked": true}]}], "score_patterns": []}
{"event": "run", "id": "E013", "path": "postflop_cuda", "hypothesis": "Store CFVs only for visited nodes while preserving every node and chance reference", "status": "candidate", "utc": "2026-09-07T02:17:33+00:00", "commit": "ecf7e1ebfca23eccbe8188bbc66460aba97328e0", "seconds": 57.921, "diagnostic_peak_process_mb": 4278.387, "returncode": 0, "command": ["cargo", "test", "--release", "-p", "solver", "--features", "gpu", "--test", "postflop_perf", "--test", "postflop_capacity_perf", "--test", "postflop_state_perf", "--", "--ignored", "--nocapture", "--test-threads=1"], "env": [], "metrics": {"postflop.Ks7h2d.iso.allocated_vram_mb": 6241.124352, "postflop.Ks7h2d.iso.estimated_vram_mb": 6716.6347, "postflop.Ks7h2d.iso.init_ms": 1514.7133, "postflop.Ks7h2d.iso.plan_build_ms": 103.6747, "postflop.Ks7h2d.iso.staging_memory_mb": 3380.293588, "postflop.Ks7s2d.iso.allocated_vram_mb": 4932.501504, "postflop.Ks7s2d.iso.estimated_vram_mb": 6737.546704, "postflop.Ks7s2d.iso.init_ms": 557.8100000000001, "postflop.Ks7s2d.iso.plan_build_ms": 85.025, "postflop.Ks7s2d.iso.staging_memory_mb": 2063.622928, "postflop.Ks7s2d.full.allocated_vram_mb": 6274.678784, "postflop.Ks7s2d.full.estimated_vram_mb": 6737.546704, "postflop.Ks7s2d.full.init_ms": 636.3002, "postflop.Ks7s2d.full.plan_build_ms": 118.643, "postflop.Ks7s2d.full.staging_memory_mb": 3391.473816, "postflop.Ks7h2d.init_ms": 1208.383, "postflop.Ks7h2d.iteration_ms": 57.556, "postflop.Ks7h2d.check_ms": 35.825, "postflop.Ks7s2d.init_ms": 778.332, "postflop.Ks7s2d.iteration_ms": 34.056, "postflop.Ks7s2d.check_ms": 29.436, "postflop.Ks7h2dQhTc.init_ms": 75.53, "postflop.Ks7h2dQhTc.iteration_ms": 0.319, "postflop.Ks7h2dQhTc.check_ms": 0.562}, "checks": [{"board": "Ks7h2d", "nodes": 1346813, "use_isomorphism": true}, {"board": "Ks7s2d", "nodes": 1346813, "use_isomorphism": true}, {"board": "Ks7s2d", "nodes": 1346813, "use_isomorphism": false}, {"postflop": "POSTFLOP board=Ks7h2d rake=0 nodes=1346813 init_ms=1208.383 iteration_ms=57.556 check_ms=35.825 exploit_chips=1.698464289"}, {"postflop": "POSTFLOP board=Ks7s2d rake=0.05 nodes=1346813 init_ms=778.332 iteration_ms=34.056 check_ms=29.436 exploit_chips=1.329163551"}, {"postflop": "POSTFLOP board=Ks7h2dQhTc rake=0.05 nodes=33 init_ms=75.530 iteration_ms=0.319 check_ms=0.562 exploit_chips=0.140634178"}, {"board": "KsQs2d", "iso": false, "rake": 0.0, "states": [{"exploit_bits": 4587303795425830328, "hash": "ced25cd534160a7a", "locked": false}, {"exploit_bits": 4581640868563274656, "hash": "8729320849b9d33c", "locked": true}]}, {"board": "KsQs2d", "iso": false, "rake": 0.05, "states": [{"exploit_bits": 4587469623950769688, "hash": "dce9b2717e0df16e", "locked": false}, {"exploit_bits": 4581722223845122880, "hash": "99111fb9c8ec709b", "locked": true}]}, {"board": "KsQs2d", "iso": true, "rake": 0.0, "states": [{"exploit_bits": 4587284094896033288, "hash": "f28b67b0f43f8498", "locked": false}, {"exploit_bits": 4581629036489079792, "hash": "52fbd9a266ab35c1", "locked": true}]}, {"board": "KsQs2d", "iso": true, "rake": 0.05, "states": [{"exploit_bits": 4587467559043767640, "hash": "7abb90d6fa5ac2fc", "locked": false}, {"exploit_bits": 4581695983154347840, "hash": "b529102cce25dc39", "locked": true}]}, {"board": "Qs7h2dKh", "iso": false, "rake": 0.0, "states": [{"exploit_bits": 4582461738720506392, "hash": "816eeeb55df5fe5c", "locked": false}, {"exploit_bits": 4576041536399700112, "hash": "202311fe47670cc0", "locked": true}]}, {"board": "Qs7h2dKh", "iso": false, "rake": 0.05, "states": [{"exploit_bits": 4583407264393491801, "hash": "ed2549bfcfbc34f1", "locked": false}, {"exploit_bits": 4576219535588436580, "hash": "8217b6d74d4da526", "locked": true}]}, {"board": "Qs7h2dKh", "iso": true, "rake": 0.0, "states": [{"exploit_bits": 4582461738720506392, "hash": "816eeeb55df5fe5c", "locked": false}, {"exploit_bits": 4576041536399700112, "hash": "202311fe47670cc0", "locked": true}]}, {"board": "Qs7h2dKh", "iso": true, "rake": 0.05, "states": [{"exploit_bits": 4583407264393491801, "hash": "ed2549bfcfbc34f1", "locked": false}, {"exploit_bits": 4576219535588436580, "hash": "8217b6d74d4da526", "locked": true}]}, {"board": "AsKsQsJsTs", "iso": false, "rake": 0.0, "states": [{"exploit_bits": 4554443791804951647, "hash": "7f53c8ac5434860d", "locked": false}, {"exploit_bits": 4545576682231338880, "hash": "409995a6b2afc105", "locked": true}]}, {"board": "AsKsQsJsTs", "iso": false, "rake": 0.05, "states": [{"exploit_bits": 4566905886187841344, "hash": "af8ff4550d82f9ef", "locked": false}, {"exploit_bits": 4558330255933400576, "hash": "db670420a8559b3f", "locked": true}]}, {"board": "AsKsQsJsTs", "iso": true, "rake": 0.0, "states": [{"exploit_bits": 4554443791804951647, "hash": "7f53c8ac5434860d", "locked": false}, {"exploit_bits": 4545576682231338880, "hash": "409995a6b2afc105", "locked": true}]}, {"board": "AsKsQsJsTs", "iso": true, "rake": 0.05, "states": [{"exploit_bits": 4566905886187841344, "hash": "af8ff4550d82f9ef", "locked": false}, {"exploit_bits": 4558330255933400576, "hash": "db670420a8559b3f", "locked": true}]}], "score_patterns": ["postflop.*"]}
{"event": "run", "id": "E013R", "path": "postflop_cuda", "hypothesis": "Repeat compact CFV timing/capacity and verify slot ownership plus GPU equivalence", "status": "candidate", "utc": "2026-09-07T02:18:53+00:00", "commit": "ecf7e1ebfca23eccbe8188bbc66460aba97328e0", "seconds": 54.75, "diagnostic_peak_process_mb": 4269.429, "returncode": 0, "command": ["cargo", "test", "--release", "-p", "solver", "--features", "gpu", "--lib", "--test", "gpu", "--test", "postflop_perf", "--test", "postflop_capacity_perf", "--", "--include-ignored", "--nocapture", "--test-threads=1"], "env": [], "metrics": {"postflop.Ks7h2d.iso.allocated_vram_mb": 6241.124352, "postflop.Ks7h2d.iso.estimated_vram_mb": 6716.6347, "postflop.Ks7h2d.iso.init_ms": 940.9918, "postflop.Ks7h2d.iso.plan_build_ms": 111.2345, "postflop.Ks7h2d.iso.staging_memory_mb": 3380.293588, "postflop.Ks7s2d.iso.allocated_vram_mb": 4932.501504, "postflop.Ks7s2d.iso.estimated_vram_mb": 6737.546704, "postflop.Ks7s2d.iso.init_ms": 568.2644, "postflop.Ks7s2d.iso.plan_build_ms": 74.5834, "postflop.Ks7s2d.iso.staging_memory_mb": 2063.622928, "postflop.Ks7s2d.full.allocated_vram_mb": 6274.678784, "postflop.Ks7s2d.full.estimated_vram_mb": 6737.546704, "postflop.Ks7s2d.full.init_ms": 678.1116000000001, "postflop.Ks7s2d.full.plan_build_ms": 104.54140000000001, "postflop.Ks7s2d.full.staging_memory_mb": 3391.473816, "postflop.Ks7h2d.init_ms": 1137.21, "postflop.Ks7h2d.iteration_ms": 57.433, "postflop.Ks7h2d.check_ms": 35.68, "postflop.Ks7s2d.init_ms": 661.983, "postflop.Ks7s2d.iteration_ms": 34.079, "postflop.Ks7s2d.check_ms": 28.683, "postflop.Ks7h2dQhTc.init_ms": 116.871, "postflop.Ks7h2dQhTc.iteration_ms": 0.319, "postflop.Ks7h2dQhTc.check_ms": 0.611}, "checks": [{"board": "Ks7h2d", "nodes": 1346813, "use_isomorphism": true}, {"board": "Ks7s2d", "nodes": 1346813, "use_isomorphism": true}, {"board": "Ks7s2d", "nodes": 1346813, "use_isomorphism": false}, {"postflop": "POSTFLOP board=Ks7h2d rake=0 nodes=1346813 init_ms=1137.210 iteration_ms=57.433 check_ms=35.680 exploit_chips=1.698464289"}, {"postflop": "POSTFLOP board=Ks7s2d rake=0.05 nodes=1346813 init_ms=661.983 iteration_ms=34.079 check_ms=28.683 exploit_chips=1.329163551"}, {"postflop": "POSTFLOP board=Ks7h2dQhTc rake=0.05 nodes=33 init_ms=116.871 iteration_ms=0.319 check_ms=0.611 exploit_chips=0.140634178"}], "score_patterns": ["postflop.*"]}
{"event": "decision", "id": "E013", "status": "keep", "reason": "Two-tone VRAM repeats at 4932.50 MB, down another 705 MB (36 percent below original baseline). All 24 complete saved states and EV bits equal B010R; 28 unit and 6 GPU tests pass. Iterations are about 1-2 percent slower than best pre-compaction repeat; retained for capacity, not as a speed gain.", "utc": "2026-09-07T02:19:36+00:00"}
{"event": "decision", "id": "E013R", "status": "keep", "reason": "Two-tone VRAM repeats at 4932.50 MB, down another 705 MB (36 percent below original baseline). All 24 complete saved states and EV bits equal B010R; 28 unit and 6 GPU tests pass. Iterations are about 1-2 percent slower than best pre-compaction repeat; retained for capacity, not as a speed gain.", "utc": "2026-09-07T02:19:36+00:00"}
{"event": "promote", "files": ["crates/solver/src/gpu/plan.rs", "crates/solver/src/gpu/mod.rs", "crates/solver/src/gpu/kernels.cu"], "commit": "ecf7e1ebfca23eccbe8188bbc66460aba97328e0", "utc": "2026-09-07T02:19:44+00:00"}
{"event": "run", "id": "B011", "path": "baseline", "hypothesis": "Warm preflop initialization/capacity control before eliminating temporary upload copies", "status": "baseline", "utc": "2026-09-07T02:19:52+00:00", "commit": "ecf7e1ebfca23eccbe8188bbc66460aba97328e0", "seconds": 7.344, "diagnostic_peak_process_mb": 1614.938, "returncode": 0, "command": ["cargo", "test", "--release", "-p", "solver", "--features", "gpu", "--test", "capacity_perf", "--", "--ignored", "--nocapture", "--test-threads=1"], "env": [], "metrics": {"preflop.6.allocated_vram_mb": 603.979776, "preflop.6.build_ms": 77.4773, "preflop.6.cpu_arena_mb": 224.552328, "preflop.6.estimated_vram_mb": 644.652012, "preflop.6.init_ms": 166.5338, "preflop.8.allocated_vram_mb": 1543.503872, "preflop.8.build_ms": 239.2635, "preflop.8.cpu_arena_mb": 587.239848, "preflop.8.estimated_vram_mb": 1592.914732, "preflop.8.init_ms": 281.7808}, "checks": [{"nodes": 166090, "note": "Allocated VRAM is device free-memory delta; estimate is the engine preflight formula.", "seats": 6}, {"nodes": 434350, "note": "Allocated VRAM is device free-memory delta; estimate is the engine preflight formula.", "seats": 8}], "score_patterns": []}
