{"event": "validation", "id": "final-main-gpu", "checkout": "main", "passed": 40, "failed": 0, "ignored": 0, "log": "raw/final-main-gpu.log", "utc": "2026-09-07T03:15:46.125011+00:00"}
{"event": "run", "id": "B018", "path": "baseline", "hypothesis": "Fresh specialized-raking control before testing reuse of the per-fitting-iteration aggregate buffer", "status": "baseline", "utc": "2026-09-07T03:16:42+00:00", "commit": "c91db38290736e6c117527eb38b3629960491fc5", "seconds": 0.797, "diagnostic_peak_process_mb": 96.223, "returncode": 0, "command": ["python", "research/autoresearch/check_raking.py"], "env": [], "metrics": {"lifecycle.raking_ms": 4.5577}, "checks": [{"raking_hash": "aac3ae3fc5347b11", "cases": 512}], "score_patterns": []}
{"event": "run", "id": "B019", "path": "baseline", "hypothesis": "Fresh whole-profile lifecycle control before removing repeated aggregate allocation inside raking", "status": "baseline", "utc": "2026-09-07T03:17:00+00:00", "commit": "c91db38290736e6c117527eb38b3629960491fc5", "seconds": 9.157, "diagnostic_peak_process_mb": 365.834, "returncode": 0, "command": ["cargo", "test", "--release", "-p", "solver", "--test", "research_perf", "lifecycle", "--", "--ignored", "--nocapture", "--test-threads=1"], "env": [], "metrics": {"cpu.postflop.arena_mb": 104.204192, "cpu.postflop.iteration_ms": 25.86474, "lifecycle.build_ms": 8.4256, "lifecycle.compressed_load_ms": 86.5118, "lifecycle.load_ms": 54.206900000000005, "lifecycle.profile_ms": 551.8426, "lifecycle.report_lines_ms": 63.7061, "lifecycle.save_mb": 104.204944, "lifecycle.save_ms": 220.45929999999998}, "checks": [{"exploitability": 0.36963080697589445, "iteration": 18, "nodes": 208516, "profile_hash": "b0d3ea8a1b19e943", "report_hash": "a757b21c1a6973a3", "save_hash": "b92fb5d3a217da94"}], "score_patterns": []}
{"event": "run", "id": "E019", "path": "reports_profiles", "hypothesis": "Reuse aggregate buffer across raking fitting iterations; preserve the same zeroing and arithmetic order", "status": "candidate", "utc": "2026-09-07T03:17:40+00:00", "commit": "1034aa0519aca67a118c83ad644fcaaaa93af1cc", "seconds": 0.796, "diagnostic_peak_process_mb": 96.362, "returncode": 0, "command": ["python", "research/autoresearch/check_raking.py"], "env": [], "metrics": {"lifecycle.raking_ms": 4.054}, "checks": [{"raking_hash": "aac3ae3fc5347b11", "cases": 512}], "score_patterns": ["lifecycle.raking_ms"]}
{"event": "run", "id": "E019R", "path": "reports_profiles", "hypothesis": "Whole-profile validation of aggregate-buffer reuse against fresh B019, including complete report/profile/save fingerprints", "status": "candidate", "utc": "2026-09-07T03:18:24+00:00", "commit": "1034aa0519aca67a118c83ad644fcaaaa93af1cc", "seconds": 25.984, "diagnostic_peak_process_mb": 536.326, "returncode": 0, "command": ["cargo", "test", "--release", "-p", "solver", "--test", "research_perf", "lifecycle", "--", "--ignored", "--nocapture", "--test-threads=1"], "env": [], "metrics": {"cpu.postflop.arena_mb": 104.204192, "cpu.postflop.iteration_ms": 24.78542, "lifecycle.build_ms": 8.2943, "lifecycle.compressed_load_ms": 83.7658, "lifecycle.load_ms": 51.350699999999996, "lifecycle.profile_ms": 435.5408, "lifecycle.report_lines_ms": 63.1804, "lifecycle.save_mb": 104.204944, "lifecycle.save_ms": 219.7633}, "checks": [{"exploitability": 0.36963080697589445, "iteration": 18, "nodes": 208516, "profile_hash": "b0d3ea8a1b19e943", "report_hash": "a757b21c1a6973a3", "save_hash": "b92fb5d3a217da94"}], "score_patterns": ["lifecycle.profile_ms"]}
{"event": "run", "id": "E019R2", "path": "reports_profiles", "hypothesis": "Repeat whole-profile aggregate-buffer reuse to test the observed gain and all complete lifecycle fingerprints", "status": "candidate", "utc": "2026-09-07T03:18:50+00:00", "commit": "1034aa0519aca67a118c83ad644fcaaaa93af1cc", "seconds": 3.954, "diagnostic_peak_process_mb": 366.572, "returncode": 0, "command": ["cargo", "test", "--release", "-p", "solver", "--test", "research_perf", "lifecycle", "--", "--ignored", "--nocapture", "--test-threads=1"], "env": [], "metrics": {"cpu.postflop.arena_mb": 104.204192, "cpu.postflop.iteration_ms": 25.28494, "lifecycle.build_ms": 8.3689, "lifecycle.compressed_load_ms": 81.7322, "lifecycle.load_ms": 51.2661, "lifecycle.profile_ms": 445.7917, "lifecycle.report_lines_ms": 64.0555, "lifecycle.save_mb": 104.204944, "lifecycle.save_ms": 216.0564}, "checks": [{"exploitability": 0.36963080697589445, "iteration": 18, "nodes": 208516, "profile_hash": "b0d3ea8a1b19e943", "report_hash": "a757b21c1a6973a3", "save_hash": "b92fb5d3a217da94"}], "score_patterns": ["lifecycle.profile_ms"]}
{"event": "validation", "id": "final-main-server", "checkout": "main", "passed": 1, "failed": 0, "ignored": 1, "log": "raw/final-main-server.log", "utc": "2026-09-07T03:20:28.686918+00:00"}
{"event": "run", "id": "E019T", "path": "reports_profiles", "hypothesis": "Correctness gates for reused raking aggregate buffer: solver unit tests and report line semantics", "status": "candidate", "utc": "2026-09-07T03:20:30+00:00", "commit": "1034aa0519aca67a118c83ad644fcaaaa93af1cc", "seconds": 11.844, "diagnostic_peak_process_mb": 526.189, "returncode": 0, "command": ["cargo", "test", "--release", "-p", "solver", "--lib", "--test", "report_lines"], "env": [], "metrics": {}, "checks": [], "score_patterns": []}
{"event": "decision", "id": "E019", "status": "keep", "reason": "Profile generation repeats at 435.54/445.79 ms versus fresh 551.84 ms control; 512 varied cases and all lifecycle fingerprints identical, solver unit and report tests pass. Reuses one aggregate allocation without changing zeroing or arithmetic.", "utc": "2026-09-07T03:20:55+00:00"}
{"event": "decision", "id": "E019R", "status": "keep", "reason": "Profile generation repeats at 435.54/445.79 ms versus fresh 551.84 ms control; 512 varied cases and all lifecycle fingerprints identical, solver unit and report tests pass. Reuses one aggregate allocation without changing zeroing or arithmetic.", "utc": "2026-09-07T03:20:55+00:00"}
{"event": "decision", "id": "E019R2", "status": "keep", "reason": "Profile generation repeats at 435.54/445.79 ms versus fresh 551.84 ms control; 512 varied cases and all lifecycle fingerprints identical, solver unit and report tests pass. Reuses one aggregate allocation without changing zeroing or arithmetic.", "utc": "2026-09-07T03:20:55+00:00"}
{"event": "decision", "id": "E019T", "status": "keep", "reason": "Profile generation repeats at 435.54/445.79 ms versus fresh 551.84 ms control; 512 varied cases and all lifecycle fingerprints identical, solver unit and report tests pass. Reuses one aggregate allocation without changing zeroing or arithmetic.", "utc": "2026-09-07T03:20:55+00:00"}
{"event": "promote", "files": ["crates/solver/src/query.rs"], "commit": "1034aa0519aca67a118c83ad644fcaaaa93af1cc", "utc": "2026-09-07T03:21:04+00:00"}
{"event": "run", "id": "B020", "path": "baseline", "hypothesis": "Fresh CPU six-seat baseline before runtime-selected wider-vector equity calculation; same 18 iterations and complete arena/EV/gap fingerprints", "status": "baseline", "utc": "2026-09-07T03:21:08+00:00", "commit": "1034aa0519aca67a118c83ad644fcaaaa93af1cc", "seconds": 3.172, "diagnostic_peak_process_mb": 773.28, "returncode": 0, "command": ["cargo", "test", "--release", "-p", "solver", "--test", "research_perf", "cpu_preflop", "--", "--ignored", "--nocapture", "--test-threads=1"], "env": [], "metrics": {"cpu.preflop.arena_mb": 224.552328, "cpu.preflop.check_ms": 321.8135, "cpu.preflop.iteration_ms": 76.81178}, "checks": [{"arena_hash": "3f021c64d7c7a141", "evs": [0.11723085944569259, 0.11294138971777481, 0.06514406696957305, 0.07628515082630205, -0.39683870489050355, -0.46397515173140375], "gaps": [0.941004372452971, 0.10522786080636143, 0.20258109159216667, 0.2029610176426232, 0.15556088815149854, 0.11106866681620509], "iteration": 18, "nodes": 166090}], "score_patterns": []}
{"event": "run", "id": "E020", "path": "cpu_solving", "hypothesis": "Runtime AVX2 dispatch widens independent hero-hand lanes with portable fallback and unchanged per-hand multiply/add order", "status": "candidate", "utc": "2026-09-07T03:22:32+00:00", "commit": "42c6ab24335f29442ca874a20922561c209fd9e2", "seconds": 24.688, "diagnostic_peak_process_mb": 773.833, "returncode": 0, "command": ["cargo", "test", "--release", "-p", "solver", "--test", "research_perf", "cpu_preflop", "--", "--ignored", "--nocapture", "--test-threads=1"], "env": [], "metrics": {"cpu.preflop.arena_mb": 224.552328, "cpu.preflop.check_ms": 297.8852, "cpu.preflop.iteration_ms": 71.89982}, "checks": [{"arena_hash": "3f021c64d7c7a141", "evs": [0.11723085944569259, 0.11294138971777481, 0.06514406696957305, 0.07628515082630205, -0.39683870489050355, -0.46397515173140375], "gaps": [0.941004372452971, 0.10522786080636143, 0.20258109159216667, 0.2029610176426232, 0.15556088815149854, 0.11106866681620509], "iteration": 18, "nodes": 166090}], "score_patterns": ["cpu.preflop.*"]}
{"event": "run", "id": "E020R", "path": "cpu_solving", "hypothesis": "Repeat runtime AVX2 dispatch on the frozen six-seat CPU workload, including complete original state fingerprints", "status": "candidate", "utc": "2026-09-07T03:23:29+00:00", "commit": "42c6ab24335f29442ca874a20922561c209fd9e2", "seconds": 2.906, "diagnostic_peak_process_mb": 772.731, "returncode": 0, "command": ["cargo", "test", "--release", "-p", "solver", "--test", "research_perf", "cpu_preflop", "--", "--ignored", "--nocapture", "--test-threads=1"], "env": [], "metrics": {"cpu.preflop.arena_mb": 224.552328, "cpu.preflop.check_ms": 312.4436, "cpu.preflop.iteration_ms": 75.61728}, "checks": [{"arena_hash": "3f021c64d7c7a141", "evs": [0.11723085944569259, 0.11294138971777481, 0.06514406696957305, 0.07628515082630205, -0.39683870489050355, -0.46397515173140375], "gaps": [0.941004372452971, 0.10522786080636143, 0.20258109159216667, 0.2029610176426232, 0.15556088815149854, 0.11106866681620509], "iteration": 18, "nodes": 166090}], "score_patterns": ["cpu.preflop.*"]}
{"event": "run", "id": "E020T", "path": "cpu_solving", "hypothesis": "CPU unit correctness gates, including exact scalar, portable and runtime-vector equity results over 32 varied distributions", "status": "candidate", "utc": "2026-09-07T03:24:07+00:00", "commit": "42c6ab24335f29442ca874a20922561c209fd9e2", "seconds": 8.391, "diagnostic_peak_process_mb": 296.632, "returncode": 0, "command": ["cargo", "test", "--release", "-p", "solver", "--lib"], "env": [], "metrics": {}, "checks": [], "score_patterns": []}
{"event": "run", "id": "E020R2", "path": "cpu_solving", "hypothesis": "Third AVX2 trial to resolve smaller gain in the second repeat before a fresh portable control", "status": "candidate", "utc": "2026-09-07T03:24:46+00:00", "commit": "42c6ab24335f29442ca874a20922561c209fd9e2", "seconds": 2.938, "diagnostic_peak_process_mb": 773.288, "returncode": 0, "command": ["cargo", "test", "--release", "-p", "solver", "--test", "research_perf", "cpu_preflop", "--", "--ignored", "--nocapture", "--test-threads=1"], "env": [], "metrics": {"cpu.preflop.arena_mb": 224.552328, "cpu.preflop.check_ms": 294.4136, "cpu.preflop.iteration_ms": 72.4907}, "checks": [{"arena_hash": "3f021c64d7c7a141", "evs": [0.11723085944569259, 0.11294138971777481, 0.06514406696957305, 0.07628515082630205, -0.39683870489050355, -0.46397515173140375], "gaps": [0.941004372452971, 0.10522786080636143, 0.20258109159216667, 0.2029610176426232, 0.15556088815149854, 0.11106866681620509], "iteration": 18, "nodes": 166090}], "score_patterns": ["cpu.preflop.*"]}
{"event": "run", "id": "B021", "path": "baseline", "hypothesis": "Fresh portable-equity control to separate AVX2 benefit from CPU timing drift", "status": "baseline", "utc": "2026-09-07T03:25:41+00:00", "commit": "c1db0503f180b2ce538478d7c091791d2de85014", "seconds": 25.218, "diagnostic_peak_process_mb": 773.968, "returncode": 0, "command": ["cargo", "test", "--release", "-p", "solver", "--test", "research_perf", "cpu_preflop", "--", "--ignored", "--nocapture", "--test-threads=1"], "env": [], "metrics": {"cpu.preflop.arena_mb": 224.552328, "cpu.preflop.check_ms": 313.432, "cpu.preflop.iteration_ms": 75.23492}, "checks": [{"arena_hash": "3f021c64d7c7a141", "evs": [0.11723085944569259, 0.11294138971777481, 0.06514406696957305, 0.07628515082630205, -0.39683870489050355, -0.46397515173140375], "gaps": [0.941004372452971, 0.10522786080636143, 0.20258109159216667, 0.2029610176426232, 0.15556088815149854, 0.11106866681620509], "iteration": 18, "nodes": 166090}], "score_patterns": []}
{"event": "run", "id": "B021R", "path": "baseline", "hypothesis": "Repeat portable-equity control for the small AVX2 gain", "status": "baseline", "utc": "2026-09-07T03:26:06+00:00", "commit": "c1db0503f180b2ce538478d7c091791d2de85014", "seconds": 3.172, "diagnostic_peak_process_mb": 772.899, "returncode": 0, "command": ["cargo", "test", "--release", "-p", "solver", "--test", "research_perf", "cpu_preflop", "--", "--ignored", "--nocapture", "--test-threads=1"], "env": [], "metrics": {"cpu.preflop.arena_mb": 224.552328, "cpu.preflop.check_ms": 327.37519999999995, "cpu.preflop.iteration_ms": 78.34725999999999}, "checks": [{"arena_hash": "3f021c64d7c7a141", "evs": [0.11723085944569259, 0.11294138971777481, 0.06514406696957305, 0.07628515082630205, -0.39683870489050355, -0.46397515173140375], "gaps": [0.941004372452971, 0.10522786080636143, 0.20258109159216667, 0.2029610176426232, 0.15556088815149854, 0.11106866681620509], "iteration": 18, "nodes": 166090}], "score_patterns": []}
{"event": "run", "id": "E020R3", "path": "cpu_solving", "hypothesis": "Final AVX2 paired repeat after portable controls B021 and B021R; exact complete state must remain unchanged", "status": "candidate", "utc": "2026-09-07T03:27:04+00:00", "commit": "a557aede88743db8efd29f99ef50833847918862", "seconds": 24.797, "diagnostic_peak_process_mb": 773.607, "returncode": 0, "command": ["cargo", "test", "--release", "-p", "solver", "--test", "research_perf", "cpu_preflop", "--", "--ignored", "--nocapture", "--test-threads=1"], "env": [], "metrics": {"cpu.preflop.arena_mb": 224.552328, "cpu.preflop.check_ms": 292.77619999999996, "cpu.preflop.iteration_ms": 73.3495}, "checks": [{"arena_hash": "3f021c64d7c7a141", "evs": [0.11723085944569259, 0.11294138971777481, 0.06514406696957305, 0.07628515082630205, -0.39683870489050355, -0.46397515173140375], "gaps": [0.941004372452971, 0.10522786080636143, 0.20258109159216667, 0.2029610176426232, 0.15556088815149854, 0.11106866681620509], "iteration": 18, "nodes": 166090}], "score_patterns": ["cpu.preflop.*"]}
{"event": "decision", "id": "E020", "status": "keep", "reason": "Four vector repeats versus three portable controls give median iteration 72.92 versus 76.81 ms and check 296.15 versus 321.81 ms (5/8 percent less time). Every complete arena/EV/gap fingerprint matches; unit tests explicitly compare scalar, portable and vector paths. Runtime detection retains portability.", "utc": "2026-09-07T03:27:36+00:00"}
{"event": "decision", "id": "E020R", "status": "keep", "reason": "Four vector repeats versus three portable controls give median iteration 72.92 versus 76.81 ms and check 296.15 versus 321.81 ms (5/8 percent less time). Every complete arena/EV/gap fingerprint matches; unit tests explicitly compare scalar, portable and vector paths. Runtime detection retains portability.", "utc": "2026-09-07T03:27:36+00:00"}
{"event": "decision", "id": "E020R2", "status": "keep", "reason": "Four vector repeats versus three portable controls give median iteration 72.92 versus 76.81 ms and check 296.15 versus 321.81 ms (5/8 percent less time). Every complete arena/EV/gap fingerprint matches; unit tests explicitly compare scalar, portable and vector paths. Runtime detection retains portability.", "utc": "2026-09-07T03:27:36+00:00"}
{"event": "decision", "id": "E020R3", "status": "keep", "reason": "Four vector repeats versus three portable controls give median iteration 72.92 versus 76.81 ms and check 296.15 versus 321.81 ms (5/8 percent less time). Every complete arena/EV/gap fingerprint matches; unit tests explicitly compare scalar, portable and vector paths. Runtime detection retains portability.", "utc": "2026-09-07T03:27:36+00:00"}
{"event": "decision", "id": "E020T", "status": "keep", "reason": "Four vector repeats versus three portable controls give median iteration 72.92 versus 76.81 ms and check 296.15 versus 321.81 ms (5/8 percent less time). Every complete arena/EV/gap fingerprint matches; unit tests explicitly compare scalar, portable and vector paths. Runtime detection retains portability.", "utc": "2026-09-07T03:27:36+00:00"}
{"event": "promote", "files": ["crates/solver/src/preflop/equity.rs"], "commit": "a557aede88743db8efd29f99ef50833847918862", "utc": "2026-09-07T03:27:45+00:00"}
{"event": "validation", "id": "final-main-cpu-v2", "checkout": "main", "passed": 124, "failed": 0, "ignored": 4, "log": "raw/final-main-cpu-v2.log", "utc": "2026-09-07T03:30:27.313097+00:00"}
{"event": "run", "id": "F008", "path": "postflop_cuda", "hypothesis": "Final timing repeat after combined checks; resolve small river checkpoint outlier and confirm deterministic evaluation values", "status": "candidate", "utc": "2026-09-07T03:33:17+00:00", "commit": "a557aede88743db8efd29f99ef50833847918862", "seconds": 41.0, "diagnostic_peak_process_mb": 4735.377, "returncode": 0, "command": ["cargo", "test", "--release", "-p", "solver", "--features", "gpu", "--test", "postflop_perf", "--", "--ignored", "--nocapture", "--test-threads=1"], "env": [], "metrics": {"postflop.Ks7h2d.init_ms": 1000.915, "postflop.Ks7h2d.iteration_ms": 53.089, "postflop.Ks7h2d.check_ms": 33.287, "postflop.Ks7s2d.init_ms": 728.576, "postflop.Ks7s2d.iteration_ms": 31.303, "postflop.Ks7s2d.check_ms": 26.745, "postflop.Ks7h2dQhTc.init_ms": 65.711, "postflop.Ks7h2dQhTc.iteration_ms": 0.295, "postflop.Ks7h2dQhTc.check_ms": 0.555}, "checks": [{"postflop": "POSTFLOP board=Ks7h2d rake=0 nodes=1346813 init_ms=1000.915 iteration_ms=53.089 check_ms=33.287 exploit_chips=1.698464289"}, {"postflop": "POSTFLOP board=Ks7s2d rake=0.05 nodes=1346813 init_ms=728.576 iteration_ms=31.303 check_ms=26.745 exploit_chips=1.329163551"}, {"postflop": "POSTFLOP board=Ks7h2dQhTc rake=0.05 nodes=33 init_ms=65.711 iteration_ms=0.295 check_ms=0.555 exploit_chips=0.140634178"}], "score_patterns": ["postflop.*"]}
{"event": "run", "id": "F009", "path": "preflop_cuda", "hypothesis": "Final time-to-target repeat after all retained changes; six/eight-seat arenas, gaps, EVs and iteration counts must equal original B013", "status": "candidate", "utc": "2026-09-07T03:33:54+00:00", "commit": "a557aede88743db8efd29f99ef50833847918862", "seconds": 18.328, "diagnostic_peak_process_mb": 2107.974, "returncode": 0, "command": ["cargo", "test", "--release", "-p", "solver", "--features", "gpu", "--test", "preflop_target_perf", "--", "--ignored", "--nocapture", "--test-threads=1"], "env": [], "metrics": {"preflop.6.target_seconds": 3.2001564, "preflop.8.target_seconds": 7.9307805}, "checks": [{"arena_hash": "c2dad646abce18b5", "evs": [0.08797255266730505, 0.11134619537831136, 0.14089217263325687, 0.18902651619282607, -0.30302059818816424, -0.4718418733933629], "gap_total": 0.024847662904315698, "gaps": [0.008891930020792499, 0.0028558437428595207, 0.004669706392101347, 0.003544522935725547, 0.0024462647714426633, 0.0024393950413941212], "iteration": 175, "seats": 6}, {"arena_hash": "84a3dfccf7629cc7", "evs": [0.05031450986961973, 0.06125595802790403, 0.07389315031782204, 0.08774957648238482, 0.10797622645047951, 0.14606867660221595, -0.3852499664026161, -0.5872064351282983], "gap_total": 0.020521659486179414, "gaps": [0.00410024124668109, 0.002149521831405564, 0.0020851674306289897, 0.0024997828874374906, 0.0022918593337274834, 0.0023690504386156275, 0.002572443936215363, 0.0024535923814678062], "iteration": 125, "seats": 8}], "score_patterns": ["preflop.*.target_seconds"]}
{"event": "decision", "id": "F008", "status": "keep", "reason": "Final postflop repeat: 53.09/31.30 ms flop iterations, exact evaluation values. Tiny river check returns to 0.555 ms, confirming preceding 1.212 ms observation was an outlier.", "utc": "2026-09-07T03:34:36+00:00"}
{"event": "decision", "id": "F009", "status": "keep", "reason": "Final six/eight-seat time-to-target repeat retains every original iteration, arena, gap and EV bit and confirms the complete-solve speed gains.", "utc": "2026-09-07T03:34:36+00:00"}
{"event": "validation", "id": "final-main-gpu-v2", "checkout": "main", "passed": 40, "failed": 0, "ignored": 0, "log": "raw/final-main-gpu-v2.log", "utc": "2026-09-07T03:34:36+00:00"}
{"event": "validation", "id": "final-main-server-v2", "checkout": "main", "passed": 1, "failed": 0, "ignored": 1, "log": "raw/final-main-server-v2.log", "utc": "2026-09-07T03:34:36+00:00"}
{"event": "complete", "utc": "2026-09-07T03:37:15+00:00", "retained_commit": "a557aede88743db8efd29f99ef50833847918862", "recorded_runs": 87, "numbered_hypotheses": 20, "retained_families": 17, "metrics": 64, "verification": "validation.json", "report": "report.md"}
{"event": "pass_started", "pass": 2, "utc": "2026-09-07T03:59:44.893299+00:00", "baseline_commit": "a557aede88743db8efd29f99ef50833847918862", "paths": ["preflop_cuda", "postflop_cuda", "memory_transfers"], "reason": "User requested further preflop CUDA, postflop CUDA and GPU memory research"}
