{"event": "run", "id": "B013", "path": "baseline", "hypothesis": "Original implementation: time to total preflop gap 0.03 with checks every 25 iterations and complete state fingerprints", "status": "baseline", "utc": "2026-09-07T02:57:27+00:00", "commit": "301a3540f11a355e86d586b8fac42fb1d6c6f82d", "seconds": 53.235, "diagnostic_peak_process_mb": 1602.093, "returncode": 0, "command": ["cargo", "test", "--release", "-p", "solver", "--features", "gpu", "--test", "preflop_target_perf", "--", "--ignored", "--nocapture", "--test-threads=1"], "env": [], "metrics": {"preflop.6.target_seconds": 5.3921866, "preflop.8.target_seconds": 17.6991689}, "checks": [{"arena_hash": "c2dad646abce18b5", "evs": [0.08797255266730505, 0.11134619537831136, 0.14089217263325687, 0.18902651619282607, -0.30302059818816424, -0.4718418733933629], "gap_total": 0.024847662904315698, "gaps": [0.008891930020792499, 0.0028558437428595207, 0.004669706392101347, 0.003544522935725547, 0.0024462647714426633, 0.0024393950413941212], "iteration": 175, "seats": 6}, {"arena_hash": "84a3dfccf7629cc7", "evs": [0.05031450986961973, 0.06125595802790403, 0.07389315031782204, 0.08774957648238482, 0.10797622645047951, 0.14606867660221595, -0.3852499664026161, -0.5872064351282983], "gap_total": 0.020521659486179414, "gaps": [0.00410024124668109, 0.002149521831405564, 0.0020851674306289897, 0.0024997828874374906, 0.0022918593337274834, 0.0023690504386156275, 0.002572443936215363, 0.0024535923814678062], "iteration": 125, "seats": 8}], "score_patterns": []}
{"event": "run", "id": "B014", "path": "baseline", "hypothesis": "Fresh original-code control for CPU solving, report generation, profile raking and persistence", "status": "baseline", "utc": "2026-09-07T03:01:18+00:00", "commit": "301a3540f11a355e86d586b8fac42fb1d6c6f82d", "seconds": 34.891, "diagnostic_peak_process_mb": 772.669, "returncode": 0, "command": ["cargo", "test", "--release", "-p", "solver", "--test", "research_perf", "--", "--ignored", "--nocapture", "--test-threads=1"], "env": [], "metrics": {"cpu.preflop.arena_mb": 224.552328, "cpu.preflop.check_ms": 1424.2441999999999, "cpu.preflop.iteration_ms": 197.01732, "cpu.postflop.arena_mb": 104.204192, "cpu.postflop.iteration_ms": 32.880579999999995, "lifecycle.build_ms": 11.6358, "lifecycle.compressed_load_ms": 83.2808, "lifecycle.load_ms": 49.7383, "lifecycle.profile_ms": 638.0926000000001, "lifecycle.report_lines_ms": 199.1774, "lifecycle.save_mb": 104.204944, "lifecycle.save_ms": 137.171}, "checks": [{"arena_hash": "3f021c64d7c7a141", "evs": [0.11723085944569259, 0.11294138971777481, 0.06514406696957305, 0.07628515082630205, -0.39683870489050355, -0.46397515173140375], "gaps": [0.941004372452971, 0.10522786080636143, 0.20258109159216667, 0.2029610176426232, 0.15556088815149854, 0.11106866681620509], "iteration": 18, "nodes": 166090}, {"exploitability": 0.36963080697589445, "iteration": 18, "nodes": 208516, "profile_hash": "b0d3ea8a1b19e943", "report_hash": "a757b21c1a6973a3", "save_hash": "b92fb5d3a217da94"}], "score_patterns": []}
{"event": "run", "id": "B015", "path": "baseline", "hypothesis": "Fresh original-code postflop throughput and time to 0.3 percent exploitability with fixed 20 iteration checks", "status": "baseline", "utc": "2026-09-07T03:02:10+00:00", "commit": "301a3540f11a355e86d586b8fac42fb1d6c6f82d", "seconds": 32.735, "diagnostic_peak_process_mb": 4273.57, "returncode": 0, "command": ["cargo", "test", "--release", "-p", "solver", "--features", "gpu", "--test", "postflop_perf", "--", "--ignored", "--nocapture", "--test-threads=1"], "env": ["POSTFLOP_PERF_CONVERGENCE=1"], "metrics": {"postflop.Ks7h2d.target_seconds": 11.305, "postflop.Ks7s2d.target_seconds": 6.739, "postflop.Ks7h2dQhTc.target_seconds": 0.022}, "checks": [{"convergence": "POSTFLOP_TARGET board=Ks7h2d iteration=200 seconds=11.305 pct=0.279914604"}, {"convergence": "POSTFLOP_TARGET board=Ks7s2d iteration=200 seconds=6.739 pct=0.255958513"}, {"convergence": "POSTFLOP_TARGET board=Ks7h2dQhTc iteration=60 seconds=0.022 pct=0.269896858"}], "score_patterns": []}
{"event": "run", "id": "B016", "path": "baseline", "hypothesis": "Fresh original-code compressed report adaptation: GPU continuation from iteration 40, profile locked, 40 additional iterations including device setup and CPU sync", "status": "baseline", "utc": "2026-09-07T03:03:16+00:00", "commit": "301a3540f11a355e86d586b8fac42fb1d6c6f82d", "seconds": 46.172, "diagnostic_peak_process_mb": 6523.965, "returncode": 0, "command": ["cargo", "test", "--release", "-p", "server", "--features", "gpu", "report_adaptation_benchmark", "--", "--ignored", "--nocapture", "--test-threads=1"], "env": [], "metrics": {"reports.adaptation_seconds": 5.008}, "checks": [{"report": "REPORT_ADAPT engine=gpu nodes=1346813 seconds=5.008 iterations=80 exploit_pct=8.760296845"}], "score_patterns": []}
{"event": "run", "id": "B017", "path": "baseline", "hypothesis": "Fresh original-code isolated 20-sample warm f32 load control with process peak working set and exact exploitability", "status": "baseline", "utc": "2026-09-07T03:03:45+00:00", "commit": "301a3540f11a355e86d586b8fac42fb1d6c6f82d", "seconds": 1.265, "diagnostic_peak_process_mb": 201.593, "returncode": 0, "command": ["T:\\Dev\\GTOpen\\target\\autoresearch\\workspace\\target\\release\\deps\\load_perf-b0a65e03adb61606.exe", "--ignored", "--nocapture", "--test-threads=1"], "env": [], "metrics": {"lifecycle.warm_load_ms": 47.4907, "lifecycle.load_process_memory_mb": 201.593}, "checks": [{"exploitability": 0.36963080697589445, "iteration": 18, "samples_ms": [45.0029, 45.5494, 45.5809, 46.3499, 46.5104, 46.6362, 46.693400000000004, 46.716300000000004, 47.1481, 47.3521, 47.4907, 47.9135, 47.980599999999995, 48.01, 48.277, 48.5376, 48.6728, 49.3257, 51.4217, 66.2769]}], "score_patterns": []}
{"event": "run", "id": "F001", "path": "preflop_cuda", "hypothesis": "Combined retained implementation: time to the same total gap 0.03 and complete arena fingerprints as B013", "status": "candidate", "utc": "2026-09-07T03:04:50+00:00", "commit": "cd84600bb84b9ff6e98c00d749128a17e4777b31", "seconds": 43.515, "diagnostic_peak_process_mb": 2108.088, "returncode": 0, "command": ["cargo", "test", "--release", "-p", "solver", "--features", "gpu", "--test", "preflop_target_perf", "--", "--ignored", "--nocapture", "--test-threads=1"], "env": [], "metrics": {"preflop.6.target_seconds": 3.2169539, "preflop.8.target_seconds": 7.9860802}, "checks": [{"arena_hash": "c2dad646abce18b5", "evs": [0.08797255266730505, 0.11134619537831136, 0.14089217263325687, 0.18902651619282607, -0.30302059818816424, -0.4718418733933629], "gap_total": 0.024847662904315698, "gaps": [0.008891930020792499, 0.0028558437428595207, 0.004669706392101347, 0.003544522935725547, 0.0024462647714426633, 0.0024393950413941212], "iteration": 175, "seats": 6}, {"arena_hash": "84a3dfccf7629cc7", "evs": [0.05031450986961973, 0.06125595802790403, 0.07389315031782204, 0.08774957648238482, 0.10797622645047951, 0.14606867660221595, -0.3852499664026161, -0.5872064351282983], "gap_total": 0.020521659486179414, "gaps": [0.00410024124668109, 0.002149521831405564, 0.0020851674306289897, 0.0024997828874374906, 0.0022918593337274834, 0.0023690504386156275, 0.002572443936215363, 0.0024535923814678062], "iteration": 125, "seats": 8}], "score_patterns": ["preflop.*.target_seconds"]}
{"event": "run", "id": "F002", "path": "cpu_solving", "hypothesis": "Combined retained CPU and lifecycle implementation versus fresh B014 with all complete fingerprints held fixed", "status": "candidate", "utc": "2026-09-07T03:05:34+00:00", "commit": "cd84600bb84b9ff6e98c00d749128a17e4777b31", "seconds": 28.578, "diagnostic_peak_process_mb": 796.795, "returncode": 0, "command": ["cargo", "test", "--release", "-p", "solver", "--test", "research_perf", "--", "--ignored", "--nocapture", "--test-threads=1"], "env": [], "metrics": {"cpu.preflop.arena_mb": 224.552328, "cpu.preflop.check_ms": 314.7503, "cpu.preflop.iteration_ms": 78.37078, "cpu.postflop.arena_mb": 104.204192, "cpu.postflop.iteration_ms": 30.79714, "lifecycle.build_ms": 8.0688, "lifecycle.compressed_load_ms": 87.80300000000001, "lifecycle.load_ms": 47.4473, "lifecycle.profile_ms": 562.6904000000001, "lifecycle.report_lines_ms": 77.6288, "lifecycle.save_mb": 104.204944, "lifecycle.save_ms": 133.7806}, "checks": [{"arena_hash": "3f021c64d7c7a141", "evs": [0.11723085944569259, 0.11294138971777481, 0.06514406696957305, 0.07628515082630205, -0.39683870489050355, -0.46397515173140375], "gaps": [0.941004372452971, 0.10522786080636143, 0.20258109159216667, 0.2029610176426232, 0.15556088815149854, 0.11106866681620509], "iteration": 18, "nodes": 166090}, {"exploitability": 0.36963080697589445, "iteration": 18, "nodes": 208516, "profile_hash": "b0d3ea8a1b19e943", "report_hash": "a757b21c1a6973a3", "save_hash": "b92fb5d3a217da94"}], "score_patterns": ["cpu.*", "lifecycle.*"]}
{"event": "run", "id": "F003", "path": "postflop_cuda", "hypothesis": "Combined retained postflop implementation versus B015: time to 0.3 percent exploitability with identical 20 iteration checkpoint cadence", "status": "candidate", "utc": "2026-09-07T03:06:32+00:00", "commit": "cd84600bb84b9ff6e98c00d749128a17e4777b31", "seconds": 33.812, "diagnostic_peak_process_mb": 4068.086, "returncode": 0, "command": ["cargo", "test", "--release", "-p", "solver", "--features", "gpu", "--test", "postflop_perf", "--", "--ignored", "--nocapture", "--test-threads=1"], "env": ["POSTFLOP_PERF_CONVERGENCE=1"], "metrics": {"postflop.Ks7h2d.target_seconds": 10.994, "postflop.Ks7s2d.target_seconds": 6.557, "postflop.Ks7h2dQhTc.target_seconds": 0.02}, "checks": [{"convergence": "POSTFLOP_TARGET board=Ks7h2d iteration=200 seconds=10.994 pct=0.275829435"}, {"convergence": "POSTFLOP_TARGET board=Ks7s2d iteration=200 seconds=6.557 pct=0.251358787"}, {"convergence": "POSTFLOP_TARGET board=Ks7h2dQhTc iteration=60 seconds=0.020 pct=0.269896845"}], "score_patterns": ["postflop.*.target_seconds"]}
{"event": "run", "id": "F004", "path": "reports_profiles", "hypothesis": "Combined retained compressed GPU report adaptation versus B016, including device setup and final CPU readback", "status": "candidate", "utc": "2026-09-07T03:07:40+00:00", "commit": "cd84600bb84b9ff6e98c00d749128a17e4777b31", "seconds": 46.094, "diagnostic_peak_process_mb": 6532.239, "returncode": 0, "command": ["cargo", "test", "--release", "-p", "server", "--features", "gpu", "report_adaptation_benchmark", "--", "--ignored", "--nocapture", "--test-threads=1"], "env": [], "metrics": {"reports.adaptation_seconds": 4.925}, "checks": [{"report": "REPORT_ADAPT engine=gpu nodes=1346813 seconds=4.925 iterations=80 exploit_pct=8.768756976"}], "score_patterns": ["reports.adaptation_seconds"]}
{"event": "run", "id": "F005", "path": "build_save_load", "hypothesis": "Combined retained implementation isolated warm f32 loading versus B017, with process peak working set and exact exploitability", "status": "candidate", "utc": "2026-09-07T03:08:20+00:00", "commit": "cd84600bb84b9ff6e98c00d749128a17e4777b31", "seconds": 1.0, "diagnostic_peak_process_mb": 170.627, "returncode": 0, "command": ["T:\\Dev\\GTOpen\\target\\autoresearch\\workspace\\target\\release\\deps\\load_perf-b0a65e03adb61606.exe", "--ignored", "--nocapture", "--test-threads=1"], "env": [], "metrics": {"lifecycle.warm_load_ms": 37.2025, "lifecycle.load_process_memory_mb": 170.627}, "checks": [{"exploitability": 0.36963080697589445, "iteration": 18, "samples_ms": [35.638799999999996, 36.039300000000004, 36.1348, 36.4784, 36.542199999999994, 36.5905, 36.8001, 37.0264, 37.089, 37.1759, 37.2025, 37.4864, 37.500400000000006, 37.7909, 37.8658, 38.035399999999996, 38.1524, 38.5141, 38.5621, 38.8043]}], "score_patterns": ["lifecycle.warm_load_ms", "lifecycle.load_process_memory_mb"]}
{"event": "run", "id": "F006", "path": "preflop_cuda", "hypothesis": "Final combined preflop throughput, checkpoint, CPU sync and actual allocated VRAM; preserve all original 2/6/8-seat fingerprints", "status": "candidate", "utc": "2026-09-07T03:08:50+00:00", "commit": "cd84600bb84b9ff6e98c00d749128a17e4777b31", "seconds": 21.25, "diagnostic_peak_process_mb": 2107.867, "returncode": 0, "command": ["cargo", "test", "--release", "-p", "solver", "--features", "gpu", "--test", "preflop_perf", "--test", "capacity_perf", "--", "--ignored", "--nocapture", "--test-threads=1"], "env": [], "metrics": {"preflop.6.allocated_vram_mb": 671.08864, "preflop.6.build_ms": 76.2565, "preflop.6.cpu_arena_mb": 224.552328, "preflop.6.estimated_vram_mb": 706.776248, "preflop.6.init_ms": 136.7468, "preflop.8.allocated_vram_mb": 1711.276032, "preflop.8.build_ms": 205.267, "preflop.8.cpu_arena_mb": 587.239848, "preflop.8.estimated_vram_mb": 1750.508472, "preflop.8.init_ms": 235.03640000000001, "preflop.2.iteration_ms": 0.084, "preflop.2.check_ms": 0.287, "preflop.2.sync_ms": 0.016, "preflop.6.iteration_ms": 17.892, "preflop.6.check_ms": 12.265, "preflop.6.sync_ms": 25.959, "preflop.8.iteration_ms": 62.182, "preflop.8.check_ms": 38.806, "preflop.8.sync_ms": 68.295}, "checks": [{"nodes": 166090, "note": "Allocated VRAM is device free-memory delta; estimate is the engine preflight formula.", "seats": 6}, {"nodes": 434350, "note": "Allocated VRAM is device free-memory delta; estimate is the engine preflight formula.", "seats": 8}, {"preflop": "PERF seats=2 nodes=40 iteration_ms=0.084 check_ms=0.287 sync_ms=0.016 arena_hash=6d4781fae03e3474 gaps=[0.05088935968248226, 0.013161917444424076] evs=[-0.15795953824550446, -0.4142353804778675]"}, {"preflop": "PERF seats=6 nodes=166090 iteration_ms=17.892 check_ms=12.265 sync_ms=25.959 arena_hash=b70284af63586e3f gaps=[0.10415872559930028, 0.03471900474586882, 0.05645132130650671, 0.04355598961220011, 0.02566278444731196, 0.025583227687036025] evs=[0.08985395657613165, 0.11143259696531381, 0.13262513589238922, 0.15984876666632344, -0.3195691149045554, -0.4656351703726333]"}, {"preflop": "PERF seats=8 nodes=434350 iteration_ms=62.182 check_ms=38.806 sync_ms=68.295 arena_hash=e01dd7a18632644d gaps=[0.022654395639749164, 0.010278385995560232, 0.008437781286659882, 0.011345792287176693, 0.011192070283014638, 0.012086956929344556, 0.01380422891560007, 0.011174031925715422] evs=[0.04857087063871364, 0.05480589083850633, 0.06796224413352651, 0.07993621403632675, 0.0996648260883227, 0.13493690699672048, -0.39486055394849295, -0.5856126067014387]"}], "score_patterns": ["preflop.*"]}
{"event": "run", "id": "F007", "path": "postflop_cuda", "hypothesis": "Final combined postflop throughput and actual memory, plus complete locked/unlocked state matrix versus canonical B010R", "status": "candidate", "utc": "2026-09-07T03:11:28+00:00", "commit": "cd84600bb84b9ff6e98c00d749128a17e4777b31", "seconds": 27.64, "diagnostic_peak_process_mb": 4619.076, "returncode": 0, "command": ["cargo", "test", "--release", "-p", "solver", "--features", "gpu", "--test", "postflop_perf", "--test", "postflop_capacity_perf", "--test", "postflop_state_perf", "--", "--ignored", "--nocapture", "--test-threads=1"], "env": [], "metrics": {"postflop.Ks7h2d.iso.allocated_vram_mb": 6241.124352, "postflop.Ks7h2d.iso.estimated_vram_mb": 6716.6347, "postflop.Ks7h2d.iso.init_ms": 847.0521, "postflop.Ks7h2d.iso.plan_build_ms": 96.515, "postflop.Ks7h2d.iso.staging_memory_mb": 3380.293588, "postflop.Ks7s2d.iso.allocated_vram_mb": 4932.501504, "postflop.Ks7s2d.iso.estimated_vram_mb": 6737.546704, "postflop.Ks7s2d.iso.init_ms": 751.8158999999999, "postflop.Ks7s2d.iso.plan_build_ms": 71.5932, "postflop.Ks7s2d.iso.staging_memory_mb": 2063.622928, "postflop.Ks7s2d.full.allocated_vram_mb": 6274.678784, "postflop.Ks7s2d.full.estimated_vram_mb": 6737.546704, "postflop.Ks7s2d.full.init_ms": 792.2909, "postflop.Ks7s2d.full.plan_build_ms": 97.6343, "postflop.Ks7s2d.full.staging_memory_mb": 3391.473816, "postflop.Ks7h2d.init_ms": 1073.74, "postflop.Ks7h2d.iteration_ms": 53.174, "postflop.Ks7h2d.check_ms": 33.255, "postflop.Ks7s2d.init_ms": 743.129, "postflop.Ks7s2d.iteration_ms": 31.423, "postflop.Ks7s2d.check_ms": 26.827, "postflop.Ks7h2dQhTc.init_ms": 65.914, "postflop.Ks7h2dQhTc.iteration_ms": 0.297, "postflop.Ks7h2dQhTc.check_ms": 1.212}, "checks": [{"board": "Ks7h2d", "nodes": 1346813, "use_isomorphism": true}, {"board": "Ks7s2d", "nodes": 1346813, "use_isomorphism": true}, {"board": "Ks7s2d", "nodes": 1346813, "use_isomorphism": false}, {"postflop": "POSTFLOP board=Ks7h2d rake=0 nodes=1346813 init_ms=1073.740 iteration_ms=53.174 check_ms=33.255 exploit_chips=1.698464289"}, {"postflop": "POSTFLOP board=Ks7s2d rake=0.05 nodes=1346813 init_ms=743.129 iteration_ms=31.423 check_ms=26.827 exploit_chips=1.329163551"}, {"postflop": "POSTFLOP board=Ks7h2dQhTc rake=0.05 nodes=33 init_ms=65.914 iteration_ms=0.297 check_ms=1.212 exploit_chips=0.140634178"}, {"board": "KsQs2d", "iso": false, "rake": 0.0, "states": [{"exploit_bits": 4587303795425830328, "hash": "ced25cd534160a7a", "locked": false}, {"exploit_bits": 4581640868563274656, "hash": "8729320849b9d33c", "locked": true}]}, {"board": "KsQs2d", "iso": false, "rake": 0.05, "states": [{"exploit_bits": 4587469623950769688, "hash": "dce9b2717e0df16e", "locked": false}, {"exploit_bits": 4581722223845122880, "hash": "99111fb9c8ec709b", "locked": true}]}, {"board": "KsQs2d", "iso": true, "rake": 0.0, "states": [{"exploit_bits": 4587284094896033288, "hash": "f28b67b0f43f8498", "locked": false}, {"exploit_bits": 4581629036489079792, "hash": "52fbd9a266ab35c1", "locked": true}]}, {"board": "KsQs2d", "iso": true, "rake": 0.05, "states": [{"exploit_bits": 4587467559043767640, "hash": "7abb90d6fa5ac2fc", "locked": false}, {"exploit_bits": 4581695983154347840, "hash": "b529102cce25dc39", "locked": true}]}, {"board": "Qs7h2dKh", "iso": false, "rake": 0.0, "states": [{"exploit_bits": 4582461738720506392, "hash": "816eeeb55df5fe5c", "locked": false}, {"exploit_bits": 4576041536399700112, "hash": "202311fe47670cc0", "locked": true}]}, {"board": "Qs7h2dKh", "iso": false, "rake": 0.05, "states": [{"exploit_bits": 4583407264393491801, "hash": "ed2549bfcfbc34f1", "locked": false}, {"exploit_bits": 4576219535588436580, "hash": "8217b6d74d4da526", "locked": true}]}, {"board": "Qs7h2dKh", "iso": true, "rake": 0.0, "states": [{"exploit_bits": 4582461738720506392, "hash": "816eeeb55df5fe5c", "locked": false}, {"exploit_bits": 4576041536399700112, "hash": "202311fe47670cc0", "locked": true}]}, {"board": "Qs7h2dKh", "iso": true, "rake": 0.05, "states": [{"exploit_bits": 4583407264393491801, "hash": "ed2549bfcfbc34f1", "locked": false}, {"exploit_bits": 4576219535588436580, "hash": "8217b6d74d4da526", "locked": true}]}, {"board": "AsKsQsJsTs", "iso": false, "rake": 0.0, "states": [{"exploit_bits": 4554443791804951647, "hash": "7f53c8ac5434860d", "locked": false}, {"exploit_bits": 4545576682231338880, "hash": "409995a6b2afc105", "locked": true}]}, {"board": "AsKsQsJsTs", "iso": false, "rake": 0.05, "states": [{"exploit_bits": 4566905886187841344, "hash": "af8ff4550d82f9ef", "locked": false}, {"exploit_bits": 4558330255933400576, "hash": "db670420a8559b3f", "locked": true}]}, {"board": "AsKsQsJsTs", "iso": true, "rake": 0.0, "states": [{"exploit_bits": 4554443791804951647, "hash": "7f53c8ac5434860d", "locked": false}, {"exploit_bits": 4545576682231338880, "hash": "409995a6b2afc105", "locked": true}]}, {"board": "AsKsQsJsTs", "iso": true, "rake": 0.05, "states": [{"exploit_bits": 4566905886187841344, "hash": "af8ff4550d82f9ef", "locked": false}, {"exploit_bits": 4558330255933400576, "hash": "db670420a8559b3f", "locked": true}]}], "score_patterns": ["postflop.*"]}
{"event": "harness_registered", "file": "crates/solver/tests/preflop_budget.rs", "sha256": "9a725e8003ef5fec9f3a6320b97c44dfdd1e4d3276cbe12a530bd2df3fcd904d", "reason": "Additional large-game cache-versus-tight-budget equivalence, frozen before first execution", "utc": "2026-09-07T03:13:27.679249+00:00"}
{"event": "decision", "id": "F001", "status": "keep", "reason": "Combined retained code reaches identical six/eight-seat iterations, full arenas, gaps and EVs in 40/55 percent less time than fresh B013.", "utc": "2026-09-07T03:15:00+00:00"}
{"event": "decision", "id": "F002", "status": "keep", "reason": "Combined retained CPU/lifecycle code matches every B014 fingerprint. CPU preflop and report/profile gains persist; unrelated build/save fluctuations are not attributed as gains.", "utc": "2026-09-07T03:15:00+00:00"}
{"event": "decision", "id": "F003", "status": "keep", "reason": "Both flop cases reach the same 0.3 percent target at 200 iterations about 3 percent sooner than fresh B015; retained deterministic reductions and compact buffers.", "utc": "2026-09-07T03:15:00+00:00"}
{"event": "decision", "id": "F004", "status": "keep", "reason": "Validation of combined retained code. Report adaptation remains near a tie versus B016; no additional adaptation speed gain is claimed.", "utc": "2026-09-07T03:15:00+00:00"}
{"event": "decision", "id": "F005", "status": "keep", "reason": "Fresh isolated load control confirms 22 percent less time and 15 percent lower process peak working set, with identical fixture exploitability.", "utc": "2026-09-07T03:15:00+00:00"}
{"event": "decision", "id": "F006", "status": "keep", "reason": "Final 2/6/8 arena hashes, per-seat gaps and EVs exactly match B001. Actual VRAM includes optional equity cache; checkpoints retain their speed gain.", "utc": "2026-09-07T03:15:00+00:00"}
{"event": "decision", "id": "F007", "status": "keep", "reason": "Final 24 complete postflop saved states and evaluation bits match B010R. VRAM reductions persist. Small river timing is noisy; final repeat planned.", "utc": "2026-09-07T03:15:00+00:00"}
{"event": "validation", "id": "final-main-cpu", "checkout": "main", "passed": 124, "failed": 0, "ignored": 4, "log": "raw/final-main-cpu.log", "utc": "2026-09-07T03:15:46.125011+00:00"}
