{"event": "run", "id": "E035R", "path": "preflop_cuda", "hypothesis": "Repeat exact128-thread reach reduction across all large seat counts and fixed convergence targets", "status": "candidate", "utc": "2026-09-07T06:03:39+00:00", "commit": "db5b25e164576dfb237f0b8a78ab07f41f8682ba", "seconds": 52.891, "diagnostic_peak_process_mb": 8234.222, "returncode": 0, "command": ["cargo", "test", "--release", "-p", "solver", "--features", "gpu", "--test", "preflop_perf", "--test", "preflop_generic_perf", "--test", "preflop_target_perf", "--test", "preflop_gpu", "--test", "cuda_resources", "--", "--include-ignored", "--nocapture", "--test-threads=1"], "env": [], "metrics": {"preflop.3.iteration_ms": 0.237, "preflop.3.check_ms": 0.622, "preflop.3.sync_ms": 0.124, "preflop.5.iteration_ms": 2.478, "preflop.5.check_ms": 2.728, "preflop.5.sync_ms": 4.819, "preflop.7.iteration_ms": 11.298, "preflop.7.check_ms": 9.033, "preflop.7.sync_ms": 17.643, "preflop.9.iteration_ms": 227.091, "preflop.9.check_ms": 161.381, "preflop.9.sync_ms": 293.034, "preflop.2.iteration_ms": 0.084, "preflop.2.check_ms": 0.299, "preflop.2.sync_ms": 0.019, "preflop.6.iteration_ms": 15.105, "preflop.6.check_ms": 12.653, "preflop.6.sync_ms": 27.846, "preflop.8.iteration_ms": 52.933, "preflop.8.check_ms": 39.323, "preflop.8.sync_ms": 66.533, "preflop.6.target_seconds": 2.696802, "preflop.8.target_seconds": 6.7872369}, "checks": [{"area": "postflop", "kernel": "down_action", "local_bytes_per_thread": 0, "registers": 48, "static_shared_bytes": 0}, {"area": "postflop", "kernel": "up_action", "local_bytes_per_thread": 0, "registers": 66, "static_shared_bytes": 0}, {"area": "postflop", "kernel": "up_action_eval", "local_bytes_per_thread": 0, "registers": 40, "static_shared_bytes": 0}, {"area": "postflop", "kernel": "up_show", "local_bytes_per_thread": 0, "registers": 40, "static_shared_bytes": 1040}, {"area": "postflop", "kernel": "up_fold", "local_bytes_per_thread": 0, "registers": 40, "static_shared_bytes": 1232}, {"area": "preflop", "kernel": "pf_down", "local_bytes_per_thread": 64, "registers": 40, "static_shared_bytes": 0}, {"area": "preflop", "kernel": "pf_up", "local_bytes_per_thread": 64, "registers": 40, "static_shared_bytes": 0}, {"area": "preflop", "kernel": "pf_terminal", "local_bytes_per_thread": 0, "registers": 40, "static_shared_bytes": 44}, {"area": "preflop", "kernel": "pf_reach_mass", "local_bytes_per_thread": 0, "registers": 10, "static_shared_bytes": 512}, {"area": "preflop", "kernel": "pf_terminal_2", "local_bytes_per_thread": 0, "registers": 40, "static_shared_bytes": 0}, {"area": "preflop", "kernel": "pf_terminal_6", "local_bytes_per_thread": 0, "registers": 48, "static_shared_bytes": 0}, {"area": "preflop", "kernel": "pf_terminal_8", "local_bytes_per_thread": 0, "registers": 64, "static_shared_bytes": 0}, {"preflop": "PERF seats=3 nodes=430 iteration_ms=0.237 check_ms=0.622 sync_ms=0.124 arena_hash=ad8e0571988ea8d1 gaps=[0.05411917144329437, 0.020649702738510856, 0.023660626623397518] evs=[0.18057702354014996, -0.2964069280900554, -0.40403772274038074]"}, {"preflop": "PERF seats=5 nodes=25666 iteration_ms=2.478 check_ms=2.728 sync_ms=4.819 arena_hash=eacd3b740ba36a87 gaps=[0.025314965158686198, 0.024440227289712735, 0.05095333293826351, 0.02204052445371546, 0.035784321232043226] evs=[0.10492140038019776, 0.12720748057673634, 0.16157980442678233, -0.3295918169553824, -0.5837288241230508]"}, {"preflop": "PERF seats=7 nodes=101410 iteration_ms=11.298 check_ms=9.033 sync_ms=17.643 arena_hash=4d7fd195a99ae236 gaps=[0.03553805162282347, 0.007648762560631045, 0.01097738780437467, 0.014944471542742727, 0.016296028635770565, 0.012559587798595728, 0.010483293730444543] evs=[0.05280050956560466, 0.0656873532014755, 0.0779941161034474, 0.09649242795931973, 0.13524390893043642, -0.38923558977054057, -0.5455678317382016]"}, {"preflop": "PERF seats=9 nodes=1825426 iteration_ms=227.091 check_ms=161.381 sync_ms=293.034 arena_hash=c0e1bd383cfd2aff gaps=[0.02448954424457915, 0.02070868826099758, 0.012772372472253046, 0.010359589852781348, 0.017246776149790838, 0.017663266297577446, 0.02407000279366972, 0.012083211967836571, 0.01758857953274018] evs=[0.039436230451638576, 0.04524954656088196, 0.05473733184401432, 0.06773912486076317, 0.07452635556321599, 0.09305239435036294, 0.12108596285718132, -0.39379665413775883, -0.6140353649962962]"}, {"preflop": "PERF seats=2 nodes=40 iteration_ms=0.084 check_ms=0.299 sync_ms=0.019 arena_hash=6d4781fae03e3474 gaps=[0.05088935968248226, 0.013161917444424076] evs=[-0.15795953824550446, -0.4142353804778675]"}, {"preflop": "PERF seats=6 nodes=166090 iteration_ms=15.105 check_ms=12.653 sync_ms=27.846 arena_hash=b70284af63586e3f gaps=[0.10415872559930028, 0.03471900474586882, 0.05645132130650671, 0.04355598961220011, 0.02566278444731196, 0.025583227687036025] evs=[0.08985395657613165, 0.11143259696531381, 0.13262513589238922, 0.15984876666632344, -0.3195691149045554, -0.4656351703726333]"}, {"preflop": "PERF seats=8 nodes=434350 iteration_ms=52.933 check_ms=39.323 sync_ms=66.533 arena_hash=e01dd7a18632644d gaps=[0.022654395639749164, 0.010278385995560232, 0.008437781286659882, 0.011345792287176693, 0.011192070283014638, 0.012086956929344556, 0.01380422891560007, 0.011174031925715422] evs=[0.04857087063871364, 0.05480589083850633, 0.06796224413352651, 0.07993621403632675, 0.0996648260883227, 0.13493690699672048, -0.39486055394849295, -0.5856126067014387]"}, {"arena_hash": "c2dad646abce18b5", "evs": [0.08797255266730505, 0.11134619537831136, 0.14089217263325687, 0.18902651619282607, -0.30302059818816424, -0.4718418733933629], "gap_total": 0.024847662904315698, "gaps": [0.008891930020792499, 0.0028558437428595207, 0.004669706392101347, 0.003544522935725547, 0.0024462647714426633, 0.0024393950413941212], "iteration": 175, "seats": 6}, {"arena_hash": "84a3dfccf7629cc7", "evs": [0.05031450986961973, 0.06125595802790403, 0.07389315031782204, 0.08774957648238482, 0.10797622645047951, 0.14606867660221595, -0.3852499664026161, -0.5872064351282983], "gap_total": 0.020521659486179414, "gaps": [0.00410024124668109, 0.002149521831405564, 0.0020851674306289897, 0.0024997828874374906, 0.0022918593337274834, 0.0023690504386156275, 0.002572443936215363, 0.0024535923814678062], "iteration": 125, "seats": 8}], "score_patterns": []}
{"event": "decision", "id": "E035", "status": "keep", "reason": "Identical original256-lane addition order mapped to128threads; focused signed-zero/subnormal/mixed-magnitude test passes. Six-seat iteration15.16/15.11ms vs16.68ms,8-seat53.49/52.93ms vs58.06ms,9-seat227.09ms vs252.74ms. All7full/48variant states, exact target states, tight cache fallback and30unit+5GPU tests pass.", "utc": "2026-09-07T06:05:07+00:00"}
{"event": "decision", "id": "E035R", "status": "keep", "reason": "Identical original256-lane addition order mapped to128threads; focused signed-zero/subnormal/mixed-magnitude test passes. Six-seat iteration15.16/15.11ms vs16.68ms,8-seat53.49/52.93ms vs58.06ms,9-seat227.09ms vs252.74ms. All7full/48variant states, exact target states, tight cache fallback and30unit+5GPU tests pass.", "utc": "2026-09-07T06:05:07+00:00"}
{"event": "promote", "files": ["crates/solver/src/preflop/gpu.rs", "crates/solver/src/preflop/kernels.cu"], "commit": "db5b25e164576dfb237f0b8a78ab07f41f8682ba", "utc": "2026-09-07T06:05:28+00:00"}
{"event": "refresh_compiler_inputs", "utc": "2026-09-07T06:05:30+00:00", "files": ["crates/solver/src/preflop/kernels.cu"], "reason": "Content changes must invalidate Cargo even after copies preserving old mtimes"}
