{"event": "run", "id": "E026R", "path": "memory_transfers", "hypothesis": "Repeat CFV lifetime reuse on default compressed lifecycle, validate GPU suite and unchanged fixed postflop accuracy targets", "status": "candidate", "utc": "2026-09-07T05:01:53+00:00", "commit": "bc699c7195b02a8a9e30d8d54ec6ef2fb3e27ac1", "seconds": 58.0, "diagnostic_peak_process_mb": 4072.899, "returncode": 0, "command": ["cargo", "test", "--release", "-p", "solver", "--features", "gpu", "--test", "gpu", "--test", "postflop_memory_perf", "--test", "postflop_perf", "--", "--include-ignored", "--nocapture", "--test-threads=1"], "env": ["POSTFLOP_PERF_CONVERGENCE=1"], "metrics": {"postflop.memory.cold.f32.allocated_vram_mb": 4731.174912, "postflop.memory.cold.f32.host_live_mb": 3917.725696, "postflop.memory.cold.f32.host_private_mb": 9231.069184, "postflop.memory.cold.f32.init_ms": 697.9680999999999, "postflop.memory.cold.f32.strategy_sync_ms": 152.418, "postflop.memory.cold.f32.sync_ms": 311.9439, "postflop.memory.warm.f32.allocated_vram_mb": 4731.174912, "postflop.memory.warm.f32.host_live_mb": 3936.702464, "postflop.memory.warm.f32.host_private_mb": 9246.359552, "postflop.memory.warm.f32.init_ms": 697.3841, "postflop.memory.warm.f32.strategy_sync_ms": 155.1129, "postflop.memory.warm.f32.sync_ms": 314.3326, "postflop.memory.cold.compressed.allocated_vram_mb": 3623.878656, "postflop.memory.cold.compressed.host_live_mb": 2303.987712, "postflop.memory.cold.compressed.host_private_mb": 6506.487808, "postflop.memory.cold.compressed.init_ms": 587.252, "postflop.memory.cold.compressed.strategy_sync_ms": 118.6593, "postflop.memory.cold.compressed.sync_ms": 244.0917, "postflop.memory.warm.compressed.allocated_vram_mb": 3623.878656, "postflop.memory.warm.compressed.host_live_mb": 3769.270272, "postflop.memory.warm.compressed.host_private_mb": 8126.603264, "postflop.memory.warm.compressed.init_ms": 964.0419999999999, "postflop.memory.warm.compressed.strategy_sync_ms": 141.5005, "postflop.memory.warm.compressed.sync_ms": 283.9759, "postflop.Ks7h2d.target_seconds": 10.664, "postflop.Ks7s2d.target_seconds": 6.525, "postflop.Ks7h2dQhTc.target_seconds": 0.019}, "checks": [{"memory_checks": [{"exploit_bits": 4635171514568527266, "iteration": 5}, {"exploit_bits": 4628956113180057410, "iteration": 10}, {"exploit_bits": 4624490585901877567, "iteration": 15}], "storage": "F32", "warm": false}, {"memory_checks": [{"exploit_bits": 4619248813860274839, "iteration": 25}, {"exploit_bits": 4617407200860962841, "iteration": 30}, {"exploit_bits": 4616217340056387513, "iteration": 35}], "storage": "F32", "warm": true}, {"memory_checks": [{"exploit_bits": 4635171514568527266, "iteration": 5}, {"exploit_bits": 4628919606694372554, "iteration": 10}, {"exploit_bits": 4624481349270140468, "iteration": 15}], "storage": "Compressed", "warm": false}, {"memory_checks": [{"exploit_bits": 4619250289695226916, "iteration": 25}, {"exploit_bits": 4617408694201541058, "iteration": 30}, {"exploit_bits": 4616218029189393624, "iteration": 35}], "storage": "Compressed", "warm": true}, {"convergence": "POSTFLOP_TARGET board=Ks7h2d iteration=200 seconds=10.664 pct=0.275829435"}, {"convergence": "POSTFLOP_TARGET board=Ks7s2d iteration=200 seconds=6.525 pct=0.251358787"}, {"convergence": "POSTFLOP_TARGET board=Ks7h2dQhTc iteration=60 seconds=0.019 pct=0.269896845"}], "score_patterns": ["*allocated_vram_mb", "*staging_memory_mb"]}
{"event": "decision", "id": "E026A", "status": "keep", "reason": "Repeated 201-336 MB VRAM saving with unchanged kernel count and no time regression; default compressed two-tone allocation now3.624GB. All112 resume/24 original states exact, GPU suite passes and target iteration/final exploitability unchanged", "utc": "2026-09-07T05:04:36+00:00"}
{"event": "decision", "id": "E026R", "status": "keep", "reason": "Repeated 201-336 MB VRAM saving with unchanged kernel count and no time regression; default compressed two-tone allocation now3.624GB. All112 resume/24 original states exact, GPU suite passes and target iteration/final exploitability unchanged", "utc": "2026-09-07T05:04:36+00:00"}
{"event": "promote", "files": ["crates/solver/src/gpu/plan.rs"], "commit": "bc699c7195b02a8a9e30d8d54ec6ef2fb3e27ac1", "utc": "2026-09-07T05:04:49+00:00"}
{"event": "harness_added", "utc": "2026-09-07T05:05:00.370022+00:00", "file": "crates/solver/tests/postflop_full_memory_perf.rs", "sha256": "e7d35da59d72d5a3d448aa7e5c12dd7a7aef6dbb6eb99e3ceff1ee6cb8326636", "reason": "Freeze rainbow cold/warm default-compressed lifecycle and Windows memory counters before full-arena transfer optimization; same underlying standard flop benchmark"}
{"event": "run", "id": "B028", "path": "memory_transfers", "hypothesis": "Fresh default-compressed rainbow report adaptation and continuation reference before optimizing full-arena staging and encoding", "status": "baseline", "utc": "2026-09-07T05:05:36+00:00", "commit": "bc699c7195b02a8a9e30d8d54ec6ef2fb3e27ac1", "seconds": 45.578, "diagnostic_peak_process_mb": 4973.371, "returncode": 0, "command": ["cargo", "test", "--release", "-p", "server", "--features", "gpu", "--", "--include-ignored", "--nocapture", "--test-threads=1"], "env": [], "metrics": {"reports.adaptation_seconds": 4.914}, "checks": [{"report": "REPORT_ADAPT engine=gpu nodes=1346813 seconds=4.914 iterations=80 exploit_pct=8.768756976"}], "score_patterns": []}
{"event": "refresh_compiler_inputs", "utc": "2026-09-07T05:06:37+00:00", "files": ["crates/solver/tests/postflop_full_memory_perf.rs"], "reason": "Content changes must invalidate Cargo even after copies preserving old mtimes"}
{"event": "run", "id": "B029", "path": "memory_transfers", "hypothesis": "Cold/warm rainbow compressed full-arena host memory, initialization and transfer reference before direct pinned staging and parallel encode", "status": "baseline", "utc": "2026-09-07T05:07:12+00:00", "commit": "e342fbb7333ecc93c8ee59ee6b6efe0ca67ce2b7", "seconds": 34.859, "diagnostic_peak_process_mb": 3374.854, "returncode": 0, "command": ["cargo", "test", "--release", "-p", "solver", "--features", "gpu", "--test", "postflop_full_memory_perf", "--", "--ignored", "--nocapture", "--test-threads=1"], "env": [], "metrics": {"postflop.memory.rainbow.cold.compressed.allocated_vram_mb": 5905.580032, "postflop.memory.rainbow.cold.compressed.host_live_mb": 3309.121536, "postflop.memory.rainbow.cold.compressed.host_private_mb": 9568.632832, "postflop.memory.rainbow.cold.compressed.init_ms": 1314.2924, "postflop.memory.rainbow.cold.compressed.strategy_sync_ms": 631.1427, "postflop.memory.rainbow.cold.compressed.sync_ms": 1203.8546000000001, "postflop.memory.rainbow.warm.compressed.allocated_vram_mb": 5905.580032, "postflop.memory.rainbow.warm.compressed.host_live_mb": 3317.088256, "postflop.memory.rainbow.warm.compressed.host_private_mb": 9574.076416, "postflop.memory.rainbow.warm.compressed.init_ms": 1344.4519, "postflop.memory.rainbow.warm.compressed.strategy_sync_ms": 659.9166, "postflop.memory.rainbow.warm.compressed.sync_ms": 1270.0653}, "checks": [{"memory_checks": [{"exploit_bits": 4635293868072649448, "iteration": 5}, {"exploit_bits": 4630023946365015954, "iteration": 10}, {"exploit_bits": 4625769973037188852, "iteration": 15}], "storage": "Compressed", "warm": false}, {"memory_checks": [{"exploit_bits": 4619888790163774590, "iteration": 25}, {"exploit_bits": 4617985406012120520, "iteration": 30}, {"exploit_bits": 4616854213690844608, "iteration": 35}], "storage": "Compressed", "warm": true}], "score_patterns": []}
{"event": "refresh_compiler_inputs", "utc": "2026-09-07T05:08:17+00:00", "files": ["crates/solver/src/gpu/arena.rs", "crates/solver/src/gpu/mod.rs"], "reason": "Content changes must invalidate Cargo even after copies preserving old mtimes"}
