{"event": "run", "id": "E005", "path": "reports_profiles", "hypothesis": "Cache board hand categories across betting lines within each report, preserving all summaries", "status": "candidate", "utc": "2026-09-07T01:09:56+00:00", "commit": "6155843a3b3c09a5c8df108e96bc5a9214041941", "seconds": 36.484, "diagnostic_peak_process_mb": 639.771, "returncode": 0, "command": ["cargo", "test", "--release", "-p", "solver", "--features", "gpu", "--test", "research_perf", "lifecycle", "--", "--ignored", "--nocapture", "--test-threads=1"], "env": [], "metrics": {"cpu.postflop.arena_mb": 104.204192, "cpu.postflop.iteration_ms": 32.12578, "lifecycle.build_ms": 8.9164, "lifecycle.compressed_load_ms": 86.0775, "lifecycle.load_ms": 56.057, "lifecycle.profile_ms": 681.2804, "lifecycle.report_lines_ms": 68.4324, "lifecycle.save_mb": 104.204944, "lifecycle.save_ms": 221.0823}, "checks": [{"exploitability": 0.36963080697589445, "iteration": 18, "nodes": 208516, "profile_hash": "b0d3ea8a1b19e943", "report_hash": "a757b21c1a6973a3", "save_hash": "b92fb5d3a217da94"}]}
{"event": "run", "id": "E005R", "path": "reports_profiles", "hypothesis": "Repeat board-category caching; pooled report and profile behavior tests passed", "status": "candidate", "utc": "2026-09-07T01:11:56+00:00", "commit": "6155843a3b3c09a5c8df108e96bc5a9214041941", "seconds": 4.719, "diagnostic_peak_process_mb": 394.834, "returncode": 0, "command": ["cargo", "test", "--release", "-p", "solver", "--features", "gpu", "--test", "research_perf", "lifecycle", "--", "--ignored", "--nocapture", "--test-threads=1"], "env": [], "metrics": {"cpu.postflop.arena_mb": 104.204192, "cpu.postflop.iteration_ms": 28.47708, "lifecycle.build_ms": 8.6211, "lifecycle.compressed_load_ms": 85.1046, "lifecycle.load_ms": 66.054, "lifecycle.profile_ms": 647.8914, "lifecycle.report_lines_ms": 67.70439999999999, "lifecycle.save_mb": 104.204944, "lifecycle.save_ms": 220.3318}, "checks": [{"exploitability": 0.36963080697589445, "iteration": 18, "nodes": 208516, "profile_hash": "b0d3ea8a1b19e943", "report_hash": "a757b21c1a6973a3", "save_hash": "b92fb5d3a217da94"}], "score_patterns": ["lifecycle.report_lines_ms"]}
{"event": "decision", "id": "E005", "status": "keep", "reason": "Reports improve from 212.4025 ms to 68.4324/67.7044 ms with identical complete JSON hash. Root and pooled-turn report comparisons plus profile behavior pass.", "utc": "2026-09-07T01:13:12+00:00"}
{"event": "decision", "id": "E005R", "status": "keep", "reason": "Repeat confirms 68% lower report time and identical report, profile and save fingerprints.", "utc": "2026-09-07T01:13:17+00:00"}
{"event": "promote", "files": ["crates/solver/src/report.rs"], "commit": "9004a81ef2e7087b5a84c3676922a342c80ebb7e", "utc": "2026-09-07T01:13:23+00:00"}
{"event": "run", "id": "E006", "path": "build_save_load", "hypothesis": "Eliminate temporary f32 arena allocations and copies during load, retaining validation and file format", "status": "candidate", "utc": "2026-09-07T01:14:00+00:00", "commit": "9004a81ef2e7087b5a84c3676922a342c80ebb7e", "seconds": 37.219, "diagnostic_peak_process_mb": 642.654, "returncode": 0, "command": ["cargo", "test", "--release", "-p", "solver", "--features", "gpu", "--test", "research_perf", "lifecycle", "--", "--ignored", "--nocapture", "--test-threads=1"], "env": [], "metrics": {"cpu.postflop.arena_mb": 104.204192, "cpu.postflop.iteration_ms": 27.196720000000003, "lifecycle.build_ms": 8.4949, "lifecycle.compressed_load_ms": 92.4106, "lifecycle.load_ms": 58.6604, "lifecycle.profile_ms": 651.1934, "lifecycle.report_lines_ms": 70.5333, "lifecycle.save_mb": 104.204944, "lifecycle.save_ms": 221.40779999999998}, "checks": [{"exploitability": 0.36963080697589445, "iteration": 18, "nodes": 208516, "profile_hash": "b0d3ea8a1b19e943", "report_hash": "a757b21c1a6973a3", "save_hash": "b92fb5d3a217da94"}], "score_patterns": ["lifecycle.load_ms"]}
{"event": "run", "id": "E006R", "path": "build_save_load", "hypothesis": "Repeat direct-arena load after warm controls; compare both latency and process memory", "status": "candidate", "utc": "2026-09-07T01:16:05+00:00", "commit": "9004a81ef2e7087b5a84c3676922a342c80ebb7e", "seconds": 4.75, "diagnostic_peak_process_mb": 367.313, "returncode": 0, "command": ["cargo", "test", "--release", "-p", "solver", "--features", "gpu", "--test", "research_perf", "lifecycle", "--", "--ignored", "--nocapture", "--test-threads=1"], "env": [], "metrics": {"cpu.postflop.arena_mb": 104.204192, "cpu.postflop.iteration_ms": 32.7023, "lifecycle.build_ms": 9.134, "lifecycle.compressed_load_ms": 96.8628, "lifecycle.load_ms": 43.0471, "lifecycle.profile_ms": 681.342, "lifecycle.report_lines_ms": 72.2329, "lifecycle.save_mb": 104.204944, "lifecycle.save_ms": 221.5483}, "checks": [{"exploitability": 0.36963080697589445, "iteration": 18, "nodes": 208516, "profile_hash": "b0d3ea8a1b19e943", "report_hash": "a757b21c1a6973a3", "save_hash": "b92fb5d3a217da94"}], "score_patterns": ["lifecycle.load_ms"]}
{"event": "run", "id": "E006W", "path": "build_save_load", "hypothesis": "Isolated 20-load median and prebuilt-process RSS for direct arena loading", "status": "crash", "utc": "2026-09-07T01:20:02+00:00", "commit": "6f2cc84e5515d5e8f3c40203f1a83af8124b2ab7", "seconds": 0.296, "diagnostic_peak_process_mb": 0.0, "returncode": 101, "command": ["T:\\Dev\\GTOpen\\target\\autoresearch\\workspace\\target\\release\\deps\\load_perf-0985c67bc3e57cab.exe", "--ignored", "--nocapture", "--test-threads=1"], "env": [], "metrics": {"lifecycle.load_process_memory_mb": 0.0}, "checks": [], "score_patterns": ["lifecycle.warm_load_ms", "lifecycle.load_process_memory_mb"]}
{"event": "harness_path_fix", "file": "crates/solver/tests/load_perf.rs", "old_sha": "bdda27729bc216c4628923c2bbeea608fa90059bc8a90071a0f04a30852bd09b", "new_sha": "01720fe5879416ce7c175e55321a0c9111fc7e9bf167c71dc725e836dc44f318", "reason": "Cargo integration tests run from the crate directory; direct executable uses workspace cwd. Resolve the same fixture via CARGO_MANIFEST_DIR. No successful measurements precede this fix.", "utc": "2026-09-07T01:21:13+00:00"}
{"event": "run", "id": "E006W", "path": "build_save_load", "hypothesis": "Isolated 20-load median and prebuilt-process RSS for direct arena loading", "status": "crash", "utc": "2026-09-07T01:20:02+00:00", "commit": "6f2cc84e5515d5e8f3c40203f1a83af8124b2ab7", "seconds": 0.296, "diagnostic_peak_process_mb": 0.0, "returncode": 101, "command": ["T:\\Dev\\GTOpen\\target\\autoresearch\\workspace\\target\\release\\deps\\load_perf-0985c67bc3e57cab.exe", "--ignored", "--nocapture", "--test-threads=1"], "env": [], "metrics": {}, "checks": [], "score_patterns": ["lifecycle.warm_load_ms", "lifecycle.load_process_memory_mb"], "reason": "New load harness failed before measuring because the relative fixture path differed under direct execution. Fixed absolute fixture path."}
{"event": "run", "id": "E006W2", "path": "build_save_load", "hypothesis": "Isolated 20-load median and OS peak working set for direct arena loading", "status": "candidate", "utc": "2026-09-07T01:21:21+00:00", "commit": "19dd982afcd2801ed8cdbe93405a712fa0875b24", "seconds": 1.078, "diagnostic_peak_process_mb": 172.012, "returncode": 0, "command": ["T:\\Dev\\GTOpen\\target\\autoresearch\\workspace\\target\\release\\deps\\load_perf-0985c67bc3e57cab.exe", "--ignored", "--nocapture", "--test-threads=1"], "env": [], "metrics": {"lifecycle.warm_load_ms": 39.8761, "lifecycle.load_process_memory_mb": 172.012}, "checks": [{"exploitability": 0.36963080697589445, "iteration": 18, "samples_ms": [37.2594, 38.0085, 38.1889, 38.2242, 38.777499999999996, 39.1607, 39.527, 39.5276, 39.590599999999995, 39.5994, 39.8761, 39.9332, 40.0967, 41.173300000000005, 42.0271, 42.893800000000006, 44.3311, 44.9071, 47.247499999999995, 48.050599999999996]}], "score_patterns": ["lifecycle.warm_load_ms", "lifecycle.load_process_memory_mb"]}
{"event": "run", "id": "B005", "path": "baseline", "hypothesis": "Paired original-loader control: same warm-load fixture, 20 samples, OS peak working set", "status": "baseline", "utc": "2026-09-07T01:22:37+00:00", "commit": "4c75a893020e1c12c83154d7c990db7abc8ac1f2", "seconds": 1.344, "diagnostic_peak_process_mb": 198.885, "returncode": 0, "command": ["T:\\Dev\\GTOpen\\target\\autoresearch\\workspace\\target\\release\\deps\\load_perf-0985c67bc3e57cab.exe", "--ignored", "--nocapture", "--test-threads=1"], "env": [], "metrics": {"lifecycle.warm_load_ms": 54.134, "lifecycle.load_process_memory_mb": 198.885}, "checks": [{"exploitability": 0.36963080697589445, "iteration": 18, "samples_ms": [50.3454, 50.4369, 50.9086, 51.1513, 51.2785, 52.163399999999996, 52.203, 52.2594, 52.4708, 53.3307, 54.134, 54.346199999999996, 54.9753, 54.998, 55.0555, 55.1299, 55.3585, 56.549099999999996, 56.863200000000006, 59.5677]}], "score_patterns": []}
{"event": "decision", "id": "E006", "status": "keep", "reason": "Isolated 20-load control confirms 54.134 to 39.876 ms (26% lower latency) and 198.885 to 172.012 MB peak working set (13.5% lower). Exact exploitability and save bytes; all eight save compatibility/lock/atomic tests pass.", "utc": "2026-09-07T01:23:23+00:00"}
{"event": "decision", "id": "E006R", "status": "keep", "reason": "Isolated 20-load control confirms 54.134 to 39.876 ms (26% lower latency) and 198.885 to 172.012 MB peak working set (13.5% lower). Exact exploitability and save bytes; all eight save compatibility/lock/atomic tests pass.", "utc": "2026-09-07T01:23:23+00:00"}
{"event": "decision", "id": "E006W2", "status": "keep", "reason": "Isolated 20-load control confirms 54.134 to 39.876 ms (26% lower latency) and 198.885 to 172.012 MB peak working set (13.5% lower). Exact exploitability and save bytes; all eight save compatibility/lock/atomic tests pass.", "utc": "2026-09-07T01:23:23+00:00"}
{"event": "promote", "files": ["crates/solver/src/save.rs"], "commit": "ebe28c637cb39b7038a8ad9b89dea6c5b25387ee", "utc": "2026-09-07T01:23:27+00:00"}
{"event": "run", "id": "E007", "path": "memory_transfers", "hypothesis": "Store one changed actor reach per edge and alias every unchanged seat reach to its ancestor", "status": "candidate", "utc": "2026-09-07T01:26:20+00:00", "commit": "4e8c4c9ebe0be70f9e642f5ccb13261cc9cf3967", "seconds": 48.14, "diagnostic_peak_process_mb": 2206.888, "returncode": 0, "command": ["cargo", "test", "--release", "-p", "solver", "--features", "gpu", "--test", "preflop_perf", "--test", "capacity_perf", "--", "--ignored", "--nocapture", "--test-threads=1"], "env": [], "metrics": {"preflop.6.allocated_vram_mb": 603.979776, "preflop.6.build_ms": 77.01719999999999, "preflop.6.cpu_arena_mb": 224.552328, "preflop.6.estimated_vram_mb": 643.987632, "preflop.6.init_ms": 595.4649, "preflop.8.allocated_vram_mb": 1543.503872, "preflop.8.build_ms": 231.4608, "preflop.8.cpu_arena_mb": 587.239848, "preflop.8.estimated_vram_mb": 1591.177304, "preflop.8.init_ms": 268.5756, "preflop.2.iteration_ms": 0.098, "preflop.2.check_ms": 0.394, "preflop.2.sync_ms": 0.035, "preflop.6.iteration_ms": 24.037, "preflop.6.check_ms": 32.787, "preflop.6.sync_ms": 27.716, "preflop.8.iteration_ms": 106.379, "preflop.8.check_ms": 133.402, "preflop.8.sync_ms": 73.445}, "checks": [{"nodes": 166090, "note": "Allocated VRAM is device free-memory delta; estimate is the engine preflight formula.", "seats": 6}, {"nodes": 434350, "note": "Allocated VRAM is device free-memory delta; estimate is the engine preflight formula.", "seats": 8}, {"preflop": "PERF seats=2 nodes=40 iteration_ms=0.098 check_ms=0.394 sync_ms=0.035 arena_hash=6d4781fae03e3474 gaps=[0.05088935968248226, 0.013161917444424076] evs=[-0.15795953824550446, -0.4142353804778675]"}, {"preflop": "PERF seats=6 nodes=166090 iteration_ms=24.037 check_ms=32.787 sync_ms=27.716 arena_hash=b70284af63586e3f gaps=[0.10415872559930028, 0.03471900474586882, 0.05645132130650671, 0.04355598961220011, 0.02566278444731196, 0.025583227687036025] evs=[0.08985395657613165, 0.11143259696531381, 0.13262513589238922, 0.15984876666632344, -0.3195691149045554, -0.4656351703726333]"}, {"preflop": "PERF seats=8 nodes=434350 iteration_ms=106.379 check_ms=133.402 sync_ms=73.445 arena_hash=e01dd7a18632644d gaps=[0.022654395639749164, 0.010278385995560232, 0.008437781286659882, 0.011345792287176693, 0.011192070283014638, 0.012086956929344556, 0.01380422891560007, 0.011174031925715422] evs=[0.04857087063871364, 0.05480589083850633, 0.06796224413352651, 0.07993621403632675, 0.0996648260883227, 0.13493690699672048, -0.39486055394849295, -0.5856126067014387]"}], "score_patterns": ["preflop.*"]}
{"event": "run", "id": "E007R", "path": "memory_transfers", "hypothesis": "Repeat compact reach timing and capacity after CUDA JIT warmup and full preflop equivalence validation", "status": "candidate", "utc": "2026-09-07T01:28:54+00:00", "commit": "4e8c4c9ebe0be70f9e642f5ccb13261cc9cf3967", "seconds": 12.593, "diagnostic_peak_process_mb": 2206.597, "returncode": 0, "command": ["cargo", "test", "--release", "-p", "solver", "--features", "gpu", "--test", "preflop_perf", "--test", "capacity_perf", "--", "--ignored", "--nocapture", "--test-threads=1"], "env": [], "metrics": {"preflop.6.allocated_vram_mb": 603.979776, "preflop.6.build_ms": 79.0233, "preflop.6.cpu_arena_mb": 224.552328, "preflop.6.estimated_vram_mb": 643.987632, "preflop.6.init_ms": 187.6735, "preflop.8.allocated_vram_mb": 1543.503872, "preflop.8.build_ms": 246.7398, "preflop.8.cpu_arena_mb": 587.239848, "preflop.8.estimated_vram_mb": 1591.177304, "preflop.8.init_ms": 295.3459, "preflop.2.iteration_ms": 0.09, "preflop.2.check_ms": 0.294, "preflop.2.sync_ms": 0.016, "preflop.6.iteration_ms": 23.784, "preflop.6.check_ms": 32.792, "preflop.6.sync_ms": 29.649, "preflop.8.iteration_ms": 106.602, "preflop.8.check_ms": 133.419, "preflop.8.sync_ms": 69.785}, "checks": [{"nodes": 166090, "note": "Allocated VRAM is device free-memory delta; estimate is the engine preflight formula.", "seats": 6}, {"nodes": 434350, "note": "Allocated VRAM is device free-memory delta; estimate is the engine preflight formula.", "seats": 8}, {"preflop": "PERF seats=2 nodes=40 iteration_ms=0.090 check_ms=0.294 sync_ms=0.016 arena_hash=6d4781fae03e3474 gaps=[0.05088935968248226, 0.013161917444424076] evs=[-0.15795953824550446, -0.4142353804778675]"}, {"preflop": "PERF seats=6 nodes=166090 iteration_ms=23.784 check_ms=32.792 sync_ms=29.649 arena_hash=b70284af63586e3f gaps=[0.10415872559930028, 0.03471900474586882, 0.05645132130650671, 0.04355598961220011, 0.02566278444731196, 0.025583227687036025] evs=[0.08985395657613165, 0.11143259696531381, 0.13262513589238922, 0.15984876666632344, -0.3195691149045554, -0.4656351703726333]"}, {"preflop": "PERF seats=8 nodes=434350 iteration_ms=106.602 check_ms=133.419 sync_ms=69.785 arena_hash=e01dd7a18632644d gaps=[0.022654395639749164, 0.010278385995560232, 0.008437781286659882, 0.011345792287176693, 0.011192070283014638, 0.012086956929344556, 0.01380422891560007, 0.011174031925715422] evs=[0.04857087063871364, 0.05480589083850633, 0.06796224413352651, 0.07993621403632675, 0.0996648260883227, 0.13493690699672048, -0.39486055394849295, -0.5856126067014387]"}], "score_patterns": ["preflop.*"]}
{"event": "decision", "id": "E007", "status": "keep", "reason": "Repeats preserve every 2/6/8-seat fingerprint. Six-seat iterations 33.508 to 23.784 ms; eight-seat 152.884 to 106.602 ms. Allocated eight-seat VRAM 3590.324 to 1543.504 MB. Full preflop equivalence, stop/graph/cache tests and unique-writer/700 MB budget test pass.", "utc": "2026-09-07T01:32:49+00:00"}
{"event": "decision", "id": "E007R", "status": "keep", "reason": "Repeats preserve every 2/6/8-seat fingerprint. Six-seat iterations 33.508 to 23.784 ms; eight-seat 152.884 to 106.602 ms. Allocated eight-seat VRAM 3590.324 to 1543.504 MB. Full preflop equivalence, stop/graph/cache tests and unique-writer/700 MB budget test pass.", "utc": "2026-09-07T01:32:49+00:00"}
{"event": "promote", "files": ["crates/solver/src/preflop/gpu.rs", "crates/solver/src/preflop/kernels.cu"], "commit": "afdc57244aa715ae7384e8cb81af54b385376ac7", "utc": "2026-09-07T01:32:54+00:00"}
{"event": "run", "id": "E008", "path": "cpu_solving", "hypothesis": "Use opponent-major equity storage to vectorize independent hero hands while preserving each sum order", "status": "candidate", "utc": "2026-09-07T01:33:30+00:00", "commit": "f3fadb13e738fe43c259689429865b13c8b5a47c", "seconds": 34.718, "diagnostic_peak_process_mb": 773.333, "returncode": 0, "command": ["cargo", "test", "--release", "-p", "solver", "--features", "gpu", "--test", "research_perf", "cpu_preflop", "--", "--ignored", "--nocapture", "--test-threads=1"], "env": [], "metrics": {"cpu.preflop.arena_mb": 224.552328, "cpu.preflop.check_ms": 325.6546, "cpu.preflop.iteration_ms": 77.83432}, "checks": [{"arena_hash": "3f021c64d7c7a141", "evs": [0.11723085944569259, 0.11294138971777481, 0.06514406696957305, 0.07628515082630205, -0.39683870489050355, -0.46397515173140375], "gaps": [0.941004372452971, 0.10522786080636143, 0.20258109159216667, 0.2029610176426232, 0.15556088815149854, 0.11106866681620509], "iteration": 18, "nodes": 166090}], "score_patterns": ["cpu.preflop.*"]}
{"event": "run", "id": "E008R", "path": "cpu_solving", "hypothesis": "Repeat exact batched equity timings after the full CPU solver suite passed", "status": "candidate", "utc": "2026-09-07T01:38:49+00:00", "commit": "0f13dcb8b59ae4bc86976e198d22f81a6b726fa4", "seconds": 14.563, "diagnostic_peak_process_mb": 773.296, "returncode": 0, "command": ["cargo", "test", "--release", "-p", "solver", "--features", "gpu", "--test", "research_perf", "cpu_preflop", "--", "--ignored", "--nocapture", "--test-threads=1"], "env": [], "metrics": {"cpu.preflop.arena_mb": 224.552328, "cpu.preflop.check_ms": 338.9815, "cpu.preflop.iteration_ms": 84.69842}, "checks": [{"arena_hash": "3f021c64d7c7a141", "evs": [0.11723085944569259, 0.11294138971777481, 0.06514406696957305, 0.07628515082630205, -0.39683870489050355, -0.46397515173140375], "gaps": [0.941004372452971, 0.10522786080636143, 0.20258109159216667, 0.2029610176426232, 0.15556088815149854, 0.11106866681620509], "iteration": 18, "nodes": 166090}], "score_patterns": ["cpu.preflop.*"]}
{"event": "decision", "id": "E008", "status": "keep", "reason": "124 CPU tests pass. CPU iterations 204.808 to 77.834/84.698 ms and checks 1439.994 to 325.655/338.982 ms. Complete arenas, gaps and EVs match baseline bits; scalar/batched equity test passes. Adds a 114 KB transposed equity table.", "utc": "2026-09-07T01:41:14+00:00"}
{"event": "decision", "id": "E008R", "status": "keep", "reason": "124 CPU tests pass. CPU iterations 204.808 to 77.834/84.698 ms and checks 1439.994 to 325.655/338.982 ms. Complete arenas, gaps and EVs match baseline bits; scalar/batched equity test passes. Adds a 114 KB transposed equity table.", "utc": "2026-09-07T01:41:14+00:00"}
{"event": "promote", "files": ["crates/solver/src/preflop/equity.rs", "crates/solver/src/preflop/mod.rs"], "commit": "0f13dcb8b59ae4bc86976e198d22f81a6b726fa4", "utc": "2026-09-07T01:41:19+00:00"}
{"event": "run", "id": "B006", "path": "baseline", "hypothesis": "Postflop GPU capacity before compact reach slots, with suit isomorphism on and off", "status": "baseline", "utc": "2026-09-07T01:41:32+00:00", "commit": "0f13dcb8b59ae4bc86976e198d22f81a6b726fa4", "seconds": 12.922, "diagnostic_peak_process_mb": 3950.51, "returncode": 0, "command": ["cargo", "test", "--release", "-p", "solver", "--features", "gpu", "--test", "postflop_capacity_perf", "--", "--ignored", "--nocapture", "--test-threads=1"], "env": [], "metrics": {"postflop.Ks7h2d.iso.allocated_vram_mb": 7683.964928, "postflop.Ks7h2d.iso.estimated_vram_mb": 8088.005516, "postflop.Ks7h2d.iso.init_ms": 868.18, "postflop.Ks7h2d.iso.plan_build_ms": 93.5086, "postflop.Ks7h2d.iso.staging_memory_mb": 4821.59054, "postflop.Ks7s2d.iso.allocated_vram_mb": 7683.964928, "postflop.Ks7s2d.iso.estimated_vram_mb": 8113.667768, "postflop.Ks7s2d.iso.init_ms": 634.1732, "postflop.Ks7s2d.iso.plan_build_ms": 68.9306, "postflop.Ks7s2d.iso.staging_memory_mb": 4837.752296, "postflop.Ks7s2d.full.allocated_vram_mb": 7717.51936, "postflop.Ks7s2d.full.estimated_vram_mb": 8113.667768, "postflop.Ks7s2d.full.init_ms": 663.1458, "postflop.Ks7s2d.full.plan_build_ms": 128.3491, "postflop.Ks7s2d.full.staging_memory_mb": 4837.752296}, "checks": [{"board": "Ks7h2d", "nodes": 1346813, "use_isomorphism": true}, {"board": "Ks7s2d", "nodes": 1346813, "use_isomorphism": true}, {"board": "Ks7s2d", "nodes": 1346813, "use_isomorphism": false}], "score_patterns": []}
{"event": "run", "id": "B007", "path": "baseline", "hypothesis": "Postflop time-to-0.3-percent-exploitability control before compact reach storage", "status": "baseline", "utc": "2026-09-07T01:43:33+00:00", "commit": "0f13dcb8b59ae4bc86976e198d22f81a6b726fa4", "seconds": 31.812, "diagnostic_peak_process_mb": 4742.078, "returncode": 0, "command": ["cargo", "test", "--release", "-p", "solver", "--features", "gpu", "--test", "postflop_perf", "--", "--ignored", "--nocapture", "--test-threads=1"], "env": ["POSTFLOP_PERF_CONVERGENCE=1"], "metrics": {"postflop.Ks7h2d.target_seconds": 12.244, "postflop.Ks7s2d.target_seconds": 7.346, "postflop.Ks7h2dQhTc.target_seconds": 0.023}, "checks": [{"convergence": "POSTFLOP_TARGET board=Ks7h2d iteration=200 seconds=12.244 pct=0.268540011"}, {"convergence": "POSTFLOP_TARGET board=Ks7s2d iteration=200 seconds=7.346 pct=0.243424362"}, {"convergence": "POSTFLOP_TARGET board=Ks7h2dQhTc iteration=60 seconds=0.023 pct=0.269896317"}], "score_patterns": []}
