{"event": "run", "id": "E029R", "path": "preflop_cuda", "hypothesis": "Repeat captured preflop checks and verify fixed target stopping, CUDA equivalence, and tight cache fallback", "status": "candidate", "utc": "2026-09-07T05:26:36+00:00", "commit": "1167a2f65f7d19e3376285639acd15423a9aacc8", "seconds": 54.078, "diagnostic_peak_process_mb": 3999.113, "returncode": 0, "command": ["cargo", "test", "--release", "-p", "solver", "--features", "gpu", "--test", "gpu_check_perf", "--test", "preflop_target_perf", "--test", "preflop_gpu", "--test", "preflop_budget", "--", "--include-ignored", "--nocapture", "--test-threads=1"], "env": [], "metrics": {"postflop.Ks7h2d.first_check_ms": 34.778499999999994, "postflop.Ks7h2d.second_check_ms": 34.3488, "postflop.Ks7h2d.steady_check_ms": 34.68305, "postflop.Ks7s2d.first_check_ms": 27.7804, "postflop.Ks7s2d.second_check_ms": 28.573, "postflop.Ks7s2d.steady_check_ms": 28.187875000000002, "postflop.Ks7h2dQhTc.first_check_ms": 0.5848, "postflop.Ks7h2dQhTc.second_check_ms": 0.5534, "postflop.Ks7h2dQhTc.steady_check_ms": 0.581625, "preflop.2.first_check_ms": 0.2387, "preflop.2.second_check_ms": 0.2216, "preflop.2.steady_check_ms": 0.099375, "preflop.6.first_check_ms": 12.7441, "preflop.6.second_check_ms": 12.8703, "preflop.6.steady_check_ms": 11.891375, "preflop.8.first_check_ms": 38.6179, "preflop.8.second_check_ms": 38.5531, "preflop.8.steady_check_ms": 37.242075, "preflop.6.target_seconds": 3.0237311, "preflop.8.target_seconds": 7.3570144}, "checks": [{"check_board": "Ks7h2d", "check_eval_bits": 4610328022310931180, "check_iteration": 65}, {"check_board": "Ks7s2d", "check_eval_bits": 4608664839644425536, "check_iteration": 65}, {"check_board": "Ks7h2dQhTc", "check_eval_bits": 4594234900545878240, "check_iteration": 65}, {"check_ev_bits": [13818231149285967788, 13824505857993336927], "check_gap_bits": [4587494750677495240, 4578740950612821696], "check_iteration": 65, "check_seats": 2}, {"check_ev_bits": [4591139080588829428, 4592693985497883551, 4593946344391214828, 4594927179058488125, 13822800502159894828, 13825431794291804883], "check_gap_bits": [4592169847827907240, 4585164356934551850, 4588296313823012216, 4586437900670586676, 4583054015422772960, 4583031084747833216], "check_iteration": 65, "check_seats": 6}, {"check_ev_bits": [4587160621192900714, 4588059182301650598, 4589561616460845131, 4590424431923123478, 4591846028241297974, 4594029634723087085, 13824156832147184690, 13826821985834700352], "check_gap_bits": [4582186906385158536, 4577078707904519064, 4576017671529333144, 4577694025738397696, 4577605411036232848, 4578121278065602480, 4579111217966708928, 4577595012631213824], "check_iteration": 65, "check_seats": 8}, {"all_arena_gap_ev_bits_equal": true, "iteration": 65, "seats": 6, "tight_budget_mb": 550}, {"all_arena_gap_ev_bits_equal": true, "iteration": 65, "seats": 8, "tight_budget_mb": 1350}, {"arena_hash": "c2dad646abce18b5", "evs": [0.08797255266730505, 0.11134619537831136, 0.14089217263325687, 0.18902651619282607, -0.30302059818816424, -0.4718418733933629], "gap_total": 0.024847662904315698, "gaps": [0.008891930020792499, 0.0028558437428595207, 0.004669706392101347, 0.003544522935725547, 0.0024462647714426633, 0.0024393950413941212], "iteration": 175, "seats": 6}, {"arena_hash": "84a3dfccf7629cc7", "evs": [0.05031450986961973, 0.06125595802790403, 0.07389315031782204, 0.08774957648238482, 0.10797622645047951, 0.14606867660221595, -0.3852499664026161, -0.5872064351282983], "gap_total": 0.020521659486179414, "gaps": [0.00410024124668109, 0.002149521831405564, 0.0020851674306289897, 0.0024997828874374906, 0.0022918593337274834, 0.0023690504386156275, 0.002572443936215363, 0.0024535923814678062], "iteration": 125, "seats": 8}], "score_patterns": ["preflop.*check_ms", "preflop.*target_seconds"]}
{"event": "decision", "id": "E029", "status": "keep", "reason": "Repeated steady checks0.099-0.108ms vs0.424ms for2seats;11.89-11.95ms vs13.20ms for6;37.22-37.24ms vs39.51ms for8. First and capture-call costs measured separately without material regression. Full fingerprints,48variants, repeatedEVbits and175/125-iteration target states exact; unit, GPU and tight-budget suites pass.", "utc": "2026-09-07T05:27:41+00:00"}
{"event": "decision", "id": "E029R", "status": "keep", "reason": "Repeated steady checks0.099-0.108ms vs0.424ms for2seats;11.89-11.95ms vs13.20ms for6;37.22-37.24ms vs39.51ms for8. First and capture-call costs measured separately without material regression. Full fingerprints,48variants, repeatedEVbits and175/125-iteration target states exact; unit, GPU and tight-budget suites pass.", "utc": "2026-09-07T05:27:41+00:00"}
{"event": "promote", "files": ["crates/solver/src/preflop/gpu.rs"], "commit": "1167a2f65f7d19e3376285639acd15423a9aacc8", "utc": "2026-09-07T05:27:59+00:00"}
{"event": "refresh_compiler_inputs", "utc": "2026-09-07T05:28:01+00:00", "files": ["crates/solver/src/gpu/mod.rs"], "reason": "Content changes must invalidate Cargo even after copies preserving old mtimes"}
