{"event": "refresh_compiler_inputs", "utc": "2026-09-07T04:58:11+00:00", "files": ["Cargo.toml", "Cargo.lock", "bench_spot.json", "crates/server/Cargo.toml", "crates/server/src/main.rs", "crates/server/src/report_tests.rs", "crates/solver/Cargo.toml", "crates/solver/src/best_response.rs", "crates/solver/src/cards.rs", "crates/solver/src/cfr.rs", "crates/solver/src/evaluator.rs", "crates/solver/src/game.rs", "crates/solver/src/lib.rs", "crates/solver/src/query.rs", "crates/solver/src/range.rs", "crates/solver/src/report.rs", "crates/solver/src/save.rs", "crates/solver/src/scratch.rs", "crates/solver/src/store.rs", "crates/solver/src/sysmem.rs", "crates/solver/src/tree.rs", "crates/solver/src/bin/solve_cli.rs", "crates/solver/src/gpu/arena.rs", "crates/solver/src/gpu/kernels.cu", "crates/solver/src/gpu/mod.rs", "crates/solver/src/gpu/plan.rs", "crates/solver/src/preflop/equity.rs", "crates/solver/src/preflop/gpu.rs", "crates/solver/src/preflop/kernels.cu", "crates/solver/src/preflop/mod.rs", "crates/solver/src/preflop/reference.rs", "crates/solver/src/preflop/save.rs", "crates/solver/tests/build_validation.rs", "crates/solver/tests/capacity_perf.rs", "crates/solver/tests/convergence.rs", "crates/solver/tests/cuda_resources.rs", "crates/solver/tests/gpu.rs", "crates/solver/tests/gpu_bench.rs", "crates/solver/tests/load_perf.rs", "crates/solver/tests/postflop_action_menus.rs", "crates/solver/tests/postflop_capacity_perf.rs", "crates/solver/tests/postflop_memory_perf.rs", "crates/solver/tests/postflop_perf.rs", "crates/solver/tests/postflop_profile.rs", "crates/solver/tests/postflop_resume_state.rs", "crates/solver/tests/postflop_state_perf.rs", "crates/solver/tests/preflop.rs", "crates/solver/tests/preflop_bench.rs", "crates/solver/tests/preflop_budget.rs", "crates/solver/tests/preflop_gpu.rs", "crates/solver/tests/preflop_perf.rs", "crates/solver/tests/preflop_target_perf.rs", "crates/solver/tests/preflop_variants.rs", "crates/solver/tests/realization.rs", "crates/solver/tests/report_lines.rs", "crates/solver/tests/research_perf.rs", "crates/solver/tests/save_atomic.rs", "crates/solver/tests/save_compat.rs", "crates/solver/tests/save_locks.rs", "crates/solver/examples/reference_order.rs", "crates/solver/examples/research_equity_reuse.rs"], "reason": "Content changes must invalidate Cargo even after copies preserving old mtimes"}
