{"event": "run", "id": "E030R", "path": "postflop_cuda", "hypothesis": "Repeat postflop evaluation graphs including first-call cost, fixed target stopping, and all action-menu states", "status": "candidate", "utc": "2026-09-07T05:31:13+00:00", "commit": "8fffe84a34ecd081e4fcde9b54ac5220e00fb1ad", "seconds": 52.328, "diagnostic_peak_process_mb": 4073.693, "returncode": 0, "command": ["cargo", "test", "--release", "-p", "solver", "--features", "gpu", "--test", "gpu_check_perf", "--test", "postflop_perf", "--test", "postflop_state_perf", "--test", "postflop_action_menus", "--", "--ignored", "--nocapture", "--test-threads=1"], "env": ["POSTFLOP_PERF_CONVERGENCE=1"], "metrics": {"postflop.Ks7h2d.first_check_ms": 31.7577, "postflop.Ks7h2d.second_check_ms": 32.1483, "postflop.Ks7h2d.steady_check_ms": 31.992624999999997, "postflop.Ks7s2d.first_check_ms": 25.8739, "postflop.Ks7s2d.second_check_ms": 26.2297, "postflop.Ks7s2d.steady_check_ms": 25.7055, "postflop.Ks7h2dQhTc.first_check_ms": 1.109, "postflop.Ks7h2dQhTc.second_check_ms": 0.5747, "postflop.Ks7h2dQhTc.steady_check_ms": 0.32285, "preflop.2.first_check_ms": 0.3553, "preflop.2.second_check_ms": 0.24850000000000003, "preflop.2.steady_check_ms": 0.108825, "preflop.6.first_check_ms": 11.6832, "preflop.6.second_check_ms": 12.1938, "preflop.6.steady_check_ms": 10.951975, "preflop.8.first_check_ms": 35.449099999999994, "preflop.8.second_check_ms": 36.1883, "preflop.8.steady_check_ms": 34.368975000000006, "postflop.Ks7h2d.target_seconds": 9.89, "postflop.Ks7s2d.target_seconds": 6.032, "postflop.Ks7h2dQhTc.target_seconds": 0.018}, "checks": [{"check_board": "Ks7h2d", "check_eval_bits": 4610328022310931180, "check_iteration": 65}, {"check_board": "Ks7s2d", "check_eval_bits": 4608664839644425536, "check_iteration": 65}, {"check_board": "Ks7h2dQhTc", "check_eval_bits": 4594234900545878240, "check_iteration": 65}, {"check_ev_bits": [13818231149285967788, 13824505857993336927], "check_gap_bits": [4587494750677495240, 4578740950612821696], "check_iteration": 65, "check_seats": 2}, {"check_ev_bits": [4591139080588829428, 4592693985497883551, 4593946344391214828, 4594927179058488125, 13822800502159894828, 13825431794291804883], "check_gap_bits": [4592169847827907240, 4585164356934551850, 4588296313823012216, 4586437900670586676, 4583054015422772960, 4583031084747833216], "check_iteration": 65, "check_seats": 6}, {"check_ev_bits": [4587160621192900714, 4588059182301650598, 4589561616460845131, 4590424431923123478, 4591846028241297974, 4594029634723087085, 13824156832147184690, 13826821985834700352], "check_gap_bits": [4582186906385158536, 4577078707904519064, 4576017671529333144, 4577694025738397696, 4577605411036232848, 4578121278065602480, 4579111217966708928, 4577595012631213824], "check_iteration": 65, "check_seats": 8}, {"algorithm": "Dcfr", "bets": "", "menu_states": [{"exploit_bits": 0, "hash": "4f030aa0fe9deb5f", "locked": false}, {"exploit_bits": 0, "hash": "8e5d7a73c6fc124e", "locked": true}], "root_actions": 1}, {"algorithm": "CfrPlus", "bets": "", "menu_states": [{"exploit_bits": 0, "hash": "4f030aa0fe9deb5f", "locked": false}, {"exploit_bits": 0, "hash": "8e5d7a73c6fc124e", "locked": true}], "root_actions": 1}, {"algorithm": "Dcfr", "bets": "50", "menu_states": [{"exploit_bits": 4573123367441913472, "hash": "28e830748f7862f9", "locked": false}, {"exploit_bits": 4565846421063463936, "hash": "32e870d727e15e5f", "locked": true}], "root_actions": 2}, {"algorithm": "CfrPlus", "bets": "50", "menu_states": [{"exploit_bits": 4575373351273120128, "hash": "416e7f8a4ac7c606", "locked": false}, {"exploit_bits": 4567243943030646784, "hash": "8069c4264711efae", "locked": true}], "root_actions": 2}, {"algorithm": "Dcfr", "bets": "33 75", "menu_states": [{"exploit_bits": 4575084589291749568, "hash": "ae061a57520656fe", "locked": false}, {"exploit_bits": 4567293853705376896, "hash": "97518332785a83cd", "locked": true}], "root_actions": 3}, {"algorithm": "CfrPlus", "bets": "33 75", "menu_states": [{"exploit_bits": 4577085624307641248, "hash": "195630b94c45e510", "locked": false}, {"exploit_bits": 4569213372567492352, "hash": "0d0282705a8c51f8", "locked": true}], "root_actions": 3}, {"algorithm": "Dcfr", "bets": "25 50 100", "menu_states": [{"exploit_bits": 4576662650375970560, "hash": "91e4a6d2278b5be4", "locked": false}, {"exploit_bits": 4568167495878385472, "hash": "a574b116361c3282", "locked": true}], "root_actions": 4}, {"algorithm": "CfrPlus", "bets": "25 50 100", "menu_states": [{"exploit_bits": 4578098029924519584, "hash": "f4efe3ba80456c06", "locked": false}, {"exploit_bits": 4570670884258282048, "hash": "e6b3b44c5bc12b96", "locked": true}], "root_actions": 4}, {"algorithm": "Dcfr", "bets": "20 40 60 100", "menu_states": [{"exploit_bits": 4578393802013603200, "hash": "3e71e04bcdc2e331", "locked": false}, {"exploit_bits": 4568168038134907328, "hash": "39f6f84bb1cf1880", "locked": true}], "root_actions": 5}, {"algorithm": "CfrPlus", "bets": "20 40 60 100", "menu_states": [{"exploit_bits": 4577566401053905312, "hash": "a91a7f665d7b4f5c", "locked": false}, {"exploit_bits": 4569007400465854784, "hash": "6ae19fa9468f87df", "locked": true}], "root_actions": 5}, {"algorithm": "Dcfr", "bets": "10 20 30 40 50 60 70 80 90 100", "menu_states": [{"exploit_bits": 4585573299270657502, "hash": "1231d62f4e5b8eb2", "locked": false}, {"exploit_bits": 4573412747826466240, "hash": "cb4ff418bc95b1ee", "locked": true}], "root_actions": 11}, {"algorithm": "CfrPlus", "bets": "10 20 30 40 50 60 70 80 90 100", "menu_states": [{"exploit_bits": 4585724609751663300, "hash": "eb415ad20798bb2f", "locked": false}, {"exploit_bits": 4573816642404738784, "hash": "df982bf6925ef500", "locked": true}], "root_actions": 11}, {"convergence": "POSTFLOP_TARGET board=Ks7h2d iteration=200 seconds=9.890 pct=0.275829435"}, {"convergence": "POSTFLOP_TARGET board=Ks7s2d iteration=200 seconds=6.032 pct=0.251358787"}, {"convergence": "POSTFLOP_TARGET board=Ks7h2dQhTc iteration=60 seconds=0.018 pct=0.269896845"}, {"board": "KsQs2d", "iso": false, "rake": 0.0, "states": [{"exploit_bits": 4587303795425830328, "hash": "ced25cd534160a7a", "locked": false}, {"exploit_bits": 4581640868563274656, "hash": "8729320849b9d33c", "locked": true}]}, {"board": "KsQs2d", "iso": false, "rake": 0.05, "states": [{"exploit_bits": 4587469623950769688, "hash": "dce9b2717e0df16e", "locked": false}, {"exploit_bits": 4581722223845122880, "hash": "99111fb9c8ec709b", "locked": true}]}, {"board": "KsQs2d", "iso": true, "rake": 0.0, "states": [{"exploit_bits": 4587284094896033288, "hash": "f28b67b0f43f8498", "locked": false}, {"exploit_bits": 4581629036489079792, "hash": "52fbd9a266ab35c1", "locked": true}]}, {"board": "KsQs2d", "iso": true, "rake": 0.05, "states": [{"exploit_bits": 4587467559043767640, "hash": "7abb90d6fa5ac2fc", "locked": false}, {"exploit_bits": 4581695983154347840, "hash": "b529102cce25dc39", "locked": true}]}, {"board": "Qs7h2dKh", "iso": false, "rake": 0.0, "states": [{"exploit_bits": 4582461738720506392, "hash": "816eeeb55df5fe5c", "locked": false}, {"exploit_bits": 4576041536399700112, "hash": "202311fe47670cc0", "locked": true}]}, {"board": "Qs7h2dKh", "iso": false, "rake": 0.05, "states": [{"exploit_bits": 4583407264393491801, "hash": "ed2549bfcfbc34f1", "locked": false}, {"exploit_bits": 4576219535588436580, "hash": "8217b6d74d4da526", "locked": true}]}, {"board": "Qs7h2dKh", "iso": true, "rake": 0.0, "states": [{"exploit_bits": 4582461738720506392, "hash": "816eeeb55df5fe5c", "locked": false}, {"exploit_bits": 4576041536399700112, "hash": "202311fe47670cc0", "locked": true}]}, {"board": "Qs7h2dKh", "iso": true, "rake": 0.05, "states": [{"exploit_bits": 4583407264393491801, "hash": "ed2549bfcfbc34f1", "locked": false}, {"exploit_bits": 4576219535588436580, "hash": "8217b6d74d4da526", "locked": true}]}, {"board": "AsKsQsJsTs", "iso": false, "rake": 0.0, "states": [{"exploit_bits": 4554443791804951647, "hash": "7f53c8ac5434860d", "locked": false}, {"exploit_bits": 4545576682231338880, "hash": "409995a6b2afc105", "locked": true}]}, {"board": "AsKsQsJsTs", "iso": false, "rake": 0.05, "states": [{"exploit_bits": 4566905886187841344, "hash": "af8ff4550d82f9ef", "locked": false}, {"exploit_bits": 4558330255933400576, "hash": "db670420a8559b3f", "locked": true}]}, {"board": "AsKsQsJsTs", "iso": true, "rake": 0.0, "states": [{"exploit_bits": 4554443791804951647, "hash": "7f53c8ac5434860d", "locked": false}, {"exploit_bits": 4545576682231338880, "hash": "409995a6b2afc105", "locked": true}]}, {"board": "AsKsQsJsTs", "iso": true, "rake": 0.05, "states": [{"exploit_bits": 4566905886187841344, "hash": "af8ff4550d82f9ef", "locked": false}, {"exploit_bits": 4558330255933400576, "hash": "db670420a8559b3f", "locked": true}]}], "score_patterns": ["postflop.*check_ms", "postflop.*target_seconds"]}
{"event": "refresh_compiler_inputs", "utc": "2026-09-07T05:33:42+00:00", "files": ["crates/solver/src/gpu/mod.rs"], "reason": "Content changes must invalidate Cargo even after copies preserving old mtimes"}
{"event": "run", "id": "E030A", "path": "postflop_cuda", "hypothesis": "Retain original eager first-check transfers and capture subsequent checks to avoid one-shot startup regression", "status": "candidate", "utc": "2026-09-07T05:34:45+00:00", "commit": "e20667ebb1b3d442564588ad2d79b0c2a98d5f16", "seconds": 62.812, "diagnostic_peak_process_mb": 4585.832, "returncode": 0, "command": ["cargo", "test", "--release", "-p", "solver", "--features", "gpu", "--lib", "--test", "gpu", "--test", "gpu_check_perf", "--", "--include-ignored", "--nocapture", "--test-threads=1"], "env": [], "metrics": {"postflop.Ks7h2d.first_check_ms": 35.6008, "postflop.Ks7h2d.second_check_ms": 36.2908, "postflop.Ks7h2d.steady_check_ms": 38.141025, "postflop.Ks7s2d.first_check_ms": 28.5117, "postflop.Ks7s2d.second_check_ms": 28.5552, "postflop.Ks7s2d.steady_check_ms": 28.0433, "postflop.Ks7h2dQhTc.first_check_ms": 0.8764000000000001, "postflop.Ks7h2dQhTc.second_check_ms": 0.6049, "postflop.Ks7h2dQhTc.steady_check_ms": 0.310175, "preflop.2.first_check_ms": 0.2673, "preflop.2.second_check_ms": 0.24259999999999998, "preflop.2.steady_check_ms": 0.09787499999999999, "preflop.6.first_check_ms": 13.2616, "preflop.6.second_check_ms": 13.448699999999999, "preflop.6.steady_check_ms": 12.04815, "preflop.8.first_check_ms": 38.4597, "preflop.8.second_check_ms": 38.809000000000005, "preflop.8.steady_check_ms": 37.40525}, "checks": [{"check_board": "Ks7h2d", "check_eval_bits": 4610328022310931180, "check_iteration": 65}, {"check_board": "Ks7s2d", "check_eval_bits": 4608664839644425536, "check_iteration": 65}, {"check_board": "Ks7h2dQhTc", "check_eval_bits": 4594234900545878240, "check_iteration": 65}, {"check_ev_bits": [13818231149285967788, 13824505857993336927], "check_gap_bits": [4587494750677495240, 4578740950612821696], "check_iteration": 65, "check_seats": 2}, {"check_ev_bits": [4591139080588829428, 4592693985497883551, 4593946344391214828, 4594927179058488125, 13822800502159894828, 13825431794291804883], "check_gap_bits": [4592169847827907240, 4585164356934551850, 4588296313823012216, 4586437900670586676, 4583054015422772960, 4583031084747833216], "check_iteration": 65, "check_seats": 6}, {"check_ev_bits": [4587160621192900714, 4588059182301650598, 4589561616460845131, 4590424431923123478, 4591846028241297974, 4594029634723087085, 13824156832147184690, 13826821985834700352], "check_gap_bits": [4582186906385158536, 4577078707904519064, 4576017671529333144, 4577694025738397696, 4577605411036232848, 4578121278065602480, 4579111217966708928, 4577595012631213824], "check_iteration": 65, "check_seats": 8}], "score_patterns": ["postflop.*check_ms"]}
{"event": "scope_extended", "utc": "2026-09-07T05:34:50.632087+00:00", "path": "memory_transfers", "file": "crates/solver/src/preflop/kernels.cu", "reason": "Preflop value-slot addressing for exact lifetime scratch reuse"}
{"event": "refresh_compiler_inputs", "utc": "2026-09-07T05:35:34+00:00", "files": ["crates/solver/src/gpu/mod.rs"], "reason": "Content changes must invalidate Cargo even after copies preserving old mtimes"}
{"event": "run", "id": "B032", "path": "baseline", "hypothesis": "Fresh original postflop-check control plus retained preflop speed/capacity reference before shared terminal and compact value trials", "status": "baseline", "utc": "2026-09-07T05:36:39+00:00", "commit": "a0b42f34eabb38c519a91cf66a4e8481a68519f0", "seconds": 65.078, "diagnostic_peak_process_mb": 4274.414, "returncode": 0, "command": ["cargo", "test", "--release", "-p", "solver", "--features", "gpu", "--test", "gpu_check_perf", "--test", "preflop_perf", "--test", "capacity_perf", "--", "--ignored", "--nocapture", "--test-threads=1"], "env": [], "metrics": {"preflop.6.allocated_vram_mb": 536.870912, "preflop.6.build_ms": 78.9652, "preflop.6.cpu_arena_mb": 224.552328, "preflop.6.estimated_vram_mb": 594.500084, "preflop.6.init_ms": 154.63299999999998, "preflop.8.allocated_vram_mb": 1409.286144, "preflop.8.build_ms": 215.7656, "preflop.8.cpu_arena_mb": 587.239848, "preflop.8.estimated_vram_mb": 1456.8885480000001, "preflop.8.init_ms": 230.0572, "postflop.Ks7h2d.first_check_ms": 36.5299, "postflop.Ks7h2d.second_check_ms": 37.0481, "postflop.Ks7h2d.steady_check_ms": 34.780474999999996, "postflop.Ks7s2d.first_check_ms": 28.9978, "postflop.Ks7s2d.second_check_ms": 27.954900000000002, "postflop.Ks7s2d.steady_check_ms": 30.331500000000002, "postflop.Ks7h2dQhTc.first_check_ms": 0.8571, "postflop.Ks7h2dQhTc.second_check_ms": 0.73, "postflop.Ks7h2dQhTc.steady_check_ms": 0.8278, "preflop.2.first_check_ms": 0.8624999999999999, "preflop.2.second_check_ms": 0.2635, "preflop.2.steady_check_ms": 0.128325, "preflop.6.first_check_ms": 13.4164, "preflop.6.second_check_ms": 14.316799999999999, "preflop.6.steady_check_ms": 11.931249999999999, "preflop.8.first_check_ms": 37.8048, "preflop.8.second_check_ms": 40.8427, "preflop.8.steady_check_ms": 37.149225, "preflop.2.iteration_ms": 0.077, "preflop.2.check_ms": 0.254, "preflop.2.sync_ms": 0.018, "preflop.6.iteration_ms": 16.89, "preflop.6.check_ms": 13.199, "preflop.6.sync_ms": 27.376, "preflop.8.iteration_ms": 57.473, "preflop.8.check_ms": 38.581, "preflop.8.sync_ms": 66.372}, "checks": [{"nodes": 166090, "note": "Allocated VRAM is device free-memory delta; estimate is the engine preflight formula.", "seats": 6}, {"nodes": 434350, "note": "Allocated VRAM is device free-memory delta; estimate is the engine preflight formula.", "seats": 8}, {"check_board": "Ks7h2d", "check_eval_bits": 4610328022310931180, "check_iteration": 65}, {"check_board": "Ks7s2d", "check_eval_bits": 4608664839644425536, "check_iteration": 65}, {"check_board": "Ks7h2dQhTc", "check_eval_bits": 4594234900545878240, "check_iteration": 65}, {"check_ev_bits": [13818231149285967788, 13824505857993336927], "check_gap_bits": [4587494750677495240, 4578740950612821696], "check_iteration": 65, "check_seats": 2}, {"check_ev_bits": [4591139080588829428, 4592693985497883551, 4593946344391214828, 4594927179058488125, 13822800502159894828, 13825431794291804883], "check_gap_bits": [4592169847827907240, 4585164356934551850, 4588296313823012216, 4586437900670586676, 4583054015422772960, 4583031084747833216], "check_iteration": 65, "check_seats": 6}, {"check_ev_bits": [4587160621192900714, 4588059182301650598, 4589561616460845131, 4590424431923123478, 4591846028241297974, 4594029634723087085, 13824156832147184690, 13826821985834700352], "check_gap_bits": [4582186906385158536, 4577078707904519064, 4576017671529333144, 4577694025738397696, 4577605411036232848, 4578121278065602480, 4579111217966708928, 4577595012631213824], "check_iteration": 65, "check_seats": 8}, {"preflop": "PERF seats=2 nodes=40 iteration_ms=0.077 check_ms=0.254 sync_ms=0.018 arena_hash=6d4781fae03e3474 gaps=[0.05088935968248226, 0.013161917444424076] evs=[-0.15795953824550446, -0.4142353804778675]"}, {"preflop": "PERF seats=6 nodes=166090 iteration_ms=16.890 check_ms=13.199 sync_ms=27.376 arena_hash=b70284af63586e3f gaps=[0.10415872559930028, 0.03471900474586882, 0.05645132130650671, 0.04355598961220011, 0.02566278444731196, 0.025583227687036025] evs=[0.08985395657613165, 0.11143259696531381, 0.13262513589238922, 0.15984876666632344, -0.3195691149045554, -0.4656351703726333]"}, {"preflop": "PERF seats=8 nodes=434350 iteration_ms=57.473 check_ms=38.581 sync_ms=66.372 arena_hash=e01dd7a18632644d gaps=[0.022654395639749164, 0.010278385995560232, 0.008437781286659882, 0.011345792287176693, 0.011192070283014638, 0.012086956929344556, 0.01380422891560007, 0.011174031925715422] evs=[0.04857087063871364, 0.05480589083850633, 0.06796224413352651, 0.07993621403632675, 0.0996648260883227, 0.13493690699672048, -0.39486055394849295, -0.5856126067014387]"}], "score_patterns": []}
{"event": "refresh_compiler_inputs", "utc": "2026-09-07T05:37:32+00:00", "files": ["crates/solver/src/gpu/mod.rs"], "reason": "Content changes must invalidate Cargo even after copies preserving old mtimes"}
{"event": "run", "id": "E030AR", "path": "postflop_cuda", "hypothesis": "Matched repeat after fresh B032 control, separating river benefit from large-tree timing drift", "status": "candidate", "utc": "2026-09-07T05:38:22+00:00", "commit": "949febe59d714de88c64e59c91e73a40de241fee", "seconds": 49.359, "diagnostic_peak_process_mb": 4241.142, "returncode": 0, "command": ["cargo", "test", "--release", "-p", "solver", "--features", "gpu", "--test", "gpu_check_perf", "postflop_checks", "--", "--ignored", "--nocapture", "--test-threads=1"], "env": [], "metrics": {"postflop.Ks7h2d.first_check_ms": 34.6028, "postflop.Ks7h2d.second_check_ms": 34.9231, "postflop.Ks7h2d.steady_check_ms": 34.64645, "postflop.Ks7s2d.first_check_ms": 28.0841, "postflop.Ks7s2d.second_check_ms": 29.928199999999997, "postflop.Ks7s2d.steady_check_ms": 28.05065, "postflop.Ks7h2dQhTc.first_check_ms": 1.2526, "postflop.Ks7h2dQhTc.second_check_ms": 0.6039, "postflop.Ks7h2dQhTc.steady_check_ms": 0.327125}, "checks": [{"check_board": "Ks7h2d", "check_eval_bits": 4610328022310931180, "check_iteration": 65}, {"check_board": "Ks7s2d", "check_eval_bits": 4608664839644425536, "check_iteration": 65}, {"check_board": "Ks7h2dQhTc", "check_eval_bits": 4594234900545878240, "check_iteration": 65}], "score_patterns": ["postflop.*check_ms"]}
{"event": "decision", "id": "E030", "status": "discard", "reason": "Superseded by eager-first E030A/AR; correctness and stopping evidence retained in ledger.", "utc": "2026-09-07T05:39:44+00:00"}
{"event": "decision", "id": "E030R", "status": "discard", "reason": "Superseded by eager-first E030A/AR; correctness and stopping evidence retained in ledger.", "utc": "2026-09-07T05:39:44+00:00"}
{"event": "decision", "id": "E030A", "status": "keep", "reason": "Repeated river checks0.310/0.327ms vsfresh B0320.828ms and prior eager0.582-0.825ms. Large flop steady result near control; timing drift prevents a broad speed claim. First-check path uses original eager transfers; measured startup remains noisy0.876/1.253ms vsfresh0.857ms. All29 unit+6 GPU,112resume,24saved and24menu states, target stopping and repeated check bits exact across this family.", "utc": "2026-09-07T05:40:02+00:00"}
{"event": "decision", "id": "E030AR", "status": "keep", "reason": "Repeated river checks0.310/0.327ms vsfresh B0320.828ms and prior eager0.582-0.825ms. Large flop steady result near control; timing drift prevents a broad speed claim. First-check path uses original eager transfers; measured startup remains noisy0.876/1.253ms vsfresh0.857ms. All29 unit+6 GPU,112resume,24saved and24menu states, target stopping and repeated check bits exact across this family.", "utc": "2026-09-07T05:40:02+00:00"}
{"event": "promote", "files": ["crates/solver/src/gpu/mod.rs"], "commit": "949febe59d714de88c64e59c91e73a40de241fee", "utc": "2026-09-07T05:40:19+00:00"}
{"event": "refresh_compiler_inputs", "utc": "2026-09-07T05:40:21+00:00", "files": ["crates/solver/src/preflop/kernels.cu"], "reason": "Content changes must invalidate Cargo even after copies preserving old mtimes"}
