{"event": "run", "id": "E014", "path": "memory_transfers", "hypothesis": "Upload directly from immutable preflop arena slices instead of copying into temporary host vectors", "status": "candidate", "utc": "2026-09-07T02:21:48+00:00", "commit": "a3324e159c22cf547fdc8321ce76bef9ae4a0977", "seconds": 43.656, "diagnostic_peak_process_mb": 2104.459, "returncode": 0, "command": ["cargo", "test", "--release", "-p", "solver", "--features", "gpu", "--test", "capacity_perf", "--test", "preflop_perf", "--", "--ignored", "--nocapture", "--test-threads=1"], "env": [], "metrics": {"preflop.6.allocated_vram_mb": 603.979776, "preflop.6.build_ms": 76.637, "preflop.6.cpu_arena_mb": 224.552328, "preflop.6.estimated_vram_mb": 644.652012, "preflop.6.init_ms": 128.98399999999998, "preflop.8.allocated_vram_mb": 1543.503872, "preflop.8.build_ms": 210.9156, "preflop.8.cpu_arena_mb": 587.239848, "preflop.8.estimated_vram_mb": 1592.914732, "preflop.8.init_ms": 211.3061, "preflop.2.iteration_ms": 0.094, "preflop.2.check_ms": 0.289, "preflop.2.sync_ms": 0.016, "preflop.6.iteration_ms": 19.277, "preflop.6.check_ms": 24.389, "preflop.6.sync_ms": 27.32, "preflop.8.iteration_ms": 79.002, "preflop.8.check_ms": 94.587, "preflop.8.sync_ms": 65.767}, "checks": [{"nodes": 166090, "note": "Allocated VRAM is device free-memory delta; estimate is the engine preflight formula.", "seats": 6}, {"nodes": 434350, "note": "Allocated VRAM is device free-memory delta; estimate is the engine preflight formula.", "seats": 8}, {"preflop": "PERF seats=2 nodes=40 iteration_ms=0.094 check_ms=0.289 sync_ms=0.016 arena_hash=6d4781fae03e3474 gaps=[0.05088935968248226, 0.013161917444424076] evs=[-0.15795953824550446, -0.4142353804778675]"}, {"preflop": "PERF seats=6 nodes=166090 iteration_ms=19.277 check_ms=24.389 sync_ms=27.320 arena_hash=b70284af63586e3f gaps=[0.10415872559930028, 0.03471900474586882, 0.05645132130650671, 0.04355598961220011, 0.02566278444731196, 0.025583227687036025] evs=[0.08985395657613165, 0.11143259696531381, 0.13262513589238922, 0.15984876666632344, -0.3195691149045554, -0.4656351703726333]"}, {"preflop": "PERF seats=8 nodes=434350 iteration_ms=79.002 check_ms=94.587 sync_ms=65.767 arena_hash=e01dd7a18632644d gaps=[0.022654395639749164, 0.010278385995560232, 0.008437781286659882, 0.011345792287176693, 0.011192070283014638, 0.012086956929344556, 0.01380422891560007, 0.011174031925715422] evs=[0.04857087063871364, 0.05480589083850633, 0.06796224413352651, 0.07993621403632675, 0.0996648260883227, 0.13493690699672048, -0.39486055394849295, -0.5856126067014387]"}], "score_patterns": ["preflop.*.init_ms"]}
{"event": "run", "id": "E014R", "path": "memory_transfers", "hypothesis": "Repeat direct arena upload initialization and validate preflop GPU equivalence", "status": "candidate", "utc": "2026-09-07T02:22:32+00:00", "commit": "a3324e159c22cf547fdc8321ce76bef9ae4a0977", "seconds": 8.656, "diagnostic_peak_process_mb": 1612.505, "returncode": 0, "command": ["cargo", "test", "--release", "-p", "solver", "--features", "gpu", "--test", "preflop_gpu", "--test", "capacity_perf", "--", "--include-ignored", "--nocapture", "--test-threads=1"], "env": [], "metrics": {"preflop.6.allocated_vram_mb": 603.979776, "preflop.6.build_ms": 77.2499, "preflop.6.cpu_arena_mb": 224.552328, "preflop.6.estimated_vram_mb": 644.652012, "preflop.6.init_ms": 134.9879, "preflop.8.allocated_vram_mb": 1543.503872, "preflop.8.build_ms": 210.4357, "preflop.8.cpu_arena_mb": 587.239848, "preflop.8.estimated_vram_mb": 1592.914732, "preflop.8.init_ms": 213.619}, "checks": [{"nodes": 166090, "note": "Allocated VRAM is device free-memory delta; estimate is the engine preflight formula.", "seats": 6}, {"nodes": 434350, "note": "Allocated VRAM is device free-memory delta; estimate is the engine preflight formula.", "seats": 8}], "score_patterns": ["preflop.*.init_ms"]}
{"event": "decision", "id": "E014", "status": "keep", "reason": "Initialization repeats at 129-135 ms six-seat and 211-214 ms eight-seat, versus paired 167/282 ms controls; all 2/6/8-seat fingerprints unchanged and 5 GPU equivalence tests pass. Removes two temporary host copies without retaining extra memory.", "utc": "2026-09-07T02:26:41+00:00"}
{"event": "decision", "id": "E014R", "status": "keep", "reason": "Initialization repeats at 129-135 ms six-seat and 211-214 ms eight-seat, versus paired 167/282 ms controls; all 2/6/8-seat fingerprints unchanged and 5 GPU equivalence tests pass. Removes two temporary host copies without retaining extra memory.", "utc": "2026-09-07T02:26:41+00:00"}
{"event": "promote", "files": ["crates/solver/src/preflop/gpu.rs"], "commit": "a3324e159c22cf547fdc8321ce76bef9ae4a0977", "utc": "2026-09-07T02:26:49+00:00"}
{"event": "run", "id": "E015", "path": "preflop_cuda", "hypothesis": "Reuse exact opponent equity vectors across terminals and seats; limit learning work per traverser and retain uncached budget fallback", "status": "candidate", "utc": "2026-09-07T02:27:35+00:00", "commit": "15ee58576bf279bfb94c02b25b2376558ec8bf98", "seconds": 44.188, "diagnostic_peak_process_mb": 2107.843, "returncode": 0, "command": ["cargo", "test", "--release", "-p", "solver", "--features", "gpu", "--test", "preflop_perf", "--test", "capacity_perf", "--", "--ignored", "--nocapture", "--test-threads=1"], "env": [], "metrics": {"preflop.6.allocated_vram_mb": 671.08864, "preflop.6.build_ms": 80.50160000000001, "preflop.6.cpu_arena_mb": 224.552328, "preflop.6.estimated_vram_mb": 706.776248, "preflop.6.init_ms": 458.4197, "preflop.8.allocated_vram_mb": 1711.276032, "preflop.8.build_ms": 204.3844, "preflop.8.cpu_arena_mb": 587.239848, "preflop.8.estimated_vram_mb": 1750.508472, "preflop.8.init_ms": 235.7224, "preflop.2.iteration_ms": 0.092, "preflop.2.check_ms": 0.437, "preflop.2.sync_ms": 0.026, "preflop.6.iteration_ms": 19.421, "preflop.6.check_ms": 13.398, "preflop.6.sync_ms": 27.09, "preflop.8.iteration_ms": 67.432, "preflop.8.check_ms": 41.632, "preflop.8.sync_ms": 69.404}, "checks": [{"nodes": 166090, "note": "Allocated VRAM is device free-memory delta; estimate is the engine preflight formula.", "seats": 6}, {"nodes": 434350, "note": "Allocated VRAM is device free-memory delta; estimate is the engine preflight formula.", "seats": 8}, {"preflop": "PERF seats=2 nodes=40 iteration_ms=0.092 check_ms=0.437 sync_ms=0.026 arena_hash=6d4781fae03e3474 gaps=[0.05088935968248226, 0.013161917444424076] evs=[-0.15795953824550446, -0.4142353804778675]"}, {"preflop": "PERF seats=6 nodes=166090 iteration_ms=19.421 check_ms=13.398 sync_ms=27.090 arena_hash=b70284af63586e3f gaps=[0.10415872559930028, 0.03471900474586882, 0.05645132130650671, 0.04355598961220011, 0.02566278444731196, 0.025583227687036025] evs=[0.08985395657613165, 0.11143259696531381, 0.13262513589238922, 0.15984876666632344, -0.3195691149045554, -0.4656351703726333]"}, {"preflop": "PERF seats=8 nodes=434350 iteration_ms=67.432 check_ms=41.632 sync_ms=69.404 arena_hash=e01dd7a18632644d gaps=[0.022654395639749164, 0.010278385995560232, 0.008437781286659882, 0.011345792287176693, 0.011192070283014638, 0.012086956929344556, 0.01380422891560007, 0.011174031925715422] evs=[0.04857087063871364, 0.05480589083850633, 0.06796224413352651, 0.07993621403632675, 0.0996648260883227, 0.13493690699672048, -0.39486055394849295, -0.5856126067014387]"}], "score_patterns": ["preflop.*"]}
{"event": "run", "id": "E015R", "path": "preflop_cuda", "hypothesis": "Repeat exact-equity cache with graph/stop, hero/locks, CPU/GPU and 700 MB fallback checks", "status": "candidate", "utc": "2026-09-07T02:29:29+00:00", "commit": "15ee58576bf279bfb94c02b25b2376558ec8bf98", "seconds": 45.25, "diagnostic_peak_process_mb": 2108.129, "returncode": 0, "command": ["cargo", "test", "--release", "-p", "solver", "--features", "gpu", "--lib", "--test", "preflop_gpu", "--test", "preflop_perf", "--test", "capacity_perf", "--", "--include-ignored", "--nocapture", "--test-threads=1"], "env": [], "metrics": {"preflop.6.allocated_vram_mb": 671.08864, "preflop.6.build_ms": 77.4201, "preflop.6.cpu_arena_mb": 224.552328, "preflop.6.estimated_vram_mb": 706.776248, "preflop.6.init_ms": 136.49339999999998, "preflop.8.allocated_vram_mb": 1711.276032, "preflop.8.build_ms": 212.8094, "preflop.8.cpu_arena_mb": 587.239848, "preflop.8.estimated_vram_mb": 1750.508472, "preflop.8.init_ms": 230.2584, "preflop.2.iteration_ms": 0.085, "preflop.2.check_ms": 0.278, "preflop.2.sync_ms": 0.016, "preflop.6.iteration_ms": 19.294, "preflop.6.check_ms": 13.485, "preflop.6.sync_ms": 32.833, "preflop.8.iteration_ms": 67.283, "preflop.8.check_ms": 41.823, "preflop.8.sync_ms": 69.003}, "checks": [{"nodes": 166090, "note": "Allocated VRAM is device free-memory delta; estimate is the engine preflight formula.", "seats": 6}, {"nodes": 434350, "note": "Allocated VRAM is device free-memory delta; estimate is the engine preflight formula.", "seats": 8}, {"preflop": "PERF seats=2 nodes=40 iteration_ms=0.085 check_ms=0.278 sync_ms=0.016 arena_hash=6d4781fae03e3474 gaps=[0.05088935968248226, 0.013161917444424076] evs=[-0.15795953824550446, -0.4142353804778675]"}, {"preflop": "PERF seats=6 nodes=166090 iteration_ms=19.294 check_ms=13.485 sync_ms=32.833 arena_hash=b70284af63586e3f gaps=[0.10415872559930028, 0.03471900474586882, 0.05645132130650671, 0.04355598961220011, 0.02566278444731196, 0.025583227687036025] evs=[0.08985395657613165, 0.11143259696531381, 0.13262513589238922, 0.15984876666632344, -0.3195691149045554, -0.4656351703726333]"}, {"preflop": "PERF seats=8 nodes=434350 iteration_ms=67.283 check_ms=41.823 sync_ms=69.003 arena_hash=e01dd7a18632644d gaps=[0.022654395639749164, 0.010278385995560232, 0.008437781286659882, 0.011345792287176693, 0.011192070283014638, 0.012086956929344556, 0.01380422891560007, 0.011174031925715422] evs=[0.04857087063871364, 0.05480589083850633, 0.06796224413352651, 0.07993621403632675, 0.0996648260883227, 0.13493690699672048, -0.39486055394849295, -0.5856126067014387]"}], "score_patterns": ["preflop.*"]}
{"event": "decision", "id": "E015", "status": "keep", "reason": "Repeated eight-seat iteration 67.28-67.43 ms versus 78 ms; checks 13.40-13.49 ms six-seat and 41.63-41.82 ms eight-seat versus 24/94 ms. Complete fingerprints and explicit cached-vs-direct learning/evaluation match. 700 MB fallback passes. Additional actual VRAM 67/168 MB; initialization 136/230 ms warm.", "utc": "2026-09-07T02:35:37+00:00"}
{"event": "decision", "id": "E015R", "status": "keep", "reason": "Repeated eight-seat iteration 67.28-67.43 ms versus 78 ms; checks 13.40-13.49 ms six-seat and 41.63-41.82 ms eight-seat versus 24/94 ms. Complete fingerprints and explicit cached-vs-direct learning/evaluation match. 700 MB fallback passes. Additional actual VRAM 67/168 MB; initialization 136/230 ms warm.", "utc": "2026-09-07T02:35:37+00:00"}
{"event": "promote", "files": ["crates/solver/src/preflop/gpu.rs", "crates/solver/src/preflop/kernels.cu"], "commit": "6c5b5484da93b22d7e7e08ba1d22c73aabbccb25", "utc": "2026-09-07T02:35:45+00:00"}
{"event": "run", "id": "E016", "path": "memory_transfers", "hypothesis": "Use the actual configured compact plan for interactive GPU admission; retain budget rejection before allocation", "status": "crash", "utc": "2026-09-07T02:36:32+00:00", "commit": "78b96e39f52ac099848c881ea4fe475cf5b3210c", "seconds": 44.938, "diagnostic_peak_process_mb": 894.693, "returncode": 101, "command": ["cargo", "test", "--release", "-p", "solver", "--features", "gpu", "--lib", "--test", "gpu", "--", "--nocapture", "--test-threads=1"], "env": [], "metrics": {}, "checks": [], "score_patterns": []}
{"event": "run", "id": "E016R", "path": "memory_transfers", "hypothesis": "Validate compact-plan admission and rejection; river plans without omitted branches need no isomorphism saving assertion", "status": "candidate", "utc": "2026-09-07T02:40:03+00:00", "commit": "0a1ad64816061ddd0ce75ccdca94d9590979a854", "seconds": 50.203, "diagnostic_peak_process_mb": 937.693, "returncode": 0, "command": ["cargo", "test", "--release", "-p", "solver", "--features", "gpu", "--lib", "--test", "gpu", "--", "--nocapture", "--test-threads=1"], "env": [], "metrics": {}, "checks": [], "score_patterns": []}
{"event": "run", "id": "E016S", "path": "memory_transfers", "hypothesis": "Validate server GPU solve/report integration with compact-plan budget admission", "status": "candidate", "utc": "2026-09-07T02:41:12+00:00", "commit": "0a1ad64816061ddd0ce75ccdca94d9590979a854", "seconds": 48.844, "diagnostic_peak_process_mb": 1406.583, "returncode": 0, "command": ["cargo", "test", "--release", "-p", "server", "--features", "gpu", "--", "--nocapture", "--test-threads=1"], "env": [], "metrics": {}, "checks": [], "score_patterns": []}
{"event": "decision", "id": "E016", "status": "crash", "reason": "The new budget-savings assertion incorrectly treated suit symmetry on a river tree as omitted branches. E016R corrects that test assumption; the constructor and server integration then pass all affected checks.", "utc": "2026-09-07T02:42:54+00:00"}
{"event": "decision", "id": "E016R", "status": "keep", "reason": "Configured compact-plan budget admission/rejection passes 28 unit and 6 GPU tests plus the server GPU continuation/lock/compressed/stop test. This exposes retained VRAM savings to interactive solves without building the plan twice.", "utc": "2026-09-07T02:43:02+00:00"}
{"event": "decision", "id": "E016S", "status": "keep", "reason": "Configured compact-plan budget admission/rejection passes 28 unit and 6 GPU tests plus the server GPU continuation/lock/compressed/stop test. This exposes retained VRAM savings to interactive solves without building the plan twice.", "utc": "2026-09-07T02:43:02+00:00"}
{"event": "promote", "files": ["crates/solver/src/gpu/mod.rs", "crates/server/src/main.rs"], "commit": "0a1ad64816061ddd0ce75ccdca94d9590979a854", "utc": "2026-09-07T02:43:09+00:00"}
{"event": "run", "id": "B012", "path": "baseline", "hypothesis": "Fresh CPU postflop/lifecycle control before eliminating showdown scratch storage", "status": "baseline", "utc": "2026-09-07T02:43:19+00:00", "commit": "0a1ad64816061ddd0ce75ccdca94d9590979a854", "seconds": 9.172, "diagnostic_peak_process_mb": 370.328, "returncode": 0, "command": ["cargo", "test", "--release", "-p", "solver", "--test", "research_perf", "--", "lifecycle", "--ignored", "--nocapture", "--test-threads=1"], "env": [], "metrics": {"cpu.postflop.arena_mb": 104.204192, "cpu.postflop.iteration_ms": 26.05292, "lifecycle.build_ms": 9.7982, "lifecycle.compressed_load_ms": 87.2666, "lifecycle.load_ms": 50.1537, "lifecycle.profile_ms": 560.7379999999999, "lifecycle.report_lines_ms": 66.5572, "lifecycle.save_mb": 104.204944, "lifecycle.save_ms": 219.8941}, "checks": [{"exploitability": 0.36963080697589445, "iteration": 18, "nodes": 208516, "profile_hash": "b0d3ea8a1b19e943", "report_hash": "a757b21c1a6973a3", "save_hash": "b92fb5d3a217da94"}], "score_patterns": []}
{"event": "run", "id": "E017", "path": "cpu_solving", "hypothesis": "Remove per-showdown scratch-buffer acquisition and zeroing by reusing each unique output slot", "status": "candidate", "utc": "2026-09-07T02:45:12+00:00", "commit": "f26fa1c3f8bf6c7f39d2c5bbc0f6f370f3cd5824", "seconds": 25.782, "diagnostic_peak_process_mb": 539.087, "returncode": 0, "command": ["cargo", "test", "--release", "-p", "solver", "--test", "research_perf", "--", "lifecycle", "--ignored", "--nocapture", "--test-threads=1"], "env": [], "metrics": {"cpu.postflop.arena_mb": 104.204192, "cpu.postflop.iteration_ms": 25.109019999999997, "lifecycle.build_ms": 8.2563, "lifecycle.compressed_load_ms": 85.43549999999999, "lifecycle.load_ms": 50.6689, "lifecycle.profile_ms": 547.5017, "lifecycle.report_lines_ms": 64.755, "lifecycle.save_mb": 104.204944, "lifecycle.save_ms": 219.5164}, "checks": [{"exploitability": 0.36963080697589445, "iteration": 18, "nodes": 208516, "profile_hash": "b0d3ea8a1b19e943", "report_hash": "a757b21c1a6973a3", "save_hash": "b92fb5d3a217da94"}], "score_patterns": ["cpu.postflop.iteration_ms"]}
{"event": "run", "id": "E017R", "path": "cpu_solving", "hypothesis": "Repeat CPU showdown output reuse with full solver correctness suite", "status": "candidate", "utc": "2026-09-07T02:48:08+00:00", "commit": "f26fa1c3f8bf6c7f39d2c5bbc0f6f370f3cd5824", "seconds": 111.281, "diagnostic_peak_process_mb": 3487.531, "returncode": 0, "command": ["cargo", "test", "--release", "-p", "solver", "--", "--nocapture", "--test-threads=1"], "env": [], "metrics": {}, "checks": [], "score_patterns": ["cpu.postflop.iteration_ms"]}
{"event": "run", "id": "E017R2", "path": "cpu_solving", "hypothesis": "Repeat lifecycle timing after the full CPU suite passed for showdown output reuse", "status": "candidate", "utc": "2026-09-07T02:48:27+00:00", "commit": "50568eac0bb73145832c1bc67c722b5111f328d9", "seconds": 4.468, "diagnostic_peak_process_mb": 373.998, "returncode": 0, "command": ["cargo", "test", "--release", "-p", "solver", "--test", "research_perf", "--", "lifecycle", "--ignored", "--nocapture", "--test-threads=1"], "env": [], "metrics": {"cpu.postflop.arena_mb": 104.204192, "cpu.postflop.iteration_ms": 25.491039999999998, "lifecycle.build_ms": 11.8717, "lifecycle.compressed_load_ms": 90.199, "lifecycle.load_ms": 41.7304, "lifecycle.profile_ms": 554.8166, "lifecycle.report_lines_ms": 68.41460000000001, "lifecycle.save_mb": 104.204944, "lifecycle.save_ms": 278.4916}, "checks": [{"exploitability": 0.36963080697589445, "iteration": 18, "nodes": 208516, "profile_hash": "b0d3ea8a1b19e943", "report_hash": "a757b21c1a6973a3", "save_hash": "b92fb5d3a217da94"}], "score_patterns": ["cpu.postflop.iteration_ms"]}
{"event": "decision", "id": "E017", "status": "keep", "reason": "CPU postflop iteration repeats at 25.11/25.49 ms versus fresh 26.05 ms control (2-4 percent improvement). Full 124-test CPU suite passes; exploitability, report, profile and saved-state fingerprints unchanged. Removes scratch storage without changing arithmetic order.", "utc": "2026-09-07T02:50:12+00:00"}
{"event": "decision", "id": "E017R", "status": "keep", "reason": "CPU postflop iteration repeats at 25.11/25.49 ms versus fresh 26.05 ms control (2-4 percent improvement). Full 124-test CPU suite passes; exploitability, report, profile and saved-state fingerprints unchanged. Removes scratch storage without changing arithmetic order.", "utc": "2026-09-07T02:50:12+00:00"}
{"event": "decision", "id": "E017R2", "status": "keep", "reason": "CPU postflop iteration repeats at 25.11/25.49 ms versus fresh 26.05 ms control (2-4 percent improvement). Full 124-test CPU suite passes; exploitability, report, profile and saved-state fingerprints unchanged. Removes scratch storage without changing arithmetic order.", "utc": "2026-09-07T02:50:12+00:00"}
{"event": "promote", "files": ["crates/solver/src/game.rs"], "commit": "50568eac0bb73145832c1bc67c722b5111f328d9", "utc": "2026-09-07T02:50:20+00:00"}
{"event": "run", "id": "E018", "path": "cpu_solving", "hypothesis": "Precompute showdown strength boundaries for CPU sweeps and reuse them in GPU plans, preserving every sum order", "status": "candidate", "utc": "2026-09-07T02:50:48+00:00", "commit": "110e964817aa38b85f1e8a7d838ee7a1040a6d99", "seconds": 25.953, "diagnostic_peak_process_mb": 536.457, "returncode": 0, "command": ["cargo", "test", "--release", "-p", "solver", "--test", "research_perf", "--", "lifecycle", "--ignored", "--nocapture", "--test-threads=1"], "env": [], "metrics": {"cpu.postflop.arena_mb": 104.204192, "cpu.postflop.iteration_ms": 25.222559999999998, "lifecycle.build_ms": 8.9559, "lifecycle.compressed_load_ms": 85.06519999999999, "lifecycle.load_ms": 37.011, "lifecycle.profile_ms": 546.0077, "lifecycle.report_lines_ms": 67.8058, "lifecycle.save_mb": 104.204944, "lifecycle.save_ms": 126.18109999999999}, "checks": [{"exploitability": 0.36963080697589445, "iteration": 18, "nodes": 208516, "profile_hash": "b0d3ea8a1b19e943", "report_hash": "a757b21c1a6973a3", "save_hash": "b92fb5d3a217da94"}], "score_patterns": ["cpu.postflop.iteration_ms", "lifecycle.*load_ms", "lifecycle.build_ms"]}
{"event": "run", "id": "E018R", "path": "cpu_solving", "hypothesis": "Repeat precomputed CPU showdown boundaries to distinguish a useful gain from a near-tie", "status": "candidate", "utc": "2026-09-07T02:52:45+00:00", "commit": "110e964817aa38b85f1e8a7d838ee7a1040a6d99", "seconds": 3.937, "diagnostic_peak_process_mb": 370.065, "returncode": 0, "command": ["cargo", "test", "--release", "-p", "solver", "--test", "research_perf", "--", "lifecycle", "--ignored", "--nocapture", "--test-threads=1"], "env": [], "metrics": {"cpu.postflop.arena_mb": 104.204192, "cpu.postflop.iteration_ms": 25.57894, "lifecycle.build_ms": 8.4499, "lifecycle.compressed_load_ms": 88.82339999999999, "lifecycle.load_ms": 38.6703, "lifecycle.profile_ms": 551.6168, "lifecycle.report_lines_ms": 69.3545, "lifecycle.save_mb": 104.204944, "lifecycle.save_ms": 132.35569999999998}, "checks": [{"exploitability": 0.36963080697589445, "iteration": 18, "nodes": 208516, "profile_hash": "b0d3ea8a1b19e943", "report_hash": "a757b21c1a6973a3", "save_hash": "b92fb5d3a217da94"}], "score_patterns": ["cpu.postflop.iteration_ms"]}
{"event": "decision", "id": "E018", "status": "discard", "reason": "CPU iterations 25.22/25.58 ms versus 25.11/25.49 ms before the added cache: no repeatable gain. Identical state, but persistent table memory and added setup complexity are not justified. Restore prior game and GPU plan.", "utc": "2026-09-07T02:53:59+00:00"}
{"event": "decision", "id": "E018R", "status": "discard", "reason": "CPU iterations 25.22/25.58 ms versus 25.11/25.49 ms before the added cache: no repeatable gain. Identical state, but persistent table memory and added setup complexity are not justified. Restore prior game and GPU plan.", "utc": "2026-09-07T02:53:59+00:00"}
