{"event": "run", "id": "B022", "path": "baseline", "hypothesis": "Second-pass starting control: retained preflop CUDA throughput, CPU readback and allocated VRAM before removing sigma cache", "status": "baseline", "utc": "2026-09-07T04:00:00+00:00", "commit": "a557aede88743db8efd29f99ef50833847918862", "seconds": 15.203, "diagnostic_peak_process_mb": 2107.949, "returncode": 0, "command": ["cargo", "test", "--release", "-p", "solver", "--features", "gpu", "--test", "preflop_perf", "--test", "capacity_perf", "--", "--ignored", "--nocapture", "--test-threads=1"], "env": [], "metrics": {"preflop.6.allocated_vram_mb": 671.08864, "preflop.6.build_ms": 78.73769999999999, "preflop.6.cpu_arena_mb": 224.552328, "preflop.6.estimated_vram_mb": 706.776248, "preflop.6.init_ms": 137.2215, "preflop.8.allocated_vram_mb": 1711.276032, "preflop.8.build_ms": 212.5951, "preflop.8.cpu_arena_mb": 587.239848, "preflop.8.estimated_vram_mb": 1750.508472, "preflop.8.init_ms": 232.1813, "preflop.2.iteration_ms": 0.084, "preflop.2.check_ms": 0.294, "preflop.2.sync_ms": 0.017, "preflop.6.iteration_ms": 19.437, "preflop.6.check_ms": 13.014, "preflop.6.sync_ms": 25.102, "preflop.8.iteration_ms": 67.243, "preflop.8.check_ms": 41.56, "preflop.8.sync_ms": 70.492}, "checks": [{"nodes": 166090, "note": "Allocated VRAM is device free-memory delta; estimate is the engine preflight formula.", "seats": 6}, {"nodes": 434350, "note": "Allocated VRAM is device free-memory delta; estimate is the engine preflight formula.", "seats": 8}, {"preflop": "PERF seats=2 nodes=40 iteration_ms=0.084 check_ms=0.294 sync_ms=0.017 arena_hash=6d4781fae03e3474 gaps=[0.05088935968248226, 0.013161917444424076] evs=[-0.15795953824550446, -0.4142353804778675]"}, {"preflop": "PERF seats=6 nodes=166090 iteration_ms=19.437 check_ms=13.014 sync_ms=25.102 arena_hash=b70284af63586e3f gaps=[0.10415872559930028, 0.03471900474586882, 0.05645132130650671, 0.04355598961220011, 0.02566278444731196, 0.025583227687036025] evs=[0.08985395657613165, 0.11143259696531381, 0.13262513589238922, 0.15984876666632344, -0.3195691149045554, -0.4656351703726333]"}, {"preflop": "PERF seats=8 nodes=434350 iteration_ms=67.243 check_ms=41.560 sync_ms=70.492 arena_hash=e01dd7a18632644d gaps=[0.022654395639749164, 0.010278385995560232, 0.008437781286659882, 0.011345792287176693, 0.011192070283014638, 0.012086956929344556, 0.01380422891560007, 0.011174031925715422] evs=[0.04857087063871364, 0.05480589083850633, 0.06796224413352651, 0.07993621403632675, 0.0996648260883227, 0.13493690699672048, -0.39486055394849295, -0.5856126067014387]"}], "score_patterns": []}
{"event": "run", "id": "E021", "path": "memory_transfers", "hypothesis": "Remove full preflop sigma arena: recompute exact action probabilities before each own-node update, reducing GPU allocation and repeated sigma traffic", "status": "candidate", "utc": "2026-09-07T04:02:14+00:00", "commit": "b0a97dbf15e1149c8f0c0d2c1874c071960c0766", "seconds": 40.281, "diagnostic_peak_process_mb": 2108.088, "returncode": 0, "command": ["cargo", "test", "--release", "-p", "solver", "--features", "gpu", "--test", "preflop_perf", "--test", "capacity_perf", "--", "--ignored", "--nocapture", "--test-threads=1"], "env": [], "metrics": {"preflop.6.allocated_vram_mb": 536.870912, "preflop.6.build_ms": 78.2891, "preflop.6.cpu_arena_mb": 224.552328, "preflop.6.estimated_vram_mb": 594.500084, "preflop.6.init_ms": 511.6802, "preflop.8.allocated_vram_mb": 1409.286144, "preflop.8.build_ms": 213.5309, "preflop.8.cpu_arena_mb": 587.239848, "preflop.8.estimated_vram_mb": 1456.8885480000001, "preflop.8.init_ms": 240.9114, "preflop.2.iteration_ms": 0.085, "preflop.2.check_ms": 0.304, "preflop.2.sync_ms": 0.018, "preflop.6.iteration_ms": 18.194, "preflop.6.check_ms": 12.885, "preflop.6.sync_ms": 24.904, "preflop.8.iteration_ms": 63.324, "preflop.8.check_ms": 41.641, "preflop.8.sync_ms": 71.408}, "checks": [{"nodes": 166090, "note": "Allocated VRAM is device free-memory delta; estimate is the engine preflight formula.", "seats": 6}, {"nodes": 434350, "note": "Allocated VRAM is device free-memory delta; estimate is the engine preflight formula.", "seats": 8}, {"preflop": "PERF seats=2 nodes=40 iteration_ms=0.085 check_ms=0.304 sync_ms=0.018 arena_hash=6d4781fae03e3474 gaps=[0.05088935968248226, 0.013161917444424076] evs=[-0.15795953824550446, -0.4142353804778675]"}, {"preflop": "PERF seats=6 nodes=166090 iteration_ms=18.194 check_ms=12.885 sync_ms=24.904 arena_hash=b70284af63586e3f gaps=[0.10415872559930028, 0.03471900474586882, 0.05645132130650671, 0.04355598961220011, 0.02566278444731196, 0.025583227687036025] evs=[0.08985395657613165, 0.11143259696531381, 0.13262513589238922, 0.15984876666632344, -0.3195691149045554, -0.4656351703726333]"}, {"preflop": "PERF seats=8 nodes=434350 iteration_ms=63.324 check_ms=41.641 sync_ms=71.408 arena_hash=e01dd7a18632644d gaps=[0.022654395639749164, 0.010278385995560232, 0.008437781286659882, 0.011345792287176693, 0.011192070283014638, 0.012086956929344556, 0.01380422891560007, 0.011174031925715422] evs=[0.04857087063871364, 0.05480589083850633, 0.06796224413352651, 0.07993621403632675, 0.0996648260883227, 0.13493690699672048, -0.39486055394849295, -0.5856126067014387]"}], "score_patterns": ["preflop.*"]}
{"event": "run", "id": "E021R", "path": "memory_transfers", "hypothesis": "Repeat sigma-arena removal: require original complete fingerprints and stable memory reduction, then preflop GPU equivalence and cache/stop unit checks", "status": "candidate", "utc": "2026-09-07T04:03:31+00:00", "commit": "b0a97dbf15e1149c8f0c0d2c1874c071960c0766", "seconds": 41.094, "diagnostic_peak_process_mb": 2107.941, "returncode": 0, "command": ["cargo", "test", "--release", "-p", "solver", "--features", "gpu", "--lib", "--test", "preflop_gpu", "--test", "preflop_perf", "--test", "capacity_perf", "--", "--include-ignored", "--nocapture", "--test-threads=1"], "env": [], "metrics": {"preflop.6.allocated_vram_mb": 536.870912, "preflop.6.build_ms": 79.5018, "preflop.6.cpu_arena_mb": 224.552328, "preflop.6.estimated_vram_mb": 594.500084, "preflop.6.init_ms": 146.0123, "preflop.8.allocated_vram_mb": 1409.286144, "preflop.8.build_ms": 217.3764, "preflop.8.cpu_arena_mb": 587.239848, "preflop.8.estimated_vram_mb": 1456.8885480000001, "preflop.8.init_ms": 234.6397, "preflop.2.iteration_ms": 0.085, "preflop.2.check_ms": 0.285, "preflop.2.sync_ms": 0.017, "preflop.6.iteration_ms": 18.12, "preflop.6.check_ms": 12.998, "preflop.6.sync_ms": 24.96, "preflop.8.iteration_ms": 63.133, "preflop.8.check_ms": 41.037, "preflop.8.sync_ms": 66.701}, "checks": [{"nodes": 166090, "note": "Allocated VRAM is device free-memory delta; estimate is the engine preflight formula.", "seats": 6}, {"nodes": 434350, "note": "Allocated VRAM is device free-memory delta; estimate is the engine preflight formula.", "seats": 8}, {"preflop": "PERF seats=2 nodes=40 iteration_ms=0.085 check_ms=0.285 sync_ms=0.017 arena_hash=6d4781fae03e3474 gaps=[0.05088935968248226, 0.013161917444424076] evs=[-0.15795953824550446, -0.4142353804778675]"}, {"preflop": "PERF seats=6 nodes=166090 iteration_ms=18.120 check_ms=12.998 sync_ms=24.960 arena_hash=b70284af63586e3f gaps=[0.10415872559930028, 0.03471900474586882, 0.05645132130650671, 0.04355598961220011, 0.02566278444731196, 0.025583227687036025] evs=[0.08985395657613165, 0.11143259696531381, 0.13262513589238922, 0.15984876666632344, -0.3195691149045554, -0.4656351703726333]"}, {"preflop": "PERF seats=8 nodes=434350 iteration_ms=63.133 check_ms=41.037 sync_ms=66.701 arena_hash=e01dd7a18632644d gaps=[0.022654395639749164, 0.010278385995560232, 0.008437781286659882, 0.011345792287176693, 0.011192070283014638, 0.012086956929344556, 0.01380422891560007, 0.011174031925715422] evs=[0.04857087063871364, 0.05480589083850633, 0.06796224413352651, 0.07993621403632675, 0.0996648260883227, 0.13493690699672048, -0.39486055394849295, -0.5856126067014387]"}], "score_patterns": ["preflop.*"]}
{"event": "harness_updated", "file": "crates/solver/tests/preflop_budget.rs", "old_sha256": "9a725e8003ef5fec9f3a6320b97c44dfdd1e4d3276cbe12a530bd2df3fcd904d", "new_sha256": "9c5376769a3d41ec7d341cd011cab36aeccb8b7d386e24863a1ae1b681b2f2ea", "reason": "E021 reduces preferred memory below old budget constants. Tighten correctness-only fallback budgets from 700/1600 to 550/1350 MB so the optional cache still must be omitted; all input trees, iterations and exact assertions stay unchanged. No timed workload is changed.", "utc": "2026-09-07T04:04:56.151608+00:00"}
{"event": "run", "id": "E021B", "path": "memory_transfers", "hypothesis": "Tightened 550/1350 MB fallback budgets after sigma removal must preserve every large-game arena, gap and EV bit", "status": "candidate", "utc": "2026-09-07T04:05:42+00:00", "commit": "9c8a21fe870e8c1b831bee88941eed56a67dbbb7", "seconds": 45.234, "diagnostic_peak_process_mb": 2213.45, "returncode": 0, "command": ["cargo", "test", "--release", "-p", "solver", "--features", "gpu", "--test", "preflop_budget", "--", "--ignored", "--nocapture", "--test-threads=1"], "env": [], "metrics": {}, "checks": [{"all_arena_gap_ev_bits_equal": true, "iteration": 65, "seats": 6, "tight_budget_mb": 550}, {"all_arena_gap_ev_bits_equal": true, "iteration": 65, "seats": 8, "tight_budget_mb": 1350}], "score_patterns": []}
{"event": "decision", "id": "E021", "status": "keep", "reason": "Repeated 6-7% large-game iteration gain; 134/302 MB less actual VRAM; exact 2/6/8-player fingerprints and tight-budget fallback equivalence", "utc": "2026-09-07T04:08:29+00:00"}
{"event": "decision", "id": "E021R", "status": "keep", "reason": "Repeated 6-7% large-game iteration gain; 134/302 MB less actual VRAM; exact 2/6/8-player fingerprints and tight-budget fallback equivalence", "utc": "2026-09-07T04:08:29+00:00"}
{"event": "decision", "id": "E021B", "status": "keep", "reason": "Repeated 6-7% large-game iteration gain; 134/302 MB less actual VRAM; exact 2/6/8-player fingerprints and tight-budget fallback equivalence", "utc": "2026-09-07T04:08:29+00:00"}
{"event": "promote", "files": ["crates/solver/src/preflop/gpu.rs", "crates/solver/src/preflop/kernels.cu"], "commit": "9c8a21fe870e8c1b831bee88941eed56a67dbbb7", "utc": "2026-09-07T04:08:39+00:00"}
{"event": "run", "id": "B023", "path": "postflop_cuda", "hypothesis": "Fresh postflop action-kernel control on retained sigma-free preflop code", "status": "baseline", "utc": "2026-09-07T04:09:10+00:00", "commit": "9c8a21fe870e8c1b831bee88941eed56a67dbbb7", "seconds": 20.297, "diagnostic_peak_process_mb": 4377.244, "returncode": 0, "command": ["cargo", "test", "--release", "-p", "solver", "--features", "gpu", "--test", "postflop_perf", "--", "--ignored", "--nocapture", "--test-threads=1"], "env": [], "metrics": {"postflop.Ks7h2d.init_ms": 1035.113, "postflop.Ks7h2d.iteration_ms": 57.573, "postflop.Ks7h2d.check_ms": 36.387, "postflop.Ks7s2d.init_ms": 745.932, "postflop.Ks7s2d.iteration_ms": 34.151, "postflop.Ks7s2d.check_ms": 29.432, "postflop.Ks7h2dQhTc.init_ms": 69.231, "postflop.Ks7h2dQhTc.iteration_ms": 0.32, "postflop.Ks7h2dQhTc.check_ms": 0.579}, "checks": [{"postflop": "POSTFLOP board=Ks7h2d rake=0 nodes=1346813 init_ms=1035.113 iteration_ms=57.573 check_ms=36.387 exploit_chips=1.698464289"}, {"postflop": "POSTFLOP board=Ks7s2d rake=0.05 nodes=1346813 init_ms=745.932 iteration_ms=34.151 check_ms=29.432 exploit_chips=1.329163551"}, {"postflop": "POSTFLOP board=Ks7h2dQhTc rake=0.05 nodes=33 init_ms=69.231 iteration_ms=0.320 check_ms=0.579 exploit_chips=0.140634178"}], "score_patterns": []}
{"event": "harness_added", "utc": "2026-09-07T04:10:24.978872+00:00", "file": "crates/solver/tests/cuda_resources.rs", "sha256": "f353296223ecc8f35745fd086702a64bcc134f9f351e3d8247ff08925f8a6d02", "reason": "Read-only NVRTC resources using unchanged production compiler options; diagnostics only, not scores"}
{"event": "run", "id": "B024", "path": "postflop_cuda", "hypothesis": "Compile retained CUDA with production options and inspect local memory/register resources before action specialization", "status": "baseline", "utc": "2026-09-07T04:10:32+00:00", "commit": "b65ec048ce7fdb57d127c07dd344b43ebecab65d", "seconds": 5.265, "diagnostic_peak_process_mb": 295.961, "returncode": 0, "command": ["cargo", "test", "--release", "-p", "solver", "--features", "gpu", "--test", "cuda_resources", "--", "--ignored", "--nocapture", "--test-threads=1"], "env": [], "metrics": {}, "checks": [{"area": "postflop", "kernel": "down_action", "local_bytes_per_thread": 32, "registers": 40, "static_shared_bytes": 0}, {"area": "postflop", "kernel": "up_action", "local_bytes_per_thread": 64, "registers": 40, "static_shared_bytes": 0}, {"area": "postflop", "kernel": "up_action_eval", "local_bytes_per_thread": 0, "registers": 40, "static_shared_bytes": 0}, {"area": "postflop", "kernel": "up_show", "local_bytes_per_thread": 0, "registers": 40, "static_shared_bytes": 1040}, {"area": "postflop", "kernel": "up_fold", "local_bytes_per_thread": 0, "registers": 40, "static_shared_bytes": 1232}, {"area": "preflop", "kernel": "pf_down", "local_bytes_per_thread": 64, "registers": 40, "static_shared_bytes": 0}, {"area": "preflop", "kernel": "pf_up", "local_bytes_per_thread": 64, "registers": 40, "static_shared_bytes": 0}, {"area": "preflop", "kernel": "pf_terminal", "local_bytes_per_thread": 40, "registers": 46, "static_shared_bytes": 0}, {"area": "preflop", "kernel": "pf_reach_mass", "local_bytes_per_thread": 0, "registers": 12, "static_shared_bytes": 1024}], "score_patterns": []}
{"event": "run", "id": "E022", "path": "postflop_cuda", "hypothesis": "Specialize two/three/four-action up sweeps to keep private regret/value caches in registers without changing sum order", "status": "candidate", "utc": "2026-09-07T04:11:52+00:00", "commit": "cb6f9d45cdc3c972a6e6fd447d9cd473faf1faf9", "seconds": 49.828, "diagnostic_peak_process_mb": 4372.992, "returncode": 0, "command": ["cargo", "test", "--release", "-p", "solver", "--features", "gpu", "--test", "cuda_resources", "--test", "postflop_perf", "--test", "postflop_state_perf", "--", "--ignored", "--nocapture", "--test-threads=1"], "env": [], "metrics": {"postflop.Ks7h2d.init_ms": 1030.811, "postflop.Ks7h2d.iteration_ms": 54.49, "postflop.Ks7h2d.check_ms": 35.871, "postflop.Ks7s2d.init_ms": 724.568, "postflop.Ks7s2d.iteration_ms": 32.618, "postflop.Ks7s2d.check_ms": 29.48, "postflop.Ks7h2dQhTc.init_ms": 65.858, "postflop.Ks7h2dQhTc.iteration_ms": 0.304, "postflop.Ks7h2dQhTc.check_ms": 0.561}, "checks": [{"area": "postflop", "kernel": "down_action", "local_bytes_per_thread": 32, "registers": 40, "static_shared_bytes": 0}, {"area": "postflop", "kernel": "up_action", "local_bytes_per_thread": 0, "registers": 66, "static_shared_bytes": 0}, {"area": "postflop", "kernel": "up_action_eval", "local_bytes_per_thread": 0, "registers": 40, "static_shared_bytes": 0}, {"area": "postflop", "kernel": "up_show", "local_bytes_per_thread": 0, "registers": 40, "static_shared_bytes": 1040}, {"area": "postflop", "kernel": "up_fold", "local_bytes_per_thread": 0, "registers": 40, "static_shared_bytes": 1232}, {"area": "preflop", "kernel": "pf_down", "local_bytes_per_thread": 64, "registers": 40, "static_shared_bytes": 0}, {"area": "preflop", "kernel": "pf_up", "local_bytes_per_thread": 64, "registers": 40, "static_shared_bytes": 0}, {"area": "preflop", "kernel": "pf_terminal", "local_bytes_per_thread": 40, "registers": 46, "static_shared_bytes": 0}, {"area": "preflop", "kernel": "pf_reach_mass", "local_bytes_per_thread": 0, "registers": 12, "static_shared_bytes": 1024}, {"postflop": "POSTFLOP board=Ks7h2d rake=0 nodes=1346813 init_ms=1030.811 iteration_ms=54.490 check_ms=35.871 exploit_chips=1.698464289"}, {"postflop": "POSTFLOP board=Ks7s2d rake=0.05 nodes=1346813 init_ms=724.568 iteration_ms=32.618 check_ms=29.480 exploit_chips=1.329163551"}, {"postflop": "POSTFLOP board=Ks7h2dQhTc rake=0.05 nodes=33 init_ms=65.858 iteration_ms=0.304 check_ms=0.561 exploit_chips=0.140634178"}, {"board": "KsQs2d", "iso": false, "rake": 0.0, "states": [{"exploit_bits": 4587303795425830328, "hash": "ced25cd534160a7a", "locked": false}, {"exploit_bits": 4581640868563274656, "hash": "8729320849b9d33c", "locked": true}]}, {"board": "KsQs2d", "iso": false, "rake": 0.05, "states": [{"exploit_bits": 4587469623950769688, "hash": "dce9b2717e0df16e", "locked": false}, {"exploit_bits": 4581722223845122880, "hash": "99111fb9c8ec709b", "locked": true}]}, {"board": "KsQs2d", "iso": true, "rake": 0.0, "states": [{"exploit_bits": 4587284094896033288, "hash": "f28b67b0f43f8498", "locked": false}, {"exploit_bits": 4581629036489079792, "hash": "52fbd9a266ab35c1", "locked": true}]}, {"board": "KsQs2d", "iso": true, "rake": 0.05, "states": [{"exploit_bits": 4587467559043767640, "hash": "7abb90d6fa5ac2fc", "locked": false}, {"exploit_bits": 4581695983154347840, "hash": "b529102cce25dc39", "locked": true}]}, {"board": "Qs7h2dKh", "iso": false, "rake": 0.0, "states": [{"exploit_bits": 4582461738720506392, "hash": "816eeeb55df5fe5c", "locked": false}, {"exploit_bits": 4576041536399700112, "hash": "202311fe47670cc0", "locked": true}]}, {"board": "Qs7h2dKh", "iso": false, "rake": 0.05, "states": [{"exploit_bits": 4583407264393491801, "hash": "ed2549bfcfbc34f1", "locked": false}, {"exploit_bits": 4576219535588436580, "hash": "8217b6d74d4da526", "locked": true}]}, {"board": "Qs7h2dKh", "iso": true, "rake": 0.0, "states": [{"exploit_bits": 4582461738720506392, "hash": "816eeeb55df5fe5c", "locked": false}, {"exploit_bits": 4576041536399700112, "hash": "202311fe47670cc0", "locked": true}]}, {"board": "Qs7h2dKh", "iso": true, "rake": 0.05, "states": [{"exploit_bits": 4583407264393491801, "hash": "ed2549bfcfbc34f1", "locked": false}, {"exploit_bits": 4576219535588436580, "hash": "8217b6d74d4da526", "locked": true}]}, {"board": "AsKsQsJsTs", "iso": false, "rake": 0.0, "states": [{"exploit_bits": 4554443791804951647, "hash": "7f53c8ac5434860d", "locked": false}, {"exploit_bits": 4545576682231338880, "hash": "409995a6b2afc105", "locked": true}]}, {"board": "AsKsQsJsTs", "iso": false, "rake": 0.05, "states": [{"exploit_bits": 4566905886187841344, "hash": "af8ff4550d82f9ef", "locked": false}, {"exploit_bits": 4558330255933400576, "hash": "db670420a8559b3f", "locked": true}]}, {"board": "AsKsQsJsTs", "iso": true, "rake": 0.0, "states": [{"exploit_bits": 4554443791804951647, "hash": "7f53c8ac5434860d", "locked": false}, {"exploit_bits": 4545576682231338880, "hash": "409995a6b2afc105", "locked": true}]}, {"board": "AsKsQsJsTs", "iso": true, "rake": 0.05, "states": [{"exploit_bits": 4566905886187841344, "hash": "af8ff4550d82f9ef", "locked": false}, {"exploit_bits": 4558330255933400576, "hash": "db670420a8559b3f", "locked": true}]}], "score_patterns": []}
{"event": "harness_added", "utc": "2026-09-07T04:13:19.758561+00:00", "file": "crates/solver/tests/postflop_resume_state.rs", "sha256": "eb15af135a357f9ceb8e21d3fe8f2a616a0d562ee9468cc6ada6113ca27617a4", "reason": "Freeze pre-compaction full raw-store/save/query/exploit controls: cold and CPU-warm; F32/compressed; iso on/off; signed zero inactive data; repeated full/strategy sync; lock changes; load/resume"}
