{"event": "run", "id": "E023", "path": "postflop_cuda", "hypothesis": "Specialize two/three/four-action reach propagation to eliminate dynamic local cache and accelerate both iterations and checks", "status": "candidate", "utc": "2026-09-07T04:16:30+00:00", "commit": "7d72ebd40006e0a1ae3689e7fc31a99290d66311", "seconds": 50.14, "diagnostic_peak_process_mb": 4274.856, "returncode": 0, "command": ["cargo", "test", "--release", "-p", "solver", "--features", "gpu", "--test", "cuda_resources", "--test", "postflop_perf", "--test", "postflop_state_perf", "--", "--ignored", "--nocapture", "--test-threads=1"], "env": [], "metrics": {"postflop.Ks7h2d.init_ms": 1030.994, "postflop.Ks7h2d.iteration_ms": 52.084, "postflop.Ks7h2d.check_ms": 34.969, "postflop.Ks7s2d.init_ms": 677.237, "postflop.Ks7s2d.iteration_ms": 31.235, "postflop.Ks7s2d.check_ms": 28.881, "postflop.Ks7h2dQhTc.init_ms": 76.76, "postflop.Ks7h2dQhTc.iteration_ms": 0.273, "postflop.Ks7h2dQhTc.check_ms": 0.571}, "checks": [{"area": "postflop", "kernel": "down_action", "local_bytes_per_thread": 0, "registers": 48, "static_shared_bytes": 0}, {"area": "postflop", "kernel": "up_action", "local_bytes_per_thread": 0, "registers": 66, "static_shared_bytes": 0}, {"area": "postflop", "kernel": "up_action_eval", "local_bytes_per_thread": 0, "registers": 40, "static_shared_bytes": 0}, {"area": "postflop", "kernel": "up_show", "local_bytes_per_thread": 0, "registers": 40, "static_shared_bytes": 1040}, {"area": "postflop", "kernel": "up_fold", "local_bytes_per_thread": 0, "registers": 40, "static_shared_bytes": 1232}, {"area": "preflop", "kernel": "pf_down", "local_bytes_per_thread": 64, "registers": 40, "static_shared_bytes": 0}, {"area": "preflop", "kernel": "pf_up", "local_bytes_per_thread": 64, "registers": 40, "static_shared_bytes": 0}, {"area": "preflop", "kernel": "pf_terminal", "local_bytes_per_thread": 40, "registers": 46, "static_shared_bytes": 0}, {"area": "preflop", "kernel": "pf_reach_mass", "local_bytes_per_thread": 0, "registers": 12, "static_shared_bytes": 1024}, {"postflop": "POSTFLOP board=Ks7h2d rake=0 nodes=1346813 init_ms=1030.994 iteration_ms=52.084 check_ms=34.969 exploit_chips=1.698464289"}, {"postflop": "POSTFLOP board=Ks7s2d rake=0.05 nodes=1346813 init_ms=677.237 iteration_ms=31.235 check_ms=28.881 exploit_chips=1.329163551"}, {"postflop": "POSTFLOP board=Ks7h2dQhTc rake=0.05 nodes=33 init_ms=76.760 iteration_ms=0.273 check_ms=0.571 exploit_chips=0.140634178"}, {"board": "KsQs2d", "iso": false, "rake": 0.0, "states": [{"exploit_bits": 4587303795425830328, "hash": "ced25cd534160a7a", "locked": false}, {"exploit_bits": 4581640868563274656, "hash": "8729320849b9d33c", "locked": true}]}, {"board": "KsQs2d", "iso": false, "rake": 0.05, "states": [{"exploit_bits": 4587469623950769688, "hash": "dce9b2717e0df16e", "locked": false}, {"exploit_bits": 4581722223845122880, "hash": "99111fb9c8ec709b", "locked": true}]}, {"board": "KsQs2d", "iso": true, "rake": 0.0, "states": [{"exploit_bits": 4587284094896033288, "hash": "f28b67b0f43f8498", "locked": false}, {"exploit_bits": 4581629036489079792, "hash": "52fbd9a266ab35c1", "locked": true}]}, {"board": "KsQs2d", "iso": true, "rake": 0.05, "states": [{"exploit_bits": 4587467559043767640, "hash": "7abb90d6fa5ac2fc", "locked": false}, {"exploit_bits": 4581695983154347840, "hash": "b529102cce25dc39", "locked": true}]}, {"board": "Qs7h2dKh", "iso": false, "rake": 0.0, "states": [{"exploit_bits": 4582461738720506392, "hash": "816eeeb55df5fe5c", "locked": false}, {"exploit_bits": 4576041536399700112, "hash": "202311fe47670cc0", "locked": true}]}, {"board": "Qs7h2dKh", "iso": false, "rake": 0.05, "states": [{"exploit_bits": 4583407264393491801, "hash": "ed2549bfcfbc34f1", "locked": false}, {"exploit_bits": 4576219535588436580, "hash": "8217b6d74d4da526", "locked": true}]}, {"board": "Qs7h2dKh", "iso": true, "rake": 0.0, "states": [{"exploit_bits": 4582461738720506392, "hash": "816eeeb55df5fe5c", "locked": false}, {"exploit_bits": 4576041536399700112, "hash": "202311fe47670cc0", "locked": true}]}, {"board": "Qs7h2dKh", "iso": true, "rake": 0.05, "states": [{"exploit_bits": 4583407264393491801, "hash": "ed2549bfcfbc34f1", "locked": false}, {"exploit_bits": 4576219535588436580, "hash": "8217b6d74d4da526", "locked": true}]}, {"board": "AsKsQsJsTs", "iso": false, "rake": 0.0, "states": [{"exploit_bits": 4554443791804951647, "hash": "7f53c8ac5434860d", "locked": false}, {"exploit_bits": 4545576682231338880, "hash": "409995a6b2afc105", "locked": true}]}, {"board": "AsKsQsJsTs", "iso": false, "rake": 0.05, "states": [{"exploit_bits": 4566905886187841344, "hash": "af8ff4550d82f9ef", "locked": false}, {"exploit_bits": 4558330255933400576, "hash": "db670420a8559b3f", "locked": true}]}, {"board": "AsKsQsJsTs", "iso": true, "rake": 0.0, "states": [{"exploit_bits": 4554443791804951647, "hash": "7f53c8ac5434860d", "locked": false}, {"exploit_bits": 4545576682231338880, "hash": "409995a6b2afc105", "locked": true}]}, {"board": "AsKsQsJsTs", "iso": true, "rake": 0.05, "states": [{"exploit_bits": 4566905886187841344, "hash": "af8ff4550d82f9ef", "locked": false}, {"exploit_bits": 4558330255933400576, "hash": "db670420a8559b3f", "locked": true}]}], "score_patterns": ["postflop.*.iteration_ms", "postflop.*.check_ms"]}
{"event": "harness_added", "utc": "2026-09-07T04:17:11.372952+00:00", "file": "crates/solver/tests/postflop_action_menus.rs", "sha256": "4a518cbc449668a3221737815507e8ffc1f0434f1c387809736ce31b3cad5cc3", "reason": "Freeze 1/2/3/4/5/11-action DCFR and CFR+ controls including locks before original-source reference run"}
{"event": "run", "id": "B025", "path": "postflop_cuda", "hypothesis": "Fresh original action-kernel timings and 1/2/3/4/5/11-action DCFR/CFR+ state reference before comparing both specializations", "status": "baseline", "utc": "2026-09-07T04:18:17+00:00", "commit": "2b111e836f03789ae043215ed57cf8d3b730228d", "seconds": 47.969, "diagnostic_peak_process_mb": 4733.731, "returncode": 0, "command": ["cargo", "test", "--release", "-p", "solver", "--features", "gpu", "--test", "postflop_action_menus", "--test", "postflop_perf", "--", "--ignored", "--nocapture", "--test-threads=1"], "env": [], "metrics": {"postflop.Ks7h2d.init_ms": 1063.286, "postflop.Ks7h2d.iteration_ms": 58.213, "postflop.Ks7h2d.check_ms": 35.708, "postflop.Ks7s2d.init_ms": 733.486, "postflop.Ks7s2d.iteration_ms": 34.09, "postflop.Ks7s2d.check_ms": 28.705, "postflop.Ks7h2dQhTc.init_ms": 63.589, "postflop.Ks7h2dQhTc.iteration_ms": 0.321, "postflop.Ks7h2dQhTc.check_ms": 0.596}, "checks": [{"algorithm": "Dcfr", "bets": "", "menu_states": [{"exploit_bits": 0, "hash": "4f030aa0fe9deb5f", "locked": false}, {"exploit_bits": 0, "hash": "8e5d7a73c6fc124e", "locked": true}], "root_actions": 1}, {"algorithm": "CfrPlus", "bets": "", "menu_states": [{"exploit_bits": 0, "hash": "4f030aa0fe9deb5f", "locked": false}, {"exploit_bits": 0, "hash": "8e5d7a73c6fc124e", "locked": true}], "root_actions": 1}, {"algorithm": "Dcfr", "bets": "50", "menu_states": [{"exploit_bits": 4573123367441913472, "hash": "28e830748f7862f9", "locked": false}, {"exploit_bits": 4565846421063463936, "hash": "32e870d727e15e5f", "locked": true}], "root_actions": 2}, {"algorithm": "CfrPlus", "bets": "50", "menu_states": [{"exploit_bits": 4575373351273120128, "hash": "416e7f8a4ac7c606", "locked": false}, {"exploit_bits": 4567243943030646784, "hash": "8069c4264711efae", "locked": true}], "root_actions": 2}, {"algorithm": "Dcfr", "bets": "33 75", "menu_states": [{"exploit_bits": 4575084589291749568, "hash": "ae061a57520656fe", "locked": false}, {"exploit_bits": 4567293853705376896, "hash": "97518332785a83cd", "locked": true}], "root_actions": 3}, {"algorithm": "CfrPlus", "bets": "33 75", "menu_states": [{"exploit_bits": 4577085624307641248, "hash": "195630b94c45e510", "locked": false}, {"exploit_bits": 4569213372567492352, "hash": "0d0282705a8c51f8", "locked": true}], "root_actions": 3}, {"algorithm": "Dcfr", "bets": "25 50 100", "menu_states": [{"exploit_bits": 4576662650375970560, "hash": "91e4a6d2278b5be4", "locked": false}, {"exploit_bits": 4568167495878385472, "hash": "a574b116361c3282", "locked": true}], "root_actions": 4}, {"algorithm": "CfrPlus", "bets": "25 50 100", "menu_states": [{"exploit_bits": 4578098029924519584, "hash": "f4efe3ba80456c06", "locked": false}, {"exploit_bits": 4570670884258282048, "hash": "e6b3b44c5bc12b96", "locked": true}], "root_actions": 4}, {"algorithm": "Dcfr", "bets": "20 40 60 100", "menu_states": [{"exploit_bits": 4578393802013603200, "hash": "3e71e04bcdc2e331", "locked": false}, {"exploit_bits": 4568168038134907328, "hash": "39f6f84bb1cf1880", "locked": true}], "root_actions": 5}, {"algorithm": "CfrPlus", "bets": "20 40 60 100", "menu_states": [{"exploit_bits": 4577566401053905312, "hash": "a91a7f665d7b4f5c", "locked": false}, {"exploit_bits": 4569007400465854784, "hash": "6ae19fa9468f87df", "locked": true}], "root_actions": 5}, {"algorithm": "Dcfr", "bets": "10 20 30 40 50 60 70 80 90 100", "menu_states": [{"exploit_bits": 4585573299270657502, "hash": "1231d62f4e5b8eb2", "locked": false}, {"exploit_bits": 4573412747826466240, "hash": "cb4ff418bc95b1ee", "locked": true}], "root_actions": 11}, {"algorithm": "CfrPlus", "bets": "10 20 30 40 50 60 70 80 90 100", "menu_states": [{"exploit_bits": 4585724609751663300, "hash": "eb415ad20798bb2f", "locked": false}, {"exploit_bits": 4573816642404738784, "hash": "df982bf6925ef500", "locked": true}], "root_actions": 11}, {"postflop": "POSTFLOP board=Ks7h2d rake=0 nodes=1346813 init_ms=1063.286 iteration_ms=58.213 check_ms=35.708 exploit_chips=1.698464289"}, {"postflop": "POSTFLOP board=Ks7s2d rake=0.05 nodes=1346813 init_ms=733.486 iteration_ms=34.090 check_ms=28.705 exploit_chips=1.329163551"}, {"postflop": "POSTFLOP board=Ks7h2dQhTc rake=0.05 nodes=33 init_ms=63.589 iteration_ms=0.321 check_ms=0.596 exploit_chips=0.140634178"}], "score_patterns": []}
{"event": "run", "id": "E023R", "path": "postflop_cuda", "hypothesis": "Repeat both action specializations against fresh original control; exact common/generic-menu and CFR+ checks; pre-compaction capacity reference", "status": "candidate", "utc": "2026-09-07T04:20:03+00:00", "commit": "1d86527a33d981047da841a5b83aff4a0939430e", "seconds": 48.593, "diagnostic_peak_process_mb": 4370.19, "returncode": 0, "command": ["cargo", "test", "--release", "-p", "solver", "--features", "gpu", "--test", "postflop_action_menus", "--test", "postflop_perf", "--test", "postflop_capacity_perf", "--", "--ignored", "--nocapture", "--test-threads=1"], "env": [], "metrics": {"postflop.Ks7h2d.iso.allocated_vram_mb": 6241.124352, "postflop.Ks7h2d.iso.estimated_vram_mb": 6716.6347, "postflop.Ks7h2d.iso.init_ms": 854.3783999999999, "postflop.Ks7h2d.iso.plan_build_ms": 105.9177, "postflop.Ks7h2d.iso.staging_memory_mb": 3380.293588, "postflop.Ks7s2d.iso.allocated_vram_mb": 4932.501504, "postflop.Ks7s2d.iso.estimated_vram_mb": 6737.546704, "postflop.Ks7s2d.iso.init_ms": 674.3261, "postflop.Ks7s2d.iso.plan_build_ms": 106.6646, "postflop.Ks7s2d.iso.staging_memory_mb": 2063.622928, "postflop.Ks7s2d.full.allocated_vram_mb": 6274.678784, "postflop.Ks7s2d.full.estimated_vram_mb": 6737.546704, "postflop.Ks7s2d.full.init_ms": 605.7013, "postflop.Ks7s2d.full.plan_build_ms": 100.3169, "postflop.Ks7s2d.full.staging_memory_mb": 3391.473816, "postflop.Ks7h2d.init_ms": 1058.969, "postflop.Ks7h2d.iteration_ms": 51.82, "postflop.Ks7h2d.check_ms": 34.853, "postflop.Ks7s2d.init_ms": 643.856, "postflop.Ks7s2d.iteration_ms": 31.797, "postflop.Ks7s2d.check_ms": 29.15, "postflop.Ks7h2dQhTc.init_ms": 125.861, "postflop.Ks7h2dQhTc.iteration_ms": 0.259, "postflop.Ks7h2dQhTc.check_ms": 1.246}, "checks": [{"algorithm": "Dcfr", "bets": "", "menu_states": [{"exploit_bits": 0, "hash": "4f030aa0fe9deb5f", "locked": false}, {"exploit_bits": 0, "hash": "8e5d7a73c6fc124e", "locked": true}], "root_actions": 1}, {"algorithm": "CfrPlus", "bets": "", "menu_states": [{"exploit_bits": 0, "hash": "4f030aa0fe9deb5f", "locked": false}, {"exploit_bits": 0, "hash": "8e5d7a73c6fc124e", "locked": true}], "root_actions": 1}, {"algorithm": "Dcfr", "bets": "50", "menu_states": [{"exploit_bits": 4573123367441913472, "hash": "28e830748f7862f9", "locked": false}, {"exploit_bits": 4565846421063463936, "hash": "32e870d727e15e5f", "locked": true}], "root_actions": 2}, {"algorithm": "CfrPlus", "bets": "50", "menu_states": [{"exploit_bits": 4575373351273120128, "hash": "416e7f8a4ac7c606", "locked": false}, {"exploit_bits": 4567243943030646784, "hash": "8069c4264711efae", "locked": true}], "root_actions": 2}, {"algorithm": "Dcfr", "bets": "33 75", "menu_states": [{"exploit_bits": 4575084589291749568, "hash": "ae061a57520656fe", "locked": false}, {"exploit_bits": 4567293853705376896, "hash": "97518332785a83cd", "locked": true}], "root_actions": 3}, {"algorithm": "CfrPlus", "bets": "33 75", "menu_states": [{"exploit_bits": 4577085624307641248, "hash": "195630b94c45e510", "locked": false}, {"exploit_bits": 4569213372567492352, "hash": "0d0282705a8c51f8", "locked": true}], "root_actions": 3}, {"algorithm": "Dcfr", "bets": "25 50 100", "menu_states": [{"exploit_bits": 4576662650375970560, "hash": "91e4a6d2278b5be4", "locked": false}, {"exploit_bits": 4568167495878385472, "hash": "a574b116361c3282", "locked": true}], "root_actions": 4}, {"algorithm": "CfrPlus", "bets": "25 50 100", "menu_states": [{"exploit_bits": 4578098029924519584, "hash": "f4efe3ba80456c06", "locked": false}, {"exploit_bits": 4570670884258282048, "hash": "e6b3b44c5bc12b96", "locked": true}], "root_actions": 4}, {"algorithm": "Dcfr", "bets": "20 40 60 100", "menu_states": [{"exploit_bits": 4578393802013603200, "hash": "3e71e04bcdc2e331", "locked": false}, {"exploit_bits": 4568168038134907328, "hash": "39f6f84bb1cf1880", "locked": true}], "root_actions": 5}, {"algorithm": "CfrPlus", "bets": "20 40 60 100", "menu_states": [{"exploit_bits": 4577566401053905312, "hash": "a91a7f665d7b4f5c", "locked": false}, {"exploit_bits": 4569007400465854784, "hash": "6ae19fa9468f87df", "locked": true}], "root_actions": 5}, {"algorithm": "Dcfr", "bets": "10 20 30 40 50 60 70 80 90 100", "menu_states": [{"exploit_bits": 4585573299270657502, "hash": "1231d62f4e5b8eb2", "locked": false}, {"exploit_bits": 4573412747826466240, "hash": "cb4ff418bc95b1ee", "locked": true}], "root_actions": 11}, {"algorithm": "CfrPlus", "bets": "10 20 30 40 50 60 70 80 90 100", "menu_states": [{"exploit_bits": 4585724609751663300, "hash": "eb415ad20798bb2f", "locked": false}, {"exploit_bits": 4573816642404738784, "hash": "df982bf6925ef500", "locked": true}], "root_actions": 11}, {"board": "Ks7h2d", "nodes": 1346813, "use_isomorphism": true}, {"board": "Ks7s2d", "nodes": 1346813, "use_isomorphism": true}, {"board": "Ks7s2d", "nodes": 1346813, "use_isomorphism": false}, {"postflop": "POSTFLOP board=Ks7h2d rake=0 nodes=1346813 init_ms=1058.969 iteration_ms=51.820 check_ms=34.853 exploit_chips=1.698464289"}, {"postflop": "POSTFLOP board=Ks7s2d rake=0.05 nodes=1346813 init_ms=643.856 iteration_ms=31.797 check_ms=29.150 exploit_chips=1.329163551"}, {"postflop": "POSTFLOP board=Ks7h2dQhTc rake=0.05 nodes=33 init_ms=125.861 iteration_ms=0.259 check_ms=1.246 exploit_chips=0.140634178"}], "score_patterns": ["postflop.*.iteration_ms", "postflop.*.check_ms"]}
{"event": "decision", "id": "E023", "status": "keep", "reason": "Additional 3-5% large-flop iteration reduction repeated; both action specializations total roughly 9-11% vs fresh B025; all original 24 state controls and all 24 new action-menu/CFR+/lock states exact. River check timing noisy; retest in combined validation", "utc": "2026-09-07T04:21:19+00:00"}
{"event": "decision", "id": "E023R", "status": "keep", "reason": "Additional 3-5% large-flop iteration reduction repeated; both action specializations total roughly 9-11% vs fresh B025; all original 24 state controls and all 24 new action-menu/CFR+/lock states exact. River check timing noisy; retest in combined validation", "utc": "2026-09-07T04:21:19+00:00"}
{"event": "promote", "files": ["crates/solver/src/gpu/kernels.cu"], "commit": "1d86527a33d981047da841a5b83aff4a0939430e", "utc": "2026-09-07T04:21:29+00:00"}
{"event": "source_guard_added", "utc": "2026-09-07T04:21:29.998991+00:00", "file": "crates/solver/src/gpu/arena.rs", "expected": null, "reason": "New compact arena module; promotion must verify destination remains absent"}
{"event": "run", "id": "E024", "path": "memory_transfers", "hypothesis": "Pack only visited postflop regret/strategy blocks on GPU; preserve inactive initial bits using sparse zero-aware host snapshots and reduce pinned readback staging", "status": "crash", "utc": "2026-09-07T04:21:34+00:00", "commit": "20359dd6aff1aafc96551147cd86c529ad278306", "seconds": 2.359, "diagnostic_peak_process_mb": 493.24, "returncode": 101, "command": ["cargo", "test", "--release", "-p", "solver", "--features", "gpu", "--lib", "--test", "postflop_resume_state", "--test", "postflop_capacity_perf", "--test", "postflop_perf", "--", "--include-ignored", "--nocapture", "--test-threads=1"], "env": [], "metrics": {}, "checks": [], "score_patterns": ["*allocated_vram_mb"]}
