{"event": "promote", "files": ["crates/solver/src/gpu/arena.rs", "crates/solver/src/gpu/mod.rs"], "commit": "09ad3d15a67f827718765c6dc6adc7537ba6603e", "utc": "2026-09-07T05:18:09+00:00"}
{"event": "refresh_compiler_inputs", "utc": "2026-09-07T05:18:12+00:00", "files": ["crates/solver/tests/gpu_check_perf.rs"], "reason": "Content changes must invalidate Cargo even after copies preserving old mtimes"}
{"event": "run", "id": "B030", "path": "baseline", "hypothesis": "Fresh retained preflop action control and frozen first/steady GPU check baselines before new kernel and graph trials", "status": "baseline", "utc": "2026-09-07T05:18:55+00:00", "commit": "1fcd018269a8cad6c00d8cfa8ecfb4a5f9f3fcfc", "seconds": 42.907, "diagnostic_peak_process_mb": 4169.056, "returncode": 0, "command": ["cargo", "test", "--release", "-p", "solver", "--features", "gpu", "--test", "preflop_perf", "--test", "gpu_check_perf", "--", "--ignored", "--nocapture", "--test-threads=1"], "env": [], "metrics": {"postflop.Ks7h2d.first_check_ms": 34.8658, "postflop.Ks7h2d.second_check_ms": 34.5521, "postflop.Ks7h2d.steady_check_ms": 35.1191, "postflop.Ks7s2d.first_check_ms": 29.941, "postflop.Ks7s2d.second_check_ms": 28.628, "postflop.Ks7s2d.steady_check_ms": 28.929675, "postflop.Ks7h2dQhTc.first_check_ms": 0.9745, "postflop.Ks7h2dQhTc.second_check_ms": 0.8046000000000001, "postflop.Ks7h2dQhTc.steady_check_ms": 0.762175, "preflop.2.first_check_ms": 0.46040000000000003, "preflop.2.second_check_ms": 0.4172, "preflop.2.steady_check_ms": 0.42957500000000004, "preflop.6.first_check_ms": 12.7483, "preflop.6.second_check_ms": 13.5429, "preflop.6.steady_check_ms": 13.58625, "preflop.8.first_check_ms": 39.4661, "preflop.8.second_check_ms": 39.912499999999994, "preflop.8.steady_check_ms": 41.526050000000005, "preflop.2.iteration_ms": 0.086, "preflop.2.check_ms": 0.294, "preflop.2.sync_ms": 0.019, "preflop.6.iteration_ms": 17.586, "preflop.6.check_ms": 13.678, "preflop.6.sync_ms": 28.291, "preflop.8.iteration_ms": 60.301, "preflop.8.check_ms": 40.07, "preflop.8.sync_ms": 80.169}, "checks": [{"check_board": "Ks7h2d", "check_eval_bits": 4610328022310931180, "check_iteration": 65}, {"check_board": "Ks7s2d", "check_eval_bits": 4608664839644425536, "check_iteration": 65}, {"check_board": "Ks7h2dQhTc", "check_eval_bits": 4594234900545878240, "check_iteration": 65}, {"check_ev_bits": [13818231149285967788, 13824505857993336927], "check_gap_bits": [4587494750677495240, 4578740950612821696], "check_iteration": 65, "check_seats": 2}, {"check_ev_bits": [4591139080588829428, 4592693985497883551, 4593946344391214828, 4594927179058488125, 13822800502159894828, 13825431794291804883], "check_gap_bits": [4592169847827907240, 4585164356934551850, 4588296313823012216, 4586437900670586676, 4583054015422772960, 4583031084747833216], "check_iteration": 65, "check_seats": 6}, {"check_ev_bits": [4587160621192900714, 4588059182301650598, 4589561616460845131, 4590424431923123478, 4591846028241297974, 4594029634723087085, 13824156832147184690, 13826821985834700352], "check_gap_bits": [4582186906385158536, 4577078707904519064, 4576017671529333144, 4577694025738397696, 4577605411036232848, 4578121278065602480, 4579111217966708928, 4577595012631213824], "check_iteration": 65, "check_seats": 8}, {"preflop": "PERF seats=2 nodes=40 iteration_ms=0.086 check_ms=0.294 sync_ms=0.019 arena_hash=6d4781fae03e3474 gaps=[0.05088935968248226, 0.013161917444424076] evs=[-0.15795953824550446, -0.4142353804778675]"}, {"preflop": "PERF seats=6 nodes=166090 iteration_ms=17.586 check_ms=13.678 sync_ms=28.291 arena_hash=b70284af63586e3f gaps=[0.10415872559930028, 0.03471900474586882, 0.05645132130650671, 0.04355598961220011, 0.02566278444731196, 0.025583227687036025] evs=[0.08985395657613165, 0.11143259696531381, 0.13262513589238922, 0.15984876666632344, -0.3195691149045554, -0.4656351703726333]"}, {"preflop": "PERF seats=8 nodes=434350 iteration_ms=60.301 check_ms=40.070 sync_ms=80.169 arena_hash=e01dd7a18632644d gaps=[0.022654395639749164, 0.010278385995560232, 0.008437781286659882, 0.011345792287176693, 0.011192070283014638, 0.012086956929344556, 0.01380422891560007, 0.011174031925715422] evs=[0.04857087063871364, 0.05480589083850633, 0.06796224413352651, 0.07993621403632675, 0.0996648260883227, 0.13493690699672048, -0.39486055394849295, -0.5856126067014387]"}], "score_patterns": []}
{"event": "refresh_compiler_inputs", "utc": "2026-09-07T05:19:16+00:00", "files": ["crates/solver/src/preflop/kernels.cu"], "reason": "Content changes must invalidate Cargo even after copies preserving old mtimes"}
