experiment	path	commit	status	metric	value	hypothesis	utc
E026R	memory_transfers	bc699c7195b02a8a9e30d8d54ec6ef2fb3e27ac1	keep	postflop.memory.cold.compressed.init_ms	587.252	Repeat CFV lifetime reuse on default compressed lifecycle, validate GPU suite and unchanged fixed postflop accuracy targets	2026-09-07T05:01:53+00:00
E026R	memory_transfers	bc699c7195b02a8a9e30d8d54ec6ef2fb3e27ac1	keep	postflop.memory.cold.compressed.strategy_sync_ms	118.6593	Repeat CFV lifetime reuse on default compressed lifecycle, validate GPU suite and unchanged fixed postflop accuracy targets	2026-09-07T05:01:53+00:00
E026R	memory_transfers	bc699c7195b02a8a9e30d8d54ec6ef2fb3e27ac1	keep	postflop.memory.cold.compressed.sync_ms	244.0917	Repeat CFV lifetime reuse on default compressed lifecycle, validate GPU suite and unchanged fixed postflop accuracy targets	2026-09-07T05:01:53+00:00
E026R	memory_transfers	bc699c7195b02a8a9e30d8d54ec6ef2fb3e27ac1	keep	postflop.memory.warm.compressed.allocated_vram_mb	3623.878656	Repeat CFV lifetime reuse on default compressed lifecycle, validate GPU suite and unchanged fixed postflop accuracy targets	2026-09-07T05:01:53+00:00
E026R	memory_transfers	bc699c7195b02a8a9e30d8d54ec6ef2fb3e27ac1	keep	postflop.memory.warm.compressed.host_live_mb	3769.270272	Repeat CFV lifetime reuse on default compressed lifecycle, validate GPU suite and unchanged fixed postflop accuracy targets	2026-09-07T05:01:53+00:00
E026R	memory_transfers	bc699c7195b02a8a9e30d8d54ec6ef2fb3e27ac1	keep	postflop.memory.warm.compressed.host_private_mb	8126.603264	Repeat CFV lifetime reuse on default compressed lifecycle, validate GPU suite and unchanged fixed postflop accuracy targets	2026-09-07T05:01:53+00:00
E026R	memory_transfers	bc699c7195b02a8a9e30d8d54ec6ef2fb3e27ac1	keep	postflop.memory.warm.compressed.init_ms	964.0419999999999	Repeat CFV lifetime reuse on default compressed lifecycle, validate GPU suite and unchanged fixed postflop accuracy targets	2026-09-07T05:01:53+00:00
E026R	memory_transfers	bc699c7195b02a8a9e30d8d54ec6ef2fb3e27ac1	keep	postflop.memory.warm.compressed.strategy_sync_ms	141.5005	Repeat CFV lifetime reuse on default compressed lifecycle, validate GPU suite and unchanged fixed postflop accuracy targets	2026-09-07T05:01:53+00:00
E026R	memory_transfers	bc699c7195b02a8a9e30d8d54ec6ef2fb3e27ac1	keep	postflop.memory.warm.compressed.sync_ms	283.9759	Repeat CFV lifetime reuse on default compressed lifecycle, validate GPU suite and unchanged fixed postflop accuracy targets	2026-09-07T05:01:53+00:00
E026R	memory_transfers	bc699c7195b02a8a9e30d8d54ec6ef2fb3e27ac1	keep	postflop.Ks7h2d.target_seconds	10.664	Repeat CFV lifetime reuse on default compressed lifecycle, validate GPU suite and unchanged fixed postflop accuracy targets	2026-09-07T05:01:53+00:00
E026R	memory_transfers	bc699c7195b02a8a9e30d8d54ec6ef2fb3e27ac1	keep	postflop.Ks7s2d.target_seconds	6.525	Repeat CFV lifetime reuse on default compressed lifecycle, validate GPU suite and unchanged fixed postflop accuracy targets	2026-09-07T05:01:53+00:00
E026R	memory_transfers	bc699c7195b02a8a9e30d8d54ec6ef2fb3e27ac1	keep	postflop.Ks7h2dQhTc.target_seconds	0.019	Repeat CFV lifetime reuse on default compressed lifecycle, validate GPU suite and unchanged fixed postflop accuracy targets	2026-09-07T05:01:53+00:00
B028	memory_transfers	bc699c7195b02a8a9e30d8d54ec6ef2fb3e27ac1	baseline	reports.adaptation_seconds	4.914	Fresh default-compressed rainbow report adaptation and continuation reference before optimizing full-arena staging and encoding	2026-09-07T05:05:36+00:00
B029	memory_transfers	e342fbb7333ecc93c8ee59ee6b6efe0ca67ce2b7	baseline	postflop.memory.rainbow.cold.compressed.allocated_vram_mb	5905.580032	Cold/warm rainbow compressed full-arena host memory, initialization and transfer reference before direct pinned staging and parallel encode	2026-09-07T05:07:12+00:00
B029	memory_transfers	e342fbb7333ecc93c8ee59ee6b6efe0ca67ce2b7	baseline	postflop.memory.rainbow.cold.compressed.host_live_mb	3309.121536	Cold/warm rainbow compressed full-arena host memory, initialization and transfer reference before direct pinned staging and parallel encode	2026-09-07T05:07:12+00:00
B029	memory_transfers	e342fbb7333ecc93c8ee59ee6b6efe0ca67ce2b7	baseline	postflop.memory.rainbow.cold.compressed.host_private_mb	9568.632832	Cold/warm rainbow compressed full-arena host memory, initialization and transfer reference before direct pinned staging and parallel encode	2026-09-07T05:07:12+00:00
B029	memory_transfers	e342fbb7333ecc93c8ee59ee6b6efe0ca67ce2b7	baseline	postflop.memory.rainbow.cold.compressed.init_ms	1314.2924	Cold/warm rainbow compressed full-arena host memory, initialization and transfer reference before direct pinned staging and parallel encode	2026-09-07T05:07:12+00:00
B029	memory_transfers	e342fbb7333ecc93c8ee59ee6b6efe0ca67ce2b7	baseline	postflop.memory.rainbow.cold.compressed.strategy_sync_ms	631.1427	Cold/warm rainbow compressed full-arena host memory, initialization and transfer reference before direct pinned staging and parallel encode	2026-09-07T05:07:12+00:00
B029	memory_transfers	e342fbb7333ecc93c8ee59ee6b6efe0ca67ce2b7	baseline	postflop.memory.rainbow.cold.compressed.sync_ms	1203.8546000000001	Cold/warm rainbow compressed full-arena host memory, initialization and transfer reference before direct pinned staging and parallel encode	2026-09-07T05:07:12+00:00
B029	memory_transfers	e342fbb7333ecc93c8ee59ee6b6efe0ca67ce2b7	baseline	postflop.memory.rainbow.warm.compressed.allocated_vram_mb	5905.580032	Cold/warm rainbow compressed full-arena host memory, initialization and transfer reference before direct pinned staging and parallel encode	2026-09-07T05:07:12+00:00
B029	memory_transfers	e342fbb7333ecc93c8ee59ee6b6efe0ca67ce2b7	baseline	postflop.memory.rainbow.warm.compressed.host_live_mb	3317.088256	Cold/warm rainbow compressed full-arena host memory, initialization and transfer reference before direct pinned staging and parallel encode	2026-09-07T05:07:12+00:00
B029	memory_transfers	e342fbb7333ecc93c8ee59ee6b6efe0ca67ce2b7	baseline	postflop.memory.rainbow.warm.compressed.host_private_mb	9574.076416	Cold/warm rainbow compressed full-arena host memory, initialization and transfer reference before direct pinned staging and parallel encode	2026-09-07T05:07:12+00:00
B029	memory_transfers	e342fbb7333ecc93c8ee59ee6b6efe0ca67ce2b7	baseline	postflop.memory.rainbow.warm.compressed.init_ms	1344.4519	Cold/warm rainbow compressed full-arena host memory, initialization and transfer reference before direct pinned staging and parallel encode	2026-09-07T05:07:12+00:00
B029	memory_transfers	e342fbb7333ecc93c8ee59ee6b6efe0ca67ce2b7	baseline	postflop.memory.rainbow.warm.compressed.strategy_sync_ms	659.9166	Cold/warm rainbow compressed full-arena host memory, initialization and transfer reference before direct pinned staging and parallel encode	2026-09-07T05:07:12+00:00
B029	memory_transfers	e342fbb7333ecc93c8ee59ee6b6efe0ca67ce2b7	baseline	postflop.memory.rainbow.warm.compressed.sync_ms	1270.0653	Cold/warm rainbow compressed full-arena host memory, initialization and transfer reference before direct pinned staging and parallel encode	2026-09-07T05:07:12+00:00
E027	memory_transfers	09ad3d15a67f827718765c6dc6adc7537ba6603e	keep	postflop.memory.rainbow.cold.compressed.allocated_vram_mb	5905.580032	Full compressed arenas decode directly into existing pinned staging and encode independent nodes in parallel, removing temporary arena images without numerical changes	2026-09-07T05:09:15+00:00
E027	memory_transfers	09ad3d15a67f827718765c6dc6adc7537ba6603e	keep	postflop.memory.rainbow.cold.compressed.host_live_mb	2584.039424	Full compressed arenas decode directly into existing pinned staging and encode independent nodes in parallel, removing temporary arena images without numerical changes	2026-09-07T05:09:15+00:00
E027	memory_transfers	09ad3d15a67f827718765c6dc6adc7537ba6603e	keep	postflop.memory.rainbow.cold.compressed.host_private_mb	9086.087168	Full compressed arenas decode directly into existing pinned staging and encode independent nodes in parallel, removing temporary arena images without numerical changes	2026-09-07T05:09:15+00:00
E027	memory_transfers	09ad3d15a67f827718765c6dc6adc7537ba6603e	keep	postflop.memory.rainbow.cold.compressed.init_ms	805.9534	Full compressed arenas decode directly into existing pinned staging and encode independent nodes in parallel, removing temporary arena images without numerical changes	2026-09-07T05:09:15+00:00
E027	memory_transfers	09ad3d15a67f827718765c6dc6adc7537ba6603e	keep	postflop.memory.rainbow.cold.compressed.strategy_sync_ms	166.33229999999998	Full compressed arenas decode directly into existing pinned staging and encode independent nodes in parallel, removing temporary arena images without numerical changes	2026-09-07T05:09:15+00:00
E027	memory_transfers	09ad3d15a67f827718765c6dc6adc7537ba6603e	keep	postflop.memory.rainbow.cold.compressed.sync_ms	331.2705	Full compressed arenas decode directly into existing pinned staging and encode independent nodes in parallel, removing temporary arena images without numerical changes	2026-09-07T05:09:15+00:00
E027	memory_transfers	09ad3d15a67f827718765c6dc6adc7537ba6603e	keep	postflop.memory.rainbow.warm.compressed.allocated_vram_mb	5905.580032	Full compressed arenas decode directly into existing pinned staging and encode independent nodes in parallel, removing temporary arena images without numerical changes	2026-09-07T05:09:15+00:00
E027	memory_transfers	09ad3d15a67f827718765c6dc6adc7537ba6603e	keep	postflop.memory.rainbow.warm.compressed.host_live_mb	2594.476032	Full compressed arenas decode directly into existing pinned staging and encode independent nodes in parallel, removing temporary arena images without numerical changes	2026-09-07T05:09:15+00:00
E027	memory_transfers	09ad3d15a67f827718765c6dc6adc7537ba6603e	keep	postflop.memory.rainbow.warm.compressed.host_private_mb	9087.574016	Full compressed arenas decode directly into existing pinned staging and encode independent nodes in parallel, removing temporary arena images without numerical changes	2026-09-07T05:09:15+00:00
E027	memory_transfers	09ad3d15a67f827718765c6dc6adc7537ba6603e	keep	postflop.memory.rainbow.warm.compressed.init_ms	800.5723	Full compressed arenas decode directly into existing pinned staging and encode independent nodes in parallel, removing temporary arena images without numerical changes	2026-09-07T05:09:15+00:00
E027	memory_transfers	09ad3d15a67f827718765c6dc6adc7537ba6603e	keep	postflop.memory.rainbow.warm.compressed.strategy_sync_ms	163.0888	Full compressed arenas decode directly into existing pinned staging and encode independent nodes in parallel, removing temporary arena images without numerical changes	2026-09-07T05:09:15+00:00
E027	memory_transfers	09ad3d15a67f827718765c6dc6adc7537ba6603e	keep	postflop.memory.rainbow.warm.compressed.sync_ms	329.3583	Full compressed arenas decode directly into existing pinned staging and encode independent nodes in parallel, removing temporary arena images without numerical changes	2026-09-07T05:09:15+00:00
E027S	memory_transfers	09ad3d15a67f827718765c6dc6adc7537ba6603e	keep	reports.adaptation_seconds	3.734	Verify full compressed transfers in the server reporting and continuation path	2026-09-07T05:16:00+00:00
E027R	memory_transfers	09ad3d15a67f827718765c6dc6adc7537ba6603e	keep	postflop.memory.rainbow.cold.compressed.allocated_vram_mb	5905.580032	Repeat full compressed staging transfer measurements before retention	2026-09-07T05:17:12+00:00
E027R	memory_transfers	09ad3d15a67f827718765c6dc6adc7537ba6603e	keep	postflop.memory.rainbow.cold.compressed.host_live_mb	2585.25184	Repeat full compressed staging transfer measurements before retention	2026-09-07T05:17:12+00:00
E027R	memory_transfers	09ad3d15a67f827718765c6dc6adc7537ba6603e	keep	postflop.memory.rainbow.cold.compressed.host_private_mb	9082.421248	Repeat full compressed staging transfer measurements before retention	2026-09-07T05:17:12+00:00
E027R	memory_transfers	09ad3d15a67f827718765c6dc6adc7537ba6603e	keep	postflop.memory.rainbow.cold.compressed.init_ms	841.236	Repeat full compressed staging transfer measurements before retention	2026-09-07T05:17:12+00:00
E027R	memory_transfers	09ad3d15a67f827718765c6dc6adc7537ba6603e	keep	postflop.memory.rainbow.cold.compressed.strategy_sync_ms	169.2416	Repeat full compressed staging transfer measurements before retention	2026-09-07T05:17:12+00:00
E027R	memory_transfers	09ad3d15a67f827718765c6dc6adc7537ba6603e	keep	postflop.memory.rainbow.cold.compressed.sync_ms	337.4548	Repeat full compressed staging transfer measurements before retention	2026-09-07T05:17:12+00:00
E027R	memory_transfers	09ad3d15a67f827718765c6dc6adc7537ba6603e	keep	postflop.memory.rainbow.warm.compressed.allocated_vram_mb	5905.580032	Repeat full compressed staging transfer measurements before retention	2026-09-07T05:17:12+00:00
E027R	memory_transfers	09ad3d15a67f827718765c6dc6adc7537ba6603e	keep	postflop.memory.rainbow.warm.compressed.host_live_mb	2595.131392	Repeat full compressed staging transfer measurements before retention	2026-09-07T05:17:12+00:00
E027R	memory_transfers	09ad3d15a67f827718765c6dc6adc7537ba6603e	keep	postflop.memory.rainbow.warm.compressed.host_private_mb	9099.272192	Repeat full compressed staging transfer measurements before retention	2026-09-07T05:17:12+00:00
E027R	memory_transfers	09ad3d15a67f827718765c6dc6adc7537ba6603e	keep	postflop.memory.rainbow.warm.compressed.init_ms	820.0937	Repeat full compressed staging transfer measurements before retention	2026-09-07T05:17:12+00:00
E027R	memory_transfers	09ad3d15a67f827718765c6dc6adc7537ba6603e	keep	postflop.memory.rainbow.warm.compressed.strategy_sync_ms	171.9774	Repeat full compressed staging transfer measurements before retention	2026-09-07T05:17:12+00:00
E027R	memory_transfers	09ad3d15a67f827718765c6dc6adc7537ba6603e	keep	postflop.memory.rainbow.warm.compressed.sync_ms	343.93780000000004	Repeat full compressed staging transfer measurements before retention	2026-09-07T05:17:12+00:00
B030	baseline	1fcd018269a8cad6c00d8cfa8ecfb4a5f9f3fcfc	baseline	postflop.Ks7h2d.first_check_ms	34.8658	Fresh retained preflop action control and frozen first/steady GPU check baselines before new kernel and graph trials	2026-09-07T05:18:55+00:00
B030	baseline	1fcd018269a8cad6c00d8cfa8ecfb4a5f9f3fcfc	baseline	postflop.Ks7h2d.second_check_ms	34.5521	Fresh retained preflop action control and frozen first/steady GPU check baselines before new kernel and graph trials	2026-09-07T05:18:55+00:00
B030	baseline	1fcd018269a8cad6c00d8cfa8ecfb4a5f9f3fcfc	baseline	postflop.Ks7h2d.steady_check_ms	35.1191	Fresh retained preflop action control and frozen first/steady GPU check baselines before new kernel and graph trials	2026-09-07T05:18:55+00:00
B030	baseline	1fcd018269a8cad6c00d8cfa8ecfb4a5f9f3fcfc	baseline	postflop.Ks7s2d.first_check_ms	29.941	Fresh retained preflop action control and frozen first/steady GPU check baselines before new kernel and graph trials	2026-09-07T05:18:55+00:00
B030	baseline	1fcd018269a8cad6c00d8cfa8ecfb4a5f9f3fcfc	baseline	postflop.Ks7s2d.second_check_ms	28.628	Fresh retained preflop action control and frozen first/steady GPU check baselines before new kernel and graph trials	2026-09-07T05:18:55+00:00
B030	baseline	1fcd018269a8cad6c00d8cfa8ecfb4a5f9f3fcfc	baseline	postflop.Ks7s2d.steady_check_ms	28.929675	Fresh retained preflop action control and frozen first/steady GPU check baselines before new kernel and graph trials	2026-09-07T05:18:55+00:00
B030	baseline	1fcd018269a8cad6c00d8cfa8ecfb4a5f9f3fcfc	baseline	postflop.Ks7h2dQhTc.first_check_ms	0.9745	Fresh retained preflop action control and frozen first/steady GPU check baselines before new kernel and graph trials	2026-09-07T05:18:55+00:00
B030	baseline	1fcd018269a8cad6c00d8cfa8ecfb4a5f9f3fcfc	baseline	postflop.Ks7h2dQhTc.second_check_ms	0.8046000000000001	Fresh retained preflop action control and frozen first/steady GPU check baselines before new kernel and graph trials	2026-09-07T05:18:55+00:00
B030	baseline	1fcd018269a8cad6c00d8cfa8ecfb4a5f9f3fcfc	baseline	postflop.Ks7h2dQhTc.steady_check_ms	0.762175	Fresh retained preflop action control and frozen first/steady GPU check baselines before new kernel and graph trials	2026-09-07T05:18:55+00:00
B030	baseline	1fcd018269a8cad6c00d8cfa8ecfb4a5f9f3fcfc	baseline	preflop.2.first_check_ms	0.46040000000000003	Fresh retained preflop action control and frozen first/steady GPU check baselines before new kernel and graph trials	2026-09-07T05:18:55+00:00
B030	baseline	1fcd018269a8cad6c00d8cfa8ecfb4a5f9f3fcfc	baseline	preflop.2.second_check_ms	0.4172	Fresh retained preflop action control and frozen first/steady GPU check baselines before new kernel and graph trials	2026-09-07T05:18:55+00:00
B030	baseline	1fcd018269a8cad6c00d8cfa8ecfb4a5f9f3fcfc	baseline	preflop.2.steady_check_ms	0.42957500000000004	Fresh retained preflop action control and frozen first/steady GPU check baselines before new kernel and graph trials	2026-09-07T05:18:55+00:00
B030	baseline	1fcd018269a8cad6c00d8cfa8ecfb4a5f9f3fcfc	baseline	preflop.6.first_check_ms	12.7483	Fresh retained preflop action control and frozen first/steady GPU check baselines before new kernel and graph trials	2026-09-07T05:18:55+00:00
B030	baseline	1fcd018269a8cad6c00d8cfa8ecfb4a5f9f3fcfc	baseline	preflop.6.second_check_ms	13.5429	Fresh retained preflop action control and frozen first/steady GPU check baselines before new kernel and graph trials	2026-09-07T05:18:55+00:00
B030	baseline	1fcd018269a8cad6c00d8cfa8ecfb4a5f9f3fcfc	baseline	preflop.6.steady_check_ms	13.58625	Fresh retained preflop action control and frozen first/steady GPU check baselines before new kernel and graph trials	2026-09-07T05:18:55+00:00
B030	baseline	1fcd018269a8cad6c00d8cfa8ecfb4a5f9f3fcfc	baseline	preflop.8.first_check_ms	39.4661	Fresh retained preflop action control and frozen first/steady GPU check baselines before new kernel and graph trials	2026-09-07T05:18:55+00:00
B030	baseline	1fcd018269a8cad6c00d8cfa8ecfb4a5f9f3fcfc	baseline	preflop.8.second_check_ms	39.912499999999994	Fresh retained preflop action control and frozen first/steady GPU check baselines before new kernel and graph trials	2026-09-07T05:18:55+00:00
B030	baseline	1fcd018269a8cad6c00d8cfa8ecfb4a5f9f3fcfc	baseline	preflop.8.steady_check_ms	41.526050000000005	Fresh retained preflop action control and frozen first/steady GPU check baselines before new kernel and graph trials	2026-09-07T05:18:55+00:00
B030	baseline	1fcd018269a8cad6c00d8cfa8ecfb4a5f9f3fcfc	baseline	preflop.2.iteration_ms	0.086	Fresh retained preflop action control and frozen first/steady GPU check baselines before new kernel and graph trials	2026-09-07T05:18:55+00:00
B030	baseline	1fcd018269a8cad6c00d8cfa8ecfb4a5f9f3fcfc	baseline	preflop.2.check_ms	0.294	Fresh retained preflop action control and frozen first/steady GPU check baselines before new kernel and graph trials	2026-09-07T05:18:55+00:00
B030	baseline	1fcd018269a8cad6c00d8cfa8ecfb4a5f9f3fcfc	baseline	preflop.2.sync_ms	0.019	Fresh retained preflop action control and frozen first/steady GPU check baselines before new kernel and graph trials	2026-09-07T05:18:55+00:00
B030	baseline	1fcd018269a8cad6c00d8cfa8ecfb4a5f9f3fcfc	baseline	preflop.6.iteration_ms	17.586	Fresh retained preflop action control and frozen first/steady GPU check baselines before new kernel and graph trials	2026-09-07T05:18:55+00:00
B030	baseline	1fcd018269a8cad6c00d8cfa8ecfb4a5f9f3fcfc	baseline	preflop.6.check_ms	13.678	Fresh retained preflop action control and frozen first/steady GPU check baselines before new kernel and graph trials	2026-09-07T05:18:55+00:00
B030	baseline	1fcd018269a8cad6c00d8cfa8ecfb4a5f9f3fcfc	baseline	preflop.6.sync_ms	28.291	Fresh retained preflop action control and frozen first/steady GPU check baselines before new kernel and graph trials	2026-09-07T05:18:55+00:00
B030	baseline	1fcd018269a8cad6c00d8cfa8ecfb4a5f9f3fcfc	baseline	preflop.8.iteration_ms	60.301	Fresh retained preflop action control and frozen first/steady GPU check baselines before new kernel and graph trials	2026-09-07T05:18:55+00:00
B030	baseline	1fcd018269a8cad6c00d8cfa8ecfb4a5f9f3fcfc	baseline	preflop.8.check_ms	40.07	Fresh retained preflop action control and frozen first/steady GPU check baselines before new kernel and graph trials	2026-09-07T05:18:55+00:00
B030	baseline	1fcd018269a8cad6c00d8cfa8ecfb4a5f9f3fcfc	baseline	preflop.8.sync_ms	80.169	Fresh retained preflop action control and frozen first/steady GPU check baselines before new kernel and graph trials	2026-09-07T05:18:55+00:00
E028	preflop_cuda	a6a2e0a2afb85e5e3577a81fe8e8930543ed2229	keep	preflop.2.iteration_ms	0.081	Specialize 2/3/4-action preflop down and up sweeps with exact generic fallback to reduce local array traffic	2026-09-07T05:20:07+00:00
E028	preflop_cuda	a6a2e0a2afb85e5e3577a81fe8e8930543ed2229	keep	preflop.2.check_ms	0.296	Specialize 2/3/4-action preflop down and up sweeps with exact generic fallback to reduce local array traffic	2026-09-07T05:20:07+00:00
E028	preflop_cuda	a6a2e0a2afb85e5e3577a81fe8e8930543ed2229	keep	preflop.2.sync_ms	0.018	Specialize 2/3/4-action preflop down and up sweeps with exact generic fallback to reduce local array traffic	2026-09-07T05:20:07+00:00
E028	preflop_cuda	a6a2e0a2afb85e5e3577a81fe8e8930543ed2229	keep	preflop.6.iteration_ms	16.943	Specialize 2/3/4-action preflop down and up sweeps with exact generic fallback to reduce local array traffic	2026-09-07T05:20:07+00:00
E028	preflop_cuda	a6a2e0a2afb85e5e3577a81fe8e8930543ed2229	keep	preflop.6.check_ms	12.689	Specialize 2/3/4-action preflop down and up sweeps with exact generic fallback to reduce local array traffic	2026-09-07T05:20:07+00:00
