experiment	path	commit	status	metric	value	hypothesis	utc
E038	memory_transfers	523c8d45ddf1d444e33523484673bf815a33c243	discard	postflop.memory.cold.compressed.init_ms	639.4744999999999	Decode compressed upload directly into disjoint pinned chunks in parallel, preserving per-node scales and exact output; retain serial fallback for small buffers.	2026-09-07T06:29:47+00:00
E038	memory_transfers	523c8d45ddf1d444e33523484673bf815a33c243	discard	postflop.memory.cold.compressed.strategy_sync_ms	127.4424	Decode compressed upload directly into disjoint pinned chunks in parallel, preserving per-node scales and exact output; retain serial fallback for small buffers.	2026-09-07T06:29:47+00:00
E038	memory_transfers	523c8d45ddf1d444e33523484673bf815a33c243	discard	postflop.memory.cold.compressed.sync_ms	249.0234	Decode compressed upload directly into disjoint pinned chunks in parallel, preserving per-node scales and exact output; retain serial fallback for small buffers.	2026-09-07T06:29:47+00:00
E038	memory_transfers	523c8d45ddf1d444e33523484673bf815a33c243	discard	postflop.memory.warm.compressed.allocated_vram_mb	3623.878656	Decode compressed upload directly into disjoint pinned chunks in parallel, preserving per-node scales and exact output; retain serial fallback for small buffers.	2026-09-07T06:29:47+00:00
E038	memory_transfers	523c8d45ddf1d444e33523484673bf815a33c243	discard	postflop.memory.warm.compressed.host_live_mb	3777.08544	Decode compressed upload directly into disjoint pinned chunks in parallel, preserving per-node scales and exact output; retain serial fallback for small buffers.	2026-09-07T06:29:47+00:00
E038	memory_transfers	523c8d45ddf1d444e33523484673bf815a33c243	discard	postflop.memory.warm.compressed.host_private_mb	8140.038144	Decode compressed upload directly into disjoint pinned chunks in parallel, preserving per-node scales and exact output; retain serial fallback for small buffers.	2026-09-07T06:29:47+00:00
E038	memory_transfers	523c8d45ddf1d444e33523484673bf815a33c243	discard	postflop.memory.warm.compressed.init_ms	1024.8295	Decode compressed upload directly into disjoint pinned chunks in parallel, preserving per-node scales and exact output; retain serial fallback for small buffers.	2026-09-07T06:29:47+00:00
E038	memory_transfers	523c8d45ddf1d444e33523484673bf815a33c243	discard	postflop.memory.warm.compressed.strategy_sync_ms	148.1594	Decode compressed upload directly into disjoint pinned chunks in parallel, preserving per-node scales and exact output; retain serial fallback for small buffers.	2026-09-07T06:29:47+00:00
E038	memory_transfers	523c8d45ddf1d444e33523484673bf815a33c243	discard	postflop.memory.warm.compressed.sync_ms	298.5226	Decode compressed upload directly into disjoint pinned chunks in parallel, preserving per-node scales and exact output; retain serial fallback for small buffers.	2026-09-07T06:29:47+00:00
B034	baseline	c14e87c3ad7f1c98cf61ca38b2971b37ecb97fef	baseline	preflop.6.allocated_vram_mb	671.08864	Fresh pass-start CUDA implementation on the current machine, with unchanged frozen workloads; compare final combined gains.	2026-09-07T06:36:58+00:00
B034	baseline	c14e87c3ad7f1c98cf61ca38b2971b37ecb97fef	baseline	preflop.6.build_ms	79.7142	Fresh pass-start CUDA implementation on the current machine, with unchanged frozen workloads; compare final combined gains.	2026-09-07T06:36:58+00:00
B034	baseline	c14e87c3ad7f1c98cf61ca38b2971b37ecb97fef	baseline	preflop.6.cpu_arena_mb	224.552328	Fresh pass-start CUDA implementation on the current machine, with unchanged frozen workloads; compare final combined gains.	2026-09-07T06:36:58+00:00
B034	baseline	c14e87c3ad7f1c98cf61ca38b2971b37ecb97fef	baseline	preflop.6.estimated_vram_mb	706.776248	Fresh pass-start CUDA implementation on the current machine, with unchanged frozen workloads; compare final combined gains.	2026-09-07T06:36:58+00:00
B034	baseline	c14e87c3ad7f1c98cf61ca38b2971b37ecb97fef	baseline	preflop.6.init_ms	146.5464	Fresh pass-start CUDA implementation on the current machine, with unchanged frozen workloads; compare final combined gains.	2026-09-07T06:36:58+00:00
B034	baseline	c14e87c3ad7f1c98cf61ca38b2971b37ecb97fef	baseline	preflop.8.allocated_vram_mb	1711.276032	Fresh pass-start CUDA implementation on the current machine, with unchanged frozen workloads; compare final combined gains.	2026-09-07T06:36:58+00:00
B034	baseline	c14e87c3ad7f1c98cf61ca38b2971b37ecb97fef	baseline	preflop.8.build_ms	206.5267	Fresh pass-start CUDA implementation on the current machine, with unchanged frozen workloads; compare final combined gains.	2026-09-07T06:36:58+00:00
B034	baseline	c14e87c3ad7f1c98cf61ca38b2971b37ecb97fef	baseline	preflop.8.cpu_arena_mb	587.239848	Fresh pass-start CUDA implementation on the current machine, with unchanged frozen workloads; compare final combined gains.	2026-09-07T06:36:58+00:00
B034	baseline	c14e87c3ad7f1c98cf61ca38b2971b37ecb97fef	baseline	preflop.8.estimated_vram_mb	1750.508472	Fresh pass-start CUDA implementation on the current machine, with unchanged frozen workloads; compare final combined gains.	2026-09-07T06:36:58+00:00
B034	baseline	c14e87c3ad7f1c98cf61ca38b2971b37ecb97fef	baseline	preflop.8.init_ms	237.5974	Fresh pass-start CUDA implementation on the current machine, with unchanged frozen workloads; compare final combined gains.	2026-09-07T06:36:58+00:00
B034	baseline	c14e87c3ad7f1c98cf61ca38b2971b37ecb97fef	baseline	postflop.Ks7h2d.target_seconds	12.067	Fresh pass-start CUDA implementation on the current machine, with unchanged frozen workloads; compare final combined gains.	2026-09-07T06:36:58+00:00
B034	baseline	c14e87c3ad7f1c98cf61ca38b2971b37ecb97fef	baseline	postflop.Ks7s2d.target_seconds	7.219	Fresh pass-start CUDA implementation on the current machine, with unchanged frozen workloads; compare final combined gains.	2026-09-07T06:36:58+00:00
B034	baseline	c14e87c3ad7f1c98cf61ca38b2971b37ecb97fef	baseline	postflop.Ks7h2dQhTc.target_seconds	0.022	Fresh pass-start CUDA implementation on the current machine, with unchanged frozen workloads; compare final combined gains.	2026-09-07T06:36:58+00:00
B034	baseline	c14e87c3ad7f1c98cf61ca38b2971b37ecb97fef	baseline	preflop.3.iteration_ms	0.24	Fresh pass-start CUDA implementation on the current machine, with unchanged frozen workloads; compare final combined gains.	2026-09-07T06:36:58+00:00
B034	baseline	c14e87c3ad7f1c98cf61ca38b2971b37ecb97fef	baseline	preflop.3.check_ms	0.612	Fresh pass-start CUDA implementation on the current machine, with unchanged frozen workloads; compare final combined gains.	2026-09-07T06:36:58+00:00
B034	baseline	c14e87c3ad7f1c98cf61ca38b2971b37ecb97fef	baseline	preflop.3.sync_ms	0.067	Fresh pass-start CUDA implementation on the current machine, with unchanged frozen workloads; compare final combined gains.	2026-09-07T06:36:58+00:00
B034	baseline	c14e87c3ad7f1c98cf61ca38b2971b37ecb97fef	baseline	preflop.5.iteration_ms	3.149	Fresh pass-start CUDA implementation on the current machine, with unchanged frozen workloads; compare final combined gains.	2026-09-07T06:36:58+00:00
B034	baseline	c14e87c3ad7f1c98cf61ca38b2971b37ecb97fef	baseline	preflop.5.check_ms	2.959	Fresh pass-start CUDA implementation on the current machine, with unchanged frozen workloads; compare final combined gains.	2026-09-07T06:36:58+00:00
B034	baseline	c14e87c3ad7f1c98cf61ca38b2971b37ecb97fef	baseline	preflop.5.sync_ms	4.621	Fresh pass-start CUDA implementation on the current machine, with unchanged frozen workloads; compare final combined gains.	2026-09-07T06:36:58+00:00
B034	baseline	c14e87c3ad7f1c98cf61ca38b2971b37ecb97fef	baseline	preflop.7.iteration_ms	14.703	Fresh pass-start CUDA implementation on the current machine, with unchanged frozen workloads; compare final combined gains.	2026-09-07T06:36:58+00:00
B034	baseline	c14e87c3ad7f1c98cf61ca38b2971b37ecb97fef	baseline	preflop.7.check_ms	10.424	Fresh pass-start CUDA implementation on the current machine, with unchanged frozen workloads; compare final combined gains.	2026-09-07T06:36:58+00:00
B034	baseline	c14e87c3ad7f1c98cf61ca38b2971b37ecb97fef	baseline	preflop.7.sync_ms	16.793	Fresh pass-start CUDA implementation on the current machine, with unchanged frozen workloads; compare final combined gains.	2026-09-07T06:36:58+00:00
B034	baseline	c14e87c3ad7f1c98cf61ca38b2971b37ecb97fef	baseline	preflop.9.iteration_ms	315.572	Fresh pass-start CUDA implementation on the current machine, with unchanged frozen workloads; compare final combined gains.	2026-09-07T06:36:58+00:00
B034	baseline	c14e87c3ad7f1c98cf61ca38b2971b37ecb97fef	baseline	preflop.9.check_ms	197.742	Fresh pass-start CUDA implementation on the current machine, with unchanged frozen workloads; compare final combined gains.	2026-09-07T06:36:58+00:00
B034	baseline	c14e87c3ad7f1c98cf61ca38b2971b37ecb97fef	baseline	preflop.9.sync_ms	281.192	Fresh pass-start CUDA implementation on the current machine, with unchanged frozen workloads; compare final combined gains.	2026-09-07T06:36:58+00:00
B034	baseline	c14e87c3ad7f1c98cf61ca38b2971b37ecb97fef	baseline	preflop.2.iteration_ms	0.084	Fresh pass-start CUDA implementation on the current machine, with unchanged frozen workloads; compare final combined gains.	2026-09-07T06:36:58+00:00
B034	baseline	c14e87c3ad7f1c98cf61ca38b2971b37ecb97fef	baseline	preflop.2.check_ms	0.322	Fresh pass-start CUDA implementation on the current machine, with unchanged frozen workloads; compare final combined gains.	2026-09-07T06:36:58+00:00
B034	baseline	c14e87c3ad7f1c98cf61ca38b2971b37ecb97fef	baseline	preflop.2.sync_ms	0.019	Fresh pass-start CUDA implementation on the current machine, with unchanged frozen workloads; compare final combined gains.	2026-09-07T06:36:58+00:00
B034	baseline	c14e87c3ad7f1c98cf61ca38b2971b37ecb97fef	baseline	preflop.6.iteration_ms	19.612	Fresh pass-start CUDA implementation on the current machine, with unchanged frozen workloads; compare final combined gains.	2026-09-07T06:36:58+00:00
B034	baseline	c14e87c3ad7f1c98cf61ca38b2971b37ecb97fef	baseline	preflop.6.check_ms	13.891	Fresh pass-start CUDA implementation on the current machine, with unchanged frozen workloads; compare final combined gains.	2026-09-07T06:36:58+00:00
B034	baseline	c14e87c3ad7f1c98cf61ca38b2971b37ecb97fef	baseline	preflop.6.sync_ms	26.613	Fresh pass-start CUDA implementation on the current machine, with unchanged frozen workloads; compare final combined gains.	2026-09-07T06:36:58+00:00
B034	baseline	c14e87c3ad7f1c98cf61ca38b2971b37ecb97fef	baseline	preflop.8.iteration_ms	69.358	Fresh pass-start CUDA implementation on the current machine, with unchanged frozen workloads; compare final combined gains.	2026-09-07T06:36:58+00:00
B034	baseline	c14e87c3ad7f1c98cf61ca38b2971b37ecb97fef	baseline	preflop.8.check_ms	42.0	Fresh pass-start CUDA implementation on the current machine, with unchanged frozen workloads; compare final combined gains.	2026-09-07T06:36:58+00:00
B034	baseline	c14e87c3ad7f1c98cf61ca38b2971b37ecb97fef	baseline	preflop.8.sync_ms	66.686	Fresh pass-start CUDA implementation on the current machine, with unchanged frozen workloads; compare final combined gains.	2026-09-07T06:36:58+00:00
B034	baseline	c14e87c3ad7f1c98cf61ca38b2971b37ecb97fef	baseline	preflop.6.target_seconds	3.5492666	Fresh pass-start CUDA implementation on the current machine, with unchanged frozen workloads; compare final combined gains.	2026-09-07T06:36:58+00:00
B034	baseline	c14e87c3ad7f1c98cf61ca38b2971b37ecb97fef	baseline	preflop.8.target_seconds	8.925965099999999	Fresh pass-start CUDA implementation on the current machine, with unchanged frozen workloads; compare final combined gains.	2026-09-07T06:36:58+00:00
G001	preflop_cuda	a75c327cfa20ad3338d68aa1a75398458b76ea46	keep	preflop.3.iteration_ms	0.239	Final combined preflop source: all seven large fingerprints, 48 variants and unchanged target stopping states.	2026-09-07T06:38:40+00:00
G001	preflop_cuda	a75c327cfa20ad3338d68aa1a75398458b76ea46	keep	preflop.3.check_ms	0.638	Final combined preflop source: all seven large fingerprints, 48 variants and unchanged target stopping states.	2026-09-07T06:38:40+00:00
G001	preflop_cuda	a75c327cfa20ad3338d68aa1a75398458b76ea46	keep	preflop.3.sync_ms	0.096	Final combined preflop source: all seven large fingerprints, 48 variants and unchanged target stopping states.	2026-09-07T06:38:40+00:00
G001	preflop_cuda	a75c327cfa20ad3338d68aa1a75398458b76ea46	keep	preflop.5.iteration_ms	2.462	Final combined preflop source: all seven large fingerprints, 48 variants and unchanged target stopping states.	2026-09-07T06:38:40+00:00
G001	preflop_cuda	a75c327cfa20ad3338d68aa1a75398458b76ea46	keep	preflop.5.check_ms	2.386	Final combined preflop source: all seven large fingerprints, 48 variants and unchanged target stopping states.	2026-09-07T06:38:40+00:00
G001	preflop_cuda	a75c327cfa20ad3338d68aa1a75398458b76ea46	keep	preflop.5.sync_ms	4.058	Final combined preflop source: all seven large fingerprints, 48 variants and unchanged target stopping states.	2026-09-07T06:38:40+00:00
G001	preflop_cuda	a75c327cfa20ad3338d68aa1a75398458b76ea46	keep	preflop.7.iteration_ms	9.617	Final combined preflop source: all seven large fingerprints, 48 variants and unchanged target stopping states.	2026-09-07T06:38:40+00:00
G001	preflop_cuda	a75c327cfa20ad3338d68aa1a75398458b76ea46	keep	preflop.7.check_ms	6.92	Final combined preflop source: all seven large fingerprints, 48 variants and unchanged target stopping states.	2026-09-07T06:38:40+00:00
G001	preflop_cuda	a75c327cfa20ad3338d68aa1a75398458b76ea46	keep	preflop.7.sync_ms	16.194	Final combined preflop source: all seven large fingerprints, 48 variants and unchanged target stopping states.	2026-09-07T06:38:40+00:00
G001	preflop_cuda	a75c327cfa20ad3338d68aa1a75398458b76ea46	keep	preflop.9.iteration_ms	185.17	Final combined preflop source: all seven large fingerprints, 48 variants and unchanged target stopping states.	2026-09-07T06:38:40+00:00
G001	preflop_cuda	a75c327cfa20ad3338d68aa1a75398458b76ea46	keep	preflop.9.check_ms	113.863	Final combined preflop source: all seven large fingerprints, 48 variants and unchanged target stopping states.	2026-09-07T06:38:40+00:00
G001	preflop_cuda	a75c327cfa20ad3338d68aa1a75398458b76ea46	keep	preflop.9.sync_ms	323.142	Final combined preflop source: all seven large fingerprints, 48 variants and unchanged target stopping states.	2026-09-07T06:38:40+00:00
G001	preflop_cuda	a75c327cfa20ad3338d68aa1a75398458b76ea46	keep	preflop.2.iteration_ms	0.081	Final combined preflop source: all seven large fingerprints, 48 variants and unchanged target stopping states.	2026-09-07T06:38:40+00:00
G001	preflop_cuda	a75c327cfa20ad3338d68aa1a75398458b76ea46	keep	preflop.2.check_ms	0.246	Final combined preflop source: all seven large fingerprints, 48 variants and unchanged target stopping states.	2026-09-07T06:38:40+00:00
G001	preflop_cuda	a75c327cfa20ad3338d68aa1a75398458b76ea46	keep	preflop.2.sync_ms	0.036	Final combined preflop source: all seven large fingerprints, 48 variants and unchanged target stopping states.	2026-09-07T06:38:40+00:00
G001	preflop_cuda	a75c327cfa20ad3338d68aa1a75398458b76ea46	keep	preflop.6.iteration_ms	12.981	Final combined preflop source: all seven large fingerprints, 48 variants and unchanged target stopping states.	2026-09-07T06:38:40+00:00
G001	preflop_cuda	a75c327cfa20ad3338d68aa1a75398458b76ea46	keep	preflop.6.check_ms	9.197	Final combined preflop source: all seven large fingerprints, 48 variants and unchanged target stopping states.	2026-09-07T06:38:40+00:00
G001	preflop_cuda	a75c327cfa20ad3338d68aa1a75398458b76ea46	keep	preflop.6.sync_ms	31.166	Final combined preflop source: all seven large fingerprints, 48 variants and unchanged target stopping states.	2026-09-07T06:38:40+00:00
G001	preflop_cuda	a75c327cfa20ad3338d68aa1a75398458b76ea46	keep	preflop.8.iteration_ms	41.768	Final combined preflop source: all seven large fingerprints, 48 variants and unchanged target stopping states.	2026-09-07T06:38:40+00:00
G001	preflop_cuda	a75c327cfa20ad3338d68aa1a75398458b76ea46	keep	preflop.8.check_ms	25.377	Final combined preflop source: all seven large fingerprints, 48 variants and unchanged target stopping states.	2026-09-07T06:38:40+00:00
G001	preflop_cuda	a75c327cfa20ad3338d68aa1a75398458b76ea46	keep	preflop.8.sync_ms	68.293	Final combined preflop source: all seven large fingerprints, 48 variants and unchanged target stopping states.	2026-09-07T06:38:40+00:00
G001	preflop_cuda	a75c327cfa20ad3338d68aa1a75398458b76ea46	keep	preflop.6.target_seconds	2.3167796	Final combined preflop source: all seven large fingerprints, 48 variants and unchanged target stopping states.	2026-09-07T06:38:40+00:00
G001	preflop_cuda	a75c327cfa20ad3338d68aa1a75398458b76ea46	keep	preflop.8.target_seconds	5.3233246	Final combined preflop source: all seven large fingerprints, 48 variants and unchanged target stopping states.	2026-09-07T06:38:40+00:00
G002	postflop_cuda	a75c327cfa20ad3338d68aa1a75398458b76ea46	keep	postflop.Ks7h2d.target_seconds	11.107	Final combined postflop source: saved states, resume and CPU query materialization, action menus and unchanged convergence targets.	2026-09-07T06:39:59+00:00
G002	postflop_cuda	a75c327cfa20ad3338d68aa1a75398458b76ea46	keep	postflop.Ks7s2d.target_seconds	6.667	Final combined postflop source: saved states, resume and CPU query materialization, action menus and unchanged convergence targets.	2026-09-07T06:39:59+00:00
G002	postflop_cuda	a75c327cfa20ad3338d68aa1a75398458b76ea46	keep	postflop.Ks7h2dQhTc.target_seconds	0.022	Final combined postflop source: saved states, resume and CPU query materialization, action menus and unchanged convergence targets.	2026-09-07T06:39:59+00:00
G003	memory_transfers	a75c327cfa20ad3338d68aa1a75398458b76ea46	keep	preflop.6.allocated_vram_mb	503.31648	Final combined memory and evaluation checks: actual device allocation, cold and warm lifecycle, and repeated first/capture/steady evaluations.	2026-09-07T06:41:41+00:00
G003	memory_transfers	a75c327cfa20ad3338d68aa1a75398458b76ea46	keep	preflop.6.build_ms	82.515	Final combined memory and evaluation checks: actual device allocation, cold and warm lifecycle, and repeated first/capture/steady evaluations.	2026-09-07T06:41:41+00:00
G003	memory_transfers	a75c327cfa20ad3338d68aa1a75398458b76ea46	keep	preflop.6.cpu_arena_mb	224.552328	Final combined memory and evaluation checks: actual device allocation, cold and warm lifecycle, and repeated first/capture/steady evaluations.	2026-09-07T06:41:41+00:00
G003	memory_transfers	a75c327cfa20ad3338d68aa1a75398458b76ea46	keep	preflop.6.estimated_vram_mb	558.527272	Final combined memory and evaluation checks: actual device allocation, cold and warm lifecycle, and repeated first/capture/steady evaluations.	2026-09-07T06:41:41+00:00
G003	memory_transfers	a75c327cfa20ad3338d68aa1a75398458b76ea46	keep	preflop.6.init_ms	151.8129	Final combined memory and evaluation checks: actual device allocation, cold and warm lifecycle, and repeated first/capture/steady evaluations.	2026-09-07T06:41:41+00:00
G003	memory_transfers	a75c327cfa20ad3338d68aa1a75398458b76ea46	keep	preflop.8.allocated_vram_mb	1308.622848	Final combined memory and evaluation checks: actual device allocation, cold and warm lifecycle, and repeated first/capture/steady evaluations.	2026-09-07T06:41:41+00:00
G003	memory_transfers	a75c327cfa20ad3338d68aa1a75398458b76ea46	keep	preflop.8.build_ms	220.894	Final combined memory and evaluation checks: actual device allocation, cold and warm lifecycle, and repeated first/capture/steady evaluations.	2026-09-07T06:41:41+00:00
G003	memory_transfers	a75c327cfa20ad3338d68aa1a75398458b76ea46	keep	preflop.8.cpu_arena_mb	587.239848	Final combined memory and evaluation checks: actual device allocation, cold and warm lifecycle, and repeated first/capture/steady evaluations.	2026-09-07T06:41:41+00:00
G003	memory_transfers	a75c327cfa20ad3338d68aa1a75398458b76ea46	keep	preflop.8.estimated_vram_mb	1357.2225680000001	Final combined memory and evaluation checks: actual device allocation, cold and warm lifecycle, and repeated first/capture/steady evaluations.	2026-09-07T06:41:41+00:00
G003	memory_transfers	a75c327cfa20ad3338d68aa1a75398458b76ea46	keep	preflop.8.init_ms	243.2158	Final combined memory and evaluation checks: actual device allocation, cold and warm lifecycle, and repeated first/capture/steady evaluations.	2026-09-07T06:41:41+00:00
G003	memory_transfers	a75c327cfa20ad3338d68aa1a75398458b76ea46	keep	postflop.Ks7h2d.first_check_ms	34.8859	Final combined memory and evaluation checks: actual device allocation, cold and warm lifecycle, and repeated first/capture/steady evaluations.	2026-09-07T06:41:41+00:00
G003	memory_transfers	a75c327cfa20ad3338d68aa1a75398458b76ea46	keep	postflop.Ks7h2d.second_check_ms	35.5047	Final combined memory and evaluation checks: actual device allocation, cold and warm lifecycle, and repeated first/capture/steady evaluations.	2026-09-07T06:41:41+00:00
G003	memory_transfers	a75c327cfa20ad3338d68aa1a75398458b76ea46	keep	postflop.Ks7h2d.steady_check_ms	34.780975	Final combined memory and evaluation checks: actual device allocation, cold and warm lifecycle, and repeated first/capture/steady evaluations.	2026-09-07T06:41:41+00:00
G003	memory_transfers	a75c327cfa20ad3338d68aa1a75398458b76ea46	keep	postflop.Ks7s2d.first_check_ms	28.037	Final combined memory and evaluation checks: actual device allocation, cold and warm lifecycle, and repeated first/capture/steady evaluations.	2026-09-07T06:41:41+00:00
G003	memory_transfers	a75c327cfa20ad3338d68aa1a75398458b76ea46	keep	postflop.Ks7s2d.second_check_ms	28.5076	Final combined memory and evaluation checks: actual device allocation, cold and warm lifecycle, and repeated first/capture/steady evaluations.	2026-09-07T06:41:41+00:00
