experiment	path	commit	status	metric	value	hypothesis	utc
B035	baseline	dfc1b3765810e50e0de713691e48e50bb18ea4b8	baseline	preflop.2.steady_check_ms	0.370525	Fresh pass-start fixed-step postflop, device memory, full cold/warm transfers, and first/capture/steady checks; original source and frozen inputs.	2026-09-07T06:46:25+00:00
B035	baseline	dfc1b3765810e50e0de713691e48e50bb18ea4b8	baseline	preflop.6.first_check_ms	13.9405	Fresh pass-start fixed-step postflop, device memory, full cold/warm transfers, and first/capture/steady checks; original source and frozen inputs.	2026-09-07T06:46:25+00:00
B035	baseline	dfc1b3765810e50e0de713691e48e50bb18ea4b8	baseline	preflop.6.second_check_ms	13.9294	Fresh pass-start fixed-step postflop, device memory, full cold/warm transfers, and first/capture/steady checks; original source and frozen inputs.	2026-09-07T06:46:25+00:00
B035	baseline	dfc1b3765810e50e0de713691e48e50bb18ea4b8	baseline	preflop.6.steady_check_ms	14.62225	Fresh pass-start fixed-step postflop, device memory, full cold/warm transfers, and first/capture/steady checks; original source and frozen inputs.	2026-09-07T06:46:25+00:00
B035	baseline	dfc1b3765810e50e0de713691e48e50bb18ea4b8	baseline	preflop.8.first_check_ms	43.8741	Fresh pass-start fixed-step postflop, device memory, full cold/warm transfers, and first/capture/steady checks; original source and frozen inputs.	2026-09-07T06:46:25+00:00
B035	baseline	dfc1b3765810e50e0de713691e48e50bb18ea4b8	baseline	preflop.8.second_check_ms	44.1018	Fresh pass-start fixed-step postflop, device memory, full cold/warm transfers, and first/capture/steady checks; original source and frozen inputs.	2026-09-07T06:46:25+00:00
B035	baseline	dfc1b3765810e50e0de713691e48e50bb18ea4b8	baseline	preflop.8.steady_check_ms	43.93	Fresh pass-start fixed-step postflop, device memory, full cold/warm transfers, and first/capture/steady checks; original source and frozen inputs.	2026-09-07T06:46:25+00:00
B035	baseline	dfc1b3765810e50e0de713691e48e50bb18ea4b8	baseline	postflop.memory.rainbow.cold.compressed.allocated_vram_mb	6241.124352	Fresh pass-start fixed-step postflop, device memory, full cold/warm transfers, and first/capture/steady checks; original source and frozen inputs.	2026-09-07T06:46:25+00:00
B035	baseline	dfc1b3765810e50e0de713691e48e50bb18ea4b8	baseline	postflop.memory.rainbow.cold.compressed.host_live_mb	5302.112256	Fresh pass-start fixed-step postflop, device memory, full cold/warm transfers, and first/capture/steady checks; original source and frozen inputs.	2026-09-07T06:46:25+00:00
B035	baseline	dfc1b3765810e50e0de713691e48e50bb18ea4b8	baseline	postflop.memory.rainbow.cold.compressed.host_private_mb	11909.353472	Fresh pass-start fixed-step postflop, device memory, full cold/warm transfers, and first/capture/steady checks; original source and frozen inputs.	2026-09-07T06:46:25+00:00
B035	baseline	dfc1b3765810e50e0de713691e48e50bb18ea4b8	baseline	postflop.memory.rainbow.cold.compressed.init_ms	1630.134	Fresh pass-start fixed-step postflop, device memory, full cold/warm transfers, and first/capture/steady checks; original source and frozen inputs.	2026-09-07T06:46:25+00:00
B035	baseline	dfc1b3765810e50e0de713691e48e50bb18ea4b8	baseline	postflop.memory.rainbow.cold.compressed.strategy_sync_ms	833.943	Fresh pass-start fixed-step postflop, device memory, full cold/warm transfers, and first/capture/steady checks; original source and frozen inputs.	2026-09-07T06:46:25+00:00
B035	baseline	dfc1b3765810e50e0de713691e48e50bb18ea4b8	baseline	postflop.memory.rainbow.cold.compressed.sync_ms	1606.9308	Fresh pass-start fixed-step postflop, device memory, full cold/warm transfers, and first/capture/steady checks; original source and frozen inputs.	2026-09-07T06:46:25+00:00
B035	baseline	dfc1b3765810e50e0de713691e48e50bb18ea4b8	baseline	postflop.memory.rainbow.warm.compressed.allocated_vram_mb	6241.124352	Fresh pass-start fixed-step postflop, device memory, full cold/warm transfers, and first/capture/steady checks; original source and frozen inputs.	2026-09-07T06:46:25+00:00
B035	baseline	dfc1b3765810e50e0de713691e48e50bb18ea4b8	baseline	postflop.memory.rainbow.warm.compressed.host_live_mb	5309.97248	Fresh pass-start fixed-step postflop, device memory, full cold/warm transfers, and first/capture/steady checks; original source and frozen inputs.	2026-09-07T06:46:25+00:00
B035	baseline	dfc1b3765810e50e0de713691e48e50bb18ea4b8	baseline	postflop.memory.rainbow.warm.compressed.host_private_mb	11908.096	Fresh pass-start fixed-step postflop, device memory, full cold/warm transfers, and first/capture/steady checks; original source and frozen inputs.	2026-09-07T06:46:25+00:00
B035	baseline	dfc1b3765810e50e0de713691e48e50bb18ea4b8	baseline	postflop.memory.rainbow.warm.compressed.init_ms	1933.6133	Fresh pass-start fixed-step postflop, device memory, full cold/warm transfers, and first/capture/steady checks; original source and frozen inputs.	2026-09-07T06:46:25+00:00
B035	baseline	dfc1b3765810e50e0de713691e48e50bb18ea4b8	baseline	postflop.memory.rainbow.warm.compressed.strategy_sync_ms	838.366	Fresh pass-start fixed-step postflop, device memory, full cold/warm transfers, and first/capture/steady checks; original source and frozen inputs.	2026-09-07T06:46:25+00:00
B035	baseline	dfc1b3765810e50e0de713691e48e50bb18ea4b8	baseline	postflop.memory.rainbow.warm.compressed.sync_ms	1655.8828	Fresh pass-start fixed-step postflop, device memory, full cold/warm transfers, and first/capture/steady checks; original source and frozen inputs.	2026-09-07T06:46:25+00:00
B035	baseline	dfc1b3765810e50e0de713691e48e50bb18ea4b8	baseline	postflop.memory.cold.f32.allocated_vram_mb	4932.501504	Fresh pass-start fixed-step postflop, device memory, full cold/warm transfers, and first/capture/steady checks; original source and frozen inputs.	2026-09-07T06:46:25+00:00
B035	baseline	dfc1b3765810e50e0de713691e48e50bb18ea4b8	baseline	postflop.memory.cold.f32.host_live_mb	3924.64384	Fresh pass-start fixed-step postflop, device memory, full cold/warm transfers, and first/capture/steady checks; original source and frozen inputs.	2026-09-07T06:46:25+00:00
B035	baseline	dfc1b3765810e50e0de713691e48e50bb18ea4b8	baseline	postflop.memory.cold.f32.host_private_mb	9448.87808	Fresh pass-start fixed-step postflop, device memory, full cold/warm transfers, and first/capture/steady checks; original source and frozen inputs.	2026-09-07T06:46:25+00:00
B035	baseline	dfc1b3765810e50e0de713691e48e50bb18ea4b8	baseline	postflop.memory.cold.f32.init_ms	791.1983	Fresh pass-start fixed-step postflop, device memory, full cold/warm transfers, and first/capture/steady checks; original source and frozen inputs.	2026-09-07T06:46:25+00:00
B035	baseline	dfc1b3765810e50e0de713691e48e50bb18ea4b8	baseline	postflop.memory.cold.f32.strategy_sync_ms	172.12939999999998	Fresh pass-start fixed-step postflop, device memory, full cold/warm transfers, and first/capture/steady checks; original source and frozen inputs.	2026-09-07T06:46:25+00:00
B035	baseline	dfc1b3765810e50e0de713691e48e50bb18ea4b8	baseline	postflop.memory.cold.f32.sync_ms	361.2863	Fresh pass-start fixed-step postflop, device memory, full cold/warm transfers, and first/capture/steady checks; original source and frozen inputs.	2026-09-07T06:46:25+00:00
B035	baseline	dfc1b3765810e50e0de713691e48e50bb18ea4b8	baseline	postflop.memory.warm.f32.allocated_vram_mb	4932.501504	Fresh pass-start fixed-step postflop, device memory, full cold/warm transfers, and first/capture/steady checks; original source and frozen inputs.	2026-09-07T06:46:25+00:00
B035	baseline	dfc1b3765810e50e0de713691e48e50bb18ea4b8	baseline	postflop.memory.warm.f32.host_live_mb	3934.756864	Fresh pass-start fixed-step postflop, device memory, full cold/warm transfers, and first/capture/steady checks; original source and frozen inputs.	2026-09-07T06:46:25+00:00
B035	baseline	dfc1b3765810e50e0de713691e48e50bb18ea4b8	baseline	postflop.memory.warm.f32.host_private_mb	9447.366656	Fresh pass-start fixed-step postflop, device memory, full cold/warm transfers, and first/capture/steady checks; original source and frozen inputs.	2026-09-07T06:46:25+00:00
B035	baseline	dfc1b3765810e50e0de713691e48e50bb18ea4b8	baseline	postflop.memory.warm.f32.init_ms	781.5497	Fresh pass-start fixed-step postflop, device memory, full cold/warm transfers, and first/capture/steady checks; original source and frozen inputs.	2026-09-07T06:46:25+00:00
B035	baseline	dfc1b3765810e50e0de713691e48e50bb18ea4b8	baseline	postflop.memory.warm.f32.strategy_sync_ms	185.6557	Fresh pass-start fixed-step postflop, device memory, full cold/warm transfers, and first/capture/steady checks; original source and frozen inputs.	2026-09-07T06:46:25+00:00
B035	baseline	dfc1b3765810e50e0de713691e48e50bb18ea4b8	baseline	postflop.memory.warm.f32.sync_ms	365.40250000000003	Fresh pass-start fixed-step postflop, device memory, full cold/warm transfers, and first/capture/steady checks; original source and frozen inputs.	2026-09-07T06:46:25+00:00
B035	baseline	dfc1b3765810e50e0de713691e48e50bb18ea4b8	baseline	postflop.memory.cold.compressed.allocated_vram_mb	4932.501504	Fresh pass-start fixed-step postflop, device memory, full cold/warm transfers, and first/capture/steady checks; original source and frozen inputs.	2026-09-07T06:46:25+00:00
B035	baseline	dfc1b3765810e50e0de713691e48e50bb18ea4b8	baseline	postflop.memory.cold.compressed.host_live_mb	5317.95968	Fresh pass-start fixed-step postflop, device memory, full cold/warm transfers, and first/capture/steady checks; original source and frozen inputs.	2026-09-07T06:46:25+00:00
B035	baseline	dfc1b3765810e50e0de713691e48e50bb18ea4b8	baseline	postflop.memory.cold.compressed.host_private_mb	10602.053632	Fresh pass-start fixed-step postflop, device memory, full cold/warm transfers, and first/capture/steady checks; original source and frozen inputs.	2026-09-07T06:46:25+00:00
B035	baseline	dfc1b3765810e50e0de713691e48e50bb18ea4b8	baseline	postflop.memory.cold.compressed.init_ms	1667.7062	Fresh pass-start fixed-step postflop, device memory, full cold/warm transfers, and first/capture/steady checks; original source and frozen inputs.	2026-09-07T06:46:25+00:00
B035	baseline	dfc1b3765810e50e0de713691e48e50bb18ea4b8	baseline	postflop.memory.cold.compressed.strategy_sync_ms	556.6742	Fresh pass-start fixed-step postflop, device memory, full cold/warm transfers, and first/capture/steady checks; original source and frozen inputs.	2026-09-07T06:46:25+00:00
B035	baseline	dfc1b3765810e50e0de713691e48e50bb18ea4b8	baseline	postflop.memory.cold.compressed.sync_ms	1124.0348	Fresh pass-start fixed-step postflop, device memory, full cold/warm transfers, and first/capture/steady checks; original source and frozen inputs.	2026-09-07T06:46:25+00:00
B035	baseline	dfc1b3765810e50e0de713691e48e50bb18ea4b8	baseline	postflop.memory.warm.compressed.allocated_vram_mb	4932.501504	Fresh pass-start fixed-step postflop, device memory, full cold/warm transfers, and first/capture/steady checks; original source and frozen inputs.	2026-09-07T06:46:25+00:00
B035	baseline	dfc1b3765810e50e0de713691e48e50bb18ea4b8	baseline	postflop.memory.warm.compressed.host_live_mb	5318.643712	Fresh pass-start fixed-step postflop, device memory, full cold/warm transfers, and first/capture/steady checks; original source and frozen inputs.	2026-09-07T06:46:25+00:00
B035	baseline	dfc1b3765810e50e0de713691e48e50bb18ea4b8	baseline	postflop.memory.warm.compressed.host_private_mb	10602.053632	Fresh pass-start fixed-step postflop, device memory, full cold/warm transfers, and first/capture/steady checks; original source and frozen inputs.	2026-09-07T06:46:25+00:00
B035	baseline	dfc1b3765810e50e0de713691e48e50bb18ea4b8	baseline	postflop.memory.warm.compressed.init_ms	1707.9687	Fresh pass-start fixed-step postflop, device memory, full cold/warm transfers, and first/capture/steady checks; original source and frozen inputs.	2026-09-07T06:46:25+00:00
B035	baseline	dfc1b3765810e50e0de713691e48e50bb18ea4b8	baseline	postflop.memory.warm.compressed.strategy_sync_ms	757.4297	Fresh pass-start fixed-step postflop, device memory, full cold/warm transfers, and first/capture/steady checks; original source and frozen inputs.	2026-09-07T06:46:25+00:00
B035	baseline	dfc1b3765810e50e0de713691e48e50bb18ea4b8	baseline	postflop.memory.warm.compressed.sync_ms	1531.0011000000002	Fresh pass-start fixed-step postflop, device memory, full cold/warm transfers, and first/capture/steady checks; original source and frozen inputs.	2026-09-07T06:46:25+00:00
B035	baseline	dfc1b3765810e50e0de713691e48e50bb18ea4b8	baseline	postflop.Ks7h2d.init_ms	1266.589	Fresh pass-start fixed-step postflop, device memory, full cold/warm transfers, and first/capture/steady checks; original source and frozen inputs.	2026-09-07T06:46:25+00:00
B035	baseline	dfc1b3765810e50e0de713691e48e50bb18ea4b8	baseline	postflop.Ks7h2d.iteration_ms	58.5	Fresh pass-start fixed-step postflop, device memory, full cold/warm transfers, and first/capture/steady checks; original source and frozen inputs.	2026-09-07T06:46:25+00:00
B035	baseline	dfc1b3765810e50e0de713691e48e50bb18ea4b8	baseline	postflop.Ks7h2d.check_ms	36.793	Fresh pass-start fixed-step postflop, device memory, full cold/warm transfers, and first/capture/steady checks; original source and frozen inputs.	2026-09-07T06:46:25+00:00
B035	baseline	dfc1b3765810e50e0de713691e48e50bb18ea4b8	baseline	postflop.Ks7s2d.init_ms	793.612	Fresh pass-start fixed-step postflop, device memory, full cold/warm transfers, and first/capture/steady checks; original source and frozen inputs.	2026-09-07T06:46:25+00:00
B035	baseline	dfc1b3765810e50e0de713691e48e50bb18ea4b8	baseline	postflop.Ks7s2d.iteration_ms	34.59	Fresh pass-start fixed-step postflop, device memory, full cold/warm transfers, and first/capture/steady checks; original source and frozen inputs.	2026-09-07T06:46:25+00:00
B035	baseline	dfc1b3765810e50e0de713691e48e50bb18ea4b8	baseline	postflop.Ks7s2d.check_ms	29.888	Fresh pass-start fixed-step postflop, device memory, full cold/warm transfers, and first/capture/steady checks; original source and frozen inputs.	2026-09-07T06:46:25+00:00
B035	baseline	dfc1b3765810e50e0de713691e48e50bb18ea4b8	baseline	postflop.Ks7h2dQhTc.init_ms	79.516	Fresh pass-start fixed-step postflop, device memory, full cold/warm transfers, and first/capture/steady checks; original source and frozen inputs.	2026-09-07T06:46:25+00:00
B035	baseline	dfc1b3765810e50e0de713691e48e50bb18ea4b8	baseline	postflop.Ks7h2dQhTc.iteration_ms	0.321	Fresh pass-start fixed-step postflop, device memory, full cold/warm transfers, and first/capture/steady checks; original source and frozen inputs.	2026-09-07T06:46:25+00:00
B035	baseline	dfc1b3765810e50e0de713691e48e50bb18ea4b8	baseline	postflop.Ks7h2dQhTc.check_ms	0.6	Fresh pass-start fixed-step postflop, device memory, full cold/warm transfers, and first/capture/steady checks; original source and frozen inputs.	2026-09-07T06:46:25+00:00
G005	postflop_cuda	d3ff6d69969e13939e3ff7e1f43f6d9616ce24f3	keep	postflop.Ks7h2d.first_check_ms	35.6075	Final combined fixed-step postflop and lifecycle comparison after fresh B035; numerical output and workload unchanged.	2026-09-07T06:48:34+00:00
G005	postflop_cuda	d3ff6d69969e13939e3ff7e1f43f6d9616ce24f3	keep	postflop.Ks7h2d.second_check_ms	34.846599999999995	Final combined fixed-step postflop and lifecycle comparison after fresh B035; numerical output and workload unchanged.	2026-09-07T06:48:34+00:00
G005	postflop_cuda	d3ff6d69969e13939e3ff7e1f43f6d9616ce24f3	keep	postflop.Ks7h2d.steady_check_ms	34.9521	Final combined fixed-step postflop and lifecycle comparison after fresh B035; numerical output and workload unchanged.	2026-09-07T06:48:34+00:00
G005	postflop_cuda	d3ff6d69969e13939e3ff7e1f43f6d9616ce24f3	keep	postflop.Ks7s2d.first_check_ms	28.6578	Final combined fixed-step postflop and lifecycle comparison after fresh B035; numerical output and workload unchanged.	2026-09-07T06:48:34+00:00
G005	postflop_cuda	d3ff6d69969e13939e3ff7e1f43f6d9616ce24f3	keep	postflop.Ks7s2d.second_check_ms	28.8875	Final combined fixed-step postflop and lifecycle comparison after fresh B035; numerical output and workload unchanged.	2026-09-07T06:48:34+00:00
G005	postflop_cuda	d3ff6d69969e13939e3ff7e1f43f6d9616ce24f3	keep	postflop.Ks7s2d.steady_check_ms	28.086225	Final combined fixed-step postflop and lifecycle comparison after fresh B035; numerical output and workload unchanged.	2026-09-07T06:48:34+00:00
G005	postflop_cuda	d3ff6d69969e13939e3ff7e1f43f6d9616ce24f3	keep	postflop.Ks7h2dQhTc.first_check_ms	0.7595	Final combined fixed-step postflop and lifecycle comparison after fresh B035; numerical output and workload unchanged.	2026-09-07T06:48:34+00:00
G005	postflop_cuda	d3ff6d69969e13939e3ff7e1f43f6d9616ce24f3	keep	postflop.Ks7h2dQhTc.second_check_ms	0.5783999999999999	Final combined fixed-step postflop and lifecycle comparison after fresh B035; numerical output and workload unchanged.	2026-09-07T06:48:34+00:00
G005	postflop_cuda	d3ff6d69969e13939e3ff7e1f43f6d9616ce24f3	keep	postflop.Ks7h2dQhTc.steady_check_ms	0.310375	Final combined fixed-step postflop and lifecycle comparison after fresh B035; numerical output and workload unchanged.	2026-09-07T06:48:34+00:00
G005	postflop_cuda	d3ff6d69969e13939e3ff7e1f43f6d9616ce24f3	keep	preflop.2.first_check_ms	0.2565	Final combined fixed-step postflop and lifecycle comparison after fresh B035; numerical output and workload unchanged.	2026-09-07T06:48:34+00:00
G005	postflop_cuda	d3ff6d69969e13939e3ff7e1f43f6d9616ce24f3	keep	preflop.2.second_check_ms	0.2361	Final combined fixed-step postflop and lifecycle comparison after fresh B035; numerical output and workload unchanged.	2026-09-07T06:48:34+00:00
G005	postflop_cuda	d3ff6d69969e13939e3ff7e1f43f6d9616ce24f3	keep	preflop.2.steady_check_ms	0.103675	Final combined fixed-step postflop and lifecycle comparison after fresh B035; numerical output and workload unchanged.	2026-09-07T06:48:34+00:00
G005	postflop_cuda	d3ff6d69969e13939e3ff7e1f43f6d9616ce24f3	keep	preflop.6.first_check_ms	8.8877	Final combined fixed-step postflop and lifecycle comparison after fresh B035; numerical output and workload unchanged.	2026-09-07T06:48:34+00:00
G005	postflop_cuda	d3ff6d69969e13939e3ff7e1f43f6d9616ce24f3	keep	preflop.6.second_check_ms	10.2597	Final combined fixed-step postflop and lifecycle comparison after fresh B035; numerical output and workload unchanged.	2026-09-07T06:48:34+00:00
G005	postflop_cuda	d3ff6d69969e13939e3ff7e1f43f6d9616ce24f3	keep	preflop.6.steady_check_ms	8.363025	Final combined fixed-step postflop and lifecycle comparison after fresh B035; numerical output and workload unchanged.	2026-09-07T06:48:34+00:00
G005	postflop_cuda	d3ff6d69969e13939e3ff7e1f43f6d9616ce24f3	keep	preflop.8.first_check_ms	25.3321	Final combined fixed-step postflop and lifecycle comparison after fresh B035; numerical output and workload unchanged.	2026-09-07T06:48:34+00:00
G005	postflop_cuda	d3ff6d69969e13939e3ff7e1f43f6d9616ce24f3	keep	preflop.8.second_check_ms	26.4326	Final combined fixed-step postflop and lifecycle comparison after fresh B035; numerical output and workload unchanged.	2026-09-07T06:48:34+00:00
G005	postflop_cuda	d3ff6d69969e13939e3ff7e1f43f6d9616ce24f3	keep	preflop.8.steady_check_ms	24.445675	Final combined fixed-step postflop and lifecycle comparison after fresh B035; numerical output and workload unchanged.	2026-09-07T06:48:34+00:00
G005	postflop_cuda	d3ff6d69969e13939e3ff7e1f43f6d9616ce24f3	keep	postflop.memory.rainbow.cold.compressed.allocated_vram_mb	5905.580032	Final combined fixed-step postflop and lifecycle comparison after fresh B035; numerical output and workload unchanged.	2026-09-07T06:48:34+00:00
G005	postflop_cuda	d3ff6d69969e13939e3ff7e1f43f6d9616ce24f3	keep	postflop.memory.rainbow.cold.compressed.host_live_mb	2585.382912	Final combined fixed-step postflop and lifecycle comparison after fresh B035; numerical output and workload unchanged.	2026-09-07T06:48:34+00:00
G005	postflop_cuda	d3ff6d69969e13939e3ff7e1f43f6d9616ce24f3	keep	postflop.memory.rainbow.cold.compressed.host_private_mb	9074.91328	Final combined fixed-step postflop and lifecycle comparison after fresh B035; numerical output and workload unchanged.	2026-09-07T06:48:34+00:00
G005	postflop_cuda	d3ff6d69969e13939e3ff7e1f43f6d9616ce24f3	keep	postflop.memory.rainbow.cold.compressed.init_ms	840.7807	Final combined fixed-step postflop and lifecycle comparison after fresh B035; numerical output and workload unchanged.	2026-09-07T06:48:34+00:00
G005	postflop_cuda	d3ff6d69969e13939e3ff7e1f43f6d9616ce24f3	keep	postflop.memory.rainbow.cold.compressed.strategy_sync_ms	162.87869999999998	Final combined fixed-step postflop and lifecycle comparison after fresh B035; numerical output and workload unchanged.	2026-09-07T06:48:34+00:00
G005	postflop_cuda	d3ff6d69969e13939e3ff7e1f43f6d9616ce24f3	keep	postflop.memory.rainbow.cold.compressed.sync_ms	336.65	Final combined fixed-step postflop and lifecycle comparison after fresh B035; numerical output and workload unchanged.	2026-09-07T06:48:34+00:00
G005	postflop_cuda	d3ff6d69969e13939e3ff7e1f43f6d9616ce24f3	keep	postflop.memory.rainbow.warm.compressed.allocated_vram_mb	5905.580032	Final combined fixed-step postflop and lifecycle comparison after fresh B035; numerical output and workload unchanged.	2026-09-07T06:48:34+00:00
G005	postflop_cuda	d3ff6d69969e13939e3ff7e1f43f6d9616ce24f3	keep	postflop.memory.rainbow.warm.compressed.host_live_mb	2597.154816	Final combined fixed-step postflop and lifecycle comparison after fresh B035; numerical output and workload unchanged.	2026-09-07T06:48:34+00:00
