experiment	path	commit	status	metric	value	hypothesis	utc
E025B	preflop_cuda	8f2a92c7b9819ccd729ae1e26060ee4169113cbf	keep	preflop.6.check_ms	13.305	Dispatch separate 2/6/8-player terminal kernels at initialization, removing generic fallback register pressure from specialized paths and preserving other seat counts	2026-09-07T04:49:08+00:00
E025B	preflop_cuda	8f2a92c7b9819ccd729ae1e26060ee4169113cbf	keep	preflop.6.sync_ms	25.722	Dispatch separate 2/6/8-player terminal kernels at initialization, removing generic fallback register pressure from specialized paths and preserving other seat counts	2026-09-07T04:49:08+00:00
E025B	preflop_cuda	8f2a92c7b9819ccd729ae1e26060ee4169113cbf	keep	preflop.8.iteration_ms	59.263	Dispatch separate 2/6/8-player terminal kernels at initialization, removing generic fallback register pressure from specialized paths and preserving other seat counts	2026-09-07T04:49:08+00:00
E025B	preflop_cuda	8f2a92c7b9819ccd729ae1e26060ee4169113cbf	keep	preflop.8.check_ms	38.815	Dispatch separate 2/6/8-player terminal kernels at initialization, removing generic fallback register pressure from specialized paths and preserving other seat counts	2026-09-07T04:49:08+00:00
E025B	preflop_cuda	8f2a92c7b9819ccd729ae1e26060ee4169113cbf	keep	preflop.8.sync_ms	69.079	Dispatch separate 2/6/8-player terminal kernels at initialization, removing generic fallback register pressure from specialized paths and preserving other seat counts	2026-09-07T04:49:08+00:00
E025BR	preflop_cuda	8f2a92c7b9819ccd729ae1e26060ee4169113cbf	keep	postflop.Ks7h2d.iso.allocated_vram_mb	6241.124352	Repeat separate terminal entry points with preflop GPU and budget tests; collect immediate postflop timing/capacity control before CFV lifetime reuse	2026-09-07T04:53:08+00:00
E025BR	preflop_cuda	8f2a92c7b9819ccd729ae1e26060ee4169113cbf	keep	postflop.Ks7h2d.iso.estimated_vram_mb	6716.6347	Repeat separate terminal entry points with preflop GPU and budget tests; collect immediate postflop timing/capacity control before CFV lifetime reuse	2026-09-07T04:53:08+00:00
E025BR	preflop_cuda	8f2a92c7b9819ccd729ae1e26060ee4169113cbf	keep	postflop.Ks7h2d.iso.init_ms	958.9462	Repeat separate terminal entry points with preflop GPU and budget tests; collect immediate postflop timing/capacity control before CFV lifetime reuse	2026-09-07T04:53:08+00:00
E025BR	preflop_cuda	8f2a92c7b9819ccd729ae1e26060ee4169113cbf	keep	postflop.Ks7h2d.iso.plan_build_ms	101.8055	Repeat separate terminal entry points with preflop GPU and budget tests; collect immediate postflop timing/capacity control before CFV lifetime reuse	2026-09-07T04:53:08+00:00
E025BR	preflop_cuda	8f2a92c7b9819ccd729ae1e26060ee4169113cbf	keep	postflop.Ks7h2d.iso.staging_memory_mb	3380.293588	Repeat separate terminal entry points with preflop GPU and budget tests; collect immediate postflop timing/capacity control before CFV lifetime reuse	2026-09-07T04:53:08+00:00
E025BR	preflop_cuda	8f2a92c7b9819ccd729ae1e26060ee4169113cbf	keep	postflop.Ks7s2d.iso.allocated_vram_mb	4932.501504	Repeat separate terminal entry points with preflop GPU and budget tests; collect immediate postflop timing/capacity control before CFV lifetime reuse	2026-09-07T04:53:08+00:00
E025BR	preflop_cuda	8f2a92c7b9819ccd729ae1e26060ee4169113cbf	keep	postflop.Ks7s2d.iso.estimated_vram_mb	6737.546704	Repeat separate terminal entry points with preflop GPU and budget tests; collect immediate postflop timing/capacity control before CFV lifetime reuse	2026-09-07T04:53:08+00:00
E025BR	preflop_cuda	8f2a92c7b9819ccd729ae1e26060ee4169113cbf	keep	postflop.Ks7s2d.iso.init_ms	661.6857	Repeat separate terminal entry points with preflop GPU and budget tests; collect immediate postflop timing/capacity control before CFV lifetime reuse	2026-09-07T04:53:08+00:00
E025BR	preflop_cuda	8f2a92c7b9819ccd729ae1e26060ee4169113cbf	keep	postflop.Ks7s2d.iso.plan_build_ms	94.8851	Repeat separate terminal entry points with preflop GPU and budget tests; collect immediate postflop timing/capacity control before CFV lifetime reuse	2026-09-07T04:53:08+00:00
E025BR	preflop_cuda	8f2a92c7b9819ccd729ae1e26060ee4169113cbf	keep	postflop.Ks7s2d.iso.staging_memory_mb	2063.622928	Repeat separate terminal entry points with preflop GPU and budget tests; collect immediate postflop timing/capacity control before CFV lifetime reuse	2026-09-07T04:53:08+00:00
E025BR	preflop_cuda	8f2a92c7b9819ccd729ae1e26060ee4169113cbf	keep	postflop.Ks7s2d.full.allocated_vram_mb	6274.678784	Repeat separate terminal entry points with preflop GPU and budget tests; collect immediate postflop timing/capacity control before CFV lifetime reuse	2026-09-07T04:53:08+00:00
E025BR	preflop_cuda	8f2a92c7b9819ccd729ae1e26060ee4169113cbf	keep	postflop.Ks7s2d.full.estimated_vram_mb	6737.546704	Repeat separate terminal entry points with preflop GPU and budget tests; collect immediate postflop timing/capacity control before CFV lifetime reuse	2026-09-07T04:53:08+00:00
E025BR	preflop_cuda	8f2a92c7b9819ccd729ae1e26060ee4169113cbf	keep	postflop.Ks7s2d.full.init_ms	745.6814	Repeat separate terminal entry points with preflop GPU and budget tests; collect immediate postflop timing/capacity control before CFV lifetime reuse	2026-09-07T04:53:08+00:00
E025BR	preflop_cuda	8f2a92c7b9819ccd729ae1e26060ee4169113cbf	keep	postflop.Ks7s2d.full.plan_build_ms	98.5857	Repeat separate terminal entry points with preflop GPU and budget tests; collect immediate postflop timing/capacity control before CFV lifetime reuse	2026-09-07T04:53:08+00:00
E025BR	preflop_cuda	8f2a92c7b9819ccd729ae1e26060ee4169113cbf	keep	postflop.Ks7s2d.full.staging_memory_mb	3391.473816	Repeat separate terminal entry points with preflop GPU and budget tests; collect immediate postflop timing/capacity control before CFV lifetime reuse	2026-09-07T04:53:08+00:00
E025BR	preflop_cuda	8f2a92c7b9819ccd729ae1e26060ee4169113cbf	keep	postflop.Ks7h2d.init_ms	1272.236	Repeat separate terminal entry points with preflop GPU and budget tests; collect immediate postflop timing/capacity control before CFV lifetime reuse	2026-09-07T04:53:08+00:00
E025BR	preflop_cuda	8f2a92c7b9819ccd729ae1e26060ee4169113cbf	keep	postflop.Ks7h2d.iteration_ms	52.444	Repeat separate terminal entry points with preflop GPU and budget tests; collect immediate postflop timing/capacity control before CFV lifetime reuse	2026-09-07T04:53:08+00:00
E025BR	preflop_cuda	8f2a92c7b9819ccd729ae1e26060ee4169113cbf	keep	postflop.Ks7h2d.check_ms	35.472	Repeat separate terminal entry points with preflop GPU and budget tests; collect immediate postflop timing/capacity control before CFV lifetime reuse	2026-09-07T04:53:08+00:00
E025BR	preflop_cuda	8f2a92c7b9819ccd729ae1e26060ee4169113cbf	keep	postflop.Ks7s2d.init_ms	850.005	Repeat separate terminal entry points with preflop GPU and budget tests; collect immediate postflop timing/capacity control before CFV lifetime reuse	2026-09-07T04:53:08+00:00
E025BR	preflop_cuda	8f2a92c7b9819ccd729ae1e26060ee4169113cbf	keep	postflop.Ks7s2d.iteration_ms	31.759	Repeat separate terminal entry points with preflop GPU and budget tests; collect immediate postflop timing/capacity control before CFV lifetime reuse	2026-09-07T04:53:08+00:00
E025BR	preflop_cuda	8f2a92c7b9819ccd729ae1e26060ee4169113cbf	keep	postflop.Ks7s2d.check_ms	28.667	Repeat separate terminal entry points with preflop GPU and budget tests; collect immediate postflop timing/capacity control before CFV lifetime reuse	2026-09-07T04:53:08+00:00
E025BR	preflop_cuda	8f2a92c7b9819ccd729ae1e26060ee4169113cbf	keep	postflop.Ks7h2dQhTc.init_ms	64.713	Repeat separate terminal entry points with preflop GPU and budget tests; collect immediate postflop timing/capacity control before CFV lifetime reuse	2026-09-07T04:53:08+00:00
E025BR	preflop_cuda	8f2a92c7b9819ccd729ae1e26060ee4169113cbf	keep	postflop.Ks7h2dQhTc.iteration_ms	0.257	Repeat separate terminal entry points with preflop GPU and budget tests; collect immediate postflop timing/capacity control before CFV lifetime reuse	2026-09-07T04:53:08+00:00
E025BR	preflop_cuda	8f2a92c7b9819ccd729ae1e26060ee4169113cbf	keep	postflop.Ks7h2dQhTc.check_ms	0.594	Repeat separate terminal entry points with preflop GPU and budget tests; collect immediate postflop timing/capacity control before CFV lifetime reuse	2026-09-07T04:53:08+00:00
E025BR	preflop_cuda	8f2a92c7b9819ccd729ae1e26060ee4169113cbf	keep	preflop.2.iteration_ms	0.085	Repeat separate terminal entry points with preflop GPU and budget tests; collect immediate postflop timing/capacity control before CFV lifetime reuse	2026-09-07T04:53:08+00:00
E025BR	preflop_cuda	8f2a92c7b9819ccd729ae1e26060ee4169113cbf	keep	preflop.2.check_ms	0.309	Repeat separate terminal entry points with preflop GPU and budget tests; collect immediate postflop timing/capacity control before CFV lifetime reuse	2026-09-07T04:53:08+00:00
E025BR	preflop_cuda	8f2a92c7b9819ccd729ae1e26060ee4169113cbf	keep	preflop.2.sync_ms	0.023	Repeat separate terminal entry points with preflop GPU and budget tests; collect immediate postflop timing/capacity control before CFV lifetime reuse	2026-09-07T04:53:08+00:00
E025BR	preflop_cuda	8f2a92c7b9819ccd729ae1e26060ee4169113cbf	keep	preflop.6.iteration_ms	16.183	Repeat separate terminal entry points with preflop GPU and budget tests; collect immediate postflop timing/capacity control before CFV lifetime reuse	2026-09-07T04:53:08+00:00
E025BR	preflop_cuda	8f2a92c7b9819ccd729ae1e26060ee4169113cbf	keep	preflop.6.check_ms	11.999	Repeat separate terminal entry points with preflop GPU and budget tests; collect immediate postflop timing/capacity control before CFV lifetime reuse	2026-09-07T04:53:08+00:00
E025BR	preflop_cuda	8f2a92c7b9819ccd729ae1e26060ee4169113cbf	keep	preflop.6.sync_ms	24.731	Repeat separate terminal entry points with preflop GPU and budget tests; collect immediate postflop timing/capacity control before CFV lifetime reuse	2026-09-07T04:53:08+00:00
E025BR	preflop_cuda	8f2a92c7b9819ccd729ae1e26060ee4169113cbf	keep	preflop.8.iteration_ms	60.351	Repeat separate terminal entry points with preflop GPU and budget tests; collect immediate postflop timing/capacity control before CFV lifetime reuse	2026-09-07T04:53:08+00:00
E025BR	preflop_cuda	8f2a92c7b9819ccd729ae1e26060ee4169113cbf	keep	preflop.8.check_ms	38.857	Repeat separate terminal entry points with preflop GPU and budget tests; collect immediate postflop timing/capacity control before CFV lifetime reuse	2026-09-07T04:53:08+00:00
E025BR	preflop_cuda	8f2a92c7b9819ccd729ae1e26060ee4169113cbf	keep	preflop.8.sync_ms	67.14	Repeat separate terminal entry points with preflop GPU and budget tests; collect immediate postflop timing/capacity control before CFV lifetime reuse	2026-09-07T04:53:08+00:00
E026A	memory_transfers	bc699c7195b02a8a9e30d8d54ec6ef2fb3e27ac1	keep	postflop.Ks7h2d.iso.allocated_vram_mb	5905.580032	Rebuild verified current CFV lifetime-reuse source after repairing stale-mtime build caching, then measure capacity, speed and all exact postflop state controls	2026-09-07T04:59:31+00:00
E026A	memory_transfers	bc699c7195b02a8a9e30d8d54ec6ef2fb3e27ac1	keep	postflop.Ks7h2d.iso.estimated_vram_mb	6716.6347	Rebuild verified current CFV lifetime-reuse source after repairing stale-mtime build caching, then measure capacity, speed and all exact postflop state controls	2026-09-07T04:59:31+00:00
E026A	memory_transfers	bc699c7195b02a8a9e30d8d54ec6ef2fb3e27ac1	keep	postflop.Ks7h2d.iso.init_ms	993.1186	Rebuild verified current CFV lifetime-reuse source after repairing stale-mtime build caching, then measure capacity, speed and all exact postflop state controls	2026-09-07T04:59:31+00:00
E026A	memory_transfers	bc699c7195b02a8a9e30d8d54ec6ef2fb3e27ac1	keep	postflop.Ks7h2d.iso.plan_build_ms	111.5767	Rebuild verified current CFV lifetime-reuse source after repairing stale-mtime build caching, then measure capacity, speed and all exact postflop state controls	2026-09-07T04:59:31+00:00
E026A	memory_transfers	bc699c7195b02a8a9e30d8d54ec6ef2fb3e27ac1	keep	postflop.Ks7h2d.iso.staging_memory_mb	3052.063004	Rebuild verified current CFV lifetime-reuse source after repairing stale-mtime build caching, then measure capacity, speed and all exact postflop state controls	2026-09-07T04:59:31+00:00
E026A	memory_transfers	bc699c7195b02a8a9e30d8d54ec6ef2fb3e27ac1	keep	postflop.Ks7s2d.iso.allocated_vram_mb	4731.174912	Rebuild verified current CFV lifetime-reuse source after repairing stale-mtime build caching, then measure capacity, speed and all exact postflop state controls	2026-09-07T04:59:31+00:00
E026A	memory_transfers	bc699c7195b02a8a9e30d8d54ec6ef2fb3e27ac1	keep	postflop.Ks7s2d.iso.estimated_vram_mb	6737.546704	Rebuild verified current CFV lifetime-reuse source after repairing stale-mtime build caching, then measure capacity, speed and all exact postflop state controls	2026-09-07T04:59:31+00:00
E026A	memory_transfers	bc699c7195b02a8a9e30d8d54ec6ef2fb3e27ac1	keep	postflop.Ks7s2d.iso.init_ms	663.1236	Rebuild verified current CFV lifetime-reuse source after repairing stale-mtime build caching, then measure capacity, speed and all exact postflop state controls	2026-09-07T04:59:31+00:00
E026A	memory_transfers	bc699c7195b02a8a9e30d8d54ec6ef2fb3e27ac1	keep	postflop.Ks7s2d.iso.plan_build_ms	93.3129	Rebuild verified current CFV lifetime-reuse source after repairing stale-mtime build caching, then measure capacity, speed and all exact postflop state controls	2026-09-07T04:59:31+00:00
E026A	memory_transfers	bc699c7195b02a8a9e30d8d54ec6ef2fb3e27ac1	keep	postflop.Ks7s2d.iso.staging_memory_mb	1862.657808	Rebuild verified current CFV lifetime-reuse source after repairing stale-mtime build caching, then measure capacity, speed and all exact postflop state controls	2026-09-07T04:59:31+00:00
E026A	memory_transfers	bc699c7195b02a8a9e30d8d54ec6ef2fb3e27ac1	keep	postflop.Ks7s2d.full.allocated_vram_mb	5939.134464	Rebuild verified current CFV lifetime-reuse source after repairing stale-mtime build caching, then measure capacity, speed and all exact postflop state controls	2026-09-07T04:59:31+00:00
E026A	memory_transfers	bc699c7195b02a8a9e30d8d54ec6ef2fb3e27ac1	keep	postflop.Ks7s2d.full.estimated_vram_mb	6737.546704	Rebuild verified current CFV lifetime-reuse source after repairing stale-mtime build caching, then measure capacity, speed and all exact postflop state controls	2026-09-07T04:59:31+00:00
E026A	memory_transfers	bc699c7195b02a8a9e30d8d54ec6ef2fb3e27ac1	keep	postflop.Ks7s2d.full.init_ms	758.6101	Rebuild verified current CFV lifetime-reuse source after repairing stale-mtime build caching, then measure capacity, speed and all exact postflop state controls	2026-09-07T04:59:31+00:00
E026A	memory_transfers	bc699c7195b02a8a9e30d8d54ec6ef2fb3e27ac1	keep	postflop.Ks7s2d.full.plan_build_ms	104.0598	Rebuild verified current CFV lifetime-reuse source after repairing stale-mtime build caching, then measure capacity, speed and all exact postflop state controls	2026-09-07T04:59:31+00:00
E026A	memory_transfers	bc699c7195b02a8a9e30d8d54ec6ef2fb3e27ac1	keep	postflop.Ks7s2d.full.staging_memory_mb	3062.214296	Rebuild verified current CFV lifetime-reuse source after repairing stale-mtime build caching, then measure capacity, speed and all exact postflop state controls	2026-09-07T04:59:31+00:00
E026A	memory_transfers	bc699c7195b02a8a9e30d8d54ec6ef2fb3e27ac1	keep	postflop.Ks7h2d.init_ms	1227.889	Rebuild verified current CFV lifetime-reuse source after repairing stale-mtime build caching, then measure capacity, speed and all exact postflop state controls	2026-09-07T04:59:31+00:00
E026A	memory_transfers	bc699c7195b02a8a9e30d8d54ec6ef2fb3e27ac1	keep	postflop.Ks7h2d.iteration_ms	51.724	Rebuild verified current CFV lifetime-reuse source after repairing stale-mtime build caching, then measure capacity, speed and all exact postflop state controls	2026-09-07T04:59:31+00:00
E026A	memory_transfers	bc699c7195b02a8a9e30d8d54ec6ef2fb3e27ac1	keep	postflop.Ks7h2d.check_ms	34.758	Rebuild verified current CFV lifetime-reuse source after repairing stale-mtime build caching, then measure capacity, speed and all exact postflop state controls	2026-09-07T04:59:31+00:00
E026A	memory_transfers	bc699c7195b02a8a9e30d8d54ec6ef2fb3e27ac1	keep	postflop.Ks7s2d.init_ms	782.305	Rebuild verified current CFV lifetime-reuse source after repairing stale-mtime build caching, then measure capacity, speed and all exact postflop state controls	2026-09-07T04:59:31+00:00
E026A	memory_transfers	bc699c7195b02a8a9e30d8d54ec6ef2fb3e27ac1	keep	postflop.Ks7s2d.iteration_ms	31.379	Rebuild verified current CFV lifetime-reuse source after repairing stale-mtime build caching, then measure capacity, speed and all exact postflop state controls	2026-09-07T04:59:31+00:00
E026A	memory_transfers	bc699c7195b02a8a9e30d8d54ec6ef2fb3e27ac1	keep	postflop.Ks7s2d.check_ms	28.053	Rebuild verified current CFV lifetime-reuse source after repairing stale-mtime build caching, then measure capacity, speed and all exact postflop state controls	2026-09-07T04:59:31+00:00
E026A	memory_transfers	bc699c7195b02a8a9e30d8d54ec6ef2fb3e27ac1	keep	postflop.Ks7h2dQhTc.init_ms	60.782	Rebuild verified current CFV lifetime-reuse source after repairing stale-mtime build caching, then measure capacity, speed and all exact postflop state controls	2026-09-07T04:59:31+00:00
E026A	memory_transfers	bc699c7195b02a8a9e30d8d54ec6ef2fb3e27ac1	keep	postflop.Ks7h2dQhTc.iteration_ms	0.283	Rebuild verified current CFV lifetime-reuse source after repairing stale-mtime build caching, then measure capacity, speed and all exact postflop state controls	2026-09-07T04:59:31+00:00
E026A	memory_transfers	bc699c7195b02a8a9e30d8d54ec6ef2fb3e27ac1	keep	postflop.Ks7h2dQhTc.check_ms	0.547	Rebuild verified current CFV lifetime-reuse source after repairing stale-mtime build caching, then measure capacity, speed and all exact postflop state controls	2026-09-07T04:59:31+00:00
E026R	memory_transfers	bc699c7195b02a8a9e30d8d54ec6ef2fb3e27ac1	keep	postflop.memory.cold.f32.allocated_vram_mb	4731.174912	Repeat CFV lifetime reuse on default compressed lifecycle, validate GPU suite and unchanged fixed postflop accuracy targets	2026-09-07T05:01:53+00:00
E026R	memory_transfers	bc699c7195b02a8a9e30d8d54ec6ef2fb3e27ac1	keep	postflop.memory.cold.f32.host_live_mb	3917.725696	Repeat CFV lifetime reuse on default compressed lifecycle, validate GPU suite and unchanged fixed postflop accuracy targets	2026-09-07T05:01:53+00:00
E026R	memory_transfers	bc699c7195b02a8a9e30d8d54ec6ef2fb3e27ac1	keep	postflop.memory.cold.f32.host_private_mb	9231.069184	Repeat CFV lifetime reuse on default compressed lifecycle, validate GPU suite and unchanged fixed postflop accuracy targets	2026-09-07T05:01:53+00:00
E026R	memory_transfers	bc699c7195b02a8a9e30d8d54ec6ef2fb3e27ac1	keep	postflop.memory.cold.f32.init_ms	697.9680999999999	Repeat CFV lifetime reuse on default compressed lifecycle, validate GPU suite and unchanged fixed postflop accuracy targets	2026-09-07T05:01:53+00:00
E026R	memory_transfers	bc699c7195b02a8a9e30d8d54ec6ef2fb3e27ac1	keep	postflop.memory.cold.f32.strategy_sync_ms	152.418	Repeat CFV lifetime reuse on default compressed lifecycle, validate GPU suite and unchanged fixed postflop accuracy targets	2026-09-07T05:01:53+00:00
E026R	memory_transfers	bc699c7195b02a8a9e30d8d54ec6ef2fb3e27ac1	keep	postflop.memory.cold.f32.sync_ms	311.9439	Repeat CFV lifetime reuse on default compressed lifecycle, validate GPU suite and unchanged fixed postflop accuracy targets	2026-09-07T05:01:53+00:00
E026R	memory_transfers	bc699c7195b02a8a9e30d8d54ec6ef2fb3e27ac1	keep	postflop.memory.warm.f32.allocated_vram_mb	4731.174912	Repeat CFV lifetime reuse on default compressed lifecycle, validate GPU suite and unchanged fixed postflop accuracy targets	2026-09-07T05:01:53+00:00
E026R	memory_transfers	bc699c7195b02a8a9e30d8d54ec6ef2fb3e27ac1	keep	postflop.memory.warm.f32.host_live_mb	3936.702464	Repeat CFV lifetime reuse on default compressed lifecycle, validate GPU suite and unchanged fixed postflop accuracy targets	2026-09-07T05:01:53+00:00
E026R	memory_transfers	bc699c7195b02a8a9e30d8d54ec6ef2fb3e27ac1	keep	postflop.memory.warm.f32.host_private_mb	9246.359552	Repeat CFV lifetime reuse on default compressed lifecycle, validate GPU suite and unchanged fixed postflop accuracy targets	2026-09-07T05:01:53+00:00
E026R	memory_transfers	bc699c7195b02a8a9e30d8d54ec6ef2fb3e27ac1	keep	postflop.memory.warm.f32.init_ms	697.3841	Repeat CFV lifetime reuse on default compressed lifecycle, validate GPU suite and unchanged fixed postflop accuracy targets	2026-09-07T05:01:53+00:00
E026R	memory_transfers	bc699c7195b02a8a9e30d8d54ec6ef2fb3e27ac1	keep	postflop.memory.warm.f32.strategy_sync_ms	155.1129	Repeat CFV lifetime reuse on default compressed lifecycle, validate GPU suite and unchanged fixed postflop accuracy targets	2026-09-07T05:01:53+00:00
E026R	memory_transfers	bc699c7195b02a8a9e30d8d54ec6ef2fb3e27ac1	keep	postflop.memory.warm.f32.sync_ms	314.3326	Repeat CFV lifetime reuse on default compressed lifecycle, validate GPU suite and unchanged fixed postflop accuracy targets	2026-09-07T05:01:53+00:00
E026R	memory_transfers	bc699c7195b02a8a9e30d8d54ec6ef2fb3e27ac1	keep	postflop.memory.cold.compressed.allocated_vram_mb	3623.878656	Repeat CFV lifetime reuse on default compressed lifecycle, validate GPU suite and unchanged fixed postflop accuracy targets	2026-09-07T05:01:53+00:00
E026R	memory_transfers	bc699c7195b02a8a9e30d8d54ec6ef2fb3e27ac1	keep	postflop.memory.cold.compressed.host_live_mb	2303.987712	Repeat CFV lifetime reuse on default compressed lifecycle, validate GPU suite and unchanged fixed postflop accuracy targets	2026-09-07T05:01:53+00:00
E026R	memory_transfers	bc699c7195b02a8a9e30d8d54ec6ef2fb3e27ac1	keep	postflop.memory.cold.compressed.host_private_mb	6506.487808	Repeat CFV lifetime reuse on default compressed lifecycle, validate GPU suite and unchanged fixed postflop accuracy targets	2026-09-07T05:01:53+00:00
