experiment	path	commit	status	metric	value	hypothesis	utc
E032	memory_transfers	ae8bd56fea5db6bdbca543febd0c41d15839842e	keep	preflop.6.build_ms	77.941	Keep terminal values persistent and reuse action CFV scratch between alternate depths with an exact slot table and linear level construction	2026-09-07T05:43:52+00:00
E032	memory_transfers	ae8bd56fea5db6bdbca543febd0c41d15839842e	keep	preflop.6.cpu_arena_mb	224.552328	Keep terminal values persistent and reuse action CFV scratch between alternate depths with an exact slot table and linear level construction	2026-09-07T05:43:52+00:00
E032	memory_transfers	ae8bd56fea5db6bdbca543febd0c41d15839842e	keep	preflop.6.estimated_vram_mb	558.527272	Keep terminal values persistent and reuse action CFV scratch between alternate depths with an exact slot table and linear level construction	2026-09-07T05:43:52+00:00
E032	memory_transfers	ae8bd56fea5db6bdbca543febd0c41d15839842e	keep	preflop.6.init_ms	146.671	Keep terminal values persistent and reuse action CFV scratch between alternate depths with an exact slot table and linear level construction	2026-09-07T05:43:52+00:00
E032	memory_transfers	ae8bd56fea5db6bdbca543febd0c41d15839842e	keep	preflop.8.allocated_vram_mb	1308.622848	Keep terminal values persistent and reuse action CFV scratch between alternate depths with an exact slot table and linear level construction	2026-09-07T05:43:52+00:00
E032	memory_transfers	ae8bd56fea5db6bdbca543febd0c41d15839842e	keep	preflop.8.build_ms	208.0391	Keep terminal values persistent and reuse action CFV scratch between alternate depths with an exact slot table and linear level construction	2026-09-07T05:43:52+00:00
E032	memory_transfers	ae8bd56fea5db6bdbca543febd0c41d15839842e	keep	preflop.8.cpu_arena_mb	587.239848	Keep terminal values persistent and reuse action CFV scratch between alternate depths with an exact slot table and linear level construction	2026-09-07T05:43:52+00:00
E032	memory_transfers	ae8bd56fea5db6bdbca543febd0c41d15839842e	keep	preflop.8.estimated_vram_mb	1357.2225680000001	Keep terminal values persistent and reuse action CFV scratch between alternate depths with an exact slot table and linear level construction	2026-09-07T05:43:52+00:00
E032	memory_transfers	ae8bd56fea5db6bdbca543febd0c41d15839842e	keep	preflop.8.init_ms	237.1321	Keep terminal values persistent and reuse action CFV scratch between alternate depths with an exact slot table and linear level construction	2026-09-07T05:43:52+00:00
E032	memory_transfers	ae8bd56fea5db6bdbca543febd0c41d15839842e	keep	preflop.2.iteration_ms	0.079	Keep terminal values persistent and reuse action CFV scratch between alternate depths with an exact slot table and linear level construction	2026-09-07T05:43:52+00:00
E032	memory_transfers	ae8bd56fea5db6bdbca543febd0c41d15839842e	keep	preflop.2.check_ms	0.209	Keep terminal values persistent and reuse action CFV scratch between alternate depths with an exact slot table and linear level construction	2026-09-07T05:43:52+00:00
E032	memory_transfers	ae8bd56fea5db6bdbca543febd0c41d15839842e	keep	preflop.2.sync_ms	0.02	Keep terminal values persistent and reuse action CFV scratch between alternate depths with an exact slot table and linear level construction	2026-09-07T05:43:52+00:00
E032	memory_transfers	ae8bd56fea5db6bdbca543febd0c41d15839842e	keep	preflop.6.iteration_ms	16.71	Keep terminal values persistent and reuse action CFV scratch between alternate depths with an exact slot table and linear level construction	2026-09-07T05:43:52+00:00
E032	memory_transfers	ae8bd56fea5db6bdbca543febd0c41d15839842e	keep	preflop.6.check_ms	12.316	Keep terminal values persistent and reuse action CFV scratch between alternate depths with an exact slot table and linear level construction	2026-09-07T05:43:52+00:00
E032	memory_transfers	ae8bd56fea5db6bdbca543febd0c41d15839842e	keep	preflop.6.sync_ms	27.029	Keep terminal values persistent and reuse action CFV scratch between alternate depths with an exact slot table and linear level construction	2026-09-07T05:43:52+00:00
E032	memory_transfers	ae8bd56fea5db6bdbca543febd0c41d15839842e	keep	preflop.8.iteration_ms	58.319	Keep terminal values persistent and reuse action CFV scratch between alternate depths with an exact slot table and linear level construction	2026-09-07T05:43:52+00:00
E032	memory_transfers	ae8bd56fea5db6bdbca543febd0c41d15839842e	keep	preflop.8.check_ms	39.397	Keep terminal values persistent and reuse action CFV scratch between alternate depths with an exact slot table and linear level construction	2026-09-07T05:43:52+00:00
E032	memory_transfers	ae8bd56fea5db6bdbca543febd0c41d15839842e	keep	preflop.8.sync_ms	66.947	Keep terminal values persistent and reuse action CFV scratch between alternate depths with an exact slot table and linear level construction	2026-09-07T05:43:52+00:00
E032R	memory_transfers	ae8bd56fea5db6bdbca543febd0c41d15839842e	keep	preflop.6.allocated_vram_mb	503.31648	Repeat compact preflop values with fixed convergence stopping and CUDA equivalence	2026-09-07T05:45:32+00:00
E032R	memory_transfers	ae8bd56fea5db6bdbca543febd0c41d15839842e	keep	preflop.6.build_ms	78.336	Repeat compact preflop values with fixed convergence stopping and CUDA equivalence	2026-09-07T05:45:32+00:00
E032R	memory_transfers	ae8bd56fea5db6bdbca543febd0c41d15839842e	keep	preflop.6.cpu_arena_mb	224.552328	Repeat compact preflop values with fixed convergence stopping and CUDA equivalence	2026-09-07T05:45:32+00:00
E032R	memory_transfers	ae8bd56fea5db6bdbca543febd0c41d15839842e	keep	preflop.6.estimated_vram_mb	558.527272	Repeat compact preflop values with fixed convergence stopping and CUDA equivalence	2026-09-07T05:45:32+00:00
E032R	memory_transfers	ae8bd56fea5db6bdbca543febd0c41d15839842e	keep	preflop.6.init_ms	138.59959999999998	Repeat compact preflop values with fixed convergence stopping and CUDA equivalence	2026-09-07T05:45:32+00:00
E032R	memory_transfers	ae8bd56fea5db6bdbca543febd0c41d15839842e	keep	preflop.8.allocated_vram_mb	1308.622848	Repeat compact preflop values with fixed convergence stopping and CUDA equivalence	2026-09-07T05:45:32+00:00
E032R	memory_transfers	ae8bd56fea5db6bdbca543febd0c41d15839842e	keep	preflop.8.build_ms	212.7641	Repeat compact preflop values with fixed convergence stopping and CUDA equivalence	2026-09-07T05:45:32+00:00
E032R	memory_transfers	ae8bd56fea5db6bdbca543febd0c41d15839842e	keep	preflop.8.cpu_arena_mb	587.239848	Repeat compact preflop values with fixed convergence stopping and CUDA equivalence	2026-09-07T05:45:32+00:00
E032R	memory_transfers	ae8bd56fea5db6bdbca543febd0c41d15839842e	keep	preflop.8.estimated_vram_mb	1357.2225680000001	Repeat compact preflop values with fixed convergence stopping and CUDA equivalence	2026-09-07T05:45:32+00:00
E032R	memory_transfers	ae8bd56fea5db6bdbca543febd0c41d15839842e	keep	preflop.8.init_ms	217.7318	Repeat compact preflop values with fixed convergence stopping and CUDA equivalence	2026-09-07T05:45:32+00:00
E032R	memory_transfers	ae8bd56fea5db6bdbca543febd0c41d15839842e	keep	preflop.2.iteration_ms	0.082	Repeat compact preflop values with fixed convergence stopping and CUDA equivalence	2026-09-07T05:45:32+00:00
E032R	memory_transfers	ae8bd56fea5db6bdbca543febd0c41d15839842e	keep	preflop.2.check_ms	0.283	Repeat compact preflop values with fixed convergence stopping and CUDA equivalence	2026-09-07T05:45:32+00:00
E032R	memory_transfers	ae8bd56fea5db6bdbca543febd0c41d15839842e	keep	preflop.2.sync_ms	0.018	Repeat compact preflop values with fixed convergence stopping and CUDA equivalence	2026-09-07T05:45:32+00:00
E032R	memory_transfers	ae8bd56fea5db6bdbca543febd0c41d15839842e	keep	preflop.6.iteration_ms	16.474	Repeat compact preflop values with fixed convergence stopping and CUDA equivalence	2026-09-07T05:45:32+00:00
E032R	memory_transfers	ae8bd56fea5db6bdbca543febd0c41d15839842e	keep	preflop.6.check_ms	11.629	Repeat compact preflop values with fixed convergence stopping and CUDA equivalence	2026-09-07T05:45:32+00:00
E032R	memory_transfers	ae8bd56fea5db6bdbca543febd0c41d15839842e	keep	preflop.6.sync_ms	29.096	Repeat compact preflop values with fixed convergence stopping and CUDA equivalence	2026-09-07T05:45:32+00:00
E032R	memory_transfers	ae8bd56fea5db6bdbca543febd0c41d15839842e	keep	preflop.8.iteration_ms	57.946	Repeat compact preflop values with fixed convergence stopping and CUDA equivalence	2026-09-07T05:45:32+00:00
E032R	memory_transfers	ae8bd56fea5db6bdbca543febd0c41d15839842e	keep	preflop.8.check_ms	39.74	Repeat compact preflop values with fixed convergence stopping and CUDA equivalence	2026-09-07T05:45:32+00:00
E032R	memory_transfers	ae8bd56fea5db6bdbca543febd0c41d15839842e	keep	preflop.8.sync_ms	66.138	Repeat compact preflop values with fixed convergence stopping and CUDA equivalence	2026-09-07T05:45:32+00:00
E032R	memory_transfers	ae8bd56fea5db6bdbca543febd0c41d15839842e	keep	preflop.6.target_seconds	2.9564696	Repeat compact preflop values with fixed convergence stopping and CUDA equivalence	2026-09-07T05:45:32+00:00
E032R	memory_transfers	ae8bd56fea5db6bdbca543febd0c41d15839842e	keep	preflop.8.target_seconds	7.4261381	Repeat compact preflop values with fixed convergence stopping and CUDA equivalence	2026-09-07T05:45:32+00:00
B033	baseline	2781e2b67dae08330f267bd48663a82d4c940bfa	baseline	postflop.Ks7h2d.init_ms	1105.904	Freeze generic3/5/7/9-seat full-state baseline and refresh postflop iteration control before narrower CUDA trials	2026-09-07T05:49:34+00:00
B033	baseline	2781e2b67dae08330f267bd48663a82d4c940bfa	baseline	postflop.Ks7h2d.iteration_ms	51.841	Freeze generic3/5/7/9-seat full-state baseline and refresh postflop iteration control before narrower CUDA trials	2026-09-07T05:49:34+00:00
B033	baseline	2781e2b67dae08330f267bd48663a82d4c940bfa	baseline	postflop.Ks7h2d.check_ms	34.858	Freeze generic3/5/7/9-seat full-state baseline and refresh postflop iteration control before narrower CUDA trials	2026-09-07T05:49:34+00:00
B033	baseline	2781e2b67dae08330f267bd48663a82d4c940bfa	baseline	postflop.Ks7s2d.init_ms	831.082	Freeze generic3/5/7/9-seat full-state baseline and refresh postflop iteration control before narrower CUDA trials	2026-09-07T05:49:34+00:00
B033	baseline	2781e2b67dae08330f267bd48663a82d4c940bfa	baseline	postflop.Ks7s2d.iteration_ms	31.208	Freeze generic3/5/7/9-seat full-state baseline and refresh postflop iteration control before narrower CUDA trials	2026-09-07T05:49:34+00:00
B033	baseline	2781e2b67dae08330f267bd48663a82d4c940bfa	baseline	postflop.Ks7s2d.check_ms	28.182	Freeze generic3/5/7/9-seat full-state baseline and refresh postflop iteration control before narrower CUDA trials	2026-09-07T05:49:34+00:00
B033	baseline	2781e2b67dae08330f267bd48663a82d4c940bfa	baseline	postflop.Ks7h2dQhTc.init_ms	68.056	Freeze generic3/5/7/9-seat full-state baseline and refresh postflop iteration control before narrower CUDA trials	2026-09-07T05:49:34+00:00
B033	baseline	2781e2b67dae08330f267bd48663a82d4c940bfa	baseline	postflop.Ks7h2dQhTc.iteration_ms	0.284	Freeze generic3/5/7/9-seat full-state baseline and refresh postflop iteration control before narrower CUDA trials	2026-09-07T05:49:34+00:00
B033	baseline	2781e2b67dae08330f267bd48663a82d4c940bfa	baseline	postflop.Ks7h2dQhTc.check_ms	0.599	Freeze generic3/5/7/9-seat full-state baseline and refresh postflop iteration control before narrower CUDA trials	2026-09-07T05:49:34+00:00
B033	baseline	2781e2b67dae08330f267bd48663a82d4c940bfa	baseline	preflop.3.iteration_ms	0.2	Freeze generic3/5/7/9-seat full-state baseline and refresh postflop iteration control before narrower CUDA trials	2026-09-07T05:49:34+00:00
B033	baseline	2781e2b67dae08330f267bd48663a82d4c940bfa	baseline	preflop.3.check_ms	0.527	Freeze generic3/5/7/9-seat full-state baseline and refresh postflop iteration control before narrower CUDA trials	2026-09-07T05:49:34+00:00
B033	baseline	2781e2b67dae08330f267bd48663a82d4c940bfa	baseline	preflop.3.sync_ms	0.072	Freeze generic3/5/7/9-seat full-state baseline and refresh postflop iteration control before narrower CUDA trials	2026-09-07T05:49:34+00:00
B033	baseline	2781e2b67dae08330f267bd48663a82d4c940bfa	baseline	preflop.5.iteration_ms	2.733	Freeze generic3/5/7/9-seat full-state baseline and refresh postflop iteration control before narrower CUDA trials	2026-09-07T05:49:34+00:00
B033	baseline	2781e2b67dae08330f267bd48663a82d4c940bfa	baseline	preflop.5.check_ms	2.569	Freeze generic3/5/7/9-seat full-state baseline and refresh postflop iteration control before narrower CUDA trials	2026-09-07T05:49:34+00:00
B033	baseline	2781e2b67dae08330f267bd48663a82d4c940bfa	baseline	preflop.5.sync_ms	9.799	Freeze generic3/5/7/9-seat full-state baseline and refresh postflop iteration control before narrower CUDA trials	2026-09-07T05:49:34+00:00
B033	baseline	2781e2b67dae08330f267bd48663a82d4c940bfa	baseline	preflop.7.iteration_ms	13.092	Freeze generic3/5/7/9-seat full-state baseline and refresh postflop iteration control before narrower CUDA trials	2026-09-07T05:49:34+00:00
B033	baseline	2781e2b67dae08330f267bd48663a82d4c940bfa	baseline	preflop.7.check_ms	9.167	Freeze generic3/5/7/9-seat full-state baseline and refresh postflop iteration control before narrower CUDA trials	2026-09-07T05:49:34+00:00
B033	baseline	2781e2b67dae08330f267bd48663a82d4c940bfa	baseline	preflop.7.sync_ms	15.824	Freeze generic3/5/7/9-seat full-state baseline and refresh postflop iteration control before narrower CUDA trials	2026-09-07T05:49:34+00:00
B033	baseline	2781e2b67dae08330f267bd48663a82d4c940bfa	baseline	preflop.9.iteration_ms	290.68	Freeze generic3/5/7/9-seat full-state baseline and refresh postflop iteration control before narrower CUDA trials	2026-09-07T05:49:34+00:00
B033	baseline	2781e2b67dae08330f267bd48663a82d4c940bfa	baseline	preflop.9.check_ms	197.123	Freeze generic3/5/7/9-seat full-state baseline and refresh postflop iteration control before narrower CUDA trials	2026-09-07T05:49:34+00:00
B033	baseline	2781e2b67dae08330f267bd48663a82d4c940bfa	baseline	preflop.9.sync_ms	283.644	Freeze generic3/5/7/9-seat full-state baseline and refresh postflop iteration control before narrower CUDA trials	2026-09-07T05:49:34+00:00
E033	preflop_cuda	324a69097dfce7a2a876a8f7b8fb645fd2bd128f	keep	preflop.3.iteration_ms	0.23	Use shared terminal masses only for generic3/5/7/9-seat kernels while preserving specialized common kernels	2026-09-07T05:51:23+00:00
E033	preflop_cuda	324a69097dfce7a2a876a8f7b8fb645fd2bd128f	keep	preflop.3.check_ms	0.525	Use shared terminal masses only for generic3/5/7/9-seat kernels while preserving specialized common kernels	2026-09-07T05:51:23+00:00
E033	preflop_cuda	324a69097dfce7a2a876a8f7b8fb645fd2bd128f	keep	preflop.3.sync_ms	0.063	Use shared terminal masses only for generic3/5/7/9-seat kernels while preserving specialized common kernels	2026-09-07T05:51:23+00:00
E033	preflop_cuda	324a69097dfce7a2a876a8f7b8fb645fd2bd128f	keep	preflop.5.iteration_ms	2.754	Use shared terminal masses only for generic3/5/7/9-seat kernels while preserving specialized common kernels	2026-09-07T05:51:23+00:00
E033	preflop_cuda	324a69097dfce7a2a876a8f7b8fb645fd2bd128f	keep	preflop.5.check_ms	2.538	Use shared terminal masses only for generic3/5/7/9-seat kernels while preserving specialized common kernels	2026-09-07T05:51:23+00:00
E033	preflop_cuda	324a69097dfce7a2a876a8f7b8fb645fd2bd128f	keep	preflop.5.sync_ms	4.136	Use shared terminal masses only for generic3/5/7/9-seat kernels while preserving specialized common kernels	2026-09-07T05:51:23+00:00
E033	preflop_cuda	324a69097dfce7a2a876a8f7b8fb645fd2bd128f	keep	preflop.7.iteration_ms	12.328	Use shared terminal masses only for generic3/5/7/9-seat kernels while preserving specialized common kernels	2026-09-07T05:51:23+00:00
E033	preflop_cuda	324a69097dfce7a2a876a8f7b8fb645fd2bd128f	keep	preflop.7.check_ms	8.582	Use shared terminal masses only for generic3/5/7/9-seat kernels while preserving specialized common kernels	2026-09-07T05:51:23+00:00
E033	preflop_cuda	324a69097dfce7a2a876a8f7b8fb645fd2bd128f	keep	preflop.7.sync_ms	16.566	Use shared terminal masses only for generic3/5/7/9-seat kernels while preserving specialized common kernels	2026-09-07T05:51:23+00:00
E033	preflop_cuda	324a69097dfce7a2a876a8f7b8fb645fd2bd128f	keep	preflop.9.iteration_ms	251.787	Use shared terminal masses only for generic3/5/7/9-seat kernels while preserving specialized common kernels	2026-09-07T05:51:23+00:00
E033	preflop_cuda	324a69097dfce7a2a876a8f7b8fb645fd2bd128f	keep	preflop.9.check_ms	161.789	Use shared terminal masses only for generic3/5/7/9-seat kernels while preserving specialized common kernels	2026-09-07T05:51:23+00:00
E033	preflop_cuda	324a69097dfce7a2a876a8f7b8fb645fd2bd128f	keep	preflop.9.sync_ms	293.842	Use shared terminal masses only for generic3/5/7/9-seat kernels while preserving specialized common kernels	2026-09-07T05:51:23+00:00
E033	preflop_cuda	324a69097dfce7a2a876a8f7b8fb645fd2bd128f	keep	preflop.2.iteration_ms	0.081	Use shared terminal masses only for generic3/5/7/9-seat kernels while preserving specialized common kernels	2026-09-07T05:51:23+00:00
E033	preflop_cuda	324a69097dfce7a2a876a8f7b8fb645fd2bd128f	keep	preflop.2.check_ms	0.26	Use shared terminal masses only for generic3/5/7/9-seat kernels while preserving specialized common kernels	2026-09-07T05:51:23+00:00
E033	preflop_cuda	324a69097dfce7a2a876a8f7b8fb645fd2bd128f	keep	preflop.2.sync_ms	0.017	Use shared terminal masses only for generic3/5/7/9-seat kernels while preserving specialized common kernels	2026-09-07T05:51:23+00:00
E033	preflop_cuda	324a69097dfce7a2a876a8f7b8fb645fd2bd128f	keep	preflop.6.iteration_ms	16.592	Use shared terminal masses only for generic3/5/7/9-seat kernels while preserving specialized common kernels	2026-09-07T05:51:23+00:00
E033	preflop_cuda	324a69097dfce7a2a876a8f7b8fb645fd2bd128f	keep	preflop.6.check_ms	12.162	Use shared terminal masses only for generic3/5/7/9-seat kernels while preserving specialized common kernels	2026-09-07T05:51:23+00:00
E033	preflop_cuda	324a69097dfce7a2a876a8f7b8fb645fd2bd128f	keep	preflop.6.sync_ms	26.62	Use shared terminal masses only for generic3/5/7/9-seat kernels while preserving specialized common kernels	2026-09-07T05:51:23+00:00
E033	preflop_cuda	324a69097dfce7a2a876a8f7b8fb645fd2bd128f	keep	preflop.8.iteration_ms	57.988	Use shared terminal masses only for generic3/5/7/9-seat kernels while preserving specialized common kernels	2026-09-07T05:51:23+00:00
E033	preflop_cuda	324a69097dfce7a2a876a8f7b8fb645fd2bd128f	keep	preflop.8.check_ms	39.808	Use shared terminal masses only for generic3/5/7/9-seat kernels while preserving specialized common kernels	2026-09-07T05:51:23+00:00
E033	preflop_cuda	324a69097dfce7a2a876a8f7b8fb645fd2bd128f	keep	preflop.8.sync_ms	69.246	Use shared terminal masses only for generic3/5/7/9-seat kernels while preserving specialized common kernels	2026-09-07T05:51:23+00:00
E033B	preflop_cuda	c6cf909eaa1c99786b186915ebc007a880f07437	discard	preflop.3.iteration_ms	0.227	Compare direct compile-time seat specialization against shared generic terminal uniforms for all supported seats	2026-09-07T05:53:52+00:00
E033B	preflop_cuda	c6cf909eaa1c99786b186915ebc007a880f07437	discard	preflop.3.check_ms	0.527	Compare direct compile-time seat specialization against shared generic terminal uniforms for all supported seats	2026-09-07T05:53:52+00:00
E033B	preflop_cuda	c6cf909eaa1c99786b186915ebc007a880f07437	discard	preflop.3.sync_ms	0.068	Compare direct compile-time seat specialization against shared generic terminal uniforms for all supported seats	2026-09-07T05:53:52+00:00
E033B	preflop_cuda	c6cf909eaa1c99786b186915ebc007a880f07437	discard	preflop.5.iteration_ms	2.739	Compare direct compile-time seat specialization against shared generic terminal uniforms for all supported seats	2026-09-07T05:53:52+00:00
E033B	preflop_cuda	c6cf909eaa1c99786b186915ebc007a880f07437	discard	preflop.5.check_ms	2.996	Compare direct compile-time seat specialization against shared generic terminal uniforms for all supported seats	2026-09-07T05:53:52+00:00
E033B	preflop_cuda	c6cf909eaa1c99786b186915ebc007a880f07437	discard	preflop.5.sync_ms	3.891	Compare direct compile-time seat specialization against shared generic terminal uniforms for all supported seats	2026-09-07T05:53:52+00:00
E033B	preflop_cuda	c6cf909eaa1c99786b186915ebc007a880f07437	discard	preflop.7.iteration_ms	12.488	Compare direct compile-time seat specialization against shared generic terminal uniforms for all supported seats	2026-09-07T05:53:52+00:00
E033B	preflop_cuda	c6cf909eaa1c99786b186915ebc007a880f07437	discard	preflop.7.check_ms	9.157	Compare direct compile-time seat specialization against shared generic terminal uniforms for all supported seats	2026-09-07T05:53:52+00:00
E033B	preflop_cuda	c6cf909eaa1c99786b186915ebc007a880f07437	discard	preflop.7.sync_ms	15.596	Compare direct compile-time seat specialization against shared generic terminal uniforms for all supported seats	2026-09-07T05:53:52+00:00
E033B	preflop_cuda	c6cf909eaa1c99786b186915ebc007a880f07437	discard	preflop.9.iteration_ms	262.141	Compare direct compile-time seat specialization against shared generic terminal uniforms for all supported seats	2026-09-07T05:53:52+00:00
E033B	preflop_cuda	c6cf909eaa1c99786b186915ebc007a880f07437	discard	preflop.9.check_ms	181.62	Compare direct compile-time seat specialization against shared generic terminal uniforms for all supported seats	2026-09-07T05:53:52+00:00
E033B	preflop_cuda	c6cf909eaa1c99786b186915ebc007a880f07437	discard	preflop.9.sync_ms	285.448	Compare direct compile-time seat specialization against shared generic terminal uniforms for all supported seats	2026-09-07T05:53:52+00:00
E033B	preflop_cuda	c6cf909eaa1c99786b186915ebc007a880f07437	discard	preflop.2.iteration_ms	0.107	Compare direct compile-time seat specialization against shared generic terminal uniforms for all supported seats	2026-09-07T05:53:52+00:00
