experiment	path	commit	status	metric	value	hypothesis	utc
E011D	postflop_cuda	e30c0f3cfe446c194dfcc1b2d8137098a62951f1	keep	postflop.Ks7h2d.iteration_ms	58.899	Remove fold atomics with indexed fixed-order sums at the existing f32 precision	2026-09-07T02:04:14+00:00
E011D	postflop_cuda	e30c0f3cfe446c194dfcc1b2d8137098a62951f1	keep	postflop.Ks7h2d.check_ms	36.224	Remove fold atomics with indexed fixed-order sums at the existing f32 precision	2026-09-07T02:04:14+00:00
E011D	postflop_cuda	e30c0f3cfe446c194dfcc1b2d8137098a62951f1	keep	postflop.Ks7s2d.init_ms	768.642	Remove fold atomics with indexed fixed-order sums at the existing f32 precision	2026-09-07T02:04:14+00:00
E011D	postflop_cuda	e30c0f3cfe446c194dfcc1b2d8137098a62951f1	keep	postflop.Ks7s2d.iteration_ms	34.254	Remove fold atomics with indexed fixed-order sums at the existing f32 precision	2026-09-07T02:04:14+00:00
E011D	postflop_cuda	e30c0f3cfe446c194dfcc1b2d8137098a62951f1	keep	postflop.Ks7s2d.check_ms	30.277	Remove fold atomics with indexed fixed-order sums at the existing f32 precision	2026-09-07T02:04:14+00:00
E011D	postflop_cuda	e30c0f3cfe446c194dfcc1b2d8137098a62951f1	keep	postflop.Ks7h2dQhTc.init_ms	80.328	Remove fold atomics with indexed fixed-order sums at the existing f32 precision	2026-09-07T02:04:14+00:00
E011D	postflop_cuda	e30c0f3cfe446c194dfcc1b2d8137098a62951f1	keep	postflop.Ks7h2dQhTc.iteration_ms	0.302	Remove fold atomics with indexed fixed-order sums at the existing f32 precision	2026-09-07T02:04:14+00:00
E011D	postflop_cuda	e30c0f3cfe446c194dfcc1b2d8137098a62951f1	keep	postflop.Ks7h2dQhTc.check_ms	0.736	Remove fold atomics with indexed fixed-order sums at the existing f32 precision	2026-09-07T02:04:14+00:00
E011DR	postflop_cuda	1ec2683d9135f38b49d3e0c120dadbb086b50230	keep	postflop.Ks7h2d.target_seconds	11.882	Verify repeatable learning and time to the same 0.3-percent exploitability with fixed-order f32 folds	2026-09-07T02:06:29+00:00
E011DR	postflop_cuda	1ec2683d9135f38b49d3e0c120dadbb086b50230	keep	postflop.Ks7s2d.target_seconds	7.149	Verify repeatable learning and time to the same 0.3-percent exploitability with fixed-order f32 folds	2026-09-07T02:06:29+00:00
E011DR	postflop_cuda	1ec2683d9135f38b49d3e0c120dadbb086b50230	keep	postflop.Ks7h2dQhTc.target_seconds	0.021	Verify repeatable learning and time to the same 0.3-percent exploitability with fixed-order f32 folds	2026-09-07T02:06:29+00:00
B009	baseline	4b77be8117502022b03a13ddbba41f5d795c1765	baseline	lifecycle.raking_ms	5.6832	Original profile raking across 512 fixed dense, sparse, zero-reach and zero-target cases	2026-09-07T02:07:24+00:00
E011DR2	postflop_cuda	4b77be8117502022b03a13ddbba41f5d795c1765	keep	postflop.Ks7h2d.init_ms	1042.241	Warm fixed-iteration repeat of deterministic fold sums after all accuracy and reproducibility checks passed	2026-09-07T02:07:54+00:00
E011DR2	postflop_cuda	4b77be8117502022b03a13ddbba41f5d795c1765	keep	postflop.Ks7h2d.iteration_ms	56.643	Warm fixed-iteration repeat of deterministic fold sums after all accuracy and reproducibility checks passed	2026-09-07T02:07:54+00:00
E011DR2	postflop_cuda	4b77be8117502022b03a13ddbba41f5d795c1765	keep	postflop.Ks7h2d.check_ms	35.059	Warm fixed-iteration repeat of deterministic fold sums after all accuracy and reproducibility checks passed	2026-09-07T02:07:54+00:00
E011DR2	postflop_cuda	4b77be8117502022b03a13ddbba41f5d795c1765	keep	postflop.Ks7s2d.init_ms	858.983	Warm fixed-iteration repeat of deterministic fold sums after all accuracy and reproducibility checks passed	2026-09-07T02:07:54+00:00
E011DR2	postflop_cuda	4b77be8117502022b03a13ddbba41f5d795c1765	keep	postflop.Ks7s2d.iteration_ms	33.599	Warm fixed-iteration repeat of deterministic fold sums after all accuracy and reproducibility checks passed	2026-09-07T02:07:54+00:00
E011DR2	postflop_cuda	4b77be8117502022b03a13ddbba41f5d795c1765	keep	postflop.Ks7s2d.check_ms	28.463	Warm fixed-iteration repeat of deterministic fold sums after all accuracy and reproducibility checks passed	2026-09-07T02:07:54+00:00
E011DR2	postflop_cuda	4b77be8117502022b03a13ddbba41f5d795c1765	keep	postflop.Ks7h2dQhTc.init_ms	73.606	Warm fixed-iteration repeat of deterministic fold sums after all accuracy and reproducibility checks passed	2026-09-07T02:07:54+00:00
E011DR2	postflop_cuda	4b77be8117502022b03a13ddbba41f5d795c1765	keep	postflop.Ks7h2dQhTc.iteration_ms	0.313	Warm fixed-iteration repeat of deterministic fold sums after all accuracy and reproducibility checks passed	2026-09-07T02:07:54+00:00
E011DR2	postflop_cuda	4b77be8117502022b03a13ddbba41f5d795c1765	keep	postflop.Ks7h2dQhTc.check_ms	0.662	Warm fixed-iteration repeat of deterministic fold sums after all accuracy and reproducibility checks passed	2026-09-07T02:07:54+00:00
E012	reports_profiles	2e4ae15ce344b3c8e359cb9aa2d8868072149216	keep	lifecycle.raking_ms	4.629099999999999	Specialize two-, three- and four-action raking without changing any arithmetic order	2026-09-07T02:09:06+00:00
E012R	reports_profiles	2e4ae15ce344b3c8e359cb9aa2d8868072149216	keep	cpu.preflop.arena_mb	224.552328	Measure specialized raking in full profile generation and verify report/profile/state fingerprints	2026-09-07T02:10:13+00:00
E012R	reports_profiles	2e4ae15ce344b3c8e359cb9aa2d8868072149216	keep	cpu.preflop.check_ms	339.3351	Measure specialized raking in full profile generation and verify report/profile/state fingerprints	2026-09-07T02:10:13+00:00
E012R	reports_profiles	2e4ae15ce344b3c8e359cb9aa2d8868072149216	keep	cpu.preflop.iteration_ms	78.79948	Measure specialized raking in full profile generation and verify report/profile/state fingerprints	2026-09-07T02:10:13+00:00
E012R	reports_profiles	2e4ae15ce344b3c8e359cb9aa2d8868072149216	keep	cpu.postflop.arena_mb	104.204192	Measure specialized raking in full profile generation and verify report/profile/state fingerprints	2026-09-07T02:10:13+00:00
E012R	reports_profiles	2e4ae15ce344b3c8e359cb9aa2d8868072149216	keep	cpu.postflop.iteration_ms	33.886919999999996	Measure specialized raking in full profile generation and verify report/profile/state fingerprints	2026-09-07T02:10:13+00:00
E012R	reports_profiles	2e4ae15ce344b3c8e359cb9aa2d8868072149216	keep	lifecycle.build_ms	7.7875000000000005	Measure specialized raking in full profile generation and verify report/profile/state fingerprints	2026-09-07T02:10:13+00:00
E012R	reports_profiles	2e4ae15ce344b3c8e359cb9aa2d8868072149216	keep	lifecycle.compressed_load_ms	103.52749999999999	Measure specialized raking in full profile generation and verify report/profile/state fingerprints	2026-09-07T02:10:13+00:00
E012R	reports_profiles	2e4ae15ce344b3c8e359cb9aa2d8868072149216	keep	lifecycle.load_ms	48.7379	Measure specialized raking in full profile generation and verify report/profile/state fingerprints	2026-09-07T02:10:13+00:00
E012R	reports_profiles	2e4ae15ce344b3c8e359cb9aa2d8868072149216	keep	lifecycle.profile_ms	592.6199	Measure specialized raking in full profile generation and verify report/profile/state fingerprints	2026-09-07T02:10:13+00:00
E012R	reports_profiles	2e4ae15ce344b3c8e359cb9aa2d8868072149216	keep	lifecycle.report_lines_ms	88.95870000000001	Measure specialized raking in full profile generation and verify report/profile/state fingerprints	2026-09-07T02:10:13+00:00
E012R	reports_profiles	2e4ae15ce344b3c8e359cb9aa2d8868072149216	keep	lifecycle.save_mb	104.204944	Measure specialized raking in full profile generation and verify report/profile/state fingerprints	2026-09-07T02:10:13+00:00
E012R	reports_profiles	2e4ae15ce344b3c8e359cb9aa2d8868072149216	keep	lifecycle.save_ms	221.0937	Measure specialized raking in full profile generation and verify report/profile/state fingerprints	2026-09-07T02:10:13+00:00
E012R2	reports_profiles	2e4ae15ce344b3c8e359cb9aa2d8868072149216	keep	cpu.postflop.arena_mb	104.204192	Repeat full profile specialization workload with immutable profile and solver fingerprints	2026-09-07T02:11:21+00:00
E012R2	reports_profiles	2e4ae15ce344b3c8e359cb9aa2d8868072149216	keep	cpu.postflop.iteration_ms	29.792800000000003	Repeat full profile specialization workload with immutable profile and solver fingerprints	2026-09-07T02:11:21+00:00
E012R2	reports_profiles	2e4ae15ce344b3c8e359cb9aa2d8868072149216	keep	lifecycle.build_ms	10.1053	Repeat full profile specialization workload with immutable profile and solver fingerprints	2026-09-07T02:11:21+00:00
E012R2	reports_profiles	2e4ae15ce344b3c8e359cb9aa2d8868072149216	keep	lifecycle.compressed_load_ms	93.786	Repeat full profile specialization workload with immutable profile and solver fingerprints	2026-09-07T02:11:21+00:00
E012R2	reports_profiles	2e4ae15ce344b3c8e359cb9aa2d8868072149216	keep	lifecycle.load_ms	42.166799999999995	Repeat full profile specialization workload with immutable profile and solver fingerprints	2026-09-07T02:11:21+00:00
E012R2	reports_profiles	2e4ae15ce344b3c8e359cb9aa2d8868072149216	keep	lifecycle.profile_ms	579.7951999999999	Repeat full profile specialization workload with immutable profile and solver fingerprints	2026-09-07T02:11:21+00:00
E012R2	reports_profiles	2e4ae15ce344b3c8e359cb9aa2d8868072149216	keep	lifecycle.report_lines_ms	70.8613	Repeat full profile specialization workload with immutable profile and solver fingerprints	2026-09-07T02:11:21+00:00
E012R2	reports_profiles	2e4ae15ce344b3c8e359cb9aa2d8868072149216	keep	lifecycle.save_mb	104.204944	Repeat full profile specialization workload with immutable profile and solver fingerprints	2026-09-07T02:11:21+00:00
E012R2	reports_profiles	2e4ae15ce344b3c8e359cb9aa2d8868072149216	keep	lifecycle.save_ms	221.23160000000001	Repeat full profile specialization workload with immutable profile and solver fingerprints	2026-09-07T02:11:21+00:00
E013	postflop_cuda	ecf7e1ebfca23eccbe8188bbc66460aba97328e0	keep	postflop.Ks7h2d.iso.allocated_vram_mb	6241.124352	Store CFVs only for visited nodes while preserving every node and chance reference	2026-09-07T02:17:33+00:00
E013	postflop_cuda	ecf7e1ebfca23eccbe8188bbc66460aba97328e0	keep	postflop.Ks7h2d.iso.estimated_vram_mb	6716.6347	Store CFVs only for visited nodes while preserving every node and chance reference	2026-09-07T02:17:33+00:00
E013	postflop_cuda	ecf7e1ebfca23eccbe8188bbc66460aba97328e0	keep	postflop.Ks7h2d.iso.init_ms	1514.7133	Store CFVs only for visited nodes while preserving every node and chance reference	2026-09-07T02:17:33+00:00
E013	postflop_cuda	ecf7e1ebfca23eccbe8188bbc66460aba97328e0	keep	postflop.Ks7h2d.iso.plan_build_ms	103.6747	Store CFVs only for visited nodes while preserving every node and chance reference	2026-09-07T02:17:33+00:00
E013	postflop_cuda	ecf7e1ebfca23eccbe8188bbc66460aba97328e0	keep	postflop.Ks7h2d.iso.staging_memory_mb	3380.293588	Store CFVs only for visited nodes while preserving every node and chance reference	2026-09-07T02:17:33+00:00
E013	postflop_cuda	ecf7e1ebfca23eccbe8188bbc66460aba97328e0	keep	postflop.Ks7s2d.iso.allocated_vram_mb	4932.501504	Store CFVs only for visited nodes while preserving every node and chance reference	2026-09-07T02:17:33+00:00
E013	postflop_cuda	ecf7e1ebfca23eccbe8188bbc66460aba97328e0	keep	postflop.Ks7s2d.iso.estimated_vram_mb	6737.546704	Store CFVs only for visited nodes while preserving every node and chance reference	2026-09-07T02:17:33+00:00
E013	postflop_cuda	ecf7e1ebfca23eccbe8188bbc66460aba97328e0	keep	postflop.Ks7s2d.iso.init_ms	557.8100000000001	Store CFVs only for visited nodes while preserving every node and chance reference	2026-09-07T02:17:33+00:00
E013	postflop_cuda	ecf7e1ebfca23eccbe8188bbc66460aba97328e0	keep	postflop.Ks7s2d.iso.plan_build_ms	85.025	Store CFVs only for visited nodes while preserving every node and chance reference	2026-09-07T02:17:33+00:00
E013	postflop_cuda	ecf7e1ebfca23eccbe8188bbc66460aba97328e0	keep	postflop.Ks7s2d.iso.staging_memory_mb	2063.622928	Store CFVs only for visited nodes while preserving every node and chance reference	2026-09-07T02:17:33+00:00
E013	postflop_cuda	ecf7e1ebfca23eccbe8188bbc66460aba97328e0	keep	postflop.Ks7s2d.full.allocated_vram_mb	6274.678784	Store CFVs only for visited nodes while preserving every node and chance reference	2026-09-07T02:17:33+00:00
E013	postflop_cuda	ecf7e1ebfca23eccbe8188bbc66460aba97328e0	keep	postflop.Ks7s2d.full.estimated_vram_mb	6737.546704	Store CFVs only for visited nodes while preserving every node and chance reference	2026-09-07T02:17:33+00:00
E013	postflop_cuda	ecf7e1ebfca23eccbe8188bbc66460aba97328e0	keep	postflop.Ks7s2d.full.init_ms	636.3002	Store CFVs only for visited nodes while preserving every node and chance reference	2026-09-07T02:17:33+00:00
E013	postflop_cuda	ecf7e1ebfca23eccbe8188bbc66460aba97328e0	keep	postflop.Ks7s2d.full.plan_build_ms	118.643	Store CFVs only for visited nodes while preserving every node and chance reference	2026-09-07T02:17:33+00:00
E013	postflop_cuda	ecf7e1ebfca23eccbe8188bbc66460aba97328e0	keep	postflop.Ks7s2d.full.staging_memory_mb	3391.473816	Store CFVs only for visited nodes while preserving every node and chance reference	2026-09-07T02:17:33+00:00
E013	postflop_cuda	ecf7e1ebfca23eccbe8188bbc66460aba97328e0	keep	postflop.Ks7h2d.init_ms	1208.383	Store CFVs only for visited nodes while preserving every node and chance reference	2026-09-07T02:17:33+00:00
E013	postflop_cuda	ecf7e1ebfca23eccbe8188bbc66460aba97328e0	keep	postflop.Ks7h2d.iteration_ms	57.556	Store CFVs only for visited nodes while preserving every node and chance reference	2026-09-07T02:17:33+00:00
E013	postflop_cuda	ecf7e1ebfca23eccbe8188bbc66460aba97328e0	keep	postflop.Ks7h2d.check_ms	35.825	Store CFVs only for visited nodes while preserving every node and chance reference	2026-09-07T02:17:33+00:00
E013	postflop_cuda	ecf7e1ebfca23eccbe8188bbc66460aba97328e0	keep	postflop.Ks7s2d.init_ms	778.332	Store CFVs only for visited nodes while preserving every node and chance reference	2026-09-07T02:17:33+00:00
E013	postflop_cuda	ecf7e1ebfca23eccbe8188bbc66460aba97328e0	keep	postflop.Ks7s2d.iteration_ms	34.056	Store CFVs only for visited nodes while preserving every node and chance reference	2026-09-07T02:17:33+00:00
E013	postflop_cuda	ecf7e1ebfca23eccbe8188bbc66460aba97328e0	keep	postflop.Ks7s2d.check_ms	29.436	Store CFVs only for visited nodes while preserving every node and chance reference	2026-09-07T02:17:33+00:00
E013	postflop_cuda	ecf7e1ebfca23eccbe8188bbc66460aba97328e0	keep	postflop.Ks7h2dQhTc.init_ms	75.53	Store CFVs only for visited nodes while preserving every node and chance reference	2026-09-07T02:17:33+00:00
E013	postflop_cuda	ecf7e1ebfca23eccbe8188bbc66460aba97328e0	keep	postflop.Ks7h2dQhTc.iteration_ms	0.319	Store CFVs only for visited nodes while preserving every node and chance reference	2026-09-07T02:17:33+00:00
E013	postflop_cuda	ecf7e1ebfca23eccbe8188bbc66460aba97328e0	keep	postflop.Ks7h2dQhTc.check_ms	0.562	Store CFVs only for visited nodes while preserving every node and chance reference	2026-09-07T02:17:33+00:00
E013R	postflop_cuda	ecf7e1ebfca23eccbe8188bbc66460aba97328e0	keep	postflop.Ks7h2d.iso.allocated_vram_mb	6241.124352	Repeat compact CFV timing/capacity and verify slot ownership plus GPU equivalence	2026-09-07T02:18:53+00:00
E013R	postflop_cuda	ecf7e1ebfca23eccbe8188bbc66460aba97328e0	keep	postflop.Ks7h2d.iso.estimated_vram_mb	6716.6347	Repeat compact CFV timing/capacity and verify slot ownership plus GPU equivalence	2026-09-07T02:18:53+00:00
E013R	postflop_cuda	ecf7e1ebfca23eccbe8188bbc66460aba97328e0	keep	postflop.Ks7h2d.iso.init_ms	940.9918	Repeat compact CFV timing/capacity and verify slot ownership plus GPU equivalence	2026-09-07T02:18:53+00:00
E013R	postflop_cuda	ecf7e1ebfca23eccbe8188bbc66460aba97328e0	keep	postflop.Ks7h2d.iso.plan_build_ms	111.2345	Repeat compact CFV timing/capacity and verify slot ownership plus GPU equivalence	2026-09-07T02:18:53+00:00
E013R	postflop_cuda	ecf7e1ebfca23eccbe8188bbc66460aba97328e0	keep	postflop.Ks7h2d.iso.staging_memory_mb	3380.293588	Repeat compact CFV timing/capacity and verify slot ownership plus GPU equivalence	2026-09-07T02:18:53+00:00
E013R	postflop_cuda	ecf7e1ebfca23eccbe8188bbc66460aba97328e0	keep	postflop.Ks7s2d.iso.allocated_vram_mb	4932.501504	Repeat compact CFV timing/capacity and verify slot ownership plus GPU equivalence	2026-09-07T02:18:53+00:00
E013R	postflop_cuda	ecf7e1ebfca23eccbe8188bbc66460aba97328e0	keep	postflop.Ks7s2d.iso.estimated_vram_mb	6737.546704	Repeat compact CFV timing/capacity and verify slot ownership plus GPU equivalence	2026-09-07T02:18:53+00:00
E013R	postflop_cuda	ecf7e1ebfca23eccbe8188bbc66460aba97328e0	keep	postflop.Ks7s2d.iso.init_ms	568.2644	Repeat compact CFV timing/capacity and verify slot ownership plus GPU equivalence	2026-09-07T02:18:53+00:00
E013R	postflop_cuda	ecf7e1ebfca23eccbe8188bbc66460aba97328e0	keep	postflop.Ks7s2d.iso.plan_build_ms	74.5834	Repeat compact CFV timing/capacity and verify slot ownership plus GPU equivalence	2026-09-07T02:18:53+00:00
E013R	postflop_cuda	ecf7e1ebfca23eccbe8188bbc66460aba97328e0	keep	postflop.Ks7s2d.iso.staging_memory_mb	2063.622928	Repeat compact CFV timing/capacity and verify slot ownership plus GPU equivalence	2026-09-07T02:18:53+00:00
E013R	postflop_cuda	ecf7e1ebfca23eccbe8188bbc66460aba97328e0	keep	postflop.Ks7s2d.full.allocated_vram_mb	6274.678784	Repeat compact CFV timing/capacity and verify slot ownership plus GPU equivalence	2026-09-07T02:18:53+00:00
E013R	postflop_cuda	ecf7e1ebfca23eccbe8188bbc66460aba97328e0	keep	postflop.Ks7s2d.full.estimated_vram_mb	6737.546704	Repeat compact CFV timing/capacity and verify slot ownership plus GPU equivalence	2026-09-07T02:18:53+00:00
E013R	postflop_cuda	ecf7e1ebfca23eccbe8188bbc66460aba97328e0	keep	postflop.Ks7s2d.full.init_ms	678.1116000000001	Repeat compact CFV timing/capacity and verify slot ownership plus GPU equivalence	2026-09-07T02:18:53+00:00
E013R	postflop_cuda	ecf7e1ebfca23eccbe8188bbc66460aba97328e0	keep	postflop.Ks7s2d.full.plan_build_ms	104.54140000000001	Repeat compact CFV timing/capacity and verify slot ownership plus GPU equivalence	2026-09-07T02:18:53+00:00
E013R	postflop_cuda	ecf7e1ebfca23eccbe8188bbc66460aba97328e0	keep	postflop.Ks7s2d.full.staging_memory_mb	3391.473816	Repeat compact CFV timing/capacity and verify slot ownership plus GPU equivalence	2026-09-07T02:18:53+00:00
E013R	postflop_cuda	ecf7e1ebfca23eccbe8188bbc66460aba97328e0	keep	postflop.Ks7h2d.init_ms	1137.21	Repeat compact CFV timing/capacity and verify slot ownership plus GPU equivalence	2026-09-07T02:18:53+00:00
E013R	postflop_cuda	ecf7e1ebfca23eccbe8188bbc66460aba97328e0	keep	postflop.Ks7h2d.iteration_ms	57.433	Repeat compact CFV timing/capacity and verify slot ownership plus GPU equivalence	2026-09-07T02:18:53+00:00
E013R	postflop_cuda	ecf7e1ebfca23eccbe8188bbc66460aba97328e0	keep	postflop.Ks7h2d.check_ms	35.68	Repeat compact CFV timing/capacity and verify slot ownership plus GPU equivalence	2026-09-07T02:18:53+00:00
E013R	postflop_cuda	ecf7e1ebfca23eccbe8188bbc66460aba97328e0	keep	postflop.Ks7s2d.init_ms	661.983	Repeat compact CFV timing/capacity and verify slot ownership plus GPU equivalence	2026-09-07T02:18:53+00:00
E013R	postflop_cuda	ecf7e1ebfca23eccbe8188bbc66460aba97328e0	keep	postflop.Ks7s2d.iteration_ms	34.079	Repeat compact CFV timing/capacity and verify slot ownership plus GPU equivalence	2026-09-07T02:18:53+00:00
E013R	postflop_cuda	ecf7e1ebfca23eccbe8188bbc66460aba97328e0	keep	postflop.Ks7s2d.check_ms	28.683	Repeat compact CFV timing/capacity and verify slot ownership plus GPU equivalence	2026-09-07T02:18:53+00:00
E013R	postflop_cuda	ecf7e1ebfca23eccbe8188bbc66460aba97328e0	keep	postflop.Ks7h2dQhTc.init_ms	116.871	Repeat compact CFV timing/capacity and verify slot ownership plus GPU equivalence	2026-09-07T02:18:53+00:00
E013R	postflop_cuda	ecf7e1ebfca23eccbe8188bbc66460aba97328e0	keep	postflop.Ks7h2dQhTc.iteration_ms	0.319	Repeat compact CFV timing/capacity and verify slot ownership plus GPU equivalence	2026-09-07T02:18:53+00:00
E013R	postflop_cuda	ecf7e1ebfca23eccbe8188bbc66460aba97328e0	keep	postflop.Ks7h2dQhTc.check_ms	0.611	Repeat compact CFV timing/capacity and verify slot ownership plus GPU equivalence	2026-09-07T02:18:53+00:00
B011	baseline	ecf7e1ebfca23eccbe8188bbc66460aba97328e0	baseline	preflop.6.allocated_vram_mb	603.979776	Warm preflop initialization/capacity control before eliminating temporary upload copies	2026-09-07T02:19:52+00:00
B011	baseline	ecf7e1ebfca23eccbe8188bbc66460aba97328e0	baseline	preflop.6.build_ms	77.4773	Warm preflop initialization/capacity control before eliminating temporary upload copies	2026-09-07T02:19:52+00:00
B011	baseline	ecf7e1ebfca23eccbe8188bbc66460aba97328e0	baseline	preflop.6.cpu_arena_mb	224.552328	Warm preflop initialization/capacity control before eliminating temporary upload copies	2026-09-07T02:19:52+00:00
B011	baseline	ecf7e1ebfca23eccbe8188bbc66460aba97328e0	baseline	preflop.6.estimated_vram_mb	644.652012	Warm preflop initialization/capacity control before eliminating temporary upload copies	2026-09-07T02:19:52+00:00
B011	baseline	ecf7e1ebfca23eccbe8188bbc66460aba97328e0	baseline	preflop.6.init_ms	166.5338	Warm preflop initialization/capacity control before eliminating temporary upload copies	2026-09-07T02:19:52+00:00
B011	baseline	ecf7e1ebfca23eccbe8188bbc66460aba97328e0	baseline	preflop.8.allocated_vram_mb	1543.503872	Warm preflop initialization/capacity control before eliminating temporary upload copies	2026-09-07T02:19:52+00:00
B011	baseline	ecf7e1ebfca23eccbe8188bbc66460aba97328e0	baseline	preflop.8.build_ms	239.2635	Warm preflop initialization/capacity control before eliminating temporary upload copies	2026-09-07T02:19:52+00:00
B011	baseline	ecf7e1ebfca23eccbe8188bbc66460aba97328e0	baseline	preflop.8.cpu_arena_mb	587.239848	Warm preflop initialization/capacity control before eliminating temporary upload copies	2026-09-07T02:19:52+00:00
