experiment	path	commit	status	metric	value	hypothesis	utc
E021	memory_transfers	b0a97dbf15e1149c8f0c0d2c1874c071960c0766	keep	preflop.6.estimated_vram_mb	594.500084	Remove full preflop sigma arena: recompute exact action probabilities before each own-node update, reducing GPU allocation and repeated sigma traffic	2026-09-07T04:02:14+00:00
E021	memory_transfers	b0a97dbf15e1149c8f0c0d2c1874c071960c0766	keep	preflop.6.init_ms	511.6802	Remove full preflop sigma arena: recompute exact action probabilities before each own-node update, reducing GPU allocation and repeated sigma traffic	2026-09-07T04:02:14+00:00
E021	memory_transfers	b0a97dbf15e1149c8f0c0d2c1874c071960c0766	keep	preflop.8.allocated_vram_mb	1409.286144	Remove full preflop sigma arena: recompute exact action probabilities before each own-node update, reducing GPU allocation and repeated sigma traffic	2026-09-07T04:02:14+00:00
E021	memory_transfers	b0a97dbf15e1149c8f0c0d2c1874c071960c0766	keep	preflop.8.build_ms	213.5309	Remove full preflop sigma arena: recompute exact action probabilities before each own-node update, reducing GPU allocation and repeated sigma traffic	2026-09-07T04:02:14+00:00
E021	memory_transfers	b0a97dbf15e1149c8f0c0d2c1874c071960c0766	keep	preflop.8.cpu_arena_mb	587.239848	Remove full preflop sigma arena: recompute exact action probabilities before each own-node update, reducing GPU allocation and repeated sigma traffic	2026-09-07T04:02:14+00:00
E021	memory_transfers	b0a97dbf15e1149c8f0c0d2c1874c071960c0766	keep	preflop.8.estimated_vram_mb	1456.8885480000001	Remove full preflop sigma arena: recompute exact action probabilities before each own-node update, reducing GPU allocation and repeated sigma traffic	2026-09-07T04:02:14+00:00
E021	memory_transfers	b0a97dbf15e1149c8f0c0d2c1874c071960c0766	keep	preflop.8.init_ms	240.9114	Remove full preflop sigma arena: recompute exact action probabilities before each own-node update, reducing GPU allocation and repeated sigma traffic	2026-09-07T04:02:14+00:00
E021	memory_transfers	b0a97dbf15e1149c8f0c0d2c1874c071960c0766	keep	preflop.2.iteration_ms	0.085	Remove full preflop sigma arena: recompute exact action probabilities before each own-node update, reducing GPU allocation and repeated sigma traffic	2026-09-07T04:02:14+00:00
E021	memory_transfers	b0a97dbf15e1149c8f0c0d2c1874c071960c0766	keep	preflop.2.check_ms	0.304	Remove full preflop sigma arena: recompute exact action probabilities before each own-node update, reducing GPU allocation and repeated sigma traffic	2026-09-07T04:02:14+00:00
E021	memory_transfers	b0a97dbf15e1149c8f0c0d2c1874c071960c0766	keep	preflop.2.sync_ms	0.018	Remove full preflop sigma arena: recompute exact action probabilities before each own-node update, reducing GPU allocation and repeated sigma traffic	2026-09-07T04:02:14+00:00
E021	memory_transfers	b0a97dbf15e1149c8f0c0d2c1874c071960c0766	keep	preflop.6.iteration_ms	18.194	Remove full preflop sigma arena: recompute exact action probabilities before each own-node update, reducing GPU allocation and repeated sigma traffic	2026-09-07T04:02:14+00:00
E021	memory_transfers	b0a97dbf15e1149c8f0c0d2c1874c071960c0766	keep	preflop.6.check_ms	12.885	Remove full preflop sigma arena: recompute exact action probabilities before each own-node update, reducing GPU allocation and repeated sigma traffic	2026-09-07T04:02:14+00:00
E021	memory_transfers	b0a97dbf15e1149c8f0c0d2c1874c071960c0766	keep	preflop.6.sync_ms	24.904	Remove full preflop sigma arena: recompute exact action probabilities before each own-node update, reducing GPU allocation and repeated sigma traffic	2026-09-07T04:02:14+00:00
E021	memory_transfers	b0a97dbf15e1149c8f0c0d2c1874c071960c0766	keep	preflop.8.iteration_ms	63.324	Remove full preflop sigma arena: recompute exact action probabilities before each own-node update, reducing GPU allocation and repeated sigma traffic	2026-09-07T04:02:14+00:00
E021	memory_transfers	b0a97dbf15e1149c8f0c0d2c1874c071960c0766	keep	preflop.8.check_ms	41.641	Remove full preflop sigma arena: recompute exact action probabilities before each own-node update, reducing GPU allocation and repeated sigma traffic	2026-09-07T04:02:14+00:00
E021	memory_transfers	b0a97dbf15e1149c8f0c0d2c1874c071960c0766	keep	preflop.8.sync_ms	71.408	Remove full preflop sigma arena: recompute exact action probabilities before each own-node update, reducing GPU allocation and repeated sigma traffic	2026-09-07T04:02:14+00:00
E021R	memory_transfers	b0a97dbf15e1149c8f0c0d2c1874c071960c0766	keep	preflop.6.allocated_vram_mb	536.870912	Repeat sigma-arena removal: require original complete fingerprints and stable memory reduction, then preflop GPU equivalence and cache/stop unit checks	2026-09-07T04:03:31+00:00
E021R	memory_transfers	b0a97dbf15e1149c8f0c0d2c1874c071960c0766	keep	preflop.6.build_ms	79.5018	Repeat sigma-arena removal: require original complete fingerprints and stable memory reduction, then preflop GPU equivalence and cache/stop unit checks	2026-09-07T04:03:31+00:00
E021R	memory_transfers	b0a97dbf15e1149c8f0c0d2c1874c071960c0766	keep	preflop.6.cpu_arena_mb	224.552328	Repeat sigma-arena removal: require original complete fingerprints and stable memory reduction, then preflop GPU equivalence and cache/stop unit checks	2026-09-07T04:03:31+00:00
E021R	memory_transfers	b0a97dbf15e1149c8f0c0d2c1874c071960c0766	keep	preflop.6.estimated_vram_mb	594.500084	Repeat sigma-arena removal: require original complete fingerprints and stable memory reduction, then preflop GPU equivalence and cache/stop unit checks	2026-09-07T04:03:31+00:00
E021R	memory_transfers	b0a97dbf15e1149c8f0c0d2c1874c071960c0766	keep	preflop.6.init_ms	146.0123	Repeat sigma-arena removal: require original complete fingerprints and stable memory reduction, then preflop GPU equivalence and cache/stop unit checks	2026-09-07T04:03:31+00:00
E021R	memory_transfers	b0a97dbf15e1149c8f0c0d2c1874c071960c0766	keep	preflop.8.allocated_vram_mb	1409.286144	Repeat sigma-arena removal: require original complete fingerprints and stable memory reduction, then preflop GPU equivalence and cache/stop unit checks	2026-09-07T04:03:31+00:00
E021R	memory_transfers	b0a97dbf15e1149c8f0c0d2c1874c071960c0766	keep	preflop.8.build_ms	217.3764	Repeat sigma-arena removal: require original complete fingerprints and stable memory reduction, then preflop GPU equivalence and cache/stop unit checks	2026-09-07T04:03:31+00:00
E021R	memory_transfers	b0a97dbf15e1149c8f0c0d2c1874c071960c0766	keep	preflop.8.cpu_arena_mb	587.239848	Repeat sigma-arena removal: require original complete fingerprints and stable memory reduction, then preflop GPU equivalence and cache/stop unit checks	2026-09-07T04:03:31+00:00
E021R	memory_transfers	b0a97dbf15e1149c8f0c0d2c1874c071960c0766	keep	preflop.8.estimated_vram_mb	1456.8885480000001	Repeat sigma-arena removal: require original complete fingerprints and stable memory reduction, then preflop GPU equivalence and cache/stop unit checks	2026-09-07T04:03:31+00:00
E021R	memory_transfers	b0a97dbf15e1149c8f0c0d2c1874c071960c0766	keep	preflop.8.init_ms	234.6397	Repeat sigma-arena removal: require original complete fingerprints and stable memory reduction, then preflop GPU equivalence and cache/stop unit checks	2026-09-07T04:03:31+00:00
E021R	memory_transfers	b0a97dbf15e1149c8f0c0d2c1874c071960c0766	keep	preflop.2.iteration_ms	0.085	Repeat sigma-arena removal: require original complete fingerprints and stable memory reduction, then preflop GPU equivalence and cache/stop unit checks	2026-09-07T04:03:31+00:00
E021R	memory_transfers	b0a97dbf15e1149c8f0c0d2c1874c071960c0766	keep	preflop.2.check_ms	0.285	Repeat sigma-arena removal: require original complete fingerprints and stable memory reduction, then preflop GPU equivalence and cache/stop unit checks	2026-09-07T04:03:31+00:00
E021R	memory_transfers	b0a97dbf15e1149c8f0c0d2c1874c071960c0766	keep	preflop.2.sync_ms	0.017	Repeat sigma-arena removal: require original complete fingerprints and stable memory reduction, then preflop GPU equivalence and cache/stop unit checks	2026-09-07T04:03:31+00:00
E021R	memory_transfers	b0a97dbf15e1149c8f0c0d2c1874c071960c0766	keep	preflop.6.iteration_ms	18.12	Repeat sigma-arena removal: require original complete fingerprints and stable memory reduction, then preflop GPU equivalence and cache/stop unit checks	2026-09-07T04:03:31+00:00
E021R	memory_transfers	b0a97dbf15e1149c8f0c0d2c1874c071960c0766	keep	preflop.6.check_ms	12.998	Repeat sigma-arena removal: require original complete fingerprints and stable memory reduction, then preflop GPU equivalence and cache/stop unit checks	2026-09-07T04:03:31+00:00
E021R	memory_transfers	b0a97dbf15e1149c8f0c0d2c1874c071960c0766	keep	preflop.6.sync_ms	24.96	Repeat sigma-arena removal: require original complete fingerprints and stable memory reduction, then preflop GPU equivalence and cache/stop unit checks	2026-09-07T04:03:31+00:00
E021R	memory_transfers	b0a97dbf15e1149c8f0c0d2c1874c071960c0766	keep	preflop.8.iteration_ms	63.133	Repeat sigma-arena removal: require original complete fingerprints and stable memory reduction, then preflop GPU equivalence and cache/stop unit checks	2026-09-07T04:03:31+00:00
E021R	memory_transfers	b0a97dbf15e1149c8f0c0d2c1874c071960c0766	keep	preflop.8.check_ms	41.037	Repeat sigma-arena removal: require original complete fingerprints and stable memory reduction, then preflop GPU equivalence and cache/stop unit checks	2026-09-07T04:03:31+00:00
E021R	memory_transfers	b0a97dbf15e1149c8f0c0d2c1874c071960c0766	keep	preflop.8.sync_ms	66.701	Repeat sigma-arena removal: require original complete fingerprints and stable memory reduction, then preflop GPU equivalence and cache/stop unit checks	2026-09-07T04:03:31+00:00
B023	postflop_cuda	9c8a21fe870e8c1b831bee88941eed56a67dbbb7	baseline	postflop.Ks7h2d.init_ms	1035.113	Fresh postflop action-kernel control on retained sigma-free preflop code	2026-09-07T04:09:10+00:00
B023	postflop_cuda	9c8a21fe870e8c1b831bee88941eed56a67dbbb7	baseline	postflop.Ks7h2d.iteration_ms	57.573	Fresh postflop action-kernel control on retained sigma-free preflop code	2026-09-07T04:09:10+00:00
B023	postflop_cuda	9c8a21fe870e8c1b831bee88941eed56a67dbbb7	baseline	postflop.Ks7h2d.check_ms	36.387	Fresh postflop action-kernel control on retained sigma-free preflop code	2026-09-07T04:09:10+00:00
B023	postflop_cuda	9c8a21fe870e8c1b831bee88941eed56a67dbbb7	baseline	postflop.Ks7s2d.init_ms	745.932	Fresh postflop action-kernel control on retained sigma-free preflop code	2026-09-07T04:09:10+00:00
B023	postflop_cuda	9c8a21fe870e8c1b831bee88941eed56a67dbbb7	baseline	postflop.Ks7s2d.iteration_ms	34.151	Fresh postflop action-kernel control on retained sigma-free preflop code	2026-09-07T04:09:10+00:00
B023	postflop_cuda	9c8a21fe870e8c1b831bee88941eed56a67dbbb7	baseline	postflop.Ks7s2d.check_ms	29.432	Fresh postflop action-kernel control on retained sigma-free preflop code	2026-09-07T04:09:10+00:00
B023	postflop_cuda	9c8a21fe870e8c1b831bee88941eed56a67dbbb7	baseline	postflop.Ks7h2dQhTc.init_ms	69.231	Fresh postflop action-kernel control on retained sigma-free preflop code	2026-09-07T04:09:10+00:00
B023	postflop_cuda	9c8a21fe870e8c1b831bee88941eed56a67dbbb7	baseline	postflop.Ks7h2dQhTc.iteration_ms	0.32	Fresh postflop action-kernel control on retained sigma-free preflop code	2026-09-07T04:09:10+00:00
B023	postflop_cuda	9c8a21fe870e8c1b831bee88941eed56a67dbbb7	baseline	postflop.Ks7h2dQhTc.check_ms	0.579	Fresh postflop action-kernel control on retained sigma-free preflop code	2026-09-07T04:09:10+00:00
E022	postflop_cuda	cb6f9d45cdc3c972a6e6fd447d9cd473faf1faf9	keep	postflop.Ks7h2d.init_ms	1030.811	Specialize two/three/four-action up sweeps to keep private regret/value caches in registers without changing sum order	2026-09-07T04:11:52+00:00
E022	postflop_cuda	cb6f9d45cdc3c972a6e6fd447d9cd473faf1faf9	keep	postflop.Ks7h2d.iteration_ms	54.49	Specialize two/three/four-action up sweeps to keep private regret/value caches in registers without changing sum order	2026-09-07T04:11:52+00:00
E022	postflop_cuda	cb6f9d45cdc3c972a6e6fd447d9cd473faf1faf9	keep	postflop.Ks7h2d.check_ms	35.871	Specialize two/three/four-action up sweeps to keep private regret/value caches in registers without changing sum order	2026-09-07T04:11:52+00:00
E022	postflop_cuda	cb6f9d45cdc3c972a6e6fd447d9cd473faf1faf9	keep	postflop.Ks7s2d.init_ms	724.568	Specialize two/three/four-action up sweeps to keep private regret/value caches in registers without changing sum order	2026-09-07T04:11:52+00:00
E022	postflop_cuda	cb6f9d45cdc3c972a6e6fd447d9cd473faf1faf9	keep	postflop.Ks7s2d.iteration_ms	32.618	Specialize two/three/four-action up sweeps to keep private regret/value caches in registers without changing sum order	2026-09-07T04:11:52+00:00
E022	postflop_cuda	cb6f9d45cdc3c972a6e6fd447d9cd473faf1faf9	keep	postflop.Ks7s2d.check_ms	29.48	Specialize two/three/four-action up sweeps to keep private regret/value caches in registers without changing sum order	2026-09-07T04:11:52+00:00
E022	postflop_cuda	cb6f9d45cdc3c972a6e6fd447d9cd473faf1faf9	keep	postflop.Ks7h2dQhTc.init_ms	65.858	Specialize two/three/four-action up sweeps to keep private regret/value caches in registers without changing sum order	2026-09-07T04:11:52+00:00
E022	postflop_cuda	cb6f9d45cdc3c972a6e6fd447d9cd473faf1faf9	keep	postflop.Ks7h2dQhTc.iteration_ms	0.304	Specialize two/three/four-action up sweeps to keep private regret/value caches in registers without changing sum order	2026-09-07T04:11:52+00:00
E022	postflop_cuda	cb6f9d45cdc3c972a6e6fd447d9cd473faf1faf9	keep	postflop.Ks7h2dQhTc.check_ms	0.561	Specialize two/three/four-action up sweeps to keep private regret/value caches in registers without changing sum order	2026-09-07T04:11:52+00:00
E022R	postflop_cuda	ffd03bf27593881bdc3c3ad36d032b147a89a6f5	keep	postflop.Ks7h2d.init_ms	1015.54	Repeat action specialization timings and run full GPU regressions; establish broad pre-compaction readback/resume fingerprints	2026-09-07T04:14:28+00:00
E022R	postflop_cuda	ffd03bf27593881bdc3c3ad36d032b147a89a6f5	keep	postflop.Ks7h2d.iteration_ms	54.53	Repeat action specialization timings and run full GPU regressions; establish broad pre-compaction readback/resume fingerprints	2026-09-07T04:14:28+00:00
E022R	postflop_cuda	ffd03bf27593881bdc3c3ad36d032b147a89a6f5	keep	postflop.Ks7h2d.check_ms	35.839	Repeat action specialization timings and run full GPU regressions; establish broad pre-compaction readback/resume fingerprints	2026-09-07T04:14:28+00:00
E022R	postflop_cuda	ffd03bf27593881bdc3c3ad36d032b147a89a6f5	keep	postflop.Ks7s2d.init_ms	733.515	Repeat action specialization timings and run full GPU regressions; establish broad pre-compaction readback/resume fingerprints	2026-09-07T04:14:28+00:00
E022R	postflop_cuda	ffd03bf27593881bdc3c3ad36d032b147a89a6f5	keep	postflop.Ks7s2d.iteration_ms	32.663	Repeat action specialization timings and run full GPU regressions; establish broad pre-compaction readback/resume fingerprints	2026-09-07T04:14:28+00:00
E022R	postflop_cuda	ffd03bf27593881bdc3c3ad36d032b147a89a6f5	keep	postflop.Ks7s2d.check_ms	29.671	Repeat action specialization timings and run full GPU regressions; establish broad pre-compaction readback/resume fingerprints	2026-09-07T04:14:28+00:00
E022R	postflop_cuda	ffd03bf27593881bdc3c3ad36d032b147a89a6f5	keep	postflop.Ks7h2dQhTc.init_ms	73.155	Repeat action specialization timings and run full GPU regressions; establish broad pre-compaction readback/resume fingerprints	2026-09-07T04:14:28+00:00
E022R	postflop_cuda	ffd03bf27593881bdc3c3ad36d032b147a89a6f5	keep	postflop.Ks7h2dQhTc.iteration_ms	0.307	Repeat action specialization timings and run full GPU regressions; establish broad pre-compaction readback/resume fingerprints	2026-09-07T04:14:28+00:00
E022R	postflop_cuda	ffd03bf27593881bdc3c3ad36d032b147a89a6f5	keep	postflop.Ks7h2dQhTc.check_ms	0.722	Repeat action specialization timings and run full GPU regressions; establish broad pre-compaction readback/resume fingerprints	2026-09-07T04:14:28+00:00
E023	postflop_cuda	7d72ebd40006e0a1ae3689e7fc31a99290d66311	keep	postflop.Ks7h2d.init_ms	1030.994	Specialize two/three/four-action reach propagation to eliminate dynamic local cache and accelerate both iterations and checks	2026-09-07T04:16:30+00:00
E023	postflop_cuda	7d72ebd40006e0a1ae3689e7fc31a99290d66311	keep	postflop.Ks7h2d.iteration_ms	52.084	Specialize two/three/four-action reach propagation to eliminate dynamic local cache and accelerate both iterations and checks	2026-09-07T04:16:30+00:00
E023	postflop_cuda	7d72ebd40006e0a1ae3689e7fc31a99290d66311	keep	postflop.Ks7h2d.check_ms	34.969	Specialize two/three/four-action reach propagation to eliminate dynamic local cache and accelerate both iterations and checks	2026-09-07T04:16:30+00:00
E023	postflop_cuda	7d72ebd40006e0a1ae3689e7fc31a99290d66311	keep	postflop.Ks7s2d.init_ms	677.237	Specialize two/three/four-action reach propagation to eliminate dynamic local cache and accelerate both iterations and checks	2026-09-07T04:16:30+00:00
E023	postflop_cuda	7d72ebd40006e0a1ae3689e7fc31a99290d66311	keep	postflop.Ks7s2d.iteration_ms	31.235	Specialize two/three/four-action reach propagation to eliminate dynamic local cache and accelerate both iterations and checks	2026-09-07T04:16:30+00:00
E023	postflop_cuda	7d72ebd40006e0a1ae3689e7fc31a99290d66311	keep	postflop.Ks7s2d.check_ms	28.881	Specialize two/three/four-action reach propagation to eliminate dynamic local cache and accelerate both iterations and checks	2026-09-07T04:16:30+00:00
E023	postflop_cuda	7d72ebd40006e0a1ae3689e7fc31a99290d66311	keep	postflop.Ks7h2dQhTc.init_ms	76.76	Specialize two/three/four-action reach propagation to eliminate dynamic local cache and accelerate both iterations and checks	2026-09-07T04:16:30+00:00
E023	postflop_cuda	7d72ebd40006e0a1ae3689e7fc31a99290d66311	keep	postflop.Ks7h2dQhTc.iteration_ms	0.273	Specialize two/three/four-action reach propagation to eliminate dynamic local cache and accelerate both iterations and checks	2026-09-07T04:16:30+00:00
E023	postflop_cuda	7d72ebd40006e0a1ae3689e7fc31a99290d66311	keep	postflop.Ks7h2dQhTc.check_ms	0.571	Specialize two/three/four-action reach propagation to eliminate dynamic local cache and accelerate both iterations and checks	2026-09-07T04:16:30+00:00
B025	postflop_cuda	2b111e836f03789ae043215ed57cf8d3b730228d	baseline	postflop.Ks7h2d.init_ms	1063.286	Fresh original action-kernel timings and 1/2/3/4/5/11-action DCFR/CFR+ state reference before comparing both specializations	2026-09-07T04:18:17+00:00
B025	postflop_cuda	2b111e836f03789ae043215ed57cf8d3b730228d	baseline	postflop.Ks7h2d.iteration_ms	58.213	Fresh original action-kernel timings and 1/2/3/4/5/11-action DCFR/CFR+ state reference before comparing both specializations	2026-09-07T04:18:17+00:00
B025	postflop_cuda	2b111e836f03789ae043215ed57cf8d3b730228d	baseline	postflop.Ks7h2d.check_ms	35.708	Fresh original action-kernel timings and 1/2/3/4/5/11-action DCFR/CFR+ state reference before comparing both specializations	2026-09-07T04:18:17+00:00
B025	postflop_cuda	2b111e836f03789ae043215ed57cf8d3b730228d	baseline	postflop.Ks7s2d.init_ms	733.486	Fresh original action-kernel timings and 1/2/3/4/5/11-action DCFR/CFR+ state reference before comparing both specializations	2026-09-07T04:18:17+00:00
B025	postflop_cuda	2b111e836f03789ae043215ed57cf8d3b730228d	baseline	postflop.Ks7s2d.iteration_ms	34.09	Fresh original action-kernel timings and 1/2/3/4/5/11-action DCFR/CFR+ state reference before comparing both specializations	2026-09-07T04:18:17+00:00
B025	postflop_cuda	2b111e836f03789ae043215ed57cf8d3b730228d	baseline	postflop.Ks7s2d.check_ms	28.705	Fresh original action-kernel timings and 1/2/3/4/5/11-action DCFR/CFR+ state reference before comparing both specializations	2026-09-07T04:18:17+00:00
B025	postflop_cuda	2b111e836f03789ae043215ed57cf8d3b730228d	baseline	postflop.Ks7h2dQhTc.init_ms	63.589	Fresh original action-kernel timings and 1/2/3/4/5/11-action DCFR/CFR+ state reference before comparing both specializations	2026-09-07T04:18:17+00:00
B025	postflop_cuda	2b111e836f03789ae043215ed57cf8d3b730228d	baseline	postflop.Ks7h2dQhTc.iteration_ms	0.321	Fresh original action-kernel timings and 1/2/3/4/5/11-action DCFR/CFR+ state reference before comparing both specializations	2026-09-07T04:18:17+00:00
B025	postflop_cuda	2b111e836f03789ae043215ed57cf8d3b730228d	baseline	postflop.Ks7h2dQhTc.check_ms	0.596	Fresh original action-kernel timings and 1/2/3/4/5/11-action DCFR/CFR+ state reference before comparing both specializations	2026-09-07T04:18:17+00:00
E023R	postflop_cuda	1d86527a33d981047da841a5b83aff4a0939430e	keep	postflop.Ks7h2d.iso.allocated_vram_mb	6241.124352	Repeat both action specializations against fresh original control; exact common/generic-menu and CFR+ checks; pre-compaction capacity reference	2026-09-07T04:20:03+00:00
E023R	postflop_cuda	1d86527a33d981047da841a5b83aff4a0939430e	keep	postflop.Ks7h2d.iso.estimated_vram_mb	6716.6347	Repeat both action specializations against fresh original control; exact common/generic-menu and CFR+ checks; pre-compaction capacity reference	2026-09-07T04:20:03+00:00
E023R	postflop_cuda	1d86527a33d981047da841a5b83aff4a0939430e	keep	postflop.Ks7h2d.iso.init_ms	854.3783999999999	Repeat both action specializations against fresh original control; exact common/generic-menu and CFR+ checks; pre-compaction capacity reference	2026-09-07T04:20:03+00:00
E023R	postflop_cuda	1d86527a33d981047da841a5b83aff4a0939430e	keep	postflop.Ks7h2d.iso.plan_build_ms	105.9177	Repeat both action specializations against fresh original control; exact common/generic-menu and CFR+ checks; pre-compaction capacity reference	2026-09-07T04:20:03+00:00
