experiment	path	commit	status	metric	value	hypothesis	utc
E023R	postflop_cuda	1d86527a33d981047da841a5b83aff4a0939430e	keep	postflop.Ks7h2d.iso.staging_memory_mb	3380.293588	Repeat both action specializations against fresh original control; exact common/generic-menu and CFR+ checks; pre-compaction capacity reference	2026-09-07T04:20:03+00:00
E023R	postflop_cuda	1d86527a33d981047da841a5b83aff4a0939430e	keep	postflop.Ks7s2d.iso.allocated_vram_mb	4932.501504	Repeat both action specializations against fresh original control; exact common/generic-menu and CFR+ checks; pre-compaction capacity reference	2026-09-07T04:20:03+00:00
E023R	postflop_cuda	1d86527a33d981047da841a5b83aff4a0939430e	keep	postflop.Ks7s2d.iso.estimated_vram_mb	6737.546704	Repeat both action specializations against fresh original control; exact common/generic-menu and CFR+ checks; pre-compaction capacity reference	2026-09-07T04:20:03+00:00
E023R	postflop_cuda	1d86527a33d981047da841a5b83aff4a0939430e	keep	postflop.Ks7s2d.iso.init_ms	674.3261	Repeat both action specializations against fresh original control; exact common/generic-menu and CFR+ checks; pre-compaction capacity reference	2026-09-07T04:20:03+00:00
E023R	postflop_cuda	1d86527a33d981047da841a5b83aff4a0939430e	keep	postflop.Ks7s2d.iso.plan_build_ms	106.6646	Repeat both action specializations against fresh original control; exact common/generic-menu and CFR+ checks; pre-compaction capacity reference	2026-09-07T04:20:03+00:00
E023R	postflop_cuda	1d86527a33d981047da841a5b83aff4a0939430e	keep	postflop.Ks7s2d.iso.staging_memory_mb	2063.622928	Repeat both action specializations against fresh original control; exact common/generic-menu and CFR+ checks; pre-compaction capacity reference	2026-09-07T04:20:03+00:00
E023R	postflop_cuda	1d86527a33d981047da841a5b83aff4a0939430e	keep	postflop.Ks7s2d.full.allocated_vram_mb	6274.678784	Repeat both action specializations against fresh original control; exact common/generic-menu and CFR+ checks; pre-compaction capacity reference	2026-09-07T04:20:03+00:00
E023R	postflop_cuda	1d86527a33d981047da841a5b83aff4a0939430e	keep	postflop.Ks7s2d.full.estimated_vram_mb	6737.546704	Repeat both action specializations against fresh original control; exact common/generic-menu and CFR+ checks; pre-compaction capacity reference	2026-09-07T04:20:03+00:00
E023R	postflop_cuda	1d86527a33d981047da841a5b83aff4a0939430e	keep	postflop.Ks7s2d.full.init_ms	605.7013	Repeat both action specializations against fresh original control; exact common/generic-menu and CFR+ checks; pre-compaction capacity reference	2026-09-07T04:20:03+00:00
E023R	postflop_cuda	1d86527a33d981047da841a5b83aff4a0939430e	keep	postflop.Ks7s2d.full.plan_build_ms	100.3169	Repeat both action specializations against fresh original control; exact common/generic-menu and CFR+ checks; pre-compaction capacity reference	2026-09-07T04:20:03+00:00
E023R	postflop_cuda	1d86527a33d981047da841a5b83aff4a0939430e	keep	postflop.Ks7s2d.full.staging_memory_mb	3391.473816	Repeat both action specializations against fresh original control; exact common/generic-menu and CFR+ checks; pre-compaction capacity reference	2026-09-07T04:20:03+00:00
E023R	postflop_cuda	1d86527a33d981047da841a5b83aff4a0939430e	keep	postflop.Ks7h2d.init_ms	1058.969	Repeat both action specializations against fresh original control; exact common/generic-menu and CFR+ checks; pre-compaction capacity reference	2026-09-07T04:20:03+00:00
E023R	postflop_cuda	1d86527a33d981047da841a5b83aff4a0939430e	keep	postflop.Ks7h2d.iteration_ms	51.82	Repeat both action specializations against fresh original control; exact common/generic-menu and CFR+ checks; pre-compaction capacity reference	2026-09-07T04:20:03+00:00
E023R	postflop_cuda	1d86527a33d981047da841a5b83aff4a0939430e	keep	postflop.Ks7h2d.check_ms	34.853	Repeat both action specializations against fresh original control; exact common/generic-menu and CFR+ checks; pre-compaction capacity reference	2026-09-07T04:20:03+00:00
E023R	postflop_cuda	1d86527a33d981047da841a5b83aff4a0939430e	keep	postflop.Ks7s2d.init_ms	643.856	Repeat both action specializations against fresh original control; exact common/generic-menu and CFR+ checks; pre-compaction capacity reference	2026-09-07T04:20:03+00:00
E023R	postflop_cuda	1d86527a33d981047da841a5b83aff4a0939430e	keep	postflop.Ks7s2d.iteration_ms	31.797	Repeat both action specializations against fresh original control; exact common/generic-menu and CFR+ checks; pre-compaction capacity reference	2026-09-07T04:20:03+00:00
E023R	postflop_cuda	1d86527a33d981047da841a5b83aff4a0939430e	keep	postflop.Ks7s2d.check_ms	29.15	Repeat both action specializations against fresh original control; exact common/generic-menu and CFR+ checks; pre-compaction capacity reference	2026-09-07T04:20:03+00:00
E023R	postflop_cuda	1d86527a33d981047da841a5b83aff4a0939430e	keep	postflop.Ks7h2dQhTc.init_ms	125.861	Repeat both action specializations against fresh original control; exact common/generic-menu and CFR+ checks; pre-compaction capacity reference	2026-09-07T04:20:03+00:00
E023R	postflop_cuda	1d86527a33d981047da841a5b83aff4a0939430e	keep	postflop.Ks7h2dQhTc.iteration_ms	0.259	Repeat both action specializations against fresh original control; exact common/generic-menu and CFR+ checks; pre-compaction capacity reference	2026-09-07T04:20:03+00:00
E023R	postflop_cuda	1d86527a33d981047da841a5b83aff4a0939430e	keep	postflop.Ks7h2dQhTc.check_ms	1.246	Repeat both action specializations against fresh original control; exact common/generic-menu and CFR+ checks; pre-compaction capacity reference	2026-09-07T04:20:03+00:00
E024A	memory_transfers	8564c2ac941068aba87ceaa25f38504b4bfd4d35	discard	postflop.Ks7h2d.iso.allocated_vram_mb	6174.015488	Correct stream receiver and test compact postflop action arenas against frozen raw storage, save, query, EV and resume controls	2026-09-07T04:23:27+00:00
E024A	memory_transfers	8564c2ac941068aba87ceaa25f38504b4bfd4d35	discard	postflop.Ks7h2d.iso.estimated_vram_mb	6716.6347	Correct stream receiver and test compact postflop action arenas against frozen raw storage, save, query, EV and resume controls	2026-09-07T04:23:27+00:00
E024A	memory_transfers	8564c2ac941068aba87ceaa25f38504b4bfd4d35	discard	postflop.Ks7h2d.iso.init_ms	1370.1408	Correct stream receiver and test compact postflop action arenas against frozen raw storage, save, query, EV and resume controls	2026-09-07T04:23:27+00:00
E024A	memory_transfers	8564c2ac941068aba87ceaa25f38504b4bfd4d35	discard	postflop.Ks7h2d.iso.plan_build_ms	103.4734	Correct stream receiver and test compact postflop action arenas against frozen raw storage, save, query, EV and resume controls	2026-09-07T04:23:27+00:00
E024A	memory_transfers	8564c2ac941068aba87ceaa25f38504b4bfd4d35	discard	postflop.Ks7h2d.iso.staging_memory_mb	3380.293588	Correct stream receiver and test compact postflop action arenas against frozen raw storage, save, query, EV and resume controls	2026-09-07T04:23:27+00:00
E024A	memory_transfers	8564c2ac941068aba87ceaa25f38504b4bfd4d35	discard	postflop.Ks7s2d.iso.allocated_vram_mb	3825.205248	Correct stream receiver and test compact postflop action arenas against frozen raw storage, save, query, EV and resume controls	2026-09-07T04:23:27+00:00
E024A	memory_transfers	8564c2ac941068aba87ceaa25f38504b4bfd4d35	discard	postflop.Ks7s2d.iso.estimated_vram_mb	6737.546704	Correct stream receiver and test compact postflop action arenas against frozen raw storage, save, query, EV and resume controls	2026-09-07T04:23:27+00:00
E024A	memory_transfers	8564c2ac941068aba87ceaa25f38504b4bfd4d35	discard	postflop.Ks7s2d.iso.init_ms	1091.8238000000001	Correct stream receiver and test compact postflop action arenas against frozen raw storage, save, query, EV and resume controls	2026-09-07T04:23:27+00:00
E024A	memory_transfers	8564c2ac941068aba87ceaa25f38504b4bfd4d35	discard	postflop.Ks7s2d.iso.plan_build_ms	76.9345	Correct stream receiver and test compact postflop action arenas against frozen raw storage, save, query, EV and resume controls	2026-09-07T04:23:27+00:00
E024A	memory_transfers	8564c2ac941068aba87ceaa25f38504b4bfd4d35	discard	postflop.Ks7s2d.iso.staging_memory_mb	2063.622928	Correct stream receiver and test compact postflop action arenas against frozen raw storage, save, query, EV and resume controls	2026-09-07T04:23:27+00:00
E024A	memory_transfers	8564c2ac941068aba87ceaa25f38504b4bfd4d35	discard	postflop.Ks7s2d.full.allocated_vram_mb	6207.56992	Correct stream receiver and test compact postflop action arenas against frozen raw storage, save, query, EV and resume controls	2026-09-07T04:23:27+00:00
E024A	memory_transfers	8564c2ac941068aba87ceaa25f38504b4bfd4d35	discard	postflop.Ks7s2d.full.estimated_vram_mb	6737.546704	Correct stream receiver and test compact postflop action arenas against frozen raw storage, save, query, EV and resume controls	2026-09-07T04:23:27+00:00
E024A	memory_transfers	8564c2ac941068aba87ceaa25f38504b4bfd4d35	discard	postflop.Ks7s2d.full.init_ms	1287.3741	Correct stream receiver and test compact postflop action arenas against frozen raw storage, save, query, EV and resume controls	2026-09-07T04:23:27+00:00
E024A	memory_transfers	8564c2ac941068aba87ceaa25f38504b4bfd4d35	discard	postflop.Ks7s2d.full.plan_build_ms	105.18610000000001	Correct stream receiver and test compact postflop action arenas against frozen raw storage, save, query, EV and resume controls	2026-09-07T04:23:27+00:00
E024A	memory_transfers	8564c2ac941068aba87ceaa25f38504b4bfd4d35	discard	postflop.Ks7s2d.full.staging_memory_mb	3391.473816	Correct stream receiver and test compact postflop action arenas against frozen raw storage, save, query, EV and resume controls	2026-09-07T04:23:27+00:00
E024A	memory_transfers	8564c2ac941068aba87ceaa25f38504b4bfd4d35	discard	postflop.Ks7h2d.init_ms	1603.856	Correct stream receiver and test compact postflop action arenas against frozen raw storage, save, query, EV and resume controls	2026-09-07T04:23:27+00:00
E024A	memory_transfers	8564c2ac941068aba87ceaa25f38504b4bfd4d35	discard	postflop.Ks7h2d.iteration_ms	52.02	Correct stream receiver and test compact postflop action arenas against frozen raw storage, save, query, EV and resume controls	2026-09-07T04:23:27+00:00
E024A	memory_transfers	8564c2ac941068aba87ceaa25f38504b4bfd4d35	discard	postflop.Ks7h2d.check_ms	34.724	Correct stream receiver and test compact postflop action arenas against frozen raw storage, save, query, EV and resume controls	2026-09-07T04:23:27+00:00
E024A	memory_transfers	8564c2ac941068aba87ceaa25f38504b4bfd4d35	discard	postflop.Ks7s2d.init_ms	1089.805	Correct stream receiver and test compact postflop action arenas against frozen raw storage, save, query, EV and resume controls	2026-09-07T04:23:27+00:00
E024A	memory_transfers	8564c2ac941068aba87ceaa25f38504b4bfd4d35	discard	postflop.Ks7s2d.iteration_ms	31.309	Correct stream receiver and test compact postflop action arenas against frozen raw storage, save, query, EV and resume controls	2026-09-07T04:23:27+00:00
E024A	memory_transfers	8564c2ac941068aba87ceaa25f38504b4bfd4d35	discard	postflop.Ks7s2d.check_ms	28.734	Correct stream receiver and test compact postflop action arenas against frozen raw storage, save, query, EV and resume controls	2026-09-07T04:23:27+00:00
E024A	memory_transfers	8564c2ac941068aba87ceaa25f38504b4bfd4d35	discard	postflop.Ks7h2dQhTc.init_ms	70.046	Correct stream receiver and test compact postflop action arenas against frozen raw storage, save, query, EV and resume controls	2026-09-07T04:23:27+00:00
E024A	memory_transfers	8564c2ac941068aba87ceaa25f38504b4bfd4d35	discard	postflop.Ks7h2dQhTc.iteration_ms	0.288	Correct stream receiver and test compact postflop action arenas against frozen raw storage, save, query, EV and resume controls	2026-09-07T04:23:27+00:00
E024A	memory_transfers	8564c2ac941068aba87ceaa25f38504b4bfd4d35	discard	postflop.Ks7h2dQhTc.check_ms	0.623	Correct stream receiver and test compact postflop action arenas against frozen raw storage, save, query, EV and resume controls	2026-09-07T04:23:27+00:00
E024B	memory_transfers	e274391f6fe54ba1a0fcfcf28349c8d7f89a9219	discard	postflop.Ks7h2d.iso.allocated_vram_mb	6241.124352	Use packed action arenas only when at least five percent of action elements are inactive; recover direct-upload latency on rainbow and no-isomorphism controls	2026-09-07T04:26:31+00:00
E024B	memory_transfers	e274391f6fe54ba1a0fcfcf28349c8d7f89a9219	discard	postflop.Ks7h2d.iso.estimated_vram_mb	6716.6347	Use packed action arenas only when at least five percent of action elements are inactive; recover direct-upload latency on rainbow and no-isomorphism controls	2026-09-07T04:26:31+00:00
E024B	memory_transfers	e274391f6fe54ba1a0fcfcf28349c8d7f89a9219	discard	postflop.Ks7h2d.iso.init_ms	871.0727	Use packed action arenas only when at least five percent of action elements are inactive; recover direct-upload latency on rainbow and no-isomorphism controls	2026-09-07T04:26:31+00:00
E024B	memory_transfers	e274391f6fe54ba1a0fcfcf28349c8d7f89a9219	discard	postflop.Ks7h2d.iso.plan_build_ms	102.9614	Use packed action arenas only when at least five percent of action elements are inactive; recover direct-upload latency on rainbow and no-isomorphism controls	2026-09-07T04:26:31+00:00
E024B	memory_transfers	e274391f6fe54ba1a0fcfcf28349c8d7f89a9219	discard	postflop.Ks7h2d.iso.staging_memory_mb	3380.293588	Use packed action arenas only when at least five percent of action elements are inactive; recover direct-upload latency on rainbow and no-isomorphism controls	2026-09-07T04:26:31+00:00
E024B	memory_transfers	e274391f6fe54ba1a0fcfcf28349c8d7f89a9219	discard	postflop.Ks7s2d.iso.allocated_vram_mb	3825.205248	Use packed action arenas only when at least five percent of action elements are inactive; recover direct-upload latency on rainbow and no-isomorphism controls	2026-09-07T04:26:31+00:00
E024B	memory_transfers	e274391f6fe54ba1a0fcfcf28349c8d7f89a9219	discard	postflop.Ks7s2d.iso.estimated_vram_mb	6737.546704	Use packed action arenas only when at least five percent of action elements are inactive; recover direct-upload latency on rainbow and no-isomorphism controls	2026-09-07T04:26:31+00:00
E024B	memory_transfers	e274391f6fe54ba1a0fcfcf28349c8d7f89a9219	discard	postflop.Ks7s2d.iso.init_ms	944.487	Use packed action arenas only when at least five percent of action elements are inactive; recover direct-upload latency on rainbow and no-isomorphism controls	2026-09-07T04:26:31+00:00
E024B	memory_transfers	e274391f6fe54ba1a0fcfcf28349c8d7f89a9219	discard	postflop.Ks7s2d.iso.plan_build_ms	100.2709	Use packed action arenas only when at least five percent of action elements are inactive; recover direct-upload latency on rainbow and no-isomorphism controls	2026-09-07T04:26:31+00:00
E024B	memory_transfers	e274391f6fe54ba1a0fcfcf28349c8d7f89a9219	discard	postflop.Ks7s2d.iso.staging_memory_mb	2063.622928	Use packed action arenas only when at least five percent of action elements are inactive; recover direct-upload latency on rainbow and no-isomorphism controls	2026-09-07T04:26:31+00:00
E024B	memory_transfers	e274391f6fe54ba1a0fcfcf28349c8d7f89a9219	discard	postflop.Ks7s2d.full.allocated_vram_mb	6274.678784	Use packed action arenas only when at least five percent of action elements are inactive; recover direct-upload latency on rainbow and no-isomorphism controls	2026-09-07T04:26:31+00:00
E024B	memory_transfers	e274391f6fe54ba1a0fcfcf28349c8d7f89a9219	discard	postflop.Ks7s2d.full.estimated_vram_mb	6737.546704	Use packed action arenas only when at least five percent of action elements are inactive; recover direct-upload latency on rainbow and no-isomorphism controls	2026-09-07T04:26:31+00:00
E024B	memory_transfers	e274391f6fe54ba1a0fcfcf28349c8d7f89a9219	discard	postflop.Ks7s2d.full.init_ms	643.1247	Use packed action arenas only when at least five percent of action elements are inactive; recover direct-upload latency on rainbow and no-isomorphism controls	2026-09-07T04:26:31+00:00
E024B	memory_transfers	e274391f6fe54ba1a0fcfcf28349c8d7f89a9219	discard	postflop.Ks7s2d.full.plan_build_ms	104.5796	Use packed action arenas only when at least five percent of action elements are inactive; recover direct-upload latency on rainbow and no-isomorphism controls	2026-09-07T04:26:31+00:00
E024B	memory_transfers	e274391f6fe54ba1a0fcfcf28349c8d7f89a9219	discard	postflop.Ks7s2d.full.staging_memory_mb	3391.473816	Use packed action arenas only when at least five percent of action elements are inactive; recover direct-upload latency on rainbow and no-isomorphism controls	2026-09-07T04:26:31+00:00
E024B	memory_transfers	e274391f6fe54ba1a0fcfcf28349c8d7f89a9219	discard	postflop.Ks7h2d.init_ms	1137.271	Use packed action arenas only when at least five percent of action elements are inactive; recover direct-upload latency on rainbow and no-isomorphism controls	2026-09-07T04:26:31+00:00
E024B	memory_transfers	e274391f6fe54ba1a0fcfcf28349c8d7f89a9219	discard	postflop.Ks7h2d.iteration_ms	52.077	Use packed action arenas only when at least five percent of action elements are inactive; recover direct-upload latency on rainbow and no-isomorphism controls	2026-09-07T04:26:31+00:00
E024B	memory_transfers	e274391f6fe54ba1a0fcfcf28349c8d7f89a9219	discard	postflop.Ks7h2d.check_ms	34.914	Use packed action arenas only when at least five percent of action elements are inactive; recover direct-upload latency on rainbow and no-isomorphism controls	2026-09-07T04:26:31+00:00
E024B	memory_transfers	e274391f6fe54ba1a0fcfcf28349c8d7f89a9219	discard	postflop.Ks7s2d.init_ms	1037.444	Use packed action arenas only when at least five percent of action elements are inactive; recover direct-upload latency on rainbow and no-isomorphism controls	2026-09-07T04:26:31+00:00
E024B	memory_transfers	e274391f6fe54ba1a0fcfcf28349c8d7f89a9219	discard	postflop.Ks7s2d.iteration_ms	31.269	Use packed action arenas only when at least five percent of action elements are inactive; recover direct-upload latency on rainbow and no-isomorphism controls	2026-09-07T04:26:31+00:00
E024B	memory_transfers	e274391f6fe54ba1a0fcfcf28349c8d7f89a9219	discard	postflop.Ks7s2d.check_ms	28.227	Use packed action arenas only when at least five percent of action elements are inactive; recover direct-upload latency on rainbow and no-isomorphism controls	2026-09-07T04:26:31+00:00
E024B	memory_transfers	e274391f6fe54ba1a0fcfcf28349c8d7f89a9219	discard	postflop.Ks7h2dQhTc.init_ms	67.566	Use packed action arenas only when at least five percent of action elements are inactive; recover direct-upload latency on rainbow and no-isomorphism controls	2026-09-07T04:26:31+00:00
E024B	memory_transfers	e274391f6fe54ba1a0fcfcf28349c8d7f89a9219	discard	postflop.Ks7h2dQhTc.iteration_ms	0.287	Use packed action arenas only when at least five percent of action elements are inactive; recover direct-upload latency on rainbow and no-isomorphism controls	2026-09-07T04:26:31+00:00
E024B	memory_transfers	e274391f6fe54ba1a0fcfcf28349c8d7f89a9219	discard	postflop.Ks7h2dQhTc.check_ms	0.573	Use packed action arenas only when at least five percent of action elements are inactive; recover direct-upload latency on rainbow and no-isomorphism controls	2026-09-07T04:26:31+00:00
B026	memory_transfers	1e6124f2ba907afca9e9597f169ccca621251485	baseline	postflop.memory.cold.f32.allocated_vram_mb	4932.501504	Pre-compaction full action-arena reference for cold/warm F32/compressed live host memory, VRAM, GPU initialization and both download paths	2026-09-07T04:28:48+00:00
B026	memory_transfers	1e6124f2ba907afca9e9597f169ccca621251485	baseline	postflop.memory.cold.f32.host_live_mb	3924.324352	Pre-compaction full action-arena reference for cold/warm F32/compressed live host memory, VRAM, GPU initialization and both download paths	2026-09-07T04:28:48+00:00
B026	memory_transfers	1e6124f2ba907afca9e9597f169ccca621251485	baseline	postflop.memory.cold.f32.host_private_mb	9447.09632	Pre-compaction full action-arena reference for cold/warm F32/compressed live host memory, VRAM, GPU initialization and both download paths	2026-09-07T04:28:48+00:00
B026	memory_transfers	1e6124f2ba907afca9e9597f169ccca621251485	baseline	postflop.memory.cold.f32.init_ms	653.0877	Pre-compaction full action-arena reference for cold/warm F32/compressed live host memory, VRAM, GPU initialization and both download paths	2026-09-07T04:28:48+00:00
B026	memory_transfers	1e6124f2ba907afca9e9597f169ccca621251485	baseline	postflop.memory.cold.f32.strategy_sync_ms	169.63739999999999	Pre-compaction full action-arena reference for cold/warm F32/compressed live host memory, VRAM, GPU initialization and both download paths	2026-09-07T04:28:48+00:00
B026	memory_transfers	1e6124f2ba907afca9e9597f169ccca621251485	baseline	postflop.memory.cold.f32.sync_ms	331.9303	Pre-compaction full action-arena reference for cold/warm F32/compressed live host memory, VRAM, GPU initialization and both download paths	2026-09-07T04:28:48+00:00
B026	memory_transfers	1e6124f2ba907afca9e9597f169ccca621251485	baseline	postflop.memory.warm.f32.allocated_vram_mb	4932.501504	Pre-compaction full action-arena reference for cold/warm F32/compressed live host memory, VRAM, GPU initialization and both download paths	2026-09-07T04:28:48+00:00
B026	memory_transfers	1e6124f2ba907afca9e9597f169ccca621251485	baseline	postflop.memory.warm.f32.host_live_mb	3936.01024	Pre-compaction full action-arena reference for cold/warm F32/compressed live host memory, VRAM, GPU initialization and both download paths	2026-09-07T04:28:48+00:00
B026	memory_transfers	1e6124f2ba907afca9e9597f169ccca621251485	baseline	postflop.memory.warm.f32.host_private_mb	9446.637568	Pre-compaction full action-arena reference for cold/warm F32/compressed live host memory, VRAM, GPU initialization and both download paths	2026-09-07T04:28:48+00:00
