experiment	path	commit	status	metric	value	hypothesis	utc
E037DR	preflop_cuda	76ca9e7ded44b122049901ac81c23509037fe891	keep	postflop.memory.rainbow.warm.compressed.strategy_sync_ms	167.7842	Repeat adaptive launch geometry with exact stopping and GPU/cache gates; collect fresh compressed lifecycle controls for the upload trial	2026-09-07T06:22:38+00:00
E037DR	preflop_cuda	76ca9e7ded44b122049901ac81c23509037fe891	keep	postflop.memory.rainbow.warm.compressed.sync_ms	337.7634	Repeat adaptive launch geometry with exact stopping and GPU/cache gates; collect fresh compressed lifecycle controls for the upload trial	2026-09-07T06:22:38+00:00
E037DR	preflop_cuda	76ca9e7ded44b122049901ac81c23509037fe891	keep	postflop.memory.cold.f32.allocated_vram_mb	4731.174912	Repeat adaptive launch geometry with exact stopping and GPU/cache gates; collect fresh compressed lifecycle controls for the upload trial	2026-09-07T06:22:38+00:00
E037DR	preflop_cuda	76ca9e7ded44b122049901ac81c23509037fe891	keep	postflop.memory.cold.f32.host_live_mb	3917.53728	Repeat adaptive launch geometry with exact stopping and GPU/cache gates; collect fresh compressed lifecycle controls for the upload trial	2026-09-07T06:22:38+00:00
E037DR	preflop_cuda	76ca9e7ded44b122049901ac81c23509037fe891	keep	postflop.memory.cold.f32.host_private_mb	9230.974976	Repeat adaptive launch geometry with exact stopping and GPU/cache gates; collect fresh compressed lifecycle controls for the upload trial	2026-09-07T06:22:38+00:00
E037DR	preflop_cuda	76ca9e7ded44b122049901ac81c23509037fe891	keep	postflop.memory.cold.f32.init_ms	679.433	Repeat adaptive launch geometry with exact stopping and GPU/cache gates; collect fresh compressed lifecycle controls for the upload trial	2026-09-07T06:22:38+00:00
E037DR	preflop_cuda	76ca9e7ded44b122049901ac81c23509037fe891	keep	postflop.memory.cold.f32.strategy_sync_ms	157.2373	Repeat adaptive launch geometry with exact stopping and GPU/cache gates; collect fresh compressed lifecycle controls for the upload trial	2026-09-07T06:22:38+00:00
E037DR	preflop_cuda	76ca9e7ded44b122049901ac81c23509037fe891	keep	postflop.memory.cold.f32.sync_ms	311.70750000000004	Repeat adaptive launch geometry with exact stopping and GPU/cache gates; collect fresh compressed lifecycle controls for the upload trial	2026-09-07T06:22:38+00:00
E037DR	preflop_cuda	76ca9e7ded44b122049901ac81c23509037fe891	keep	postflop.memory.warm.f32.allocated_vram_mb	4731.174912	Repeat adaptive launch geometry with exact stopping and GPU/cache gates; collect fresh compressed lifecycle controls for the upload trial	2026-09-07T06:22:38+00:00
E037DR	preflop_cuda	76ca9e7ded44b122049901ac81c23509037fe891	keep	postflop.memory.warm.f32.host_live_mb	3936.321536	Repeat adaptive launch geometry with exact stopping and GPU/cache gates; collect fresh compressed lifecycle controls for the upload trial	2026-09-07T06:22:38+00:00
E037DR	preflop_cuda	76ca9e7ded44b122049901ac81c23509037fe891	keep	postflop.memory.warm.f32.host_private_mb	9246.261248	Repeat adaptive launch geometry with exact stopping and GPU/cache gates; collect fresh compressed lifecycle controls for the upload trial	2026-09-07T06:22:38+00:00
E037DR	preflop_cuda	76ca9e7ded44b122049901ac81c23509037fe891	keep	postflop.memory.warm.f32.init_ms	747.5805	Repeat adaptive launch geometry with exact stopping and GPU/cache gates; collect fresh compressed lifecycle controls for the upload trial	2026-09-07T06:22:38+00:00
E037DR	preflop_cuda	76ca9e7ded44b122049901ac81c23509037fe891	keep	postflop.memory.warm.f32.strategy_sync_ms	157.7772	Repeat adaptive launch geometry with exact stopping and GPU/cache gates; collect fresh compressed lifecycle controls for the upload trial	2026-09-07T06:22:38+00:00
E037DR	preflop_cuda	76ca9e7ded44b122049901ac81c23509037fe891	keep	postflop.memory.warm.f32.sync_ms	309.5161	Repeat adaptive launch geometry with exact stopping and GPU/cache gates; collect fresh compressed lifecycle controls for the upload trial	2026-09-07T06:22:38+00:00
E037DR	preflop_cuda	76ca9e7ded44b122049901ac81c23509037fe891	keep	postflop.memory.cold.compressed.allocated_vram_mb	3623.878656	Repeat adaptive launch geometry with exact stopping and GPU/cache gates; collect fresh compressed lifecycle controls for the upload trial	2026-09-07T06:22:38+00:00
E037DR	preflop_cuda	76ca9e7ded44b122049901ac81c23509037fe891	keep	postflop.memory.cold.compressed.host_live_mb	2300.452864	Repeat adaptive launch geometry with exact stopping and GPU/cache gates; collect fresh compressed lifecycle controls for the upload trial	2026-09-07T06:22:38+00:00
E037DR	preflop_cuda	76ca9e7ded44b122049901ac81c23509037fe891	keep	postflop.memory.cold.compressed.host_private_mb	6504.681472	Repeat adaptive launch geometry with exact stopping and GPU/cache gates; collect fresh compressed lifecycle controls for the upload trial	2026-09-07T06:22:38+00:00
E037DR	preflop_cuda	76ca9e7ded44b122049901ac81c23509037fe891	keep	postflop.memory.cold.compressed.init_ms	597.1931000000001	Repeat adaptive launch geometry with exact stopping and GPU/cache gates; collect fresh compressed lifecycle controls for the upload trial	2026-09-07T06:22:38+00:00
E037DR	preflop_cuda	76ca9e7ded44b122049901ac81c23509037fe891	keep	postflop.memory.cold.compressed.strategy_sync_ms	124.1716	Repeat adaptive launch geometry with exact stopping and GPU/cache gates; collect fresh compressed lifecycle controls for the upload trial	2026-09-07T06:22:38+00:00
E037DR	preflop_cuda	76ca9e7ded44b122049901ac81c23509037fe891	keep	postflop.memory.cold.compressed.sync_ms	254.95620000000002	Repeat adaptive launch geometry with exact stopping and GPU/cache gates; collect fresh compressed lifecycle controls for the upload trial	2026-09-07T06:22:38+00:00
E037DR	preflop_cuda	76ca9e7ded44b122049901ac81c23509037fe891	keep	postflop.memory.warm.compressed.allocated_vram_mb	3623.878656	Repeat adaptive launch geometry with exact stopping and GPU/cache gates; collect fresh compressed lifecycle controls for the upload trial	2026-09-07T06:22:38+00:00
E037DR	preflop_cuda	76ca9e7ded44b122049901ac81c23509037fe891	keep	postflop.memory.warm.compressed.host_live_mb	3769.335808	Repeat adaptive launch geometry with exact stopping and GPU/cache gates; collect fresh compressed lifecycle controls for the upload trial	2026-09-07T06:22:38+00:00
E037DR	preflop_cuda	76ca9e7ded44b122049901ac81c23509037fe891	keep	postflop.memory.warm.compressed.host_private_mb	8126.562304	Repeat adaptive launch geometry with exact stopping and GPU/cache gates; collect fresh compressed lifecycle controls for the upload trial	2026-09-07T06:22:38+00:00
E037DR	preflop_cuda	76ca9e7ded44b122049901ac81c23509037fe891	keep	postflop.memory.warm.compressed.init_ms	1005.5111999999999	Repeat adaptive launch geometry with exact stopping and GPU/cache gates; collect fresh compressed lifecycle controls for the upload trial	2026-09-07T06:22:38+00:00
E037DR	preflop_cuda	76ca9e7ded44b122049901ac81c23509037fe891	keep	postflop.memory.warm.compressed.strategy_sync_ms	143.0512	Repeat adaptive launch geometry with exact stopping and GPU/cache gates; collect fresh compressed lifecycle controls for the upload trial	2026-09-07T06:22:38+00:00
E037DR	preflop_cuda	76ca9e7ded44b122049901ac81c23509037fe891	keep	postflop.memory.warm.compressed.sync_ms	291.0126	Repeat adaptive launch geometry with exact stopping and GPU/cache gates; collect fresh compressed lifecycle controls for the upload trial	2026-09-07T06:22:38+00:00
E037DR	preflop_cuda	76ca9e7ded44b122049901ac81c23509037fe891	keep	preflop.3.iteration_ms	0.221	Repeat adaptive launch geometry with exact stopping and GPU/cache gates; collect fresh compressed lifecycle controls for the upload trial	2026-09-07T06:22:38+00:00
E037DR	preflop_cuda	76ca9e7ded44b122049901ac81c23509037fe891	keep	preflop.3.check_ms	0.503	Repeat adaptive launch geometry with exact stopping and GPU/cache gates; collect fresh compressed lifecycle controls for the upload trial	2026-09-07T06:22:38+00:00
E037DR	preflop_cuda	76ca9e7ded44b122049901ac81c23509037fe891	keep	preflop.3.sync_ms	0.057	Repeat adaptive launch geometry with exact stopping and GPU/cache gates; collect fresh compressed lifecycle controls for the upload trial	2026-09-07T06:22:38+00:00
E037DR	preflop_cuda	76ca9e7ded44b122049901ac81c23509037fe891	keep	preflop.5.iteration_ms	2.381	Repeat adaptive launch geometry with exact stopping and GPU/cache gates; collect fresh compressed lifecycle controls for the upload trial	2026-09-07T06:22:38+00:00
E037DR	preflop_cuda	76ca9e7ded44b122049901ac81c23509037fe891	keep	preflop.5.check_ms	2.464	Repeat adaptive launch geometry with exact stopping and GPU/cache gates; collect fresh compressed lifecycle controls for the upload trial	2026-09-07T06:22:38+00:00
E037DR	preflop_cuda	76ca9e7ded44b122049901ac81c23509037fe891	keep	preflop.5.sync_ms	4.035	Repeat adaptive launch geometry with exact stopping and GPU/cache gates; collect fresh compressed lifecycle controls for the upload trial	2026-09-07T06:22:38+00:00
E037DR	preflop_cuda	76ca9e7ded44b122049901ac81c23509037fe891	keep	preflop.7.iteration_ms	9.622	Repeat adaptive launch geometry with exact stopping and GPU/cache gates; collect fresh compressed lifecycle controls for the upload trial	2026-09-07T06:22:38+00:00
E037DR	preflop_cuda	76ca9e7ded44b122049901ac81c23509037fe891	keep	preflop.7.check_ms	6.261	Repeat adaptive launch geometry with exact stopping and GPU/cache gates; collect fresh compressed lifecycle controls for the upload trial	2026-09-07T06:22:38+00:00
E037DR	preflop_cuda	76ca9e7ded44b122049901ac81c23509037fe891	keep	preflop.7.sync_ms	15.892	Repeat adaptive launch geometry with exact stopping and GPU/cache gates; collect fresh compressed lifecycle controls for the upload trial	2026-09-07T06:22:38+00:00
E037DR	preflop_cuda	76ca9e7ded44b122049901ac81c23509037fe891	keep	preflop.9.iteration_ms	184.056	Repeat adaptive launch geometry with exact stopping and GPU/cache gates; collect fresh compressed lifecycle controls for the upload trial	2026-09-07T06:22:38+00:00
E037DR	preflop_cuda	76ca9e7ded44b122049901ac81c23509037fe891	keep	preflop.9.check_ms	112.307	Repeat adaptive launch geometry with exact stopping and GPU/cache gates; collect fresh compressed lifecycle controls for the upload trial	2026-09-07T06:22:38+00:00
E037DR	preflop_cuda	76ca9e7ded44b122049901ac81c23509037fe891	keep	preflop.9.sync_ms	317.055	Repeat adaptive launch geometry with exact stopping and GPU/cache gates; collect fresh compressed lifecycle controls for the upload trial	2026-09-07T06:22:38+00:00
E037DR	preflop_cuda	76ca9e7ded44b122049901ac81c23509037fe891	keep	preflop.2.iteration_ms	0.082	Repeat adaptive launch geometry with exact stopping and GPU/cache gates; collect fresh compressed lifecycle controls for the upload trial	2026-09-07T06:22:38+00:00
E037DR	preflop_cuda	76ca9e7ded44b122049901ac81c23509037fe891	keep	preflop.2.check_ms	0.268	Repeat adaptive launch geometry with exact stopping and GPU/cache gates; collect fresh compressed lifecycle controls for the upload trial	2026-09-07T06:22:38+00:00
E037DR	preflop_cuda	76ca9e7ded44b122049901ac81c23509037fe891	keep	preflop.2.sync_ms	0.03	Repeat adaptive launch geometry with exact stopping and GPU/cache gates; collect fresh compressed lifecycle controls for the upload trial	2026-09-07T06:22:38+00:00
E037DR	preflop_cuda	76ca9e7ded44b122049901ac81c23509037fe891	keep	preflop.6.iteration_ms	12.656	Repeat adaptive launch geometry with exact stopping and GPU/cache gates; collect fresh compressed lifecycle controls for the upload trial	2026-09-07T06:22:38+00:00
E037DR	preflop_cuda	76ca9e7ded44b122049901ac81c23509037fe891	keep	preflop.6.check_ms	9.033	Repeat adaptive launch geometry with exact stopping and GPU/cache gates; collect fresh compressed lifecycle controls for the upload trial	2026-09-07T06:22:38+00:00
E037DR	preflop_cuda	76ca9e7ded44b122049901ac81c23509037fe891	keep	preflop.6.sync_ms	25.226	Repeat adaptive launch geometry with exact stopping and GPU/cache gates; collect fresh compressed lifecycle controls for the upload trial	2026-09-07T06:22:38+00:00
E037DR	preflop_cuda	76ca9e7ded44b122049901ac81c23509037fe891	keep	preflop.8.iteration_ms	41.825	Repeat adaptive launch geometry with exact stopping and GPU/cache gates; collect fresh compressed lifecycle controls for the upload trial	2026-09-07T06:22:38+00:00
E037DR	preflop_cuda	76ca9e7ded44b122049901ac81c23509037fe891	keep	preflop.8.check_ms	25.355	Repeat adaptive launch geometry with exact stopping and GPU/cache gates; collect fresh compressed lifecycle controls for the upload trial	2026-09-07T06:22:38+00:00
E037DR	preflop_cuda	76ca9e7ded44b122049901ac81c23509037fe891	keep	preflop.8.sync_ms	69.182	Repeat adaptive launch geometry with exact stopping and GPU/cache gates; collect fresh compressed lifecycle controls for the upload trial	2026-09-07T06:22:38+00:00
E037DR	preflop_cuda	76ca9e7ded44b122049901ac81c23509037fe891	keep	preflop.6.target_seconds	2.2677291	Repeat adaptive launch geometry with exact stopping and GPU/cache gates; collect fresh compressed lifecycle controls for the upload trial	2026-09-07T06:22:38+00:00
E037DR	preflop_cuda	76ca9e7ded44b122049901ac81c23509037fe891	keep	preflop.8.target_seconds	5.336061	Repeat adaptive launch geometry with exact stopping and GPU/cache gates; collect fresh compressed lifecycle controls for the upload trial	2026-09-07T06:22:38+00:00
E038	memory_transfers	523c8d45ddf1d444e33523484673bf815a33c243	discard	postflop.memory.rainbow.cold.compressed.allocated_vram_mb	5905.580032	Decode compressed upload directly into disjoint pinned chunks in parallel, preserving per-node scales and exact output; retain serial fallback for small buffers.	2026-09-07T06:29:47+00:00
E038	memory_transfers	523c8d45ddf1d444e33523484673bf815a33c243	discard	postflop.memory.rainbow.cold.compressed.host_live_mb	2601.775104	Decode compressed upload directly into disjoint pinned chunks in parallel, preserving per-node scales and exact output; retain serial fallback for small buffers.	2026-09-07T06:29:47+00:00
E038	memory_transfers	523c8d45ddf1d444e33523484673bf815a33c243	discard	postflop.memory.rainbow.cold.compressed.host_private_mb	9098.858496	Decode compressed upload directly into disjoint pinned chunks in parallel, preserving per-node scales and exact output; retain serial fallback for small buffers.	2026-09-07T06:29:47+00:00
E038	memory_transfers	523c8d45ddf1d444e33523484673bf815a33c243	discard	postflop.memory.rainbow.cold.compressed.init_ms	899.1308	Decode compressed upload directly into disjoint pinned chunks in parallel, preserving per-node scales and exact output; retain serial fallback for small buffers.	2026-09-07T06:29:47+00:00
E038	memory_transfers	523c8d45ddf1d444e33523484673bf815a33c243	discard	postflop.memory.rainbow.cold.compressed.strategy_sync_ms	180.2157	Decode compressed upload directly into disjoint pinned chunks in parallel, preserving per-node scales and exact output; retain serial fallback for small buffers.	2026-09-07T06:29:47+00:00
E038	memory_transfers	523c8d45ddf1d444e33523484673bf815a33c243	discard	postflop.memory.rainbow.cold.compressed.sync_ms	355.3143	Decode compressed upload directly into disjoint pinned chunks in parallel, preserving per-node scales and exact output; retain serial fallback for small buffers.	2026-09-07T06:29:47+00:00
E038	memory_transfers	523c8d45ddf1d444e33523484673bf815a33c243	discard	postflop.memory.rainbow.warm.compressed.allocated_vram_mb	5905.580032	Decode compressed upload directly into disjoint pinned chunks in parallel, preserving per-node scales and exact output; retain serial fallback for small buffers.	2026-09-07T06:29:47+00:00
E038	memory_transfers	523c8d45ddf1d444e33523484673bf815a33c243	discard	postflop.memory.rainbow.warm.compressed.host_live_mb	2611.736576	Decode compressed upload directly into disjoint pinned chunks in parallel, preserving per-node scales and exact output; retain serial fallback for small buffers.	2026-09-07T06:29:47+00:00
E038	memory_transfers	523c8d45ddf1d444e33523484673bf815a33c243	discard	postflop.memory.rainbow.warm.compressed.host_private_mb	9107.472384	Decode compressed upload directly into disjoint pinned chunks in parallel, preserving per-node scales and exact output; retain serial fallback for small buffers.	2026-09-07T06:29:47+00:00
E038	memory_transfers	523c8d45ddf1d444e33523484673bf815a33c243	discard	postflop.memory.rainbow.warm.compressed.init_ms	848.7948	Decode compressed upload directly into disjoint pinned chunks in parallel, preserving per-node scales and exact output; retain serial fallback for small buffers.	2026-09-07T06:29:47+00:00
E038	memory_transfers	523c8d45ddf1d444e33523484673bf815a33c243	discard	postflop.memory.rainbow.warm.compressed.strategy_sync_ms	177.6823	Decode compressed upload directly into disjoint pinned chunks in parallel, preserving per-node scales and exact output; retain serial fallback for small buffers.	2026-09-07T06:29:47+00:00
E038	memory_transfers	523c8d45ddf1d444e33523484673bf815a33c243	discard	postflop.memory.rainbow.warm.compressed.sync_ms	338.34979999999996	Decode compressed upload directly into disjoint pinned chunks in parallel, preserving per-node scales and exact output; retain serial fallback for small buffers.	2026-09-07T06:29:47+00:00
E038	memory_transfers	523c8d45ddf1d444e33523484673bf815a33c243	discard	postflop.memory.cold.f32.allocated_vram_mb	4731.174912	Decode compressed upload directly into disjoint pinned chunks in parallel, preserving per-node scales and exact output; retain serial fallback for small buffers.	2026-09-07T06:29:47+00:00
E038	memory_transfers	523c8d45ddf1d444e33523484673bf815a33c243	discard	postflop.memory.cold.f32.host_live_mb	3917.058048	Decode compressed upload directly into disjoint pinned chunks in parallel, preserving per-node scales and exact output; retain serial fallback for small buffers.	2026-09-07T06:29:47+00:00
E038	memory_transfers	523c8d45ddf1d444e33523484673bf815a33c243	discard	postflop.memory.cold.f32.host_private_mb	9229.254656	Decode compressed upload directly into disjoint pinned chunks in parallel, preserving per-node scales and exact output; retain serial fallback for small buffers.	2026-09-07T06:29:47+00:00
E038	memory_transfers	523c8d45ddf1d444e33523484673bf815a33c243	discard	postflop.memory.cold.f32.init_ms	689.8482	Decode compressed upload directly into disjoint pinned chunks in parallel, preserving per-node scales and exact output; retain serial fallback for small buffers.	2026-09-07T06:29:47+00:00
E038	memory_transfers	523c8d45ddf1d444e33523484673bf815a33c243	discard	postflop.memory.cold.f32.strategy_sync_ms	154.07229999999998	Decode compressed upload directly into disjoint pinned chunks in parallel, preserving per-node scales and exact output; retain serial fallback for small buffers.	2026-09-07T06:29:47+00:00
E038	memory_transfers	523c8d45ddf1d444e33523484673bf815a33c243	discard	postflop.memory.cold.f32.sync_ms	313.1286	Decode compressed upload directly into disjoint pinned chunks in parallel, preserving per-node scales and exact output; retain serial fallback for small buffers.	2026-09-07T06:29:47+00:00
E038	memory_transfers	523c8d45ddf1d444e33523484673bf815a33c243	discard	postflop.memory.warm.f32.allocated_vram_mb	4731.174912	Decode compressed upload directly into disjoint pinned chunks in parallel, preserving per-node scales and exact output; retain serial fallback for small buffers.	2026-09-07T06:29:47+00:00
E038	memory_transfers	523c8d45ddf1d444e33523484673bf815a33c243	discard	postflop.memory.warm.f32.host_live_mb	3932.807168	Decode compressed upload directly into disjoint pinned chunks in parallel, preserving per-node scales and exact output; retain serial fallback for small buffers.	2026-09-07T06:29:47+00:00
E038	memory_transfers	523c8d45ddf1d444e33523484673bf815a33c243	discard	postflop.memory.warm.f32.host_private_mb	9244.409856	Decode compressed upload directly into disjoint pinned chunks in parallel, preserving per-node scales and exact output; retain serial fallback for small buffers.	2026-09-07T06:29:47+00:00
E038	memory_transfers	523c8d45ddf1d444e33523484673bf815a33c243	discard	postflop.memory.warm.f32.init_ms	712.4235	Decode compressed upload directly into disjoint pinned chunks in parallel, preserving per-node scales and exact output; retain serial fallback for small buffers.	2026-09-07T06:29:47+00:00
E038	memory_transfers	523c8d45ddf1d444e33523484673bf815a33c243	discard	postflop.memory.warm.f32.strategy_sync_ms	171.101	Decode compressed upload directly into disjoint pinned chunks in parallel, preserving per-node scales and exact output; retain serial fallback for small buffers.	2026-09-07T06:29:47+00:00
E038	memory_transfers	523c8d45ddf1d444e33523484673bf815a33c243	discard	postflop.memory.warm.f32.sync_ms	337.6953	Decode compressed upload directly into disjoint pinned chunks in parallel, preserving per-node scales and exact output; retain serial fallback for small buffers.	2026-09-07T06:29:47+00:00
E038	memory_transfers	523c8d45ddf1d444e33523484673bf815a33c243	discard	postflop.memory.cold.compressed.allocated_vram_mb	3623.878656	Decode compressed upload directly into disjoint pinned chunks in parallel, preserving per-node scales and exact output; retain serial fallback for small buffers.	2026-09-07T06:29:47+00:00
E038	memory_transfers	523c8d45ddf1d444e33523484673bf815a33c243	discard	postflop.memory.cold.compressed.host_live_mb	2308.861952	Decode compressed upload directly into disjoint pinned chunks in parallel, preserving per-node scales and exact output; retain serial fallback for small buffers.	2026-09-07T06:29:47+00:00
E038	memory_transfers	523c8d45ddf1d444e33523484673bf815a33c243	discard	postflop.memory.cold.compressed.host_private_mb	6508.744704	Decode compressed upload directly into disjoint pinned chunks in parallel, preserving per-node scales and exact output; retain serial fallback for small buffers.	2026-09-07T06:29:47+00:00
