experiment	path	commit	status	metric	value	hypothesis	utc
E009	postflop_cuda	4fe013617fc43a951f18977dffe4633bc59070c4	keep	postflop.Ks7h2d.iso.staging_memory_mb	3415.119456	Dense reach-owner storage reduces postflop VRAM without changing any reach calculation	2026-09-07T01:50:21+00:00
E009	postflop_cuda	4fe013617fc43a951f18977dffe4633bc59070c4	keep	postflop.Ks7s2d.iso.allocated_vram_mb	5637.144576	Dense reach-owner storage reduces postflop VRAM without changing any reach calculation	2026-09-07T01:50:21+00:00
E009	postflop_cuda	4fe013617fc43a951f18977dffe4633bc59070c4	keep	postflop.Ks7s2d.iso.estimated_vram_mb	6737.546704	Dense reach-owner storage reduces postflop VRAM without changing any reach calculation	2026-09-07T01:50:21+00:00
E009	postflop_cuda	4fe013617fc43a951f18977dffe4633bc59070c4	keep	postflop.Ks7s2d.iso.init_ms	642.9473	Dense reach-owner storage reduces postflop VRAM without changing any reach calculation	2026-09-07T01:50:21+00:00
E009	postflop_cuda	4fe013617fc43a951f18977dffe4633bc59070c4	keep	postflop.Ks7s2d.iso.plan_build_ms	87.69399999999999	Dense reach-owner storage reduces postflop VRAM without changing any reach calculation	2026-09-07T01:50:21+00:00
E009	postflop_cuda	4fe013617fc43a951f18977dffe4633bc59070c4	keep	postflop.Ks7s2d.iso.staging_memory_mb	2759.814928	Dense reach-owner storage reduces postflop VRAM without changing any reach calculation	2026-09-07T01:50:21+00:00
E009	postflop_cuda	4fe013617fc43a951f18977dffe4633bc59070c4	keep	postflop.Ks7s2d.full.allocated_vram_mb	6308.233216	Dense reach-owner storage reduces postflop VRAM without changing any reach calculation	2026-09-07T01:50:21+00:00
E009	postflop_cuda	4fe013617fc43a951f18977dffe4633bc59070c4	keep	postflop.Ks7s2d.full.estimated_vram_mb	6737.546704	Dense reach-owner storage reduces postflop VRAM without changing any reach calculation	2026-09-07T01:50:21+00:00
E009	postflop_cuda	4fe013617fc43a951f18977dffe4633bc59070c4	keep	postflop.Ks7s2d.full.init_ms	657.4692	Dense reach-owner storage reduces postflop VRAM without changing any reach calculation	2026-09-07T01:50:21+00:00
E009	postflop_cuda	4fe013617fc43a951f18977dffe4633bc59070c4	keep	postflop.Ks7s2d.full.plan_build_ms	147.3625	Dense reach-owner storage reduces postflop VRAM without changing any reach calculation	2026-09-07T01:50:21+00:00
E009	postflop_cuda	4fe013617fc43a951f18977dffe4633bc59070c4	keep	postflop.Ks7s2d.full.staging_memory_mb	3426.408856	Dense reach-owner storage reduces postflop VRAM without changing any reach calculation	2026-09-07T01:50:21+00:00
E009	postflop_cuda	4fe013617fc43a951f18977dffe4633bc59070c4	keep	postflop.Ks7h2d.init_ms	1216.602	Dense reach-owner storage reduces postflop VRAM without changing any reach calculation	2026-09-07T01:50:21+00:00
E009	postflop_cuda	4fe013617fc43a951f18977dffe4633bc59070c4	keep	postflop.Ks7h2d.iteration_ms	63.968	Dense reach-owner storage reduces postflop VRAM without changing any reach calculation	2026-09-07T01:50:21+00:00
E009	postflop_cuda	4fe013617fc43a951f18977dffe4633bc59070c4	keep	postflop.Ks7h2d.check_ms	45.384	Dense reach-owner storage reduces postflop VRAM without changing any reach calculation	2026-09-07T01:50:21+00:00
E009	postflop_cuda	4fe013617fc43a951f18977dffe4633bc59070c4	keep	postflop.Ks7s2d.init_ms	764.46	Dense reach-owner storage reduces postflop VRAM without changing any reach calculation	2026-09-07T01:50:21+00:00
E009	postflop_cuda	4fe013617fc43a951f18977dffe4633bc59070c4	keep	postflop.Ks7s2d.iteration_ms	37.658	Dense reach-owner storage reduces postflop VRAM without changing any reach calculation	2026-09-07T01:50:21+00:00
E009	postflop_cuda	4fe013617fc43a951f18977dffe4633bc59070c4	keep	postflop.Ks7s2d.check_ms	34.214	Dense reach-owner storage reduces postflop VRAM without changing any reach calculation	2026-09-07T01:50:21+00:00
E009	postflop_cuda	4fe013617fc43a951f18977dffe4633bc59070c4	keep	postflop.Ks7h2dQhTc.init_ms	73.845	Dense reach-owner storage reduces postflop VRAM without changing any reach calculation	2026-09-07T01:50:21+00:00
E009	postflop_cuda	4fe013617fc43a951f18977dffe4633bc59070c4	keep	postflop.Ks7h2dQhTc.iteration_ms	0.365	Dense reach-owner storage reduces postflop VRAM without changing any reach calculation	2026-09-07T01:50:21+00:00
E009	postflop_cuda	4fe013617fc43a951f18977dffe4633bc59070c4	keep	postflop.Ks7h2dQhTc.check_ms	0.881	Dense reach-owner storage reduces postflop VRAM without changing any reach calculation	2026-09-07T01:50:21+00:00
E009R	postflop_cuda	4fe013617fc43a951f18977dffe4633bc59070c4	keep	postflop.Ks7h2d.target_seconds	12.267	Repeat compact postflop reaches and verify time to unchanged 0.3-percent target	2026-09-07T01:51:51+00:00
E009R	postflop_cuda	4fe013617fc43a951f18977dffe4633bc59070c4	keep	postflop.Ks7s2d.target_seconds	7.325	Repeat compact postflop reaches and verify time to unchanged 0.3-percent target	2026-09-07T01:51:51+00:00
E009R	postflop_cuda	4fe013617fc43a951f18977dffe4633bc59070c4	keep	postflop.Ks7h2dQhTc.target_seconds	0.024	Repeat compact postflop reaches and verify time to unchanged 0.3-percent target	2026-09-07T01:51:51+00:00
B008	baseline	b6131a59d8a8561693f8545de49b45fe26723341	baseline	postflop.Ks7h2d.init_ms	1029.168	Paired original reach-storage control after E009 to distinguish timing drift from indirection cost	2026-09-07T01:52:59+00:00
B008	baseline	b6131a59d8a8561693f8545de49b45fe26723341	baseline	postflop.Ks7h2d.iteration_ms	58.918	Paired original reach-storage control after E009 to distinguish timing drift from indirection cost	2026-09-07T01:52:59+00:00
B008	baseline	b6131a59d8a8561693f8545de49b45fe26723341	baseline	postflop.Ks7h2d.check_ms	41.145	Paired original reach-storage control after E009 to distinguish timing drift from indirection cost	2026-09-07T01:52:59+00:00
B008	baseline	b6131a59d8a8561693f8545de49b45fe26723341	baseline	postflop.Ks7s2d.init_ms	776.34	Paired original reach-storage control after E009 to distinguish timing drift from indirection cost	2026-09-07T01:52:59+00:00
B008	baseline	b6131a59d8a8561693f8545de49b45fe26723341	baseline	postflop.Ks7s2d.iteration_ms	34.811	Paired original reach-storage control after E009 to distinguish timing drift from indirection cost	2026-09-07T01:52:59+00:00
B008	baseline	b6131a59d8a8561693f8545de49b45fe26723341	baseline	postflop.Ks7s2d.check_ms	31.529	Paired original reach-storage control after E009 to distinguish timing drift from indirection cost	2026-09-07T01:52:59+00:00
B008	baseline	b6131a59d8a8561693f8545de49b45fe26723341	baseline	postflop.Ks7h2dQhTc.init_ms	68.551	Paired original reach-storage control after E009 to distinguish timing drift from indirection cost	2026-09-07T01:52:59+00:00
B008	baseline	b6131a59d8a8561693f8545de49b45fe26723341	baseline	postflop.Ks7h2dQhTc.iteration_ms	0.338	Paired original reach-storage control after E009 to distinguish timing drift from indirection cost	2026-09-07T01:52:59+00:00
B008	baseline	b6131a59d8a8561693f8545de49b45fe26723341	baseline	postflop.Ks7h2dQhTc.check_ms	0.594	Paired original reach-storage control after E009 to distinguish timing drift from indirection cost	2026-09-07T01:52:59+00:00
E009R2	postflop_cuda	4763e3ea36f56f1bddb30e7e02a671095542614e	keep	postflop.Ks7h2d.iso.allocated_vram_mb	6274.678784	Paired warm repeat of compact reach storage after original-layout control	2026-09-07T01:54:09+00:00
E009R2	postflop_cuda	4763e3ea36f56f1bddb30e7e02a671095542614e	keep	postflop.Ks7h2d.iso.estimated_vram_mb	6716.6347	Paired warm repeat of compact reach storage after original-layout control	2026-09-07T01:54:09+00:00
E009R2	postflop_cuda	4763e3ea36f56f1bddb30e7e02a671095542614e	keep	postflop.Ks7h2d.iso.init_ms	871.3498	Paired warm repeat of compact reach storage after original-layout control	2026-09-07T01:54:09+00:00
E009R2	postflop_cuda	4763e3ea36f56f1bddb30e7e02a671095542614e	keep	postflop.Ks7h2d.iso.plan_build_ms	99.2814	Paired warm repeat of compact reach storage after original-layout control	2026-09-07T01:54:09+00:00
E009R2	postflop_cuda	4763e3ea36f56f1bddb30e7e02a671095542614e	keep	postflop.Ks7h2d.iso.staging_memory_mb	3415.119456	Paired warm repeat of compact reach storage after original-layout control	2026-09-07T01:54:09+00:00
E009R2	postflop_cuda	4763e3ea36f56f1bddb30e7e02a671095542614e	keep	postflop.Ks7s2d.iso.allocated_vram_mb	5637.144576	Paired warm repeat of compact reach storage after original-layout control	2026-09-07T01:54:09+00:00
E009R2	postflop_cuda	4763e3ea36f56f1bddb30e7e02a671095542614e	keep	postflop.Ks7s2d.iso.estimated_vram_mb	6737.546704	Paired warm repeat of compact reach storage after original-layout control	2026-09-07T01:54:09+00:00
E009R2	postflop_cuda	4763e3ea36f56f1bddb30e7e02a671095542614e	keep	postflop.Ks7s2d.iso.init_ms	623.3035	Paired warm repeat of compact reach storage after original-layout control	2026-09-07T01:54:09+00:00
E009R2	postflop_cuda	4763e3ea36f56f1bddb30e7e02a671095542614e	keep	postflop.Ks7s2d.iso.plan_build_ms	133.5797	Paired warm repeat of compact reach storage after original-layout control	2026-09-07T01:54:09+00:00
E009R2	postflop_cuda	4763e3ea36f56f1bddb30e7e02a671095542614e	keep	postflop.Ks7s2d.iso.staging_memory_mb	2759.814928	Paired warm repeat of compact reach storage after original-layout control	2026-09-07T01:54:09+00:00
E009R2	postflop_cuda	4763e3ea36f56f1bddb30e7e02a671095542614e	keep	postflop.Ks7s2d.full.allocated_vram_mb	6308.233216	Paired warm repeat of compact reach storage after original-layout control	2026-09-07T01:54:09+00:00
E009R2	postflop_cuda	4763e3ea36f56f1bddb30e7e02a671095542614e	keep	postflop.Ks7s2d.full.estimated_vram_mb	6737.546704	Paired warm repeat of compact reach storage after original-layout control	2026-09-07T01:54:09+00:00
E009R2	postflop_cuda	4763e3ea36f56f1bddb30e7e02a671095542614e	keep	postflop.Ks7s2d.full.init_ms	592.9345000000001	Paired warm repeat of compact reach storage after original-layout control	2026-09-07T01:54:09+00:00
E009R2	postflop_cuda	4763e3ea36f56f1bddb30e7e02a671095542614e	keep	postflop.Ks7s2d.full.plan_build_ms	93.0251	Paired warm repeat of compact reach storage after original-layout control	2026-09-07T01:54:09+00:00
E009R2	postflop_cuda	4763e3ea36f56f1bddb30e7e02a671095542614e	keep	postflop.Ks7s2d.full.staging_memory_mb	3426.408856	Paired warm repeat of compact reach storage after original-layout control	2026-09-07T01:54:09+00:00
E009R2	postflop_cuda	4763e3ea36f56f1bddb30e7e02a671095542614e	keep	postflop.Ks7h2d.init_ms	1103.302	Paired warm repeat of compact reach storage after original-layout control	2026-09-07T01:54:09+00:00
E009R2	postflop_cuda	4763e3ea36f56f1bddb30e7e02a671095542614e	keep	postflop.Ks7h2d.iteration_ms	59.09	Paired warm repeat of compact reach storage after original-layout control	2026-09-07T01:54:09+00:00
E009R2	postflop_cuda	4763e3ea36f56f1bddb30e7e02a671095542614e	keep	postflop.Ks7h2d.check_ms	40.829	Paired warm repeat of compact reach storage after original-layout control	2026-09-07T01:54:09+00:00
E009R2	postflop_cuda	4763e3ea36f56f1bddb30e7e02a671095542614e	keep	postflop.Ks7s2d.init_ms	704.889	Paired warm repeat of compact reach storage after original-layout control	2026-09-07T01:54:09+00:00
E009R2	postflop_cuda	4763e3ea36f56f1bddb30e7e02a671095542614e	keep	postflop.Ks7s2d.iteration_ms	34.924	Paired warm repeat of compact reach storage after original-layout control	2026-09-07T01:54:09+00:00
E009R2	postflop_cuda	4763e3ea36f56f1bddb30e7e02a671095542614e	keep	postflop.Ks7s2d.check_ms	31.529	Paired warm repeat of compact reach storage after original-layout control	2026-09-07T01:54:09+00:00
E009R2	postflop_cuda	4763e3ea36f56f1bddb30e7e02a671095542614e	keep	postflop.Ks7h2dQhTc.init_ms	88.041	Paired warm repeat of compact reach storage after original-layout control	2026-09-07T01:54:09+00:00
E009R2	postflop_cuda	4763e3ea36f56f1bddb30e7e02a671095542614e	keep	postflop.Ks7h2dQhTc.iteration_ms	0.344	Paired warm repeat of compact reach storage after original-layout control	2026-09-07T01:54:09+00:00
E009R2	postflop_cuda	4763e3ea36f56f1bddb30e7e02a671095542614e	keep	postflop.Ks7h2dQhTc.check_ms	0.77	Paired warm repeat of compact reach storage after original-layout control	2026-09-07T01:54:09+00:00
E010	preflop_cuda	f3e9aba7a6556edd495538342ec0f98583223631	keep	preflop.2.iteration_ms	0.095	Reduce each shared reach mass once per down sweep instead of at every terminal for every opponent	2026-09-07T01:56:01+00:00
E010	preflop_cuda	f3e9aba7a6556edd495538342ec0f98583223631	keep	preflop.2.check_ms	0.295	Reduce each shared reach mass once per down sweep instead of at every terminal for every opponent	2026-09-07T01:56:01+00:00
E010	preflop_cuda	f3e9aba7a6556edd495538342ec0f98583223631	keep	preflop.2.sync_ms	0.039	Reduce each shared reach mass once per down sweep instead of at every terminal for every opponent	2026-09-07T01:56:01+00:00
E010	preflop_cuda	f3e9aba7a6556edd495538342ec0f98583223631	keep	preflop.6.iteration_ms	19.145	Reduce each shared reach mass once per down sweep instead of at every terminal for every opponent	2026-09-07T01:56:01+00:00
E010	preflop_cuda	f3e9aba7a6556edd495538342ec0f98583223631	keep	preflop.6.check_ms	24.308	Reduce each shared reach mass once per down sweep instead of at every terminal for every opponent	2026-09-07T01:56:01+00:00
E010	preflop_cuda	f3e9aba7a6556edd495538342ec0f98583223631	keep	preflop.6.sync_ms	25.43	Reduce each shared reach mass once per down sweep instead of at every terminal for every opponent	2026-09-07T01:56:01+00:00
E010	preflop_cuda	f3e9aba7a6556edd495538342ec0f98583223631	keep	preflop.8.iteration_ms	78.157	Reduce each shared reach mass once per down sweep instead of at every terminal for every opponent	2026-09-07T01:56:01+00:00
E010	preflop_cuda	f3e9aba7a6556edd495538342ec0f98583223631	keep	preflop.8.check_ms	93.947	Reduce each shared reach mass once per down sweep instead of at every terminal for every opponent	2026-09-07T01:56:01+00:00
E010	preflop_cuda	f3e9aba7a6556edd495538342ec0f98583223631	keep	preflop.8.sync_ms	70.391	Reduce each shared reach mass once per down sweep instead of at every terminal for every opponent	2026-09-07T01:56:01+00:00
E010R	preflop_cuda	f3e9aba7a6556edd495538342ec0f98583223631	keep	preflop.2.iteration_ms	0.096	Repeat cached reach masses with full preflop GPU and graph-stop equivalence coverage	2026-09-07T01:57:10+00:00
E010R	preflop_cuda	f3e9aba7a6556edd495538342ec0f98583223631	keep	preflop.2.check_ms	0.289	Repeat cached reach masses with full preflop GPU and graph-stop equivalence coverage	2026-09-07T01:57:10+00:00
E010R	preflop_cuda	f3e9aba7a6556edd495538342ec0f98583223631	keep	preflop.2.sync_ms	0.018	Repeat cached reach masses with full preflop GPU and graph-stop equivalence coverage	2026-09-07T01:57:10+00:00
E010R	preflop_cuda	f3e9aba7a6556edd495538342ec0f98583223631	keep	preflop.6.iteration_ms	19.257	Repeat cached reach masses with full preflop GPU and graph-stop equivalence coverage	2026-09-07T01:57:10+00:00
E010R	preflop_cuda	f3e9aba7a6556edd495538342ec0f98583223631	keep	preflop.6.check_ms	24.453	Repeat cached reach masses with full preflop GPU and graph-stop equivalence coverage	2026-09-07T01:57:10+00:00
E010R	preflop_cuda	f3e9aba7a6556edd495538342ec0f98583223631	keep	preflop.6.sync_ms	26.742	Repeat cached reach masses with full preflop GPU and graph-stop equivalence coverage	2026-09-07T01:57:10+00:00
E010R	preflop_cuda	f3e9aba7a6556edd495538342ec0f98583223631	keep	preflop.8.iteration_ms	78.01	Repeat cached reach masses with full preflop GPU and graph-stop equivalence coverage	2026-09-07T01:57:10+00:00
E010R	preflop_cuda	f3e9aba7a6556edd495538342ec0f98583223631	keep	preflop.8.check_ms	93.785	Repeat cached reach masses with full preflop GPU and graph-stop equivalence coverage	2026-09-07T01:57:10+00:00
E010R	preflop_cuda	f3e9aba7a6556edd495538342ec0f98583223631	keep	preflop.8.sync_ms	66.13	Repeat cached reach masses with full preflop GPU and graph-stop equivalence coverage	2026-09-07T01:57:10+00:00
E011	postflop_cuda	ff045a34a8225df54a3dc3178f66c8336e195f1d	discard	postflop.Ks7h2d.init_ms	1663.934	Replace contended fold atomics with indexed card lists and CPU-order f64 sums	2026-09-07T01:59:17+00:00
E011	postflop_cuda	ff045a34a8225df54a3dc3178f66c8336e195f1d	discard	postflop.Ks7h2d.iteration_ms	113.943	Replace contended fold atomics with indexed card lists and CPU-order f64 sums	2026-09-07T01:59:17+00:00
E011	postflop_cuda	ff045a34a8225df54a3dc3178f66c8336e195f1d	discard	postflop.Ks7h2d.check_ms	93.23	Replace contended fold atomics with indexed card lists and CPU-order f64 sums	2026-09-07T01:59:17+00:00
E011	postflop_cuda	ff045a34a8225df54a3dc3178f66c8336e195f1d	discard	postflop.Ks7s2d.init_ms	662.83	Replace contended fold atomics with indexed card lists and CPU-order f64 sums	2026-09-07T01:59:17+00:00
E011	postflop_cuda	ff045a34a8225df54a3dc3178f66c8336e195f1d	discard	postflop.Ks7s2d.iteration_ms	68.083	Replace contended fold atomics with indexed card lists and CPU-order f64 sums	2026-09-07T01:59:17+00:00
E011	postflop_cuda	ff045a34a8225df54a3dc3178f66c8336e195f1d	discard	postflop.Ks7s2d.check_ms	62.735	Replace contended fold atomics with indexed card lists and CPU-order f64 sums	2026-09-07T01:59:17+00:00
E011	postflop_cuda	ff045a34a8225df54a3dc3178f66c8336e195f1d	discard	postflop.Ks7h2dQhTc.init_ms	72.586	Replace contended fold atomics with indexed card lists and CPU-order f64 sums	2026-09-07T01:59:17+00:00
E011	postflop_cuda	ff045a34a8225df54a3dc3178f66c8336e195f1d	discard	postflop.Ks7h2dQhTc.iteration_ms	0.411	Replace contended fold atomics with indexed card lists and CPU-order f64 sums	2026-09-07T01:59:17+00:00
E011	postflop_cuda	ff045a34a8225df54a3dc3178f66c8336e195f1d	discard	postflop.Ks7h2dQhTc.check_ms	0.616	Replace contended fold atomics with indexed card lists and CPU-order f64 sums	2026-09-07T01:59:17+00:00
E011B	postflop_cuda	fa9da02b6cbd429650975bf5ed36df1375c9a1a7	discard	postflop.Ks7h2d.init_ms	1557.562	Stage opponent reach in shared memory before deterministic CPU-precision fold sums	2026-09-07T02:01:02+00:00
E011B	postflop_cuda	fa9da02b6cbd429650975bf5ed36df1375c9a1a7	discard	postflop.Ks7h2d.iteration_ms	114.255	Stage opponent reach in shared memory before deterministic CPU-precision fold sums	2026-09-07T02:01:02+00:00
E011B	postflop_cuda	fa9da02b6cbd429650975bf5ed36df1375c9a1a7	discard	postflop.Ks7h2d.check_ms	91.642	Stage opponent reach in shared memory before deterministic CPU-precision fold sums	2026-09-07T02:01:02+00:00
E011B	postflop_cuda	fa9da02b6cbd429650975bf5ed36df1375c9a1a7	discard	postflop.Ks7s2d.init_ms	639.241	Stage opponent reach in shared memory before deterministic CPU-precision fold sums	2026-09-07T02:01:02+00:00
E011B	postflop_cuda	fa9da02b6cbd429650975bf5ed36df1375c9a1a7	discard	postflop.Ks7s2d.iteration_ms	69.008	Stage opponent reach in shared memory before deterministic CPU-precision fold sums	2026-09-07T02:01:02+00:00
E011B	postflop_cuda	fa9da02b6cbd429650975bf5ed36df1375c9a1a7	discard	postflop.Ks7s2d.check_ms	63.14	Stage opponent reach in shared memory before deterministic CPU-precision fold sums	2026-09-07T02:01:02+00:00
E011B	postflop_cuda	fa9da02b6cbd429650975bf5ed36df1375c9a1a7	discard	postflop.Ks7h2dQhTc.init_ms	77.253	Stage opponent reach in shared memory before deterministic CPU-precision fold sums	2026-09-07T02:01:02+00:00
E011B	postflop_cuda	fa9da02b6cbd429650975bf5ed36df1375c9a1a7	discard	postflop.Ks7h2dQhTc.iteration_ms	0.406	Stage opponent reach in shared memory before deterministic CPU-precision fold sums	2026-09-07T02:01:02+00:00
E011B	postflop_cuda	fa9da02b6cbd429650975bf5ed36df1375c9a1a7	discard	postflop.Ks7h2dQhTc.check_ms	0.696	Stage opponent reach in shared memory before deterministic CPU-precision fold sums	2026-09-07T02:01:02+00:00
E011C	postflop_cuda	3f6fdb592a2fdd4834d2d4b6ac90483d1856d1a6	discard	postflop.Ks7h2d.init_ms	1526.368	Parallelize fold total with a deterministic f64 reduction tree while retaining indexed card sums	2026-09-07T02:02:31+00:00
E011C	postflop_cuda	3f6fdb592a2fdd4834d2d4b6ac90483d1856d1a6	discard	postflop.Ks7h2d.iteration_ms	69.627	Parallelize fold total with a deterministic f64 reduction tree while retaining indexed card sums	2026-09-07T02:02:31+00:00
E011C	postflop_cuda	3f6fdb592a2fdd4834d2d4b6ac90483d1856d1a6	discard	postflop.Ks7h2d.check_ms	47.892	Parallelize fold total with a deterministic f64 reduction tree while retaining indexed card sums	2026-09-07T02:02:31+00:00
E011C	postflop_cuda	3f6fdb592a2fdd4834d2d4b6ac90483d1856d1a6	discard	postflop.Ks7s2d.init_ms	714.206	Parallelize fold total with a deterministic f64 reduction tree while retaining indexed card sums	2026-09-07T02:02:31+00:00
E011C	postflop_cuda	3f6fdb592a2fdd4834d2d4b6ac90483d1856d1a6	discard	postflop.Ks7s2d.iteration_ms	41.545	Parallelize fold total with a deterministic f64 reduction tree while retaining indexed card sums	2026-09-07T02:02:31+00:00
E011C	postflop_cuda	3f6fdb592a2fdd4834d2d4b6ac90483d1856d1a6	discard	postflop.Ks7s2d.check_ms	35.644	Parallelize fold total with a deterministic f64 reduction tree while retaining indexed card sums	2026-09-07T02:02:31+00:00
E011C	postflop_cuda	3f6fdb592a2fdd4834d2d4b6ac90483d1856d1a6	discard	postflop.Ks7h2dQhTc.init_ms	69.742	Parallelize fold total with a deterministic f64 reduction tree while retaining indexed card sums	2026-09-07T02:02:31+00:00
E011C	postflop_cuda	3f6fdb592a2fdd4834d2d4b6ac90483d1856d1a6	discard	postflop.Ks7h2dQhTc.iteration_ms	0.332	Parallelize fold total with a deterministic f64 reduction tree while retaining indexed card sums	2026-09-07T02:02:31+00:00
E011C	postflop_cuda	3f6fdb592a2fdd4834d2d4b6ac90483d1856d1a6	discard	postflop.Ks7h2dQhTc.check_ms	0.689	Parallelize fold total with a deterministic f64 reduction tree while retaining indexed card sums	2026-09-07T02:02:31+00:00
E011D	postflop_cuda	e30c0f3cfe446c194dfcc1b2d8137098a62951f1	keep	postflop.Ks7h2d.init_ms	1574.626	Remove fold atomics with indexed fixed-order sums at the existing f32 precision	2026-09-07T02:04:14+00:00
