experiment	path	commit	status	metric	value	hypothesis	utc
G003	memory_transfers	a75c327cfa20ad3338d68aa1a75398458b76ea46	keep	postflop.Ks7s2d.steady_check_ms	28.0708	Final combined memory and evaluation checks: actual device allocation, cold and warm lifecycle, and repeated first/capture/steady evaluations.	2026-09-07T06:41:41+00:00
G003	memory_transfers	a75c327cfa20ad3338d68aa1a75398458b76ea46	keep	postflop.Ks7h2dQhTc.first_check_ms	0.6189	Final combined memory and evaluation checks: actual device allocation, cold and warm lifecycle, and repeated first/capture/steady evaluations.	2026-09-07T06:41:41+00:00
G003	memory_transfers	a75c327cfa20ad3338d68aa1a75398458b76ea46	keep	postflop.Ks7h2dQhTc.second_check_ms	0.6246	Final combined memory and evaluation checks: actual device allocation, cold and warm lifecycle, and repeated first/capture/steady evaluations.	2026-09-07T06:41:41+00:00
G003	memory_transfers	a75c327cfa20ad3338d68aa1a75398458b76ea46	keep	postflop.Ks7h2dQhTc.steady_check_ms	0.305775	Final combined memory and evaluation checks: actual device allocation, cold and warm lifecycle, and repeated first/capture/steady evaluations.	2026-09-07T06:41:41+00:00
G003	memory_transfers	a75c327cfa20ad3338d68aa1a75398458b76ea46	keep	preflop.2.first_check_ms	0.3327	Final combined memory and evaluation checks: actual device allocation, cold and warm lifecycle, and repeated first/capture/steady evaluations.	2026-09-07T06:41:41+00:00
G003	memory_transfers	a75c327cfa20ad3338d68aa1a75398458b76ea46	keep	preflop.2.second_check_ms	0.2743	Final combined memory and evaluation checks: actual device allocation, cold and warm lifecycle, and repeated first/capture/steady evaluations.	2026-09-07T06:41:41+00:00
G003	memory_transfers	a75c327cfa20ad3338d68aa1a75398458b76ea46	keep	preflop.2.steady_check_ms	0.11299999999999999	Final combined memory and evaluation checks: actual device allocation, cold and warm lifecycle, and repeated first/capture/steady evaluations.	2026-09-07T06:41:41+00:00
G003	memory_transfers	a75c327cfa20ad3338d68aa1a75398458b76ea46	keep	preflop.6.first_check_ms	8.960600000000001	Final combined memory and evaluation checks: actual device allocation, cold and warm lifecycle, and repeated first/capture/steady evaluations.	2026-09-07T06:41:41+00:00
G003	memory_transfers	a75c327cfa20ad3338d68aa1a75398458b76ea46	keep	preflop.6.second_check_ms	9.577300000000001	Final combined memory and evaluation checks: actual device allocation, cold and warm lifecycle, and repeated first/capture/steady evaluations.	2026-09-07T06:41:41+00:00
G003	memory_transfers	a75c327cfa20ad3338d68aa1a75398458b76ea46	keep	preflop.6.steady_check_ms	8.108525	Final combined memory and evaluation checks: actual device allocation, cold and warm lifecycle, and repeated first/capture/steady evaluations.	2026-09-07T06:41:41+00:00
G003	memory_transfers	a75c327cfa20ad3338d68aa1a75398458b76ea46	keep	preflop.8.first_check_ms	25.958	Final combined memory and evaluation checks: actual device allocation, cold and warm lifecycle, and repeated first/capture/steady evaluations.	2026-09-07T06:41:41+00:00
G003	memory_transfers	a75c327cfa20ad3338d68aa1a75398458b76ea46	keep	preflop.8.second_check_ms	26.7404	Final combined memory and evaluation checks: actual device allocation, cold and warm lifecycle, and repeated first/capture/steady evaluations.	2026-09-07T06:41:41+00:00
G003	memory_transfers	a75c327cfa20ad3338d68aa1a75398458b76ea46	keep	preflop.8.steady_check_ms	24.275925	Final combined memory and evaluation checks: actual device allocation, cold and warm lifecycle, and repeated first/capture/steady evaluations.	2026-09-07T06:41:41+00:00
G003	memory_transfers	a75c327cfa20ad3338d68aa1a75398458b76ea46	keep	postflop.Ks7h2d.iso.allocated_vram_mb	5905.580032	Final combined memory and evaluation checks: actual device allocation, cold and warm lifecycle, and repeated first/capture/steady evaluations.	2026-09-07T06:41:41+00:00
G003	memory_transfers	a75c327cfa20ad3338d68aa1a75398458b76ea46	keep	postflop.Ks7h2d.iso.estimated_vram_mb	6716.6347	Final combined memory and evaluation checks: actual device allocation, cold and warm lifecycle, and repeated first/capture/steady evaluations.	2026-09-07T06:41:41+00:00
G003	memory_transfers	a75c327cfa20ad3338d68aa1a75398458b76ea46	keep	postflop.Ks7h2d.iso.init_ms	983.6586000000001	Final combined memory and evaluation checks: actual device allocation, cold and warm lifecycle, and repeated first/capture/steady evaluations.	2026-09-07T06:41:41+00:00
G003	memory_transfers	a75c327cfa20ad3338d68aa1a75398458b76ea46	keep	postflop.Ks7h2d.iso.plan_build_ms	114.645	Final combined memory and evaluation checks: actual device allocation, cold and warm lifecycle, and repeated first/capture/steady evaluations.	2026-09-07T06:41:41+00:00
G003	memory_transfers	a75c327cfa20ad3338d68aa1a75398458b76ea46	keep	postflop.Ks7h2d.iso.staging_memory_mb	3052.063004	Final combined memory and evaluation checks: actual device allocation, cold and warm lifecycle, and repeated first/capture/steady evaluations.	2026-09-07T06:41:41+00:00
G003	memory_transfers	a75c327cfa20ad3338d68aa1a75398458b76ea46	keep	postflop.Ks7s2d.iso.allocated_vram_mb	4731.174912	Final combined memory and evaluation checks: actual device allocation, cold and warm lifecycle, and repeated first/capture/steady evaluations.	2026-09-07T06:41:41+00:00
G003	memory_transfers	a75c327cfa20ad3338d68aa1a75398458b76ea46	keep	postflop.Ks7s2d.iso.estimated_vram_mb	6737.546704	Final combined memory and evaluation checks: actual device allocation, cold and warm lifecycle, and repeated first/capture/steady evaluations.	2026-09-07T06:41:41+00:00
G003	memory_transfers	a75c327cfa20ad3338d68aa1a75398458b76ea46	keep	postflop.Ks7s2d.iso.init_ms	668.1643	Final combined memory and evaluation checks: actual device allocation, cold and warm lifecycle, and repeated first/capture/steady evaluations.	2026-09-07T06:41:41+00:00
G003	memory_transfers	a75c327cfa20ad3338d68aa1a75398458b76ea46	keep	postflop.Ks7s2d.iso.plan_build_ms	147.952	Final combined memory and evaluation checks: actual device allocation, cold and warm lifecycle, and repeated first/capture/steady evaluations.	2026-09-07T06:41:41+00:00
G003	memory_transfers	a75c327cfa20ad3338d68aa1a75398458b76ea46	keep	postflop.Ks7s2d.iso.staging_memory_mb	1862.657808	Final combined memory and evaluation checks: actual device allocation, cold and warm lifecycle, and repeated first/capture/steady evaluations.	2026-09-07T06:41:41+00:00
G003	memory_transfers	a75c327cfa20ad3338d68aa1a75398458b76ea46	keep	postflop.Ks7s2d.full.allocated_vram_mb	5939.134464	Final combined memory and evaluation checks: actual device allocation, cold and warm lifecycle, and repeated first/capture/steady evaluations.	2026-09-07T06:41:41+00:00
G003	memory_transfers	a75c327cfa20ad3338d68aa1a75398458b76ea46	keep	postflop.Ks7s2d.full.estimated_vram_mb	6737.546704	Final combined memory and evaluation checks: actual device allocation, cold and warm lifecycle, and repeated first/capture/steady evaluations.	2026-09-07T06:41:41+00:00
G003	memory_transfers	a75c327cfa20ad3338d68aa1a75398458b76ea46	keep	postflop.Ks7s2d.full.init_ms	792.9421	Final combined memory and evaluation checks: actual device allocation, cold and warm lifecycle, and repeated first/capture/steady evaluations.	2026-09-07T06:41:41+00:00
G003	memory_transfers	a75c327cfa20ad3338d68aa1a75398458b76ea46	keep	postflop.Ks7s2d.full.plan_build_ms	112.8806	Final combined memory and evaluation checks: actual device allocation, cold and warm lifecycle, and repeated first/capture/steady evaluations.	2026-09-07T06:41:41+00:00
G003	memory_transfers	a75c327cfa20ad3338d68aa1a75398458b76ea46	keep	postflop.Ks7s2d.full.staging_memory_mb	3062.214296	Final combined memory and evaluation checks: actual device allocation, cold and warm lifecycle, and repeated first/capture/steady evaluations.	2026-09-07T06:41:41+00:00
G003	memory_transfers	a75c327cfa20ad3338d68aa1a75398458b76ea46	keep	postflop.memory.rainbow.cold.compressed.allocated_vram_mb	5905.580032	Final combined memory and evaluation checks: actual device allocation, cold and warm lifecycle, and repeated first/capture/steady evaluations.	2026-09-07T06:41:41+00:00
G003	memory_transfers	a75c327cfa20ad3338d68aa1a75398458b76ea46	keep	postflop.memory.rainbow.cold.compressed.host_live_mb	2585.35424	Final combined memory and evaluation checks: actual device allocation, cold and warm lifecycle, and repeated first/capture/steady evaluations.	2026-09-07T06:41:41+00:00
G003	memory_transfers	a75c327cfa20ad3338d68aa1a75398458b76ea46	keep	postflop.memory.rainbow.cold.compressed.host_private_mb	9075.191808	Final combined memory and evaluation checks: actual device allocation, cold and warm lifecycle, and repeated first/capture/steady evaluations.	2026-09-07T06:41:41+00:00
G003	memory_transfers	a75c327cfa20ad3338d68aa1a75398458b76ea46	keep	postflop.memory.rainbow.cold.compressed.init_ms	849.6359	Final combined memory and evaluation checks: actual device allocation, cold and warm lifecycle, and repeated first/capture/steady evaluations.	2026-09-07T06:41:41+00:00
G003	memory_transfers	a75c327cfa20ad3338d68aa1a75398458b76ea46	keep	postflop.memory.rainbow.cold.compressed.strategy_sync_ms	165.93179999999998	Final combined memory and evaluation checks: actual device allocation, cold and warm lifecycle, and repeated first/capture/steady evaluations.	2026-09-07T06:41:41+00:00
G003	memory_transfers	a75c327cfa20ad3338d68aa1a75398458b76ea46	keep	postflop.memory.rainbow.cold.compressed.sync_ms	337.33459999999997	Final combined memory and evaluation checks: actual device allocation, cold and warm lifecycle, and repeated first/capture/steady evaluations.	2026-09-07T06:41:41+00:00
G003	memory_transfers	a75c327cfa20ad3338d68aa1a75398458b76ea46	keep	postflop.memory.rainbow.warm.compressed.allocated_vram_mb	5905.580032	Final combined memory and evaluation checks: actual device allocation, cold and warm lifecycle, and repeated first/capture/steady evaluations.	2026-09-07T06:41:41+00:00
G003	memory_transfers	a75c327cfa20ad3338d68aa1a75398458b76ea46	keep	postflop.memory.rainbow.warm.compressed.host_live_mb	2596.999168	Final combined memory and evaluation checks: actual device allocation, cold and warm lifecycle, and repeated first/capture/steady evaluations.	2026-09-07T06:41:41+00:00
G003	memory_transfers	a75c327cfa20ad3338d68aa1a75398458b76ea46	keep	postflop.memory.rainbow.warm.compressed.host_private_mb	9088.483328	Final combined memory and evaluation checks: actual device allocation, cold and warm lifecycle, and repeated first/capture/steady evaluations.	2026-09-07T06:41:41+00:00
G003	memory_transfers	a75c327cfa20ad3338d68aa1a75398458b76ea46	keep	postflop.memory.rainbow.warm.compressed.init_ms	812.5689	Final combined memory and evaluation checks: actual device allocation, cold and warm lifecycle, and repeated first/capture/steady evaluations.	2026-09-07T06:41:41+00:00
G003	memory_transfers	a75c327cfa20ad3338d68aa1a75398458b76ea46	keep	postflop.memory.rainbow.warm.compressed.strategy_sync_ms	167.1227	Final combined memory and evaluation checks: actual device allocation, cold and warm lifecycle, and repeated first/capture/steady evaluations.	2026-09-07T06:41:41+00:00
G003	memory_transfers	a75c327cfa20ad3338d68aa1a75398458b76ea46	keep	postflop.memory.rainbow.warm.compressed.sync_ms	338.3694	Final combined memory and evaluation checks: actual device allocation, cold and warm lifecycle, and repeated first/capture/steady evaluations.	2026-09-07T06:41:41+00:00
G003	memory_transfers	a75c327cfa20ad3338d68aa1a75398458b76ea46	keep	postflop.memory.cold.f32.allocated_vram_mb	4731.174912	Final combined memory and evaluation checks: actual device allocation, cold and warm lifecycle, and repeated first/capture/steady evaluations.	2026-09-07T06:41:41+00:00
G003	memory_transfers	a75c327cfa20ad3338d68aa1a75398458b76ea46	keep	postflop.memory.cold.f32.host_live_mb	3917.201408	Final combined memory and evaluation checks: actual device allocation, cold and warm lifecycle, and repeated first/capture/steady evaluations.	2026-09-07T06:41:41+00:00
G003	memory_transfers	a75c327cfa20ad3338d68aa1a75398458b76ea46	keep	postflop.memory.cold.f32.host_private_mb	9231.663104	Final combined memory and evaluation checks: actual device allocation, cold and warm lifecycle, and repeated first/capture/steady evaluations.	2026-09-07T06:41:41+00:00
G003	memory_transfers	a75c327cfa20ad3338d68aa1a75398458b76ea46	keep	postflop.memory.cold.f32.init_ms	764.0916	Final combined memory and evaluation checks: actual device allocation, cold and warm lifecycle, and repeated first/capture/steady evaluations.	2026-09-07T06:41:41+00:00
G003	memory_transfers	a75c327cfa20ad3338d68aa1a75398458b76ea46	keep	postflop.memory.cold.f32.strategy_sync_ms	160.8278	Final combined memory and evaluation checks: actual device allocation, cold and warm lifecycle, and repeated first/capture/steady evaluations.	2026-09-07T06:41:41+00:00
G003	memory_transfers	a75c327cfa20ad3338d68aa1a75398458b76ea46	keep	postflop.memory.cold.f32.sync_ms	315.06309999999996	Final combined memory and evaluation checks: actual device allocation, cold and warm lifecycle, and repeated first/capture/steady evaluations.	2026-09-07T06:41:41+00:00
G003	memory_transfers	a75c327cfa20ad3338d68aa1a75398458b76ea46	keep	postflop.memory.warm.f32.allocated_vram_mb	4731.174912	Final combined memory and evaluation checks: actual device allocation, cold and warm lifecycle, and repeated first/capture/steady evaluations.	2026-09-07T06:41:41+00:00
G003	memory_transfers	a75c327cfa20ad3338d68aa1a75398458b76ea46	keep	postflop.memory.warm.f32.host_live_mb	3936.37888	Final combined memory and evaluation checks: actual device allocation, cold and warm lifecycle, and repeated first/capture/steady evaluations.	2026-09-07T06:41:41+00:00
G003	memory_transfers	a75c327cfa20ad3338d68aa1a75398458b76ea46	keep	postflop.memory.warm.f32.host_private_mb	9246.818304	Final combined memory and evaluation checks: actual device allocation, cold and warm lifecycle, and repeated first/capture/steady evaluations.	2026-09-07T06:41:41+00:00
G003	memory_transfers	a75c327cfa20ad3338d68aa1a75398458b76ea46	keep	postflop.memory.warm.f32.init_ms	679.6604000000001	Final combined memory and evaluation checks: actual device allocation, cold and warm lifecycle, and repeated first/capture/steady evaluations.	2026-09-07T06:41:41+00:00
G003	memory_transfers	a75c327cfa20ad3338d68aa1a75398458b76ea46	keep	postflop.memory.warm.f32.strategy_sync_ms	157.4178	Final combined memory and evaluation checks: actual device allocation, cold and warm lifecycle, and repeated first/capture/steady evaluations.	2026-09-07T06:41:41+00:00
G003	memory_transfers	a75c327cfa20ad3338d68aa1a75398458b76ea46	keep	postflop.memory.warm.f32.sync_ms	315.5089	Final combined memory and evaluation checks: actual device allocation, cold and warm lifecycle, and repeated first/capture/steady evaluations.	2026-09-07T06:41:41+00:00
G003	memory_transfers	a75c327cfa20ad3338d68aa1a75398458b76ea46	keep	postflop.memory.cold.compressed.allocated_vram_mb	3623.878656	Final combined memory and evaluation checks: actual device allocation, cold and warm lifecycle, and repeated first/capture/steady evaluations.	2026-09-07T06:41:41+00:00
G003	memory_transfers	a75c327cfa20ad3338d68aa1a75398458b76ea46	keep	postflop.memory.cold.compressed.host_live_mb	2309.14048	Final combined memory and evaluation checks: actual device allocation, cold and warm lifecycle, and repeated first/capture/steady evaluations.	2026-09-07T06:41:41+00:00
G003	memory_transfers	a75c327cfa20ad3338d68aa1a75398458b76ea46	keep	postflop.memory.cold.compressed.host_private_mb	6511.149056	Final combined memory and evaluation checks: actual device allocation, cold and warm lifecycle, and repeated first/capture/steady evaluations.	2026-09-07T06:41:41+00:00
G003	memory_transfers	a75c327cfa20ad3338d68aa1a75398458b76ea46	keep	postflop.memory.cold.compressed.init_ms	610.103	Final combined memory and evaluation checks: actual device allocation, cold and warm lifecycle, and repeated first/capture/steady evaluations.	2026-09-07T06:41:41+00:00
G003	memory_transfers	a75c327cfa20ad3338d68aa1a75398458b76ea46	keep	postflop.memory.cold.compressed.strategy_sync_ms	125.4606	Final combined memory and evaluation checks: actual device allocation, cold and warm lifecycle, and repeated first/capture/steady evaluations.	2026-09-07T06:41:41+00:00
G003	memory_transfers	a75c327cfa20ad3338d68aa1a75398458b76ea46	keep	postflop.memory.cold.compressed.sync_ms	259.5902	Final combined memory and evaluation checks: actual device allocation, cold and warm lifecycle, and repeated first/capture/steady evaluations.	2026-09-07T06:41:41+00:00
G003	memory_transfers	a75c327cfa20ad3338d68aa1a75398458b76ea46	keep	postflop.memory.warm.compressed.allocated_vram_mb	3623.878656	Final combined memory and evaluation checks: actual device allocation, cold and warm lifecycle, and repeated first/capture/steady evaluations.	2026-09-07T06:41:41+00:00
G003	memory_transfers	a75c327cfa20ad3338d68aa1a75398458b76ea46	keep	postflop.memory.warm.compressed.host_live_mb	3770.580992	Final combined memory and evaluation checks: actual device allocation, cold and warm lifecycle, and repeated first/capture/steady evaluations.	2026-09-07T06:41:41+00:00
G003	memory_transfers	a75c327cfa20ad3338d68aa1a75398458b76ea46	keep	postflop.memory.warm.compressed.host_private_mb	8131.416064	Final combined memory and evaluation checks: actual device allocation, cold and warm lifecycle, and repeated first/capture/steady evaluations.	2026-09-07T06:41:41+00:00
G003	memory_transfers	a75c327cfa20ad3338d68aa1a75398458b76ea46	keep	postflop.memory.warm.compressed.init_ms	1099.2911000000001	Final combined memory and evaluation checks: actual device allocation, cold and warm lifecycle, and repeated first/capture/steady evaluations.	2026-09-07T06:41:41+00:00
G003	memory_transfers	a75c327cfa20ad3338d68aa1a75398458b76ea46	keep	postflop.memory.warm.compressed.strategy_sync_ms	164.6826	Final combined memory and evaluation checks: actual device allocation, cold and warm lifecycle, and repeated first/capture/steady evaluations.	2026-09-07T06:41:41+00:00
G003	memory_transfers	a75c327cfa20ad3338d68aa1a75398458b76ea46	keep	postflop.memory.warm.compressed.sync_ms	305.50939999999997	Final combined memory and evaluation checks: actual device allocation, cold and warm lifecycle, and repeated first/capture/steady evaluations.	2026-09-07T06:41:41+00:00
G004	reports_profiles	a75c327cfa20ad3338d68aa1a75398458b76ea46	keep	reports.adaptation_seconds	3.63	Final combined server report adaptation tests and fixed 80-iteration performance workload.	2026-09-07T06:42:54+00:00
B035	baseline	dfc1b3765810e50e0de713691e48e50bb18ea4b8	baseline	postflop.Ks7h2d.first_check_ms	36.7749	Fresh pass-start fixed-step postflop, device memory, full cold/warm transfers, and first/capture/steady checks; original source and frozen inputs.	2026-09-07T06:46:25+00:00
B035	baseline	dfc1b3765810e50e0de713691e48e50bb18ea4b8	baseline	postflop.Ks7h2d.second_check_ms	37.184799999999996	Fresh pass-start fixed-step postflop, device memory, full cold/warm transfers, and first/capture/steady checks; original source and frozen inputs.	2026-09-07T06:46:25+00:00
B035	baseline	dfc1b3765810e50e0de713691e48e50bb18ea4b8	baseline	postflop.Ks7h2d.steady_check_ms	37.42545	Fresh pass-start fixed-step postflop, device memory, full cold/warm transfers, and first/capture/steady checks; original source and frozen inputs.	2026-09-07T06:46:25+00:00
B035	baseline	dfc1b3765810e50e0de713691e48e50bb18ea4b8	baseline	postflop.Ks7s2d.first_check_ms	29.7091	Fresh pass-start fixed-step postflop, device memory, full cold/warm transfers, and first/capture/steady checks; original source and frozen inputs.	2026-09-07T06:46:25+00:00
B035	baseline	dfc1b3765810e50e0de713691e48e50bb18ea4b8	baseline	postflop.Ks7s2d.second_check_ms	28.51	Fresh pass-start fixed-step postflop, device memory, full cold/warm transfers, and first/capture/steady checks; original source and frozen inputs.	2026-09-07T06:46:25+00:00
B035	baseline	dfc1b3765810e50e0de713691e48e50bb18ea4b8	baseline	postflop.Ks7s2d.steady_check_ms	29.937325	Fresh pass-start fixed-step postflop, device memory, full cold/warm transfers, and first/capture/steady checks; original source and frozen inputs.	2026-09-07T06:46:25+00:00
B035	baseline	dfc1b3765810e50e0de713691e48e50bb18ea4b8	baseline	postflop.Ks7h2dQhTc.first_check_ms	0.8628	Fresh pass-start fixed-step postflop, device memory, full cold/warm transfers, and first/capture/steady checks; original source and frozen inputs.	2026-09-07T06:46:25+00:00
B035	baseline	dfc1b3765810e50e0de713691e48e50bb18ea4b8	baseline	postflop.Ks7h2dQhTc.second_check_ms	0.7505	Fresh pass-start fixed-step postflop, device memory, full cold/warm transfers, and first/capture/steady checks; original source and frozen inputs.	2026-09-07T06:46:25+00:00
B035	baseline	dfc1b3765810e50e0de713691e48e50bb18ea4b8	baseline	postflop.Ks7h2dQhTc.steady_check_ms	0.7909250000000001	Fresh pass-start fixed-step postflop, device memory, full cold/warm transfers, and first/capture/steady checks; original source and frozen inputs.	2026-09-07T06:46:25+00:00
B035	baseline	dfc1b3765810e50e0de713691e48e50bb18ea4b8	baseline	preflop.2.first_check_ms	0.3525	Fresh pass-start fixed-step postflop, device memory, full cold/warm transfers, and first/capture/steady checks; original source and frozen inputs.	2026-09-07T06:46:25+00:00
B035	baseline	dfc1b3765810e50e0de713691e48e50bb18ea4b8	baseline	preflop.2.second_check_ms	0.3687	Fresh pass-start fixed-step postflop, device memory, full cold/warm transfers, and first/capture/steady checks; original source and frozen inputs.	2026-09-07T06:46:25+00:00
