experiment	path	commit	status	metric	value	hypothesis	utc
B026	memory_transfers	1e6124f2ba907afca9e9597f169ccca621251485	baseline	postflop.memory.warm.f32.init_ms	652.2886	Pre-compaction full action-arena reference for cold/warm F32/compressed live host memory, VRAM, GPU initialization and both download paths	2026-09-07T04:28:48+00:00
B026	memory_transfers	1e6124f2ba907afca9e9597f169ccca621251485	baseline	postflop.memory.warm.f32.strategy_sync_ms	157.4931	Pre-compaction full action-arena reference for cold/warm F32/compressed live host memory, VRAM, GPU initialization and both download paths	2026-09-07T04:28:48+00:00
B026	memory_transfers	1e6124f2ba907afca9e9597f169ccca621251485	baseline	postflop.memory.warm.f32.sync_ms	309.4536	Pre-compaction full action-arena reference for cold/warm F32/compressed live host memory, VRAM, GPU initialization and both download paths	2026-09-07T04:28:48+00:00
B026	memory_transfers	1e6124f2ba907afca9e9597f169ccca621251485	baseline	postflop.memory.cold.compressed.allocated_vram_mb	4932.501504	Pre-compaction full action-arena reference for cold/warm F32/compressed live host memory, VRAM, GPU initialization and both download paths	2026-09-07T04:28:48+00:00
B026	memory_transfers	1e6124f2ba907afca9e9597f169ccca621251485	baseline	postflop.memory.cold.compressed.host_live_mb	5320.187904	Pre-compaction full action-arena reference for cold/warm F32/compressed live host memory, VRAM, GPU initialization and both download paths	2026-09-07T04:28:48+00:00
B026	memory_transfers	1e6124f2ba907afca9e9597f169ccca621251485	baseline	postflop.memory.cold.compressed.host_private_mb	10601.906176	Pre-compaction full action-arena reference for cold/warm F32/compressed live host memory, VRAM, GPU initialization and both download paths	2026-09-07T04:28:48+00:00
B026	memory_transfers	1e6124f2ba907afca9e9597f169ccca621251485	baseline	postflop.memory.cold.compressed.init_ms	1543.5738	Pre-compaction full action-arena reference for cold/warm F32/compressed live host memory, VRAM, GPU initialization and both download paths	2026-09-07T04:28:48+00:00
B026	memory_transfers	1e6124f2ba907afca9e9597f169ccca621251485	baseline	postflop.memory.cold.compressed.strategy_sync_ms	478.344	Pre-compaction full action-arena reference for cold/warm F32/compressed live host memory, VRAM, GPU initialization and both download paths	2026-09-07T04:28:48+00:00
B026	memory_transfers	1e6124f2ba907afca9e9597f169ccca621251485	baseline	postflop.memory.cold.compressed.sync_ms	925.2454	Pre-compaction full action-arena reference for cold/warm F32/compressed live host memory, VRAM, GPU initialization and both download paths	2026-09-07T04:28:48+00:00
B026	memory_transfers	1e6124f2ba907afca9e9597f169ccca621251485	baseline	postflop.memory.warm.compressed.allocated_vram_mb	4932.501504	Pre-compaction full action-arena reference for cold/warm F32/compressed live host memory, VRAM, GPU initialization and both download paths	2026-09-07T04:28:48+00:00
B026	memory_transfers	1e6124f2ba907afca9e9597f169ccca621251485	baseline	postflop.memory.warm.compressed.host_live_mb	5320.282112	Pre-compaction full action-arena reference for cold/warm F32/compressed live host memory, VRAM, GPU initialization and both download paths	2026-09-07T04:28:48+00:00
B026	memory_transfers	1e6124f2ba907afca9e9597f169ccca621251485	baseline	postflop.memory.warm.compressed.host_private_mb	10602.070016	Pre-compaction full action-arena reference for cold/warm F32/compressed live host memory, VRAM, GPU initialization and both download paths	2026-09-07T04:28:48+00:00
B026	memory_transfers	1e6124f2ba907afca9e9597f169ccca621251485	baseline	postflop.memory.warm.compressed.init_ms	1585.7136999999998	Pre-compaction full action-arena reference for cold/warm F32/compressed live host memory, VRAM, GPU initialization and both download paths	2026-09-07T04:28:48+00:00
B026	memory_transfers	1e6124f2ba907afca9e9597f169ccca621251485	baseline	postflop.memory.warm.compressed.strategy_sync_ms	676.4058	Pre-compaction full action-arena reference for cold/warm F32/compressed live host memory, VRAM, GPU initialization and both download paths	2026-09-07T04:28:48+00:00
B026	memory_transfers	1e6124f2ba907afca9e9597f169ccca621251485	baseline	postflop.memory.warm.compressed.sync_ms	1289.081	Pre-compaction full action-arena reference for cold/warm F32/compressed live host memory, VRAM, GPU initialization and both download paths	2026-09-07T04:28:48+00:00
E024C	memory_transfers	ffe12e97cf9554dd9f22c7e891ba74270b22b3d2	discard	postflop.memory.cold.f32.allocated_vram_mb	3825.205248	Restore compact action arenas with vectorizable bitwise zero-block detection; measure complete cold/warm host-memory and transfer tradeoffs against B026	2026-09-07T04:31:01+00:00
E024C	memory_transfers	ffe12e97cf9554dd9f22c7e891ba74270b22b3d2	discard	postflop.memory.cold.f32.host_live_mb	4462.977024	Restore compact action arenas with vectorizable bitwise zero-block detection; measure complete cold/warm host-memory and transfer tradeoffs against B026	2026-09-07T04:31:01+00:00
E024C	memory_transfers	ffe12e97cf9554dd9f22c7e891ba74270b22b3d2	discard	postflop.memory.cold.f32.host_private_mb	8879.849472	Restore compact action arenas with vectorizable bitwise zero-block detection; measure complete cold/warm host-memory and transfer tradeoffs against B026	2026-09-07T04:31:01+00:00
E024C	memory_transfers	ffe12e97cf9554dd9f22c7e891ba74270b22b3d2	discard	postflop.memory.cold.f32.init_ms	1248.8847999999998	Restore compact action arenas with vectorizable bitwise zero-block detection; measure complete cold/warm host-memory and transfer tradeoffs against B026	2026-09-07T04:31:01+00:00
E024C	memory_transfers	ffe12e97cf9554dd9f22c7e891ba74270b22b3d2	discard	postflop.memory.cold.f32.strategy_sync_ms	219.95780000000002	Restore compact action arenas with vectorizable bitwise zero-block detection; measure complete cold/warm host-memory and transfer tradeoffs against B026	2026-09-07T04:31:01+00:00
E024C	memory_transfers	ffe12e97cf9554dd9f22c7e891ba74270b22b3d2	discard	postflop.memory.cold.f32.sync_ms	432.18580000000003	Restore compact action arenas with vectorizable bitwise zero-block detection; measure complete cold/warm host-memory and transfer tradeoffs against B026	2026-09-07T04:31:01+00:00
E024C	memory_transfers	ffe12e97cf9554dd9f22c7e891ba74270b22b3d2	discard	postflop.memory.warm.f32.allocated_vram_mb	3825.205248	Restore compact action arenas with vectorizable bitwise zero-block detection; measure complete cold/warm host-memory and transfer tradeoffs against B026	2026-09-07T04:31:01+00:00
E024C	memory_transfers	ffe12e97cf9554dd9f22c7e891ba74270b22b3d2	discard	postflop.memory.warm.f32.host_live_mb	5729.222656	Restore compact action arenas with vectorizable bitwise zero-block detection; measure complete cold/warm host-memory and transfer tradeoffs against B026	2026-09-07T04:31:01+00:00
E024C	memory_transfers	ffe12e97cf9554dd9f22c7e891ba74270b22b3d2	discard	postflop.memory.warm.f32.host_private_mb	10288.64	Restore compact action arenas with vectorizable bitwise zero-block detection; measure complete cold/warm host-memory and transfer tradeoffs against B026	2026-09-07T04:31:01+00:00
E024C	memory_transfers	ffe12e97cf9554dd9f22c7e891ba74270b22b3d2	discard	postflop.memory.warm.f32.init_ms	1613.8884	Restore compact action arenas with vectorizable bitwise zero-block detection; measure complete cold/warm host-memory and transfer tradeoffs against B026	2026-09-07T04:31:01+00:00
E024C	memory_transfers	ffe12e97cf9554dd9f22c7e891ba74270b22b3d2	discard	postflop.memory.warm.f32.strategy_sync_ms	253.7218	Restore compact action arenas with vectorizable bitwise zero-block detection; measure complete cold/warm host-memory and transfer tradeoffs against B026	2026-09-07T04:31:01+00:00
E024C	memory_transfers	ffe12e97cf9554dd9f22c7e891ba74270b22b3d2	discard	postflop.memory.warm.f32.sync_ms	489.9636	Restore compact action arenas with vectorizable bitwise zero-block detection; measure complete cold/warm host-memory and transfer tradeoffs against B026	2026-09-07T04:31:01+00:00
E024C	memory_transfers	ffe12e97cf9554dd9f22c7e891ba74270b22b3d2	discard	postflop.memory.cold.compressed.allocated_vram_mb	3825.205248	Restore compact action arenas with vectorizable bitwise zero-block detection; measure complete cold/warm host-memory and transfer tradeoffs against B026	2026-09-07T04:31:01+00:00
E024C	memory_transfers	ffe12e97cf9554dd9f22c7e891ba74270b22b3d2	discard	postflop.memory.cold.compressed.host_live_mb	2754.715648	Restore compact action arenas with vectorizable bitwise zero-block detection; measure complete cold/warm host-memory and transfer tradeoffs against B026	2026-09-07T04:31:01+00:00
E024C	memory_transfers	ffe12e97cf9554dd9f22c7e891ba74270b22b3d2	discard	postflop.memory.cold.compressed.host_private_mb	7163.133952	Restore compact action arenas with vectorizable bitwise zero-block detection; measure complete cold/warm host-memory and transfer tradeoffs against B026	2026-09-07T04:31:01+00:00
E024C	memory_transfers	ffe12e97cf9554dd9f22c7e891ba74270b22b3d2	discard	postflop.memory.cold.compressed.init_ms	903.4918	Restore compact action arenas with vectorizable bitwise zero-block detection; measure complete cold/warm host-memory and transfer tradeoffs against B026	2026-09-07T04:31:01+00:00
E024C	memory_transfers	ffe12e97cf9554dd9f22c7e891ba74270b22b3d2	discard	postflop.memory.cold.compressed.strategy_sync_ms	449.0752	Restore compact action arenas with vectorizable bitwise zero-block detection; measure complete cold/warm host-memory and transfer tradeoffs against B026	2026-09-07T04:31:01+00:00
E024C	memory_transfers	ffe12e97cf9554dd9f22c7e891ba74270b22b3d2	discard	postflop.memory.cold.compressed.sync_ms	899.7561	Restore compact action arenas with vectorizable bitwise zero-block detection; measure complete cold/warm host-memory and transfer tradeoffs against B026	2026-09-07T04:31:01+00:00
E024C	memory_transfers	ffe12e97cf9554dd9f22c7e891ba74270b22b3d2	discard	postflop.memory.warm.compressed.allocated_vram_mb	3825.205248	Restore compact action arenas with vectorizable bitwise zero-block detection; measure complete cold/warm host-memory and transfer tradeoffs against B026	2026-09-07T04:31:01+00:00
E024C	memory_transfers	ffe12e97cf9554dd9f22c7e891ba74270b22b3d2	discard	postflop.memory.warm.compressed.host_live_mb	4155.482112	Restore compact action arenas with vectorizable bitwise zero-block detection; measure complete cold/warm host-memory and transfer tradeoffs against B026	2026-09-07T04:31:01+00:00
E024C	memory_transfers	ffe12e97cf9554dd9f22c7e891ba74270b22b3d2	discard	postflop.memory.warm.compressed.host_private_mb	8510.6688	Restore compact action arenas with vectorizable bitwise zero-block detection; measure complete cold/warm host-memory and transfer tradeoffs against B026	2026-09-07T04:31:01+00:00
E024C	memory_transfers	ffe12e97cf9554dd9f22c7e891ba74270b22b3d2	discard	postflop.memory.warm.compressed.init_ms	1337.3429999999998	Restore compact action arenas with vectorizable bitwise zero-block detection; measure complete cold/warm host-memory and transfer tradeoffs against B026	2026-09-07T04:31:01+00:00
E024C	memory_transfers	ffe12e97cf9554dd9f22c7e891ba74270b22b3d2	discard	postflop.memory.warm.compressed.strategy_sync_ms	665.8615	Restore compact action arenas with vectorizable bitwise zero-block detection; measure complete cold/warm host-memory and transfer tradeoffs against B026	2026-09-07T04:31:01+00:00
E024C	memory_transfers	ffe12e97cf9554dd9f22c7e891ba74270b22b3d2	discard	postflop.memory.warm.compressed.sync_ms	1352.1607	Restore compact action arenas with vectorizable bitwise zero-block detection; measure complete cold/warm host-memory and transfer tradeoffs against B026	2026-09-07T04:31:01+00:00
E024D	memory_transfers	360ce0dcdba64f6886e4a5b123f49ddf5372ee3e	discard	postflop.memory.cold.f32.allocated_vram_mb	3825.205248	Remove pageable packed-arena temporaries, reuse pinned upload/download storage, coalesce F32 copies and trim inactive snapshot capacity to reduce host memory and transfer costs	2026-09-07T04:34:11+00:00
E024D	memory_transfers	360ce0dcdba64f6886e4a5b123f49ddf5372ee3e	discard	postflop.memory.cold.f32.host_live_mb	3642.056704	Remove pageable packed-arena temporaries, reuse pinned upload/download storage, coalesce F32 copies and trim inactive snapshot capacity to reduce host memory and transfer costs	2026-09-07T04:34:11+00:00
E024D	memory_transfers	360ce0dcdba64f6886e4a5b123f49ddf5372ee3e	discard	postflop.memory.cold.f32.host_private_mb	8066.408448	Remove pageable packed-arena temporaries, reuse pinned upload/download storage, coalesce F32 copies and trim inactive snapshot capacity to reduce host memory and transfer costs	2026-09-07T04:34:11+00:00
E024D	memory_transfers	360ce0dcdba64f6886e4a5b123f49ddf5372ee3e	discard	postflop.memory.cold.f32.init_ms	599.6827000000001	Remove pageable packed-arena temporaries, reuse pinned upload/download storage, coalesce F32 copies and trim inactive snapshot capacity to reduce host memory and transfer costs	2026-09-07T04:34:11+00:00
E024D	memory_transfers	360ce0dcdba64f6886e4a5b123f49ddf5372ee3e	discard	postflop.memory.cold.f32.strategy_sync_ms	188.9072	Remove pageable packed-arena temporaries, reuse pinned upload/download storage, coalesce F32 copies and trim inactive snapshot capacity to reduce host memory and transfer costs	2026-09-07T04:34:11+00:00
E024D	memory_transfers	360ce0dcdba64f6886e4a5b123f49ddf5372ee3e	discard	postflop.memory.cold.f32.sync_ms	376.5779	Remove pageable packed-arena temporaries, reuse pinned upload/download storage, coalesce F32 copies and trim inactive snapshot capacity to reduce host memory and transfer costs	2026-09-07T04:34:11+00:00
E024D	memory_transfers	360ce0dcdba64f6886e4a5b123f49ddf5372ee3e	discard	postflop.memory.warm.f32.allocated_vram_mb	3825.205248	Remove pageable packed-arena temporaries, reuse pinned upload/download storage, coalesce F32 copies and trim inactive snapshot capacity to reduce host memory and transfer costs	2026-09-07T04:34:11+00:00
E024D	memory_transfers	360ce0dcdba64f6886e4a5b123f49ddf5372ee3e	discard	postflop.memory.warm.f32.host_live_mb	5017.35424	Remove pageable packed-arena temporaries, reuse pinned upload/download storage, coalesce F32 copies and trim inactive snapshot capacity to reduce host memory and transfer costs	2026-09-07T04:34:11+00:00
E024D	memory_transfers	360ce0dcdba64f6886e4a5b123f49ddf5372ee3e	discard	postflop.memory.warm.f32.host_private_mb	9618.685952	Remove pageable packed-arena temporaries, reuse pinned upload/download storage, coalesce F32 copies and trim inactive snapshot capacity to reduce host memory and transfer costs	2026-09-07T04:34:11+00:00
E024D	memory_transfers	360ce0dcdba64f6886e4a5b123f49ddf5372ee3e	discard	postflop.memory.warm.f32.init_ms	912.4881	Remove pageable packed-arena temporaries, reuse pinned upload/download storage, coalesce F32 copies and trim inactive snapshot capacity to reduce host memory and transfer costs	2026-09-07T04:34:11+00:00
E024D	memory_transfers	360ce0dcdba64f6886e4a5b123f49ddf5372ee3e	discard	postflop.memory.warm.f32.strategy_sync_ms	214.66969999999998	Remove pageable packed-arena temporaries, reuse pinned upload/download storage, coalesce F32 copies and trim inactive snapshot capacity to reduce host memory and transfer costs	2026-09-07T04:34:11+00:00
E024D	memory_transfers	360ce0dcdba64f6886e4a5b123f49ddf5372ee3e	discard	postflop.memory.warm.f32.sync_ms	430.2626	Remove pageable packed-arena temporaries, reuse pinned upload/download storage, coalesce F32 copies and trim inactive snapshot capacity to reduce host memory and transfer costs	2026-09-07T04:34:11+00:00
E024D	memory_transfers	360ce0dcdba64f6886e4a5b123f49ddf5372ee3e	discard	postflop.memory.cold.compressed.allocated_vram_mb	3825.205248	Remove pageable packed-arena temporaries, reuse pinned upload/download storage, coalesce F32 copies and trim inactive snapshot capacity to reduce host memory and transfer costs	2026-09-07T04:34:11+00:00
E024D	memory_transfers	360ce0dcdba64f6886e4a5b123f49ddf5372ee3e	discard	postflop.memory.cold.compressed.host_live_mb	2303.340544	Remove pageable packed-arena temporaries, reuse pinned upload/download storage, coalesce F32 copies and trim inactive snapshot capacity to reduce host memory and transfer costs	2026-09-07T04:34:11+00:00
E024D	memory_transfers	360ce0dcdba64f6886e4a5b123f49ddf5372ee3e	discard	postflop.memory.cold.compressed.host_private_mb	6716.25216	Remove pageable packed-arena temporaries, reuse pinned upload/download storage, coalesce F32 copies and trim inactive snapshot capacity to reduce host memory and transfer costs	2026-09-07T04:34:11+00:00
E024D	memory_transfers	360ce0dcdba64f6886e4a5b123f49ddf5372ee3e	discard	postflop.memory.cold.compressed.init_ms	588.9697	Remove pageable packed-arena temporaries, reuse pinned upload/download storage, coalesce F32 copies and trim inactive snapshot capacity to reduce host memory and transfer costs	2026-09-07T04:34:11+00:00
E024D	memory_transfers	360ce0dcdba64f6886e4a5b123f49ddf5372ee3e	discard	postflop.memory.cold.compressed.strategy_sync_ms	449.73760000000004	Remove pageable packed-arena temporaries, reuse pinned upload/download storage, coalesce F32 copies and trim inactive snapshot capacity to reduce host memory and transfer costs	2026-09-07T04:34:11+00:00
E024D	memory_transfers	360ce0dcdba64f6886e4a5b123f49ddf5372ee3e	discard	postflop.memory.cold.compressed.sync_ms	880.7989	Remove pageable packed-arena temporaries, reuse pinned upload/download storage, coalesce F32 copies and trim inactive snapshot capacity to reduce host memory and transfer costs	2026-09-07T04:34:11+00:00
E024D	memory_transfers	360ce0dcdba64f6886e4a5b123f49ddf5372ee3e	discard	postflop.memory.warm.compressed.allocated_vram_mb	3825.205248	Remove pageable packed-arena temporaries, reuse pinned upload/download storage, coalesce F32 copies and trim inactive snapshot capacity to reduce host memory and transfer costs	2026-09-07T04:34:11+00:00
E024D	memory_transfers	360ce0dcdba64f6886e4a5b123f49ddf5372ee3e	discard	postflop.memory.warm.compressed.host_live_mb	3767.345152	Remove pageable packed-arena temporaries, reuse pinned upload/download storage, coalesce F32 copies and trim inactive snapshot capacity to reduce host memory and transfer costs	2026-09-07T04:34:11+00:00
E024D	memory_transfers	360ce0dcdba64f6886e4a5b123f49ddf5372ee3e	discard	postflop.memory.warm.compressed.host_private_mb	8099.75808	Remove pageable packed-arena temporaries, reuse pinned upload/download storage, coalesce F32 copies and trim inactive snapshot capacity to reduce host memory and transfer costs	2026-09-07T04:34:11+00:00
E024D	memory_transfers	360ce0dcdba64f6886e4a5b123f49ddf5372ee3e	discard	postflop.memory.warm.compressed.init_ms	1002.0215999999999	Remove pageable packed-arena temporaries, reuse pinned upload/download storage, coalesce F32 copies and trim inactive snapshot capacity to reduce host memory and transfer costs	2026-09-07T04:34:11+00:00
E024D	memory_transfers	360ce0dcdba64f6886e4a5b123f49ddf5372ee3e	discard	postflop.memory.warm.compressed.strategy_sync_ms	665.6309	Remove pageable packed-arena temporaries, reuse pinned upload/download storage, coalesce F32 copies and trim inactive snapshot capacity to reduce host memory and transfer costs	2026-09-07T04:34:11+00:00
E024D	memory_transfers	360ce0dcdba64f6886e4a5b123f49ddf5372ee3e	discard	postflop.memory.warm.compressed.sync_ms	1315.9936	Remove pageable packed-arena temporaries, reuse pinned upload/download storage, coalesce F32 copies and trim inactive snapshot capacity to reduce host memory and transfer costs	2026-09-07T04:34:11+00:00
E024E	memory_transfers	2351793787a46a8566ab6cb5050b63860341cd93	discard	postflop.memory.cold.f32.allocated_vram_mb	3825.205248	Parallelize independent compact arena CPU scatter/restore and compressed node encoding to offset the extra host work while preserving exact bytes	2026-09-07T04:37:47+00:00
E024E	memory_transfers	2351793787a46a8566ab6cb5050b63860341cd93	discard	postflop.memory.cold.f32.host_live_mb	3642.331136	Parallelize independent compact arena CPU scatter/restore and compressed node encoding to offset the extra host work while preserving exact bytes	2026-09-07T04:37:47+00:00
E024E	memory_transfers	2351793787a46a8566ab6cb5050b63860341cd93	discard	postflop.memory.cold.f32.host_private_mb	8063.954944	Parallelize independent compact arena CPU scatter/restore and compressed node encoding to offset the extra host work while preserving exact bytes	2026-09-07T04:37:47+00:00
E024E	memory_transfers	2351793787a46a8566ab6cb5050b63860341cd93	discard	postflop.memory.cold.f32.init_ms	656.42	Parallelize independent compact arena CPU scatter/restore and compressed node encoding to offset the extra host work while preserving exact bytes	2026-09-07T04:37:47+00:00
E024E	memory_transfers	2351793787a46a8566ab6cb5050b63860341cd93	discard	postflop.memory.cold.f32.strategy_sync_ms	194.5728	Parallelize independent compact arena CPU scatter/restore and compressed node encoding to offset the extra host work while preserving exact bytes	2026-09-07T04:37:47+00:00
E024E	memory_transfers	2351793787a46a8566ab6cb5050b63860341cd93	discard	postflop.memory.cold.f32.sync_ms	370.5911	Parallelize independent compact arena CPU scatter/restore and compressed node encoding to offset the extra host work while preserving exact bytes	2026-09-07T04:37:47+00:00
E024E	memory_transfers	2351793787a46a8566ab6cb5050b63860341cd93	discard	postflop.memory.warm.f32.allocated_vram_mb	3825.205248	Parallelize independent compact arena CPU scatter/restore and compressed node encoding to offset the extra host work while preserving exact bytes	2026-09-07T04:37:47+00:00
