experiment	path	commit	status	metric	value	hypothesis	utc
G005	postflop_cuda	d3ff6d69969e13939e3ff7e1f43f6d9616ce24f3	keep	postflop.memory.rainbow.warm.compressed.host_private_mb	9087.971328	Final combined fixed-step postflop and lifecycle comparison after fresh B035; numerical output and workload unchanged.	2026-09-07T06:48:34+00:00
G005	postflop_cuda	d3ff6d69969e13939e3ff7e1f43f6d9616ce24f3	keep	postflop.memory.rainbow.warm.compressed.init_ms	824.7242	Final combined fixed-step postflop and lifecycle comparison after fresh B035; numerical output and workload unchanged.	2026-09-07T06:48:34+00:00
G005	postflop_cuda	d3ff6d69969e13939e3ff7e1f43f6d9616ce24f3	keep	postflop.memory.rainbow.warm.compressed.strategy_sync_ms	171.306	Final combined fixed-step postflop and lifecycle comparison after fresh B035; numerical output and workload unchanged.	2026-09-07T06:48:34+00:00
G005	postflop_cuda	d3ff6d69969e13939e3ff7e1f43f6d9616ce24f3	keep	postflop.memory.rainbow.warm.compressed.sync_ms	340.2909	Final combined fixed-step postflop and lifecycle comparison after fresh B035; numerical output and workload unchanged.	2026-09-07T06:48:34+00:00
G005	postflop_cuda	d3ff6d69969e13939e3ff7e1f43f6d9616ce24f3	keep	postflop.memory.cold.f32.allocated_vram_mb	4731.174912	Final combined fixed-step postflop and lifecycle comparison after fresh B035; numerical output and workload unchanged.	2026-09-07T06:48:34+00:00
G005	postflop_cuda	d3ff6d69969e13939e3ff7e1f43f6d9616ce24f3	keep	postflop.memory.cold.f32.host_live_mb	3917.586432	Final combined fixed-step postflop and lifecycle comparison after fresh B035; numerical output and workload unchanged.	2026-09-07T06:48:34+00:00
G005	postflop_cuda	d3ff6d69969e13939e3ff7e1f43f6d9616ce24f3	keep	postflop.memory.cold.f32.host_private_mb	9231.110144	Final combined fixed-step postflop and lifecycle comparison after fresh B035; numerical output and workload unchanged.	2026-09-07T06:48:34+00:00
G005	postflop_cuda	d3ff6d69969e13939e3ff7e1f43f6d9616ce24f3	keep	postflop.memory.cold.f32.init_ms	699.1374000000001	Final combined fixed-step postflop and lifecycle comparison after fresh B035; numerical output and workload unchanged.	2026-09-07T06:48:34+00:00
G005	postflop_cuda	d3ff6d69969e13939e3ff7e1f43f6d9616ce24f3	keep	postflop.memory.cold.f32.strategy_sync_ms	163.8291	Final combined fixed-step postflop and lifecycle comparison after fresh B035; numerical output and workload unchanged.	2026-09-07T06:48:34+00:00
G005	postflop_cuda	d3ff6d69969e13939e3ff7e1f43f6d9616ce24f3	keep	postflop.memory.cold.f32.sync_ms	338.9266	Final combined fixed-step postflop and lifecycle comparison after fresh B035; numerical output and workload unchanged.	2026-09-07T06:48:34+00:00
G005	postflop_cuda	d3ff6d69969e13939e3ff7e1f43f6d9616ce24f3	keep	postflop.memory.warm.f32.allocated_vram_mb	4731.174912	Final combined fixed-step postflop and lifecycle comparison after fresh B035; numerical output and workload unchanged.	2026-09-07T06:48:34+00:00
G005	postflop_cuda	d3ff6d69969e13939e3ff7e1f43f6d9616ce24f3	keep	postflop.memory.warm.f32.host_live_mb	3934.920704	Final combined fixed-step postflop and lifecycle comparison after fresh B035; numerical output and workload unchanged.	2026-09-07T06:48:34+00:00
G005	postflop_cuda	d3ff6d69969e13939e3ff7e1f43f6d9616ce24f3	keep	postflop.memory.warm.f32.host_private_mb	9246.425088	Final combined fixed-step postflop and lifecycle comparison after fresh B035; numerical output and workload unchanged.	2026-09-07T06:48:34+00:00
G005	postflop_cuda	d3ff6d69969e13939e3ff7e1f43f6d9616ce24f3	keep	postflop.memory.warm.f32.init_ms	753.777	Final combined fixed-step postflop and lifecycle comparison after fresh B035; numerical output and workload unchanged.	2026-09-07T06:48:34+00:00
G005	postflop_cuda	d3ff6d69969e13939e3ff7e1f43f6d9616ce24f3	keep	postflop.memory.warm.f32.strategy_sync_ms	158.70919999999998	Final combined fixed-step postflop and lifecycle comparison after fresh B035; numerical output and workload unchanged.	2026-09-07T06:48:34+00:00
G005	postflop_cuda	d3ff6d69969e13939e3ff7e1f43f6d9616ce24f3	keep	postflop.memory.warm.f32.sync_ms	324.2772	Final combined fixed-step postflop and lifecycle comparison after fresh B035; numerical output and workload unchanged.	2026-09-07T06:48:34+00:00
G005	postflop_cuda	d3ff6d69969e13939e3ff7e1f43f6d9616ce24f3	keep	postflop.memory.cold.compressed.allocated_vram_mb	3623.878656	Final combined fixed-step postflop and lifecycle comparison after fresh B035; numerical output and workload unchanged.	2026-09-07T06:48:34+00:00
G005	postflop_cuda	d3ff6d69969e13939e3ff7e1f43f6d9616ce24f3	keep	postflop.memory.cold.compressed.host_live_mb	2300.47744	Final combined fixed-step postflop and lifecycle comparison after fresh B035; numerical output and workload unchanged.	2026-09-07T06:48:34+00:00
G005	postflop_cuda	d3ff6d69969e13939e3ff7e1f43f6d9616ce24f3	keep	postflop.memory.cold.compressed.host_private_mb	6504.701952	Final combined fixed-step postflop and lifecycle comparison after fresh B035; numerical output and workload unchanged.	2026-09-07T06:48:34+00:00
G005	postflop_cuda	d3ff6d69969e13939e3ff7e1f43f6d9616ce24f3	keep	postflop.memory.cold.compressed.init_ms	624.8189	Final combined fixed-step postflop and lifecycle comparison after fresh B035; numerical output and workload unchanged.	2026-09-07T06:48:34+00:00
G005	postflop_cuda	d3ff6d69969e13939e3ff7e1f43f6d9616ce24f3	keep	postflop.memory.cold.compressed.strategy_sync_ms	128.3911	Final combined fixed-step postflop and lifecycle comparison after fresh B035; numerical output and workload unchanged.	2026-09-07T06:48:34+00:00
G005	postflop_cuda	d3ff6d69969e13939e3ff7e1f43f6d9616ce24f3	keep	postflop.memory.cold.compressed.sync_ms	269.2628	Final combined fixed-step postflop and lifecycle comparison after fresh B035; numerical output and workload unchanged.	2026-09-07T06:48:34+00:00
G005	postflop_cuda	d3ff6d69969e13939e3ff7e1f43f6d9616ce24f3	keep	postflop.memory.warm.compressed.allocated_vram_mb	3623.878656	Final combined fixed-step postflop and lifecycle comparison after fresh B035; numerical output and workload unchanged.	2026-09-07T06:48:34+00:00
G005	postflop_cuda	d3ff6d69969e13939e3ff7e1f43f6d9616ce24f3	keep	postflop.memory.warm.compressed.host_live_mb	3769.421824	Final combined fixed-step postflop and lifecycle comparison after fresh B035; numerical output and workload unchanged.	2026-09-07T06:48:34+00:00
G005	postflop_cuda	d3ff6d69969e13939e3ff7e1f43f6d9616ce24f3	keep	postflop.memory.warm.compressed.host_private_mb	8126.619648	Final combined fixed-step postflop and lifecycle comparison after fresh B035; numerical output and workload unchanged.	2026-09-07T06:48:34+00:00
G005	postflop_cuda	d3ff6d69969e13939e3ff7e1f43f6d9616ce24f3	keep	postflop.memory.warm.compressed.init_ms	1064.1628	Final combined fixed-step postflop and lifecycle comparison after fresh B035; numerical output and workload unchanged.	2026-09-07T06:48:34+00:00
G005	postflop_cuda	d3ff6d69969e13939e3ff7e1f43f6d9616ce24f3	keep	postflop.memory.warm.compressed.strategy_sync_ms	149.2541	Final combined fixed-step postflop and lifecycle comparison after fresh B035; numerical output and workload unchanged.	2026-09-07T06:48:34+00:00
G005	postflop_cuda	d3ff6d69969e13939e3ff7e1f43f6d9616ce24f3	keep	postflop.memory.warm.compressed.sync_ms	297.39910000000003	Final combined fixed-step postflop and lifecycle comparison after fresh B035; numerical output and workload unchanged.	2026-09-07T06:48:34+00:00
G005	postflop_cuda	d3ff6d69969e13939e3ff7e1f43f6d9616ce24f3	keep	postflop.Ks7h2d.init_ms	1256.484	Final combined fixed-step postflop and lifecycle comparison after fresh B035; numerical output and workload unchanged.	2026-09-07T06:48:34+00:00
G005	postflop_cuda	d3ff6d69969e13939e3ff7e1f43f6d9616ce24f3	keep	postflop.Ks7h2d.iteration_ms	51.796	Final combined fixed-step postflop and lifecycle comparison after fresh B035; numerical output and workload unchanged.	2026-09-07T06:48:34+00:00
G005	postflop_cuda	d3ff6d69969e13939e3ff7e1f43f6d9616ce24f3	keep	postflop.Ks7h2d.check_ms	34.672	Final combined fixed-step postflop and lifecycle comparison after fresh B035; numerical output and workload unchanged.	2026-09-07T06:48:34+00:00
G005	postflop_cuda	d3ff6d69969e13939e3ff7e1f43f6d9616ce24f3	keep	postflop.Ks7s2d.init_ms	844.755	Final combined fixed-step postflop and lifecycle comparison after fresh B035; numerical output and workload unchanged.	2026-09-07T06:48:34+00:00
G005	postflop_cuda	d3ff6d69969e13939e3ff7e1f43f6d9616ce24f3	keep	postflop.Ks7s2d.iteration_ms	31.358	Final combined fixed-step postflop and lifecycle comparison after fresh B035; numerical output and workload unchanged.	2026-09-07T06:48:34+00:00
G005	postflop_cuda	d3ff6d69969e13939e3ff7e1f43f6d9616ce24f3	keep	postflop.Ks7s2d.check_ms	28.203	Final combined fixed-step postflop and lifecycle comparison after fresh B035; numerical output and workload unchanged.	2026-09-07T06:48:34+00:00
G005	postflop_cuda	d3ff6d69969e13939e3ff7e1f43f6d9616ce24f3	keep	postflop.Ks7h2dQhTc.init_ms	78.225	Final combined fixed-step postflop and lifecycle comparison after fresh B035; numerical output and workload unchanged.	2026-09-07T06:48:34+00:00
G005	postflop_cuda	d3ff6d69969e13939e3ff7e1f43f6d9616ce24f3	keep	postflop.Ks7h2dQhTc.iteration_ms	0.284	Final combined fixed-step postflop and lifecycle comparison after fresh B035; numerical output and workload unchanged.	2026-09-07T06:48:34+00:00
G005	postflop_cuda	d3ff6d69969e13939e3ff7e1f43f6d9616ce24f3	keep	postflop.Ks7h2dQhTc.check_ms	0.569	Final combined fixed-step postflop and lifecycle comparison after fresh B035; numerical output and workload unchanged.	2026-09-07T06:48:34+00:00
