experiment	path	commit	status	metric	value	hypothesis	utc
E028	preflop_cuda	a6a2e0a2afb85e5e3577a81fe8e8930543ed2229	keep	preflop.6.sync_ms	31.729	Specialize 2/3/4-action preflop down and up sweeps with exact generic fallback to reduce local array traffic	2026-09-07T05:20:07+00:00
E028	preflop_cuda	a6a2e0a2afb85e5e3577a81fe8e8930543ed2229	keep	preflop.8.iteration_ms	58.432	Specialize 2/3/4-action preflop down and up sweeps with exact generic fallback to reduce local array traffic	2026-09-07T05:20:07+00:00
E028	preflop_cuda	a6a2e0a2afb85e5e3577a81fe8e8930543ed2229	keep	preflop.8.check_ms	39.507	Specialize 2/3/4-action preflop down and up sweeps with exact generic fallback to reduce local array traffic	2026-09-07T05:20:07+00:00
E028	preflop_cuda	a6a2e0a2afb85e5e3577a81fe8e8930543ed2229	keep	preflop.8.sync_ms	89.521	Specialize 2/3/4-action preflop down and up sweeps with exact generic fallback to reduce local array traffic	2026-09-07T05:20:07+00:00
E028R	preflop_cuda	a6a2e0a2afb85e5e3577a81fe8e8930543ed2229	keep	preflop.2.iteration_ms	0.081	Repeat action specialization with CUDA equivalence and private exact graph/cache tests	2026-09-07T05:21:33+00:00
E028R	preflop_cuda	a6a2e0a2afb85e5e3577a81fe8e8930543ed2229	keep	preflop.2.check_ms	0.272	Repeat action specialization with CUDA equivalence and private exact graph/cache tests	2026-09-07T05:21:33+00:00
E028R	preflop_cuda	a6a2e0a2afb85e5e3577a81fe8e8930543ed2229	keep	preflop.2.sync_ms	0.019	Repeat action specialization with CUDA equivalence and private exact graph/cache tests	2026-09-07T05:21:33+00:00
E028R	preflop_cuda	a6a2e0a2afb85e5e3577a81fe8e8930543ed2229	keep	preflop.6.iteration_ms	17.003	Repeat action specialization with CUDA equivalence and private exact graph/cache tests	2026-09-07T05:21:33+00:00
E028R	preflop_cuda	a6a2e0a2afb85e5e3577a81fe8e8930543ed2229	keep	preflop.6.check_ms	12.641	Repeat action specialization with CUDA equivalence and private exact graph/cache tests	2026-09-07T05:21:33+00:00
E028R	preflop_cuda	a6a2e0a2afb85e5e3577a81fe8e8930543ed2229	keep	preflop.6.sync_ms	28.516	Repeat action specialization with CUDA equivalence and private exact graph/cache tests	2026-09-07T05:21:33+00:00
E028R	preflop_cuda	a6a2e0a2afb85e5e3577a81fe8e8930543ed2229	keep	preflop.8.iteration_ms	57.514	Repeat action specialization with CUDA equivalence and private exact graph/cache tests	2026-09-07T05:21:33+00:00
E028R	preflop_cuda	a6a2e0a2afb85e5e3577a81fe8e8930543ed2229	keep	preflop.8.check_ms	38.685	Repeat action specialization with CUDA equivalence and private exact graph/cache tests	2026-09-07T05:21:33+00:00
E028R	preflop_cuda	a6a2e0a2afb85e5e3577a81fe8e8930543ed2229	keep	preflop.8.sync_ms	69.221	Repeat action specialization with CUDA equivalence and private exact graph/cache tests	2026-09-07T05:21:33+00:00
B031	baseline	a6a2e0a2afb85e5e3577a81fe8e8930543ed2229	baseline	preflop.2.first_check_ms	0.4545	Steady preflop check control including retained action specialization, before evaluation graphs	2026-09-07T05:23:07+00:00
B031	baseline	a6a2e0a2afb85e5e3577a81fe8e8930543ed2229	baseline	preflop.2.second_check_ms	0.40509999999999996	Steady preflop check control including retained action specialization, before evaluation graphs	2026-09-07T05:23:07+00:00
B031	baseline	a6a2e0a2afb85e5e3577a81fe8e8930543ed2229	baseline	preflop.2.steady_check_ms	0.423575	Steady preflop check control including retained action specialization, before evaluation graphs	2026-09-07T05:23:07+00:00
B031	baseline	a6a2e0a2afb85e5e3577a81fe8e8930543ed2229	baseline	preflop.6.first_check_ms	12.7186	Steady preflop check control including retained action specialization, before evaluation graphs	2026-09-07T05:23:07+00:00
B031	baseline	a6a2e0a2afb85e5e3577a81fe8e8930543ed2229	baseline	preflop.6.second_check_ms	13.538400000000001	Steady preflop check control including retained action specialization, before evaluation graphs	2026-09-07T05:23:07+00:00
B031	baseline	a6a2e0a2afb85e5e3577a81fe8e8930543ed2229	baseline	preflop.6.steady_check_ms	13.198649999999999	Steady preflop check control including retained action specialization, before evaluation graphs	2026-09-07T05:23:07+00:00
B031	baseline	a6a2e0a2afb85e5e3577a81fe8e8930543ed2229	baseline	preflop.8.first_check_ms	38.9525	Steady preflop check control including retained action specialization, before evaluation graphs	2026-09-07T05:23:07+00:00
B031	baseline	a6a2e0a2afb85e5e3577a81fe8e8930543ed2229	baseline	preflop.8.second_check_ms	38.1159	Steady preflop check control including retained action specialization, before evaluation graphs	2026-09-07T05:23:07+00:00
B031	baseline	a6a2e0a2afb85e5e3577a81fe8e8930543ed2229	baseline	preflop.8.steady_check_ms	39.509725	Steady preflop check control including retained action specialization, before evaluation graphs	2026-09-07T05:23:07+00:00
E029	preflop_cuda	1167a2f65f7d19e3376285639acd15423a9aacc8	keep	postflop.Ks7h2d.first_check_ms	35.1215	Capture repeated accuracy checks and batch root downloads while preserving exact f64 CPU accumulation	2026-09-07T05:25:04+00:00
E029	preflop_cuda	1167a2f65f7d19e3376285639acd15423a9aacc8	keep	postflop.Ks7h2d.second_check_ms	34.5157	Capture repeated accuracy checks and batch root downloads while preserving exact f64 CPU accumulation	2026-09-07T05:25:04+00:00
E029	preflop_cuda	1167a2f65f7d19e3376285639acd15423a9aacc8	keep	postflop.Ks7h2d.steady_check_ms	34.796124999999996	Capture repeated accuracy checks and batch root downloads while preserving exact f64 CPU accumulation	2026-09-07T05:25:04+00:00
E029	preflop_cuda	1167a2f65f7d19e3376285639acd15423a9aacc8	keep	postflop.Ks7s2d.first_check_ms	28.090400000000002	Capture repeated accuracy checks and batch root downloads while preserving exact f64 CPU accumulation	2026-09-07T05:25:04+00:00
E029	preflop_cuda	1167a2f65f7d19e3376285639acd15423a9aacc8	keep	postflop.Ks7s2d.second_check_ms	28.830399999999997	Capture repeated accuracy checks and batch root downloads while preserving exact f64 CPU accumulation	2026-09-07T05:25:04+00:00
E029	preflop_cuda	1167a2f65f7d19e3376285639acd15423a9aacc8	keep	postflop.Ks7s2d.steady_check_ms	28.285925	Capture repeated accuracy checks and batch root downloads while preserving exact f64 CPU accumulation	2026-09-07T05:25:04+00:00
E029	preflop_cuda	1167a2f65f7d19e3376285639acd15423a9aacc8	keep	postflop.Ks7h2dQhTc.first_check_ms	0.7917	Capture repeated accuracy checks and batch root downloads while preserving exact f64 CPU accumulation	2026-09-07T05:25:04+00:00
E029	preflop_cuda	1167a2f65f7d19e3376285639acd15423a9aacc8	keep	postflop.Ks7h2dQhTc.second_check_ms	0.799	Capture repeated accuracy checks and batch root downloads while preserving exact f64 CPU accumulation	2026-09-07T05:25:04+00:00
E029	preflop_cuda	1167a2f65f7d19e3376285639acd15423a9aacc8	keep	postflop.Ks7h2dQhTc.steady_check_ms	0.825325	Capture repeated accuracy checks and batch root downloads while preserving exact f64 CPU accumulation	2026-09-07T05:25:04+00:00
E029	preflop_cuda	1167a2f65f7d19e3376285639acd15423a9aacc8	keep	preflop.2.first_check_ms	0.38539999999999996	Capture repeated accuracy checks and batch root downloads while preserving exact f64 CPU accumulation	2026-09-07T05:25:04+00:00
E029	preflop_cuda	1167a2f65f7d19e3376285639acd15423a9aacc8	keep	preflop.2.second_check_ms	0.2517	Capture repeated accuracy checks and batch root downloads while preserving exact f64 CPU accumulation	2026-09-07T05:25:04+00:00
E029	preflop_cuda	1167a2f65f7d19e3376285639acd15423a9aacc8	keep	preflop.2.steady_check_ms	0.108375	Capture repeated accuracy checks and batch root downloads while preserving exact f64 CPU accumulation	2026-09-07T05:25:04+00:00
E029	preflop_cuda	1167a2f65f7d19e3376285639acd15423a9aacc8	keep	preflop.6.first_check_ms	13.0252	Capture repeated accuracy checks and batch root downloads while preserving exact f64 CPU accumulation	2026-09-07T05:25:04+00:00
E029	preflop_cuda	1167a2f65f7d19e3376285639acd15423a9aacc8	keep	preflop.6.second_check_ms	12.8556	Capture repeated accuracy checks and batch root downloads while preserving exact f64 CPU accumulation	2026-09-07T05:25:04+00:00
E029	preflop_cuda	1167a2f65f7d19e3376285639acd15423a9aacc8	keep	preflop.6.steady_check_ms	11.9527	Capture repeated accuracy checks and batch root downloads while preserving exact f64 CPU accumulation	2026-09-07T05:25:04+00:00
E029	preflop_cuda	1167a2f65f7d19e3376285639acd15423a9aacc8	keep	preflop.8.first_check_ms	38.3549	Capture repeated accuracy checks and batch root downloads while preserving exact f64 CPU accumulation	2026-09-07T05:25:04+00:00
E029	preflop_cuda	1167a2f65f7d19e3376285639acd15423a9aacc8	keep	preflop.8.second_check_ms	38.5443	Capture repeated accuracy checks and batch root downloads while preserving exact f64 CPU accumulation	2026-09-07T05:25:04+00:00
E029	preflop_cuda	1167a2f65f7d19e3376285639acd15423a9aacc8	keep	preflop.8.steady_check_ms	37.2197	Capture repeated accuracy checks and batch root downloads while preserving exact f64 CPU accumulation	2026-09-07T05:25:04+00:00
E029	preflop_cuda	1167a2f65f7d19e3376285639acd15423a9aacc8	keep	preflop.2.iteration_ms	0.077	Capture repeated accuracy checks and batch root downloads while preserving exact f64 CPU accumulation	2026-09-07T05:25:04+00:00
E029	preflop_cuda	1167a2f65f7d19e3376285639acd15423a9aacc8	keep	preflop.2.check_ms	0.252	Capture repeated accuracy checks and batch root downloads while preserving exact f64 CPU accumulation	2026-09-07T05:25:04+00:00
E029	preflop_cuda	1167a2f65f7d19e3376285639acd15423a9aacc8	keep	preflop.2.sync_ms	0.017	Capture repeated accuracy checks and batch root downloads while preserving exact f64 CPU accumulation	2026-09-07T05:25:04+00:00
E029	preflop_cuda	1167a2f65f7d19e3376285639acd15423a9aacc8	keep	preflop.6.iteration_ms	17.004	Capture repeated accuracy checks and batch root downloads while preserving exact f64 CPU accumulation	2026-09-07T05:25:04+00:00
E029	preflop_cuda	1167a2f65f7d19e3376285639acd15423a9aacc8	keep	preflop.6.check_ms	12.288	Capture repeated accuracy checks and batch root downloads while preserving exact f64 CPU accumulation	2026-09-07T05:25:04+00:00
E029	preflop_cuda	1167a2f65f7d19e3376285639acd15423a9aacc8	keep	preflop.6.sync_ms	28.151	Capture repeated accuracy checks and batch root downloads while preserving exact f64 CPU accumulation	2026-09-07T05:25:04+00:00
E029	preflop_cuda	1167a2f65f7d19e3376285639acd15423a9aacc8	keep	preflop.8.iteration_ms	57.774	Capture repeated accuracy checks and batch root downloads while preserving exact f64 CPU accumulation	2026-09-07T05:25:04+00:00
E029	preflop_cuda	1167a2f65f7d19e3376285639acd15423a9aacc8	keep	preflop.8.check_ms	38.453	Capture repeated accuracy checks and batch root downloads while preserving exact f64 CPU accumulation	2026-09-07T05:25:04+00:00
E029	preflop_cuda	1167a2f65f7d19e3376285639acd15423a9aacc8	keep	preflop.8.sync_ms	71.424	Capture repeated accuracy checks and batch root downloads while preserving exact f64 CPU accumulation	2026-09-07T05:25:04+00:00
E029R	preflop_cuda	1167a2f65f7d19e3376285639acd15423a9aacc8	keep	postflop.Ks7h2d.first_check_ms	34.778499999999994	Repeat captured preflop checks and verify fixed target stopping, CUDA equivalence, and tight cache fallback	2026-09-07T05:26:36+00:00
E029R	preflop_cuda	1167a2f65f7d19e3376285639acd15423a9aacc8	keep	postflop.Ks7h2d.second_check_ms	34.3488	Repeat captured preflop checks and verify fixed target stopping, CUDA equivalence, and tight cache fallback	2026-09-07T05:26:36+00:00
E029R	preflop_cuda	1167a2f65f7d19e3376285639acd15423a9aacc8	keep	postflop.Ks7h2d.steady_check_ms	34.68305	Repeat captured preflop checks and verify fixed target stopping, CUDA equivalence, and tight cache fallback	2026-09-07T05:26:36+00:00
E029R	preflop_cuda	1167a2f65f7d19e3376285639acd15423a9aacc8	keep	postflop.Ks7s2d.first_check_ms	27.7804	Repeat captured preflop checks and verify fixed target stopping, CUDA equivalence, and tight cache fallback	2026-09-07T05:26:36+00:00
E029R	preflop_cuda	1167a2f65f7d19e3376285639acd15423a9aacc8	keep	postflop.Ks7s2d.second_check_ms	28.573	Repeat captured preflop checks and verify fixed target stopping, CUDA equivalence, and tight cache fallback	2026-09-07T05:26:36+00:00
E029R	preflop_cuda	1167a2f65f7d19e3376285639acd15423a9aacc8	keep	postflop.Ks7s2d.steady_check_ms	28.187875000000002	Repeat captured preflop checks and verify fixed target stopping, CUDA equivalence, and tight cache fallback	2026-09-07T05:26:36+00:00
E029R	preflop_cuda	1167a2f65f7d19e3376285639acd15423a9aacc8	keep	postflop.Ks7h2dQhTc.first_check_ms	0.5848	Repeat captured preflop checks and verify fixed target stopping, CUDA equivalence, and tight cache fallback	2026-09-07T05:26:36+00:00
E029R	preflop_cuda	1167a2f65f7d19e3376285639acd15423a9aacc8	keep	postflop.Ks7h2dQhTc.second_check_ms	0.5534	Repeat captured preflop checks and verify fixed target stopping, CUDA equivalence, and tight cache fallback	2026-09-07T05:26:36+00:00
E029R	preflop_cuda	1167a2f65f7d19e3376285639acd15423a9aacc8	keep	postflop.Ks7h2dQhTc.steady_check_ms	0.581625	Repeat captured preflop checks and verify fixed target stopping, CUDA equivalence, and tight cache fallback	2026-09-07T05:26:36+00:00
E029R	preflop_cuda	1167a2f65f7d19e3376285639acd15423a9aacc8	keep	preflop.2.first_check_ms	0.2387	Repeat captured preflop checks and verify fixed target stopping, CUDA equivalence, and tight cache fallback	2026-09-07T05:26:36+00:00
E029R	preflop_cuda	1167a2f65f7d19e3376285639acd15423a9aacc8	keep	preflop.2.second_check_ms	0.2216	Repeat captured preflop checks and verify fixed target stopping, CUDA equivalence, and tight cache fallback	2026-09-07T05:26:36+00:00
E029R	preflop_cuda	1167a2f65f7d19e3376285639acd15423a9aacc8	keep	preflop.2.steady_check_ms	0.099375	Repeat captured preflop checks and verify fixed target stopping, CUDA equivalence, and tight cache fallback	2026-09-07T05:26:36+00:00
E029R	preflop_cuda	1167a2f65f7d19e3376285639acd15423a9aacc8	keep	preflop.6.first_check_ms	12.7441	Repeat captured preflop checks and verify fixed target stopping, CUDA equivalence, and tight cache fallback	2026-09-07T05:26:36+00:00
E029R	preflop_cuda	1167a2f65f7d19e3376285639acd15423a9aacc8	keep	preflop.6.second_check_ms	12.8703	Repeat captured preflop checks and verify fixed target stopping, CUDA equivalence, and tight cache fallback	2026-09-07T05:26:36+00:00
E029R	preflop_cuda	1167a2f65f7d19e3376285639acd15423a9aacc8	keep	preflop.6.steady_check_ms	11.891375	Repeat captured preflop checks and verify fixed target stopping, CUDA equivalence, and tight cache fallback	2026-09-07T05:26:36+00:00
E029R	preflop_cuda	1167a2f65f7d19e3376285639acd15423a9aacc8	keep	preflop.8.first_check_ms	38.6179	Repeat captured preflop checks and verify fixed target stopping, CUDA equivalence, and tight cache fallback	2026-09-07T05:26:36+00:00
E029R	preflop_cuda	1167a2f65f7d19e3376285639acd15423a9aacc8	keep	preflop.8.second_check_ms	38.5531	Repeat captured preflop checks and verify fixed target stopping, CUDA equivalence, and tight cache fallback	2026-09-07T05:26:36+00:00
E029R	preflop_cuda	1167a2f65f7d19e3376285639acd15423a9aacc8	keep	preflop.8.steady_check_ms	37.242075	Repeat captured preflop checks and verify fixed target stopping, CUDA equivalence, and tight cache fallback	2026-09-07T05:26:36+00:00
E029R	preflop_cuda	1167a2f65f7d19e3376285639acd15423a9aacc8	keep	preflop.6.target_seconds	3.0237311	Repeat captured preflop checks and verify fixed target stopping, CUDA equivalence, and tight cache fallback	2026-09-07T05:26:36+00:00
E029R	preflop_cuda	1167a2f65f7d19e3376285639acd15423a9aacc8	keep	preflop.8.target_seconds	7.3570144	Repeat captured preflop checks and verify fixed target stopping, CUDA equivalence, and tight cache fallback	2026-09-07T05:26:36+00:00
E030	postflop_cuda	8fffe84a34ecd081e4fcde9b54ac5220e00fb1ad	discard	postflop.Ks7h2d.first_check_ms	34.933	Capture repeated postflop accuracy evaluations with batched root downloads, rebuilding on lock updates	2026-09-07T05:29:31+00:00
E030	postflop_cuda	8fffe84a34ecd081e4fcde9b54ac5220e00fb1ad	discard	postflop.Ks7h2d.second_check_ms	34.8293	Capture repeated postflop accuracy evaluations with batched root downloads, rebuilding on lock updates	2026-09-07T05:29:31+00:00
E030	postflop_cuda	8fffe84a34ecd081e4fcde9b54ac5220e00fb1ad	discard	postflop.Ks7h2d.steady_check_ms	34.8846	Capture repeated postflop accuracy evaluations with batched root downloads, rebuilding on lock updates	2026-09-07T05:29:31+00:00
E030	postflop_cuda	8fffe84a34ecd081e4fcde9b54ac5220e00fb1ad	discard	postflop.Ks7s2d.first_check_ms	27.9639	Capture repeated postflop accuracy evaluations with batched root downloads, rebuilding on lock updates	2026-09-07T05:29:31+00:00
E030	postflop_cuda	8fffe84a34ecd081e4fcde9b54ac5220e00fb1ad	discard	postflop.Ks7s2d.second_check_ms	28.9771	Capture repeated postflop accuracy evaluations with batched root downloads, rebuilding on lock updates	2026-09-07T05:29:31+00:00
E030	postflop_cuda	8fffe84a34ecd081e4fcde9b54ac5220e00fb1ad	discard	postflop.Ks7s2d.steady_check_ms	28.010625	Capture repeated postflop accuracy evaluations with batched root downloads, rebuilding on lock updates	2026-09-07T05:29:31+00:00
E030	postflop_cuda	8fffe84a34ecd081e4fcde9b54ac5220e00fb1ad	discard	postflop.Ks7h2dQhTc.first_check_ms	1.1219	Capture repeated postflop accuracy evaluations with batched root downloads, rebuilding on lock updates	2026-09-07T05:29:31+00:00
E030	postflop_cuda	8fffe84a34ecd081e4fcde9b54ac5220e00fb1ad	discard	postflop.Ks7h2dQhTc.second_check_ms	0.5849	Capture repeated postflop accuracy evaluations with batched root downloads, rebuilding on lock updates	2026-09-07T05:29:31+00:00
E030	postflop_cuda	8fffe84a34ecd081e4fcde9b54ac5220e00fb1ad	discard	postflop.Ks7h2dQhTc.steady_check_ms	0.31405	Capture repeated postflop accuracy evaluations with batched root downloads, rebuilding on lock updates	2026-09-07T05:29:31+00:00
E030	postflop_cuda	8fffe84a34ecd081e4fcde9b54ac5220e00fb1ad	discard	preflop.2.first_check_ms	0.38939999999999997	Capture repeated postflop accuracy evaluations with batched root downloads, rebuilding on lock updates	2026-09-07T05:29:31+00:00
E030	postflop_cuda	8fffe84a34ecd081e4fcde9b54ac5220e00fb1ad	discard	preflop.2.second_check_ms	0.7969999999999999	Capture repeated postflop accuracy evaluations with batched root downloads, rebuilding on lock updates	2026-09-07T05:29:31+00:00
E030	postflop_cuda	8fffe84a34ecd081e4fcde9b54ac5220e00fb1ad	discard	preflop.2.steady_check_ms	0.10535	Capture repeated postflop accuracy evaluations with batched root downloads, rebuilding on lock updates	2026-09-07T05:29:31+00:00
E030	postflop_cuda	8fffe84a34ecd081e4fcde9b54ac5220e00fb1ad	discard	preflop.6.first_check_ms	13.8908	Capture repeated postflop accuracy evaluations with batched root downloads, rebuilding on lock updates	2026-09-07T05:29:31+00:00
E030	postflop_cuda	8fffe84a34ecd081e4fcde9b54ac5220e00fb1ad	discard	preflop.6.second_check_ms	13.8766	Capture repeated postflop accuracy evaluations with batched root downloads, rebuilding on lock updates	2026-09-07T05:29:31+00:00
E030	postflop_cuda	8fffe84a34ecd081e4fcde9b54ac5220e00fb1ad	discard	preflop.6.steady_check_ms	12.2502	Capture repeated postflop accuracy evaluations with batched root downloads, rebuilding on lock updates	2026-09-07T05:29:31+00:00
E030	postflop_cuda	8fffe84a34ecd081e4fcde9b54ac5220e00fb1ad	discard	preflop.8.first_check_ms	37.9373	Capture repeated postflop accuracy evaluations with batched root downloads, rebuilding on lock updates	2026-09-07T05:29:31+00:00
E030	postflop_cuda	8fffe84a34ecd081e4fcde9b54ac5220e00fb1ad	discard	preflop.8.second_check_ms	39.5473	Capture repeated postflop accuracy evaluations with batched root downloads, rebuilding on lock updates	2026-09-07T05:29:31+00:00
E030	postflop_cuda	8fffe84a34ecd081e4fcde9b54ac5220e00fb1ad	discard	preflop.8.steady_check_ms	37.367999999999995	Capture repeated postflop accuracy evaluations with batched root downloads, rebuilding on lock updates	2026-09-07T05:29:31+00:00
E030R	postflop_cuda	8fffe84a34ecd081e4fcde9b54ac5220e00fb1ad	discard	postflop.Ks7h2d.first_check_ms	31.7577	Repeat postflop evaluation graphs including first-call cost, fixed target stopping, and all action-menu states	2026-09-07T05:31:13+00:00
E030R	postflop_cuda	8fffe84a34ecd081e4fcde9b54ac5220e00fb1ad	discard	postflop.Ks7h2d.second_check_ms	32.1483	Repeat postflop evaluation graphs including first-call cost, fixed target stopping, and all action-menu states	2026-09-07T05:31:13+00:00
E030R	postflop_cuda	8fffe84a34ecd081e4fcde9b54ac5220e00fb1ad	discard	postflop.Ks7h2d.steady_check_ms	31.992624999999997	Repeat postflop evaluation graphs including first-call cost, fixed target stopping, and all action-menu states	2026-09-07T05:31:13+00:00
E030R	postflop_cuda	8fffe84a34ecd081e4fcde9b54ac5220e00fb1ad	discard	postflop.Ks7s2d.first_check_ms	25.8739	Repeat postflop evaluation graphs including first-call cost, fixed target stopping, and all action-menu states	2026-09-07T05:31:13+00:00
E030R	postflop_cuda	8fffe84a34ecd081e4fcde9b54ac5220e00fb1ad	discard	postflop.Ks7s2d.second_check_ms	26.2297	Repeat postflop evaluation graphs including first-call cost, fixed target stopping, and all action-menu states	2026-09-07T05:31:13+00:00
E030R	postflop_cuda	8fffe84a34ecd081e4fcde9b54ac5220e00fb1ad	discard	postflop.Ks7s2d.steady_check_ms	25.7055	Repeat postflop evaluation graphs including first-call cost, fixed target stopping, and all action-menu states	2026-09-07T05:31:13+00:00
E030R	postflop_cuda	8fffe84a34ecd081e4fcde9b54ac5220e00fb1ad	discard	postflop.Ks7h2dQhTc.first_check_ms	1.109	Repeat postflop evaluation graphs including first-call cost, fixed target stopping, and all action-menu states	2026-09-07T05:31:13+00:00
