experiment	path	commit	status	metric	value	hypothesis	utc
E033B	preflop_cuda	c6cf909eaa1c99786b186915ebc007a880f07437	discard	preflop.2.check_ms	0.277	Compare direct compile-time seat specialization against shared generic terminal uniforms for all supported seats	2026-09-07T05:53:52+00:00
E033B	preflop_cuda	c6cf909eaa1c99786b186915ebc007a880f07437	discard	preflop.2.sync_ms	0.129	Compare direct compile-time seat specialization against shared generic terminal uniforms for all supported seats	2026-09-07T05:53:52+00:00
E033B	preflop_cuda	c6cf909eaa1c99786b186915ebc007a880f07437	discard	preflop.6.iteration_ms	16.557	Compare direct compile-time seat specialization against shared generic terminal uniforms for all supported seats	2026-09-07T05:53:52+00:00
E033B	preflop_cuda	c6cf909eaa1c99786b186915ebc007a880f07437	discard	preflop.6.check_ms	11.83	Compare direct compile-time seat specialization against shared generic terminal uniforms for all supported seats	2026-09-07T05:53:52+00:00
E033B	preflop_cuda	c6cf909eaa1c99786b186915ebc007a880f07437	discard	preflop.6.sync_ms	27.783	Compare direct compile-time seat specialization against shared generic terminal uniforms for all supported seats	2026-09-07T05:53:52+00:00
E033B	preflop_cuda	c6cf909eaa1c99786b186915ebc007a880f07437	discard	preflop.8.iteration_ms	58.119	Compare direct compile-time seat specialization against shared generic terminal uniforms for all supported seats	2026-09-07T05:53:52+00:00
E033B	preflop_cuda	c6cf909eaa1c99786b186915ebc007a880f07437	discard	preflop.8.check_ms	39.421	Compare direct compile-time seat specialization against shared generic terminal uniforms for all supported seats	2026-09-07T05:53:52+00:00
E033B	preflop_cuda	c6cf909eaa1c99786b186915ebc007a880f07437	discard	preflop.8.sync_ms	66.568	Compare direct compile-time seat specialization against shared generic terminal uniforms for all supported seats	2026-09-07T05:53:52+00:00
E033R	preflop_cuda	cf62471145c5bb9afbbf9be0f78ea3cf2bdbad3e	keep	preflop.3.iteration_ms	0.209	Repeat generic-only terminal broadcasts with full varied-seat states and GPU equivalence	2026-09-07T05:56:24+00:00
E033R	preflop_cuda	cf62471145c5bb9afbbf9be0f78ea3cf2bdbad3e	keep	preflop.3.check_ms	0.599	Repeat generic-only terminal broadcasts with full varied-seat states and GPU equivalence	2026-09-07T05:56:24+00:00
E033R	preflop_cuda	cf62471145c5bb9afbbf9be0f78ea3cf2bdbad3e	keep	preflop.3.sync_ms	0.083	Repeat generic-only terminal broadcasts with full varied-seat states and GPU equivalence	2026-09-07T05:56:24+00:00
E033R	preflop_cuda	cf62471145c5bb9afbbf9be0f78ea3cf2bdbad3e	keep	preflop.5.iteration_ms	2.791	Repeat generic-only terminal broadcasts with full varied-seat states and GPU equivalence	2026-09-07T05:56:24+00:00
E033R	preflop_cuda	cf62471145c5bb9afbbf9be0f78ea3cf2bdbad3e	keep	preflop.5.check_ms	2.614	Repeat generic-only terminal broadcasts with full varied-seat states and GPU equivalence	2026-09-07T05:56:24+00:00
E033R	preflop_cuda	cf62471145c5bb9afbbf9be0f78ea3cf2bdbad3e	keep	preflop.5.sync_ms	4.163	Repeat generic-only terminal broadcasts with full varied-seat states and GPU equivalence	2026-09-07T05:56:24+00:00
E033R	preflop_cuda	cf62471145c5bb9afbbf9be0f78ea3cf2bdbad3e	keep	preflop.7.iteration_ms	12.33	Repeat generic-only terminal broadcasts with full varied-seat states and GPU equivalence	2026-09-07T05:56:24+00:00
E033R	preflop_cuda	cf62471145c5bb9afbbf9be0f78ea3cf2bdbad3e	keep	preflop.7.check_ms	8.745	Repeat generic-only terminal broadcasts with full varied-seat states and GPU equivalence	2026-09-07T05:56:24+00:00
E033R	preflop_cuda	cf62471145c5bb9afbbf9be0f78ea3cf2bdbad3e	keep	preflop.7.sync_ms	16.577	Repeat generic-only terminal broadcasts with full varied-seat states and GPU equivalence	2026-09-07T05:56:24+00:00
E033R	preflop_cuda	cf62471145c5bb9afbbf9be0f78ea3cf2bdbad3e	keep	preflop.9.iteration_ms	252.738	Repeat generic-only terminal broadcasts with full varied-seat states and GPU equivalence	2026-09-07T05:56:24+00:00
E033R	preflop_cuda	cf62471145c5bb9afbbf9be0f78ea3cf2bdbad3e	keep	preflop.9.check_ms	162.047	Repeat generic-only terminal broadcasts with full varied-seat states and GPU equivalence	2026-09-07T05:56:24+00:00
E033R	preflop_cuda	cf62471145c5bb9afbbf9be0f78ea3cf2bdbad3e	keep	preflop.9.sync_ms	305.603	Repeat generic-only terminal broadcasts with full varied-seat states and GPU equivalence	2026-09-07T05:56:24+00:00
E033R	preflop_cuda	cf62471145c5bb9afbbf9be0f78ea3cf2bdbad3e	keep	preflop.2.iteration_ms	0.081	Repeat generic-only terminal broadcasts with full varied-seat states and GPU equivalence	2026-09-07T05:56:24+00:00
E033R	preflop_cuda	cf62471145c5bb9afbbf9be0f78ea3cf2bdbad3e	keep	preflop.2.check_ms	0.275	Repeat generic-only terminal broadcasts with full varied-seat states and GPU equivalence	2026-09-07T05:56:24+00:00
E033R	preflop_cuda	cf62471145c5bb9afbbf9be0f78ea3cf2bdbad3e	keep	preflop.2.sync_ms	0.019	Repeat generic-only terminal broadcasts with full varied-seat states and GPU equivalence	2026-09-07T05:56:24+00:00
E033R	preflop_cuda	cf62471145c5bb9afbbf9be0f78ea3cf2bdbad3e	keep	preflop.6.iteration_ms	16.677	Repeat generic-only terminal broadcasts with full varied-seat states and GPU equivalence	2026-09-07T05:56:24+00:00
E033R	preflop_cuda	cf62471145c5bb9afbbf9be0f78ea3cf2bdbad3e	keep	preflop.6.check_ms	12.277	Repeat generic-only terminal broadcasts with full varied-seat states and GPU equivalence	2026-09-07T05:56:24+00:00
E033R	preflop_cuda	cf62471145c5bb9afbbf9be0f78ea3cf2bdbad3e	keep	preflop.6.sync_ms	28.441	Repeat generic-only terminal broadcasts with full varied-seat states and GPU equivalence	2026-09-07T05:56:24+00:00
E033R	preflop_cuda	cf62471145c5bb9afbbf9be0f78ea3cf2bdbad3e	keep	preflop.8.iteration_ms	58.058	Repeat generic-only terminal broadcasts with full varied-seat states and GPU equivalence	2026-09-07T05:56:24+00:00
E033R	preflop_cuda	cf62471145c5bb9afbbf9be0f78ea3cf2bdbad3e	keep	preflop.8.check_ms	38.759	Repeat generic-only terminal broadcasts with full varied-seat states and GPU equivalence	2026-09-07T05:56:24+00:00
E033R	preflop_cuda	cf62471145c5bb9afbbf9be0f78ea3cf2bdbad3e	keep	preflop.8.sync_ms	69.964	Repeat generic-only terminal broadcasts with full varied-seat states and GPU equivalence	2026-09-07T05:56:24+00:00
E034	postflop_cuda	8e00a2ec1b354fa3d7dcc1971a18de12b624f212	discard	postflop.Ks7h2d.init_ms	1872.394	Use sorted lower/tied/higher card-removal runs to reduce per-entry rank branches without extra memory or changed sums	2026-09-07T05:59:19+00:00
E034	postflop_cuda	8e00a2ec1b354fa3d7dcc1971a18de12b624f212	discard	postflop.Ks7h2d.iteration_ms	57.098	Use sorted lower/tied/higher card-removal runs to reduce per-entry rank branches without extra memory or changed sums	2026-09-07T05:59:19+00:00
E034	postflop_cuda	8e00a2ec1b354fa3d7dcc1971a18de12b624f212	discard	postflop.Ks7h2d.check_ms	40.14	Use sorted lower/tied/higher card-removal runs to reduce per-entry rank branches without extra memory or changed sums	2026-09-07T05:59:19+00:00
E034	postflop_cuda	8e00a2ec1b354fa3d7dcc1971a18de12b624f212	discard	postflop.Ks7s2d.init_ms	711.152	Use sorted lower/tied/higher card-removal runs to reduce per-entry rank branches without extra memory or changed sums	2026-09-07T05:59:19+00:00
E034	postflop_cuda	8e00a2ec1b354fa3d7dcc1971a18de12b624f212	discard	postflop.Ks7s2d.iteration_ms	37.243	Use sorted lower/tied/higher card-removal runs to reduce per-entry rank branches without extra memory or changed sums	2026-09-07T05:59:19+00:00
E034	postflop_cuda	8e00a2ec1b354fa3d7dcc1971a18de12b624f212	discard	postflop.Ks7s2d.check_ms	34.465	Use sorted lower/tied/higher card-removal runs to reduce per-entry rank branches without extra memory or changed sums	2026-09-07T05:59:19+00:00
E034	postflop_cuda	8e00a2ec1b354fa3d7dcc1971a18de12b624f212	discard	postflop.Ks7h2dQhTc.init_ms	103.844	Use sorted lower/tied/higher card-removal runs to reduce per-entry rank branches without extra memory or changed sums	2026-09-07T05:59:19+00:00
E034	postflop_cuda	8e00a2ec1b354fa3d7dcc1971a18de12b624f212	discard	postflop.Ks7h2dQhTc.iteration_ms	0.394	Use sorted lower/tied/higher card-removal runs to reduce per-entry rank branches without extra memory or changed sums	2026-09-07T05:59:19+00:00
E034	postflop_cuda	8e00a2ec1b354fa3d7dcc1971a18de12b624f212	discard	postflop.Ks7h2dQhTc.check_ms	3.423	Use sorted lower/tied/higher card-removal runs to reduce per-entry rank branches without extra memory or changed sums	2026-09-07T05:59:19+00:00
E035	preflop_cuda	db5b25e164576dfb237f0b8a78ab07f41f8682ba	keep	preflop.2.iteration_ms	0.086	Map the original256-lane reach sum onto128threads with identical pair-addition order, including signed zeros and subnormals	2026-09-07T06:02:19+00:00
E035	preflop_cuda	db5b25e164576dfb237f0b8a78ab07f41f8682ba	keep	preflop.2.check_ms	0.323	Map the original256-lane reach sum onto128threads with identical pair-addition order, including signed zeros and subnormals	2026-09-07T06:02:19+00:00
E035	preflop_cuda	db5b25e164576dfb237f0b8a78ab07f41f8682ba	keep	preflop.2.sync_ms	0.027	Map the original256-lane reach sum onto128threads with identical pair-addition order, including signed zeros and subnormals	2026-09-07T06:02:19+00:00
E035	preflop_cuda	db5b25e164576dfb237f0b8a78ab07f41f8682ba	keep	preflop.6.iteration_ms	15.157	Map the original256-lane reach sum onto128threads with identical pair-addition order, including signed zeros and subnormals	2026-09-07T06:02:19+00:00
E035	preflop_cuda	db5b25e164576dfb237f0b8a78ab07f41f8682ba	keep	preflop.6.check_ms	12.937	Map the original256-lane reach sum onto128threads with identical pair-addition order, including signed zeros and subnormals	2026-09-07T06:02:19+00:00
E035	preflop_cuda	db5b25e164576dfb237f0b8a78ab07f41f8682ba	keep	preflop.6.sync_ms	28.471	Map the original256-lane reach sum onto128threads with identical pair-addition order, including signed zeros and subnormals	2026-09-07T06:02:19+00:00
E035	preflop_cuda	db5b25e164576dfb237f0b8a78ab07f41f8682ba	keep	preflop.8.iteration_ms	53.486	Map the original256-lane reach sum onto128threads with identical pair-addition order, including signed zeros and subnormals	2026-09-07T06:02:19+00:00
E035	preflop_cuda	db5b25e164576dfb237f0b8a78ab07f41f8682ba	keep	preflop.8.check_ms	39.423	Map the original256-lane reach sum onto128threads with identical pair-addition order, including signed zeros and subnormals	2026-09-07T06:02:19+00:00
E035	preflop_cuda	db5b25e164576dfb237f0b8a78ab07f41f8682ba	keep	preflop.8.sync_ms	69.104	Map the original256-lane reach sum onto128threads with identical pair-addition order, including signed zeros and subnormals	2026-09-07T06:02:19+00:00
E035R	preflop_cuda	db5b25e164576dfb237f0b8a78ab07f41f8682ba	keep	preflop.3.iteration_ms	0.237	Repeat exact128-thread reach reduction across all large seat counts and fixed convergence targets	2026-09-07T06:03:39+00:00
E035R	preflop_cuda	db5b25e164576dfb237f0b8a78ab07f41f8682ba	keep	preflop.3.check_ms	0.622	Repeat exact128-thread reach reduction across all large seat counts and fixed convergence targets	2026-09-07T06:03:39+00:00
E035R	preflop_cuda	db5b25e164576dfb237f0b8a78ab07f41f8682ba	keep	preflop.3.sync_ms	0.124	Repeat exact128-thread reach reduction across all large seat counts and fixed convergence targets	2026-09-07T06:03:39+00:00
E035R	preflop_cuda	db5b25e164576dfb237f0b8a78ab07f41f8682ba	keep	preflop.5.iteration_ms	2.478	Repeat exact128-thread reach reduction across all large seat counts and fixed convergence targets	2026-09-07T06:03:39+00:00
E035R	preflop_cuda	db5b25e164576dfb237f0b8a78ab07f41f8682ba	keep	preflop.5.check_ms	2.728	Repeat exact128-thread reach reduction across all large seat counts and fixed convergence targets	2026-09-07T06:03:39+00:00
E035R	preflop_cuda	db5b25e164576dfb237f0b8a78ab07f41f8682ba	keep	preflop.5.sync_ms	4.819	Repeat exact128-thread reach reduction across all large seat counts and fixed convergence targets	2026-09-07T06:03:39+00:00
E035R	preflop_cuda	db5b25e164576dfb237f0b8a78ab07f41f8682ba	keep	preflop.7.iteration_ms	11.298	Repeat exact128-thread reach reduction across all large seat counts and fixed convergence targets	2026-09-07T06:03:39+00:00
E035R	preflop_cuda	db5b25e164576dfb237f0b8a78ab07f41f8682ba	keep	preflop.7.check_ms	9.033	Repeat exact128-thread reach reduction across all large seat counts and fixed convergence targets	2026-09-07T06:03:39+00:00
E035R	preflop_cuda	db5b25e164576dfb237f0b8a78ab07f41f8682ba	keep	preflop.7.sync_ms	17.643	Repeat exact128-thread reach reduction across all large seat counts and fixed convergence targets	2026-09-07T06:03:39+00:00
E035R	preflop_cuda	db5b25e164576dfb237f0b8a78ab07f41f8682ba	keep	preflop.9.iteration_ms	227.091	Repeat exact128-thread reach reduction across all large seat counts and fixed convergence targets	2026-09-07T06:03:39+00:00
E035R	preflop_cuda	db5b25e164576dfb237f0b8a78ab07f41f8682ba	keep	preflop.9.check_ms	161.381	Repeat exact128-thread reach reduction across all large seat counts and fixed convergence targets	2026-09-07T06:03:39+00:00
E035R	preflop_cuda	db5b25e164576dfb237f0b8a78ab07f41f8682ba	keep	preflop.9.sync_ms	293.034	Repeat exact128-thread reach reduction across all large seat counts and fixed convergence targets	2026-09-07T06:03:39+00:00
E035R	preflop_cuda	db5b25e164576dfb237f0b8a78ab07f41f8682ba	keep	preflop.2.iteration_ms	0.084	Repeat exact128-thread reach reduction across all large seat counts and fixed convergence targets	2026-09-07T06:03:39+00:00
E035R	preflop_cuda	db5b25e164576dfb237f0b8a78ab07f41f8682ba	keep	preflop.2.check_ms	0.299	Repeat exact128-thread reach reduction across all large seat counts and fixed convergence targets	2026-09-07T06:03:39+00:00
E035R	preflop_cuda	db5b25e164576dfb237f0b8a78ab07f41f8682ba	keep	preflop.2.sync_ms	0.019	Repeat exact128-thread reach reduction across all large seat counts and fixed convergence targets	2026-09-07T06:03:39+00:00
E035R	preflop_cuda	db5b25e164576dfb237f0b8a78ab07f41f8682ba	keep	preflop.6.iteration_ms	15.105	Repeat exact128-thread reach reduction across all large seat counts and fixed convergence targets	2026-09-07T06:03:39+00:00
E035R	preflop_cuda	db5b25e164576dfb237f0b8a78ab07f41f8682ba	keep	preflop.6.check_ms	12.653	Repeat exact128-thread reach reduction across all large seat counts and fixed convergence targets	2026-09-07T06:03:39+00:00
E035R	preflop_cuda	db5b25e164576dfb237f0b8a78ab07f41f8682ba	keep	preflop.6.sync_ms	27.846	Repeat exact128-thread reach reduction across all large seat counts and fixed convergence targets	2026-09-07T06:03:39+00:00
E035R	preflop_cuda	db5b25e164576dfb237f0b8a78ab07f41f8682ba	keep	preflop.8.iteration_ms	52.933	Repeat exact128-thread reach reduction across all large seat counts and fixed convergence targets	2026-09-07T06:03:39+00:00
E035R	preflop_cuda	db5b25e164576dfb237f0b8a78ab07f41f8682ba	keep	preflop.8.check_ms	39.323	Repeat exact128-thread reach reduction across all large seat counts and fixed convergence targets	2026-09-07T06:03:39+00:00
E035R	preflop_cuda	db5b25e164576dfb237f0b8a78ab07f41f8682ba	keep	preflop.8.sync_ms	66.533	Repeat exact128-thread reach reduction across all large seat counts and fixed convergence targets	2026-09-07T06:03:39+00:00
E035R	preflop_cuda	db5b25e164576dfb237f0b8a78ab07f41f8682ba	keep	preflop.6.target_seconds	2.696802	Repeat exact128-thread reach reduction across all large seat counts and fixed convergence targets	2026-09-07T06:03:39+00:00
E035R	preflop_cuda	db5b25e164576dfb237f0b8a78ab07f41f8682ba	keep	preflop.8.target_seconds	6.7872369	Repeat exact128-thread reach reduction across all large seat counts and fixed convergence targets	2026-09-07T06:03:39+00:00
E036	preflop_cuda	8db273b9a33a8a6f4273339b61efb31a775fc6fd	discard	preflop.3.iteration_ms	0.217	Unroll equity-cache dot loops by4 to amortize loop/address work while preserving each sequential accumulation	2026-09-07T06:06:45+00:00
E036	preflop_cuda	8db273b9a33a8a6f4273339b61efb31a775fc6fd	discard	preflop.3.check_ms	0.553	Unroll equity-cache dot loops by4 to amortize loop/address work while preserving each sequential accumulation	2026-09-07T06:06:45+00:00
E036	preflop_cuda	8db273b9a33a8a6f4273339b61efb31a775fc6fd	discard	preflop.3.sync_ms	0.075	Unroll equity-cache dot loops by4 to amortize loop/address work while preserving each sequential accumulation	2026-09-07T06:06:45+00:00
E036	preflop_cuda	8db273b9a33a8a6f4273339b61efb31a775fc6fd	discard	preflop.5.iteration_ms	2.752	Unroll equity-cache dot loops by4 to amortize loop/address work while preserving each sequential accumulation	2026-09-07T06:06:45+00:00
E036	preflop_cuda	8db273b9a33a8a6f4273339b61efb31a775fc6fd	discard	preflop.5.check_ms	2.623	Unroll equity-cache dot loops by4 to amortize loop/address work while preserving each sequential accumulation	2026-09-07T06:06:45+00:00
E036	preflop_cuda	8db273b9a33a8a6f4273339b61efb31a775fc6fd	discard	preflop.5.sync_ms	4.166	Unroll equity-cache dot loops by4 to amortize loop/address work while preserving each sequential accumulation	2026-09-07T06:06:45+00:00
E036	preflop_cuda	8db273b9a33a8a6f4273339b61efb31a775fc6fd	discard	preflop.7.iteration_ms	11.799	Unroll equity-cache dot loops by4 to amortize loop/address work while preserving each sequential accumulation	2026-09-07T06:06:45+00:00
E036	preflop_cuda	8db273b9a33a8a6f4273339b61efb31a775fc6fd	discard	preflop.7.check_ms	8.863	Unroll equity-cache dot loops by4 to amortize loop/address work while preserving each sequential accumulation	2026-09-07T06:06:45+00:00
E036	preflop_cuda	8db273b9a33a8a6f4273339b61efb31a775fc6fd	discard	preflop.7.sync_ms	16.301	Unroll equity-cache dot loops by4 to amortize loop/address work while preserving each sequential accumulation	2026-09-07T06:06:45+00:00
E036	preflop_cuda	8db273b9a33a8a6f4273339b61efb31a775fc6fd	discard	preflop.9.iteration_ms	237.416	Unroll equity-cache dot loops by4 to amortize loop/address work while preserving each sequential accumulation	2026-09-07T06:06:45+00:00
E036	preflop_cuda	8db273b9a33a8a6f4273339b61efb31a775fc6fd	discard	preflop.9.check_ms	163.015	Unroll equity-cache dot loops by4 to amortize loop/address work while preserving each sequential accumulation	2026-09-07T06:06:45+00:00
E036	preflop_cuda	8db273b9a33a8a6f4273339b61efb31a775fc6fd	discard	preflop.9.sync_ms	320.15	Unroll equity-cache dot loops by4 to amortize loop/address work while preserving each sequential accumulation	2026-09-07T06:06:45+00:00
E036	preflop_cuda	8db273b9a33a8a6f4273339b61efb31a775fc6fd	discard	preflop.2.iteration_ms	0.091	Unroll equity-cache dot loops by4 to amortize loop/address work while preserving each sequential accumulation	2026-09-07T06:06:45+00:00
E036	preflop_cuda	8db273b9a33a8a6f4273339b61efb31a775fc6fd	discard	preflop.2.check_ms	0.239	Unroll equity-cache dot loops by4 to amortize loop/address work while preserving each sequential accumulation	2026-09-07T06:06:45+00:00
E036	preflop_cuda	8db273b9a33a8a6f4273339b61efb31a775fc6fd	discard	preflop.2.sync_ms	0.017	Unroll equity-cache dot loops by4 to amortize loop/address work while preserving each sequential accumulation	2026-09-07T06:06:45+00:00
E036	preflop_cuda	8db273b9a33a8a6f4273339b61efb31a775fc6fd	discard	preflop.6.iteration_ms	15.823	Unroll equity-cache dot loops by4 to amortize loop/address work while preserving each sequential accumulation	2026-09-07T06:06:45+00:00
E036	preflop_cuda	8db273b9a33a8a6f4273339b61efb31a775fc6fd	discard	preflop.6.check_ms	12.213	Unroll equity-cache dot loops by4 to amortize loop/address work while preserving each sequential accumulation	2026-09-07T06:06:45+00:00
E036	preflop_cuda	8db273b9a33a8a6f4273339b61efb31a775fc6fd	discard	preflop.6.sync_ms	27.451	Unroll equity-cache dot loops by4 to amortize loop/address work while preserving each sequential accumulation	2026-09-07T06:06:45+00:00
E036	preflop_cuda	8db273b9a33a8a6f4273339b61efb31a775fc6fd	discard	preflop.8.iteration_ms	55.576	Unroll equity-cache dot loops by4 to amortize loop/address work while preserving each sequential accumulation	2026-09-07T06:06:45+00:00
E036	preflop_cuda	8db273b9a33a8a6f4273339b61efb31a775fc6fd	discard	preflop.8.check_ms	39.953	Unroll equity-cache dot loops by4 to amortize loop/address work while preserving each sequential accumulation	2026-09-07T06:06:45+00:00
E036	preflop_cuda	8db273b9a33a8a6f4273339b61efb31a775fc6fd	discard	preflop.8.sync_ms	71.1	Unroll equity-cache dot loops by4 to amortize loop/address work while preserving each sequential accumulation	2026-09-07T06:06:45+00:00
E037	preflop_cuda	ad22abafaf902a0747b8df868b97910bbcb48c5b	discard	preflop.3.iteration_ms	0.229	Use192threads for non-reduction per-node kernels, reducing idle lanes while retaining the exact128-thread reach reduction	2026-09-07T06:09:49+00:00
E037	preflop_cuda	ad22abafaf902a0747b8df868b97910bbcb48c5b	discard	preflop.3.check_ms	0.486	Use192threads for non-reduction per-node kernels, reducing idle lanes while retaining the exact128-thread reach reduction	2026-09-07T06:09:49+00:00
E037	preflop_cuda	ad22abafaf902a0747b8df868b97910bbcb48c5b	discard	preflop.3.sync_ms	0.059	Use192threads for non-reduction per-node kernels, reducing idle lanes while retaining the exact128-thread reach reduction	2026-09-07T06:09:49+00:00
E037	preflop_cuda	ad22abafaf902a0747b8df868b97910bbcb48c5b	discard	preflop.5.iteration_ms	2.375	Use192threads for non-reduction per-node kernels, reducing idle lanes while retaining the exact128-thread reach reduction	2026-09-07T06:09:49+00:00
E037	preflop_cuda	ad22abafaf902a0747b8df868b97910bbcb48c5b	discard	preflop.5.check_ms	2.946	Use192threads for non-reduction per-node kernels, reducing idle lanes while retaining the exact128-thread reach reduction	2026-09-07T06:09:49+00:00
E037	preflop_cuda	ad22abafaf902a0747b8df868b97910bbcb48c5b	discard	preflop.5.sync_ms	3.855	Use192threads for non-reduction per-node kernels, reducing idle lanes while retaining the exact128-thread reach reduction	2026-09-07T06:09:49+00:00
