experiment	path	commit	status	metric	value	hypothesis	utc
E005	reports_profiles	6155843a3b3c09a5c8df108e96bc5a9214041941	keep	lifecycle.report_lines_ms	68.4324	Cache board hand categories across betting lines within each report, preserving all summaries	2026-09-07T01:09:56+00:00
E005	reports_profiles	6155843a3b3c09a5c8df108e96bc5a9214041941	keep	lifecycle.save_mb	104.204944	Cache board hand categories across betting lines within each report, preserving all summaries	2026-09-07T01:09:56+00:00
E005	reports_profiles	6155843a3b3c09a5c8df108e96bc5a9214041941	keep	lifecycle.save_ms	221.0823	Cache board hand categories across betting lines within each report, preserving all summaries	2026-09-07T01:09:56+00:00
E005R	reports_profiles	6155843a3b3c09a5c8df108e96bc5a9214041941	keep	cpu.postflop.arena_mb	104.204192	Repeat board-category caching; pooled report and profile behavior tests passed	2026-09-07T01:11:56+00:00
E005R	reports_profiles	6155843a3b3c09a5c8df108e96bc5a9214041941	keep	cpu.postflop.iteration_ms	28.47708	Repeat board-category caching; pooled report and profile behavior tests passed	2026-09-07T01:11:56+00:00
E005R	reports_profiles	6155843a3b3c09a5c8df108e96bc5a9214041941	keep	lifecycle.build_ms	8.6211	Repeat board-category caching; pooled report and profile behavior tests passed	2026-09-07T01:11:56+00:00
E005R	reports_profiles	6155843a3b3c09a5c8df108e96bc5a9214041941	keep	lifecycle.compressed_load_ms	85.1046	Repeat board-category caching; pooled report and profile behavior tests passed	2026-09-07T01:11:56+00:00
E005R	reports_profiles	6155843a3b3c09a5c8df108e96bc5a9214041941	keep	lifecycle.load_ms	66.054	Repeat board-category caching; pooled report and profile behavior tests passed	2026-09-07T01:11:56+00:00
E005R	reports_profiles	6155843a3b3c09a5c8df108e96bc5a9214041941	keep	lifecycle.profile_ms	647.8914	Repeat board-category caching; pooled report and profile behavior tests passed	2026-09-07T01:11:56+00:00
E005R	reports_profiles	6155843a3b3c09a5c8df108e96bc5a9214041941	keep	lifecycle.report_lines_ms	67.70439999999999	Repeat board-category caching; pooled report and profile behavior tests passed	2026-09-07T01:11:56+00:00
E005R	reports_profiles	6155843a3b3c09a5c8df108e96bc5a9214041941	keep	lifecycle.save_mb	104.204944	Repeat board-category caching; pooled report and profile behavior tests passed	2026-09-07T01:11:56+00:00
E005R	reports_profiles	6155843a3b3c09a5c8df108e96bc5a9214041941	keep	lifecycle.save_ms	220.3318	Repeat board-category caching; pooled report and profile behavior tests passed	2026-09-07T01:11:56+00:00
E006	build_save_load	9004a81ef2e7087b5a84c3676922a342c80ebb7e	keep	cpu.postflop.arena_mb	104.204192	Eliminate temporary f32 arena allocations and copies during load, retaining validation and file format	2026-09-07T01:14:00+00:00
E006	build_save_load	9004a81ef2e7087b5a84c3676922a342c80ebb7e	keep	cpu.postflop.iteration_ms	27.196720000000003	Eliminate temporary f32 arena allocations and copies during load, retaining validation and file format	2026-09-07T01:14:00+00:00
E006	build_save_load	9004a81ef2e7087b5a84c3676922a342c80ebb7e	keep	lifecycle.build_ms	8.4949	Eliminate temporary f32 arena allocations and copies during load, retaining validation and file format	2026-09-07T01:14:00+00:00
E006	build_save_load	9004a81ef2e7087b5a84c3676922a342c80ebb7e	keep	lifecycle.compressed_load_ms	92.4106	Eliminate temporary f32 arena allocations and copies during load, retaining validation and file format	2026-09-07T01:14:00+00:00
E006	build_save_load	9004a81ef2e7087b5a84c3676922a342c80ebb7e	keep	lifecycle.load_ms	58.6604	Eliminate temporary f32 arena allocations and copies during load, retaining validation and file format	2026-09-07T01:14:00+00:00
E006	build_save_load	9004a81ef2e7087b5a84c3676922a342c80ebb7e	keep	lifecycle.profile_ms	651.1934	Eliminate temporary f32 arena allocations and copies during load, retaining validation and file format	2026-09-07T01:14:00+00:00
E006	build_save_load	9004a81ef2e7087b5a84c3676922a342c80ebb7e	keep	lifecycle.report_lines_ms	70.5333	Eliminate temporary f32 arena allocations and copies during load, retaining validation and file format	2026-09-07T01:14:00+00:00
E006	build_save_load	9004a81ef2e7087b5a84c3676922a342c80ebb7e	keep	lifecycle.save_mb	104.204944	Eliminate temporary f32 arena allocations and copies during load, retaining validation and file format	2026-09-07T01:14:00+00:00
E006	build_save_load	9004a81ef2e7087b5a84c3676922a342c80ebb7e	keep	lifecycle.save_ms	221.40779999999998	Eliminate temporary f32 arena allocations and copies during load, retaining validation and file format	2026-09-07T01:14:00+00:00
E006R	build_save_load	9004a81ef2e7087b5a84c3676922a342c80ebb7e	keep	cpu.postflop.arena_mb	104.204192	Repeat direct-arena load after warm controls; compare both latency and process memory	2026-09-07T01:16:05+00:00
E006R	build_save_load	9004a81ef2e7087b5a84c3676922a342c80ebb7e	keep	cpu.postflop.iteration_ms	32.7023	Repeat direct-arena load after warm controls; compare both latency and process memory	2026-09-07T01:16:05+00:00
E006R	build_save_load	9004a81ef2e7087b5a84c3676922a342c80ebb7e	keep	lifecycle.build_ms	9.134	Repeat direct-arena load after warm controls; compare both latency and process memory	2026-09-07T01:16:05+00:00
E006R	build_save_load	9004a81ef2e7087b5a84c3676922a342c80ebb7e	keep	lifecycle.compressed_load_ms	96.8628	Repeat direct-arena load after warm controls; compare both latency and process memory	2026-09-07T01:16:05+00:00
E006R	build_save_load	9004a81ef2e7087b5a84c3676922a342c80ebb7e	keep	lifecycle.load_ms	43.0471	Repeat direct-arena load after warm controls; compare both latency and process memory	2026-09-07T01:16:05+00:00
E006R	build_save_load	9004a81ef2e7087b5a84c3676922a342c80ebb7e	keep	lifecycle.profile_ms	681.342	Repeat direct-arena load after warm controls; compare both latency and process memory	2026-09-07T01:16:05+00:00
E006R	build_save_load	9004a81ef2e7087b5a84c3676922a342c80ebb7e	keep	lifecycle.report_lines_ms	72.2329	Repeat direct-arena load after warm controls; compare both latency and process memory	2026-09-07T01:16:05+00:00
E006R	build_save_load	9004a81ef2e7087b5a84c3676922a342c80ebb7e	keep	lifecycle.save_mb	104.204944	Repeat direct-arena load after warm controls; compare both latency and process memory	2026-09-07T01:16:05+00:00
E006R	build_save_load	9004a81ef2e7087b5a84c3676922a342c80ebb7e	keep	lifecycle.save_ms	221.5483	Repeat direct-arena load after warm controls; compare both latency and process memory	2026-09-07T01:16:05+00:00
E006W2	build_save_load	19dd982afcd2801ed8cdbe93405a712fa0875b24	keep	lifecycle.warm_load_ms	39.8761	Isolated 20-load median and OS peak working set for direct arena loading	2026-09-07T01:21:21+00:00
E006W2	build_save_load	19dd982afcd2801ed8cdbe93405a712fa0875b24	keep	lifecycle.load_process_memory_mb	172.012	Isolated 20-load median and OS peak working set for direct arena loading	2026-09-07T01:21:21+00:00
B005	baseline	4c75a893020e1c12c83154d7c990db7abc8ac1f2	baseline	lifecycle.warm_load_ms	54.134	Paired original-loader control: same warm-load fixture, 20 samples, OS peak working set	2026-09-07T01:22:37+00:00
B005	baseline	4c75a893020e1c12c83154d7c990db7abc8ac1f2	baseline	lifecycle.load_process_memory_mb	198.885	Paired original-loader control: same warm-load fixture, 20 samples, OS peak working set	2026-09-07T01:22:37+00:00
E007	memory_transfers	4e8c4c9ebe0be70f9e642f5ccb13261cc9cf3967	keep	preflop.6.allocated_vram_mb	603.979776	Store one changed actor reach per edge and alias every unchanged seat reach to its ancestor	2026-09-07T01:26:20+00:00
E007	memory_transfers	4e8c4c9ebe0be70f9e642f5ccb13261cc9cf3967	keep	preflop.6.build_ms	77.01719999999999	Store one changed actor reach per edge and alias every unchanged seat reach to its ancestor	2026-09-07T01:26:20+00:00
E007	memory_transfers	4e8c4c9ebe0be70f9e642f5ccb13261cc9cf3967	keep	preflop.6.cpu_arena_mb	224.552328	Store one changed actor reach per edge and alias every unchanged seat reach to its ancestor	2026-09-07T01:26:20+00:00
E007	memory_transfers	4e8c4c9ebe0be70f9e642f5ccb13261cc9cf3967	keep	preflop.6.estimated_vram_mb	643.987632	Store one changed actor reach per edge and alias every unchanged seat reach to its ancestor	2026-09-07T01:26:20+00:00
E007	memory_transfers	4e8c4c9ebe0be70f9e642f5ccb13261cc9cf3967	keep	preflop.6.init_ms	595.4649	Store one changed actor reach per edge and alias every unchanged seat reach to its ancestor	2026-09-07T01:26:20+00:00
E007	memory_transfers	4e8c4c9ebe0be70f9e642f5ccb13261cc9cf3967	keep	preflop.8.allocated_vram_mb	1543.503872	Store one changed actor reach per edge and alias every unchanged seat reach to its ancestor	2026-09-07T01:26:20+00:00
E007	memory_transfers	4e8c4c9ebe0be70f9e642f5ccb13261cc9cf3967	keep	preflop.8.build_ms	231.4608	Store one changed actor reach per edge and alias every unchanged seat reach to its ancestor	2026-09-07T01:26:20+00:00
E007	memory_transfers	4e8c4c9ebe0be70f9e642f5ccb13261cc9cf3967	keep	preflop.8.cpu_arena_mb	587.239848	Store one changed actor reach per edge and alias every unchanged seat reach to its ancestor	2026-09-07T01:26:20+00:00
E007	memory_transfers	4e8c4c9ebe0be70f9e642f5ccb13261cc9cf3967	keep	preflop.8.estimated_vram_mb	1591.177304	Store one changed actor reach per edge and alias every unchanged seat reach to its ancestor	2026-09-07T01:26:20+00:00
E007	memory_transfers	4e8c4c9ebe0be70f9e642f5ccb13261cc9cf3967	keep	preflop.8.init_ms	268.5756	Store one changed actor reach per edge and alias every unchanged seat reach to its ancestor	2026-09-07T01:26:20+00:00
E007	memory_transfers	4e8c4c9ebe0be70f9e642f5ccb13261cc9cf3967	keep	preflop.2.iteration_ms	0.098	Store one changed actor reach per edge and alias every unchanged seat reach to its ancestor	2026-09-07T01:26:20+00:00
E007	memory_transfers	4e8c4c9ebe0be70f9e642f5ccb13261cc9cf3967	keep	preflop.2.check_ms	0.394	Store one changed actor reach per edge and alias every unchanged seat reach to its ancestor	2026-09-07T01:26:20+00:00
E007	memory_transfers	4e8c4c9ebe0be70f9e642f5ccb13261cc9cf3967	keep	preflop.2.sync_ms	0.035	Store one changed actor reach per edge and alias every unchanged seat reach to its ancestor	2026-09-07T01:26:20+00:00
E007	memory_transfers	4e8c4c9ebe0be70f9e642f5ccb13261cc9cf3967	keep	preflop.6.iteration_ms	24.037	Store one changed actor reach per edge and alias every unchanged seat reach to its ancestor	2026-09-07T01:26:20+00:00
E007	memory_transfers	4e8c4c9ebe0be70f9e642f5ccb13261cc9cf3967	keep	preflop.6.check_ms	32.787	Store one changed actor reach per edge and alias every unchanged seat reach to its ancestor	2026-09-07T01:26:20+00:00
E007	memory_transfers	4e8c4c9ebe0be70f9e642f5ccb13261cc9cf3967	keep	preflop.6.sync_ms	27.716	Store one changed actor reach per edge and alias every unchanged seat reach to its ancestor	2026-09-07T01:26:20+00:00
E007	memory_transfers	4e8c4c9ebe0be70f9e642f5ccb13261cc9cf3967	keep	preflop.8.iteration_ms	106.379	Store one changed actor reach per edge and alias every unchanged seat reach to its ancestor	2026-09-07T01:26:20+00:00
E007	memory_transfers	4e8c4c9ebe0be70f9e642f5ccb13261cc9cf3967	keep	preflop.8.check_ms	133.402	Store one changed actor reach per edge and alias every unchanged seat reach to its ancestor	2026-09-07T01:26:20+00:00
E007	memory_transfers	4e8c4c9ebe0be70f9e642f5ccb13261cc9cf3967	keep	preflop.8.sync_ms	73.445	Store one changed actor reach per edge and alias every unchanged seat reach to its ancestor	2026-09-07T01:26:20+00:00
E007R	memory_transfers	4e8c4c9ebe0be70f9e642f5ccb13261cc9cf3967	keep	preflop.6.allocated_vram_mb	603.979776	Repeat compact reach timing and capacity after CUDA JIT warmup and full preflop equivalence validation	2026-09-07T01:28:54+00:00
E007R	memory_transfers	4e8c4c9ebe0be70f9e642f5ccb13261cc9cf3967	keep	preflop.6.build_ms	79.0233	Repeat compact reach timing and capacity after CUDA JIT warmup and full preflop equivalence validation	2026-09-07T01:28:54+00:00
E007R	memory_transfers	4e8c4c9ebe0be70f9e642f5ccb13261cc9cf3967	keep	preflop.6.cpu_arena_mb	224.552328	Repeat compact reach timing and capacity after CUDA JIT warmup and full preflop equivalence validation	2026-09-07T01:28:54+00:00
E007R	memory_transfers	4e8c4c9ebe0be70f9e642f5ccb13261cc9cf3967	keep	preflop.6.estimated_vram_mb	643.987632	Repeat compact reach timing and capacity after CUDA JIT warmup and full preflop equivalence validation	2026-09-07T01:28:54+00:00
E007R	memory_transfers	4e8c4c9ebe0be70f9e642f5ccb13261cc9cf3967	keep	preflop.6.init_ms	187.6735	Repeat compact reach timing and capacity after CUDA JIT warmup and full preflop equivalence validation	2026-09-07T01:28:54+00:00
E007R	memory_transfers	4e8c4c9ebe0be70f9e642f5ccb13261cc9cf3967	keep	preflop.8.allocated_vram_mb	1543.503872	Repeat compact reach timing and capacity after CUDA JIT warmup and full preflop equivalence validation	2026-09-07T01:28:54+00:00
E007R	memory_transfers	4e8c4c9ebe0be70f9e642f5ccb13261cc9cf3967	keep	preflop.8.build_ms	246.7398	Repeat compact reach timing and capacity after CUDA JIT warmup and full preflop equivalence validation	2026-09-07T01:28:54+00:00
E007R	memory_transfers	4e8c4c9ebe0be70f9e642f5ccb13261cc9cf3967	keep	preflop.8.cpu_arena_mb	587.239848	Repeat compact reach timing and capacity after CUDA JIT warmup and full preflop equivalence validation	2026-09-07T01:28:54+00:00
E007R	memory_transfers	4e8c4c9ebe0be70f9e642f5ccb13261cc9cf3967	keep	preflop.8.estimated_vram_mb	1591.177304	Repeat compact reach timing and capacity after CUDA JIT warmup and full preflop equivalence validation	2026-09-07T01:28:54+00:00
E007R	memory_transfers	4e8c4c9ebe0be70f9e642f5ccb13261cc9cf3967	keep	preflop.8.init_ms	295.3459	Repeat compact reach timing and capacity after CUDA JIT warmup and full preflop equivalence validation	2026-09-07T01:28:54+00:00
E007R	memory_transfers	4e8c4c9ebe0be70f9e642f5ccb13261cc9cf3967	keep	preflop.2.iteration_ms	0.09	Repeat compact reach timing and capacity after CUDA JIT warmup and full preflop equivalence validation	2026-09-07T01:28:54+00:00
E007R	memory_transfers	4e8c4c9ebe0be70f9e642f5ccb13261cc9cf3967	keep	preflop.2.check_ms	0.294	Repeat compact reach timing and capacity after CUDA JIT warmup and full preflop equivalence validation	2026-09-07T01:28:54+00:00
E007R	memory_transfers	4e8c4c9ebe0be70f9e642f5ccb13261cc9cf3967	keep	preflop.2.sync_ms	0.016	Repeat compact reach timing and capacity after CUDA JIT warmup and full preflop equivalence validation	2026-09-07T01:28:54+00:00
E007R	memory_transfers	4e8c4c9ebe0be70f9e642f5ccb13261cc9cf3967	keep	preflop.6.iteration_ms	23.784	Repeat compact reach timing and capacity after CUDA JIT warmup and full preflop equivalence validation	2026-09-07T01:28:54+00:00
E007R	memory_transfers	4e8c4c9ebe0be70f9e642f5ccb13261cc9cf3967	keep	preflop.6.check_ms	32.792	Repeat compact reach timing and capacity after CUDA JIT warmup and full preflop equivalence validation	2026-09-07T01:28:54+00:00
E007R	memory_transfers	4e8c4c9ebe0be70f9e642f5ccb13261cc9cf3967	keep	preflop.6.sync_ms	29.649	Repeat compact reach timing and capacity after CUDA JIT warmup and full preflop equivalence validation	2026-09-07T01:28:54+00:00
E007R	memory_transfers	4e8c4c9ebe0be70f9e642f5ccb13261cc9cf3967	keep	preflop.8.iteration_ms	106.602	Repeat compact reach timing and capacity after CUDA JIT warmup and full preflop equivalence validation	2026-09-07T01:28:54+00:00
E007R	memory_transfers	4e8c4c9ebe0be70f9e642f5ccb13261cc9cf3967	keep	preflop.8.check_ms	133.419	Repeat compact reach timing and capacity after CUDA JIT warmup and full preflop equivalence validation	2026-09-07T01:28:54+00:00
E007R	memory_transfers	4e8c4c9ebe0be70f9e642f5ccb13261cc9cf3967	keep	preflop.8.sync_ms	69.785	Repeat compact reach timing and capacity after CUDA JIT warmup and full preflop equivalence validation	2026-09-07T01:28:54+00:00
E008	cpu_solving	f3fadb13e738fe43c259689429865b13c8b5a47c	keep	cpu.preflop.arena_mb	224.552328	Use opponent-major equity storage to vectorize independent hero hands while preserving each sum order	2026-09-07T01:33:30+00:00
E008	cpu_solving	f3fadb13e738fe43c259689429865b13c8b5a47c	keep	cpu.preflop.check_ms	325.6546	Use opponent-major equity storage to vectorize independent hero hands while preserving each sum order	2026-09-07T01:33:30+00:00
E008	cpu_solving	f3fadb13e738fe43c259689429865b13c8b5a47c	keep	cpu.preflop.iteration_ms	77.83432	Use opponent-major equity storage to vectorize independent hero hands while preserving each sum order	2026-09-07T01:33:30+00:00
E008R	cpu_solving	0f13dcb8b59ae4bc86976e198d22f81a6b726fa4	keep	cpu.preflop.arena_mb	224.552328	Repeat exact batched equity timings after the full CPU solver suite passed	2026-09-07T01:38:49+00:00
E008R	cpu_solving	0f13dcb8b59ae4bc86976e198d22f81a6b726fa4	keep	cpu.preflop.check_ms	338.9815	Repeat exact batched equity timings after the full CPU solver suite passed	2026-09-07T01:38:49+00:00
E008R	cpu_solving	0f13dcb8b59ae4bc86976e198d22f81a6b726fa4	keep	cpu.preflop.iteration_ms	84.69842	Repeat exact batched equity timings after the full CPU solver suite passed	2026-09-07T01:38:49+00:00
B006	baseline	0f13dcb8b59ae4bc86976e198d22f81a6b726fa4	baseline	postflop.Ks7h2d.iso.allocated_vram_mb	7683.964928	Postflop GPU capacity before compact reach slots, with suit isomorphism on and off	2026-09-07T01:41:32+00:00
B006	baseline	0f13dcb8b59ae4bc86976e198d22f81a6b726fa4	baseline	postflop.Ks7h2d.iso.estimated_vram_mb	8088.005516	Postflop GPU capacity before compact reach slots, with suit isomorphism on and off	2026-09-07T01:41:32+00:00
B006	baseline	0f13dcb8b59ae4bc86976e198d22f81a6b726fa4	baseline	postflop.Ks7h2d.iso.init_ms	868.18	Postflop GPU capacity before compact reach slots, with suit isomorphism on and off	2026-09-07T01:41:32+00:00
B006	baseline	0f13dcb8b59ae4bc86976e198d22f81a6b726fa4	baseline	postflop.Ks7h2d.iso.plan_build_ms	93.5086	Postflop GPU capacity before compact reach slots, with suit isomorphism on and off	2026-09-07T01:41:32+00:00
B006	baseline	0f13dcb8b59ae4bc86976e198d22f81a6b726fa4	baseline	postflop.Ks7h2d.iso.staging_memory_mb	4821.59054	Postflop GPU capacity before compact reach slots, with suit isomorphism on and off	2026-09-07T01:41:32+00:00
B006	baseline	0f13dcb8b59ae4bc86976e198d22f81a6b726fa4	baseline	postflop.Ks7s2d.iso.allocated_vram_mb	7683.964928	Postflop GPU capacity before compact reach slots, with suit isomorphism on and off	2026-09-07T01:41:32+00:00
B006	baseline	0f13dcb8b59ae4bc86976e198d22f81a6b726fa4	baseline	postflop.Ks7s2d.iso.estimated_vram_mb	8113.667768	Postflop GPU capacity before compact reach slots, with suit isomorphism on and off	2026-09-07T01:41:32+00:00
B006	baseline	0f13dcb8b59ae4bc86976e198d22f81a6b726fa4	baseline	postflop.Ks7s2d.iso.init_ms	634.1732	Postflop GPU capacity before compact reach slots, with suit isomorphism on and off	2026-09-07T01:41:32+00:00
B006	baseline	0f13dcb8b59ae4bc86976e198d22f81a6b726fa4	baseline	postflop.Ks7s2d.iso.plan_build_ms	68.9306	Postflop GPU capacity before compact reach slots, with suit isomorphism on and off	2026-09-07T01:41:32+00:00
B006	baseline	0f13dcb8b59ae4bc86976e198d22f81a6b726fa4	baseline	postflop.Ks7s2d.iso.staging_memory_mb	4837.752296	Postflop GPU capacity before compact reach slots, with suit isomorphism on and off	2026-09-07T01:41:32+00:00
B006	baseline	0f13dcb8b59ae4bc86976e198d22f81a6b726fa4	baseline	postflop.Ks7s2d.full.allocated_vram_mb	7717.51936	Postflop GPU capacity before compact reach slots, with suit isomorphism on and off	2026-09-07T01:41:32+00:00
B006	baseline	0f13dcb8b59ae4bc86976e198d22f81a6b726fa4	baseline	postflop.Ks7s2d.full.estimated_vram_mb	8113.667768	Postflop GPU capacity before compact reach slots, with suit isomorphism on and off	2026-09-07T01:41:32+00:00
B006	baseline	0f13dcb8b59ae4bc86976e198d22f81a6b726fa4	baseline	postflop.Ks7s2d.full.init_ms	663.1458	Postflop GPU capacity before compact reach slots, with suit isomorphism on and off	2026-09-07T01:41:32+00:00
B006	baseline	0f13dcb8b59ae4bc86976e198d22f81a6b726fa4	baseline	postflop.Ks7s2d.full.plan_build_ms	128.3491	Postflop GPU capacity before compact reach slots, with suit isomorphism on and off	2026-09-07T01:41:32+00:00
B006	baseline	0f13dcb8b59ae4bc86976e198d22f81a6b726fa4	baseline	postflop.Ks7s2d.full.staging_memory_mb	4837.752296	Postflop GPU capacity before compact reach slots, with suit isomorphism on and off	2026-09-07T01:41:32+00:00
B007	baseline	0f13dcb8b59ae4bc86976e198d22f81a6b726fa4	baseline	postflop.Ks7h2d.target_seconds	12.244	Postflop time-to-0.3-percent-exploitability control before compact reach storage	2026-09-07T01:43:33+00:00
B007	baseline	0f13dcb8b59ae4bc86976e198d22f81a6b726fa4	baseline	postflop.Ks7s2d.target_seconds	7.346	Postflop time-to-0.3-percent-exploitability control before compact reach storage	2026-09-07T01:43:33+00:00
B007	baseline	0f13dcb8b59ae4bc86976e198d22f81a6b726fa4	baseline	postflop.Ks7h2dQhTc.target_seconds	0.023	Postflop time-to-0.3-percent-exploitability control before compact reach storage	2026-09-07T01:43:33+00:00
E009	postflop_cuda	4fe013617fc43a951f18977dffe4633bc59070c4	keep	postflop.Ks7h2d.iso.allocated_vram_mb	6274.678784	Dense reach-owner storage reduces postflop VRAM without changing any reach calculation	2026-09-07T01:50:21+00:00
E009	postflop_cuda	4fe013617fc43a951f18977dffe4633bc59070c4	keep	postflop.Ks7h2d.iso.estimated_vram_mb	6716.6347	Dense reach-owner storage reduces postflop VRAM without changing any reach calculation	2026-09-07T01:50:21+00:00
E009	postflop_cuda	4fe013617fc43a951f18977dffe4633bc59070c4	keep	postflop.Ks7h2d.iso.init_ms	1440.1109000000001	Dense reach-owner storage reduces postflop VRAM without changing any reach calculation	2026-09-07T01:50:21+00:00
E009	postflop_cuda	4fe013617fc43a951f18977dffe4633bc59070c4	keep	postflop.Ks7h2d.iso.plan_build_ms	99.9789	Dense reach-owner storage reduces postflop VRAM without changing any reach calculation	2026-09-07T01:50:21+00:00
