experiment	path	commit	status	metric	value	hypothesis	utc
E030R	postflop_cuda	8fffe84a34ecd081e4fcde9b54ac5220e00fb1ad	discard	postflop.Ks7h2dQhTc.second_check_ms	0.5747	Repeat postflop evaluation graphs including first-call cost, fixed target stopping, and all action-menu states	2026-09-07T05:31:13+00:00
E030R	postflop_cuda	8fffe84a34ecd081e4fcde9b54ac5220e00fb1ad	discard	postflop.Ks7h2dQhTc.steady_check_ms	0.32285	Repeat postflop evaluation graphs including first-call cost, fixed target stopping, and all action-menu states	2026-09-07T05:31:13+00:00
E030R	postflop_cuda	8fffe84a34ecd081e4fcde9b54ac5220e00fb1ad	discard	preflop.2.first_check_ms	0.3553	Repeat postflop evaluation graphs including first-call cost, fixed target stopping, and all action-menu states	2026-09-07T05:31:13+00:00
E030R	postflop_cuda	8fffe84a34ecd081e4fcde9b54ac5220e00fb1ad	discard	preflop.2.second_check_ms	0.24850000000000003	Repeat postflop evaluation graphs including first-call cost, fixed target stopping, and all action-menu states	2026-09-07T05:31:13+00:00
E030R	postflop_cuda	8fffe84a34ecd081e4fcde9b54ac5220e00fb1ad	discard	preflop.2.steady_check_ms	0.108825	Repeat postflop evaluation graphs including first-call cost, fixed target stopping, and all action-menu states	2026-09-07T05:31:13+00:00
E030R	postflop_cuda	8fffe84a34ecd081e4fcde9b54ac5220e00fb1ad	discard	preflop.6.first_check_ms	11.6832	Repeat postflop evaluation graphs including first-call cost, fixed target stopping, and all action-menu states	2026-09-07T05:31:13+00:00
E030R	postflop_cuda	8fffe84a34ecd081e4fcde9b54ac5220e00fb1ad	discard	preflop.6.second_check_ms	12.1938	Repeat postflop evaluation graphs including first-call cost, fixed target stopping, and all action-menu states	2026-09-07T05:31:13+00:00
E030R	postflop_cuda	8fffe84a34ecd081e4fcde9b54ac5220e00fb1ad	discard	preflop.6.steady_check_ms	10.951975	Repeat postflop evaluation graphs including first-call cost, fixed target stopping, and all action-menu states	2026-09-07T05:31:13+00:00
E030R	postflop_cuda	8fffe84a34ecd081e4fcde9b54ac5220e00fb1ad	discard	preflop.8.first_check_ms	35.449099999999994	Repeat postflop evaluation graphs including first-call cost, fixed target stopping, and all action-menu states	2026-09-07T05:31:13+00:00
E030R	postflop_cuda	8fffe84a34ecd081e4fcde9b54ac5220e00fb1ad	discard	preflop.8.second_check_ms	36.1883	Repeat postflop evaluation graphs including first-call cost, fixed target stopping, and all action-menu states	2026-09-07T05:31:13+00:00
E030R	postflop_cuda	8fffe84a34ecd081e4fcde9b54ac5220e00fb1ad	discard	preflop.8.steady_check_ms	34.368975000000006	Repeat postflop evaluation graphs including first-call cost, fixed target stopping, and all action-menu states	2026-09-07T05:31:13+00:00
E030R	postflop_cuda	8fffe84a34ecd081e4fcde9b54ac5220e00fb1ad	discard	postflop.Ks7h2d.target_seconds	9.89	Repeat postflop evaluation graphs including first-call cost, fixed target stopping, and all action-menu states	2026-09-07T05:31:13+00:00
E030R	postflop_cuda	8fffe84a34ecd081e4fcde9b54ac5220e00fb1ad	discard	postflop.Ks7s2d.target_seconds	6.032	Repeat postflop evaluation graphs including first-call cost, fixed target stopping, and all action-menu states	2026-09-07T05:31:13+00:00
E030R	postflop_cuda	8fffe84a34ecd081e4fcde9b54ac5220e00fb1ad	discard	postflop.Ks7h2dQhTc.target_seconds	0.018	Repeat postflop evaluation graphs including first-call cost, fixed target stopping, and all action-menu states	2026-09-07T05:31:13+00:00
E030A	postflop_cuda	e20667ebb1b3d442564588ad2d79b0c2a98d5f16	keep	postflop.Ks7h2d.first_check_ms	35.6008	Retain original eager first-check transfers and capture subsequent checks to avoid one-shot startup regression	2026-09-07T05:34:45+00:00
E030A	postflop_cuda	e20667ebb1b3d442564588ad2d79b0c2a98d5f16	keep	postflop.Ks7h2d.second_check_ms	36.2908	Retain original eager first-check transfers and capture subsequent checks to avoid one-shot startup regression	2026-09-07T05:34:45+00:00
E030A	postflop_cuda	e20667ebb1b3d442564588ad2d79b0c2a98d5f16	keep	postflop.Ks7h2d.steady_check_ms	38.141025	Retain original eager first-check transfers and capture subsequent checks to avoid one-shot startup regression	2026-09-07T05:34:45+00:00
E030A	postflop_cuda	e20667ebb1b3d442564588ad2d79b0c2a98d5f16	keep	postflop.Ks7s2d.first_check_ms	28.5117	Retain original eager first-check transfers and capture subsequent checks to avoid one-shot startup regression	2026-09-07T05:34:45+00:00
E030A	postflop_cuda	e20667ebb1b3d442564588ad2d79b0c2a98d5f16	keep	postflop.Ks7s2d.second_check_ms	28.5552	Retain original eager first-check transfers and capture subsequent checks to avoid one-shot startup regression	2026-09-07T05:34:45+00:00
E030A	postflop_cuda	e20667ebb1b3d442564588ad2d79b0c2a98d5f16	keep	postflop.Ks7s2d.steady_check_ms	28.0433	Retain original eager first-check transfers and capture subsequent checks to avoid one-shot startup regression	2026-09-07T05:34:45+00:00
E030A	postflop_cuda	e20667ebb1b3d442564588ad2d79b0c2a98d5f16	keep	postflop.Ks7h2dQhTc.first_check_ms	0.8764000000000001	Retain original eager first-check transfers and capture subsequent checks to avoid one-shot startup regression	2026-09-07T05:34:45+00:00
E030A	postflop_cuda	e20667ebb1b3d442564588ad2d79b0c2a98d5f16	keep	postflop.Ks7h2dQhTc.second_check_ms	0.6049	Retain original eager first-check transfers and capture subsequent checks to avoid one-shot startup regression	2026-09-07T05:34:45+00:00
E030A	postflop_cuda	e20667ebb1b3d442564588ad2d79b0c2a98d5f16	keep	postflop.Ks7h2dQhTc.steady_check_ms	0.310175	Retain original eager first-check transfers and capture subsequent checks to avoid one-shot startup regression	2026-09-07T05:34:45+00:00
E030A	postflop_cuda	e20667ebb1b3d442564588ad2d79b0c2a98d5f16	keep	preflop.2.first_check_ms	0.2673	Retain original eager first-check transfers and capture subsequent checks to avoid one-shot startup regression	2026-09-07T05:34:45+00:00
E030A	postflop_cuda	e20667ebb1b3d442564588ad2d79b0c2a98d5f16	keep	preflop.2.second_check_ms	0.24259999999999998	Retain original eager first-check transfers and capture subsequent checks to avoid one-shot startup regression	2026-09-07T05:34:45+00:00
E030A	postflop_cuda	e20667ebb1b3d442564588ad2d79b0c2a98d5f16	keep	preflop.2.steady_check_ms	0.09787499999999999	Retain original eager first-check transfers and capture subsequent checks to avoid one-shot startup regression	2026-09-07T05:34:45+00:00
E030A	postflop_cuda	e20667ebb1b3d442564588ad2d79b0c2a98d5f16	keep	preflop.6.first_check_ms	13.2616	Retain original eager first-check transfers and capture subsequent checks to avoid one-shot startup regression	2026-09-07T05:34:45+00:00
E030A	postflop_cuda	e20667ebb1b3d442564588ad2d79b0c2a98d5f16	keep	preflop.6.second_check_ms	13.448699999999999	Retain original eager first-check transfers and capture subsequent checks to avoid one-shot startup regression	2026-09-07T05:34:45+00:00
E030A	postflop_cuda	e20667ebb1b3d442564588ad2d79b0c2a98d5f16	keep	preflop.6.steady_check_ms	12.04815	Retain original eager first-check transfers and capture subsequent checks to avoid one-shot startup regression	2026-09-07T05:34:45+00:00
E030A	postflop_cuda	e20667ebb1b3d442564588ad2d79b0c2a98d5f16	keep	preflop.8.first_check_ms	38.4597	Retain original eager first-check transfers and capture subsequent checks to avoid one-shot startup regression	2026-09-07T05:34:45+00:00
E030A	postflop_cuda	e20667ebb1b3d442564588ad2d79b0c2a98d5f16	keep	preflop.8.second_check_ms	38.809000000000005	Retain original eager first-check transfers and capture subsequent checks to avoid one-shot startup regression	2026-09-07T05:34:45+00:00
E030A	postflop_cuda	e20667ebb1b3d442564588ad2d79b0c2a98d5f16	keep	preflop.8.steady_check_ms	37.40525	Retain original eager first-check transfers and capture subsequent checks to avoid one-shot startup regression	2026-09-07T05:34:45+00:00
B032	baseline	a0b42f34eabb38c519a91cf66a4e8481a68519f0	baseline	preflop.6.allocated_vram_mb	536.870912	Fresh original postflop-check control plus retained preflop speed/capacity reference before shared terminal and compact value trials	2026-09-07T05:36:39+00:00
B032	baseline	a0b42f34eabb38c519a91cf66a4e8481a68519f0	baseline	preflop.6.build_ms	78.9652	Fresh original postflop-check control plus retained preflop speed/capacity reference before shared terminal and compact value trials	2026-09-07T05:36:39+00:00
B032	baseline	a0b42f34eabb38c519a91cf66a4e8481a68519f0	baseline	preflop.6.cpu_arena_mb	224.552328	Fresh original postflop-check control plus retained preflop speed/capacity reference before shared terminal and compact value trials	2026-09-07T05:36:39+00:00
B032	baseline	a0b42f34eabb38c519a91cf66a4e8481a68519f0	baseline	preflop.6.estimated_vram_mb	594.500084	Fresh original postflop-check control plus retained preflop speed/capacity reference before shared terminal and compact value trials	2026-09-07T05:36:39+00:00
B032	baseline	a0b42f34eabb38c519a91cf66a4e8481a68519f0	baseline	preflop.6.init_ms	154.63299999999998	Fresh original postflop-check control plus retained preflop speed/capacity reference before shared terminal and compact value trials	2026-09-07T05:36:39+00:00
B032	baseline	a0b42f34eabb38c519a91cf66a4e8481a68519f0	baseline	preflop.8.allocated_vram_mb	1409.286144	Fresh original postflop-check control plus retained preflop speed/capacity reference before shared terminal and compact value trials	2026-09-07T05:36:39+00:00
B032	baseline	a0b42f34eabb38c519a91cf66a4e8481a68519f0	baseline	preflop.8.build_ms	215.7656	Fresh original postflop-check control plus retained preflop speed/capacity reference before shared terminal and compact value trials	2026-09-07T05:36:39+00:00
B032	baseline	a0b42f34eabb38c519a91cf66a4e8481a68519f0	baseline	preflop.8.cpu_arena_mb	587.239848	Fresh original postflop-check control plus retained preflop speed/capacity reference before shared terminal and compact value trials	2026-09-07T05:36:39+00:00
B032	baseline	a0b42f34eabb38c519a91cf66a4e8481a68519f0	baseline	preflop.8.estimated_vram_mb	1456.8885480000001	Fresh original postflop-check control plus retained preflop speed/capacity reference before shared terminal and compact value trials	2026-09-07T05:36:39+00:00
B032	baseline	a0b42f34eabb38c519a91cf66a4e8481a68519f0	baseline	preflop.8.init_ms	230.0572	Fresh original postflop-check control plus retained preflop speed/capacity reference before shared terminal and compact value trials	2026-09-07T05:36:39+00:00
B032	baseline	a0b42f34eabb38c519a91cf66a4e8481a68519f0	baseline	postflop.Ks7h2d.first_check_ms	36.5299	Fresh original postflop-check control plus retained preflop speed/capacity reference before shared terminal and compact value trials	2026-09-07T05:36:39+00:00
B032	baseline	a0b42f34eabb38c519a91cf66a4e8481a68519f0	baseline	postflop.Ks7h2d.second_check_ms	37.0481	Fresh original postflop-check control plus retained preflop speed/capacity reference before shared terminal and compact value trials	2026-09-07T05:36:39+00:00
B032	baseline	a0b42f34eabb38c519a91cf66a4e8481a68519f0	baseline	postflop.Ks7h2d.steady_check_ms	34.780474999999996	Fresh original postflop-check control plus retained preflop speed/capacity reference before shared terminal and compact value trials	2026-09-07T05:36:39+00:00
B032	baseline	a0b42f34eabb38c519a91cf66a4e8481a68519f0	baseline	postflop.Ks7s2d.first_check_ms	28.9978	Fresh original postflop-check control plus retained preflop speed/capacity reference before shared terminal and compact value trials	2026-09-07T05:36:39+00:00
B032	baseline	a0b42f34eabb38c519a91cf66a4e8481a68519f0	baseline	postflop.Ks7s2d.second_check_ms	27.954900000000002	Fresh original postflop-check control plus retained preflop speed/capacity reference before shared terminal and compact value trials	2026-09-07T05:36:39+00:00
B032	baseline	a0b42f34eabb38c519a91cf66a4e8481a68519f0	baseline	postflop.Ks7s2d.steady_check_ms	30.331500000000002	Fresh original postflop-check control plus retained preflop speed/capacity reference before shared terminal and compact value trials	2026-09-07T05:36:39+00:00
B032	baseline	a0b42f34eabb38c519a91cf66a4e8481a68519f0	baseline	postflop.Ks7h2dQhTc.first_check_ms	0.8571	Fresh original postflop-check control plus retained preflop speed/capacity reference before shared terminal and compact value trials	2026-09-07T05:36:39+00:00
B032	baseline	a0b42f34eabb38c519a91cf66a4e8481a68519f0	baseline	postflop.Ks7h2dQhTc.second_check_ms	0.73	Fresh original postflop-check control plus retained preflop speed/capacity reference before shared terminal and compact value trials	2026-09-07T05:36:39+00:00
B032	baseline	a0b42f34eabb38c519a91cf66a4e8481a68519f0	baseline	postflop.Ks7h2dQhTc.steady_check_ms	0.8278	Fresh original postflop-check control plus retained preflop speed/capacity reference before shared terminal and compact value trials	2026-09-07T05:36:39+00:00
B032	baseline	a0b42f34eabb38c519a91cf66a4e8481a68519f0	baseline	preflop.2.first_check_ms	0.8624999999999999	Fresh original postflop-check control plus retained preflop speed/capacity reference before shared terminal and compact value trials	2026-09-07T05:36:39+00:00
B032	baseline	a0b42f34eabb38c519a91cf66a4e8481a68519f0	baseline	preflop.2.second_check_ms	0.2635	Fresh original postflop-check control plus retained preflop speed/capacity reference before shared terminal and compact value trials	2026-09-07T05:36:39+00:00
B032	baseline	a0b42f34eabb38c519a91cf66a4e8481a68519f0	baseline	preflop.2.steady_check_ms	0.128325	Fresh original postflop-check control plus retained preflop speed/capacity reference before shared terminal and compact value trials	2026-09-07T05:36:39+00:00
B032	baseline	a0b42f34eabb38c519a91cf66a4e8481a68519f0	baseline	preflop.6.first_check_ms	13.4164	Fresh original postflop-check control plus retained preflop speed/capacity reference before shared terminal and compact value trials	2026-09-07T05:36:39+00:00
B032	baseline	a0b42f34eabb38c519a91cf66a4e8481a68519f0	baseline	preflop.6.second_check_ms	14.316799999999999	Fresh original postflop-check control plus retained preflop speed/capacity reference before shared terminal and compact value trials	2026-09-07T05:36:39+00:00
B032	baseline	a0b42f34eabb38c519a91cf66a4e8481a68519f0	baseline	preflop.6.steady_check_ms	11.931249999999999	Fresh original postflop-check control plus retained preflop speed/capacity reference before shared terminal and compact value trials	2026-09-07T05:36:39+00:00
B032	baseline	a0b42f34eabb38c519a91cf66a4e8481a68519f0	baseline	preflop.8.first_check_ms	37.8048	Fresh original postflop-check control plus retained preflop speed/capacity reference before shared terminal and compact value trials	2026-09-07T05:36:39+00:00
B032	baseline	a0b42f34eabb38c519a91cf66a4e8481a68519f0	baseline	preflop.8.second_check_ms	40.8427	Fresh original postflop-check control plus retained preflop speed/capacity reference before shared terminal and compact value trials	2026-09-07T05:36:39+00:00
B032	baseline	a0b42f34eabb38c519a91cf66a4e8481a68519f0	baseline	preflop.8.steady_check_ms	37.149225	Fresh original postflop-check control plus retained preflop speed/capacity reference before shared terminal and compact value trials	2026-09-07T05:36:39+00:00
B032	baseline	a0b42f34eabb38c519a91cf66a4e8481a68519f0	baseline	preflop.2.iteration_ms	0.077	Fresh original postflop-check control plus retained preflop speed/capacity reference before shared terminal and compact value trials	2026-09-07T05:36:39+00:00
B032	baseline	a0b42f34eabb38c519a91cf66a4e8481a68519f0	baseline	preflop.2.check_ms	0.254	Fresh original postflop-check control plus retained preflop speed/capacity reference before shared terminal and compact value trials	2026-09-07T05:36:39+00:00
B032	baseline	a0b42f34eabb38c519a91cf66a4e8481a68519f0	baseline	preflop.2.sync_ms	0.018	Fresh original postflop-check control plus retained preflop speed/capacity reference before shared terminal and compact value trials	2026-09-07T05:36:39+00:00
B032	baseline	a0b42f34eabb38c519a91cf66a4e8481a68519f0	baseline	preflop.6.iteration_ms	16.89	Fresh original postflop-check control plus retained preflop speed/capacity reference before shared terminal and compact value trials	2026-09-07T05:36:39+00:00
B032	baseline	a0b42f34eabb38c519a91cf66a4e8481a68519f0	baseline	preflop.6.check_ms	13.199	Fresh original postflop-check control plus retained preflop speed/capacity reference before shared terminal and compact value trials	2026-09-07T05:36:39+00:00
B032	baseline	a0b42f34eabb38c519a91cf66a4e8481a68519f0	baseline	preflop.6.sync_ms	27.376	Fresh original postflop-check control plus retained preflop speed/capacity reference before shared terminal and compact value trials	2026-09-07T05:36:39+00:00
B032	baseline	a0b42f34eabb38c519a91cf66a4e8481a68519f0	baseline	preflop.8.iteration_ms	57.473	Fresh original postflop-check control plus retained preflop speed/capacity reference before shared terminal and compact value trials	2026-09-07T05:36:39+00:00
B032	baseline	a0b42f34eabb38c519a91cf66a4e8481a68519f0	baseline	preflop.8.check_ms	38.581	Fresh original postflop-check control plus retained preflop speed/capacity reference before shared terminal and compact value trials	2026-09-07T05:36:39+00:00
B032	baseline	a0b42f34eabb38c519a91cf66a4e8481a68519f0	baseline	preflop.8.sync_ms	66.372	Fresh original postflop-check control plus retained preflop speed/capacity reference before shared terminal and compact value trials	2026-09-07T05:36:39+00:00
E030AR	postflop_cuda	949febe59d714de88c64e59c91e73a40de241fee	keep	postflop.Ks7h2d.first_check_ms	34.6028	Matched repeat after fresh B032 control, separating river benefit from large-tree timing drift	2026-09-07T05:38:22+00:00
E030AR	postflop_cuda	949febe59d714de88c64e59c91e73a40de241fee	keep	postflop.Ks7h2d.second_check_ms	34.9231	Matched repeat after fresh B032 control, separating river benefit from large-tree timing drift	2026-09-07T05:38:22+00:00
E030AR	postflop_cuda	949febe59d714de88c64e59c91e73a40de241fee	keep	postflop.Ks7h2d.steady_check_ms	34.64645	Matched repeat after fresh B032 control, separating river benefit from large-tree timing drift	2026-09-07T05:38:22+00:00
E030AR	postflop_cuda	949febe59d714de88c64e59c91e73a40de241fee	keep	postflop.Ks7s2d.first_check_ms	28.0841	Matched repeat after fresh B032 control, separating river benefit from large-tree timing drift	2026-09-07T05:38:22+00:00
E030AR	postflop_cuda	949febe59d714de88c64e59c91e73a40de241fee	keep	postflop.Ks7s2d.second_check_ms	29.928199999999997	Matched repeat after fresh B032 control, separating river benefit from large-tree timing drift	2026-09-07T05:38:22+00:00
E030AR	postflop_cuda	949febe59d714de88c64e59c91e73a40de241fee	keep	postflop.Ks7s2d.steady_check_ms	28.05065	Matched repeat after fresh B032 control, separating river benefit from large-tree timing drift	2026-09-07T05:38:22+00:00
E030AR	postflop_cuda	949febe59d714de88c64e59c91e73a40de241fee	keep	postflop.Ks7h2dQhTc.first_check_ms	1.2526	Matched repeat after fresh B032 control, separating river benefit from large-tree timing drift	2026-09-07T05:38:22+00:00
E030AR	postflop_cuda	949febe59d714de88c64e59c91e73a40de241fee	keep	postflop.Ks7h2dQhTc.second_check_ms	0.6039	Matched repeat after fresh B032 control, separating river benefit from large-tree timing drift	2026-09-07T05:38:22+00:00
E030AR	postflop_cuda	949febe59d714de88c64e59c91e73a40de241fee	keep	postflop.Ks7h2dQhTc.steady_check_ms	0.327125	Matched repeat after fresh B032 control, separating river benefit from large-tree timing drift	2026-09-07T05:38:22+00:00
E031	preflop_cuda	4503fb970048cb8ab88f947c88bcdfe1676881b4	discard	preflop.2.iteration_ms	0.081	Compute terminal masses and fixed-order probability once per CUDA block rather than once per hand thread	2026-09-07T05:41:07+00:00
E031	preflop_cuda	4503fb970048cb8ab88f947c88bcdfe1676881b4	discard	preflop.2.check_ms	0.263	Compute terminal masses and fixed-order probability once per CUDA block rather than once per hand thread	2026-09-07T05:41:07+00:00
E031	preflop_cuda	4503fb970048cb8ab88f947c88bcdfe1676881b4	discard	preflop.2.sync_ms	0.017	Compute terminal masses and fixed-order probability once per CUDA block rather than once per hand thread	2026-09-07T05:41:07+00:00
E031	preflop_cuda	4503fb970048cb8ab88f947c88bcdfe1676881b4	discard	preflop.6.iteration_ms	17.265	Compute terminal masses and fixed-order probability once per CUDA block rather than once per hand thread	2026-09-07T05:41:07+00:00
E031	preflop_cuda	4503fb970048cb8ab88f947c88bcdfe1676881b4	discard	preflop.6.check_ms	13.068	Compute terminal masses and fixed-order probability once per CUDA block rather than once per hand thread	2026-09-07T05:41:07+00:00
E031	preflop_cuda	4503fb970048cb8ab88f947c88bcdfe1676881b4	discard	preflop.6.sync_ms	25.388	Compute terminal masses and fixed-order probability once per CUDA block rather than once per hand thread	2026-09-07T05:41:07+00:00
E031	preflop_cuda	4503fb970048cb8ab88f947c88bcdfe1676881b4	discard	preflop.8.iteration_ms	59.284	Compute terminal masses and fixed-order probability once per CUDA block rather than once per hand thread	2026-09-07T05:41:07+00:00
E031	preflop_cuda	4503fb970048cb8ab88f947c88bcdfe1676881b4	discard	preflop.8.check_ms	38.459	Compute terminal masses and fixed-order probability once per CUDA block rather than once per hand thread	2026-09-07T05:41:07+00:00
E031	preflop_cuda	4503fb970048cb8ab88f947c88bcdfe1676881b4	discard	preflop.8.sync_ms	71.144	Compute terminal masses and fixed-order probability once per CUDA block rather than once per hand thread	2026-09-07T05:41:07+00:00
E032	memory_transfers	ae8bd56fea5db6bdbca543febd0c41d15839842e	keep	preflop.6.allocated_vram_mb	503.31648	Keep terminal values persistent and reuse action CFV scratch between alternate depths with an exact slot table and linear level construction	2026-09-07T05:43:52+00:00
