experiment	path	commit	status	metric	value	hypothesis	utc
E037	preflop_cuda	ad22abafaf902a0747b8df868b97910bbcb48c5b	discard	preflop.7.iteration_ms	10.607	Use192threads for non-reduction per-node kernels, reducing idle lanes while retaining the exact128-thread reach reduction	2026-09-07T06:09:49+00:00
E037	preflop_cuda	ad22abafaf902a0747b8df868b97910bbcb48c5b	discard	preflop.7.check_ms	7.42	Use192threads for non-reduction per-node kernels, reducing idle lanes while retaining the exact128-thread reach reduction	2026-09-07T06:09:49+00:00
E037	preflop_cuda	ad22abafaf902a0747b8df868b97910bbcb48c5b	discard	preflop.7.sync_ms	15.32	Use192threads for non-reduction per-node kernels, reducing idle lanes while retaining the exact128-thread reach reduction	2026-09-07T06:09:49+00:00
E037	preflop_cuda	ad22abafaf902a0747b8df868b97910bbcb48c5b	discard	preflop.9.iteration_ms	208.149	Use192threads for non-reduction per-node kernels, reducing idle lanes while retaining the exact128-thread reach reduction	2026-09-07T06:09:49+00:00
E037	preflop_cuda	ad22abafaf902a0747b8df868b97910bbcb48c5b	discard	preflop.9.check_ms	139.971	Use192threads for non-reduction per-node kernels, reducing idle lanes while retaining the exact128-thread reach reduction	2026-09-07T06:09:49+00:00
E037	preflop_cuda	ad22abafaf902a0747b8df868b97910bbcb48c5b	discard	preflop.9.sync_ms	285.623	Use192threads for non-reduction per-node kernels, reducing idle lanes while retaining the exact128-thread reach reduction	2026-09-07T06:09:49+00:00
E037	preflop_cuda	ad22abafaf902a0747b8df868b97910bbcb48c5b	discard	preflop.2.iteration_ms	0.089	Use192threads for non-reduction per-node kernels, reducing idle lanes while retaining the exact128-thread reach reduction	2026-09-07T06:09:49+00:00
E037	preflop_cuda	ad22abafaf902a0747b8df868b97910bbcb48c5b	discard	preflop.2.check_ms	0.384	Use192threads for non-reduction per-node kernels, reducing idle lanes while retaining the exact128-thread reach reduction	2026-09-07T06:09:49+00:00
E037	preflop_cuda	ad22abafaf902a0747b8df868b97910bbcb48c5b	discard	preflop.2.sync_ms	0.03	Use192threads for non-reduction per-node kernels, reducing idle lanes while retaining the exact128-thread reach reduction	2026-09-07T06:09:49+00:00
E037	preflop_cuda	ad22abafaf902a0747b8df868b97910bbcb48c5b	discard	preflop.6.iteration_ms	14.189	Use192threads for non-reduction per-node kernels, reducing idle lanes while retaining the exact128-thread reach reduction	2026-09-07T06:09:49+00:00
E037	preflop_cuda	ad22abafaf902a0747b8df868b97910bbcb48c5b	discard	preflop.6.check_ms	11.848	Use192threads for non-reduction per-node kernels, reducing idle lanes while retaining the exact128-thread reach reduction	2026-09-07T06:09:49+00:00
E037	preflop_cuda	ad22abafaf902a0747b8df868b97910bbcb48c5b	discard	preflop.6.sync_ms	27.224	Use192threads for non-reduction per-node kernels, reducing idle lanes while retaining the exact128-thread reach reduction	2026-09-07T06:09:49+00:00
E037	preflop_cuda	ad22abafaf902a0747b8df868b97910bbcb48c5b	discard	preflop.8.iteration_ms	48.491	Use192threads for non-reduction per-node kernels, reducing idle lanes while retaining the exact128-thread reach reduction	2026-09-07T06:09:49+00:00
E037	preflop_cuda	ad22abafaf902a0747b8df868b97910bbcb48c5b	discard	preflop.8.check_ms	34.035	Use192threads for non-reduction per-node kernels, reducing idle lanes while retaining the exact128-thread reach reduction	2026-09-07T06:09:49+00:00
E037	preflop_cuda	ad22abafaf902a0747b8df868b97910bbcb48c5b	discard	preflop.8.sync_ms	71.761	Use192threads for non-reduction per-node kernels, reducing idle lanes while retaining the exact128-thread reach reduction	2026-09-07T06:09:49+00:00
E037B	preflop_cuda	4754c4bb5f27e26e3fa78f4b7883806448169e67	discard	preflop.3.iteration_ms	0.278	Compare128-thread per-node work against192threads while keeping the reduction mapping identical	2026-09-07T06:13:04+00:00
E037B	preflop_cuda	4754c4bb5f27e26e3fa78f4b7883806448169e67	discard	preflop.3.check_ms	0.526	Compare128-thread per-node work against192threads while keeping the reduction mapping identical	2026-09-07T06:13:04+00:00
E037B	preflop_cuda	4754c4bb5f27e26e3fa78f4b7883806448169e67	discard	preflop.3.sync_ms	0.065	Compare128-thread per-node work against192threads while keeping the reduction mapping identical	2026-09-07T06:13:04+00:00
E037B	preflop_cuda	4754c4bb5f27e26e3fa78f4b7883806448169e67	discard	preflop.5.iteration_ms	2.44	Compare128-thread per-node work against192threads while keeping the reduction mapping identical	2026-09-07T06:13:04+00:00
E037B	preflop_cuda	4754c4bb5f27e26e3fa78f4b7883806448169e67	discard	preflop.5.check_ms	2.429	Compare128-thread per-node work against192threads while keeping the reduction mapping identical	2026-09-07T06:13:04+00:00
E037B	preflop_cuda	4754c4bb5f27e26e3fa78f4b7883806448169e67	discard	preflop.5.sync_ms	4.175	Compare128-thread per-node work against192threads while keeping the reduction mapping identical	2026-09-07T06:13:04+00:00
E037B	preflop_cuda	4754c4bb5f27e26e3fa78f4b7883806448169e67	discard	preflop.7.iteration_ms	9.869	Compare128-thread per-node work against192threads while keeping the reduction mapping identical	2026-09-07T06:13:04+00:00
E037B	preflop_cuda	4754c4bb5f27e26e3fa78f4b7883806448169e67	discard	preflop.7.check_ms	7.06	Compare128-thread per-node work against192threads while keeping the reduction mapping identical	2026-09-07T06:13:04+00:00
E037B	preflop_cuda	4754c4bb5f27e26e3fa78f4b7883806448169e67	discard	preflop.7.sync_ms	16.705	Compare128-thread per-node work against192threads while keeping the reduction mapping identical	2026-09-07T06:13:04+00:00
E037B	preflop_cuda	4754c4bb5f27e26e3fa78f4b7883806448169e67	discard	preflop.9.iteration_ms	190.591	Compare128-thread per-node work against192threads while keeping the reduction mapping identical	2026-09-07T06:13:04+00:00
E037B	preflop_cuda	4754c4bb5f27e26e3fa78f4b7883806448169e67	discard	preflop.9.check_ms	120.578	Compare128-thread per-node work against192threads while keeping the reduction mapping identical	2026-09-07T06:13:04+00:00
E037B	preflop_cuda	4754c4bb5f27e26e3fa78f4b7883806448169e67	discard	preflop.9.sync_ms	281.868	Compare128-thread per-node work against192threads while keeping the reduction mapping identical	2026-09-07T06:13:04+00:00
E037B	preflop_cuda	4754c4bb5f27e26e3fa78f4b7883806448169e67	discard	preflop.2.iteration_ms	0.102	Compare128-thread per-node work against192threads while keeping the reduction mapping identical	2026-09-07T06:13:04+00:00
E037B	preflop_cuda	4754c4bb5f27e26e3fa78f4b7883806448169e67	discard	preflop.2.check_ms	0.288	Compare128-thread per-node work against192threads while keeping the reduction mapping identical	2026-09-07T06:13:04+00:00
E037B	preflop_cuda	4754c4bb5f27e26e3fa78f4b7883806448169e67	discard	preflop.2.sync_ms	0.019	Compare128-thread per-node work against192threads while keeping the reduction mapping identical	2026-09-07T06:13:04+00:00
E037B	preflop_cuda	4754c4bb5f27e26e3fa78f4b7883806448169e67	discard	preflop.6.iteration_ms	13.062	Compare128-thread per-node work against192threads while keeping the reduction mapping identical	2026-09-07T06:13:04+00:00
E037B	preflop_cuda	4754c4bb5f27e26e3fa78f4b7883806448169e67	discard	preflop.6.check_ms	9.423	Compare128-thread per-node work against192threads while keeping the reduction mapping identical	2026-09-07T06:13:04+00:00
E037B	preflop_cuda	4754c4bb5f27e26e3fa78f4b7883806448169e67	discard	preflop.6.sync_ms	25.706	Compare128-thread per-node work against192threads while keeping the reduction mapping identical	2026-09-07T06:13:04+00:00
E037B	preflop_cuda	4754c4bb5f27e26e3fa78f4b7883806448169e67	discard	preflop.8.iteration_ms	44.318	Compare128-thread per-node work against192threads while keeping the reduction mapping identical	2026-09-07T06:13:04+00:00
E037B	preflop_cuda	4754c4bb5f27e26e3fa78f4b7883806448169e67	discard	preflop.8.check_ms	29.324	Compare128-thread per-node work against192threads while keeping the reduction mapping identical	2026-09-07T06:13:04+00:00
E037B	preflop_cuda	4754c4bb5f27e26e3fa78f4b7883806448169e67	discard	preflop.8.sync_ms	70.784	Compare128-thread per-node work against192threads while keeping the reduction mapping identical	2026-09-07T06:13:04+00:00
E037C	preflop_cuda	daacddcf31ba0207d964bde29104e5491e3aef2d	discard	preflop.3.iteration_ms	0.328	Test64-thread per-node blocks for further occupancy and redundant-uniform-work savings, with the exact reach sum fixed at128threads	2026-09-07T06:16:02+00:00
E037C	preflop_cuda	daacddcf31ba0207d964bde29104e5491e3aef2d	discard	preflop.3.check_ms	1.06	Test64-thread per-node blocks for further occupancy and redundant-uniform-work savings, with the exact reach sum fixed at128threads	2026-09-07T06:16:02+00:00
E037C	preflop_cuda	daacddcf31ba0207d964bde29104e5491e3aef2d	discard	preflop.3.sync_ms	0.146	Test64-thread per-node blocks for further occupancy and redundant-uniform-work savings, with the exact reach sum fixed at128threads	2026-09-07T06:16:02+00:00
E037C	preflop_cuda	daacddcf31ba0207d964bde29104e5491e3aef2d	discard	preflop.5.iteration_ms	2.574	Test64-thread per-node blocks for further occupancy and redundant-uniform-work savings, with the exact reach sum fixed at128threads	2026-09-07T06:16:02+00:00
E037C	preflop_cuda	daacddcf31ba0207d964bde29104e5491e3aef2d	discard	preflop.5.check_ms	2.264	Test64-thread per-node blocks for further occupancy and redundant-uniform-work savings, with the exact reach sum fixed at128threads	2026-09-07T06:16:02+00:00
E037C	preflop_cuda	daacddcf31ba0207d964bde29104e5491e3aef2d	discard	preflop.5.sync_ms	4.058	Test64-thread per-node blocks for further occupancy and redundant-uniform-work savings, with the exact reach sum fixed at128threads	2026-09-07T06:16:02+00:00
E037C	preflop_cuda	daacddcf31ba0207d964bde29104e5491e3aef2d	discard	preflop.7.iteration_ms	9.856	Test64-thread per-node blocks for further occupancy and redundant-uniform-work savings, with the exact reach sum fixed at128threads	2026-09-07T06:16:02+00:00
E037C	preflop_cuda	daacddcf31ba0207d964bde29104e5491e3aef2d	discard	preflop.7.check_ms	6.775	Test64-thread per-node blocks for further occupancy and redundant-uniform-work savings, with the exact reach sum fixed at128threads	2026-09-07T06:16:02+00:00
E037C	preflop_cuda	daacddcf31ba0207d964bde29104e5491e3aef2d	discard	preflop.7.sync_ms	17.94	Test64-thread per-node blocks for further occupancy and redundant-uniform-work savings, with the exact reach sum fixed at128threads	2026-09-07T06:16:02+00:00
E037C	preflop_cuda	daacddcf31ba0207d964bde29104e5491e3aef2d	discard	preflop.9.iteration_ms	191.917	Test64-thread per-node blocks for further occupancy and redundant-uniform-work savings, with the exact reach sum fixed at128threads	2026-09-07T06:16:02+00:00
E037C	preflop_cuda	daacddcf31ba0207d964bde29104e5491e3aef2d	discard	preflop.9.check_ms	117.151	Test64-thread per-node blocks for further occupancy and redundant-uniform-work savings, with the exact reach sum fixed at128threads	2026-09-07T06:16:02+00:00
E037C	preflop_cuda	daacddcf31ba0207d964bde29104e5491e3aef2d	discard	preflop.9.sync_ms	302.379	Test64-thread per-node blocks for further occupancy and redundant-uniform-work savings, with the exact reach sum fixed at128threads	2026-09-07T06:16:02+00:00
E037C	preflop_cuda	daacddcf31ba0207d964bde29104e5491e3aef2d	discard	preflop.2.iteration_ms	0.161	Test64-thread per-node blocks for further occupancy and redundant-uniform-work savings, with the exact reach sum fixed at128threads	2026-09-07T06:16:02+00:00
E037C	preflop_cuda	daacddcf31ba0207d964bde29104e5491e3aef2d	discard	preflop.2.check_ms	0.375	Test64-thread per-node blocks for further occupancy and redundant-uniform-work savings, with the exact reach sum fixed at128threads	2026-09-07T06:16:02+00:00
E037C	preflop_cuda	daacddcf31ba0207d964bde29104e5491e3aef2d	discard	preflop.2.sync_ms	0.031	Test64-thread per-node blocks for further occupancy and redundant-uniform-work savings, with the exact reach sum fixed at128threads	2026-09-07T06:16:02+00:00
E037C	preflop_cuda	daacddcf31ba0207d964bde29104e5491e3aef2d	discard	preflop.6.iteration_ms	12.94	Test64-thread per-node blocks for further occupancy and redundant-uniform-work savings, with the exact reach sum fixed at128threads	2026-09-07T06:16:02+00:00
E037C	preflop_cuda	daacddcf31ba0207d964bde29104e5491e3aef2d	discard	preflop.6.check_ms	8.795	Test64-thread per-node blocks for further occupancy and redundant-uniform-work savings, with the exact reach sum fixed at128threads	2026-09-07T06:16:02+00:00
E037C	preflop_cuda	daacddcf31ba0207d964bde29104e5491e3aef2d	discard	preflop.6.sync_ms	29.023	Test64-thread per-node blocks for further occupancy and redundant-uniform-work savings, with the exact reach sum fixed at128threads	2026-09-07T06:16:02+00:00
E037C	preflop_cuda	daacddcf31ba0207d964bde29104e5491e3aef2d	discard	preflop.8.iteration_ms	43.123	Test64-thread per-node blocks for further occupancy and redundant-uniform-work savings, with the exact reach sum fixed at128threads	2026-09-07T06:16:02+00:00
E037C	preflop_cuda	daacddcf31ba0207d964bde29104e5491e3aef2d	discard	preflop.8.check_ms	26.183	Test64-thread per-node blocks for further occupancy and redundant-uniform-work savings, with the exact reach sum fixed at128threads	2026-09-07T06:16:02+00:00
E037C	preflop_cuda	daacddcf31ba0207d964bde29104e5491e3aef2d	discard	preflop.8.sync_ms	77.47	Test64-thread per-node blocks for further occupancy and redundant-uniform-work savings, with the exact reach sum fixed at128threads	2026-09-07T06:16:02+00:00
E037D	preflop_cuda	76ca9e7ded44b122049901ac81c23509037fe891	keep	preflop.3.iteration_ms	0.229	Keep256threads for launches below256nodes and use64threads for wide levels, preserving narrow-tree latency and exact reductions	2026-09-07T06:19:30+00:00
E037D	preflop_cuda	76ca9e7ded44b122049901ac81c23509037fe891	keep	preflop.3.check_ms	0.532	Keep256threads for launches below256nodes and use64threads for wide levels, preserving narrow-tree latency and exact reductions	2026-09-07T06:19:30+00:00
E037D	preflop_cuda	76ca9e7ded44b122049901ac81c23509037fe891	keep	preflop.3.sync_ms	0.074	Keep256threads for launches below256nodes and use64threads for wide levels, preserving narrow-tree latency and exact reductions	2026-09-07T06:19:30+00:00
E037D	preflop_cuda	76ca9e7ded44b122049901ac81c23509037fe891	keep	preflop.5.iteration_ms	2.451	Keep256threads for launches below256nodes and use64threads for wide levels, preserving narrow-tree latency and exact reductions	2026-09-07T06:19:30+00:00
E037D	preflop_cuda	76ca9e7ded44b122049901ac81c23509037fe891	keep	preflop.5.check_ms	2.209	Keep256threads for launches below256nodes and use64threads for wide levels, preserving narrow-tree latency and exact reductions	2026-09-07T06:19:30+00:00
E037D	preflop_cuda	76ca9e7ded44b122049901ac81c23509037fe891	keep	preflop.5.sync_ms	5.411	Keep256threads for launches below256nodes and use64threads for wide levels, preserving narrow-tree latency and exact reductions	2026-09-07T06:19:30+00:00
E037D	preflop_cuda	76ca9e7ded44b122049901ac81c23509037fe891	keep	preflop.7.iteration_ms	9.635	Keep256threads for launches below256nodes and use64threads for wide levels, preserving narrow-tree latency and exact reductions	2026-09-07T06:19:30+00:00
E037D	preflop_cuda	76ca9e7ded44b122049901ac81c23509037fe891	keep	preflop.7.check_ms	7.007	Keep256threads for launches below256nodes and use64threads for wide levels, preserving narrow-tree latency and exact reductions	2026-09-07T06:19:30+00:00
E037D	preflop_cuda	76ca9e7ded44b122049901ac81c23509037fe891	keep	preflop.7.sync_ms	14.983	Keep256threads for launches below256nodes and use64threads for wide levels, preserving narrow-tree latency and exact reductions	2026-09-07T06:19:30+00:00
E037D	preflop_cuda	76ca9e7ded44b122049901ac81c23509037fe891	keep	preflop.9.iteration_ms	184.509	Keep256threads for launches below256nodes and use64threads for wide levels, preserving narrow-tree latency and exact reductions	2026-09-07T06:19:30+00:00
E037D	preflop_cuda	76ca9e7ded44b122049901ac81c23509037fe891	keep	preflop.9.check_ms	112.211	Keep256threads for launches below256nodes and use64threads for wide levels, preserving narrow-tree latency and exact reductions	2026-09-07T06:19:30+00:00
E037D	preflop_cuda	76ca9e7ded44b122049901ac81c23509037fe891	keep	preflop.9.sync_ms	300.282	Keep256threads for launches below256nodes and use64threads for wide levels, preserving narrow-tree latency and exact reductions	2026-09-07T06:19:30+00:00
E037D	preflop_cuda	76ca9e7ded44b122049901ac81c23509037fe891	keep	preflop.2.iteration_ms	0.081	Keep256threads for launches below256nodes and use64threads for wide levels, preserving narrow-tree latency and exact reductions	2026-09-07T06:19:30+00:00
E037D	preflop_cuda	76ca9e7ded44b122049901ac81c23509037fe891	keep	preflop.2.check_ms	0.255	Keep256threads for launches below256nodes and use64threads for wide levels, preserving narrow-tree latency and exact reductions	2026-09-07T06:19:30+00:00
E037D	preflop_cuda	76ca9e7ded44b122049901ac81c23509037fe891	keep	preflop.2.sync_ms	0.018	Keep256threads for launches below256nodes and use64threads for wide levels, preserving narrow-tree latency and exact reductions	2026-09-07T06:19:30+00:00
E037D	preflop_cuda	76ca9e7ded44b122049901ac81c23509037fe891	keep	preflop.6.iteration_ms	12.734	Keep256threads for launches below256nodes and use64threads for wide levels, preserving narrow-tree latency and exact reductions	2026-09-07T06:19:30+00:00
E037D	preflop_cuda	76ca9e7ded44b122049901ac81c23509037fe891	keep	preflop.6.check_ms	8.809	Keep256threads for launches below256nodes and use64threads for wide levels, preserving narrow-tree latency and exact reductions	2026-09-07T06:19:30+00:00
E037D	preflop_cuda	76ca9e7ded44b122049901ac81c23509037fe891	keep	preflop.6.sync_ms	27.182	Keep256threads for launches below256nodes and use64threads for wide levels, preserving narrow-tree latency and exact reductions	2026-09-07T06:19:30+00:00
E037D	preflop_cuda	76ca9e7ded44b122049901ac81c23509037fe891	keep	preflop.8.iteration_ms	41.536	Keep256threads for launches below256nodes and use64threads for wide levels, preserving narrow-tree latency and exact reductions	2026-09-07T06:19:30+00:00
E037D	preflop_cuda	76ca9e7ded44b122049901ac81c23509037fe891	keep	preflop.8.check_ms	24.967	Keep256threads for launches below256nodes and use64threads for wide levels, preserving narrow-tree latency and exact reductions	2026-09-07T06:19:30+00:00
E037D	preflop_cuda	76ca9e7ded44b122049901ac81c23509037fe891	keep	preflop.8.sync_ms	65.091	Keep256threads for launches below256nodes and use64threads for wide levels, preserving narrow-tree latency and exact reductions	2026-09-07T06:19:30+00:00
E037DR	preflop_cuda	76ca9e7ded44b122049901ac81c23509037fe891	keep	postflop.memory.rainbow.cold.compressed.allocated_vram_mb	5905.580032	Repeat adaptive launch geometry with exact stopping and GPU/cache gates; collect fresh compressed lifecycle controls for the upload trial	2026-09-07T06:22:38+00:00
E037DR	preflop_cuda	76ca9e7ded44b122049901ac81c23509037fe891	keep	postflop.memory.rainbow.cold.compressed.host_live_mb	2585.260032	Repeat adaptive launch geometry with exact stopping and GPU/cache gates; collect fresh compressed lifecycle controls for the upload trial	2026-09-07T06:22:38+00:00
E037DR	preflop_cuda	76ca9e7ded44b122049901ac81c23509037fe891	keep	postflop.memory.rainbow.cold.compressed.host_private_mb	9082.830848	Repeat adaptive launch geometry with exact stopping and GPU/cache gates; collect fresh compressed lifecycle controls for the upload trial	2026-09-07T06:22:38+00:00
E037DR	preflop_cuda	76ca9e7ded44b122049901ac81c23509037fe891	keep	postflop.memory.rainbow.cold.compressed.init_ms	811.1334	Repeat adaptive launch geometry with exact stopping and GPU/cache gates; collect fresh compressed lifecycle controls for the upload trial	2026-09-07T06:22:38+00:00
E037DR	preflop_cuda	76ca9e7ded44b122049901ac81c23509037fe891	keep	postflop.memory.rainbow.cold.compressed.strategy_sync_ms	171.0208	Repeat adaptive launch geometry with exact stopping and GPU/cache gates; collect fresh compressed lifecycle controls for the upload trial	2026-09-07T06:22:38+00:00
E037DR	preflop_cuda	76ca9e7ded44b122049901ac81c23509037fe891	keep	postflop.memory.rainbow.cold.compressed.sync_ms	334.8445	Repeat adaptive launch geometry with exact stopping and GPU/cache gates; collect fresh compressed lifecycle controls for the upload trial	2026-09-07T06:22:38+00:00
E037DR	preflop_cuda	76ca9e7ded44b122049901ac81c23509037fe891	keep	postflop.memory.rainbow.warm.compressed.allocated_vram_mb	5905.580032	Repeat adaptive launch geometry with exact stopping and GPU/cache gates; collect fresh compressed lifecycle controls for the upload trial	2026-09-07T06:22:38+00:00
E037DR	preflop_cuda	76ca9e7ded44b122049901ac81c23509037fe891	keep	postflop.memory.rainbow.warm.compressed.host_live_mb	2597.093376	Repeat adaptive launch geometry with exact stopping and GPU/cache gates; collect fresh compressed lifecycle controls for the upload trial	2026-09-07T06:22:38+00:00
E037DR	preflop_cuda	76ca9e7ded44b122049901ac81c23509037fe891	keep	postflop.memory.rainbow.warm.compressed.host_private_mb	9088.954368	Repeat adaptive launch geometry with exact stopping and GPU/cache gates; collect fresh compressed lifecycle controls for the upload trial	2026-09-07T06:22:38+00:00
E037DR	preflop_cuda	76ca9e7ded44b122049901ac81c23509037fe891	keep	postflop.memory.rainbow.warm.compressed.init_ms	779.1766	Repeat adaptive launch geometry with exact stopping and GPU/cache gates; collect fresh compressed lifecycle controls for the upload trial	2026-09-07T06:22:38+00:00
